ref,text
This made the king so furious that he sent an army to kill those murderers and burn down their city.,"Wura mɔ gi nu gɛnen mɔ, i kyu mɔ ginyadon, ne o sun mɔ-asogya ne mɛ kpaa mɔɔ gɛnen asa amɔɔbo abono, ne mɛ yii mɔmɔ-ɔsowolɛ mɔ ɔgya."
"Then he said to the servants, “It is time for the wedding banquet, and the invited guests don't deserve to come.","“Nfono mɔ ɔ terɛ mɔ-adega mɔ ako ne ɔ tɔgɛ sa mɔmɔ yɛɛ, ‘Mɛ wɔra gɛdena mɔ agyudɔ mɔ ta. Abono nɛ da gibaa terɛ mɔ, mɔ, mɛ mɛŋ kaaborɛ mɛꞌ nyɛ agyudɔ mɔ gyi ne."
Go out to the street corners and tell everyone you meet to come to the banquet.”,Imɔso fɛꞌ naa loo nten dɔ de fɛꞌ kpaa terɛ asa abono ɔkara fɛ laa nyɛ mɔ yɛɛ mɛꞌ ba de mɛꞌ baa gyi.’
"When the king went in to meet the guests, he found that one of them wasn't wearing the right kind of clothes for the wedding.","“Wura mɔ gi loo obu mɔ dɔ de ɔꞌ faala abono mɛ kya gyi gɛkɛ belɛ mɔ ma‑a kpaa mɔ mɔ, o wu ɔnyen ɔko bo nno. Oŋ suu gɛgbɛ gɛbono ɔnan mɛ kya kyu kpe gɛdena gɛkɛ gigyi mɔ."
"They sent some of their followers and some of Herod's followers to say to him, “Teacher, we know that you are honest. You teach the truth about what God wants people to do. And you treat everyone with the same respect, no matter who they are.","Imɔso mɛ sun mɔmɔ-akasɛbo ako de Wura Hɛrodɛ gɛmara abuubo ako kpe mɔ asɛ. Abono mɛ kpaa too mɔ soso taasɛ mɔ yɛɛ, “Ɔbelɛnsɛ, a wu yɛɛ fo gyɛ gɛsintin wura. Fo kya nyiile asa Wurubuaarɛ ɔkpa gɛsintin ɔkpa so, ne fo mɛŋ selɛ ɔko. Fo berɛ, fo mɛŋ kya kerɛ nyamesɛ sakyɔ abɛɛ mɔ-nyisigyi ɔbono ɔ bo mɔ de foꞌ buu ɔko don ɔko."
"Let me see one of the coins used for paying taxes.” They brought him a silver coin,","Ɔko ɔꞌ lɛɛ aterenbi abono fɛ kya kyu sɔɔ lɛnpoo mɔ gibi ba de nꞌ kerɛ.” Gɛsintin mɔ, mɛ kyu aterenbi mɔ gibi mɔ kyu sa mɔ."
"“The Emperor's,” they answered. Then Jesus told them, “Give the Emperor what belongs to him and give God what belongs to God.”","Mɛ lɛɛ gɛnɔ yɛɛ, “Rom wura belɛ mɔ-lɛɛ.” Ne Yesu gi kisee tɔgɛ sa mɔmɔ yɛɛ, “To. Gɛnen berɛ mɔ, ilaa ibono i gyɛ Rom wura belɛ mɔ-lɛɛ mɔ fɛꞌ kyu sa mɔ, ne ibono, mɔ, i gyɛ Wurubuaarɛ-lɛɛ mɔ, fɛꞌ kyu sa Wurubuaarɛ.”"
His answer surprised them so much that they walked away. Life in the Future World (Mark,"Mɛ nu gɛnɔɔbono Yesu gi lɛɛ gɛnɔ sa mɔmɔ mɔ, i dɛ mɔmɔ-gɛnɔ gikyɔ, ne mɛ san naa kyon taa mɔ yɛgɛ. Saadusii Awura Mɛ Taasɛ Yesu Ilaa"
At last the woman died.,"Laalaalogɛ mɔ, ɔkyii mɔ kee gi wuꞌ.”"
All the Law of Moses and the Books of the Prophets are based on these two commandments. About David's Son (Mark,Wurubuaarɛ ikalan atɔgɛbo ilaa nyiilesɛ mɔ de Mosisi nbara mɔ pɛwu dɔ mɔ gɛnen nbara nnyɔ ndɛ ne n gyɛ nmɔ-gɛmu.” Yesu Gi Kisee Taasɛ Farasii Awura Mɔ Ilaa Iko
The Sadducees did not believe people would rise to life after death. So that same day some of the Sadducees came to Jesus and said:,"Gɛnen gɛkɛ gɛbono mɔ, Saadusii gikpen dɔ awura ako mɛ ba Yesu asɛ. Gɛnen asa adɛ mɛ baa tɔgɛ sa Yesu"
Jesus answered: You are completely wrong! You don't know what the Scriptures teach. And you don't know anything about the power of God.,"Yesu gi lɛɛ gɛnɔ sa mɔmɔ yɛɛ, “Fɛ fuɛ. I kya nyiile yɛɛ fɛ mɛŋ nyi Wurubuaarɛ agyɛbi mɔ, ne fɛ mɛŋ nyi Wurubuaarɛ ɔlon ɔbono ɔ bo mɔ kee."
"When God raises people to life, they won't marry. They will be like the angels in heaven.","Asa abono Wurubuaarɛ laa kyingi de mɛꞌ kyena gɛkyena pobɔrɔ mɔ, gɛdena gɛŋ baa gɛ bo no sa mɔmɔ. Mɔmɔ-gɛkyena gɛ laa wɔra daa fɛɛ Wurubuaarɛ dɔ isɔɔ-lɛɛ mɔ ɔnan.”"
The crowds were surprised to hear what Jesus was teaching. The Most Important Commandment (Mark,"Sakpii ɔbono ɔ bo nfono mɔ gi nu gɛnɔɔbono ɔ lɛɛ gɛsɛ mɔ, i dɛ mɔmɔ-gɛnɔ. Yesu Gi Nyiile Asa Wurubuaarɛ Nbara Nbono Gi Tansi Gi Tiri Mɔ"
"After Jesus had made the Sadducees look foolish, the Pharisees heard about it and got together.","Farasii awura mɔ mɛ nu yɛɛ Saadusii awura mɔ ayaa aŋ fo gɛsɛ Yesu asɛ mɔ, mɔmɔ kee mɛ kpaa ŋminde ba."
"“Teacher, what is the most important commandment in the Law?”","“Ɔbelɛnsɛ, Wurubuaarɛ nbara mɔ dɔ mɔ, nmɔ mɔ ne n tansi gi tiri daa?”"
This is the first and most important commandment.,"Gɛnen nbara ndɛ ne n don nsɛnsɛ mɔ, ne nmɔ ne n tansi gi tiri."
"The second most important commandment is like this one. And it is, “Love others as much as you love yourself.”","Nnyɔsɛ nbono kee gi tiri mɔ gi dɛ fɛɛ nbono nɛ tɔgɛ kyon mɔ. Nmɔ ne n gyɛ yɛɛ, ‘Laarɛ fo-nanbo fɛɛ fo-nyoro.’"
‘The Lord said to my Lord: Sit at my right side until I make your enemies into a footstool for you.’,"‘Wurubuaarɛ laa tɔgɛ sa me-Wura mɔ yɛɛ, “Baa kyena me-gibaa gyisɛ so de me‑rɛ fo aꞌ gyi gɛwura de nꞌ yɛgɛ foꞌ kyise fo-akyobo de fo-ayaa.” ’ ”"
"“What do you think about the Messiah? Whose family will he come from?” They answered, “He will be a son of King David.”","“Ɔbono Wurubuaarɛ laa sun de ɔꞌ baa gyi gɛwura mɔ Wurubuaarɛ adɛ so mɔ, nnɛ ne n gyɛ fɛye-gɛwɔnsa kyu lii mɔ so? Anɛ ɔnaanabi ne ɔ gyɛ?” Mɛ lɛɛ gɛnɔ sa mɔ yɛɛ, “Ɔ gyɛ daa Deefidi ɔnaanabi.”"
"Jesus replied, “How then could the Spirit lead David to call the Messiah his Lord? David said,","Ne Yesu gi kii taasɛ mɔmɔ yɛɛ, “Ne i wonɛ ne Wurubuaarɛ Oduduu mɔ gi yɛgɛ Deefidi gi wolaa terɛ gɛnen ɔnaanabi mɔ yɛɛ, ‘Me-Wura’ mɔ daa? Deefidi gi wolaa tɔgɛ yela yɛɛ,"
"If David called the Messiah his Lord, how can the Messiah be a son of King David?”","Yesu gi kii lɛɛ gɛsɛ yɛɛ, “Deefidi kya terɛ mɔ yɛɛ, ‘Me-Wura’ faa mɔ, nnɛ so ne ɔ laa kii kisee wɔra daa Deefidi ɔnaanabi?”"
"No one was able to give Jesus an answer, and from that day on, no one dared ask him any more questions.","Asa mɔ dɔ ɔko‑rɛ ɔko mɛŋ taalɛ lɛɛ gɛnɔ sa Yesu. San kyu lii gɛnen gɛkɛ gɛbono mɔ, ɔko mɛŋ baa taalɛ da otu taasɛ Yesu ilaa de ɔꞌ daasɛ mɔ kerɛ."
"If you put yourself above others, you will be put down. But if you humble yourself, you will be honored.","Ɔbono ɔ diirɛ mɔ-nyoro mɔ, Wurubuaarɛ laa kpelegɛrɛ mɔ gɛsɛ, ne ɔbono, mɔ, ɔ bara mɔ-nyoro gɛsɛ mɔ, Wurubuaarɛ laa diirɛ mɔ.” Nbara Aŋmarasɛbo De Farasii Awura, Fɛye Laako!"
And now your temple will be deserted.,Fɛꞌ nu yɛɛ Wurubuaarɛ laa lɛɛ ansi taa fɛye-ɔsowolɛ yɛgɛ sa fɛye.
Whoever is the greatest should be the servant of the others.,Ɔbono ɔ tansi ɔ gyɛ nyamesɛ gbaaꞌ fɛye dɔ mɔ gi kaaborɛ ɔꞌ wɔra daa fɛye-dega.
"Jerusalem, Jerusalem! Your people have killed the prophets and have stoned the messengers who were sent to you. I have often wanted to gather your people, as a hen gathers her chicks under her wings. But you wouldn't let me.","“O, Gyɛrusalem asa! Fɛye ne n kpɛ fa‑a mɔɔ Wurubuaarɛ ikalan atɔgɛbo mɔ, ne fɛ kya too abui fa‑a mɔɔ Wurubuaarɛ isɔɔ ibono ɔ kya sun fɛye asɛ mɔ. Nɛ tansi laarɛ fɛɛ nꞌ nyaa fɛye ba me asɛ fɛɛ gɛnɔɔbono kyaasɛ kya nyaa mɔ-biana baa wɔra mɔ-abantɛɛ dɔ mɔ. Gikpadɔ gifonɛɛ ne nɛ laarɛ nꞌ koola fɛye gɛnen ne fɛŋ kya kyule faa."
Jesus said to the crowds and to his disciples:,"Nfono mɔ Yesu gi tɔgɛ sa sakpii mɔ de mɔ-akasɛbo mɔ yɛɛ,"
The Pharisees and the teachers of the Law are experts in the Law of Moses.,“Nbara aŋmarasɛbo mɔ de Farasii awura mɔ ne n bo ɔkpa de mɛꞌ lɛɛ Mosisi nbara mɔ gɛsɛ sa asa.
"So obey everything they teach you, but don't do as they do. After all, they say one thing and do something else.","Imɔso ilaa kamaasɛ ibono mɛ kya tɔgɛ fɛye kyu lii nmɔ so mɔ fɛꞌ nu de fɛꞌ wɔra imɔ. Mɔmɔ-ilaa wɔrasɛ berɛ ne fɛŋ sa fɛꞌ wɔra. I lii fɛɛ ilaa ibono mɛ kya nyiile fɛye mɔ, iŋ gyɛ imɔ ne mɛ kya wɔra."
"Everything they do is just to show off in front of others. They even make a big show of wearing Scripture verses on their foreheads and arms, and they wear big tassels for everyone to see.","“Mɛ kya wɔra ilaa kamaasɛ mɔ, mɛ kya laarɛ daa de asa mɛꞌ wu de mɛꞌ nyɛ yen mɔmɔ. Wurubuaarɛ agyɛbi abono aye Gyuda awura a kya kyu mada aye-asegbelɛ so de abono a kya kyu kyaga aye-abaa dɔ mɔ, mɛ kya yɛgɛ mɔmɔ-lɛɛ berɛ i kya wɔra ibelɛ-belɛ. Aye-itiibilaa ibono a kya kyu kyaga de aye-ngbɛ mɔ, mɛ kya yɛgɛ mɔmɔ-lɛɛ berɛ i kya tansi wɔra gisoro."
They love the best seats at banquets and the front seats in the synagogues.,"Ne fɛɛ mɛ laa gyi gɛkɛ belɛ mɔ, abɛɛ mɛ kya kpe mɔmɔ-akyangbon dɔ mɔ, abelɛnsɛ de anyamesɛ gbaaꞌgbaa ikyenaten ne mɛ kya laarɛ."
"And when they are in the market, they like to have people greet them as their teachers.",Mɛ kya laarɛ de asa mɛꞌ terɛ mɔmɔ yɛɛ ‘Anyiilebo’ de mɛꞌ kyu buubuu faala mɔmɔ sakpii dɔ de ɔkamaasɛ oꞌ wu.
"But none of you should be called a teacher. You have only one teacher, and all of you are like brothers and sisters.",“Fɛye berɛ fɛŋ sa fɛꞌ yɛgɛ asa mɛꞌ terɛ fɛye dɔ ɔko yɛɛ ‘Onyiilebo.’ I lii fɛɛ fɛye pɛwu fɛ gyɛ gikpen kolon dɔ asa ne onyiilebo kolon ne fɛ bo. Me ne n gyɛ fɛye-onyiilebo ɔbono.
Don't call anyone on earth your father. All of you have the same Father in heaven.,"Fɛŋ sa fɛꞌ terɛ ɔko yɛɛ ‘aye-sɛ’ gɛsinkpan so gɛrɛ. I kya nyiile yɛɛ fɛ bo daa ɔsɛ kolon, mɔ ne n gyɛ Wurubuaarɛ ɔbono ɔ bo soso mɔ."
"You Pharisees and teachers of the Law of Moses are in for trouble! You're nothing but show-offs. You lock people out of the kingdom of heaven. You won't go in yourselves, and you keep others from going in.","Fɛye nbara aŋmarasɛbo de fɛye Farasii awura, fɛye laako! Fɛ gyɛ daa o-dun-me, ɔ-fon-me anyamesɛ! Fɛ kya kudi akyii ikulaabo mɔmɔ‑rɛ mɔmɔ-biana gyi, yɛgɛ fɛye, mɔ, ne n kii fa‑a dalaa faa bolo-bolo de asa mɛꞌ nyɛ yen fɛye yɛɛ fɛye ne n nyi gɛdalaa. Owi ɔbono Wurubuaarɛ laa gyi fɛye-nbɛlɛ mɔ, fɛye-gisobiidɛ gi laa nyaakyɔ too.]"
"You Pharisees and teachers of the Law of Moses are in for trouble! You're nothing but show-offs. You travel over land and sea to win one follower. And when you have done so, you make that person twice as fit for hell as you are.","Fɛye nbara aŋmarasɛbo de fɛye Farasii awura, fɛye laako! Fɛ gyɛ daa o-dun-me, ɔ-fon-me anyamesɛ! Fɛ kya naa nkyu so de nsinkpan so gyanꞌ de fɛꞌ taa nyɛ ba‑a nyamesɛ kolon ɔꞌ kyɛɛgɛ baa buu fɛye-lɛɛ Wurubuaarɛ asonbi mɔ. Fɛ nyɛ ɔkolon gɛnen mɔ, fɛ kya yɛgɛ ɔ kya kii bingiri daa isa ɔbono ɔ kaaborɛ oꞌ kpe ɔgya dɔ mɔ-lɛwu gɛmara mɔ kii don fɛye-lɛɛ mɔ!"
"You are in for trouble! You are supposed to lead others, but you are blind. You teach that it doesn't matter if a person swears by the temple. But you say it does matter if someone swears by the gold in the temple.","“Fɛye laako! Fɛ dɛ daa fɛɛ agyaatanbo ne n gyangbara mɛ sa agyaatanbo. Fɛ kya nyiile asa yɛɛ nengyene ɔko gi ka Wurubuaarɛ ɔson obu mɔ ntan mɔ, ɔ laa taalɛ yɛgɛ iꞌ gbangɛ. Sika kɔkɔɔ ɔbono ɔ bo Wurubuaarɛ ɔson obu mɔ dɔ mɔ berɛ ne ɔko gi kyu ka ntan mɔ, fɛye asɛ mɔ, gi gyɛ ntan belɛ."
You also teach that it doesn't matter if a person swears by the altar. But you say it does matter if someone swears by the gift on the altar.,"Fɛ kya nyiile asa kee yɛɛ nengyene ɔko gi ka Wurubuaarɛ asunbi ɔlɛɛten mɔ ntan mɔ, mɔ-ntan mɔ giŋ gyɛ ntan nko. Nengyene o kyu ilaa ibono ɔ laa kyu lɛɛ asunbi mɔ berɛ daa kyu ka ntan mɔ, fɛ kya kyu nmɔ yɛɛ gi gyɛ ntan belɛ."
"And anyone who swears by the temple also swears by God, who lives there.","Nengyene ɔko gi ka Wurubuaarɛ ɔson obu mɔ ntan mɔ, ɔ ka dabɔlɛ de Wurubuaarɛ ɔbono ɔ bo obu mɔ dɔ mɔ kee ne."
To swear by heaven is the same as swearing by God's throne and by the one who sits on that throne.,"Ne fɛɛ ɔko gi ka Wurubuaarɛ dɔ ntan mɔ, ɔ ka Wurubuaarɛ gɛwuragyapaa mɔ ntan de Wurubuaarɛ ɔbono ɔ tɛ gɛwuragyapaa mɔ so mɔ ntan kee ne."
"You Pharisees and teachers are show-offs, and you're in for trouble! You give God a tenth of the spices from your garden, such as mint, dill, and cumin. Yet you neglect the more important matters of the Law, such as justice, mercy, and faithfulness. These are the important things you should have done, though you should not have left the others undone either.","“Fɛye nbara aŋmarasɛbo de fɛye Farasii awura, fɛye laako! Fɛ gyɛ o-dun-me, ɔ-fon-me-ana gikyɔ! Ansi so mɔ, fɛ kya yɛ fɛye-afɛdaa gyisɛ fɛɛ agbɛɛma de malebokyu de benkeni afɛdaa dɔ gikpadɔ gudu-gudu de fɛꞌ kyu gikolon-gikolon kyu kpaa kyɛɛ Wurubuaarɛ fɛɛ gɛnɔɔbono i dɛ sa fɛye mɔ. Ilaa ibono i tiri gikyɔ Wurubuaarɛ nbara mɔ dɔ mɔ berɛ, fɛ kya nyaa imɔ ibono yela nkan. Fɛɛ fɛ laa gyi gɛsintin sa asa abɛɛ fɛꞌ su asa so, abɛɛ fɛꞌ sɔɔ Wurubuaarɛ gyi mɔ, fɛ kya lɛɛ ansi taa imɔ ibono yɛgɛ. Nbara nbono ne i kaaborɛ fɛꞌ tansi gyi nmɔ so. Iŋ gyɛ yɛɛ fɛꞌ taa nbono fɛ ti fɛ kya gyi nmɔ so mɔ yɛgɛ berɛ."
"You blind Pharisee! First clean the inside of a cup, and then the outside will also be clean.","Farasii awura, fɛ gyɛ agyaatanbo gɛsintin! Fɛꞌ foro fɛye-nwɛ tudɔ de imɔ-nyoro so kee iꞌ wɔra ɔdan. Wurubuaarɛ Laa Biidɛ Fɛye Ndɛ Asa Adɛ Giso"
"You Pharisees and teachers are in for trouble! You're nothing but show-offs. You're like tombs that have been whitewashed. On the outside they are beautiful, but inside they are full of bones and filth.","“Fɛye nbara aŋmarasɛbo de fɛye Farasii awura, fɛye laako! Fɛ gyɛ daa o-dun-me, ɔ-fon-me anyamesɛ! Fɛ dɛ fɛɛ nkyan nbono mɛ pɔrɔ nmɔ ne gi bo kanpɛ ansi so, yɛgɛ nmɔ tudɔ mɔ, awuye de anyamesɛ gyɔsɛ ne n bo nno!"
"That's what you are like. Outside you look good, but inside you are evil and only pretend to be good.","Gɛnen ne ansi so mɔ, asa mɛ laa kyu fɛye yɛɛ gɛsintin awura ne fɛ gyɛ, yɛgɛ gikerɛansi de ilaa nyɛnyɛn ne n bɔla fɛye-itɔ dɔ."
"You Pharisees and teachers are nothing but show-offs, and you're in for trouble! You build monuments for the prophets and decorate the tombs of good people.","“Fɛye nbara aŋmarasɛbo de fɛye Farasii awura, fɛye laako! Fɛ gyɛ o-dun-me, ɔ-fon-me anyamesɛ! Fɛ kya kerɛ ansi pɔrɔ Wurubuaarɛ ikalan atɔgɛbo de abono mɛ gyi gɛsintin sa Wurubuaarɛ baa kyon mɔ ako nkyan, ne fɛ kya dɛnkyi mɔmɔ ako-lɛɛ,"
And you claim you would not have taken part with your ancestors in killing the prophets.,"de fɛꞌ kyu gyaabii asa yɛɛ, ‘Fɛɛ aye ne nan kyena aye-naanaana aberɛ dɔ mɔ, nkana a maŋ kyule ibono mɛ mɔɔ Wurubuaarɛ ikalan atɔgɛbo mɔ.’"
But you prove you really are the relatives of the ones who killed the prophets.,"Imɔ mɔ mɔ, ibono fɛ nyɛ kyule yɛɛ fɛye-naanaana ne n mɔɔ Wurubuaarɛ ikalan atɔgɛbo mɔ faa mɔ, fɛye‑rɛ mɔmɔ fɛ gyɛ daa oyuduu kolon."
So keep on doing everything they did.,Imɔso fɛꞌ tɛsɛ logɛ fɛye-naanaana gɛsun gɛbono mɛ yii gɛsɛ mɔ!
I can promise that you people living today will be punished for all these things! Jesus Loves Jerusalem (Luke,N kya tɔgɛ fɛye gɛsintin yɛɛ Wurubuaarɛ laa biidɛ fɛye ndɛ asa adɛ giso kyu lii gɛnen asa abono so.
"You won't see me again until you say, “Blessed is the one who comes in the name of the Lord.”","N kya buu mi‑i sa fɛye yɛɛ fɛ maŋ baa wu me kpaa fo gɛkɛ gɛbono fɛ laa bugi fɛye-nnɔ tɔgɛ yɛɛ, ‘Wurubuaarɛ ɔꞌ kosorɛ ɔnyen baarɛ gimu! Wurubuaarɛ ginyen dɔ ne ɔ naa ɔ kya ba faa!’ ”"
"After Jesus left the temple, his disciples came over and said, “Look at all these buildings!”","Yesu kya lii Wurubuaarɛ ɔson obu mɔ gikpaara mɔ so mɔ, mɔ-akasɛbo mɔ mɛ naa kpaa tu mɔ, ne mɛ kya tɔgɛ mɔ yɛɛ ɔꞌ kerɛ ibu mɔ ɔdan!"
"Jesus replied, “Do you see these buildings? They will certainly be torn down! Not one stone will be left in place.” Warning about Trouble (Mark","Yesu, mɔ, gi tɔgɛ sa mɔmɔ yɛɛ, “Nga fɛ wu ibu idɛ pɛwu? Nꞌ tɔgɛ fɛye gɛsintin, i laa baa fo owi ɔko mɔ, ako mɛ laa baa boori imɔ bun. Ba‑a imɔ-gisodoo kolon gi maŋ san yɛɛ gi maŋ dɛ gɛsɛ.”"
"You will soon hear about wars and threats of wars, but don't be afraid. These things will have to happen first, but that isn't the end.","Fɛ laa nu ikɔ so titiritii de koo-koo. Fɛ kya nu gɛnen mɔ, fɛ mɛŋ sa fɛꞌ yɛgɛ fɛye-gisen giꞌ ŋmaa fɛye. Imɔ idɛ i gyɛ ilaa ibono i laa ba daa. Ne i mɛŋ gyɛ yɛɛ ilaa kamaasɛ i kya yela ɔkara ayaa abono so ne."
"Nations and kingdoms will go to war against each other. People will starve to death, and in some places there will be earthquakes.","I kya nyiile yɛɛ fɛ laa nu gɛsinkpan so asa kpɛi-kpɛi mɛ laa laarɛ ikɔ too abara so. Abɛyin de abɛyin mɛ laa koso yelɛ mɛ kya kɔ de abara. Nten kpɛi-kpɛi so mɔ, akon a laa tɔrɔ, ne gɛsinkpan gɛ laa gyigisi."
It will be a terrible time for women who are expecting babies or nursing young children.,"Awɔrɔfɔɔ a laa nyaakyɔ gikyɔ so mɔ, akyii abono mɛ dɛ itɔ gɛnen nkɛ nbono dɔ abɛɛ mɔmɔ-biana mɛ san mɛ kya nyabo mɔ, mɔmɔ laako!"
"You will be arrested, punished, and even killed. Because of me, you will be hated by people of all nations.","“Gɛnen aberɛ abono mɔ, ibono fɛ gyɛ me-akasɛbo faa so mɔ, asa mɛ laa kyu fɛye wɔra ako abaa dɔ de mɛꞌ wɔra fɛye awɔrɔfɔɔ de mɛꞌ mɔɔ fɛye ako. Me so mɔ, asa kpɛi-kpɛi pɛwu mɛ laa kyo fɛye."
Many false prophets will come and fool a lot of people.,"Asa sakyɔ mɛ laa koso mɛ kya kɛɛ abon yɛɛ Wurubuaarɛ ikalan atɔgɛbo ne mɛ gyɛ, de mɛꞌ penɛ asa sakyɔ kee."
And pray that you won't have to escape in winter or on a Sabbath.,Fɛꞌ dalaa yɛɛ gɛnen ilaa idɛ i mɛŋ sa iꞌ ba gikyɛ abɛɛ gɛkɛ kyoolasɛ.
"If you are living in Judea at that time, run to the mountains.","fɛye abono fɛ bo Gyudiya gɛsinkpan so mɔ, fɛꞌ selɛ kpe abii dɔ."
"If you are out in the field, don't go back for your coat.","Ne fo ɔbono fo bo ndɔɔ dɔ gɛnen owi ɔbono mɔ, gɛŋ baa kii ba gɛwi yɛɛ fo kya ba de foꞌ baa kyu fo-gikuru."
"If God doesn't make the time shorter, no one will be left alive. But because of God's chosen ones, he will make the time shorter.","Abono Wurubuaarɛ gi tɔɔsɛ lɛɛ yɛɛ mɛꞌ nyɛ mɔ-gɛwuragyi dɔ akyenabi mɔ so mɔ, ɔ keda awɔrɔfɔɔ nkɛ nbono kɔɔgɛ. Iŋ gyɛ gɛnen mɔ, nkana pɛi de nkɛ mɔ giꞌ baa logɛ mɔ, iŋ baa san ba‑a isa."
"When the Son of Man appears, things will be just as they were when Noah lived.","Me, anyamesɛ pɛwu mɔmɔ-daa mɔ, gikiiba gɛsinkpan so mɔ i kya fuude mɔ, i laa wɔra daa fɛɛ Nowa aberɛ dɔ-lɛɛ mɔ."
"No one knows the day or hour. The angels in heaven don't know, and the Son himself doesn't know. Only the Father knows.","“Gɛkɛ gɛbono abɛɛ owi ɔbono nan kii ba mɔ berɛ, ɔko mɛŋ nyi. Wurubuaarɛ dɔ isɔɔ gbaa mɛ mɛŋ nyi, ne me, Wurubuaarɛ mɔ-bi mɔ kee, meŋ nyi. Gɛnen mɔ, me-sɛ Wurubuaarɛ mɔ-nkon ne n nyi."
They didn't know anything was happening until the flood came and swept them all away. This is how it will be when the Son of Man appears.,"nkyu mɔ gi baa gyi asa mɔ pɛwu, ibono mɛ mɛŋ dɛsɛ. Gɛnen kee ne me, anyamesɛ pɛwu mɔmɔ-daa mɔ, gikiiba gɛsinkpan so mɔ i laa wɔra ne."
"Two men will be in the same field, but only one will be taken. The other will be left.","Gɛnen gɛkɛ gɛbono mɔ, i laa nyɛ fɛɛ asa anyɔ mɛ yelɛ ndɔɔ dɔ dabɔlɛ. Wurubuaarɛ laa baa puru ɔko de ɔꞌ taa ɔko yɛgɛ."
"Two women will be together grinding grain, but only one will be taken. The other will be left.","Akyii anyɔ mɛ yelɛ dabɔlɛ mɛ kya kɔrɔ fɛɛ awayu mɔ, Wurubuaarɛ laa puru ɔko de ɔꞌ taa ɔnyɔsɛ mɔ yɛgɛ."
So be on your guard! You don't know when your Lord will come.,"Imɔso fɛꞌ dɛsɛ fɛye-nyoro so gyoo me-giba. Fɛ mɛŋ nyi gɛkaabono me, fɛye-wura mɔ, nan kii ba mɔ.”"
Always be ready! You don't know when the Son of Man will come. Faithful and Unfaithful Servants (Luke,"Gɛnen kee ne i kaaborɛ fɛꞌ bii fɛye-nyoro akedabi owi kamaasɛ dɔ ne. I kya nyiile yɛɛ me, anyamesɛ pɛwu mɔmɔ-daa mɔ, nan lii Wurubuaarɛ dɔ kii ba daa owi ɔbono fɛ mɛŋ dɛsɛ mɔ.”"
But suppose one of the servants thinks the master won't return until late.,"“To, ne fɛɛ gɛnen dega ɔbono gyɛ nyamesɛ nyɛnyɛn mɔ, foŋbii mɔ, ɔ laa tɔgɛ sa mɔ-nyoro yɛɛ, ‘Ilaa iko i keda me-wura yela.’"
Servants are fortunate if their master comes and finds them doing their job.,"Nengyene mɔ-wura mɔ gi baa tu mɔ ɔ kya wɔra ibono ɔ yela sa mɔ mɔ, ɔ laa gyi ginsi.”"
You may be sure a servant who is always faithful will be put in charge of everything the master owns.,"Ne Yesu gi tɔgɛ yɛɛ, “Gɛsintin ne nꞌ kya tɔgɛ fɛye faa, mɔ-wura mɔ laa kyu mɔ-ilaa pɛwu wɔra gɛnen dega ɔbono abaa dɔ."
Suppose this evil servant starts beating the other servants and eats and drinks with people who are drunk.,"Fo baa kerɛ mɔ, o yii gɛsɛ ɔ kya daarɛ mɔ-nanboana sɛnsɛ mɔ, ɔ kya gyi ne ɔ kya nun nta ɔ kya boo."
"If that happens, the master will surely come on a day and at a time when the servant least expects him.","Ɔ kya wɔra gɛnen mɔ, mɔ-wura mɔ laa baa tuule mɔ owi ɔbono ɔ mɛŋ dɛsɛ mɔ."
This servant will then be punished and thrown out with the ones who only pretended to serve their master. There they will cry and grit their teeth in pain.,Ɔ laa tansi biidɛ dega ɔbono giso de ɔꞌ kalɛ mɔ bɔla gikerɛansi awura mɔ so. Osulon de anɛbi giwɛ ne n bo nno.”
The ones who were wise took along extra oil for their lamps.,"Asɛɛbo mɔ berɛ mɛ puru mɔmɔ-ifatela mɔ, mɛ bii puru ifatela nfɔ keda too."
"Then in the middle of the night someone shouted, “Here's the groom! Come to meet him!”","“I baa fo gɛnyɛ de nsana mɔ, mɛ nu ɔko gi lɛɛ gɛnɔ yɛɛ, ‘Ɔkyiifɔ mɔ-kuli mɔ kya ba‑o! Fɛꞌ koso de fɛꞌ kpaa gyangara mɔ.’"
"When the women got up and started getting their lamps ready,",Nfono ne abolonbu gudu mɔ mɛ koso diirɛ mɔmɔ-ifatela mɔ.
"the foolish ones said to the others, “Let us have some of your oil! Our lamps are going out.”","Anun abono mɛŋ nyi ɔlaako mɔ, mɛ kolɛ asɛɛbo mɔ yɛɛ, ‘Aye-ifatela i kya wu. Fɛꞌ sa aye nfɔ.’"
"Those who were wise answered, “There's not enough oil for all of us! Go and buy some for yourselves.”","Asɛɛbo mɔ mɛ kine yɛɛ, ‘Kuaa. Ibono a dɛ mɔ i maŋ fo aye‑rɛ fɛye. Fɛꞌ kpe ɔfɛten de fɛꞌ kpaa sɔɔ.’"
"But the groom replied, “I don't even know you!”","Ne ɔkyiifɔ mɔ-kuli mɔ gi lɛɛ gɛnɔ sa mɔmɔ yɛɛ, ‘Gɛsintin ne n boran, meŋ nyi fɛye.’ ”"
"So, my disciples, always be ready! You don't know the day or the time when all this will happen. A Story about Three Servants (Luke","Yesu gi da gikpalɛ mɔ ta mɔ, ɔ tɔgɛ yɛɛ, “Fɛꞌ dɛsɛ fɛye-nyoro so. I lii fɛɛ fɛ mɛŋ nyi gɛkɛ gɛbono abɛɛ owi ɔbono nan kii ba mɔ.” Adega Abono Mɛ Buɛɛdɛ Gyoo Mɔmɔ-Wura Mɔ Gikpalɛ"
Some time later the master of those servants returned. He called them in and asked what they had done with his money.,"“Ɔbelɛnsɛ mɔ gi kɛɛla nfono o kpe mɔ. Ɔ ba mɔ, ɔ terɛ mɔ-adega yɛɛ mɛꞌ baa buu-buu agyan abono ɔkamaasɛ gi nyɛ mɔ sa mɔ."
The kingdom is also like what happened when a man went away and put his three servants in charge of all he owned.,"Yesu gi kii tɔgɛ sa mɔmɔ yɛɛ, “Me-gikiiba mɔ i laa wɔra fɛɛ gikpalɛ gibono nan ba da faa. Imɔ ne n gyɛ yɛɛ ɔbelɛnsɛ ɔko kya laarɛ oꞌ kpe ɔkpa. Imɔso ɔ terɛ mɔ-adega ba mɔ asɛ ne o kyu mɔ-ilaa wɔra mɔmɔ-abaa dɔ."
"“Wonderful!” his master replied. “You are a good and faithful servant. I left you in charge of only a little, but now I will put you in charge of much more. Come and share in my happiness!”","Ɔbelɛnsɛ mɔ gi nu gɛnen mɔ, ɔ tɔgɛ sa mɔ yɛɛ, ‘Fo wɔra ilaa; fɔɔꞌkpon. Fo gyɛ dega dɛnsɛ ne fo kya gyi gɛsintin. Fɛɛ gɛnɔɔbono fo gyi gɛsintin ilaa pii idɛ dɔ faa mɔ, nan kyu ilaa gikyɔ kyu wɔra fo-abaa dɔ. Ba de me‑rɛ fo aꞌ gyi ɔkon dabɔlɛ.’"
"“Wonderful!” his master replied. “You are a good and faithful servant. I left you in charge of only a little, but now I will put you in charge of much more. Come and share in my happiness!”","Ɔbelɛnsɛ mɔ gi tɔgɛ sa ɔbono kee yɛɛ, ‘Fo wɔra ilaa; fɔɔꞌkpon. Fo gyɛ dega dɛnsɛ ne fo kya gyi gɛsintin. Fɛɛ gɛnɔɔbono fo gyi gɛsintin ilaa pii idɛ dɔ faa mɔ, nan kyu ilaa gikyɔ kyu wɔra fo-abaa dɔ. Ba de me‑rɛ fo aꞌ gyi ɔkon dabɔlɛ.’"
I was frightened and went out and hid your money in the ground. Here is every single coin!”,"Imɔso nɛ selɛ fo gifuu, ne nɛ kyu fo-sika kɔkɔɔ mɔ kyu kpaa ŋara ɔbɔ dɔ. Kerɛ, fo-sika kɔkɔɔ mɔ ne.’"
"The master of the servant told him, “You are lazy and good-for-nothing! You know I harvest what I don't plant and gather crops where I haven't scattered seed.","Dega mɔ gi tɔgɛ gɛnen mɔ, ɔbelɛnsɛ mɔ gi tɔgɛ sa mɔ yɛɛ, ‘Fo gyɛ dega nyɛnyɛn, ne fo bo wolɛgyɔ. Fo nyi yɛɛ me-ilaa i bo lon. N gyɛ onsipara wura. N kya laarɛ agyan lii gɛsun gɛbono iŋ gyɛ me ne n wɔra mɔ dɔ."
