ref,text
"Jesus replied, “I promise you before a rooster crows tonight, you will say three times that you don't know me.”","Mɔ Pɩɛlɩ anʋan tɔlɩ'n, Zozi nwan: “Mɩɩn kan yɩ́ ananhɔlɛ mɩn kele wɔ́ kɛ ɛnɛ kɔngɔɛ muonun, ɔ nʋn dee mɔ akɔ'n 'bɔ kokolokoo'n, ɛ 'kan yɩ́ ngʋkʋn kpɛ̂ nsan kɛ ɛ nzɩ man mɩ́n.”"
"Jesus went with his disciples to a place called Gethsemane. When they got there, he told them, “Sit here while I go over there and pray.”","M'ɔ yɔlɩ sɔ'n, Zozi nʋn yɩ́ menian'n-mɔ hɔlɩ juli lɩka kʋn *Olivʋ bʋka nɩn asʋ. Bɛ fɛlɛ lɩka sɔ'n Gɛtɩsemanne . Mɔ bɛ juli ɛbɛlɛ'n, Zozi nwan: “Ɛmɔ tánlan ɛwa nán mɩn 'tɩ mɩ́n nwʋn kaan mɩn yɔ asɔnɩn.”"
"and he said to them, “I am so sad that I feel as if I am dying. Stay here and keep awake with me.”","Ɔ kɔ han kɔ hele bɛ́ kɛ: “Ewue nɩn a man mɩ́n lʋa a bɔ mɩ́n nwʋn sʋnman. Ɛmɔ nʋn mɩ́n tánlan ɛwa, nán bɛ sísa!”"
"Peter spoke up, “Even if all the others reject you, I never will!”","Pɩɛlɩ jasʋlɩ a, yɩ́ nwan: “Sɛ bɛ́ kʋalaa bɛ nwanndi wɔ́ a, mɩ́n kʋnmgba cein dɩɛ mɩn nnwanndi man wɔ́ lé.”"
"But Peter said, “Even if I have to die with you, I will never say I don't know you.” All the others said the same thing. Jesus Prays (Mark","Pɩɛlɩ nwan: “Sɛ ɔ di mɔ mɩn nʋn wɔ́ wu bɔbɔ a, mɩn ngan man sɔ lé.” Yɩ́ menian'n-mɔ kʋalaa kɔ han sɔ bie. Zozi 'ba yɔ asɔnɩn Gɛtɩsemanne (Maakɩ"
"Again Jesus went to pray and said, “My Father, if there is no other way, and I must suffer, I will still do what you want.”","Mɔ Zozi hanlɩn sɔ'n, ɔ kɔ yaci bɛ́ ɛbɛlɛ ɔ kɔ hɔ asɔnɩn ɛyɔlɛ biekun. Yɩ́ nwan: “Mɩ́n Sɩ, sɛ m'an nnʋn man ewue kangɔ ɛhɩ anun nán ɔ nyɔ man ye a, anɩn man n nʋ́n nun kɛ ɛ kulo'n.”"
"Jesus walked on a little way. Then he knelt with his face to the ground and prayed, “My Father, if it is possible, don't make me suffer by drinking from this cup. But do what you want, and not what I want.”","Zozi hɔlɩ yɩ́ nyunnun mʋa kaan an, ɔ kɔ butu yɩ́ nyɩn asɩ ɔ kɔ yɔ asɔnɩn. Yɩ́ nwan: “Mɩ́n Sɩ, sɛ ɛ kʋala kɛ ɛ kpala ewue nyinlinlin ɛhɩ gua a, anɩn kpala gua! N'ɛ man mɩn nʋn ewue kangɔ nɩn anun. Nan kʋsʋ like biala anun, yɔ mɔ ɛ kulo'n nan n'ɛ yɔ mɔ mɩn kulo'n.”"
Get up! Let's go. The one who will betray me is already here.” Jesus Is Arrested (Mark,"Ɛmɔ jásʋ bɛ mán yɛ hɔ́. Ɛmɔ nɩ́an, sʋanlan'n mɔ ɔ 'ba yɩ mɩ́n man'n, ɔ'a ju ɛwa.” Zozi ɛhyɩɛ'n (Maakɩ"
"Jesus took along Peter and the two brothers, James and John. He was very sad and troubled,","Mɔ ɔ 'kɔ'n, ɔ nʋn Pɩɛlɩ nʋn Zebede amma nnyuan'n yɛ̂ bɛ hɔlɩ ɔ. Anwʋnmmubue nʋn alʋabɔ kɔ han Zozi."
"He came back and found his disciples sleeping. So he said to Peter, “Can't any of you stay awake with me for just one hour?","M'ɔ yɔlɩ asɔnɩn'n yuelɩ'n, ɔ kɔ sa kɔ a yɩ́ menian nsan'n-mɔ anwʋn ɛbɛlɛ. Ɔ 'ba ju a, anɩn bɛ lɛ dafɩ. Zozi kɔ fɛlɛ Pɩɛlɩ, yɩ́ nwan: “Ɛmɔ a ngʋala man mɩ́n nʋn asɩ tanlan dɔhyʋɩlɩ kʋnmgba cein?"
"Stay awake and pray that you won't be tested. You want to do what is right, but you are weak.”","Nán bɛ dafɩ, bɛ tánlan asɩ bɛ yɔ́ asɔnɩn, nán Abɔnsanmʋn a nzɔ man ɛmɔ a nnɩan man. Ɔ wɔ ɛmɔ ahʋnlɩn nɩn anun kɛ ɛmɔ 'yɔ, nan kʋsʋ anwʋnnaan'n le man anwʋnsɛlɛ.”"
He left them and prayed the same prayer once more.,"Yɩ́ kpɛ̂ nsan nɩn asʋ, Zozi kɔ yaci bɛ́ ɛbɛlɛ ɔ kɔ hɔ asɔnɩn kʋnmgba nɩn ɛyɔlɛ biekun."
"Jesus replied, “My friend, do what you came for.” The men grabbed Jesus and arrested him.","Zozi nwan: “Mɩ́n manngʋn, like mɔ ɛ walɩ yɩ́ ɛyɔlɛ'n, yɔ.” Ɛbɛlɛ ala, menian'n-mɔ kɔ tɩ kɔ gua Zozi sʋ bɛ kɔ hyɩ yɩ́."
"Jesus was still speaking, when Judas the betrayer came up. He was one of the twelve disciples, and a large mob armed with swords and clubs was with him. They had been sent by the chief priests and the nation's leaders.","Zozi anʋan ngɔ tɔ man, yɩ́ menian bulu nʋn nnyuan nɩn anun kʋn'n mɔ bɛ fɛlɛ yɩ́ Zudasɩ'n kɔ fite ɛbɛlɛ. Ɔ 'ba a, menian dɔʋn si yɩ́ sʋ. Bɛ lile dadɩɛ nʋn koloman. Menian sɔ'n-mɔ, Nyanmɩan *tɛɛyɩfʋɛ mgbain'n-mɔ nʋn Zufʋ mgbain'n-mɔ yɛ̂ bɛ sʋanlɩn bɛ́ ɔ."
"Judas walked right up to Jesus and said, “Hello, teacher.” Then Judas kissed him.","Mɔ Zudasɩ juli ɛbɛlɛ nɩn ala, ɔ kɔ kpunnge Zozi. Yɩ́ nwan: “*Labi, anun o.” M'ɔ hanlɩn sɔ'n, ɔ'a tɔ Zozi nun."
One of Jesus' followers pulled out a sword. He struck the servant of the high priest and cut off his ear.,"Bɛ́ mɔ anɩn bɛ nʋn Zozi wɔ ɛbɛlɛ nɩn anun kʋn kɔ hyʋɩn yɩ́ dadɩɛ'n, ɔ kɔ kpɛ Nyanmɩan *tɛɛyɩfʋɛ kpain nɩn akʋa nɩn anzʋ'n."
"But Jesus told him, “Put your sword away. Anyone who lives by fighting will die by fighting.","M'ɔ kpɛlɩ yɩ́ nzʋ'n, Zozi nwan: “Fa wɔ́ dadɩɛ'n wula yɩ́ bʋa nɩn anun. Ɔ sanlɩn kɛ bɛ́ mɔ bɛ fa dadɩɛ bɛ kʋn'n, dadɩɛ yɛ̂ ɔ 'kun bɛ́ ɔ."
"The high priest then tore his robe and said, “This man claims to be God! We don't need any more witnesses! You have heard what he said.","Mɔ Nyanmɩan tɛɛyɩfʋɛ kpain'n tɩlɩ ɛjɔlɛ sɔ'n Zozi anʋan nun'n, ɔ kɔ sɔ taladɩɛ'n mɔ yɩ́ muonun ɔ wula'n ɔ kɔ sosua nun. Yɩ́ nwan: “Sian dɩɛ, yɛ mgbʋnndɛ man adanzɩɛ kʋ́n! Afɩ ɛmɔ kʋalaa a tɩ kɛ ɔ'a han ɛjɔlɛ ɛtɛ ɔ'a tia Nyanmɩan!"
"But Jesus did not answer. So the high priest said, “With the living God looking on, you must tell the truth. Are you the Messiah, the Son of God?”","Zozi ngɔ tɛ man yɩ́ sʋ. Nyanmɩan tɛɛyɩfʋɛ kpain'n kɔ han kɔ hele yɩ́ kɛ: “Mɩn kan Tɩasɩfʋɛ Nyanmɩan nɩn ati, sɛ Kilisi'n m'ɔ tɩ Nyanmɩan Awa'n y'ɔ le wɔ́ a, anɩn kan maan yɛ tɩ́!”"
"When Peter had gone out to the gate, another servant girl saw him and said to some people there, “This man was with Jesus from Nazareth.”","Ɛhɩ, ɔ fi ɛbɛlɛ ɔ kɔ jasʋ ɔ kɔ hɔ kɔ jinlan awulo nɩn anʋan nɩn anun ɛlɔ. Afanɩan kʋn biekun kɔ nwun yɩ́. Ɔ kɔ han kɔ hele bɛ́ mɔ bɛ gua ɛbɛlɛ'n kɛ: “Zozi m'ɔ fi Nazalɛtɩ'n, anɩn bian ɛhɩ si yɩ́ sʋ bie.”"
"After Jesus had been arrested, he was led off to the house of Caiaphas the high priest. The nation's leaders and the teachers of the Law of Moses were meeting there.","Bɛ́ mɔ bɛ hyɩlɩ Zozi'n, bɛ nʋn yɩ́ hɔlɩ Nyanmɩan *tɛɛyɩfʋɛ kpain'n mɔ bɛ fɛlɛ yɩ́ *Kayifʋ nɩn awulo. Ɛbɛlɛ yɛ̂ *mala nɩn asʋ mgbain'n-mɔ nʋn Zufʋ mgbain'n-mɔ hɔlɩ yialɩ ɔ."
But Peter followed along at a distance and came to the courtyard of the high priest's palace. He went in and sat down with the guards to see what was going to happen.,"Mɔ bɛ 'kɔ'n, anɩn Pɩɛlɩ lɛ di Zozi fannvanndʋ dede bɛ juli Nyanmɩan tɛɛyɩfʋɛ kpain nɩn awulo. Pɩɛlɩ kɔ wʋlʋ awulo nɩn anun, ɔ kɔ tanlan nzalafʋ'n-mɔ anwʋn ɛbɛlɛ, ɔ 'nɩan kɛ ɛjɔlɛ sɔ'n 'ba kpɩn gua yɩ́ bʋ'n."
The chief priests and the whole council wanted to put Jesus to death. So they tried to find some people who would tell lies about him in court.,Nyanmɩan tɛɛyɩfʋɛ mgbain'n-mɔ nʋn menian'n-mɔ kʋalaa mɔ bɛ di ɛjɔlɛ'n kɔ kpʋnndɛ atɩn mɔ bɛ 'sɩn sʋ bɛ tʋn Zozi ɛsʋan bɛ kun yɩ́.
"But they could not find any, even though many did come and tell lies. At last, two men came forward","Bɛ kpʋnndɛlɩ, kʋsʋ bɛ ngɔ nyan man bie sunnzun mɔ adanzɩyua dɔʋn tʋnlɩn yɩ́ ɛsʋan ɔ. Yɩ́ bɛ-yue-asɩɛ, menian nnyuan walɩ a, bɛ́ nwan:"
"and said, “This man claimed he could tear down God's temple and build it again in three days.”",“Bian ɛhɩ a han kɛ: ‘Mɩn kʋala kɛ mɩn bu Nyanmɩan sua'n mɩn fa cɩan nsan mɩn si.’”
"“That is what you say!” Jesus answered. “But I tell all of you, ‘Soon you will see the Son of Man sitting at the right side of God All-Powerful and coming on the clouds of heaven.’ ”","Zozi kɔ bua yɩ́ kɛ: “Yɛ̂ wɔ́ nʋan wɔ sʋ ɛ lɛ kan nɩn ɔ. Nan mɩɩn kan mɩn kele ɛmɔ kɛ ɛnɛ m'ɔ kɔ'n, ɛmɔ 'ba nwun yɩ́ kɛ *Mân Baa'n tɩ Nyanmɩan tunminfʋɛ'n fama sʋ. Ɛsɛ ɛmɔ 'ba nwun yɩ́ kɛ ɔ fi anwunno ɛlɔ bɔlɛ́ nɩn anun ɔ lɛ ba.”"
Then they spit in his face and hit him with their fists. Others slapped him,"Ɛhɩ, bɛ kɔ tʋtʋ Zozi anyunnun ngɛsɛlɛ, ɛsɛ bɛ kɔ tʋtʋ yɩ́ kɔtɔlɛ. Mmie-mɔ fɩa yɩ́ nyɩn bɛ kpaci yɩ́ nyɩn nɩn asʋ,"
"and said, “You think you are the Messiah! So tell us who hit you!” Peter Says He Doesn't Know Jesus (Mark","anɩn bɛ́ nwan: “Wɔ́ mɔ ɛ tɩ Kilisi'n, kele yɛ́ sʋanlan'n mɔ ɔ'a kpaci wɔ́ nyɩn nɩn asʋ'n!” Pɩɛlɩ 'ba se kɛ ɔ nzɩ man Zozi (Maakɩ"
"Again Peter denied it, and this time he swore, “I don't even know that man!”","Ɛhɩ, Pɩɛlɩ nwan: “Mɩn kan ndâ kɛ mɩ́n dɩɛ, mɩn nzɩ man sʋanlan sɔ'n!”"
"While Peter was sitting out in the courtyard, a servant girl came up to him and said, “You were with Jesus from Galilee.”","Ɔ 'ba yɔ sɔ'n, anɩn Pɩɛlɩ tɩ awulo nɩn abʋ ɛlɔ. Nyanmɩan *tɛɛyɩfʋɛ kpain nɩn afanɩan kʋn kɔ a Pɩɛlɩ anwʋn ɛbɛlɛ, yɩ́ nwan: “Wɔ́ kʋsʋ wɔ́, anɩn ɛ si Zozi m'ɔ fi Galile mân nɩn anun nɩn asʋ bie.”"
"But in front of everyone Peter said, “That isn't so! I don't know what you are talking about!”","M'ɔ hanlɩn sɔ'n, Pɩɛlɩ suli akpʋlʋwa bɛ́ kʋalaa bɛ́ nyunnun ɛbɛlɛ. Yɩ́ nwan: “Sʋanlan'n mɔ ɛ lɛ kan yɩ́ ɛjɔlɛ'n, mɩn nzɩ man yɩ́.”"
"A little while later some people standing there walked over to Peter and said, “We know you are one of them. We can tell it because you talk like someone from Galilee.”","Ɔ hyɛlɩ kaan an, bɛ́ mɔ bɛ gua ɛbɛlɛ'n kɔ kpunnge Pɩɛlɩ, bɛ́ nwan: “Ɔ tɩ ananhɔlɛ, ɛ wɔ menian sɔ'n-mɔ anun bie. Ɔ sanlɩn kɛ wɔ́ ɛjʋjɔlɛ'n kele lɩka mɔ ɛ fi'n.”"
"and Peter remembered that Jesus had said, “Before a rooster crows, you will say three times you don't know me.” Then Peter went out and cried bitterly.","Pɩɛlɩ ati kɔ kacɩ ɛjɔlɛ'n mɔ Zozi hanlɩn helelɩ yɩ́'n. Zozi nwan: “Ɔ nʋn dede mɔ akɔ'n 'bɔ'n, ɛ 'kan yɩ́ ngʋkʋn kpɛ̂ nsan kɛ ɛ nzɩ man mɩ́n.” M'ɔ yɔlɩ sɔ'n, Pɩɛlɩ fitelɩ ɔ sunlin sɛlɛ kpa."
Pilate knew the leaders had brought Jesus to him because they were jealous.,"Ɔ kɔ bisa bɛ́ sɔ, afɩ ɔ sɩ yɩ́ fɔ́ʋ́n kɛ bɛ kpɔ Zozi, yɩ́ ti yɛ̂ b'a hyɩ yɩ́ b'a man yɩ́ ɔ."
"and said, “I have sinned by betraying a man who has never done anything wrong.” “So what? That's your problem,” they replied.","Yɩ́ nwan: “M'an yɔ ɛtɛ, ɔ sanlɩn kɛ m'an tʋn sʋanlan ɛsʋan maan b'a hun yɩ́.” Mɔ Zudasɩ hanlɩn sɔ'n, bɛ́ nwan: “Ɔ nvalɩ man yɛ́ nwʋn. Wɔ́ ngʋnmɩn wɔ́ ɛjɔlɛ ɔ!”"
Then they had a meeting and decided to buy a field that belonged to someone who made clay pots. They wanted to use it as a graveyard for foreigners.,"Bɛ hanlɩn sɔ mɔ bɛ́ kʋalaa bɛ́ nʋan sɛlɩ yɩ́ nwʋn'n, bɛ falɩ esika sɔ'n bɛ tolɩ sʋanlan'n m'ɔ nwʋn ninnge nɩn ebo'n. Bɛ falɩ asɩɛ sɔ'n bɛ yɔlɩ nyɔfʋɛ asielɩɛ."
This is why people still call that place “Field of Blood.”,"Ɛhɩ ati, ɛnɛ nʋn ɛnɛ, bɛ tɛ fɛlɛ lɩka sɔ'n “Moja Ebo”."
"So the words of the prophet Jeremiah came true, “They took the thirty silver coins, the price of a person among the people of Israel.","Ɔ man ɛjɔlɛ'n mɔ Nyanmɩan falɩ wulalɩ kpɔmanfʋɛ Zolomin anʋan'n kpɩnlɩn sʋ. Kpɔmanfʋɛ Zolomin nwan: Jɛtɛ fufue mma abulasan, esika mɔ Izalayɛ amma'n-mɔ anʋan sɛlɩ yɩ́ nwʋn bɛ falɩ bɛ lili yɩ́ gua nɩn anɩn."
"They paid it for a potter's field, as the Lord had commanded me.” Pilate Questions Jesus (Mark",Esika sɔ'n b'a fa b'a to sʋanlan'n m'ɔ nwʋn ninnge nɩn ebo'n kɛ yɛ́ Mɩn hanlɩn helelɩ mɩ́n'n. Pilatɩ 'ba bisa Zozi kosuan (Maakɩ
"Jesus was brought before Pilate the governor, who asked him, “Are you the king of the Jews?” “Those are your words!” Jesus answered.",Bɛ falɩ Zozi bɛ hɔlɩ kʋnmanna nɩn aja sʋ. Ɔ kɔ bisa Zozi kɛ: “Zufʋ'n-mɔ belemgbin'n y'ɔ le wɔ́ ɔ?” Zozi nwan: “Yɛ̂ wɔ́ nʋan wɔ sʋ ɛ lɛ kan nɩn ɔ.”
"And when the chief priests and leaders brought their charges against him, he did not say a thing.","Nan mɔ Nyanmɩan *tɛɛyɩfʋɛ mgbain'n-mɔ nʋn Zufʋ mgbain'n-mɔ 'tʋn Zozi ɛsʋan'n, Zozi ngɔ tɛ man bɛ́ sʋ."
"But Jesus did not say anything, and the governor was greatly amazed. The Death Sentence (Mark",Zozi ngɔ bua ɛjɔlɛ kpɔlɛ kʋn sʋa. M'ɔ man ɛjɔlɛ'n sinlin kʋnmanna nɩn anwʋn kpili nɩn anɩn. Pilatɩ 'ba man bɛ kun Zozi (Maakɩ
People who passed by said terrible things about Jesus. They shook their heads and,"Bɛ́ mɔ bɛ 'sɩn ɛbɛlɛ'n, bɛ kɔsɔ kɔsɔ bɛ́ ti, anɩn bɛ lɛ kpɛ yɩ́ nzʋba."
"Pilate saw that there was nothing he could do and that the people were starting to riot. So he took some water and washed his hands in front of them and said, “I won't have anything to do with killing this man. You are the ones doing it!”","Anɩn menian'n-mɔ lɛ tɛtɩan sʋnman. Pilatɩ nɩan an, ɔ ngʋala man like fɩ́ɩ́ kʋ́n yɔ. Ɔ kɔ jasʋ ɔ kɔ fa nzue ɔ kɔ nwunnzin yɩ́ sa menian'n-mɔ kʋalaa anyunnun ɛbɛlɛ. Yɩ́ nwan: “Sʋanlan ɛhɩ ewue'n, mɩ́n nwʋn nnʋn man nun, m'an yɩ mɩ́n sa nun! Ɛmɔ angʋnmɩn, bɛ́ ɛjɔlɛ ɔ!”"
"Everyone answered, “We and our own families will take the blame for his death!”","Bɛ́ kʋalaa bɛ́ nwan: “Yuo o! Yɛ́ nʋn yɛ́ mma'n-mɔ, man yɩ́ ewue nɩn anwʋn ɛjɔlɛ kpólo yɛ́!”"
"They made a crown out of thorn branches and placed it on his head, and they put a stick in his right hand. The soldiers knelt down and pretended to worship him. They made fun of him and shouted, “Hey, you king of the Jews!”","Bɛ kɔ nwʋn mmowe abotile bɛ kɔ bɔ yɩ́ ti. Bɛ kɔ fa ndɛɛ kpɔman bɛ kɔ wula yɩ́ sa fama nɩn anun. Mɔ bɛ yɔlɩ sɔ yuelɩ'n, bɛ kɔ kʋtʋ yɩ́ nyunnun ɛbɛlɛ bɛ kɔ yɛyala yɩ́ nwʋn. Bɛ́ nwan: “Zufʋ'n-mɔ belemgbin, ahɩn o!”"
"He trusted God, so let God save him, if he wants to. He even said he was God's Son.”","Ɔ'a susu yɩ́ ti ɔ'a gua Nyanmɩan asʋ. Yɩ́ nwan: ‘Nyanmɩan Awa y'ɔ le mɩ́n’. Sɛ Nyanmɩan kulo yɩ́ a, anɩn ɔ lé yɩ́ ti kɩkaala!”"
"When the soldiers had finished making fun of Jesus, they took off the robe. They put his own clothes back on him and led him off to be nailed to a cross.","Bɛ yɛyalalɩ yɩ́ nwʋn dede mɔ bɛ́ kunnun jɔlɩ'n, bɛ kɔ yɩ́ taladɩɛ kɔkɔlɛ'n mɔ bɛ falɩ bɛ wulalɩ yɩ́'n. Bɛ kɔ fa yɩ́ muonun yɩ́ taladɩɛ dɩɛ'n bɛ kɔ wula yɩ́ yɛ̂ bɛ nʋn yɩ́ hɔlɩ bɛ bʋbɔlɩ yɩ́ kʋlʋwa sʋ ɔ. Bɛ 'ba bʋbɔ Zozi kʋlʋwa sʋ (Maakɩ"
"There they gave Jesus some wine mixed with a drug to ease the pain. But when Jesus tasted what it was, he refused to drink it.","Ɛbɛlɛ, bɛ kɔ fa divɩn bɛ kɔ man Zozi kɛ ɔ nʋ́n. Divɩn sɔ'n, bɛ gualɩ nun ayile m'ɔ nʋn an, ɔ nnwun man yalɛ'n sʋnman. Ɔ bɔlɩ sʋ, nan ɔ'a ngulo kɛ ɔ nʋn."
The soldiers nailed Jesus to a cross and gambled to see who would get his clothes.,"Mɔ bɛ bʋbɔlɩ yɩ́ kʋlʋwa nɩn asʋ yuelɩ'n, bɛ kɔ hyʋɩn tondo bɛ kɔ hye yɩ́ taladɩɛ'n-mɔ bɛ kɔ fa."
Then they sat down to guard him.,Ɛsɛ bɛ kɔ tɛtanlan yɩ́ nwʋn ɛbɛlɛ bɛ kɔ sisa yɩ́.
"Above his head they put a sign that told why he was nailed there. It read, “This is Jesus, the King of the Jews.”","Like mɔ yɩ́ ti yɛ̂ bɛ lɛ kun yɩ́'n, b'a hɛlɛ b'a bɔ yɩ́ ti sʋ ɛbɛlɛ kɛ: “Sʋanlan ɛhɩ li Zozi. Ɔ tɩ Zufʋ'n-mɔ belemgbin.”"
"shouted, “So you're the one who claimed you could tear down the temple and build it again in three days! If you are God's Son, save yourself and come down from the cross!”","Bɛ́ nwan: “Wɔ́ mɔ wɔ́ nwan ɛ 'bu asɔnɩn sua'n, nán ɛ fa cɩan nsan ɛ si yɩ́ fʋfɔlɛ'n, de wɔ́ nwʋn e! Sɛ wɔ́ nwan ɛ tɩ Nyanmɩan Awa sakpa a, fi kʋlʋwa nɩn asʋ ju!”"
"Others said, “Wait! Let's see if Elijah will come and save him.”",Nan ɛhɩnlɩn-mɔ nwan: “Jinlan maan yɛ nɩ́an sɛ Eli kɔ a kɔ le yɩ́ a!”
At noon the sky turned dark and stayed that way until three o'clock.,"Mɔ sɛnzɛ'n jinlanlɩn bɛ́ ti afian'n, awosin wulalɩ mân nɩn anun lɩka kʋalaa dede ɔ juli nɔsʋba dɔɛ nsan."
"Then about that time Jesus shouted, “Eli, Eli, lema sabachthani?” which means, “My God, my God, why have you deserted me?”","Mɔ bɛ 'kɔ a bɔ dɔɛ nsan'n, Zozi kɔ tɩan nun sɛlɛ kpa. Yɩ́ nwan: “Eli, Eli, lama sabakɩtanin?” Ɛjɔlɛ sɔ'n, yɩ́ bʋ y'ɔ le kɛ “Mɩ́n Nyanmɩan, mɩ́n Nyanmɩan, nzukɛ ati yɛ̂ a yɩ mɩ́n ɔ?”"
"One of them at once ran and grabbed a sponge. He soaked it in wine, then put it on a stick and held it up to Jesus.","Ɛbɛlɛ ala, bɛ́ nunhan kʋn kɔ nwanndi ɔ kɔ hɔ kɔ fa eminlan ɔ kɔ bɔ divɩn nyinnyanlɩnwa anun. Ɔ kɔ fa kɔ san baka kʋn ati ɔ kɔ tɩnngɛ yɩ́ Zozi anʋan kɛ ɔ nʋ́n."
"At once the curtain in the temple was torn in two from top to bottom. The earth shook, and rocks split apart.","Mɛlɛ sɔ'n, mgbɛnun ɛtanlan'n m'ɔ ja asɔnɩn sua nɩn anun'n kɔ sua yɩ́ anwunno dede ɔ kɔ ju yɩ́ asɩ. Asɩɛ'n kɔ kpusu, nyɔbʋɛ mgbili'n-mɔ anun kɔ kpacɩ kpacɩ."
"Graves opened, and many of God's people were raised to life.",Sɛka'n-mɔ asʋ kɔ tike tike. Nyanmɩan anwʋntɩɛ mma'n-mɔ dɔʋn mɔ bɛ wuli'n kɔ tinnge tinnge.
"They left their graves, and after Jesus had risen to life, they went into the holy city, where they were seen by many people.","Mɔ Zozi fi ewue nun tinngelɩ'n, bɛ́ kʋalaa mɔ bɛ fi sɛka'n-mɔ anun bɛ fitelɩ'n, bɛ hɔlɩ kulo kpili nwannzan-nwannzan nɩn asʋ bɛ yɩlɩ bɛ́ nwʋn bɛ helelɩ menian dɔʋn kpa."
"The officer and the soldiers guarding Jesus felt the earthquake and saw everything else that happened. They were frightened and said, “This man really was God's Son!”","Mɔ nzalafʋ kpain'n nʋn yɩ́ nzalafʋ'n-mɔ mɔ bɛ́ nʋn yɩ́ lɛ sisa Zozi'n nwunlin kɛ asɩɛ nɩn a kpusu nʋn yɩ́ nzin ɛjɔlɛ'n, esulo hanlɩn bɛ́ sɛlɛ kpa. Bɛ́ nwan: “Kannzʋ ɔ tɩ Nyanmɩan Awa sakpa!”"
"Many women had come with Jesus from Galilee to be of help to him, and they were there, looking on at a distance.","Anɩn mmalasua dɔʋn kpa kʋsʋ wɔ ɛbɛlɛ, bɛ jin mʋa bɛ lɛ nɩan Zozi. Bɛ́ yɛ̂ bɛ sili Zozi sʋ sunmin Galile mân nɩn anun bɛ sʋlɩ yɩ́ ɔ."
"went and asked for Jesus' body. Pilate gave orders for it to be given to Joseph,","Ɔ kɔ hɔ kɔ tʋ Pilatɩ ɔ kɔ sɛlɛ yɩ́ kɛ ɔ 'fa Zozi fuin'n ɔ 'kɔ a sie yɩ́. Ɛhɩ, Pilatɩ kɔ man atɩn kɛ bɛ fá bɛ mán yɩ́."
who took the body and wrapped it in a clean linen cloth.,Ɔ kɔ le fuin'n ɔ kɔ fa kisaan fʋfɔlɛ kʋn ɔ kɔ fʋfɔ yɩ́ nwʋn.
Then Joseph put the body in his own tomb that had been cut into solid rock and had never been used. He rolled a big stone against the entrance to the tomb and went away.,"Yɩ́ muonun yɩ́ sɛka mɔ ɔ'a man b'a kpɛ yɩ́ ɛbʋta kʋn anun'n, ɔ kɔ sie Zozi nun. M'ɔ sielɩ yɩ́ yuelɩ'n, ɔ kunndolɩ ɛbʋɛ kpili kʋn ɔ nyinlin sɛka nɩn anʋan'n yɛ̂ ɔ salɩ hɔlɩ ɔ."
All this time Mary Magdalene and the other Mary were sitting across from the tomb.,"Anɩn Mali m'ɔ fi Magɩdala'n, ɔ nʋn Mali kʋn'n bɛ wɔ ɛbɛlɛ. Bɛ tɩtɩ asɩ sɛka nɩn anyunnun. Sɛka nɩn esisa'n"
"On the next day, which was a Sabbath, the chief priests and the Pharisees went together to Pilate.","Zufʋ'n-mɔ bɔbʋalɩ bɛ́ nwʋn bɛ sielɩ. Mɔ yɩ́ alɩ́ɛ hɩnlɩn m'ɔ tɩ ɛnwʋnmɩan ele cɩan'n, Nyanmɩan *tɛɛyɩfʋɛ mgbain'n-mɔ nʋn *Falisifʋɛ'n-mɔ kɔ hɔ kɔ tʋ Pilatɩ. Bɛ́ nwan:"
"They said, “Sir, we remember what this liar said while he was still alive. He claimed in three days he would come back from death.","“Nannan, akʋa atofʋɛ sɔ nɩn ɛjɔlɛ kʋn mɔ anɩn yɩ́ nyɩn wɔ sʋ m'ɔ hanlɩn'n, yɛ́ ti a kpɩn sʋ. Yɩ́ nwan: ‘Sɛ mɩn wu a, yɩ́ cɩan nsan, mɩn 'tinnge.’"
"So please order the tomb to be carefully guarded for three days. If you don't, his disciples may come and steal his body. They will tell the people he has been raised to life, and this last lie will be worse than the first one.”","Yɩ́ ti, man atɩn maan bɛ hɔ́ sísa sɛka'n dede cɩan nsan. Ɔ'a nyɔ man sɔ a, yɩ́ menian'n-mɔ 'kɔ a sa yɩ́ bɛ laka menian'n-mɔ kɛ: ‘Ɔ fi ewue nun ɔ'a tinnge!’ Afɩ, sian ato mɔ bɛ 'di'n, ɔ 'tala daba dɩɛ'n.”"
"Pilate said to them, “All right, take some of your soldiers and guard the tomb as well as you know how.”","Ɛhɩ, Pilatɩ nwan: “Ɛ 'nwun nzalafʋ, Ɛmɔ fá bɛ́ hɔ́, maan bɛ hɔ́ sísa yɩ́ kɛ mɔ ɛmɔ kulo ɔ.”"
"Jesus' eleven disciples went to a mountain in Galilee, where Jesus had told them to meet him.","Ɛhɩ, Zozi menian bulu nʋn kʋn'n hɔlɩ Galile mân nɩn anun ɛlɔ bʋka'n mɔ Zozi helelɩ bɛ́ nɩn asʋ."
So the chief priests met with the leaders and decided to bribe the soldiers with a lot of money.,"Nyanmɩan tɛɛyɩfʋɛ mgbain'n-mɔ nʋn Zufʋ mgbain'n-mɔ kɔ yia. Mɔ bɛ́ nʋan sɛlɩ bɛ́ nwʋn yuelɩ'n, bɛ kɔ man nzalafʋ'n-mɔ esika dɔʋn kpa."
"and teach them to do everything I have told you. I will be with you always, even until the end of the world.","Ninnge'n kʋalaa mɔ m'an han m'an hele ɛmɔ'n, ɛmɔ héhele bɛ́ maan bɛ yɔ́. Ɛsɛ ɛmɔ nwún yɩ́ kɛ mɩn nʋn ɛmɔ san alɩhɩan biala dede ɔ kɔ ju mân nɩn ayuelɩɛ.”"
"Then Jesus said, “Don't be afraid! Tell my followers to go to Galilee. They will see me there.” Report of the Guard","Ɛhɩ, Zozi kɔ se bɛ́ kɛ: “Nán bɛ sulo. Ɛmɔ hɔ́ hán héle mɩ́n nianman'n-mɔ kɛ bɛ hɔ́ Galile mân nɩn anun ɛlɔ. Ɛbɛlɛ yɛ̂ bɛ 'nwun mɩ́n ɔ.” Nzalafʋ'n-mɔ ɛjɔlɛ'n"
"Suddenly a strong earthquake struck, and the Lord's angel came down from heaven. He rolled away the stone and sat on it.","Kʋnmgba ala, asɩɛ'n kɔ kpusu sɛlɛ kpa. Yɛ́ Mɩn bɔfʋɛ'n kʋn fi anwunno ɔ kɔ ju. Ɔ kɔ kunndo ɛbʋɛ'n m'ɔ nyin sɛka nɩn anʋan'n ɔ kɔ tʋ yɩ́ ahanmɩan ɔ kɔ fʋ ɔ kɔ tanlan sʋ."
"The angel looked as bright as lightning, and his clothes were white as snow.",Bɔfʋɛ nɩn anwʋn'n ta sʋa mɩaɩn mɩaɩn kɛ nyanmɩan'n m'ɔ kpɛ mɩaɩn mɩaɩn'n. Yɩ́ taladɩɛ'n tɩ fufue hyɩɛɩn hyɩɛɩn kpa.
"The guards shook from fear and fell down, as though they were dead.","Esulo kɔ han nzalafʋ'n-mɔ kpa dede bɛ́ nwʋn kɔ wʋsʋ bɛ́, bɛ gugua kɛ menian mɔ b'a wu ɔ."
"The angel said to the women, “Don't be afraid! I know you are looking for Jesus, who was nailed to a cross.","Bɔfʋɛ'n kɔ han kɔ hele mmalasua'n-mɔ kɛ: “Nán bɛ sulo. Afɩ mɩn sɩ kɛ ɛmɔ lɛ kpʋnndɛ Zozi, sʋanlan'n mɔ bɛ bʋbɔlɩ yɩ́ kʋlʋwa nɩn asʋ'n."
"Now hurry! Tell his disciples he has been raised to life and is on his way to Galilee. Go there, and you will see him. This is what I came to tell you.”","Ɛmɔ hɔ́ ndɛ-ndɛ bɛ hán héle yɩ́ menian'n-mɔ kɛ ɔ fi ewue nun ɔ'a tinnge. Sian dɩɛ, ɔ lɛ kɔ a nwʋnndɛ ɛmɔ Galile mân nɩn anun. Ɛlɔ yɛ̂ ɛmɔ 'nwun yɩ́ ɔ. Ngalɩɛ'n mɔ mɩ́n nwan mɩn 'kan mɩn kele ɛmɔ nɩn anɩn.”"
"While the women were on their way, some soldiers who had been guarding the tomb went into the city. They told the chief priests everything that had happened.","Mɔ anɩn mmalasua'n-mɔ aja wɔ atunnun'n, nzalafʋ'n-mɔ mɔ bɛ lɛ sisa sɛka'n, mmie-mɔ kɔ sa kɔ hɔ kulo. Bɛ kɔ hɔ kɔ bɔ ɛjɔlɛ'n m'ɔ walɩ nɩn anun amannɩɛ bɛ kɔ hele Nyanmɩan *tɛɛyɩfʋɛ mgbain'n-mɔ."
"They said to the soldiers, “Tell everyone that Jesus' disciples came during the night and stole his body while you were asleep.","Ɛsɛ bɛ́ nwan: “Sɛ bɛ bisa ɛmɔ a, ɛmɔ hán kɛ kɔngɔɛ mɔ ɛmɔ 'dafɩ'n, yɩ́ menian'n-mɔ a a a sa yɩ́ a hɔ."
The soldiers took the money and did what they were told. The people of Judea still tell each other this story. What Jesus' Followers Must Do (Mark,"Nzalafʋ'n-mɔ lelɩ esika'n, bɛ hanlɩn yɩ́ kɛ Nyanmɩan tɛɛyɩfʋɛ mgbain'n-mɔ hanlɩn helelɩ bɛ́ nɩn ala. Ɛnɛ nʋn ɛnɛ, Zufʋ'n-mɔ tɛ kan ɛjɔlɛ sɔ'n. Zozi 'ba yɩ yɩ́ nwʋn kele yɩ́ menian'n-mɔ (Maakɩ"
Jesus came to them and said: I have been given all authority in heaven and on earth!,"Zozi kɔ kpunnge bɛ́, ɔ kɔ han kɔ hele bɛ kɛ: “B'a fa anwunno ɛlɔ nʋn asɩ ɛwa tunmin'n kʋalaa b'a wula mɩ́n sa nun."
"Go to the people of all nations and make them my disciples. Baptize them in the name of the Father, the Son, and the Holy Spirit,","Ɛhɩka ati, ɛmɔ hɔ́ mân nɩn anun menian'n-mɔ kʋalaa anwʋn, ɛmɔ mán bɛ káci mɩ́n menian. Ɛmɔ sɔ́nɩn bɛ́ wɔ Sɩɛ nʋn Baa, ɔ nʋn Wawɛ Nwannzan-nwannzan'n dunman nun."
"They saw him and worshiped him, but some of them doubted.","Mɔ bɛ nwunlin yɩ́'n, bɛ kʋtʋlɩ bɛ sʋlɩ yɩ́. Nan kʋsʋ bɛ́ mmie-mɔ a nne a nni man."
Right then the two brothers dropped their nets and went with him.,"Kɛ Zozi anʋan 'tɔ ala, bɛ kɔ yaci bɛ́ dada'n-mɔ ɛbɛlɛ, bɛ kɔ si yɩ́ sʋ."
"Jesus walked on and soon saw James and John, the sons of Zebedee. They were in a boat, mending their nets.","Zozi fi ɛbɛlɛ, ɔ kɔ hɔ yɩ́ nyunnun kaan, ɔ kɔ nwun Zebede amma'n-mɔ: Zʋakɩ nʋn yɩ́ nianman Zʋan. Bɛ gua bɛ́ ɛlɛɛ nɩn anun, bɛ lɛ kpʋnmgba bɛ́ dada'n-mɔ anun."
