ref,text
"So God's promise came true, just as Isaiah the prophet had said,",Ɔ man Nyanmɩan kpɔmanfʋɛ *Ezayi ɛjɔlɛ'n m'ɔ hanlɩn'n kpɩnlɩn sʋ. Ɔ hanlɩn kɛ Nyanmɩan nwan:
"“Here is my chosen servant! I love him, and he pleases me. I will give him my Spirit, and he will bring justice to the nations.","Nɩan, mɩ́n akʋa'n mɔ m'an yɩ yɩ́'n, mɩn kulo yɩ́ m'an fa mɩ́n lʋa'n kʋalaa m'an wula yɩ́ nun. Mɩn 'fa mɩ́n Wawɛ'n mɩn wula yɩ́ nun, ɔ 'kan mɩ́n ndɛɛ ebua nɩn anwʋn ɛjɔlɛ ɔ kele mân mân'n-mɔ."
"If you are not on my side, you are against me. If you don't gather in the harvest with me, you scatter it.","“Sʋanlan m'ɔ tɩ man mɩ́n dɩɛ'n, anɩn ɔ kpɔ mɩ́n. Sʋanlan kʋsʋ m'ɔ nʋn mɩn ngohuan man ninnge'n-mɔ anʋan'n, sʋanlan sɔ'n, anɩn ɔ bɔ bɛ́ asanndɩɛ."
"Some people brought to Jesus a man who was blind and could not talk because he had a demon in him. Jesus healed the man, and then he was able to talk and see.","Ɛhɩ, bɛ kɔ fa sʋanlan kʋn bɛ kɔ bɛlɛ Zozi. Sʋanlan sɔ'n, wawɛ ɛtɛ wɔ yɩ́ nun, ɔ'a man yɩ́ nyɩn nɩn a sin ɛsɛ ɔ a tɔ amunle. Zozi kɔ man sʋanlan sɔ'n kɔ jʋjɔ ɛsɛ ɔ kɔ nwun asɩ."
"Jesus knew what they were thinking, so he said to them: Any kingdom where people fight each other will end up ruined. And a town or family that fights will soon destroy itself.","Kɛmɔ anɩn Zozi sɩ ajʋnlɩn'n m'ɔ wɔ bɛ́ ti nɩn anun'n, ɔ kɔ han kɔ hele bɛ́ kɛ: “Belemgbin mân kʋn mɔ nun menian'n-mɔ kpɛ bɛ́ nyɩn bɛ kʋn ɛlɔɛ'n, mân sɔ'n bɔ. Kulo kʋn, anaan afilie kʋn mɔ nun menian'n-mɔ kpɛ bɛ́ nyɩn bɛ kʋn ɛlɔɛ'n, kulo sɔ'n, anaan afilie sɔ nɩn abʋsʋ bɔ."
"If I use the power of Beelzebul to force out demons, whose power do your own followers use to force them out? Your followers are the ones who will judge you.","Sɛ ɛmɔ jʋnlɩn kɛ Belɩzebulu yɛ̂ ɔ man mɩ́n tunmin maan mɩn fa mɩn fʋan wawɛ ɛtɛ'n-mɔ a, anɩn ɛmɔ menian'n-mɔ dɩɛ, nwan yɛ̂ ɔ man bɛ́ tunmin maan bɛ fʋan wawɛ ɛtɛ'n-mɔ ɔ? Ɛmɔ menian'n-mɔ kele kɛ ɛmɔ di fʋɔ."
"When an evil spirit leaves a person, it travels through the desert, looking for a place to rest. But when the demon doesn't find a place,","“Mɛlɛ mɔ wawɛ ɛtɛ kʋn fi sʋanlan kʋn anun kɔ fite'n, ɔ kɔ kpʋnndɛ lɩka wʋwʋsɩɩ'n-mɔ ɔ tanlan de yɩ́ ɛnwʋnmɩan."
"it goes off and finds seven other evil spirits even worse than itself. They all come and make their home there, and the person ends up in worse shape than before. That's how it will be with you evil people of today. Jesus' Mother and Brothers (Mark","ɔ sa yɩ́ nzin ɔ kɔ kpʋnndɛ yɩ́ manngʋn nsʋ mɔ bɛ́ ti anun tɩ ɛtɛ kpa bɛ tala yɩ́ ɔ. Ɔ nʋn bɛ ba a tanlan ɛbɛlɛ. Sian dɩɛ, sʋanlan sɔ'n, ɛsɛcɩɛ m'ɔ kɔ sɛcɩ'n, ɔ tala daba'n. Kɛ ajulisʋ menian ɛtɛfʋɛ ɛhɩ-mɔ asɩtanlan'n 'yɔ yɩ́ nɩn ala anɩn.” Zozi anianman'n-mɔ nʋn yɩ́ nin (Maakɩ"
"A good tree produces good fruit, and a bad tree produces bad fruit. You can tell what a tree is like by the fruit it produces.","“Baka kpa nɩn asʋ yɛ̂ bɛ tɩ mma kpa nɩn ɔ. Baka ɛtɛ nɩn asʋ kʋsʋ yɛ̂ bɛ tɩ mma ɛtɛ nɩn ɔ. Ɔ sanlɩn kɛ baka kʋn m'ɔ jin'n, sɛ ɔ tɩ kpa o, sɛ ɔ tɩ ɛtɛ o, yɩ́ mma m'ɔ kɔ su'n yɛ̂ bɛ fa bɛ nwun yɩ́ ɔ."
"You are a bunch of evil snakes, so how can you say anything good? Your words show what is in your hearts.","Ati anun ɛtɛ mma kɛ owo, ɔ 'yɔ sɛ nán ɛmɔ a han ɛjɔlɛ kpa? Afɩ ɛjɔlɛ m'ɔ wɔ ahʋnlɩn nɩn anun'n, y'ɔ fite bɛ́ nʋan ɔ."
"I promise you on the day of judgment, everyone will have to account for every careless word they have spoken.","Mɩɩn kan mɩn kele ɛmɔ kɛ: Ndɛɛ ebua cɩan nɩn anun, mgban-mgban ɛjɔlɛ'n mɔ menian'n-mɔ hanlɩn'n, bɛ 'nwun yɩ́ nwʋn ɛjɔlɛ."
On that day they will be told they are either innocent or guilty because of the things they have said. A Sign from Heaven (Mark,"Afɩ ɛjɔlɛ m'ɔ fi wɔ́ nʋan kɔ fite'n, yɩ́ nwʋn yɛ̂ bɛ 'nɩan bɛ bua wɔ́ ndɛɛ ɔ.” Menian'n-mɔ 'ba bisa Zozi asinbɛnwʋn like kʋn (Maakɩ"
"Some Pharisees and teachers of the Law of Moses said, “Teacher, we want you to show us a sign from heaven.”","Mɔ Zozi hanlɩn sɔ yuelɩ'n, *mala nɩn asʋ mgbain'n mmie-mɔ nʋn *Falisifʋɛ'n mmie-mɔ kɔ han kɔ hele Zozi kɛ: “Kpain, yɛ kulo kɛ ɛ yɔ asinbɛnwʋn like kʋn maan yɛ nɩan.”"
But Jesus replied: You want a sign because you are evil and won't believe! But the only sign you will get is the sign of the prophet Jonah.,"Ɛhɩ a, Zozi nwan: “Ajulisʋ menian ɛtɛfʋɛ ɛhɩ-mɔ mɔ bɛ nzʋ man Nyanmɩan ananhɔlɛ nun'n lɛ kpʋnndɛ asinbɛnwʋn like bɛ nɩan. Bɛ nyɔ man asinbɛnwʋn like fɩ́ɩ́ kʋ́n bɛ ngele man bɛ́ kɛ Nyanmɩan kpɔmanfʋɛ Zonasɩ dɩɛ nɩn ala."
"He was in the stomach of a big fish for three days and nights, just as the Son of Man will be deep in the earth for three days and nights.","Afɩ kɛmɔ Zonasɩ lili cɩan nsan ejue kpili nɩn akunnun'n, yɩ́ sɔ kʋsʋ ala, *Mân Baa'n 'ba li cɩan nsan asɩɛ nɩn abʋ."
"On the day of judgment the people of Nineveh will stand there with you and condemn you. They turned to God when Jonah preached, and yet here is something far greater than Jonah.","Ndɛɛ ebua cɩan nɩn anun, Ninninvʋ amma'n-mɔ 'bu ajulisʋ menian'n-mɔ fʋɔ. Ɔ sanlɩn kɛ mɔ Ninninvʋ kulo nɩn asʋ amma'n-mɔ tɩlɩ Nyanmɩan Anʋan Ɛjɔlɛ'n mɔ Zonasɩ hanlɩn'n, bɛ nunlin bɛ́ nwʋn bɛ kacili bɛ́ abalabɔ'n. Nan sʋanlan kʋn wɔ ɛwa, ɔ tɩ kpili tala Zonasɩ."
"The Queen of the South will also stand there with you and condemn you. She traveled a long way to hear Solomon's wisdom, and yet here is something much greater than Solomon. Return of an Evil Spirit (Luke","Ndɛɛ ebua cɩan nɩn anun, balasua'n m'ɔ tɩ Saba mân nɩn asʋ belemgbin'n, ɔ 'bu ajulisʋ menian'n-mɔ fʋɔ. Ɔ sanlɩn kɛ yɩ́ m'ɔ fi mʋa'n, ɔ walɩ tielɩ Salomʋn bɛngɛlɛfʋɛ ɛjɔlɛ'n m'ɔ kan'n. Nan kʋsʋ sʋanlan kʋn wɔ ɛwa, ɔ tɩ kpili tala Salomʋn. Wawɛ ɛtɛ nɩn esa ɛwalɛ nun (Luku"
"While Jesus was still speaking to the crowds, his mother and brothers came and stood outside because they wanted to talk with him.","Zozi anʋan a ndɔ man, yɩ́ nianman'n-mɔ nʋn yɩ́ nin bɛ kɔ a. Anɩn bɛ jijin gua nɩn asʋ bɛ 'kpʋnndɛ atɩn bɛ kan ɛjɔlɛ bɛ kele yɩ́."
"Someone told Jesus, “Your mother and brothers are standing outside and want to talk with you.”","Sʋanlan kʋn kɔ han kɔ hele yɩ́ kɛ: “Nɩan, wɔ́ nin nʋn wɔ́ nianman'n-mɔ jijin gua sʋ ɛlɔ bɛ 'kpʋnndɛ kɛ bɛ kan ɛjɔlɛ bɛ kele wɔ́.”"
"Jesus answered, “Who is my mother and who are my brothers?”","Zozi kɔ bua sʋanlan sɔ'n kɛ: “Mɩ́n nin'n y'ɔ le nwan, yɛ̂ mɩn nianman'n-mɔ y'ɔ le nwan-mɔ?”"
"Then he pointed to his disciples and said, “These are my mother and my brothers!","Nan ɔ tɩnngɛlɩ yɩ́ sa yɩ́ menian'n-mɔ anwʋn an, yɩ́ nwan: “Ɛmɔ nɩ́an, mɩ́n nin nʋn mɩ́n nianman'n-mɔ, bɛ́ yɛ̂ bɛ gugua ɛwa nɩn ɔ."
"Such large crowds gathered around him that he had to sit in a boat, while the people stood on the shore.",Meninsʋnman kɔ a yɩ́ nwʋn ɛbɛlɛ. Ɔ kɔ kpati kɔ fʋ kɔ tanlan ɛlɛɛ kʋn anun asue nɩn anyɩnsʋ yɛ̂ meninsʋnman'n jijin asue nɩn anʋan.
Then he taught them many things by using stories. He said: A farmer went out to scatter seed in a field.,"Ɔ kɔ hehele bɛ́ ninnge dɔʋn kpa anyɩnndala nun, yɩ́ nwan: “Sʋanlan kʋn hɔlɩ yɩ́ *bele mma egua."
"Other seeds fell on thin, rocky ground and quickly started growing because the soil wasn't very deep.",Bie kʋsʋ kɔ gua nyɔbʋɛ nɩn asʋ. Ɛbɛlɛ ngɛtɩɛ nɩn a nzʋn man. Ɔ kɔ fifi ndɛ-ndɛ. Ɔ sanlɩn kɛ ɔ'a ngɔ man asɩɛ bʋ.
Some other seeds fell where thornbushes grew up and choked the plants.,Bie kʋsʋ kɔ gua eminlan mmowe nɩn anun. Ɔ kɔ fifi. Eminlan mmowe'n kɔ fʋ kɔ gua sʋ.
"Jesus' disciples came to him and asked, “Why do you use stories to speak to the people?”","Ɛhɩ, Zozi menian'n-mɔ kpunngelɩ yɩ́ a, bɛ́ nwan: “Nzukɛ ati yɛ̂ ɛ 'kan ɛjɔlɛ kele menian'n-mɔ a, ɛ bu yɩ́ anyɩnndala nun ɔ?”"
Everyone who has something will be given more. But people who don't have anything will lose even what little they have.,"Ɔ sanlɩn kɛ sʋanlan m'ɔ le bie'n, bɛ 'gua sʋ maan ɔ sʋn. Nan sʋanlan m'ɔ le man bie'n, kaan'n muonun m'ɔ le yɩ́'n, bɛ 'tʋa yɩ́ bɛ de."
"So God's promise came true, just as the prophet Isaiah had said, “These people will listen and listen, but never understand. They will look and look, but never see.","Ɔ man bɛ́ nwʋn ɛjɔlɛ'n mɔ *Ezayi hanlɩn'n kpɩnlɩn sʋ. Nyanmɩan nanndɩlɩ Ezayi sʋ ɔ hanlɩn kɛ: Ɛmɔ 'ba tie yɩ́ kpa, kʋsʋ ɛmɔ ngɔ tɩ man yɩ́ bʋ. Ɛmɔ 'ba nɩan yɩ́ kpa, kʋsʋ ɛmɔ ngɔ nwun man yɩ́."
Many prophets and good people were eager to see what you see and to hear what you hear. But I tell you they did not see or hear. Jesus Explains the Story about the Farmer (Mark,"Nan mɩɩn kan yɩ́ ananhɔlɛ mɩn kele ɛmɔ kɛ: Nyanmɩan mgbɔmanfʋɛ dɔʋn kpa, nʋn Nyanmɩan menian dɔʋn kpa, bɛ hulolɩ kɛ ahan bɛ nwun mɔ ɛmɔ lɛ nɩan'n, nan kʋsʋ b'a nnwun man yɩ́. Ɛsɛ bɛ hulolɩ kɛ ahan bɛ tɩ mɔ ɛmɔ lɛ tie'n, nan kʋsʋ b'a ndɩ man.” Zozi 'ba tu anyɩnndala nɩn abʋ (Maakɩ"
"The seeds that fell among the thornbushes are also people who hear the message. But they start worrying about the needs of this life and are fooled by the desire to get rich. So the message gets choked out, and they never produce anything.","M'ɔ gualɩ eminlan mmowe nɩn anun'n y'ɔ le sʋanlan ɛhɩ m'ɔ tɩ Anwunno Belemgbin Mân nɩn anwʋn ɛjɔlɛ'n, nan kʋsʋ eyuadɩ nɩn anun ninnge'n-mɔ anwʋn nzusue'n nʋn anyɩnbʋlʋ anyanbɛnwʋn'n cɩcɩ ɛjɔlɛ sɔ'n. Ɔ man ɔ nzu man mma."
Jesus then told them this story: The kingdom of heaven is like what happened when a farmer scattered good seed in a field.,"Ɛhɩ anzin, Zozi kɔ bu anyɩnndala kʋn biekun kɔ hele bɛ́. Yɩ́ nwan: “Ɛ 'nwun like mɔ Anwunno Belemgbin Mân'n soman yɩ́'n: Ɔ soman sʋanlan kʋn mɔ ɔ'a gua *bele yɩ́ ebo nɩn asʋ ɔ."
"But while everyone was sleeping, an enemy came and scattered weed seeds in the field and then left.","Nan kɔngɔɛ mɔ menian'n-mɔ kʋalaa yuelɩ dɩda'n, yɩ́ kpɔfʋɛ kʋn kɔ a kɔ lolua ndile ɛtɛ bele nɩn anun, cuein yɛ̂ ɔ hɔlɩ ɔ."
"When the plants came up and began to mature, the farmer's servants could see the weeds.","Bele'n fifili dede mɔ ɔ 'ju yɩ́ esúe tɛmʋn'n, ndile ɛtɛ'n kɔ fa ebo'n."
"The servants came and asked, “Sir, didn't you scatter good seed in your field? Where did these weeds come from?”","“Sʋanlan'n m'ɔ le ebo nɩn ajunmanfʋ'n-mɔ walɩ tʋlɩ yɩ́, bɛ́ nwan: ‘Yɛ́ Mɩn, bele yɛ̂ ɛ lualɩ ɔ. Nan ndile ɛtɛ'n mɔ ɔ'a fifi nun'n, ɔ fi nin?’"
"“An enemy did this,” he replied. His servants then asked, “Do you want us to go out and pull up the weeds?”","“Mɩnlɩan'n nwan: ‘Kpɔfʋɛ bie yɛ̂ ɔ'a li junman sɔ nɩn ɔ.’ “Ɛhɩ a, ajunmanfʋ'n-mɔ kɔ bisa yɩ́ kɛ: ‘Ɛ kulo kɛ yɛ hɔ́ tútu ndile ɛtɛ nɩn ɔ?’"
“No!” he answered. “You might also pull up the wheat.,"“Mɩnlɩan'n nwan: ‘Cɛcɛ, sɛ ɛmɔ tutu a, bɛ 'ba tutu bele'n bɛ bʋka sʋ."
"Although it is the smallest of all seeds, it grows larger than any garden plant and becomes a tree. Birds even come and nest on its branches.","Ninnge mma'n mɔ bɛ dua'n, yɩ́ y'ɔ tɩ bɛ́ nunhan kaan kpa nɩn ɔ. Nan kʋsʋ sɛ ɔ fifi a, ɔ nyin tala ninnge mma'n-mɔ kʋalaatin. Ɔ kaci dukpa nnʋnman'n-mɔ ba bɛ nwʋn bɛ́ sâ yɩ́ sa mma'n-mɔ asʋ.” Fali ayile nɩn anwʋn anyɩnndala'n (Luku"
Jesus told them another story: The kingdom of heaven is like what happens when a farmer plants a mustard seed in a field.,"Zozi kɔ bu anyɩnndala biekun kɔ hele bɛ́, yɩ́ nwan: “Anwunno Belemgbin Mân'n, ɔ tɩ kɛ muntadɩ baa mɔ sʋanlan a fa a hɔ a lua yɩ́ ebo sʋ ɔ."
"Jesus used stories when he spoke to the people. In fact, he did not tell them anything without using stories.","Ɛjɔlɛ ɛhɩ kʋalaa mɔ ɔ 'kan kele menian'n-mɔ'n, ɔ bu yɩ́ anyɩnndala nun. Sɛ ɔ'a mmun man anyɩnndala a, ɔ ngan man ɛjɔlɛ'n ɔ ngele man bɛ́."
"So God's promise came true, just as the prophet had said, “I will use stories to speak my message and to explain things hidden since the creation of the world.” Jesus Explains the Story about the Weeds","Ɛhɩ m'ɔ yɔlɩ'n manlɩn ɛjɔlɛ'n mɔ Nyanmɩan kpɔmanfʋɛ'n hanlɩn'n kpɩnlɩn sʋ. Nyanmɩan manlɩn kpɔmanfʋɛ'n hanlɩn kɛ: Mɩn 'bu anyɩnndala nán m'an han ɛjɔlɛ'n m'an hele bɛ́. Sunmin kɛ bɛ bɔlɩ mân'n, ninnge m'ɔ wɔ nvɩalɩɛ nun'n, mɩn 'bɔ yɩ́ nwʋn ɛjɔlɛ. Zozi 'ba tu ndile ɛtɛ nɩn anwʋn anyɩnndala nɩn abʋ"
"After Jesus left the crowd and went inside, his disciples came to him and said, “Explain to us the story about the weeds in the wheat field.”","Mɔ Zozi hanlɩn sɔ yuelɩ'n, ɔ gualɩ meninsʋnman nɩn atɩn yɛ̂ ɔ hɔlɩ awulo ɔ. Yɩ́ menian'n-mɔ kpunngelɩ yɩ́ a, bɛ́ nwan: “Tu ndile ɛtɛ'n m'ɔ fifi ebo nɩn asʋ nɩn anwʋn anyɩnndala nɩn abʋ kele yɛ́.”"
Jesus answered: The one who scattered the good seed is the Son of Man.,Zozi nwan: “Sʋanlan'n m'ɔ le gua *bele mma kpa'n y'ɔ le *Mân Baa'n.
"The field is the world, and the good seeds are the people who belong to the kingdom. The weeds are those who belong to the evil one,","Ebo'n y'ɔ le mân'n. Bele mma kpa'n y'ɔ le bɛ́ mɔ bɛ́ tɩ Anwunno Belemgbin Mân nɩn anun menian'n. Ndile ɛtɛ'n, y'ɔ le bɛ́ mɔ bɛ tɩ Abɔnsanmʋn menian'n."
"and the one who scattered them is the devil. The harvest is the end of time, and angels are the ones who bring in the harvest.","Kpɔfʋɛ'n mɔ ɔ'a lua ndile ɛtɛ'n y'ɔ le Abɔnsanmʋn. Bele mma nɩn ɛtɩɛ tɛmʋn'n y'ɔ le mân nɩn ayuelɩɛ nun, yɛ̂ bɛ́ mɔ bɛ 'tɩ ebo'n y'ɔ le nyanmɩansʋ mmɔfʋɛ'n-mɔ."
Weeds are gathered and burned. That's how it will be at the end of time.,"“Kɛmɔ bɛ tutu ndile ɛtɛ nɩan an, bɛ gua yɩ́ sɩ̂n nɩn anun'n, sɛ mân nɩn ayuelɩɛ'n ju a, kɛ bɛ 'yɔ yɩ́ nɩn anɩn."
"The Son of Man will send out his angels, and they will gather from his kingdom everyone who does wrong or causes others to sin.",Mân Baa'n 'sʋan yɩ́ nyanmɩansʋ mmɔfʋɛ'n-mɔ maan bɛ yɩ bɛ́ kʋalaa mɔ bɛ man ɛhɩnlɩn-mɔ tɔ ɛtɛ nɩn anun ɔ nʋn bɛ́ mɔ bɛ yɔ ɛtɛ'n fi yɩ́ Belemgbin Mân nɩn anun.
"Then he will throw them into a flaming furnace, where people will cry and grit their teeth in pain.","Bɛ yɩ bɛ́ a, bɛ 'gua bɛ́ sɩ̂n gɔhɩɩn nɩn anun. Ɛbɛlɛ yɛ̂ bɛ 'sun bɛ kʋan bɛ́ je nɩn ɔ."
"But everyone who has done right will shine like the sun in their Father's kingdom. If you have ears, pay attention! A Hidden Treasure","Nan menian mɔ bɛ́ nyɩn sɔ Nyanmɩan'n, bɛ 'ta bɛ́ Sɩ Belemgbin Mân nɩn anun kɛ sɛnzɛ m'ɔ lɛ ta ɔ. M'ɔ sɩ fasie'n, ɔ fá sie!” Anwʋndɩɛ'n m'ɔ fɩa nɩn anwʋn anyɩnndala'n"
The kingdom of heaven is like what happens when someone finds a treasure hidden in a field and buries it again. Such a person is happy and goes and sells everything in order to buy that field. A Valuable Pearl,"Ɛhɩ, Zozi nwan: “Anwunno Belemgbin Mân'n tɩ kɛ esika kɔkɔlɛ m'ɔ fɩa ebo kʋn asʋ. Sʋanlan m'ɔ kɔ fite sʋ'n, yɩ́ kʋsʋ ɔ fa fɩa biekun. Ɔ di fɛ, ɔ tɔnɩn yɩ́ nwʋn ninnge'n kʋalaatin ɔ to ebo sɔ'n. Afile nɩn anwʋn anyɩnndala'n"
The kingdom of heaven is like what happens when a shop owner is looking for fine pearls.,“Ɛsɛ Anwunno Belemgbin Mân'n tɩ kɛ watafʋɛ kʋn m'ɔ lɛ kpʋnndɛ afile nganlanman to ɔ.
"After finding a very valuable one, the owner goes and sells everything in order to buy that pearl. A Fish Net","Mɛlɛ m'ɔ kɔ nwun kʋn m'ɔ tɩ kpa'n, ɔ kɔ tɔnɩn yɩ́ nwʋn ninnge'n kʋalaatin ɔ to afile sɔ'n. Dada nɩn anwʋn anyɩnndala'n"
The kingdom of heaven is like what happens when a net is thrown into a lake and catches all kinds of fish.,“Ɛsɛ Anwunno Belemgbin Mân'n tɩ kɛ dada mɔ bɛ gua yɩ́ jenvie nɩn anun ɔ. Ejue ngacile kʋalaa wʋlʋ nun.
"When the net is full, it is dragged to the shore, and the fishermen sit down to separate the fish. They keep the good ones, but throw the bad ones away.","Ɔ yi a, bɛ hyʋhyʋɩn gua fie bɛ tanlan asɩ bɛ kpa ejue'n-mɔ anun. Bɛ gua mgbakpa'n-mɔ ece nun yɛ̂ ɛtɛ ɛtɛ'n-mɔ, bɛ ju bɛ gua."
That's how it will be at the end of time. Angels will come and separate the evil people from the ones who have done right.,Mân nɩn ayuelɩɛ nun kɛ ɔ 'ba yɔ yɩ́ nɩn anɩn. Nyanmɩansʋ mmɔfʋɛ'n-mɔ 'ba sie menin mgbakpa'n-mɔ ebue kʋn
"Then those evil people will be thrown into a flaming furnace, where they will cry and grit their teeth in pain. New and Old Treasures",bɛ gua ɛtɛfʋɛ'n-mɔ sɩ̂n gɔhɩɩn nɩn anun. Ɛbɛlɛ yɛ̂ bɛ 'sun bɛ kʋan bɛ́ je nɩn ɔ.” Anwʋndɩɛ nvʋfɔlɛ'n-mɔ nʋn nnaba'n-mɔ
"Jesus asked his disciples if they understood all these things. They said, “Yes, we do.”",Zozi kɔ bisa yɩ́ menian'n-mɔ kɛ: “Asʋ ɛmɔ a tɩ ɛjɔlɛ ɛhɩ-mɔ abʋ ɔ?” Bɛ́ nwan: “Yuo o!”
"So he told them, “Every student of the Scriptures who becomes a disciple in the kingdom of heaven is like someone who brings out new and old treasures from the storeroom.” The People of Nazareth Turn against Jesus (Mark","Ɛhɩ a, Zozi nwan: “Ɛhɩka ati, mala nɩn asʋ kpain biala m'ɔ kɔ kaci Anwunno Belemgbin Mân nɩn anun sʋanlan'n, anwʋndɩɛ'n m'ɔ nyan yɩ́'n, ninnge nvʋfɔlɛ wɔ nun yɛ̂ nnaba kʋsʋ wɔ nun.” Nazalɛtɩ amma'n-mɔ nne man Zozi bɛ nni man (Maakɩ"
"When Jesus had finished telling these stories, he left","Mɔ Zozi yuelɩ anyɩnndala ɛhɩ-mɔ bubu'n, ɔ fi ɛbɛlɛ"
"and went to his hometown. He taught in their synagogue, and the people were so amazed that they asked, “Where does he get all this wisdom and the power to work these miracles?","ɔ kɔ hɔ kulo'n mɔ bɛ talɩ yɩ́ nɩn asʋ. Ɔ kɔ wʋlʋ asɔnɩn sua nɩn anun ɔ kɔ hehele ɛbɛlɛ menian'n-mɔ ninnge, ɛjɔlɛ'n kɔ sin bɛ́ kʋalaa mɔ bɛ wɔ ɛbɛlɛ nɩn anwʋn kpa. Bɛ́ nwan: “Ɔ nyanlin ngɛlɛ ɛhɩ nin? Tunmin benin yɛ̂ ɔ fa yɔ asinbɛnwʋn ninnge ɛhɩ-mɔ ɔ?"
"Isn't he the son of the carpenter? Isn't Mary his mother, and aren't James, Joseph, Simon, and Judas his brothers?","Nán junnvʋɛ nɩn awa belenzua nɩn ɔ? Nán yɩ́ nin y'ɔ le Mali ɔ? Nán yɩ́ nianman mmelenzua'n-mɔ y'ɔ le Zʋakɩ, Zozɛfʋ, Simʋn nʋn Zudɩ ɔ?"
Don't his sisters still live here in our town? How can he do all this?”,"Yɩ́ nianman mmalasua'n-mɔ kʋalaa, bɛ nnʋn man yɛ́ yɛ̂ ɔ gua ɛwa ɔ? Ɔ nʋn tunmin ɛhɩ kʋalaa fi nin?”"
"So the people were upset because of what he was doing. But Jesus said, “Prophets are honored by everyone, except the people of their hometown and their own family.”","Ajʋnlɩn sɔ'n m'ɔ wɔ bɛ́ ti anun'n maan b'a nnwun man asɩ b'a nne man Zozi b'a nni man. Ɛhɩ a, Zozi kɔ han kɔ hele bɛ́ kɛ: “Nyanmɩan kpɔmanfʋɛ kʋn, yɩ́ kulo nɩn asʋ nʋn yɩ́ afilie nɩn anun menian'n-mɔ mmu man yɩ́ like.”"
"And because the people did not have any faith, Jesus did not work many miracles there.","Dedi'n mɔ ɛbɛlɛ menian'n-mɔ le man yɩ́ nɩn ati, Zozi a nyɔ man asinbɛnwʋn ninnge dɔʋn."
"When Jesus got out of the boat, he saw the large crowd. He felt sorry for them and healed everyone who was sick.","Mɔ Zozi fi ɛlɛɛ nɩn anun 'ju'n, ɔ 'tʋ yɩ́ nyɩn an, menian ngʋnmɩn. Bɛ́ nwʋn kɔ yɔ yɩ́ anwunnvoe, ɛsɛ ɔ kɔ man nwuluwafʋɛ'n-mɔ anwʋn kɔ sa."
“Come on!” Jesus said. Peter then got out of the boat and started walking on the water toward him.,"Mɔ Pɩɛlɩ hanlɩn sɔ'n, Zozi nwan: “Bala!” Pɩɛlɩ fi ɛlɛɛ nɩn anun ɔ kɔ ju, ɔ lɛ kpʋ Zozi."
so much he swore to give her whatever she wanted.,"dede ɔ kɔ han ndâ kɛ like biala m'ɔ kulo'n, sɛ ɔ bisa a, ɔ 'fa man yɩ́."
"and told his officials, “This is John the Baptist! He has come back from death, and that's why he has the power to work these miracles.”",ɔ kɔ han kɔ hele yɩ́ ngʋa'n-mɔ kɛ: “Zʋan Batisi dein y'ɔ fi ewue nun ɔ'a tinnge nɩn ɔ! Ɛhɩka ati yɛ̂ ɔ le tunmin ɔ yɔ asinbɛnwʋn ninnge ɔ.”
"Herod had earlier arrested John and had him chained and put in prison. He did this because John had told him, “It isn't right for you to take Herodias, the wife of your brother Philip.”","Afɩ Zʋan kɔ han kɔ hele belemgbin Elɔdɩ kɛ: “Nannan, Nyanmɩan mala'n mman man wɔ́ atɩn kɛ ɛ fá Elodiadɩ já.”"
"But the girl's mother told her to say, “Here on a serving plate I want the head of John the Baptist!”","Talua'n kɔ li yɩ́ nin anʋan ɛjɔlɛ nɩn asʋ. Ɔ kɔ han kɔ hele belemgbin Elɔdɩ kɛ: “Baba, fa Zʋan ati'n tʋ apawa nun man mɩ́n kɩkaala!”"
"It was taken on a serving plate to the girl, and she gave it to her mother.",Sʋanlan'n kɔ hɔ kɔ kpɛ Zʋan ati'n ɔ kɔ tʋ yɩ́ apawa nun kɔ bɛlɛ talua'n. Talua'n kʋsʋ kɔ hɔ kɔ fa kɔ man yɩ́ nin.
John's followers took his body and buried it. Then they told Jesus what had happened. Jesus Feeds Five Thousand (Mark,"Mɔ Zʋan menian'n-mɔ tɩlɩ yɩ́ sɔ'n, bɛ walɩ falɩ yɩ́ fuin'n bɛ hɔlɩ sielɩ yɩ́. Mɔ bɛ sielɩ yɩ́ yuelɩ'n, bɛ hɔlɩ bɔlɩ nun amannɩɛ bɛ helelɩ Zozi. Zozi 'ba man menian akpɩɩ nnun alɩɛ di (Maakɩ"
"But when Peter saw how strong the wind was, he was afraid and started sinking. “Save me, Lord!” he shouted.","Nan m'ɔ nwunlin kɛ asutue'n tɩ kpili'n, esulo kɔ han yɩ́. Ɛsɛ kɛmɔ anɩn ɔ lɛ nʋan'n, ɔ kɔ tɩan. Yɩ́ nwan: “Yɛ́ Mɩn, de mɩ́n!”"
"But they said, “We have only five small loaves of bread and two fish.”",Yɩ́ menian'n-mɔ nwan: “Kpaʋn nnun ala ɔ nʋn ejue nnyuan yɛ̂ yɛ le yɩ́ ɛwa ɔ.”
"After Jesus heard about John, he crossed Lake Galilee to go to some place where he could be alone. But the crowds found out and followed him on foot from the towns.","Mɔ Zozi tɩlɩ amannɩɛ sɔ'n, ɔ fʋlɩ ɛlɛɛ kʋn anun ɔ hɔlɩ lɩka kʋn. Lɩka sɔ'n, sʋanlan fɩ́ɩ́ nnʋn man ɛbɛlɛ. Nan mɔ menian'n-mɔ tɩlɩ yɩ́ sɔ'n, bɛ fi kulo kulo'n-mɔ asʋ bɛ kɔ fa asue nɩn anʋan atɩn'n bɛ kɔ si Zozi sʋ."
"Jesus replied, “They don't have to leave. Why don't you give them something to eat?”",Zozi kɔ bua bɛ kɛ: “Ɔ tɩ man cɩnnjɩn kɛ bɛ hɔ́. Nan ɛmɔ muonun mán bɛ́ like bɛ lí.”
"Jesus asked his disciples to bring the food to him,",Zozi nwan: “Ɛmɔ fá bɛ bɛ́lɛ mɩ́n.”
"and he told the crowd to sit down on the grass. Jesus took the five loaves and the two fish. He looked up toward heaven and blessed the food. Then he broke the bread and handed it to his disciples, and they gave it to the people.","M'ɔ hanlɩn sɔ yuelɩ'n, ɔ kɔ man meninsʋnman nɩn atɩn kɛ bɛ tɛ́tanlan ndile nɩn asʋ. Ɛhɩ anzin, ɔ kɔ fa kpaʋn nnun'n nʋn ejue nnyuan'n ɔ kɔ tʋ yɩ́ nyɩn anwunno ɔ kɔ la Nyanmɩan asɩ. M'ɔ lalɩ Nyanmɩan asɩ yuelɩ'n, ɔ kɔ bubu kpaʋn'n-mɔ anun ɔ kɔ fa kɔ man yɩ́ menian'n-mɔ. Yɩ́ menian'n-mɔ kʋsʋ kɔ hye kɔ man meninsʋnman'n."
"After everyone had eaten all they wanted, Jesus' disciples picked up twelve large baskets of leftovers.","Bɛ́ nun kʋn biala kɔ li dede yɩ́ kʋ kɔ yi. Kpaʋn'n m'ɔ halɩ'n, Zozi menian'n-mɔ kɔ sɩsa. Ɔ yi ece mma bulu nʋn nnyuan."
"At once, Jesus made his disciples get into a boat and start back across the lake. But he stayed until he had sent the crowds away.","Ɛhɩ, menian'n-mɔ yuelɩ like di ɛbɛlɛ ala a, Zozi kɔ man yɩ́ menian'n-mɔ kɔ fʋ ɛlɛɛ nɩn anun. Ɔ kɔ han kɔ hele bɛ́ kɛ bɛ kpɛ́ asue'n bɛ lí mʋa ebue kʋn ɛlɔ nán ɔ 'gua meninsʋnman nɩn atɩn."
"Then he went up on a mountain where he could be alone and pray. Later in the evening, he was still there.","M'ɔ gualɩ bɛ́ atɩn yuelɩ'n, ɔ kɔ fʋ bʋka kʋn asʋ, ɔ kɔ hɔ asɔnɩn ɛyɔlɛ ahanmɩan. Mɔ alɩ́ɛ sanlɩn'n, yɩ́ ngʋnmɩn cein yɛ̂ anɩn ɔ wɔ ɛbɛlɛ ɔ."
By this time the boat was a long way from the shore. It was going against the wind and was being tossed around by the waves.,"Ɔ 'ba yɔ sɔ'n, anɩn Zozi menian'n-mɔ ɛlɛɛ'n la bunman sʋ. Asutue'n bɔ mgbaha ɔ tu si ɛlɛɛ'n."
"A little while before morning, Jesus came walking on the water toward his disciples.","Mɔ ɔ 'kɔ alɩbahɩan'n, Zozi nanndɩ asue nɩn anyɩnsʋ ɔ lɛ kpʋ yɩ́ menian'n-mɔ."
"When they saw him, they thought he was a ghost. They were terrified and started screaming.","Mɔ bɛ nwunlin kɛ ɔ nanndɩ asue nɩn anyɩnsʋ'n, esulo kɔ han bɛ́. Bɛ́ nwan: “Ɛnwʋnmɩn aho! Ɛnwʋnmɩn aho!” Kɛmɔ anɩn bɛ sulo nɩn ati, bɛ lɛ tɛtɩan."
"At once, Jesus said to them, “Don't worry! I am Jesus. Don't be afraid.”","Nan bɛ 'tɛtɩan nɩn ala, Zozi nwan: “Ɛmɔ sɔ́ bɛ́ ahʋnlɩn nán mɩ́n ɔ. Nán bɛ sulo!”"
"Peter replied, “Lord, if it really is you, tell me to come to you on the water.”","Ɛhɩ a, Pɩɛlɩ nwan: “Yɛ́ Mɩn, sɛ wɔ́ sakpa a, man n nánndɩ asue nɩn anyɩnsʋ m gbʋ́ wɔ́.”"
"At once, Jesus reached out his hand. He helped Peter up and said, “You surely don't have much faith. Why do you doubt?”","Ɛbɛlɛ ala, Zozi kɔ tʋ yɩ́ sa ɔ kɔ sɔ yɩ́ nun yɛ̂ yɩ́ nwan: “Pɩɛlɩ, wɔ́ dedi'n tɩ kaan o! Ɔ yɔ sɛ mɔ a nnyan man dedi'n?”"
"When Jesus and Peter got into the boat, the wind died down.","Mɔ Zozi hanlɩn sɔ yuelɩ'n, ɔ nʋn Pɩɛlɩ bɛ kɔ fʋ ɛlɛɛ nɩn anun yɛ̂ asutue'n gualɩ asɩ ɔ."
