ref,text
"“A virgin will have a baby boy, and he will be called Immanuel,” which means “God is with us.”","“Oyitsɔ̃ kĩ enyína onyole aatsãmɔ kɔma, ɛma obinyole. Baavɛ ye Imanuel,” kĩ de kayɔ nyɛ, “Baguma deĩ mɔ boe.”"
more to the birth of the Messiah. The Birth of Jesus (Luke,"ade Azur ma Zadok, Zadok ma Akim, Akim lɛmɛ ma Elihud."
"This is how Jesus Christ was born. A young woman named Mary was engaged to Joseph from King David's family. But before they were married, she learned that she was going to have a baby by God's Holy Spirit.","Ade ayekĩ Yesu Kristo kama fɔlɛtsa a ya nɛ foe kamɛ a nɛ awĩ a. Bitinya ɔma Maria bɛkpa Yosef, lɛmɛ fɔmɔ baapi ye a, Maria mɔ́ eyi ɔsũ kĩ ɛtsɛ̃mɔ kɔma kĩ kuto Hũhũ Kpalɛwa a kamɛ."
Joseph was a good man and did not want to embarrass Mary in front of everyone. So he decided to quietly call off the wedding.,"Ayekĩ Yosef nyɛ oti kpĩĩ nɛ Baguma anɛ, ade ɛtáwɛ kĩ yado Maria kɔnyɔã nɛ bati anɛ sũ ni, ɛwɛ kĩ yasĩ ye nɛ kabɛla kamɛ."
"While Joseph was thinking about this, an angel from the Lord appeared to him in a dream. The angel said, “Joseph, the baby that Mary will have is from the Holy Spirit. Go ahead and marry her.","Kĩ ɛkakɔna fukĩĩ akũ a, boe Ɔlate a ode fɔtɔ ɔnyanɛ odi nyɛ ye akũ ɛtsa ye nɛ kɔda kamɛ, ebi ye kĩ, “Yosef, Dawid obi, tavila Maria kakɔã, kitonɛkĩ Hũhũ Kpalɛwa a kamɛ kɔma a to."
"Then after her baby is born, name him Jesus, because he will save his people from their sins.”","Yaama obinyole, ote ye dĩ kĩ Yesu, kitonɛkĩ ye aanyɛ ye bati etomɛna tɔkpa kamɛ.”"
"After Joseph woke up, he and Mary were soon married, just as the Lord's angel had told him to do.","Foesũ kĩ Yosef nyinya a, ɛkɔã Maria ndɛ ayekĩ Baguma ode fɔtɔ ɔnyanɛ bi ye a."
But they did not sleep together before her baby was born. Then Joseph named him Jesus.,"Lɛmɛ Yosef mɔ Maria táta mɔ akũ ndɛ ɔtsɔ̃ mɔ ɔnyɔ aye, kɛnawo lɔkɔ a kĩ ɛma ye obinyole a. Ade Yosef te ye dĩ kĩ Yesu a."
"When Jesus was born in the village of Bethlehem in Judea, Herod was king. During this time some wise men from the east came to Jerusalem","Bɛma Yesu nɛ Betlehem nɛ lɔkɔ a kĩ Herodes kanya lɛgã nɛ Yudea tite akũ a. Owi tábuna mɔ banyole badi kĩ bɛkɔlɛ fɔtsa nɛ fusibii kadã akũ to suwa kadekɔ̃ bɛya nɛ Yerusalem,"
"and said, “Where is the child born to be king of the Jews? We saw his star in the east and have come to worship him.”","ade bɛyavia kĩ, “Ndia bɛma obisɛ̃ a kĩ yaanya Yudafɔ lɛgã a? Bɔmɔ́ ye lisibii kĩ lide nɛ suwa kadekɔ̃, ade bɔya kĩ bɔ́asum ye a.”"
"When King Herod heard about this, he was worried, and so was everyone else in Jerusalem.","Kĩ Lɛgã Herodes nu fukĩĩ a, ɔwɔlɛ bɔlɛ ye mɔ odi nyɛ odi nɛ Yerusalem a."
"Herod brought together the chief priests and the teachers of the Law of Moses and asked them, “Where will the Messiah be born?”","Foesũ ɛvɛ basɔfɔnɔkɔɛ̃ mɔ mbla batsanɛ a flee ɛkpɔta evia be kĩ, “Nɛ ndia baama Kristo a?”"
"They told him, “He will be born in Bethlehem, just as the prophet wrote,","Bɛkpa mbuayɛ kĩ, “Nɛ Betlehem nɛ Yudea tite akũ, kitonɛkĩ ade lɛtsa kĩ Baguma onukpɛ̃ ɔnyɛnɛ tsɛlɛ eyi kĩ,"
"‘Bethlehem in the land of Judea, you are very important among the towns of Judea. From your town will come a leader, who will be like a shepherd for my people Israel.’ ”","‘Nɔ Betlehem nɛ Yuda tite akũ, nnɛ́ ɔmatɔ kabii kɔlaa anɛ nɛ Yuda tɛmatɔ tɛkpale tɛkpale a kamɛ. Kitonɛkĩ nɔ kamɛ mɔ ɔkpãnɛ a kĩ, yaakpã yĩ bati Israelfɔ a aanɛ eto.’ ”"
Herod secretly called in the wise men and asked them when they had first seen the star.,"Foesũ Herodes vɛ anyansãfɔ a kĩ bito suwa kadekɔ̃ a ɛnamɛna kabɛlakɔ̃, ade evia be lɔkɔ paa a kĩ lisibii a nɛ a."
"He told them, “Go to Bethlehem and search carefully for the child. As soon as you find him, let me know. I also want to go and worship him.”","Ke liti a, ɛnyɛ be osi kĩ bɛnaa Betlehem mɔ ɔlɛdo kĩ, “Minaawɛ obisɛ̃ a kawɛ wĩ. Ntɛ mimɔ́ ye ni, mifɔ̃ ĩnyi lɔkɔa yĩ malo nnaasum ye.”"
"When the men went into the house and saw the child with Mary, his mother, they knelt down and worshiped him. They took out their gifts of gold, frankincense, and myrrh and gave them to him.","Kĩ biwo nɛ kɔla a kamɛ a, bɛmɔ́ obisɛ̃ a mɔ ɔma Maria, ade bike aduli bisum ye a. Bibinya be futetsa a kĩ fɔnyɛ sika ngbã, lifii mɔ klubɔũ bɛkpa ye."
"Later they were warned in a dream not to return to Herod, and they went back home by another road. The Escape to Egypt","Baguma nyɛ ɛtsa be nɛ kɔda kamɛ kĩ bɛtabuki bɛnaa Herodes sɛkɛ̃, foesũ bimuniki bɛtsã osi bɛbã bɛdzakũ bɛnaa ɔtɔ. Yosef Lomɔ Maria Mɔ Yesu Bɛnaa Egipte."
"After the wise men had gone, an angel from the Lord appeared to Joseph in a dream and said, “Get up! Hurry and take the child and his mother to Egypt! Stay there until I tell you to return, because Herod is looking for the child and wants to kill him.”","Kĩ anyansãfɔ a dzakũ a, ode fɔtɔ ɔnyanɛ odi nyɛ ye akũ ɛtsa Yosef nɛ kɔda kamɛ ebi ye kĩ, “Herodes aatsã ɛwɛ obisɛ̃ a kĩ yakɔ ye, foesũ yidza kakpã obisɛ̃ a mɔ ɔma milo minaa Egipte tite akũ. Mina nɛ awã kɛnaawo lɔkɔ a kĩ maabi nɔ kĩ mimuniki miya.”"
"That night, Joseph got up and took his wife and the child to Egypt,","Lɛnyɛ lɛnyɛ a na, Yosef yidza ɛkpã obisɛ̃ a mɔ ɔma bilo bɛnaa Egipte tite akũ."
"where they stayed until Herod died. So the Lord's promise came true, just as the prophet had said, “I called my son out of Egypt.” The Killing of the Children","Edzi nɛ awã kɛnawo kĩ Herodes ku. Fukĩĩ ya lɔmɔ ayekĩ lɛtsa a kĩ Baguma onukpɛ̃ ɔnyɛnɛ lɛ eyi a fɔya nɛ foe kamɛ kĩ, “Nvɛ yĩ obi ntomɛna Egipte tite akũ.” Herodes Fɔ̃ Bɛkɔ Kubisɛ̃ɛ̃nyole Nɛ Betlehem."
"When Herod found out that the wise men from the east had tricked him, he was very angry. He gave orders for his men to kill all the boys who lived in or near Bethlehem and were two years old and younger. This was based on what he had learned from the wise men.","Kĩ Herodes mɔ́ eyi ɔsũ kĩ anyansãfɔ a kĩ bito suwa kadekɔ̃ a bu ye tɛkɔasia a ni, ɛna kalɔkpa paa. Foesũ edo bati kĩ bɛnaakɔ kubisɛ̃ɛ̃nyole a kĩ kɔtɛ futeli nviã kɛka, kɛyawo akɔkɔa amɛ akũ a flee nɛ Betlehem, mɔ ye tɛmatɔ kĩ tifuã a flee kamɛ. Herodes vɛ futeli nviã kĩ fuketimɔ lɔkɔ a kĩ bibi ye kĩ lisibii a nɛ a."
"So the Lord's promise came true, just as the prophet Jeremiah had said,","Adeke fɔlɛtsa a kĩ Baguma Onukpɛ̃ Ɔnyɛnɛ Yeremia lɛ eyi a ya nɛ foe kamɛ kĩ,"
"“In Ramah a voice was heard crying and weeping loudly. Rachel was mourning for her children, and she refused to be comforted, because they were dead.” The Return from Egypt","“Fɔwɔla nɛ́ nɛ Rama, kabe mɔ ayɔlɔhɔ fɔwɔla fɔanɛ. Rahel kabe ye babi, ade yaátunɔ kĩ bɛdɔla ye ɔwɔlɛ a, kitonɛkĩ ye babi ku.” Yosef, Maria Mɔ Yesu Muniki Bito Egipte."
"After King Herod died, an angel from the Lord appeared in a dream to Joseph while he was still in Egypt.","Kĩ Herodes ku a, ode fɔtɔ ɔnyanɛ odi nyɛ ye akũ ɛtsa Yosef nɛ kɔda kamɛ nɛ Egipte,"
"The angel said, “Get up and take the child and his mother back to Israel. The people who wanted to kill him are now dead.”","ade ebi ye kĩ, “Yidza, kakpã obisɛ̃ a mɔ ɔma mimuniki minaa Israelfɔ tite akũ, kitonɛkĩ bikĩ bɛwɛ kĩ bakɔ obisɛ̃ a ku.”"
Joseph got up and left with them for Israel.,Foesũ Yosef kpã obisɛ̃ a mɔ ɔma bimuniki bɛya nɛ Israel tite akũ.
"But when he heard that Herod's son Archelaus was now ruler of Judea, he was afraid to go there. Then in a dream he was told to go to Galilee,","Lɛmɛ kĩ Yosef nu kĩ bidzina Arkelao lɛgã nɛ ɔlɛga Herodes kadzakɔ̃ nɛ Yudea a, evila awã kanaa. Baguma buki ɛnyɛ foe ɛtsa ye nɛ kɔda kamɛ kĩ ɛtanaa awã, foesũ ɛdzakũ ɛnaa Galilea amantam kamɛ,"
"and they went to live there in the town of Nazareth. So the Lord's promise came true, just as the prophet had said, “He will be called a Nazarene.”","ade ɛnadzi nɛ ɔmatɔ a kĩ bavɛ Nazaret a kamɛ a. Foesũ fɔlɛtsa a kĩ Baguma onukpɛ̃ banyɛnɛ a lɛ biyi a ya nɛ foe kamɛ kĩ, “Baavɛ ye kĩ Nazaretni.”"
Do something to show you have really given up your sins.,Mikɛna fɔtsa a kĩ fɔatsa kĩ midani mi tɔwɔlɛ kamɛ.
"He said, “Turn back to God! The kingdom of heaven will soon be here.”","Ɛlɛ kĩ, “Midani mi tɔwɔlɛ kamɛ, kitonɛkĩ Baguma lɛgãkanyakɔ̃ a fuã!”"
John wore clothes made of camel's hair. He had a leather strap around his waist and ate grasshoppers and wild honey.,"Yohanes do tɛtadiɛ kĩ bɛkɔa ɔpɔnkɔpoku tɛtsã bɛnɔ, ade ɛkɔa ɔyaɛ ovoli abɔsɔ eboomu kate a. Ye funitsã nyɛ koolo mɔ kɔsã."
From Jerusalem and all Judea and from the Jordan River Valley crowds of people went to John.,"Bati kato Yerusalem, Yudea tite flee mɔ tite a kĩ tifuã Yordan ɔwɔ a flee akũ kaya nɛ ye sɛkɛ̃."
"They told how sorry they were for their sins, and he baptized them in the river.",Bɛnyɛ be tɔkpa bɛtsa ade Yohanes wɔla be mui nɛ Yordan ɔwɔ a kamɛ a.
Many Pharisees and Sadducees also came to be baptized. But John said to them: You bunch of snakes! Who warned you to run from the coming judgment?,"Kĩ Yohanes mɔ́ Farisifɔ mɔ Zadukifɔ beblebee kĩ baya nɛ ye sɛkɛ̃ kĩ ɛwɔla be mui a, ebi be kĩ, “Mi bati kĩ mila ndɛ bɔɛ kpa! Owei lɛkpa mi kɔdɛ kĩ milo nɛ sɔtɔ kavɛlɛ a kĩ Baguma aayamɛna a kamɛ?"
An ax is ready to cut the trees down at their roots. Any tree that doesn't produce good fruit will be chopped down and thrown into a fire.,"Bike kasɔã kɔkɔɛ nɛ futse tɔbɔlɛ akũ kĩ baatsua. Kutse nyɛ kutse kĩ kɔáwũ babi wĩ ni, baakpeli koe bɛta bido nɛ fi luwotu kamɛ."
"His threshing fork is in his hand, and he is ready to separate the wheat from the husks. He will store the wheat in a barn and burn the husks in a fire that never goes out. The Baptism of Jesus (Mark","Ɛnɛɛ ye kɔvɛla nɛ awɛ kĩ yaakɔa ɛwɛ ye kamɔnɛ. Yaafila ye kamɔnɛ eko nɛ oli kamɛ, lɛmɛ yaapila afafa a nɛ fi kĩ fɔádĩ da a kamɛ.” Yohanes Wɔla Yesu Mui."
Jesus left Galilee and went to the Jordan River to be baptized by John.,"Nɛ lɔkɔ a na kamɛ a, Yesu to Galilea ɛya nɛ Yohanes sɛkɛ̃ nɛ Yordan ɔwɔ a abuĩ kĩ ɛwɔla ye mui."
"But John kept objecting and said, “I ought to be baptized by you. Why have you come to me?”","Lɛmɛ Yohanes wɛ kĩ Yesu ɛdani adzuni. Ebi Yesu kĩ, “Nɔ a kĩ kɛnɛ kĩ awɔla yĩ mui a ni, nɔ mbom lɛya nɛ yĩ sɛkɛ̃?”"
"Jesus answered, “For now this is how it should be, because we must do all God wants us to do.” Then John agreed.","Lɛmɛ Yesu kpa ye mbuayɛ kĩ, “Finyaakɔ̃ fɔ̃ fɔna lɔmɔ, kitonɛkĩ ade osi kĩĩ akũ bɔ́atsã bɔkɛna fɔtsa a kĩ Baguma awɛ a.” Foesũ Yohanes tunɔ nɛ foe akũ."
"So Jesus was baptized. And as soon as he came out of the water, the sky opened, and he saw the Spirit of God coming down on him like a dove.","Kĩ Yohanes wɔla Yesu mui eyua a, ɛnɛ nɛ mui a kamɛ lɛtalɛta, ade ode binya ɛkpa Yesu, ɛmɔ Baguma Hũhũ kĩ yaka ndɛ mblɔduma aye ɛyadzi nɛ ye akũ."
"Then a voice from heaven said, “This is my own dear Son, and I am pleased with him.”","Ade odo odi nɛ eto ode ɛlɛ kĩ, “Ade yĩ mɔawɛ Obi kĩ maátunɔ ye kalɛ nɛ awĩ a, yawo yĩ anɛ.”"
"When Jesus heard that John had been put in prison, he went to Galilee.","Kĩ Yesu nu kĩ bipi Yohanes bido nɛ kɔla a, ɛdzakũ ɛnaa Galilea tite akũ."
"But instead of staying in Nazareth, Jesus moved to Capernaum. This town was beside Lake Galilee in the territory of Zebulun and Naphtali.","Ɛtánaadzi nɛ Nazaret ɔmatɔ a kamɛ, mbom ɛnadzi nɛ Kapernaum, ɔmatɔ nɛ Galilea ɔwɔ lutubu baũ a ɔwɛ̃. Awã deĩ nɛ Zebulon mɔ Naftali amantam a kamɛ."
After Jesus had gone without eating for,"Kĩ Yesu dzi katanya, lɛnyɛ mɔ suwa fuwi tɛna flee a, kɔlɛ kɔ ye."
"Then the devil came to him and said, “If you are God's Son, tell these stones to turn into bread.”","Ade Abonsam ya nɛ ye sɛkɛ̃ ebi ye kĩ, “Ntɛ Baguma obi anɛ ni, kekɔ̃ bi boe kĩĩ bɛdani bɛkɛna abodoo.”"
"Jesus answered, “The Scriptures also say, ‘Don't try to test the Lord your God!’ ”","Yesu kpa mbuayɛ kĩ, “Lɛmɛ Katsɛlɛ Kpalɛwa a buki kɛlɛ kĩ, ‘Tasɔ boe Ɔlate nɔ Baguma a ɔdã.’ ”"
"Finally, the devil took Jesus up on a very high mountain and showed him all the kingdoms on earth and their power.","Ade Abonsam buki ɛkpã Yesu ɛnamɛna ɔtɔ geĩ odi kalete, ade ɛnyɛ katinya kamɛ fɔgã kanyakɔ̃ flee, mɔ foe akũ obu ɛtsa ye a."
"The devil said to him, “I will give all this to you, if you will bow down and worship me.”","Abonsam bi ye kĩ, “Maakɔa fukĩĩ flee nkpa nɔ, ntɛ aake aduli osum yĩ.”"
"Jesus answered, “Go away Satan! The Scriptures say: ‘Worship the Lord your God and serve only him.’ ”","Yesu kpa ye mbuayɛ kĩ, “Satana, dzakũ nɛ yĩ akũ! Katsɛlɛ Kpalɛwa a lɛ kĩ, ‘Nɔ Ɔlate Baguma odi kɛnɛ kĩ akɛna nɔ akũ ɔkpa lɔkɔa osum ye lɛmɛ.’ ”"
"So God's promise came true, just as the prophet Isaiah had said,","Fɔya lɔmɔ ndɛ ayekĩ Baguma Onukpɛ̃ Ɔnyɛnɛ Yesaya lɛ eyi a kĩ,"
"“Listen, lands of Zebulun and Naphtali, lands along the road to the sea and across the Jordan. Listen Galilee, land of the Gentiles!","“Zebulon tite mɔ Naftali tite, osi kĩ ɛnaa mpo abuĩ mɔ Yordan ɔwɔ liti Galilea, bikĩ bɛnyɛ́ Yudafɔ tite!"
Right then the two brothers dropped their nets and went with him.,"Nɛ awã naa, bɛfɔnɛ be tɛsau awɛ bitomɔ ye."
"While Jesus was walking along the shore of Lake Galilee, he saw two brothers. One was Simon, also known as Peter, and the other was Andrew. They were fishermen, and they were casting their net into the lake.","Kĩ Yesu tsɛ̃ Galilea ɔwɔ lutubu baũ abuĩ yanaa a, ɛmɔ́ bawaɛ̃nyole nviã kĩ bɛnyɛ kɔfɔabi banyɛnɛ. Ade be nyɛ Simon kĩ bavɛ Petro mɔ ɔwaɛ̃ Andrea, kĩ bɛkata tɛsau nɛ lutubu baũ a kamɛ."
"Jesus walked on until he saw James and John, the sons of Zebedee. They were in a boat with their father, mending their nets. Jesus asked them to come with him.","Yesu naa lɔtɔ ade ɛmɔ bawaɛ̃nyole nviã bɛbã, Yakobo mɔ Yohanes kĩ bɛnyɛ Zebedeo babi. Bɛna nɛ be ɔkɔlɔ kamɛ bɛmɔ ɔlɛga Zebedeo bɛkalɔla be tɛsau. Yesu vɛ be,"
"At once they left the boat and their father and went with Jesus. Jesus Teaches, Preaches, and Heals (Luke","ade lɛtalɛta bɛfɔnɛ ɔkɔlɔ a mɔ be ɔlɛga awɛ biyi, bitomɔ ye a. Yesu Tsa Fɔtsa, Ɛlɛ Baguma Fɔlɛtsa, Ɛtsa Bati Fɔsɔ Lɛmɛ."
"Jesus went all over Galilee, teaching in their synagogues and preaching the good news about God's kingdom. He also healed every kind of disease and sickness.","Yesu tsã emini nɛ Galilea tite flee akũ ɛkatsa fɔtsa nɛ Yudafɔ fɔtsɛnakɔ̃ a. Ede lɛtsã nɛ Kalɛ Wĩ akũ nɛ Baguma lɛgãkanyakɔ̃ a akũ, ade ɛtsa fɔsɔ ahɔlɔ ahɔlɔ flee a."
"News about him spread all over Syria, and people with every kind of sickness or disease were brought to him. Some of them had a lot of demons in them, others were thought to be crazy, and still others could not walk. But Jesus healed them all.","Ye akũ fɔlɛtsa gba nɛ Siria tite flee akũ, foesũ bati kpã be a kĩ basɔ fɔsɔ ahɔlɔ ahɔlɔ a bɛma ye, bati kĩ bideĩ nɛ fɔsɔ mɔ ɔhau kamɛ, bikĩ hũhũ kpa deĩ nɛ be kamɛ, bikĩ odetɔ fɔsɔ kaha be, mɔ abafã amɛ, ade Yesu tsa be flee a."
"Large crowds followed Jesus from Galilee and the region around the ten cities known as Decapolis. They also came from Jerusalem, Judea, and from across the Jordan River.","Bati kɔdabu baũ kĩ bito Galilea tite akũ, mɔ Tɛmatɔ Ewua kamɛ, Yerusalem ɔmatɔ, Yudea tite akũ mɔ Yordan ɔwɔ liti tite akũ a yatomɔ ye."
"When Jesus saw the crowds, he went up on the side of a mountain and sat down. Blessings (Luke","Kĩ Yesu mɔ́ bati kɔdabu a, ede ɛnaa ɔtɔ akũ ɛnakɛna akũ edzi. Ye fɔtsa bakɔlɛnɛ a yakpɔta nɛ ye sɛkɛ̃."
"You must obey God's commands better than the Pharisees and the teachers of the Law obey them. If you don't, I promise you will never get into the kingdom of heaven. Anger","Foesũ mabi mi kĩ míapuli miwo nɛ ode lɛgãkanyakɔ̃ a, ntɛ miakɛna nɛ Baguma kawɛ akũ kaba mbla batsanɛ mɔ Farisifɔ a. Yesu Fɔtsa Katsa Nɛ Kalɔkpa Kana Akũ."
"So if you are about to place your gift on the altar and remember that someone is angry with you,","Foesũ ntɛ ɔwɛ kĩ akɔa nɔ afɔlibɔ fɔtsa ɔnaate nɛ afɔlibɔ atɛnyɛ akũ ɔkpa Baguma, mɔ ote anɛ kĩ awaɛ̃ nɛɛ nɔ kalɔɛ ni,"
and he taught them:,"Ade edo be fɔtsa katsa awɛ kĩ,"
God blesses those people who depend only on him. They belong to the kingdom of heaven!,"“Baguma hila bikĩ binyina kĩ bɛnyɛ ahiãfɔ nɛ Baguma anɛ a, kitonɛkĩ be la Baguma lɛgãkanyakɔ̃ a."
God blesses those people who grieve. They will find comfort!,"Baguma hila bikĩ babe kɔnya a, kitonɛkĩ Baguma aadɔla be tɔwɔlɛ."
God blesses those people who are humble. The earth will belong to them!,"Baguma hila bikĩ bɛdɔla be akũ a, kitonɛkĩ ade be aanya tite akũ adzapadiɛ a."
God blesses those people who are merciful. They will be treated with mercy!,"Baguma hila bikĩ bamɔ bati kɔnya a, kitonɛkĩ ade be Baguma aamɔ kɔnya a!"
God blesses those people whose hearts are pure. They will see him!,"Baguma hila bikĩ be tɔwɔlɛ teĩ nɛ ye odi akũ, kitonɛkĩ ade be aamɔ Baguma a!"
"You are the light for the whole world. A city built on top of a hill cannot be hidden,",“Mila ndɛ ɔhaĩ mikpa batidziwa flee. Bɛláapuli bɛkɔla ɔmatɔ kĩ bitsua nɛ ɔtɔ akũ.
"But I tell you not to swear by anything when you make a promise! Heaven is God's throne, so don't swear by heaven.","Lɛmɛ finyaa mabi mi kĩ mitalɔ fubo ntɛ miakɛna nhihiɛ adi. Mitatani ode, kitonɛkĩ Baguma lɛgãkpo yanɛ."
"The earth is God's footstool, so don't swear by the earth. Jerusalem is the city of the great king, so don't swear by it.","Mitatani tite kitonɛkĩ Baguma abɔa kakekɔ̃ tanɛ ĩye mitani Yerusalem, kitonɛkĩ ɛnyɛ Lɛgã Kpale a ɔmatɔ."
"You are the salt for everyone on earth. But if salt no longer tastes like salt, how can it make food salty? All it is good for is to be thrown out and walked on.","“Mila ndɛ lɛdɛmɛ mikpa batidziwa flee. Lɛmɛ ntɛ lɛdɛmɛ yɛla de ɔmɛnɛ ni, osi odima lɛláa kĩ baatsã bibuki bido de ɔmɛnɛ. Lɛdani fɔtsa pupulidza foesũ bata de kawula lɔkɔa bati asumini de."
"and no one lights a lamp and puts it under a clay pot. Instead, it is placed on a lampstand, where it can give light to everyone in the house.","Odima látɛna ɔsɛdza kakɔa lɔɔda katsa ye, mbom yakɔa ye kate nɛ ɔsɛdza otse akũ nɛ awã kĩ yaakpalɛ fɔkɔ ɛkpa odi nyɛ odi nɛ tɔtɔ a kamɛ."
"Don't suppose I came to do away with the Law and the Prophets. I did not come to do away with them, but to give them their full meaning.","Ade Yesu buki ɛlɛ kĩ, “Mitakɔna kĩ ĩya kĩ mayaafɔnɛ Mose mbla a mɔ Baguma onukpɛ̃ banyɛnɛ fɔtsa katsa a awɛ. Ntáya kĩ mayaafɔnɛ foe awɛ, mbom ĩya kĩ mayaakɛna foe fɔkpɔla."
"You know our ancestors were told, “Do not murder” and “A murderer must be brought to trial.”","“Minu kĩ kɔkɔɛ a, bibi bati kĩ, ‘Takɔ oti, ade odi nyɛ odi kĩ edi awu ni, baadzɛmɔ ye.’"
"But I promise you if you are angry with someone, you will have to stand trial. If you call someone a fool, you will be taken to court. And if you say that someone is worthless, you will be in danger of the fires of hell.","Lɛmɛ finyaa mabi mi kĩ odi nyɛ odi kĩ ɛna kalɔkpa nɛ ɔwaɛ̃ akũ ni, baadzɛmɔ ye. Odi nyɛ odi kĩ ɛvɛ ɔwaɛ̃ kĩ, ‘Ɔkɔasia’ ni, baakpã ye bɛnamɛna nɛ Ɔmaĩ banɔkɔɛ̃ anɛ bɛdzɛmɔ ye, ade odi nyɛ odi kĩ ɛvɛ ɔwaɛ̃ kĩ, ‘ɔyaɛ’ ni, ɛfɛta ɛkpa ode fi luwotu a kamɛ kanaa."
"leave your gift there in front of the altar. Make peace with that person, then come back and offer your gift to God.","fɔnɛ nɔ afɔliɛ fɔtsa a awɛ kayi nɛ afɔlibɔ atɛnyɛ a lɔtɔ nɛ awã, kamuniki kanaalɔla mi mɔ ye kayite tɔ̃ fɔmɔ ayakɔa nɔ afɔliɛ fɔtsa ɔkpa Baguma."
"Before you are dragged into court, make friends with the person who has accused you of doing wrong. If you don't, you will be handed over to the judge and then to the officer who will put you in jail.","“Ntɛ odi sama nɔ nɛ fɔlɛtsa kadzɛkɔ̃ ni, bɔa mbɔdi milɔla mi kayite nɛ lɔkɔ a kĩ lideĩ fɔmɔ baavɛ kalɛ a. Ntɛ nnɛ́ aye mɔ miwo fɔlɛtsa kadzɛkɔ̃ a, oti a aakɔa nɔ edo nɛ fɔlɛtsa ɔdzɛnɛ awɛ. Fɔlɛtsa ɔdzɛnɛ a lɛmɛ aakɔa nɔ ɛkpa polisifɔ ade baado nɔ nɛ kɔla a."
I promise you will not get out until you have paid the last cent you owe. Marriage,Mabi nɔ nɛ ɔnɔkɔali kamɛ kĩ ade awã aana flee kɛnaawo lɔkɔ a kĩ ose kɔtɔ a flee oyua a. Yesu Fɔtsa Katsa Nɛ Kɔtsɔ̃ Mɔ Kɔnyɔ Liti Kanɛ Akũ.
You have been taught that a man who divorces his wife must write out divorce papers for her.,"“Bɛlɛ lɛmɛ kĩ, ‘Odi nyɛ odi kĩ yaasĩ ɔtsɔ̃ ni, kɛnɛ kĩ ɛkpa ye kɔtsɔ̃ kasĩ ovoli.’"
"You know our ancestors were told, “Don't use the Lord's name to make a promise unless you are going to keep it.”","“Minu lɛmɛ kĩ bibi kɔkɔɛ bati a kĩ, ‘Mitatu mi fubo, mbom mikɛna nɛ fubo a kĩ milɔ mikpa boe Ɔlate a akũ.’"
"When you make a promise, say only “Yes” or “No.” Anything else comes from the devil. Revenge (Luke","Mikɔ̃ milɛ kĩ, ‘Oo,’ ĩye ‘Oowo.’ Kalɛ bɛbã kĩ mialɛ nɛ kakĩĩ liti to Oti Kpa a sɛkɛ̃. Yesu Fɔtsa Katsa Nɛ Tɔkpa Kakɛna Kase Tɔkpa Kɔtɔ Akũ."
"You know you have been taught, “An eye for an eye and a tooth for a tooth.”","“Minu kĩ bɛlɛ kĩ, ‘Linebi nɛ linebi kadokɔ̃, lɔdɔ̃ nɛ lɔdɔ̃ kadokɔ̃.’"
"But I tell you not to try to get even with a person who has done something to you. When someone slaps your right cheek, turn and let that person slap your other cheek.","Lɛmɛ finyaa mabi mi kĩ mitakɛna tɔkpa mise tɔkpa kɔtɔ. Ntɛ odi balɛ nɔ awɛ nɛ sɔmɔna ɔlɔtɔ ni, fɔ̃ ɛbalɛ nɔ nɛ sɛba ɔlɔtɔ lɛmɛ."
"If someone sues you for your shirt, give up your coat as well.","Ade ntɛ odi sama nɔ nɛ fɔlɛtsa kadzɛkɔ̃ kĩ yatɛ nɔ atadiɛ anyanglede ni, fɔ̃ ɛtɛ nɔ atadiɛ wulaa a lɛmɛ."
"If a soldier forces you to carry his pack one kilometer, carry it two kilometers.","Ntɛ oti kĩ edeĩ otumi hɛ nɔ kĩ lɔ ye fɔtsa mɔ kuvũ mitsã lisikũ mɔa ni, lɔ foe mitsã fusikũ nviã."
"When people ask you for something, give it to them. When they want to borrow money, lend it to them. Love (Luke","Ntɛ odi wã nɔ litsedi ni, kpa ye, ntɛ odi wɛ kĩ yavɛ litsedi nɛ nɔ sɛkɛ̃ ni, kpa ye ɛvɛ. Yesu Fɔtsa Katsa Nɛ Bakesĩnɛ Kalɛ Kawɛ Akũ."
"You have heard people say, “Love your neighbors and hate your enemies.”","“Minu kĩ bɛlɛ kĩ, ‘Wɛ nɔ ɔkɔba kalɛ, kakesĩ nɔ bakesĩnɛ.’"
But I tell you to love your enemies and pray for anyone who mistreats you.,"Lɛmɛ finyaa mabi mi kĩ miwɛ mi bakesĩnɛ kalɛ ade mibɔa mpaɛ nɛ bikĩ bitomɔ mi liti a lɔlɔ,"
Then you will be acting like your Father in heaven. He makes the sun rise on both good and bad people. And he sends rain for the ones who do right and for the ones who do wrong.,"ayekĩ míadani boe Ɔlɛga nɛ ode a babi. Kitonɛkĩ ye afɔ̃ suwa ata kakpa bati wĩ mɔ bati kpa flee, ade yafɔ̃ oni ako kakpa bati kĩ badã kpĩĩ mɔ bikĩ baádã kpĩĩ a flee a."
"If you love only those people who love you, will God reward you for this? Even tax collectors love their friends.","Ntɛ miawɛ bikĩ bawɛ mi kalɛ odi a, kɔtɔkase kɔɔdabe míana? Tɔgɔlɛ batɛnɛ malo akɛna foe lɔmɔ!"
"If you greet only your friends, what's so great about this? Don't even unbelievers do that?","Ade ntɛ mi bakɔba odi miado onukpɛ̃ ni, litsa mitɛnɛ kakɛna? Amamufɔ malo akɛna foe lɔmɔ!"
But you must always act like your Father in heaven.,Foesũ midã kĩ mikpɔla ndɛ ayekĩ mi Ɔlɛga nɛ ode a lɛmɛ kpɔla a.
"When you do good deeds, don't try to show off. If you do, you won't get a reward from your Father in heaven.","“Midã kadã wĩ kĩ miláakɛna mi ɔsum fɔtsa a nɛ kanade anɛ ayekĩ bati aamɔ lɛtsa a kĩ miakɛna a. Ntɛ mikɛna foe nɛ bati anɛ ni, miláana kɔtɔkase mitomɛna mi Ɔlɛga nɛ ode a sɛkɛ̃."
"When you give to the poor, don't let anyone know about it.","Foesũ nɔ kɔ̃ ntɛ akɛna sɛmɛ kalɛ ɔkpa ohiãni ni, tafɔ̃ nɔ ɔkɔba paa malo linyi lɛtsama nɛ foe akũ."
"When you pray, don't be like those show-offs who love to stand up and pray in the synagogues and on the street corners. They do this just to look good. I can assure you that they already have their reward.","“Ntɛ miabɔa mpaɛ ni, mitakɛna ndɛ anɛ kamɛ kɛkɛ fɔtsa bakɛnanɛ a aye. Bawɛ kayidza kadza kabɔa mpaɛ nɛ Yudafɔ fɔtsɛnakɔ̃ mɔ tɔblɔnu fɔbalikɔ̃ ayekĩ odi nyɛ odi aamɔ be. Mabi mi nɛ ɔnɔkɔali kamɛ kĩ bɛtɛ be kɔtɔkase a lodo kɔkɔɛ."
"When you pray, go into a room alone and close the door. Pray to your Father in private. He knows what is done in private and will reward you.","Lɛmɛ ntɛ abɔa mpaɛ ni, wo nɛ nɔ kɔla kamɛ, kabalɛ kɔla a lɔkɔa kabɔa mpaɛ kakpa nɔ Ɔlɛga a kĩ bɔámɔ mɔ anɛ a, lɔkɔa Aga a kĩ yamɔ fɔtsa a kĩ akɛna nɛ kabɛla kamɛ a aase nɔ kɔtɔ."
