ref,text
"Above his head they put a sign that told why he was nailed there. It read, “This is Jesus, the King of the Jews.”","Ade bɛtsɛlɛ ye onukpɛ̃ katsua fɔlɛtsa nɛ ye lɔlɔ nyangɛ kĩ, “Ade Yesu Yudafɔ Lɛgã a nɛ awĩ a.”"
"shouted, “So you're the one who claimed you could tear down the temple and build it again in three days! If you are God's Son, save yourself and come down from the cross!”","ade bɛkalɛ kĩ, “Nɔ a kĩ ɔlɛ kĩ aaveli Asɔli Kɔla a, lɔkɔa obuki oke koe nɛ fuwi ɛlalɛ kamɛ a, tɛ nɔ akũ! Ntɛ Baguma Obi anɛ ni, duma nɛ asendua a akũ!”"
"Others said, “Wait! Let's see if Elijah will come and save him.”","Lɛmɛ bati bɛbã a lɛ kĩ, “Dza tɔ̃. Mifɔ̃ bɔdã ntɛ Eliya aayanyɛ ye mbɔɛɛ?”"
At noon the sky turned dark and stayed that way until three o'clock.,"Kĩ kito suwa tɔdɔũ ewua-nviã a, katinya kamɛ flee ke ɔtũ kɛnawo olobe tɔdɔũ ɛlalɛ kamɛ."
"Then about that time Jesus shouted, “Eli, Eli, lema sabachthani?” which means, “My God, my God, why have you deserted me?”","Ndɛ tɔdɔũ ɛlalɛ kamɛ a, Yesu bɔa fɔwɔla kɔɔba kĩ, “Eli, Eli, lama sabaktani?” Foe kayɔ nyɛ kĩ, “Yĩ Baguma, yĩ Baguma, nde sũ ɔfɔnɛ yĩ awɛ?”"
"One of them at once ran and grabbed a sponge. He soaked it in wine, then put it on a stick and held it up to Jesus.","Ade deedimɔapɛ be kamɛ ɔmɔa wula atsɛ ɛnabɔɛ ɔsapɔ edo nɛ waĩ yilawa kamɛ ɛkɔa ɛvɛla nɛ otse onukpɛ̃, ɛdɛla ete ye nɛ onukpɛ̃ kĩ ɛmɔa."
"At once the curtain in the temple was torn in two from top to bottom. The earth shook, and rocks split apart.","Adeke lima kpale a kĩ bɛvɛla nɛ Asɔli Kɔla kamɛ a bɛ̃ fɔkɛ nviã, kito nyangɛ kɛyawo kayɔ. Tite kuna boe bakpale bakpale yɛlɛ,"
"Graves opened, and many of God's people were raised to life.",funikɛ binya ade bɛdzɛla bati kpalɛwa pii kĩ biku a bidzi nkpã a.
"They left their graves, and after Jesus had risen to life, they went into the holy city, where they were seen by many people.","Kĩ Yesu yidza eto kanɔkpa liti a, bati kpalɛwa a nɛ́ nɛ funikɛ a kamɛ bɛnaa Yerusalem, ɔmatɔ kpalɛwa a kamɛ, awã kĩ bati pii mɔ be."
"The officer and the soldiers guarding Jesus felt the earthquake and saw everything else that happened. They were frightened and said, “This man really was God's Son!”","Kĩ sodzafɔ ɔnɔkɔɛ̃ a mɔ bikĩ bibumɔ ye bɛkadzɔlɛ Yesu akũ a mɔ́ tite kakuna mɔ fɔtsa bɛbã kĩ fɔya a, libe wo be paa ade bɛlɛ kĩ, “Ɔnɔkɔali obi kĩĩ nyɛ Baguma Obi!”"
"Many women had come with Jesus from Galilee to be of help to him, and they were there, looking on at a distance.","Batsole pii kĩ bito Galilea, kĩ bitómɔ Yesu bɛkabumɔ ye a, dza mɔ lugo bɛkadã."
"went and asked for Jesus' body. Pilate gave orders for it to be given to Joseph,",Ɛnaa Pilato sɛkɛ̃ ɛnawã ye kĩ ɛkɔa Yesu ɔnɔkpa a ɛkpa ye. Ade Pilato kpa osi kĩ bɛfɔnɛ ɔnɔkpa a awɛ bɛkpa ye a.
who took the body and wrapped it in a clean linen cloth.,"Foesũ Yosef bɔɛ ɔnɔkpa a, ade ɛkɔa aklala fitaa vɔɛ̃ esuli ye,"
Then Joseph put the body in his own tomb that had been cut into solid rock and had never been used. He rolled a big stone against the entrance to the tomb and went away.,ɛkɔa ɛnado nɛ ye mɔawɛ linikɛ vɔɛ̃ kĩ ɛfɔ̃ bɛnyɛ nɛ de kpale ɔkɛ kamɛ a. Emininya de kpale esua linikɛ a onukpɛ̃ ade ɛdzakũ a.
All this time Mary Magdalene and the other Mary were sitting across from the tomb.,Maria Magdalani mɔ Maria kĩ a dzi nɛ awã bɛtsɛlamɔ linikɛ a bɛkadã. Badzɔlɛnɛ Na Nɛ Kuni a Ɔwɛ̃.
"On the next day, which was a Sabbath, the chief priests and the Pharisees went together to Pilate.","Nɛ luwi lɛyade, kĩ lɛnyɛ Kawɛya Luwi ɔnɔnɛ a, basɔfɔnɔkɔɛ̃ mɔ Farisifɔ yatsɛna nɛ Pilato sɛkɛ̃,"
"They said, “Sir, we remember what this liar said while he was still alive. He claimed in three days he would come back from death.","bibi ye kĩ, “Ɔnɔkɔɛ̃, bute anɛ kĩ, kĩ ɔvãlɛvã a na dzi nkpã a, ɛlɛ kĩ, ‘Maayidza ndzi nkpã nɛ fuwi ɛlalɛ liti.’"
"So please order the tomb to be carefully guarded for three days. If you don't, his disciples may come and steal his body. They will tell the people he has been raised to life, and this last lie will be worse than the first one.”","Foesũ kpa mbla kĩ bɛdzɔlɛ ye kuni a akũ kadzɔlɛ wĩ kɛnaawo luwi lɛlalɛde a akũ. Ntɛ nnɛ́ aye ni, ye fɔtsa bakɔlɛnɛ a aapuli bɛnaaye ɔnɔkpa a lɔkɔa bibi bati kĩ bɛdzɛla ye bitomɛna banɔkpa kamɛ. Ntɛ fɔya lɔmɔ ni, liti fɔvã a aaba fɔtɔnyade a.”"
"Pilate said to them, “All right, take some of your soldiers and guard the tomb as well as you know how.”","Pilato bi be kĩ, “Mikpã badzɔlɛnɛ minamɛna, midzɔlɛ kuni a akũ ayekĩ míapuli.”"
So they sealed it tight and placed soldiers there to guard it.,"Foesũ bɛdzakũ bɛnatim de a nɛ kuni a onukpɛ̃ kɔɔba, ade bɛdzɛla de akũ badzɔlɛnɛ nɛ awã a."
"Jesus' eleven disciples went to a mountain in Galilee, where Jesus had told them to meet him.","Nɛ foe kamɛ a, fɔtsa bakɔlɛnɛ ewua-odi a naa Galilea nɛ ɔtɔ a kĩ Yesu tsa be kĩ bɛnaa a akũ."
So the chief priests met with the leaders and decided to bribe the soldiers with a lot of money.,"Kĩ basɔfɔnɔkɔɛ̃ mɔ ɔmaĩ banɔkɔɛ̃ a tsa fɔlɔ a, bipi adzuni ade bɛkpa badzɔlɛnɛ a sika baũ,"
"and teach them to do everything I have told you. I will be with you always, even until the end of the world.","Mitsa be kĩ bidi nɛ lɛtsa nyɛ lɛtsa a kĩ nhɛ mi a akũ. Midã, ndeĩ nɛ mi sɛkɛ̃ luwi daa kɛnaawo katinya kawũna.”"
"Then Jesus said, “Don't be afraid! Tell my followers to go to Galilee. They will see me there.” Report of the Guard","Ade Yesu bi be kĩ, “Mitavila, mbom minaabi nwaɛ̃ amɛ kĩ bɛnaa Galilea, lɔkɔa baamɔ yĩ nɛ awã.” Badzɔlɛnɛ a Nalɛ Lɛtsa a Kĩ Bɛmɔ́."
"Suddenly a strong earthquake struck, and the Lord's angel came down from heaven. He rolled away the stone and sat on it.","Lɛtalɛta tite kuna mɔ ɔsĩ mɔ ɔsĩ, kitonɛkĩ ode fɔtɔ ɔnyanɛ to ode ɛka ɛyamininya de nɛ linikɛ a onukpɛ̃ a eyi, ɛkɛna akũ edzi nɛ de akũ."
"The angel looked as bright as lightning, and his clothes were white as snow.","Ye akũ flee la ndɛ odetɔ́ kamɛ kamɔanɛ aye, ade ye tɛtadiɛ voe fitaa ndɛ aklala aye a."
"The guards shook from fear and fell down, as though they were dead.","Libe wo bikĩ badzɔlɛ fɔkɔ a paa, bɛkatila bliblibli, bɛkɛna ndɛ banɔkpa."
"The angel said to the women, “Don't be afraid! I know you are looking for Jesus, who was nailed to a cross.","Ade ode fɔtɔ ɔnyanɛ a bi batsole a kĩ, “Mitavila! Ĩnyina kĩ Yesu a kĩ bɛbɔa nɛ asendua akũ a miawɛ."
"Now hurry! Tell his disciples he has been raised to life and is on his way to Galilee. Go there, and you will see him. This is what I came to tell you.”","Miwɛ sɔwa minaabi ye fɔtsa bakɔlɛnɛ a kĩ, ‘Eyidza eto banɔkpa kamɛ. Ɛnyaa mi lɔtɔ yanaa Galilea. Ade awã míamɔ ye a!’ Mite anɛ nɛ lɛtsa a kĩ mbi mi a akũ.”"
"Suddenly Jesus met them and greeted them. They went near him, held on to his feet, and worshiped him.","Lɛtalɛta Yesu tsɛlamɔ be ade ebi be kĩ, “Lukudɔ litomɔ mi.” Bifuã bɛyapili ye nɛ fɔnɛta, bike aduli bisum ye."
"While the women were on their way, some soldiers who had been guarding the tomb went into the city. They told the chief priests everything that had happened.","Kĩ batsole a dzakũ banaa a, kuni a akũ badzɔlɛnɛ a kamɛ badi naa ɔmatɔ kamɛ bɛnabi basɔfɔnɔkɔɛ̃ a lɛtsa a kĩ lɛya a flee."
"They said to the soldiers, “Tell everyone that Jesus' disciples came during the night and stole his body while you were asleep.","bibi be kĩ, “Milɛ kĩ, ‘Lɛnyɛ a kĩ bɔwa tida a ade ye fɔtsa bakɔlɛnɛ a yaye ɔnɔkpa a bɛdzakũmɛna a.’"
The soldiers took the money and did what they were told. The people of Judea still tell each other this story. What Jesus' Followers Must Do (Mark,"Badzɔlɛnɛ a tɛ sika a, bɛnakɛna ndɛ ayekĩ bibi be a. Foesũ ade fɔlɛtsa kĩĩ lɛgba nɛ Yudafɔ kamɛ bɛnɛɛ balɛ kɛyawo nviã kĩĩ a. Yesu Nyɛ Ye Akũ Ɛtsa Ye Fɔtsa Bakɔlɛnɛ a."
Jesus came to them and said: I have been given all authority in heaven and on earth!,"Yesu fuã be ɛlɛ kĩ, “Baguma kɔa tite mɔ ode otumi flee edo nɛ yĩ awɛ."
"Go to the people of all nations and make them my disciples. Baptize them in the name of the Father, the Son, and the Holy Spirit,","Foesũ minaa fude flee kamɛ nɛ kakɔ nyɛ kakɔ, minaakɛna bati a bɛdani yĩ fɔtsa bakɔlɛnɛ. Miwɔla be mui nɛ Ɔlɛga a, Obi a mɔ Hũhũ Kpalɛwa a dĩ akũ."
"They saw him and worshiped him, but some of them doubted.","Kĩ bɛmɔ́ ye a, bike aduli bisum ye, lɛmɛ be kamɛ badi tɛ atsindze."
Right then the two brothers dropped their nets and went with him.,"Nɛ awã naa, bɛfɔnɛ be tɛsau awɛ biyidza bitomɔ ye."
"Jesus walked on and soon saw James and John, the sons of Zebedee. They were in a boat, mending their nets.","Kĩ bɛnaa lɔtɔ sukuloo a, ɛmɔ bawaɛ̃ nviã Yakobo mɔ Yohanes. Bɛna nɛ be ɔkɔlɔ kamɛ bɛkalɔla be tɛsau."
News about Jesus quickly spread all over Galilee. Jesus Heals Many People (Matthew,Foesũ Yesu dĩ gba nɛ Galilea tite akũ flee. Yesu Tsa Bati Beblebee Fɔsɔ.
"It began just as God had said in the book written by Isaiah the prophet, “I am sending my messenger to get the way ready for you.","Anɛ kɔkɔɛ a mɔ Baguma Onukpɛ̃ Ɔnyɛnɛ Yesaya tsɛlɛ eyi kĩ Baguma bi ye obi kĩ, “Maado yĩ fɔtɔ ɔnyanɛ ɛnya nɔ lɔtɔ, ɛyaalɔla osi eyi ɛkpa nɔ."
John wore clothes made of camel's hair. He had a leather strap around his waist and ate grasshoppers and wild honey.,"Lɔkɔ a na kamɛ ni, Yohanes do ɔpɔnkɔ mɔ kanɛ mɔ lɔpɔ tɔlɔ tɛtadiɛ, ɛkɔa ɔyaɛ ovoli ɔwɛ̃ ɛbɔa kate. Ye funitsã nyɛ kɔsã mɔ koolo."
"John also told the people, “Someone more powerful is going to come. And I am not good enough even to stoop down and untie his sandals.","Ede lɛtsã kĩ, “Oti a kĩ yaaya nɛ yĩ liti a, ɛbɛ̃ yĩ kɔlaa kĩ ntáfɛta kĩ makɛna akũ nwũnya mpabua nɛ ye abɔa malo."
Jesus and his disciples went to the town of Capernaum. Then on the next Sabbath he went into the synagogue and started teaching.,"Yesu mɔ bikĩ bitomɔ ye a nawo ɔmatɔ kĩ bavɛ Kapernaum. Nɛ Yudafɔ Kawɛya Luwi a kĩ litomɔ be awã kawo luwi a, Yesu naa Yudafɔ katsɛnakɔ̃ ɛnatsa fɔtsa."
"Everyone was amazed at his teaching. He taught with authority, and not like the teachers of the Law of Moses.","Bati a kĩ binu ye fɔtsa katsa a kɛna saa, kitonɛkĩ fɔvɛmɛna nɛ Yudafɔ mbla batsanɛ a fude akũ, mbom ye ɛtsa fɔtsa mɔ ɔwɔlɛ kamɛ kɔbɛ̃."
"About that time Jesus came from Nazareth in Galilee, and John baptized him in the Jordan River.","Owi tábuna mɔ Yesu to Nazaret ɔmatɔ nɛ Galilea tite akũ, ɛyatɛ Yohanes mui kawɔla amaniɛ a nɛ Yordan ɔwɔ kamɛ."
"As soon as Jesus came out of the water, he saw the sky open and the Holy Spirit coming down to him like a dove.","Kĩ Yesu sila ɛnɛ́ eto mui a kamɛ a, ɛmɔ kĩ odetɔ́ kamɛ binya ade Hũhũ a ka eko nɛ ye akũ ndɛ ayekĩ mblɔduma aka a."
"A man with leprosy came to Jesus and knelt down. He begged, “You have the power to make me well, if only you wanted to.”","Oti odi kĩ yasɔ fɔsɔ ngbã kĩ bati avila ya nɛ Yesu sɛkɛ̃. Ɛkɛna akũ ade eke Yesu aduli kĩ ebumɔ ye a. Onyole a bi ye kĩ, “Ntɛ awɛ ni, aapuli ɔfɔ̃ fɔsɔ kĩĩ lɛwɔ nɛ yĩ akũ.”"
"He said, “The time has come! God's kingdom will soon be here. Turn back to God and believe the good news!” Jesus Chooses Four Fishermen (Matthew","Ɛkalɛ nɛ awã kĩ, “Lɔkɔ wĩ a wo ɔtɔ ade Baguma lɛgãkanya lɔkɔ a fuã. Mimuniki nɛ mi tɔkpa liti lɔkɔa mitɛ Kalɛ Wĩ a mido!”"
At once Jesus asked them to come with him. They left their father in the boat with the hired workers and went with him. A Man with an Evil Spirit (Luke,"Kĩ Yesu mɔ be a, ɛvɛ be deedimɔapɛ kĩ bitomɔ ye. Be malo biyidza lɛtalɛta, bɛfɔnɛ be ɔlɛga Zebedeo mɔ ye adzuma bakɛnanɛ a odi nɛ ɔkɔlɔ a kamɛ, ade bitomɔ Yesu a. Yesu Blɔmɛna Hũhũ Kpa Etomɛna Oti Odi Kamɛ."
"Jesus went to her. He took hold of her hand and helped her up. The fever left her, and she served them a meal.","Foesũ Yesu wo nɛ ye sɛkɛ̃, ade epi ye nɛ kɔkpɔ ɛdzɛla ye kĩ eyidza. Deedimɔapɛ fɔsɔ a dɔ ye, ade eyidza esum be a."
"And when they found him, they said, “Everyone is looking for you!”","Kĩ bɛmɔ́ ye a, bibi ye kĩ, “Odi nyɛ odi lamɛna nɔ kawɛ!”"
"Suddenly a man with an evil spirit in him entered the synagogue and yelled,","Nɛ lɔkɔ a na kamɛ a, onyole odi kĩ hũhũ kpa deĩ nɛ ye kamɛ na nɛ be katsɛnakɔ̃ a,"
"“Jesus from Nazareth, what do you want with us? Have you come to destroy us? I know who you are! You are God's Holy One.”","ade ɛbɔa fɔwɔla kɔɔba kĩ, “Yesu Nazaretni, litsa deĩ nɛ bɔmɔ nɔ kayite? Ɔya kĩ ayaawɔla boe mbɔɛɛ? Ĩnyina oti a kĩ anɛ. Nɔ nyɛ Baguma Oti Kpalɛwa Kĩ Bido a.”"
"Jesus told the evil spirit, “Be quiet and come out of the man!”","Yesu wũni nɛ hũhũ a akũ kĩ, “Sua onukpɛ̃, kanɛ nɛ oti a kamɛ.”"
The spirit shook him. Then it gave a loud shout and left.,"Hũhũ a fufulinya oti a mɔ ɔsĩ, ɛfɔ̃ ɛbɔa fɔwɔla kɔɔba ade ɛnɛ nɛ ye kamɛ a."
"Everyone was completely surprised and kept saying to each other, “What is this? It must be some new kind of powerful teaching! Even the evil spirits obey him.”","Fɔkɛna bati a flee kĩ bɛdza nɛ awã saa, ade bivia be akũ kĩ, “Litsa nɛ awĩ a? Ei! Fɔtsa katsa vɔɛ̃ ɔdabe nɛ awĩ a? Oti kĩĩ deĩ kɔbɛ̃ yawũni nɛ hũhũ kpa akũ ade yatse ye ɔlɛdo a!”"
"Jesus replied, “We must go to the nearby towns, so that I can tell the good news to those people. This is why I have come.”","Lɛmɛ Yesu bi be kĩ, “Mifɔ̃ bɔnaa tukula bɛbã kĩ tifuã a lɛmɛ kamɛ. Kɛfɛta kĩ mabi be malo Baguma fɔlɛtsa, kitonɛkĩ ade foesũ ĩya nɛ katinya kamɛ a.”"
"Jesus felt sorry for the man. So he put his hand on him and said, “I want to! Now you are well.”","Ye fɔlɛtsa kɔ Yesu kɔnya, foesũ eyo awɛ ɛta ye. Ebi ye kĩ, “Mawɛ lɔmɔ. Nɔ akũ ɛkpalɛ.”"
"As soon as Jesus left the synagogue with James and John, they went home with Simon and Andrew.","Yesu mɔ ye fɔtsa bakɔlɛnɛ, Yakobo mɔ Yohanes dzakũ nɛ Yudafɔ katsɛnakɔ̃ a, ade bɛnaa Simon mɔ Andrea tɔtɔ kamɛ a."
"When they got there, Jesus was told that Simon's mother-in-law was sick in bed with fever.","Kĩ biwo awã a, badi bi Yesu kĩ Simon nyina waa yasɔ, ye akũ bo hlihlihli."
"That evening after sunset, all who were sick or had demons in them were brought to Jesus.","Kĩ suwa tomu a, bati kpã basɔnɛ pii mɔ bikĩ hũhũ kpa deĩ nɛ be kamɛ a bɛyamɛna kĩ Yesu ɛtsa be."
"In fact, the whole town gathered around the door of the house.",Bati nɛ ɔmatɔ a kamɛ yabɔa obũ nɛ onyukpɛ̃.
"Jesus healed all kinds of terrible diseases and forced out a lot of demons. But the demons knew who he was, and he did not let them speak.","Yesu tsa bati pii kĩ basɔ fɔsɔ ahɔlɔ ahɔlɔ, ade ɛblɔmɛna hũhũ kpa etomɛna bati pii lɛmɛ kamɛ a. Yesu tákpa hũhũ a osi bɛlɛ kɔdzɛla kitonɛkĩ binyina ye. Yesu Lɛ Kalɛ Wĩ a Nɛ Galilea Tite Akũ."
"Very early the next morning before daylight, Jesus got up and went to a place where he could be alone and pray.","Odenyinawi a, Yesu yidza nɛ tɔtɔ a kamɛ, ɛnɛ nɛ ɔmatɔ a kamɛ ɛnaa awã kĩ oti odima táfuã, ɛnabɔa mpaɛ."
Simon and the others started looking for him.,Lɛmɛ Simon mɔ bikĩ bitomɔ ye a nɛ bɛtsɛ̃ bawɛ Yesu.
"Then Jesus went to their synagogues everywhere in Galilee, where he preached and forced out demons. Jesus Heals a Man (Matthew","Foesũ ɛnamini nɛ Galilea flee. Ɛtsã ɛkalɛ Baguma fɔlɛtsa a nɛ Yudafɔ fɔtsɛnakɔ̃, ade ɛkablɔmɛna hũhũ kpa kanɛmɛna nɛ bati kamɛ a. Yesu Tsa Onyole Odi Kĩ Yasɔ Fɔsɔ Ngbã."
"At once the man's leprosy disappeared, and he was well.",Deedimɔapɛ fɔsɔ a wɔ nɛ ye akũ.
"After Jesus strictly warned the man, he sent him on his way.","Awã naa, Yesu bi ye kĩ ɛdzakũ mɔatsɛ ɛnaa, lɛmɛ esi ye mbla mɔ ɔsĩ mɔ ɔsĩ kĩ,"
"He said, “Don't tell anyone about this. Just go and show the priest that you are well. Then take a gift to the temple as Moses commanded, and everyone will know that you have been healed.”","“Tafɔ̃ ɔdza nɛ osi ɔkabi bati lɛtsa a kĩ de lɛya, mbom naa kpĩĩ, kakɔa nɔ akũ kanaatsa ɔsɔfɔ. Bɔa afɔliɛ a kĩ Mose mbla tsa a, ayekĩ odi nyɛ odi aanyi kĩ nɔ akũ kpalɛ.”"
"The man talked about it so much and told so many people, that Jesus could no longer go openly into a town. He had to stay away from the towns, but people still came to him from everywhere.","Lɛmɛ kĩ oti kĩĩ dzakũ a, ɛnado fɔlɛtsa a kagbamɛna awɛ, ɛkabi bati flee ayekĩ Yesu tsa ye a. Nɛ foesũ, Yesu tápuli ebuki ewo nɛ ɔmatɔ odima kamɛ, ade ɛkana nɛ tuwĩ kamɛ a. Lɛmɛ bati buki bɛkato kakɔ nyɛ kakɔ kaya nɛ ye sɛkɛ̃."
It was during the time of Abiathar the high priest. David went into the house of God and ate the sacred loaves of bread that only priests are allowed to eat. He also gave some to his followers.”,"Awã naa Yesu via be kĩ, “Mitákã lɛtsa a kĩ Lɛgã Dawid kɛna a? Lɔkɔ a kĩ kɔlɛ kɔ ye mɔ bikĩ bitomɔ ye a, Dawid wo nɛ Baguma kɔla a kamɛ a, nɛ lɔkɔ a kĩ Abiata anya Yudafɔ Ɔsɔfɔnɔkɔɛ̃ Flee a. Ɛnanyɛ afɔlibɔ abodoo kĩ Yudafɔ basɔfɔ odi deĩ osi kĩ banya a ɛnya, ade ɛkɔa adi ɛkpa bikĩ bitomɛna ye a lɛmɛ bɛnya a.”"
Then so many of them came to the house that there wasn't even standing room left in front of the door. Jesus was still teaching,"Foesũ bati yayi tɔtɔ a kĩ te kamɛ edeĩ a mɔ kanya flee, ade ɛkatsa be Baguma fɔlɛtsa a."
"when four people came up, carrying a man on a mat because he could not walk.",Ade awã naa mɔ bati ɛna lɔ oti odi kĩ eveliveli bɛma ye a.
"But because of the crowd, they could not get him to Jesus. So they made a hole in the roof above him and let the man down in front of everyone.","Kĩ bɛtápuli bɛtsã onyukpɛ̃ nɛ bati lidede sũ ni, bide nɛ kɔla ode bɛnyɛ ɔkɛ nɛ kakɔ kadi, ade bɛkɛna ɔsɔnɛ a mɔ ɔkɛna biyi nɛ Yesu anɛ kamɛ a."
“Why would he say such a thing? He must think he is God! Only God can forgive sins.”,“Nde sũ yalɛ fubusuotsa lɔmɔ? Baguma odi aapuli ɛkɔa titikpa ete.”
"I will show you that the Son of Man has the right to forgive sins here on earth.” So Jesus said to the man,","Kĩ míanyi kĩ Otidziwa Obi a deĩ kɔbɛ̃ nɛ katinya kĩĩ kamɛ kĩ yakɔa bati titikpa kate sũ ni,” Yesu bi oti a kĩ eveliveli a kĩ,"
“Get up! Pick up your mat and go on home.”,"“Yidza, bɔɛ nɔ ɔkɛna kanaa kɔla.”"
"Once again, Jesus went to the shore of Lake Galilee. A large crowd gathered around him, and he taught them.",Yesu buki ɛdzakũ ɛnaa Galilea ɔwɔ lutubu baũ abuĩ a. Bati pii ya nɛ ye sɛkɛ̃ nɛ awã ade ɛtsa be Baguma fɔlɛtsa a.
"Jesus finished by saying, “People were not made for the good of the Sabbath. The Sabbath was made for the good of people.","Yesu bi be kĩ, “Otidziwa sũ bɛbɔa Kawɛya Luwi a, nnɛ́ Kawɛya Luwi a sũ bɛbɔa otidziwa."
"Later, Jesus and his disciples were having dinner at Levi's house. Many tax collectors and other sinners had become followers of Jesus, and they were also guests at the dinner.","Ke liti a, Yesu mɔ ye fɔtsa bakɔlɛnɛ a mɔ bati pii kĩ bitomɔ ye a naanya nɛ Levi awã. Tɔgɔlɛ batɛnɛ mɔ tɔkpa bakɛnanɛ pii lɛmɛ na nɛ kanyakɔ̃ a mɔ be."
"Some of the teachers of the Law of Moses were Pharisees, and they saw Jesus eating with sinners and tax collectors. So they asked his disciples, “Why does he eat with tax collectors and sinners?”","Ade Farisifɔ kĩ bɛnyɛ Yudafɔ mbla batsanɛ badi lɛmɛ na nɛ awã a. Kĩ Farisifɔ mbla batsanɛ a mɔ́ kĩ Yesu anya mɔ titikpa bakɛnanɛ mɔ tɔgɔlɛ batɛnɛ a, bivia ye fɔtsa bakɔlɛnɛ a kĩ, “Litsa sũ yanya kamɔa mɔ tɔgɔlɛ batɛnɛ mɔ tɔkpa bɛbã bakɛnanɛ?”"
"The followers of John the Baptist and the Pharisees often went without eating. Some people came and asked Jesus, “Why do the followers of John and those of the Pharisees often go without eating, while your disciples never do?”","Nɛ lɔkɔ lidi kamɛ, kĩ Yohanes mɔ ye fɔtsa bakɔlɛnɛ mɔ Farisifɔ kasui onukpɛ̃ a, bati badi ya nɛ Yesu sɛkɛ̃ bivia ye kĩ, “Nde sũ nɔ fɔtsa bakɔlɛnɛ a lásui onukpɛ̃ ndɛ Yohanes bade mɔ Farisifɔ a aye?”"
Jesus answered: The friends of a bridegroom don't go without eating while he is still with them.,"Yesu kpa be mbuayɛ kĩ, “Mbɔɛɛ obolitsɔ̃ ɔnyɔ bakɔba aapuli bidzi kɔlɛ nɛ obolitsɔ̃ kapikɔ̃ nɛ lɔkɔ a kĩ obolitsɔ̃ ɔnyɔ a deĩ nɛ be sɛkɛ̃ a?"
But the time will come when he will be taken from them. Then they will go without eating.,"Lɛmɛ luwi lidi aaya kĩ baakpã ye nɛ ye bakɔba a sɛkɛ̃, lɔkɔa baasui onukpɛ̃ nɛ fuwi a kamɛ."
No one patches old clothes by sewing on a piece of new cloth. The new piece would shrink and tear a bigger hole.,"Odima lákɔa limakũ vɔɛ̃ kataɛ ɔkɛ nɛ lima kɔɛ akũ. Limakũ vɔɛ̃ a aabɛ̃ lɔkɔɛ lidomɔ akũ ntɛ bɛvɔlɛ de, ade fɔ́afɔ̃ ɔkɛ baũ lɛwa ɛba ayekĩ fɔna kɔkɔɛ a."
"No one pours new wine into old wineskins. The wine would swell and burst the old skins. Then the wine would be lost, and the skins would be ruined. New wine must be put into new wineskins. A Question about the Sabbath (Matthew","Bio, odima lákɔa waĩ vɔɛ̃ kako nɛ ɔyaɛ ovoli kuvũ kɔɛ kamɛ, kitonɛkĩ waĩ vɔɛ̃ aabɛ̃ kuvũ kɔɛ a, lɔkɔa waĩ a aawula, kuvũ a lɛmɛ aabu kade. Mbom bakɔa waĩ vɔɛ̃ kako nɛ ɔyaɛ ovoli kuvũ vɔɛ̃ kamɛ.” Fɔlɛtsa Kavia Nɛ Kawɛya Luwi a Akũ."
One Sabbath Jesus and his disciples were walking through some wheat fields. His disciples were picking grains of wheat as they went along.,"Nɛ Kawɛya Luwi lidi akũ a, kĩ Yesu mɔ ye fɔtsa bakɔlɛnɛ tsɛ̃ batɛ̃ nɛ fugbanɔ kɔba kudi kamɛ a, fɔtsa bakɔlɛnɛ a kave fudi."
"Some Pharisees asked Jesus, “Why are your disciples picking grain on the Sabbath? They are not supposed to do that!”","Foesũ Farisifɔ a bi Yesu kĩ, “Dã! Boe mbla tákpa osi kĩ bakɛna fukĩnaa nɛ Kawɛya Luwi akũ.”"
So the Son of Man is Lord over the Sabbath.”,Foesũ Otidziwa Obi a nyɛ Kawɛya Luwi a Ɔlate.”
"The Pharisees wanted to accuse Jesus of doing something wrong, and they kept watching to see if Jesus would heal him on the Sabbath.","Lɔkɔ a na Yesu bakesĩnɛ badi na nɛ katsɛnakɔ̃ a, bɛkadã ntɛ yaatsa oti a nɛ Kawɛya Luwi akũ, ayekĩ baabɔɛ fɔlɛtsa nɛ ye akũ."
Jesus told the man to stand up where everyone could see him.,Yesu vɛ oti a kĩ ye kɔkpɔ ku a kĩ ɛnɛ ɛyaadza nɛ bati a flee anɛ kamɛ.
"Jesus was angry as he looked around at the people. Yet he felt sorry for them because they were so stubborn. Then he told the man, “Stretch out your hand.” He did, and his bad hand was healed.","Yesu dã be ɛtɛ̃mɛna nɛ kalɔkpa kamɛ, ade fɔha ye paa nɛ be lɔlɔ kamɛ ɔsĩ sũ a. Ade ebi ɔsɔnɛ a kĩ, “Yo nɔ awɛ.” Eyo awɛ a ade ye awɛ a de ɔsĩ a."
"Jesus decided to ask some of his disciples to go up on a mountain with him, and they went.","Ke liti a, Yesu de ɛnaa ɔtɔ kalete. Ade awã ɛvɛ bikĩ yawɛ kĩ bɛnya ye bade a."
"Some teachers of the Law of Moses came from Jerusalem and said, “This man is under the power of Beelzebul, the ruler of demons! He is even forcing out demons with the help of Beelzebul.”","Yudafɔ mbla batsanɛ a kĩ bito Yerusalem bɛya a lɛ kĩ, “Hũhũ kpa deĩ nɛ ye kamɛ. Hũhũ kpa lɛgã a lɛkpa ye kɔbɛ̃ yablɔmɛna hũhũ a katomɛna bati kamɛ.”"
"The crowd sitting around Jesus told him, “Your mother and your brothers and sisters are outside and want to see you.”","Bati a kĩ bidzi bɛtsɛna Yesu a bi ye kĩ, “Dã, ama mɔ awaɛ̃ amɛ dzɛ̃ nɛ kanya bawɛ nɔ!”"
Jesus told the people to gather around him. Then he spoke to them in riddles and said: How can Satan force himself out?,"Ade Yesu vɛ bati a ɛyamɛna nɛ ye sɛkɛ̃ ɛlɛ kɔdzɛla mɔ be nɛ fɔgbã kamɛ kĩ, “Nde fɔ́aya kĩ Abonsam aapuli ɛblɔmɛna ye mɔawɛ akũ etomɛna oti kamɛ?"
"Jesus went back home, and once again such a large crowd gathered that there was no chance even to eat.","Yesu dzakũ nɛ awã ɛnaa tɔtɔ kamɛ, ade bati pii buki bɛya nɛ be sɛkɛ̃ nɛ awã. Nɛ foesũ Yesu mɔ ye fɔtsa bakɔlɛnɛ a lána aya bɛnya malo."
A nation whose people fight each other won't last very long.,"Foe nfantuhũ nyɛ kĩ ntɛ lɛgãkanyakɔ̃ kadi sɛ̃ ke akũ kutsu kutsu kĩ kɔanɔ akũ ni, kanyakɔ̃ a na lɛláapuli kitim."
"How can anyone break into the house of a strong man and steal his things, unless he first ties up the strong man? Then he can take everything.","“Odima lɛláapuli ewo nɛ oti kĩ edeĩ kɔbɛ̃ kɔla kamɛ ɛnaafila ye fɔtsa, mbɔɛntɛ ɛnya lɔtɔ esuli ɔbɛlɛbɛ a fɔmɔ yaawo efila ye fɔtsa a."
"I promise you that any of the sinful things you say or do can be forgiven, no matter how terrible those things are.",“Mabi mi nɛ ɔnɔkɔali kamɛ kĩ Baguma aakɔa bati tɔkpa tidi nyɛ tidi kĩ bɛkɛna mɔ fubusuotsa fudi nyɛ fudi kĩ bɛlɛ ete be.
"But if you speak against the Holy Spirit, you can never be forgiven. That sin will be held against you forever.","Lɛmɛ odi nyɛ odi kĩ yaalɛ fubusuotsa nɛ Hũhũ Kpalɛwa a akũ ni, Baguma lɛláakɔa ete ye da. Kitonɛkĩ ɛkɛna tɔkpa kĩ taawa daa.”"
