ref,text
"Some people brought their children to Jesus, so he could place his hands on them and pray for them. His disciples told the people to stop bothering him.","Bati badi kpã babisɛ̃ bɛma Yesu kĩ ete awɛ nɛ be akũ, ɛbɔa mpaɛ ɛkpa be, lɛmɛ ye fɔtsa bakɔlɛnɛ a wũni nɛ be akũ."
"A man came to Jesus and asked, “Teacher, what good thing must I do to have eternal life?”","Luwi a onyole odi ya nɛ Yesu sɛkɛ̃ ɛvia ye kĩ, “Fɔtsa Ɔtsanɛ, lɛtsa wĩ lɔɔdabe kɛnɛ kĩ nkɛna mɔ maana daa nkpã a?”"
"“Which ones?” the man asked. Jesus answered, “Do not murder. Be faithful in marriage. Do not steal. Do not tell lies about others.","Oti a via ye kĩ, “Tɛbla tɛwɔdabe?” Yesu kpa ye mbuayɛ kĩ, “Takɔ oti, tabɔa adɔpaa, taye, tadi adansiɛ klumu,"
"After Jesus had placed his hands on the children, he left. A Rich Young Man (Mark","Adeke Yesu te awɛ nɛ be akũ ehila be, ade ɛdzakũ nɛ awã a. Opopo Osikani a."
"Jesus said to him, “Why do you ask me about what is good? Only God is good. If you want to have eternal life, you must obey his commandments.”","Yesu kpa ye mbuayɛ kĩ, “Nde sũ avia yĩ kalɛ nɛ fɔtsa wĩ kakɛna akũ? Oti mɔapɛ nyɛ owĩ. Lɛmɛ ntɛ awɛ kĩ awo nɛ nkpã kamɛ kɔ̃ ni, kɛna nɛ tɛbla a akũ.”"
"But Jesus said, “Let the children come to me, and don't try to stop them! People who are like these children belong to God's kingdom.”","Lɛmɛ Yesu lɛ kĩ, “Mifɔ̃ babisɛ̃ a bɛya nɛ yĩ sɛkɛ̃, mitasua be osi, kitonɛkĩ ade bikĩĩ bamɛ odu lá ode lɛgãkanyakɔ̃ a.”"
"But many who are now first will be last, and many who are last will be first.","Lɛmɛ bati pii kĩ bɛnyɛ batɔnyade finyaa a, aakɛna liti bade, ade liti bade a aakɛna batɔnyade a.”"
Respect your father and mother. And love others as much as you love yourself.”,"bu aga mɔ ama, kawɛ nɔ ɔkɔba kalɛ ndɛ ayekĩ awɛ nɔ akũ kalɛ a.”"
"The young man said, “I have obeyed all of these. What else must I do?”","Ade opopo a kpa mbuayɛ kĩ, “Nkɛna nɛ tɛbla kĩĩ flee akũ. Litsa libuki lisĩ kĩ nkɛna?”"
"Jesus replied, “If you want to be perfect, go sell everything you own! Give the money to the poor, and you will have riches in heaven. Then come and be my follower.”","Yesu bi ye kĩ, “Ntɛ awɛ kĩ akpɔla ni, naa kanaanɔ nɔ akũ fɔtsa flee, kakɔa sika a kate ahiãfɔ, lɔkɔa aana akũ kana fɔtsa nɛ ode. Ke liti muniki kayaatomɔ yĩ.”"
"When the young man heard this, he went away sad, because he was very rich.","Kĩ opopo a nu fɔlɛtsa kĩĩ a, ɛdzakũ mɔ ayɔlɔhɔ, kitonɛkĩ edeĩ akũ fɔtsa beblebee."
"Jesus said to his disciples, “I tell you, it's terribly hard for rich people to get into the kingdom of heaven!","Adeke Yesu bi ye fɔtsa bakɔlɛnɛ a kĩ, “Mabi mi nɛ ɔnɔkɔali kamɛ kĩ fɔ́ana ɔsĩ paa fɔkpa osikani kĩ yaawo nɛ ode lɛgãkanyakɔ̃ a kamɛ."
"In fact, it's easier for a camel to go through the eye of a needle than for a rich person to get into God's kingdom.”",Mbuki mabi mi kĩ fɔadã bɔɛɛ fɔkpa ɔpɔnkɔ mɔ kanɛ mɔ lɔpɔ kĩ yaatsã ɔnɔbɔ̃ ɔkɛ kamɛ ɛnɛ́ kɛba kĩ osikani aawo nɛ Baguma lɛgãkanyakɔ̃ a kamɛ.”
"When the disciples heard this, they were greatly surprised and asked, “How can anyone ever be saved?”","Kĩ fɔtsa bakɔlɛnɛ a nu kalɛ kĩĩ a, akũ dzuli be, ade bivia kĩ, “Kekɔ̃ owei aapuli ɛna katɛ?”"
"Jesus looked straight at them and said, “There are some things people cannot do, but God can do anything.”","Yesu dã be kɛnanaana ade ɛlɛ kĩ, “Otidziwa lɛláapuli ɛkɛna fukĩĩ, lɛmɛ Baguma kɔ̃ apuli kakɛna lɛtsa nyɛ lɛtsa.”"
"Peter replied, “Remember, we have left everything to be your followers! What will we get?”","Ade Petro dzɛla odo ɛlɛ kĩ, “Dã kĩ bɔfɔnɛ boe fɔtsa flee awɛ bɔya butomɔ nɔ, litsa koũ aanya boe fude?”"
"Jesus answered: Yes, all of you have become my followers. And so in the future world, when the Son of Man sits on his glorious throne, I promise you will sit on twelve thrones to judge the twelve tribes of Israel.","Yesu bi be kĩ, “Mabi mi nɛ ɔnɔkɔali kamɛ kĩ ntɛ Otidziwa Obi a kɛna akũ edzi nɛ ye lɛgãkpo kpalɛwa a akũ nɛ katinya vɔɛ̃ a kamɛ ni, mi bati ewua-nviã a kĩ mitomɔ yĩ a lɛmɛ míadzi nɛ fɔgãkpo ewua-nviã akũ midzɛmɔ Israel futete ewua-nviã a."
All who have given up home or brothers and sisters or father and mother or children or land for me will be given,"Ade odi nyɛ odi kĩ ɛfɔnɛ fɔla, bawaɛ̃nyole, ĩye bawaɛ̃tsole, balɛga ĩye bama ĩye babi, ĩye fɔba biyi nɛ yĩ sũ ni, Baguma aakpa ye foe titi ɔha mɔ nkpã kĩ ɛla kawũna a."
"As Jesus was telling what the kingdom of heaven would be like, he said: Early one morning a man went out to hire some workers for his vineyard.",“Ode lɛgãkanyakɔ̃ a la ndɛ okuani odi kĩ eyidza mɔ ɔnɔnɛ tutuutu ɛnabɔɛ apaafɔ badi kĩ bɛyaakɛna adzuma bɛkpa ye nɛ ye waĩ kɔba kamɛ.
"After he had agreed to pay them the usual amount for a day's work, he sent them off to his vineyard.","Bɛmɔ apaafɔ a bɛnya kɔya, etunɔ kĩ yaase be sika ovoe sɔmɔa sɔmɔa kĩ fɔnyɛ luwi mɔa kɔtɔkase, ade edo be nɛ ye waĩ kɔba a kamɛ a."
"About nine that morning, the man saw some other people standing in the market with nothing to do.","“Kĩ ɔnɔnɛ tɔdɔũ evedi bɔa a, onyole a buki ɛnɛ ɛnaa kɔya ade ɛnamɔ banyole badi kĩ bɛdzɛ̃, kĩ bɛlá adzuma kɛnawa adima."
"He promised to pay them what was fair, if they would work in his vineyard.","Foesũ ebi be kĩ, ‘Mi malo minaakɛna adzuma nɛ yĩ waĩ kɔba kamɛ, maase mi kɔtɔ kĩ kɛfɛta a.’"
So they went. At noon and again about three in the afternoon he returned to the market. And each time he made the same agreement with others who were loafing around with nothing to do.,Ade bɛnaa kɔba a. “Ebuki ɛnɛ nɛ tɔdɔũ ewua-nviã mɔ olobe tɔdɔũ ɛlalɛ kamɛ ɛnakɛna ndɛ fɔtɔnyade a.
"Finally, about five in the afternoon the man went back and found some others standing there. He asked them, “Why have you been standing here all day long doing nothing?”","Kĩ tɔdɔũ elo anaa kabɔakɔ̃ a, ɛnaa kɔya ɛnamɔ banyole bɛbã kĩ bɛdzɛ̃ pupulidza. Evia be kĩ, ‘Nde sũ midzɛ̃ nɛ awĩ luwi a flee kĩ miákɛna lɛtsama?’"
"“Because no one has hired us,” they answered. Then he told them to go work in his vineyard.","“Bɛkpa ye mbuayɛ kĩ, ‘Odima tábɔɛ boe kĩ bɔkɛna adzuma bɔkpa ye.’ “Foesũ ebi be kĩ, ‘Ntɛ aye ni, mi malo minaakɛna adzuma nɛ yĩ kɔba a kamɛ.’"
That evening the owner of the vineyard told the man in charge of the workers to call them in and give them their money. He also told the man to begin with the ones who were hired last.,"“Kĩ olobe wo ɔtɔ a, kɔba ɔlate a bi ye adzuma akũ ɔdãmɛnanɛ a kĩ, ‘Vɛ adzuma bakɛnanɛ a kase be kɔtɔ, kayi kayɔ katomɛna bikĩ bɛya nkaɛ a akũ kanaawũna nɛ batɔnyade a akũ.’"
"When the workers arrived, the ones who had been hired at five in the afternoon were given a full day's pay.",“Bikĩ biyi adzuma kayɔ nɛ olobe tɔdɔũ elo kamɛ a kamɛ odi nyɛ odi tɛ sika ovoe sɔmɔa sɔmɔa.
they began complaining to the owner of the vineyard.,"Kĩ bɛtɛ be sika a biyua a, bɛna kalɔkpa bɛkakɛna hũhũhũhũ nɛ ɔlate a akũ."
"They said, “The ones who were hired last worked for only one hour. But you paid them the same that you did us. And we worked in the hot sun all day long!”","Ade bɛlɛ kĩ, ‘Bati a kĩ ɔbɔɛ nkaɛ a kɛna adzuma dɔũhuilɛ mɔapɛ, ade boe kɔ̃ bɔdza nɛ suwa kpaa kamɛ luwi a flee bɔkɛna adzuma a, lɛmɛ ose boe flee kɔtɔ tsɛtsɛɛ!’"
"The owner answered one of them, “Friend, I didn't cheat you. I paid you exactly what we agreed on.","“Kɔba ɔlate a kpa be kamɛ ɔmɔa mbuayɛ kĩ, ‘Ɔkɔba, dã ntásisi nɔ. Nnɛ́ sika ovoe sɔmɔa akũ bɔnya kɔya?"
Take your money now and go! What business is it of yours if I want to pay them the same that I paid you?,Kɔa nɔ kɔtɔkase kanaa kɔla. Yĩ lɛwɛ kĩ mase bati nkaɛ kĩĩ kɔtɔ ndɛ ayekĩ nse nɔ a.
"Don't I have the right to do what I want with my own money? Why should you be jealous, if I want to be generous?”",Ndeĩ osi kĩ makɛna yĩ sika akũ adzuma ndɛ ayekĩ mawɛ. Mbɔɛɛ ayekĩ nkɛna sɛmɛ kalɛ a sũ anɛ abɛɛlɛ nɔ?’ ”
"Jesus then said, “So it is. Everyone who is now last will be first, and everyone who is first will be last.” Jesus Again Tells about His Death (Mark","Ade Yesu wũna kĩ, “Foesũ bati a kĩ bɛkpa liti a, aadani batɔnyade, ade bikĩ bɛnyaa lɔtɔ a aadani batide a.” Yesu Lɛ Kɔdzɛla Lɛlalɛde Nɛ Ye Wuda Akũ."
"When Jesus heard them, he stopped and asked, “What do you want me to do for you?”","Yesu fɔ̃ ɛdza ɛvɛ be kĩ bɛya nɛ ye sɛkɛ̃. Evia be kĩ, “Litsa miawɛ kĩ nkɛna nkpa mi?”"
"Jesus felt sorry for them and touched their eyes. At once they could see, and they became his followers.","Be akũ kɔ Yesu kɔnya, ade ɛkɔa awɛ ɛta be banebi a. Deedimɔapɛ be anɛ binya bɛmɔ́ fɔkɔ ade bitomɔ ye a."
"The crowd told them to be quiet, but they shouted even louder, “Lord and Son of David, have pity on us!”","Bati kɔdabu a wũni nɛ be akũ kĩ bɛfɔ̃ fɔwɔla kabɔa, lɛmɛ bɛbɔa fɔwɔla a kɔɔba bɛba bɛlɛ kĩ, “Boe Ɔlate, Dawid Obi, mɔ́ boe kɔnya ni!”"
"As Jesus was on his way to Jerusalem, he took his twelve disciples aside and told them in private:","Kĩ Yesu yɛlɛ yanaa Yerusalem a, ɛvɛ ye fɔtsa bakɔlɛnɛ ewua-nviã a nɛ ɔɔwɛ̃,"
and then they will hand him over to foreigners who will make fun of him. They will beat him and nail him to a cross. But on the third day he will rise from death. A Mother's Request (Mark,"bɛkɔa ye bido bikĩ bɛnyɛ́ Yudafɔ a nɛ awɛ kĩ bidi ye nsekuo. Baabo ye, ke liti baabɔa ye nɛ asendua akũ, lɛmɛ nɛ luwi lɛlalɛde akũ a, Baguma aadzɛla ye edzi nkpã.” Obima Odi Yakɔa Ye Kawɛ Eyi Nɛ Yesu Anɛ."
The mother of James and John came to Jesus with her two sons. She knelt down and started begging him to do something for her.,"Adeke Zebedeo ɔtsɔ̃ kpã ye babinyole nviã ɛyamɛna nɛ Yesu sɛkɛ̃, ɛyake aduli nɛ ye anɛ kamɛ evia kabumɛna a."
"Jesus asked her what she wanted, and she said, “When you come into your kingdom, please let one of my sons sit at your right side and the other at your left.”","Yesu via ye kĩ, “Litsa awɛ?” Otsole a kpa mbuayɛ kĩ, “Kpa yĩ bɔhɛ kĩ aafɔ̃ yĩ babinyole nviã kĩĩ kamɛ ɔmɔa lidzi nɛ nɔ sɔmɔna, ɔyade a lɛmɛ lidzi nɛ nɔ sɛba, nɛ nɔ lɛgãkanyakɔ̃ a.”"
"Jesus answered, “Not one of you knows what you are asking. Are you able to drink from the cup that I must soon drink from?” James and John said, “Yes, we are!”","Yesu kpa mbuayɛ kĩ, “Minyína lɛtsa a kĩ de milamɛna kavia a. Míapuli mimɔa lubo kamɔ kɔɔpu a kĩ maamɔa a?” Bɛkpa mbuayɛ kĩ, “Oo, bɔ́apuli.”"
"Jesus replied, “You certainly will drink from my cup! But it isn't for me to say who will sit at my right side and at my left. This is for my Father to say.”","Ade Yesu bi be kĩ, “Ɔnɔkɔali fɔanɛ kĩ míapuli mimɔa foe, lɛmɛ nlá osi kĩ manyɛ oti a kĩ ye aadzi nɛ yĩ sɔmɔna ĩye yĩ sɛba. Fudzikɔ̃ a na nyɛ bikĩ Nda manɛ foe eyi a fude.”"
"When the ten other disciples heard this, they were angry with the two brothers.","Kĩ fɔtsa bakɔlɛnɛ nkaɛ ewua a nu fɔlɛtsa kĩĩ a, bɛna kalɔkpa nɛ bawaɛ̃ nviã a akũ."
But Jesus called the disciples together and said: You know foreign rulers like to order their people around. And their great leaders have full power over everyone they rule.,"Foesũ Yesu vɛ be flee ɛkpɔta ade ebi be kĩ, “Minyina kĩ fɔgã a kĩ fɔanya amamufɔ akũ a deĩ kɔbɛ̃ nɛ be akũ, ade be banɔkɔɛ̃ lɛmɛ deĩ otumi baũ a nɛ be akũ a."
"But don't act like them. If you want to be great, you must be the servant of all the others.","Lɛmɛ kɛtánɛ kĩ fɔana lɔmɔ nɛ mi kamɛ. Ntɛ mi kamɛ odi awɛ kĩ yanya ɔnɔkɔɛ̃ ni, kɛnɛ kĩ ɛnya mi ɔsumunɛ."
"And if you want to be first, you must be the slave of the rest.","Ade ayea ntɛ mi kamɛ odi awɛ kĩ yanya ɔtɔnyade ni, kɛnɛ kĩ ɛnya mi ɔsumunɛ,"
"The Son of Man did not come to be a slave master, but a slave who will give his life to rescue many people. Jesus Heals Two Blind Men (Mark","ndɛ Otidziwa Obi a kĩ ɛtáya kĩ bisum ye, mbom kĩ yaasum ɛkɔa ye nkpã ɛkpa ɛnyɛ bati pii.” Yesu Tsa Banɛkunɛ Nviã."
Jesus was followed by a large crowd as he and his disciples were leaving Jericho.,"Kĩ Yesu mɔ ye fɔtsa bakɔlɛnɛ a nɛ́ bito Yeriko ɔmatɔ a kamɛ banaa ni, bati kɔdabu baũ tomɔ be."
"Two blind men were sitting beside the road. And when they heard that Jesus was coming their way, they shouted, “Lord and Son of David, have pity on us!”","Banɛkunɛ nviã kĩ bidzi nɛ osi ɔɔwɛ̃ nu kĩ Yesu yaatɛ̃, foesũ biyi fɔwɔla kabɔa kayɔ kĩ, “Lɛgã Dawid Obi, mɔ́ boe kɔnya!”"
"They answered, “Lord, we want to see!”","Bɛkpa ye mbuayɛ kĩ, “Ɔnɔkɔɛ̃, fɔ̃ boe anɛ ebinya.”"
"Jesus said: I will tell you a story about a man who had two sons. Then you can tell me what you think. The father went to the older son and said, “Go work in the vineyard today!”","“Nde mikɔna nɛ kalɛ kĩĩ akũ? Onyole odi deĩ babinyole nviã. Ɛnaa ɔnɔkɔɛ̃de a sɛkɛ̃ ebi ye kĩ, ‘Yĩ obi, naa yĩ waĩ kɔba kamɛ nviã kanaakɛna adzuma kakpa yĩ.’"
"But when they saw the man's son, they said, “Someday he will own the vineyard. Let's kill him! Then we can have it all for ourselves.”","“Lɛmɛ kĩ kɔba akũ badãmɛnanɛ a mɔ́ obi a, bibi akũ kĩ, ‘Ade fɔtsa ɔnyanɛ a nɛ awĩ a. Miya bɔkɔ ye, ye adzapadiɛ a ɛdani boe ade.’"
"If anyone asks why you are doing this, just say, ‘The Lord needs them.’ He will at once let you have the donkeys.”","Ntɛ odi via mi kadi ni, milɛ kĩ, ‘Boe Ɔlate a sĩ be,’ lɔkɔa yaafɔnɛ be awɛ ɛkpa mi lɛtalɛta.”"
"So God's promise came true, just as the prophet had said,","Bɛkɛna fukĩĩ ayekĩ fɔlɛtsa a kĩ Baguma onukpɛ̃ ɔnyɛnɛ lɛ eyi a aaya nɛ foe kamɛ kĩ,"
“Announce to the people of Jerusalem: ‘Your king is coming to you! He is humble and rides on a donkey. He comes on the colt of a donkey.’ ”,"“Bi Zion ɔmatɔ a kĩ, ‘Dã kĩ nɔ lɛgã aya nɛ nɔ sɛkɛ̃! Ɛdɔla ye akũ, edzi nɛ aflimu mɔ obi akũ yaya.’ ”"
The disciples left and did what Jesus had told them to do.,Ade fɔtsa bakɔlɛnɛ a naa bɛnakɛna ndɛ ayekĩ Yesu bi be kĩ bɛkɛna a.
They brought the donkey and its colt and laid some clothes on their backs. Then Jesus got on.,"Bɛkpã aflimu mɔ obi a bɛyamɛna, bɛkɔa be tilima bɛtɛɛtɛɛ nɛ be akũ ade Yesu de edzi a."
"When Jesus came to Jerusalem, everyone in the city was excited and asked, “Who can this be?”","Kĩ Yesu wo nɛ Yerusalem ɔmatɔ a kamɛ a, ɔmatɔ a flee bɔa obũ, ade bati via kĩ, “Owei nɛ awĩ a?”"
But the chief priests and the teachers of the Law of Moses were angry when they saw his miracles and heard the children shouting praises to the Son of David.,"Kĩ basɔfɔnɔkɔɛ̃ mɔ mbla batsanɛ a mɔ́ awãwã fɔtsa a kĩ ɛkɛna a, mɔ ayekĩ babisɛ̃ kabɔa fɔwɔla nɛ Asɔli Kɔla a kamɛ kĩ, “Mitu osee nɛ Lɛgã Dawid Obinyole a akũ!” a ni, bɛna kalɔkpa paa."
"When the chief priests and the Pharisees heard these stories, they knew Jesus was talking about them.","Kĩ basɔfɔnɔkɔɛ̃ mɔ Farisifɔ a nu Yesu fɔgbã kĩĩ a, bɛmɔ́ kĩ be akũ fɔlɛtsa ɛkalɛ,"
"He told them, “The Scriptures say, ‘My house should be called a place of worship.’ But you have turned it into a place where robbers hide.”","ade ebi be kĩ, “Bɛtsɛlɛ nɛ Katsɛlɛ Kpalɛwa a kamɛ kĩ Baguma lɛ kĩ, ‘Baavɛ Yĩ Asɔli Kɔla a kĩ mpaɛ kabɔakɔ̃’ lɛmɛ mi kɔ̃ mikɔa koe mikɛna bayekpanɛ kabɛlakɔ̃!”"
"If you have faith when you pray, you will be given whatever you ask for.” A Question about Jesus' Authority (Mark","Ntɛ mideĩ katɛkado ni, lɛtsa nyɛ lɛtsa kĩ míavia nɛ mpaɛbɔ kamɛ ni, míana foe.” Bati Via Yesu Awã Kĩ Etomɛna Ye Otumi."
"The men said to Jesus, “Don't you hear what those children are saying?” “Yes, I do!” Jesus answered. “Don't you know that the Scriptures say, ‘Children and infants will sing praises’?”","Foesũ bivia Yesu nɛ kalɔkpa kamɛ kĩ, “Anu lɛtsa a kĩ bɛlamɛna kalɛ a?” Ade Yesu kpa be mbuayɛ kĩ, “Oo, manu. Mbɔɛɛ mitákã tɔ̃ nɛ Katsɛlɛ Kpalɛwa a kamɛ kĩ, ‘Babisɛ̃ mɔ bakɔkɔa onukpɛ̃ kamɛ kamu kĩ kɛkpɔla anɛ kato’ a?”"
"Then Jesus left the city and went out to the village of Bethany, where he spent the night. Jesus Puts a Curse on a Fig Tree (Mark","Ke liti a, Yesu dzakũ ɛfɔnɛ be, ɛnɛ nɛ ɔmatɔ a kamɛ ade ɛnaa Betania ɛnawa nɛ awã a. Yesu Dumu Kutse Kudi Kĩ Kɔtáwũ Babi."
"Jesus answered, “I have just one question to ask you. If you answer it, I will tell you where I got the right to do these things.","Yesu kpa be mbuayɛ kĩ, “Maavia mi kalɛ mɔapɛ ade ntɛ mikpa yĩ ke mbuayɛ ni, maabi mi otumi a kĩ nnɛɛ nkɔa makɛna fɔtsa kĩĩ."
"When Jesus got up the next morning, he was hungry. He started out for the city,","Nɛ kadekanyina ɔnɔnɛ a, kĩ emuniki yanaa ɔmatɔ a kamɛ a, kɔlɛ kɔ ye."
"But Jesus said to them, “If you have faith and don't doubt, I promise you can do what I did to this tree. And you will be able to do even more. You can tell this mountain to get up and jump into the sea, and it will.","Ade Yesu kpa be mbuayɛ kĩ, “Mabi mi pipiipi kĩ ntɛ mitɛ mido, mɔ mitátɛ atsindze ni, míapuli mikɛna lɛtsa a kĩ nkɛna kutse kĩĩ. Nnɛ́ fukĩĩ odi malo, míapuli mibi ɔtɔ kĩĩ kĩ, ‘Bɔlɛ kanaatɔ nɛ mpo kamɛ,’ ade yaabɔlɛ a."
"So they told Jesus, “We don't know.” Jesus said, “Then I won't tell you who gave me the right to do what I do.” A Story about Two Sons","Foesũ bɛkpa Yesu mbuayɛ kĩ, “Bunyína.” Ade Yesu lɛmɛ bi be kĩ, “Kekɔ̃ yĩ malo nláabi mi awã kĩ ntomɛna otumi nnɛɛ makɛna fɔtsa kĩĩ.” Yesu Bɔa Lɛgbã Nɛ Babinyole Nviã Badi Akũ."
Jesus told the chief priests and leaders to listen to this story: A land owner once planted a vineyard. He built a wall around it and dug a pit to crush the grapes in. He also built a lookout tower. Then he rented out his vineyard and left the country.,"Yesu bi be kĩ, “Mitse lɛgbã bɛbã lidi lɛmɛ. Kɔba ɔnɛnɛ odi nɛ́ waĩ kɔba, ade edzi kɔbã emini koe a. Ɛnyɛ lɛkɛ ɛkpa waĩ mui a kakã kako, ade eke kɔla geĩ kĩ oti aana nɛ awã ɛkadã kɔba a akũ. Ke liti ɛkɔa kɔba a edo nɛ waĩ kɔba banɛnɛ awɛ ɛdzakũ ɛnaa osi akũ."
"Jesus had gone into the temple and was teaching when the chief priests and the leaders of the people came up to him. They asked, “What right do you have to do these things? Who gave you this authority?”","Kĩ Yesu muniki ɛya nɛ Asɔli Kɔla kamɛ ɛkatsa fɔtsa a, basɔfɔnɔkɔɛ̃ mɔ ɔmaĩ banɔkɔɛ̃ ya nɛ ye sɛkɛ̃ bivia ye kĩ, “Otumi ɔdabe ɔnɛɛ akɛna fɔtsa kĩĩ bamɛ? Owei lɛkpa nɔ osi a?”"
"Who gave John the right to baptize? Was it God in heaven or merely some human being?” They thought it over and said to each other, “We can't say God gave John this right. Jesus will ask us why we didn't believe John.","Owei sɛkɛ̃ Yohanes tɛ otumi etomɛna mɔ ɛwɔla bati mui? Baguma sɛkɛ̃ ɛtɛ ye etomɛna mbɔɛɛ kĩ batidziwa sɛkɛ̃?” Ade bido foe kamɛ kasa awɛ nɛ be kamɛ kĩ, “Litsa bɔ́alɛ? Ntɛ bɔlɛ kĩ, ‘Eto Baguma sɛkɛ̃’ ni, yaavia boe kĩ, ‘Mɔ nde sũ mitátɛ Yohanes mido?’"
"On the other hand, these people think John was a prophet, and we are afraid of what they might do to us. That's why we can't say it was merely some human who gave John the right to baptize.”","Ade ntɛ bɔlɛ kĩ, ‘Eto bati sɛkɛ̃’ ni, bɔavila lɛtsa a kĩ bati a aakɛna, kitonɛkĩ be flee bɛtɛ bido kĩ Yohanes nyɛ Baguma onukpɛ̃ ɔnyɛnɛ.”"
"His son told him he would not do it, but later he changed his mind and went.","“Ye obi a kpa mbuayɛ kĩ, ‘Nláanaa,’ lɛmɛ ke liti a, fuwo ye kalɔɛ ade ɛnaa kɔba a."
"The man then told his younger son to go work in the vineyard. The boy said he would, but he didn't go.","“Ɔlɛga a naa obi ɔyade a sɛkɛ̃ ebi ye kalɛ mɔapɛ a. Ɛkpa mbuayɛ kĩ, ‘Awoo, papa maanaa,’ lɛmɛ ɛtánaa."
"Which one of the sons obeyed his father? “The older one,” the chief priests and leaders answered. Then Jesus told them: You can be sure tax collectors and prostitutes will get into the kingdom of God before you ever will!","“Bati nviã kĩĩ kamɛ ɔɔdabe lɛkɛna nɛ ɔlɛga a kawɛ akũ?” Bɛkpa mbuayɛ kĩ, “Ɔnɔkɔɛ̃de a.” Ade Yesu bi be kĩ, “Mabi mi nɛ ɔnɔkɔali kamɛ kĩ tɔgɔlɛ batɛnɛ mɔ adɔpaafɔ nya mi lɔtɔ bɛnaa nɛ Baguma lɛgãkanyakɔ̃ a kamɛ."
"When John the Baptist showed you how to do right, you would not believe him. But these evil people did believe. And even when you saw what they did, you still would not change your minds and believe. Renters of a Vineyard (Mark","Kitonɛkĩ kĩ Yohanes Mui Ɔwɔlanɛ a ya kĩ yatsa mi osi wĩ a kĩ míatsã midzi nkpã a, mitátɛ ye mido. Mbom tɔgɔlɛ batɛnɛ mɔ adɔpaafɔ kɔ̃ tɛ ye bido. Ade titɔ kĩ mimɔ́ fukĩĩ malo ni, ke liti a mitádani adzuni mitɛ ye mido.” Yesu Bɔa Lɛgbã Nɛ Waĩ Kɔba Akũ Badãmɛnanɛ a Akũ."
"When it was harvest time, the owner sent some servants to get his share of the grapes.","Kĩ kutse babi a kana a wo ɔtɔ a, edo ye basumunɛ nɛ waĩ kɔba banɛnɛ a sɛkɛ̃ kĩ bɛnaatɛ ye kanyakɔ̃ bɛma ye."
"But the renters grabbed those servants. They beat up one, killed one, and stoned one of them to death.","“Kɔba akũ badãmɛnanɛ a pi ye basumunɛ a, bibo ɔmɔa, bɛkɔ ɔbɛbã ade bɛtalɛ ɔlalɛde a boe a."
He then sent more servants than he did the first time. But the renters treated them in the same way.,"Ke liti a, kɔba ɔlate a buki edo basumunɛ bɛbã kĩ bɛpɔnɛ bɛbɛ̃ batɔnyade a, lɛmɛ kɔba akũ badãmɛnanɛ a kɛna be lɛtsa mɔapɛ a."
"Finally, the owner sent his own son to the renters, because he thought they would respect him.","Nɛ foe kawũna kamɛ a, edo ye obi nɛ be sɛkɛ̃, ɛlɛ kĩ, ‘Matɛ kado kĩ baanyɔã yĩ obi.’"
"So they grabbed him, threw him out of the vineyard, and killed him.","Foesũ bipi ye bɛvɛlɛ bɛnɛmɛna nɛ kɔba a kamɛ, ade bɛkɔ ye a.”"
"Jesus asked, “When the owner of that vineyard comes, what do you suppose he will do to those renters?”","Yesu via kĩ, “Finyaa, ntɛ waĩ kɔba ɔlate a ya ni, litsa yaakɛna kɔba akũ badãmɛnanɛ kĩĩ a?”"
"The chief priests and leaders answered, “He will kill them in some horrible way. Then he will rent out his vineyard to people who will give him his share of grapes at harvest time.”","Bɛkpa ye mbuayɛ kĩ, “Nɛ ɔnɔkɔali kamɛ ni, yaawɔla bati kpa a na, lɔkɔa ɛkɔa kɔba a edo nɛ kɔba akũ badãmɛnanɛ bɛbã awɛ, bikĩ baakɔa ye kanyakɔ̃ bɛma ye nɛ fudutsa kakpɔta lɔkɔ kamɛ pɛpɛɛpɛ.”"
"Jesus replied, “You surely know that the Scriptures say, ‘The stone the builders tossed aside is now the most important stone of all. This is something the Lord has done, and it is amazing to us.’","Ade Yesu bi be kĩ, “Mitákã tɔ̃ lɛtsa a kĩ Katsɛlɛ Kpalɛwa a lɛ a? ‘De a kĩ fɔla bakenɛ sĩ a, ade de lɛdani kɔla akũ de titiliwu a. Boe Ɔlate a lɛkɛna fukĩĩ. Fɔkɛna boe wãwã!’ ”"
I tell you God's kingdom will be taken from you and given to people who will do what he demands.,"Yesu lɛ ebu kĩ, “Foesũ mabi mi kĩ, baatɛ Baguma lɛgãkanyakɔ̃ a nɛ mi awɛ bɛkɔa bɛkpa kade a kĩ kaawũ babi wĩ a."
"Anyone who stumbles over this stone will be crushed, and anyone it falls on will be smashed to pieces.”","Odi nyɛ odi kĩ yaanɛ ɛtɔ nɛ de kĩĩ akũ ni, yaaveli gblɛgblɛgblɛ, lɛmɛ owula kĩ ye akũ laaatɔ ni, laabubuli ye kpɛtɛkpɛtɛkpɛtɛ.”"
"So they looked for a way to arrest Jesus. But they were afraid to, because the people thought he was a prophet.","foesũ bɛwɛ kĩ bapi ye. Lɛmɛ bivila bati kɔdabu a, kitonɛkĩ bati a bu Yesu ndɛ Baguma onukpɛ̃ ɔnyɛnɛ aye."
"Many are invited, but only a few are chosen. Paying Taxes (Mark","Yesu wũna kĩ, “Bati beblebee bavɛ, lɛmɛ be sukuloomɛ bapau.” Bivia Yesu Kalɛ Nɛ Abãã Ɔgɔlɛ Kase Akũ."
The Pharisees got together and planned how they could trick Jesus into saying something wrong.,"Farisifɔ a nanaa adzina ayekĩ banaĩ Yesu bɛtsãmɛna fɔlɛtsa kavia kamɛ, bɛna ye nɛ ye kɔdzɛla kalɛ kamɛ."
"Teacher, Moses wrote that if a married man dies and has no children, his brother should marry the widow. Their first son would then be thought of as the son of the dead brother.","kĩ, “Fɔtsa Ɔtsanɛ, Mose bi boe kĩ ntɛ onyole odi kĩ ɛtáma ku ni, kɛnɛ kĩ ɔwaɛ̃nyole ɛkɔã okunawa a lɔkɔa bɛma bido ye lɔlɔ."
Once again Jesus used stories to teach the people:,"Yesu buki ɛlɛ kɔdzɛla mɔ be nɛ fɔgbã kamɛ kĩ,"
The kingdom of heaven is like what happened when a king gave a wedding banquet for his son.,“Baguma lɛgãkanyakɔ̃ a la ndɛ fukĩĩ. Lɛgã lidi te opunu ɛkpa obinyole nɛ ye obolitsɔ̃ kapi luwi akũ.
"The king sent some servants to tell the invited guests to come to the banquet, but the guests refused.","Lɛmɛ kĩ edo ye basumunɛ kĩ bɛnaavɛ bati a kĩ ɛkpa kanyi a kĩ bɛya nɛ kanyakɔ̃, bisĩ kaya."
