ref,text
"Later, Jesus and his disciples were having dinner at Matthew's house. Many tax collectors and other sinners were also there.","Yisa die dɩ gana Matiwo tigiri a ga die nyindiikehe, mi lampotuosiriŋ pam aŋaŋ vuodiekemba dɩ kana a ka dɩ Juu vuosi mɩraha die dɩ keŋ a gʋtɩ Yisa aŋaŋ ʋ kʋaŋandɩɩsɩrɩba ma ma a die aŋaŋ ba."
"Some Pharisees asked Jesus' disciples, “Why does your teacher eat with tax collectors and other sinners?”","Farasisi bataŋ die dɩ yene die wo die ba pɩasɩ Yisa kʋaŋandɩɩsɩrɩba dɩ, “Bɩa yine nɩ dɩdagɩrʋ wa dɩ die aŋaŋ vuosi gie?”"
"While Jesus was still speaking, an official came and knelt in front of him. The man said, “My daughter has just now died! Please come and place your hand on her. Then she will live again.”","Yisa die dɩ balala naa ta die Juu vuosi jakʋʋŋ wʋnyɩ die dɩ keŋ a gbirigi ʋ nɩŋŋa a baarɩ, “Lele n havʋʋbiŋ dɩ kpi ama keŋ a nagɩ fʋ nuuŋ a dɩɩsɩ ʋ sikpeŋ aŋ ʋ hagɩ.”"
"Jesus turned. He saw the woman and said, “Don't worry! You are now healed because of your faith.” At that moment she was healed.","Yisa die dɩ yiŋŋi a ye wo ta baarɩ, “N lɩa, vaa fʋ sʋŋ dʋa, fʋ yada gbaanna fʋ.” Saŋka mi gbaŋ gbaŋ hɔgʋ wa die dɩ ye alaafɩa. Yisa die dɩ vana havʋʋbike dɩ hagɩ kuŋ me dene"
"After Jesus had forced the demon out, the man started talking. The crowds were so amazed they began saying, “Nothing like this has ever happened in Israel!”","Yisa die dɩ yagɩ jɩmbɩakʋ a nyɩŋ daa wa ma, die ʋ wa bɩagɩ bala wɩa. Die dɩ paalɩ a yi vuoŋ mana mana mamachi ba baarɩ, “Tɩ ye ka ye mamachi ka gie chanchaaŋ Izara vuosi tɩŋ ma ma.”"
"Some followers of John the Baptist came and asked Jesus, “Why do we and the Pharisees often go without eating, while your disciples never do?”","Womi Jɔɔn vuodieke die dɩ sɩnana vuosi Ŋmɩŋ nyaabʋ kʋaŋandɩɩsɩrɩba die dɩ keŋ Yisa jigiŋ a pɩasɩ wa dɩ, “Bɩa yine tɩnɩŋ aŋaŋ Farasisi dɩ bɔba nʋaŋ saŋŋa mana ama ta fʋ kʋaŋandɩɩsɩrɩba ka wɔŋ a bɔba?”"
Jesus answered: The friends of a bridegroom aren't sad while he is still with them. But the time will come when he will be taken from them. Then they will go without eating.,"Yisa die dɩ yiŋŋi a pɩasɩ ba dɩ, “Nɩ tɩŋ yaala chaaŋ diekemba dɩ gana hɔgʋ faarɩŋ bemme aŋaŋ sʋgɩchʋʋsɩŋ saŋŋa dieke ba ŋaaŋ hɔgʋ wa tieŋ dɩ lagɩsɩna a beri wo? Die kaaŋ bɩagɩ a yi. Ama saŋŋa nan keŋ ba nan nagɩ hɔgʋ wa tieŋ a nyɩŋ ba jigiŋ, saŋka mi ba nan wa bɔbɩ nʋaŋ."
No one uses a new piece of cloth to patch old clothes. The patch would shrink and tear a bigger hole.,"“Vuoŋ kaaŋ saagɩ a nagɩ garɩhaalɩŋ garɩchɔɔtɩŋ a baalɩ a ligi garɩkʋʋŋ vɔrɩŋ, dama garɩhaalɩkʋ gie nan chɩɩrɩ ta vaa garɩkʋʋrɩ, aŋ ka vɔrɩkʋ wa a faasɩ a dalɩma."
"She had said to herself, “If I can just touch his clothes, I will be healed.”","Die ʋ yile ʋ sʋŋ ma, “Maŋ gbi ʋ jayeekiri, n nan ye gbaanɩŋ.”"
A woman who had been bleeding for twelve years came up behind Jesus and barely touched his clothes.,Hɔgʋ wʋnyɩ zɩŋ die dɩ nyɩna ʋ nyɩŋgbanɩŋ ma dee bɩna baŋ aŋaŋ ale; die dɩ dɩ Yisa kʋaŋ a die a gbi Yisa jayeekiri kʋanʋaŋ.
"When Jesus went into the home of the official and saw the musicians and the crowd of mourners,","Ta die Yisa die dɩ wana a ga jakʋʋrɩ tigiri, a ye hanye chɩarɩba aŋaŋ vuodiekemba dɩ kʋnnana kumbu,"
"he said, “Get out of here! The little girl isn't dead. She is just asleep.” Everyone started laughing at Jesus.","die ʋ baarɩ “Vuoŋ mana tɩaŋ a nyɩŋ. Havʋʋbike ka kpiye, ʋ ta ko a gʋʋra mɩŋ.” Die vuosi mana die dɩ dɔŋ laatɩ a laa wa."
"But after the crowd had been sent out of the house, Jesus went to the girl's bedside. He took her by the hand and helped her up.","Die daadamba dɩ wana a nyɩŋ yenni me wo, Yisa die dɩ ga a juu havʋʋbike dɩ dʋana jigidieke a yigi ʋ nuuŋ me die ʋ hagɩ a zie."
"After Jesus had gone indoors, the two blind men came up to him. He asked them, “Do you believe I can make you well?” “Yes, Lord,” they answered.","Die Yisa die dɩ gana a ga a juu juoŋ kaanɩ yɩɩsɩ bale wo die dɩ keŋ ʋ jigiŋ, die ʋ pɩasɩ ba, “Nɩ tuo a dii dɩ n nan bɩagɩ yi naa?” Ta ba baarɩ, “Tɩ Yɔmʋtieŋ, wa.”"
"Jesus touched their eyes and said, “Because of your faith, you will be healed.”","Die wɩa ʋ nagɩ ʋ nuusi a gbi gbi ba nine ta baarɩ, “Nɩ tuone a dii die wo ka yi a yɩ nɩ.”"
"They were able to see, and Jesus strictly warned them not to tell anyone about him.","Die ba ninehe die dɩ yuori. Yisa die dɩ kpaaŋ ba aŋaŋ nɩŋŋmɩna dɩ, “Nɩ da keŋ a balɩ a yɩ vuoŋ.”"
But they left and talked about him to everyone in that part of the country. Jesus Heals a Man Who Could Not Talk,Ama die ba nyɩŋ a mʋʋlɩ Yisa wɩa tɩka mana ma. Yisa die dɩ gbaanna dembiŋ dieke dɩ kana ka bɩagɩ bala wɩa dene
"But the Pharisees said, “The leader of the demons gives him the power to force out demons.” Jesus Has Pity on People","Ama ta die Farasisi mba die dɩ baarɩ, “Jɩmbɩatɩtɩ naaŋ wa yɩnana wa hagɩrɩbʋ ʋ bɩagɩ yaga jɩmbɩatɩ.” Yisa die dɩ chɩgɩna vuosisi zɔɔlɩŋ dene"
Jesus went to every town and village. He taught in their synagogues and preached the good news about God's kingdom. Jesus also healed every kind of disease and sickness.,"Yisa die dɩ dɩa ga tɩgɩkpɩɩma aŋaŋ tɩŋkpaŋŋɩsɩ mana mana, a die a ga Ŋmɩŋ jɩamɩŋ juone me a daga Ŋmɩŋ naarɩ wʋvɩɩna a yɩa vuosi ta gbaama yʋagɩtɩ yiri yiri mana."
