Title,Content,URL
GYENESIS 24,"Wɔhwehwɛ yerɛ ma Isak
1 Na Abraham abɔ akɔkoraa, na wadi nna pii, na AWURADE ahyira no ade nyinaa mu. 2 Na Abraham ka kyerɛɛ ne fie asomfoɔ mu panin a ɔhwɛ deɛ ɔwɔ nyinaa soɔ sɛ: Fa wo nsa ka m’asene mu, 3 na mɛma woaka AWURADE, ɔsoro Nyankopɔn ne asase Nyankopɔn, ntam sɛ worenware Kanaanfoɔ a mete wɔn mu yi mmammaa mu bi mma me ba. 4Na kɔ me kuro ne m’abusua mu kɔware yerɛ ma me ba Isak. 5Na ɔsomfoɔ no ka kyerɛɛ no sɛ: Ebia ɔbaa no rempɛ sɛ ɔbɛdi m’akyiri aba asase yi soɔ; ɛnneɛ memfa wo ba no mensane menkɔ asase a wofiri so baeɛ no so anaa? 6Na Abraham ka kyerɛɛ no sɛ: Hwɛ yie, na woamfa me ba ansane ankɔ hɔ bio. 7 AWURADE, ɔsoro Nyankopɔn a ɔfaa me firii m’agya fie ne asase a wɔwoo me wɔ soɔ no so, na ɔne me kasaeɛ, na ɔkaa ntam kyerɛɛ me sɛ: W’asefoɔ na mede asase yi bɛma wɔn no, ɔbɛsoma ne bɔfoɔ adi w’anim, na woakɔware yerɛ afiri hɔ abrɛ me ba. 8Na sɛ ɔbaa no mpɛ sɛ ɔdi w’akyiri a, ɛnneɛ wo ho afi me ntam yi mu, nanso mfa me ba nsane nkɔ hɔ bio. 9Na ɔsomfoɔ no de ne nsa kaa ne wura Abraham asene mu, na ɔkaa no ntam wɔ asɛm no ho.
10 Na ɔsomfoɔ no faa ne wura yoma mu du, na ɔkɔe, na ɔkura ne wura nnepa ahodoɔ nyinaa bi. Na ɔsɔre sii mu kɔɔ Mesopotamia, Nahor kuro mu. 11Na ɔmaa ne yoma no butuu kuro no kurotia wɔ asubura bi ho anwummerɛ a mmaa bɛsa nsuo.
12Na ɔbɔɔ mpaeɛ sɛ: AWURADE, me wura Abraham Nyankopɔn, mesrɛ wo, ma no nsi me yie nnɛ, na yɛ me wura Abraham adɔeɛ. 13Hwɛ, meregyina asubura yi so ha; na kurom hɔfoɔ mmammaa bɛfiri abɛsa nsuo. 14Na ma no mmra sɛ ababaa a mɛse no sɛ: Soɛ w’ahina ma mennom nsuo no bi, na ɔbɛka sɛ: Nom, na mɛma wo yoma no anom bie no, ma ɔno ara nyɛ deɛ woayi no ama w’akoa Isak, na ɛno mu na mɛhunu sɛ woayɛ me wura adɔeɛ.
15 Na ɔnnya nwiee kasa no, hwɛ, Rebeka baeɛ a n’ahina si ne batiri so. Ɔyɛ Betuel a ɔyɛ Abraham ne nua Nahor yere Milka ba. 16Na ababaa no ho yɛ fɛ sɛ, ɔyɛ ɔbaabunu ɛfiri sɛ na ɔbarima biara nhunuu no da. Na ɔkɔɔ asubura no mu kɔhyɛɛ n’ahina ma, na ɔbae. 17Na ɔsomfoɔ no tuu mmirika kɔhyiaa no sɛ: Mesrɛ wo, ma mennom w’ahina yi mu nsuo kakra. 18Na ɔse: Me wura, nom bi! Na ɔyɛɛ ntɛm soɛɛ n’ahina no sii ne nsam maa no nomee. 19Na ɔmaa no nom wieeɛ no, ɔkaa sɛ: Mɛkɔ makɔsa bi mabrɛ wo yoma no nso akɔsi sɛ wɔbɛwie nom. 20Na ɔyɛɛ ntɛm kɔhwiee n’ahina mu nsuo no guu anomeeɛ hɔ, na ɔtutuu mmirika kɔɔ abura no mu bio kɔsaa nsuo, na ɔsa maa ne yoma no nyinaa. 21Na ɔbarima no hwɛɛ no ara, na ɔyɛɛ komm sɛ ɔbɛhunu sɛ AWURADE ama ne kwankorɔ no ayɛ dwoodwoo anaasɛ ɛnte saa. 22 Na yoma no wiee nsuo nom no, ɔbarima no yii sika hwenemkaa a ano si dwetɛbena fa ne nsa so nkapo mmienu a ano si sikabena du de hyɛɛ no. 23Na ɔbisaa no sɛ: Hwan ba ne wo? Mesrɛ wo, kyerɛ me! Yɛbɛnya daberɛ wɔ w’agya fie anaa? 24Na ɔbuaa no sɛ: M’agya ne Betuel a ɔyɛ Nahor ne Milka ba no. 25Na ɔtoaa so sɛ: Yɛwɔ ɛserɛ ne mmoa aduane pii ne deɛ mobɛda.
26Na ɔbarima no bɔɔ ne mu ase sɔree AWURADE. 27Na ɔkaa sɛ: Nhyira nka AWURADE, me wura Abraham Nyankopɔn a wamma n’adɔeɛ ne ne nokorɛ ammɔ me wura. Na me nso, AWURADE akyerɛ me me wura nuanom fie kwan. 28Na ababaa no tuu mmirika kɔkaa saa nsɛm yi kyerɛɛ ne na fiefoɔ.
29Na Rebeka wɔ nuabarima bi a ne din de Laban. Na Laban de mmirika firii adi kɔɔ ɔbarima no nkyɛn wɔ asubura no ho. 30Na ɔhunuu hwenemkaa ne ne nsa so nkapo no, na ɔtee ne nua Rebeka nsɛm no sɛ: Sɛdeɛ ɔbarima no kasa kyerɛɛ me nie no, ɔbaa ɔbarima no nkyɛn. Na hwɛ, na ɔgyina yoma no nkyɛn, asubura no ho. 31Na ɔkaa sɛ: Wo a AWURADE ahyira woɔ, bra, adɛn nti na wogyina kurotia? Na masiesie ɛdan mu, ne baabi nso mama yoma no. 32Na ɔbarima no kɔɔ fie, na ɔyii yoma no so nnoɔma maa no ɛserɛ ne aduane, na ɔmaa ɔno ne nnipa a wɔka ne ho no nsuo sɛ wɔnhohoro wɔn nan ase. 33Na wɔde aduane bɛsii n’anim sɛ ɔnni. Nanso ɔkaa sɛ: Merennidi gye sɛ mabɔ m’amanneɛ ansa. Na ɔse: Bɔ na yɛn ntie ɛ!
34Na ɔse: Abraham somfoɔ ne me. 35Na AWURADE ahyira me wura pii na wayɛ ɔkɛseɛ. Na wama no nnwan ne anantwie, dwetɛ ne sika kɔkɔɔ, nkoa ne mfenaa, ne yoma ne mfunumu. 36Na me wura yere Sara awo ba wɔ ne mmerewaberɛ mu ama me wura, na ɔde deɛ ɔwɔ nyinaa ama no. 37Na me wura ama maka ntam sɛ: Nware Kanaanfoɔ a mete wɔn asase soɔ yi mmammaa mu bi mma me ba. 38Na mmom kɔ m’agya fie ne m’abusua mu kɔware yerɛ brɛ no. 39Na mebisaa me wura sɛ: Na sɛ ɔbaa no anni m’akyi ɛ? 40 Na ɔka kyerɛɛ me sɛ: AWURADE a menam n’anim no bɛsoma ne bɔfoɔ aka wo ho, na wama wo kwan so ayɛ dwoodwoo, na woakɔware yerɛ wɔ m’abusua mu ne m’agya fie abrɛ me ba; 41Ɛno na sɛ wokɔ m’abusua mu, na wɔamma wo bi a, ɛnneɛ na wo ho afi me ntam no mu. 42Na mebaa asubura no ho nnɛ kaa sɛ: AWURADE, me wura Abraham Nyankopɔn, sɛ wo ara worema me kwan a meretuo yi ayɛ dwoodwoo a, 43hwɛ, megyina asubura yi ho, na ma no mmra sɛ ababaa a ɔbɛfiri abɛsa nsuo no, na mɛse no sɛ: Mesrɛ wo, ma me w’ahina yi mu nsuo kakra mennom, 44na ɔbɛka akyerɛ me sɛ: Nom, na menkɔsa bi memmrɛ wo yoma no nso no, ma ɔno ara nyɛ ɔbaa a AWURADE ayi no ama me wura ba. 45Na mennya menwiee m’akoma mu kasa no, hwɛ, Rebeka firii adi bae a ahina si ne mmatiri soɔ, na ɔkɔɔ abura no mu kɔsaa nsuo. Na mesee no sɛ: Mesrɛ wo, ma me bi mennom. 46Na ɔyɛɛ ntɛm soɛɛ n’ahina no kaa sɛ: Nom, na mɛma wo yoma no nso bi anom. Na menomee, na ɔmaa yoma no nso bi nomee. 47 Na mebisaa no sɛ: Hwan ba ne wo? Na ɔse: M’agya ne Betuel a ɔyɛ Nahor ne Milka ba no. Na mede ɛhwenemkaa no mesɛnee ne hwenem, na mede nkapo no mehyehyɛɛ ne nsa, 48na mebɔɔ me mu ase mesɔree AWURADE, na mehyiraa AWURADE, me wura Abraham Nyankopɔn a ɔkyerɛɛ me nokorɛ kwan sɛ menkɔware me wura nua ba memma ne ba no. 49Na afei sɛ mo ara moreyɛ me wura adɔeɛ adi no nokorɛ a, monka nkyerɛ me; na sɛ ɛnte saa a, monka nkyerɛ me, na mennane memfa nifa anaa benkum.
50Ɛnna Laban ne Betuel buaa sɛ: AWURADE na asɛm yi firi no, yɛrentumi nka no papa anaa bɔne nkyerɛ wo. 51Hwɛ, Rebeka na ɔgyina w’anim yi, fa no kɔ ma no nkɔyɛ wo wura ba yere, sɛdeɛ AWURADE aka no. 52Na Abraham somfoɔ no tee wɔn nsɛm no, ɔkotoo fam sɔree AWURADE. 53Na ɔsomfoɔ no yii dwetɛ nnwinneɛ ne sika kɔkɔɔ nnwinneɛ ne ntadeɛ de maa Rebeka; na ɔde nnoɔma a ɛsom boɔ maa ne nuabarima ne ne na. 54Na ɔne nnipa a wɔka ne ho no didii na wɔnomeeɛ no, wɔdaa hɔ anadwo no. Na wɔsɔree anɔpa no, ɔkaa sɛ: Monnya me kwan, na menkɔ me wura nkyɛn. 55Na ne nua ne ne na kaa sɛ: Ma ababaa no ntena yɛn nkyɛn nna tiaa bi sɛ dadu ansa na woakɔ. 56Na ɔka kyerɛɛ wɔn sɛ: Monnsi me kwan, ɛfiri sɛ AWURADE ama m’akwantuo no asi me yie. Monnya me kwan mma menkɔ me wura nkyɛn. 57Na wɔse: Ma yɛmfrɛ ababaa no mmisa ɔno ara.
58Na wɔfrɛɛ Rebeka kyerɛɛ no sɛ: Wo ne ɔbarima yi bɛkɔ anaa? Na ɔse: Mɛkɔ. 59Na wɔgyaa wɔn nua Rebeka ne n’abaawa panin ne Abraham somfoɔ no ne ne nnipa no kwan. 60 Na wɔhyiraa Rebeka see no sɛ:
Yɛn nuabaa, dane
mpem du ahodoɔ mpem mpem,
na w’asefoɔ mfa
wɔn atamfoɔ apono nni.
61Na Rebeka ne ne mmaawa sɔree, na wɔtenatenaa yoma so dii ɔbarima no akyi, na ɔsomfoɔ no de Rebeka sii mu kɔe.
62 Na Isak firi Lahai-roi abura ho bae, ɛfiri sɛ na ɔte Negeb asase no so. 63Na Isak firii adi kɔɔ wiram anwummerɛ kɔdwennwenee ne nsɛm ho. Na ɔmaa n’ani so hwɛe, na hwɛ, yoma reba. 64Na Rebeka maa n’ani so, na ɔhunuu Isak no, ɔfirii yoma no so sii fam. 65Na ɔka kyerɛɛ ɔsomfoɔ no sɛ: Ɔbarima bɛn na ɔnam wira mu rebɛhyia yɛn yi? Na ɔsomfoɔ no se: Ɛyɛ me wura. Na ɔfaa ne nkatanimu de kataa n’anim. 66Na ɔsomfoɔ no kaa deɛ ɔyɛeɛ no nyinaa kyerɛɛ Isak. 67 Na Isak de no kɔɔ ne na Sara ntomadan mu, na ɔwaree Rebeka, na ɔyɛɛ no ɛyerɛ, na ɔdɔ no. Na Isak werɛ kyekyeree, ne na wuo no akyi.",https://www.bible.com/bible/1461/GEN.24.ASWDC
GYENESIS 25,"Abraham ne Ketura mma
(1 Berɛsosɛm 1.32-33)
1 Na Abraham waree yerɛ bio a ne din de Ketura. 2Na ɔwoo Simran, Yoksan, Medan, Midian, Isbak ne Sua maa no. 3Na Yoksan woo Seba ne Dedan. Na Dedan mma ne Asurfoɔ, Letusfoɔ ne Leumfoɔ. 4Na Midian mma ne Hefa, Hefer, Hanok, Abida ne Eldaa. Yeinom nyinaa ne Ketura mma.
5Na Abraham de deɛ ɔwɔ nyinaa maa Isak. 6Na mmaa nkae mma a Abraham wɔ no deɛ, berɛ a Abraham te aseɛ no, ɔkyɛɛ wɔn adeɛ, na ɔgyaa wɔn kwan firii ne ba Isak ho maa wɔkɔɔ apueeɛ asase no so.
Abraham wuo ne ne sie
7Na Abraham nna a ɔdiiɛ yɛ mfeɛ ɔha aduɔson nnum. 8 Na Abraham gyaa ne honhom mu, na ɔwuu ɛdwono pa mu, wabɔ akɔkoraa, na ɔnyaa mfeɛ pii. Na ɔtii n’agyanom wɔ asamando.
9Na ne mma Isak ne Ismael siee no Makpela bodan mu, wɔ Hetini Efron, Sohar ba, afuo no mu wɔ Mamre ntentensoɔ, 10 afuo a Abraham tɔɔ no Het mma nsam no. Ɛhɔ na wɔsiee Abraham ne ne yere Sara. 11 Na Abraham wuo akyiri no, Onyankopɔn hyiraa ne ba Isak. Na Isak tenaa Lahai-roi abura no ho.
Ismael awoɔ ntoatoasoɔ
(1 Berɛsosɛm 1.28-31)
12 Na yei ne Abraham ba Ismael a Misraimni Hagar, Sara afenaa no, wo maa Abraham no awoɔ ntoatoasoɔ: 13Na yei ne Ismael mma din a wɔde frɛɛ wɔn awoɔ ntoatoasoɔ no: Ismael abakan Nebaiot. Wɔn a wɔka ho ne Kedar, Adbeel, Mibsam, 14Misma, Duma, Masa, 15Hadad, Tema, Yetur, Nafis ne Kedema. 16 Yeinom ne Ismael mma, na yeinom ne wɔn din, sɛdeɛ wɔn nkuraa ne wɔn nsraban teɛ, atitire dummienu ne wɔn aman.
17(Na Ismael nkwa mu mfeɛ a ɔdiiɛ nie: Mfirinhyia ɔha aduasa nson. Na ɔgyaa ne honhom mu, na ɔwui, na ɔtii n’agyanom wɔ asamando.) 18 Na wɔtena firi Hawila kɔsii Sur a ɛwɔ Misraim ntentensoɔ de rekɔ Asiria no. Na ɔne ne nuanom antena no asomdwoeɛ mu.
Esau ne Yakob awoɔ
19Na yeinom ne Abraham ba Isak awoɔ ntoatoasoɔ: Abraham woo Isak. 20Na Isak dii mfirinhyia aduanan no, ɔwaree Rebeka, Aramni Betuel ba a ɔfiri Mesopotamia no ne Aramni Laban nua.
21Na Isak srɛɛ AWURADE maa ne yere, ɛfiri sɛ na ɔyɛ obonini. Na AWURADE tiee n’adesrɛ no, na ne yere Rebeka nyinsɛnee.
22Na nkɔkoaa no pempem wɔn ho wɔ ne yam. Na ɔse: Sɛ ɛte saa a, na mete ase reyɛ deɛn? Na ɔkɔbisaa AWURADE. 23 Na AWURADE ka kyerɛɛ no sɛ:
Aman mmienu na ɛwɔ wo yam,
na nkurɔfoɔ ahodoɔ mmienu na ɛbɛtete wɔn ho mu afiri wo yafunu mu.
Na ɔman no baako bɛdi baako so,
na ɔpanin no bɛsom akumaa no.
24Na ne nna duruu so sɛ ɔbɛwoɔ no, na hwɛ, nta wɔ ne yam. 25Na deɛ ɔdi kan firi baeɛ no, na ne ho yɛ kɔɔ, ne ho nyinaa wɔ enwi kusuu. Enti wɔtoo no din Esau. 26Na ɛno akyiri no, ne nua no firi bae, na ne nsa kura Esau nantin, enti wɔtoo no din Yakob. Na wɔwoo wɔn no, na Isak adi mfeɛ aduosia.
Esau tɔn ne panin
27Na mmɔfra no nyinii. Na Esau nim ahayɔ yie, na ɔyɛ ɔhamuni, na Yakob deɛ na ɔyɛ onipa a ɔmpɛ kasa a daa ɔte ntomadan mu. 28Na Isak dɔ Esau, ɛfiri sɛ na ne hanam yɛ no dɛ; na Rebeka deɛ, ɔdɔ Yakob.
29Yakob noaa aduane bi, na Esau firi wiram baeɛ no, na wabrɛ. 30Na Esau ka kyerɛɛ Yakob sɛ: Ma me adeɛ kɔkɔɔ yi bi menni ɛ, na mabrɛ. (Enti wɔde too no din Edom) 31Na Yakob kaa sɛ: Tɔn wo panin ma me nnɛ. 32Na Esau kaa sɛ: Hwɛ, wuo na merebɛwuo yi, na ɔpanin yi bɛyɛ me deɛn? 33 Na Yakob kaa sɛ: Ka ntam kyerɛ me nnɛ. Na ɔkaa ntam kyerɛɛ no tɔn ne panin maa Yakob. 34Ɛnna Yakob maa Esau paanoo ne asedua a wanoa; na ɔdii, na ɔdidi nomee, na ɔsɔre kɔe. Na sɛdeɛ Esau ammu ne panin ne no.",https://www.bible.com/bible/1461/GEN.25.ASWDC
GYENESIS 26,"Isak kɔ Gerar
1 Na ɛkɔm baa asase no so, ɛsono ɛkɔm a ɛbaa Abraham berɛ soɔ no. Na Isak kɔɔ Filistifoɔ hene Abimelek nkyɛn wɔ Gerar.
2Na AWURADE yii ne ho kyerɛɛ no sɛ: Nsiane nkɔ Misraim, tena asase a mɛkyerɛ woɔ yi so. 3 Tena asase yi so sɛ ɔhɔhoɔ, na mɛdi w’akyi na mahyira wo, ɛfiri sɛ wo ne w’asefoɔ na mede nsase yi nyinaa bɛma mo, na mɛma ntam a mekaa w’agya Abraham no agyina. 4 Na mɛma w’asefoɔ adɔre sɛ ɔsoro nsoromma, na mede nsase yi nyinaa bɛma w’asefoɔ, na w’asefoɔ mu na wɔbɛhyira asase so amanaman nyinaa, 5 ɛfiri sɛ Abraham tiee me nne, na ɔdii me nsiesieeɛ, me mmara nsɛm, m’ahyɛdeɛ ne me mmara so.
6Na Isak tenaa Gerar. 7Na ɛhɔfoɔ no bisaa no ne yere ho asɛm no, ɔkaa sɛ: Me nua ne no. Na ɔsuro sɛ ɔbɛka sɛ: Me yere ne no, ɛfiri sɛ ɔse: Anyɛ saa a, Rebeka nti ɛhafoɔ bɛku me; ɛfiri sɛ ne ho yɛ fɛ. 8 Na ɔkyɛree hɔ no, Filistifoɔ hene Abimelek hwɛɛ mpomma mu hunui, na hwɛ, Isak ne ne yere Rebeka rewewe. 9Na Abimelek frɛɛ Isak sɛ: Hwɛ, ampa ara ɔyɛ wo yere, na ɛyɛɛ dɛn na wose: Ɔyɛ me nua yi? Na Isak ka kyerɛɛ no sɛ: Ɛfiri sɛ medwenee sɛ: Anyɛ saa a, ne nti mɛwu. 10Na Abimelek kaa sɛ: Ɛdeɛn na woayɛ yɛn yi? Ɛkaa kumaa bi na anka ɔman yi muni bi ne wo yere dae, na anka wode mmusuo aba yɛn so. 11Na Abimelek hyɛɛ ne nkurɔfoɔ nyinaa sɛ: Deɛ ɔbɛka ɔbarima yi anaa ne yere no, wuo na ɔbɛwuo.
12 Na Isak duaa mfudeɛ wɔ asase no so, na ɔnyaa nnɔbaeɛ mmɔho ɔha; afirinhyia no ara mu ɛfiri sɛ AWURADE hyiraa no. 13Na Isak nyaa ne ho, na ɔkɔɔ so ara nyaa ne ho kɔsii sɛ ɔyɛɛ kɛseɛ pa ara. 14Na ɔnyaa nnwankuo ne anantwikuo ne nkoa pii. Na Filistifoɔ no ani beree no. 15 (Na nsubura a n’agya Abraham nkoa tutuu no n’agya berɛ soɔ no, Filistifoɔ sisii ne nyinaa de dɔteɛ hyehyɛɛ no mama.) 16Na Abimelek ka kyerɛɛ Isak sɛ: Firi yɛn nkyɛn kɔ, na wowɔ tumi dodo sene yɛn. 17Na Isak sii mu firi hɔ kɔsisii ne ntomadan wɔ Gerar bonhwa mu, na ɔtenaa hɔ.
18Na Isak sane titii nsubura a n’agya Abraham berɛ so wɔtutuiɛ a Abraham wuo akyi Filistifoɔ sisii no no mu. Na ɔtotoo no din sɛdeɛ n’agya totoeɛ no ara. 19Na Isak nkoa funuu bonhwa no mu, na wɔhunuu nsupa abura wɔ hɔ. 20Na Gerar mmoahwɛfoɔ ne Isak mmoahwɛfoɔ dii so aperepereɛ kaa sɛ: Nsuo no yɛ yɛn dea! Enti Isak too abura no din Esek, ɛfiri sɛ wɔne no hamee. 21Na wɔtuu asubura foforɔ, na ɛno ho nso wɔpereperee, enti ɔfrɛɛ no Sitna. 22Na wɔfirii hɔ kɔtuu abura foforɔ, na ɛno deɛ, wɔampere, enti ɔtoo no din Rehobot, na ɔkaa sɛ: Afei deɛ AWURADE ama yɛn mu atrɛ, na yɛadɔre wɔ asase yi so. 23Na ɔfirii hɔ kɔɔ Beer-seba. 24Na AWURADE yii ne ho kyerɛɛ no anadwo no ara kaa sɛ: Mene w’agya Abraham Nyankopɔn, nsuro, na medi w’akyi. Mɛhyira wo, na m’akoa Abraham nti mɛma w’asefoɔ adɔre. 25 Na ɔsii afɔrebukyia wɔ hɔ, na ɔsɔree AWURADE, na ɔsii ne ntomadan wɔ hɔ. Na Isak nkoa tuu asubura wɔ hɔ.
Abraham ne Abimelek yɛ apam
26 Na Abimelek ne n’adamfo Ahusat ne ne safohene Pikol firi Gerar baa ne nkyɛn. 27Na Isak ka kyerɛɛ wɔn sɛ: Ɛdeɛn nti na moaba me nkyɛn yi? Sɛ motane me, na moapamo me afiri mo nkyɛn. 28Na wɔse: Yɛahunu pefee sɛ AWURADE di w’akyi. Na yɛse: Ma ntam nna yɛne wo ntam. Na ma yɛne wo mpam, 29sɛ worenyɛ yɛn bɔne biara; sɛdeɛ yɛanka woɔ, na yɛayɛ wo papa nko ara, na yɛagya wo kwan asomdwoeɛ mu no. Afei wone deɛ AWURADE ahyira no. 30Na ɔtoo wɔn pono, na wɔdidi nomee. 31Na wɔsɔree anɔpatutu kekaa ntam kyerɛkyerɛɛ wɔn ho, na Isak gyaa wɔn kwan, na wɔde asomdwoeɛ firi ne nkyɛn kɔe. 32Na da no ara Isak nkoa ba bɛkaa no abura a wɔtuiɛ no ho asɛm sɛ: Yɛato nsuo. 33 Na ɔfrɛɛ no Siba. Enti kuro no din de Beer-seba de bɛsi nnɛ yi ara.
Esau ananafoɔ yerenom
34 Na Esau dii mfirinhyia aduanan no, ɔwaree Hetini Beeri babaa Yudit ne Hetini Elon babaa Basmat. 35Na wɔhyɛɛ Isak ne Rebeka awerɛhoɔ.",https://www.bible.com/bible/1461/GEN.26.ASWDC
GYENESIS 27,"Yakob gye Isak nhyira
1Na Isak bɔɔ akɔkoraa na n’ani so yɛɛ no kusukusu na ɔnhunu adeɛ yie no, ɔmaa wɔfrɛɛ ne ba panin Esau ka kyerɛɛ no sɛ: Me ba! Na ɔgyee so sɛ: Agya, menie. 2Na ɔse: Mabɔ akora, na mennim me wuda. 3Afei fa w’ahayɔdeɛ, w’agyan kotokuo ne w’agyan kɔ wiram kɔpɛ hanam brɛ me, 4 na noa akɔnnɔduane sɛdeɛ mepɛ brɛ me, na menni, na me nhyira wo ansa na mawu. 5Ɛberɛ a Isak rekasa akyerɛ ne ba Esau no, Rebeka tee. Na Esau kɔɔ wiram sɛ ɔrekɔkum nam aba.
6Na Rebeka ka kyerɛɛ ne ba Yakob sɛ: Hwɛ, metee sɛ w’agya rekasa kyerɛ wo nua Esau sɛ: 7Kɔpɛ hanam brɛ me, na noa m’akɔnnɔduane, na menni, na menhyira wo AWURADE anim ansa na mawu. 8Na afei, me ba, tie me nne, sɛdeɛ merehyɛ woɔ yi: 9Kɔ mmoakuo no mu kɔkyere mmirekyie mma pa mmienu brɛ me, na memfa menyɛ akɔnnɔduane memma w’agya sɛdeɛ ɔpɛ; 10na fa kɔma w’agya, na ɔnni, na ɔnhyira wo ansa na wawu. 11 Na Yakob ka kyerɛɛ ne na Rebeka sɛ: Hwɛ, me nua Esau ho wɔ nwi, na me deɛ, me ho yɛ toromtorom. 12Ebia m’agya bɛka me ho ahwɛ, na mayɛ n’ani so sɛ ɔdaadaafoɔ, na mede nnome maba me so, na ɛnyɛ nhyira. 13Ɛnna ne na ka kyerɛɛ no sɛ: Wo nnome mmra me so, me ba, tie me nne ara, na kɔkyere wɔn brɛ me. 14Na ɔkɔkyeree wɔn brɛɛ ne na, na ne na de yɛɛ akɔnnɔduane sɛdeɛ n’agya pɛ.
15Na Rebeka faa ne ba panin Esau ntadeɛ fɛfɛ a ɛwɔ ne nkyɛn wɔ ɛdan mu de hyɛɛ ne ba kumaa Yakob. 16Na ɔde mmirekyie mma no nwoma duraduraa ne nsa ne ne kɔn a ɛho yɛ toromtorom no ho. 17Na ɔde akɔnnɔduane ne paanoo a wasiesie no hyɛɛ ne ba Yakob nsa. 18Na ɔde kɔɔ n’agya nkyɛn, na ɔse: M’agya! Na ɔgyee so sɛ: Menie, ɛyɛ wo hwan a, me ba? 19Na Yakob ka kyerɛɛ n’agya sɛ: Ɛyɛ me, w’abakan Esau. Mayɛ sɛdeɛ wokyerɛɛ me no. Mesrɛ wo, sɔre, tena ase, na di me hanam, na wo kra nhyira me. 20Na Isak bisaa ne ba no sɛ: Ɛyɛɛ dɛn na wonyaa no ntɛm sɛɛ yi, me ba? Na ɔse: Ɛfiri sɛ AWURADE wo Nyankopɔn na ɔmaa me hyiaa yie. 21Na Isak ka kyerɛɛ Yakob sɛ: Twe pini me, na menka wo menhwɛ, me ba, sɛ ampa ara sɛ me ba Esau ne wo anaasɛ ɛnyɛ ɔno a. 22Na Yakob twe pinii n’agya Isak, na ɔde ne nsa kaa ne ho hwɛe, na ɔkaa sɛ: Ɛnne no yɛ Yakob nne, na nsa no deɛ, ɛyɛ Esau nsa. 23Na wanhu no, ɛfiri sɛ na ne nsa ho wɔ nwi te sɛ ne nua Esau deɛ. Enti ɔhyiraa no. 24Na ɔbisaa no sɛ: Ampa ara sɛ wone me ba Esau anaa? Na ɔse: Mene no. 25Na ɔse: Fa pini me nkyɛn, na menni me ba hanam, na me kra nhyira wo. Na ɔde brɛɛ no, na ɔdii, na ɔde bobesa brɛɛ no, na ɔnomee. 26Na n’agya Isak ka kyerɛɛ no sɛ: Twe pini bɛfe m’ano ɛ, me ba. 27Na ɔtwe pinii kɔfee n’ano. Na Isak huaa n’atadeɛ mu hwa hwɛe, na ɔhyiraa no sɛ:
Hwɛ, me ba ho hwa
te sɛ afuo a AWURADE ahyira soɔ mu hwa.
28Onyankopɔn mma wo ɔsoro bosuo
ne asase mu sradeɛ bi,
ne aburoo ne nsa pii.
29 Aman nsom wo,
na nkurɔfoɔ nkoto wo.
Yɛ wo nuanom so wura,
na wo na mma nkoto wo.
Wɔadome wɔn a wɔdome woɔ,
na wɔahyira wɔn a wɔhyira woɔ.
Esau srɛ Isak hɔ nhyira
30Na Isak wiee Yakob hyira na Yakob firii n’agya nkyɛn firii adi ara pɛ na ne nua Esau firi n’ahayɔ baeɛ. 31Na ɔno nso bɛnoaa akɔnnɔduane de brɛɛ n’agya ka kyerɛɛ n’agya sɛ: M’agya sɔre ɛ, na di wo ba hanam, na wo kra nhyira me! 32Na n’agya Isak see no sɛ: Ɛyɛ wo hwan a? Na ɔse: Ɛyɛ me, wo ba, w’abakan Esau.
33Na Isak de ahopopoɔ kɛseɛ pa ara kaa sɛ: Hwan mpo ne deɛ ɔkɔyɛɛ ha de brɛɛ me, na medii ne nyinaa na mehyiraa no ansa na woreba yi? Nso ɔbɛyɛ deɛ wɔahyira no.
34 Esau tee n’agya nsɛm no, ɔde su kɛseɛ ne awerɛhoɔ pii teaa mu denden ka kyerɛɛ n’agya sɛ: M’agya, hyira me nso bi. 35Na ɔse: Wo nua de nnaadaa aba abɛgye wo nhyira. 36 Na ɔse: Ne din nne Yakob anaa? Mprenu ni na watwintwane m’anan mu. Wafa me panin, na hwɛ, afei nso wagye me nhyira. Na ɔse: Woamfa nhyira bi ansie me? 37Na Isak bua see Esau sɛ: Hwɛ, mede no mayɛ wo so wura, na mede ne nuanom nyinaa mayɛ ne nkoa. Na mede aburoo ne nsa mawowa no. Na afei wo deɛ, ɛdeɛn na menyɛ woɔ, me ba? 38Na Esau ka kyerɛɛ n’agya sɛ: M’agya, nhyira baako pɛ na wowɔ? Hyira me nso, m’agya. Na Esau maa ne nne so sui. 39Na n’agya Isak bua see no sɛ:
Hwɛ, asase a sradeɛ nni mu
ne deɛ ɔsoro bosuo yɛ so na so na wobɛtena.
40 Wo nkrantɛ so na wonam bɛtena aseɛ,
na wobɛsom wo nua.
Nanso ɛbɛba sɛ wobɔ mmɔden kentene wo ho a,
wobɛyi ne kɔnnua afiri wo kɔn so.
Esau repɛ Yakob aku no
41Na Esau tanee Yakob wɔ nhyira a n’agya de hyiraa no no nti. Na Esau kaa no n’akoma mu sɛ: Nna a wɔde bɛsu m’agya no reyɛ abɛn, na merebɛkum me nua Yakob. 42Na wɔkɔkaa ne ba panin Esau nsɛm yi kyerɛɛ Rebeka. Na ɔsoma maa wɔkɔfrɛɛ ne ba kumaa Yakob, na ɔka kyerɛɛ no sɛ: Hwɛ, wo nua Esau rekyekyere ne werɛ sɛ ɔrebɛku wo. 43 Afei, me ba, tie me nne, na sɔre dwane kɔ me nua Laban nkyɛn wɔ Haran, 44na tena ne nkyɛn nna tiaa kɔsi sɛ wo nua anibereɛ no bɛfiri ne mu, 45kɔsi sɛ wo nua abufuo bɛdane afiri wo soɔ, na ne werɛ afiri deɛ woyɛɛ no no, ansa na masoma ama wɔabɛfa wo wɔ hɔ aba. Na adɛn nti koraa na ɛsɛ sɛ mehwere mo baanu da koro?
Isak ma Yakob kɔ Laban nkyɛn
46 Na Rebeka ka kyerɛɛ Isak sɛ: Het mmammaa nti m’asetena afono me. Sɛ Yakob kɔware yerɛ Het mmammaa mu, sɛ yeinom a wɔwɔ ɛha yi a, na me mmerɛ ngui, na mete ase reyɛ deɛn bio?",https://www.bible.com/bible/1461/GEN.27.ASWDC
GYENESIS 28,"Isak hyira Yakob, na ɔgya no kwan kɔ Mesopotamia
1 Na Isak frɛɛ Yakob, na ɔhyiraa no hyɛɛ no sɛ: Nware ɛyerɛ wɔ Kanaan mmammaa mu. 2 Sɔre kɔ Mesopotamia kɔ wo na n’agya Betuel fie, na kɔware wɔ wo na nua Laban mmammaa mu bi. 3Na Onyankopɔn Tweaduampɔn nhyira wo, na ɔmma wo nnɔ, na ɔmma wo nyɛ bebree, na woayɛ aman asafo; 4 na ɔmfa Abraham nhyira nhyira wo, wo ne w’asefoɔ a wɔka wo ho, na woanya asase a woyɛ so hɔhoɔ a Onyankopɔn de ama Abraham yi. 5Na Isak gyaa Yakob kwan, na ɔkɔɔ Mesopotamia wɔ Aramni Betuel ba Laban a ɔyɛ Yakob ne Esau wɔn na Rebeka nuabarima no nkyɛn.
Esau ware ɔbaa foforɔ
6Na Esau hunuu sɛ Isak ahyira Yakob, ama wagya no kwan sɛ ɔnkɔ Mesopotamia nkɔware yerɛ wɔ hɔ. Afei ɔhunuu bio sɛ ɔhyiraa no hyɛɛ no sɛ: Nware Kanaan mmammaa mu yerɛ, 7na Yakob tiee n’agya ne ne na, na ɔkɔɔ Mesopotamia. 8Na Esau hunuu sɛ Kanaan mmammaa nyɛ wɔ n’agya Isak ani soɔ no, 9 ɔsii mu kɔɔ Ismael nkyɛn kɔwaree Abraham ba Ismael babaa, Nebaiot nuabaa Mahalat kaa ne yerenom no ho.
Yakob daeɛso wɔ Betel
10Na Yakob firi Beer-seba sii mu kɔɔ Haran. 11Na ɔduruu baabi no ɔsoɛɛ hɔ anadwo no, ɛfiri sɛ na owia akɔtɔ. Na ɔfaa hɔ aboɔ no bi de yɛɛ sumiiɛ, na ɔdaa hɔ. 12 Na ɔsoo daeɛ, na hwɛ, na atwedeɛ bi si fam a atifi pem soro, na hwɛ, Nyankopɔn abɔfoɔ redi so aforosiane. 13 Na hwɛ, AWURADE gyina atifi, na ɔse: Mene AWURADE, w’agya Abraham Nyankopɔn ne Isak Nyankopɔn; asase a woda soɔ yi mede bɛma wo ne w’asefoɔ. 14 Na w’asefoɔ bɛyɛ sɛ asase so mfuturo, na woatrɛ akɔ atɔeɛ ne apueeɛ, atifi fam ne anafoɔ fam. Na wo ne w’asefoɔ mu na wɔbɛhyira wiase mmusuakuo nyinaa. 15Na hwɛ, mɛdi w’akyi, na mahwɛ wo so baabiara a wobɛkorɔ, na mama woasane aba asase yi so. Na merennya wo de bɛkɔ akɔsi sɛ mɛma deɛ maka makyerɛ woɔ yi aba mu. 16Na Yakob nyane firii ne nna mu no, ɔkaa sɛ: Ampa ara, AWURADE wɔ ha yi, nanso me deɛ, manhunu. 17 Na ɔsuroe, na ɔse: Ɛha yi yɛ hu ampa. Ɛha nyɛ baabiara sɛ Nyankopɔn fie, na ɛha ne ɔsoro aboboano.
18Na Yakob sɔree anɔpatutu, na ɔfaa ɔboɔ a ɔde yɛɛ sumiiɛ no de yɛɛ odum sii hɔ, na ɔhwiee ngo guu so. 19 Na ɔfrɛɛ hɔ: Betel, nanso akane no na kuro no din de Lus.
20Na Yakob hyɛɛ bɔ kaa sɛ: Sɛ AWURADE Nyankopɔn bɛdi m’akyi ahwɛ me so ɔkwan a merebɛtuo yi mu, na wama me aduane madi ne atadeɛ mahyɛ, 21na wasane me asomdwoeɛ mu de me aba m’agya fie a, ɛnneɛ AWURADE bɛyɛ me Nyankopɔn. 22 Na ɔboɔ yi a mede mayɛ odum asi hɔ yi bɛyɛ Nyankopɔn fie. Na deɛ wobɛma me nyinaa, mɛma wo so ntotosoɔ du du.",https://www.bible.com/bible/1461/GEN.28.ASWDC
