Title,Content,URL
GYENESIS 18,"Isak awoɔ ho bɔhyɛ
1Na AWURADE yii ne ho kyerɛɛ Abraham wɔ Mamre pɔ mu, na ɔte ne ntomadan pono ano awia ketee. 2 Na ɔmaa n’ani so hwɛe, na hwɛ, mmarima baasa abɛgyina ne ntentensoɔ. Na ɔhunuu wɔn no, ɔfirii ne ntomadan pono ano tuu mmirika kɔhyiaa wɔn, na ɔbɔɔ ne mu ase 3kaa sɛ: Me wura, sɛ manya w’anim adom a, mesrɛ wo, nsiane w’akoa ho nkɔ. 4Ma wɔnkɔsa nsuo kakraa bi mmra, na monhohoro mo nan ase, na monhome dua yi ase. 5Moanya abɛfa mo akoa nkyɛn yi, merekɔ makɔfa paanoo kakra maba, na mode adwodwo mo akoma, na ɛno akyiri no moakɔ. Na wɔse: Yɛ sɛdeɛ woaka yi. 6Na Abraham yɛɛ ntɛm kɔɔ Sara nkyɛn ntomadan mu kaa sɛ: Yɛ ntɛm, fa esiam pa susukoraa mmiɛnsa, fete to taterɛ. 7Na Abraham tuu mmirika kɔɔ anantwie mu kɔkyeree nantwie ba a ɔyɛ na ɔde maa ɔsomfoɔ bi, na ɔyɛɛ ntɛm siesiee no. 8Na Abraham faa nufosuo ani sradeɛ ne nufosuo ne nantwie ba nam a ɔsiesiee no no, na ɔde bɛsii wɔn anim; na ɔno deɛ, ɔgyinaa wɔn nkyɛn dua no ase, maa wɔdidii.
9Na wɔbisaa Abraham sɛ: Wo yere Sara wɔ he? Na ɔse: Hwɛ, ɔwɔ ntomadan mu. 10 Na wɔn mu baako kaa sɛ: Ampa ara, mɛsane maba wo nkyɛn afeda sɛsɛɛ no, na wo yere Sara anya ɔba. Na Sara retie no ntomadan pono a ɛwɔ n’akyire no ano. 11Na Abraham ne Sara nyinaa anyininyini a wɔadi mfirinhyia pii, na deɛ ɛyɛ mmaa no to atwa wɔ Sara ho. 12 Enti Sara seree ne mu kaa sɛ: Sɛ manya awie aberewa bɔ na me wura nso abɔ akɔkoraa yi, na mɛnya anigyeɛ? 13Na AWURADE bisaa Abraham sɛ: Adɛn nti na Sara seree sɛ: Ampaneampa ara manyini yi mɛwo ɔba? 14 Biribi yɛ AWURADE yɛna anaa? Berɛ a mahyɛ no, mɛsane aba wo nkyɛn afeda sɛsɛɛ no na Sara anya ɔba. 15Na Sara sanee sɛ: Menseree, ɛfiri sɛ na ɔsuro. Na ɔse: Dabi, woasere.
Abraham di ma Sodomfoɔ
16Na mmarima no sɔre firii hɔ danee wɔn ani kyerɛɛ Sodom, na Abraham kɔgyaa wɔn kwan. 17Na AWURADE kaa sɛ: Memfa deɛ merebɛyɛ yi mensie Abraham anaa? 18 Ɛfiri sɛ ampa ara Abraham bɛyɛ ɔman a ɛso na wɔwɔ tumi, na ne mu na wɔbɛhyira wiase aman nyinaa. 19 Na mahu no mayi no sɛ ɔnhyɛ ne mma ne ne fiefoɔ a ɛbɛdi n’akyire sɛ wɔnni AWURADE kwan so nyɛ tenenee ne atɛntenenee adeɛ, na AWURADE ama deɛ waka no Abraham ho no aba ne so. 20 Na AWURADE kaa sɛ: Sodom ne Gomora so nteamu so, na wɔn nnebɔne yɛ duru dodo nti, 21 meresiane makɔhwɛ sɛ wɔayɛ sɛdeɛ nteamu a ɛduru me nkyɛn no teɛ no a; na sɛ ɛnte saa, mahunu. 22 Na mmarima no danee wɔn ani firii hɔ kɔɔ Sodom; na Abraham deɛ, na ɔda so gyina AWURADE anim ara.
23 Na Abraham twe bɛn bisaa sɛ: Wobɛpra ɔteneneeni ne ɔbɔnefoɔ abom agu anaa? 24Sɛ ebia sɛsɛɛ ateneneefoɔ aduonum wɔ kuro no mu a, anka wobɛpra wɔn agu a ateneneefoɔ aduonum a ɛwɔ mu no nti woremfa kuro no ho nkyɛ wɔn anaa? 25Yei mpare wo sɛ wobɛdi saa asɛm yi sɛ wobɛkum ɔteneneeni ne ɔdebɔneyɛni afra, na ɔteneneeni ayɛ sɛ ɔdebɔneyɛni; yei mpare wo. Deɛ ɔbu asase nyinaa atɛn no remmu atɛntenenee anaa? 26 Na AWURADE kaa sɛ: Sɛ mehunu ateneneefoɔ aduonum Sodom kuro mu a, wɔn nti mede kuro no nyinaa ho bɛkyɛ wɔn. 27Na Abraham buaa sɛ: Hwɛ, meyɛ mfuturo ne nso deɛ, nanso masi me bo sɛ me ne AWURADE bɛkasa: 28Sɛ ebia ateneneefoɔ aduonum no so te enum a; anka enum nti wobɛsɛe kuro no nyinaa anaa? Na ɔse: Sɛ mehunu aduanan nnum wɔ hɔ a, merensɛe hɔ. 29Na Abraham toaa so kasa kyerɛɛ AWURADE bio sɛ: Ebia wɔbɛhunu aduanan wɔ hɔ. Na AWURADE buaa sɛ: Aduanan no nti merenyɛ. 30 Ɛnna ɔkaa sɛ: Mma AWURADE bo mmfu, na ma menkasa: Ebia wɔbɛhunu aduasa wɔ hɔ. Na ɔse: Sɛ mehunu aduasa wɔ hɔ a, merenyɛ. 31Na ɔkaa sɛ: Hwɛ, masi me bo sɛ me ne AWURADE bɛkasa. Ebia wɔbɛhunu aduonu wɔ hɔ. Na ɔse: Aduonu no nti merensɛe hɔ. 32Na ɔkaa sɛ: Mma AWURADE bo mmfu, na menkasa baako pɛ yi: Ebia wɔbɛhunu edu wɔ hɔ. Na ɔse: Edu no nti merensɛe hɔ. 33Na AWURADE ne Abraham kasa wieeɛ no, ɔkɔe, na Abraham sane baa ne fie.",https://www.bible.com/bible/1461/GEN.18.ASWDC
GYENESIS 19,"Sodom nneyɛɛ bɔne
1 Na abɔfoɔ baanu no duruu Sodom anwummerɛ; na Lot te Sodom kuro pono ano. Na Lot hunuu wɔn no, ɔsɔre kɔhyiaa wɔn, na ɔbɔɔ ne mu ase kaa sɛ: 2Me wuranom, mesrɛ mo, mommane mmra mo akoa fie mmɛsoɛ anadwo yi, na monhohoro mo nan ase, na anɔpatutu moasɔre akɔ mo kwan. Na wɔse: Dabi, yɛbɛda abɔntene so. 3Na ɔsrɛɛ wɔn dendeenden. Na wɔmanee ne nkyɛn baa ne fie, na ɔtoo wɔn pono, na ɔtoo apiti maa wɔdii.
4Na wɔnnya nkɔdaeɛ no, Sodom kurom hɔfoɔ bɛtwaa ɛdan no ho hyiae, ɛfiri mmɔfra so kɔsi mpanimfoɔ so, ɔman mu no nyinaa. 5Na wɔfrɛɛ Lot ka kyerɛɛ no sɛ: Mmarima a wɔbaa wo nkyɛn anadwo yi no wɔ he? Yi wɔn brɛ yɛn, na yɛne wɔn nna. 6Na Lot firi kɔɔ wɔn nkyɛn ɛpono ano, na ɔtoo ɛpono no mu wɔ n’akyi. 7Na ɔkaa sɛ: Anuanom, mesrɛ mo, monnyɛ bɔne saa! 8Hwɛ, mewɔ mmammaa baanu a wɔnhunuu ɔbarima, momma memfa wɔn mfiri mmrɛ mo, na monyɛ wɔn sɛdeɛ ɛyɛ mo ani soɔ na mmarima yi nko deɛ, monnyɛ wɔn hwee, na ɛno nti na wɔbaa me suhyɛ aseɛ yi. 9 Na wɔkaa sɛ: Twe wo ho firi hɔ! Na wɔse: Saa onipa yi ba bɛyɛɛ ɔhɔhoɔ, ɛnna afei ɔpɛ sɛ ɔyɛ ɔtemmufoɔ yi! Afei yɛbɛyɛ wo bɔne akyɛne wɔn. Na wɔhyɛɛ ɔbarima Lot so denden twe baa sɛ wɔbɛbubu ɛpono no. 10Na mmarima no tenee wɔn nsa twee Lot baa wɔn nkyɛn wɔ ɛdan no mu, na wɔtoo ɛpono no mu. 11 Na nnipa a wɔgyina ɛpono ano no deɛ, wɔfirafiraa wɔn ani firi mmɔfra so kɔsi mpanin so, na wɔhwehwɛɛ ɛpono ano kwan brɛe.
Lot tu firi Sodom
12Na mmarima no ka kyerɛɛ Lot sɛ: Wowɔ obi wɔ ha ka wo ho? Aseɛ anaa mmammarima anaa mmammaa anaa biribiara a wowɔ wɔ kuro yi mu, yi wɔn firi ha, 13 na yɛrebɛsɛe ha, ɛfiri sɛ wɔn nnebɔne ayɛ kɛse AWURADE anim, na AWURADE asoma yɛn sɛ yɛmmɛsɛe ha. 14 Na Lot firii adi ne ne nsenom a wɔrebɛware ne mmammaa no kɔkasaa sɛ: Monsɔre mfiri ha, na AWURADE rebɛsɛe kuro yi. Nanso ɔyɛɛ ne nsenom ani so sɛ obi a ɔredi fɛw.
15Na adeɛ reyɛ akye no, abɔfoɔ no piapiaa Lot sɛ: Sɔre, fa wo yere ne wo mmammaa baanu a wɔwɔ ha no kɔ, anyɛ saa a, wɔbɛsɛe wo, ɔman yi asotwe mu. 16Na ɔtwentwɛn ne nan ase no, mmarima no sosɔɔ ɔno ne ne yere ne ne mmammaa baanu no nsa, na wɔde no firii adi gyaa no kuro no akyi ɛfiri sɛ AWURADE huu no mmɔbɔ. 17 Na wɔde wɔn firii adie no, ɔkaa sɛ: Dwane gye wo kra nkwa, nhwɛ w’akyi, nso nnyina kanko yi mu baabiara; bepɔ so na dwane korɔ, anyɛ saa a, wɔbɛsɛe wo.
18Na Lot ka kyerɛɛ no sɛ: O, me wura, nnyɛ saa. 19Hwɛ, w’akoa anya w’anim adom, na woama w’adɔeɛ a woayɛ me yi aso sɛ woregye me nkwa nanso merentumi nnwane nkɔ mmepɔ no so, na mmusuo no ammɛto me, na manwu. 20Hwɛ, kuro yi na ɛbɛn sɛ wɔdwane kɔ hɔ, ɛhɔ sua. Ma mennwane nkɔ hɔ ɛ! Ɛnsua anaa? Na me kra anya nkwa. 21Na ɔka kyerɛɛ no sɛ: Hwɛ, matie wo wɔ saa asɛm yi ho nso, na meremmutu kuro a woaka ho asɛm yi. 22Yɛ ntɛm dwane kɔ hɔ, ɛfiri sɛ merentumi nyɛ hwee gye sɛ woakɔduru hɔ ansa. Enti na wɔfrɛ kuro no din sɛ: Soar.
Sodom ne Gomora sɛeɛ
23Na Lot duruu Soar no, na owia apue asase so. 24 Na AWURADE tɔɔ sɔfe ne ogya firi ɔsoro guu Sodom ne Gomora so. 25Na ɔbutuu nkuro no ne kanko no nyinaa ne wɔn a wɔtete nkuro no mu nyinaa ne deɛ afifiri asase no soɔ.
26 Na Lot yere no deɛ, ɔhwɛɛ n’akyi, na ɔdanee nkyene sie.
27Na Abraham tuaa ahema kɔɔ faako a na ɔgyina AWURADE anim hɔ no. 28Na ɔdanee n’ani kyerɛɛ Sodom ne Gomora ne kanko no asase nyinaa, na ɔhwɛe, na hwɛ, asase no so wisie foroo sɛ fononoo mu wisie. 29Enti berɛ a Onyankopɔn sɛee kanko no nkuro no no, ɔkaee Abraham, na ɔgyee Lot firii butuo a ɔbutuu nkuro a Lot te mu no mu.
Moabfoɔ ne Amonfoɔ ahyɛaseɛ
30Na Lot firii Soar kɔtenaa bepɔ no so, ɔne ne mmammaa baanu no, ɛfiri sɛ ɔsuroo Soar tena, na ɔne wɔn kɔtenaa ɔbodan bi mu.
31Na abakan no ka kyerɛɛ akumaa no sɛ: Yɛn agya anyini, na ɔbarima biara nni asase yi so a ɔbɛba yɛn ho, sɛdeɛ asase sofoɔ nyinaa amanneɛ teɛ. 32 Bra, na yɛmma yɛn agya nsa nnom, na yɛne no nkɔda, na yɛanya yɛn agya ho mma. 33Na wɔmaa wɔn agya nsa nomee anadwo no, na abakan no kɔɔ mu ne n’agya kɔdae; na wanhunu ne nna ne ne sɔreɛ mu. 34Na adeɛ kyeeɛ no, abakan no ka kyerɛɛ akumaa no sɛ: Hwɛ, me ne m’agya akɔda anadwo yi, ma yɛmma no nsa nnom nnɛ anadwo yi nso, na kɔ mu, na wo ne no nkɔda, na yɛanya yɛn agya ho mma. 35Na wɔmaa wɔn agya nsa nomee anadwo no nso, na akumaa no sɔre ne no kɔdae; na wanhunu ne nna ne ne sɔreɛ mu. 36Na Lot mma maa baanu no nyinaa nyinsɛn wɔn agya ho. 37 Na abakan no woo ɔbabarima, na ɔtoo no din Moab; ɔne Moabfoɔ agya de bɛsi nnɛ. 38 Na akumaa no nso woo ɔbabarima, na ɔtoo no din Ben-ami; ɔne Amon mma agya de bɛsi nnɛ.",https://www.bible.com/bible/1461/GEN.19.ASWDC
GYENESIS 20,"Abraham ne Abimelek
1 Na Abraham tutu firii hɔ kɔɔ Negeb asase so, na ɔkɔtenaa Kades ne Sur ntam. Na ɔkɔtenaa Gerar nso.
2Ɛhɔ Abraham kaa ne yere Sara ho sɛ: Ɔyɛ me nuabaa. Na Gerar hene Abimelek soma maa wɔbɛfaa Sara.
3Na Onyankopɔn baa Abimelek nkyɛn anadwo daeɛ mu, na ɔka kyerɛɛ no sɛ: Hwɛ, ɔbaa a woakɔfa no no nti, woawu awie, ɛfiri sɛ ɔyɛ ɔbarima bi yere. 4Nso na Abimelek nnya mfaa ne ho nkaa no. Na ɔkaa sɛ: AWURADE, wobɛkum ɔman tenenee nso? 5Ɛnyɛ ɔno na ɔka kyerɛɛ me sɛ: Me nua ne no? Na ɔbaa no nso kaa sɛ: Me nua ne no. M’akomam kann ne me tirim fitaa na mede meyɛɛ yei. 6Na Onyankopɔn ka kyerɛɛ no daeɛ mu sɛ: Me nso menim sɛ w’akomam kann na wode yɛɛ yei, na me nso mesɔɔ wo mu, na woanyɛ bɔne, ɛno nti na mamma woamfa wo ho anka no no. 7 Na afei dane ɔbarima no yere kɔma no, ɛfiri sɛ ɔyɛ odiyifoɔ, na wapa kyɛw ama wo, na woanya nkwa; na sɛ woannane no ankɔma no a, ɛnneɛ, hunu sɛ wuo na wobɛwuo, wo ne deɛ ɛwɔ woɔ nyinaa. 8Na Abimelek sɔree anɔpatutu frɛɛ ne nkoa nyinaa, na ɔkaa nsɛm yi nyinaa guu wɔn aso mu, na nnipa no suroo pii.
9Na Abimelek frɛɛ Abraham ka kyerɛɛ no sɛ: Ɛdeɛn na woayɛ yɛn yi, na bɔne bɛn na mayɛ woɔ, na wode bɔne kɛseɛ yi aba me ne m’ahennie soɔ? Adeɛ a wɔnyɛ na woayɛ me yi. 10Na Abimelek ka kyerɛɛ Abraham sɛ: Ɛdeɛn na wohunuiɛ na wodii saa asɛm yi? 11Na Abraham kaa sɛ: Ɛfiri sɛ mesusuu sɛ, ampa Onyankopɔn ho suro nni ha yi, na me yere nti wɔbɛku me. 12Nanso ɛwom ampa sɛ ɔyɛ me nua; m’agya ba ne no, na ɛnyɛ me na ba a; na wayɛ me yere. 13Na Onyankopɔn maa mefirii m’agya fie mebɛkyiniiɛ no, mesee ɔbaa no sɛ: W’adɔeɛ a wobɛyɛ me ne sɛ, baabiara a yɛbɛduro no, ka no me ho sɛ: Ɔyɛ me nua.
14Ɛnna Abimelek faa nnwan ne anantwie ne nkoa ne mfenaa de maa Abraham, na ɔdanee ne yere Sara maa no. 15Na Abimelek kaa sɛ: Hwɛ, m’asase na ɛda w’anim yi, baabiara a ɛyɛ wɔ w’ani soɔ no, tena. 16Na Sara deɛ, ɔka kyerɛɛ no sɛ: Hwɛ, mama wo nua nnwetɛbena apem, hwɛ, ɛno na wɔn a wɔka wo ho nyinaa de bɛhunu wo tirim, na wo ho afi nnipa nyinaa anim.
17Na Abraham bɔɔ Onyankopɔn mpaeɛ, na Onyankopɔn saa Abimelek ne ne yere ne ne mfenaa yadeɛ maa wɔwowoe. 18Ɛsiane Abraham yere Sara ho asɛm no nti, na AWURADE ato Abimelek fiefoɔ mmaa nyinaa yafunu mu.",https://www.bible.com/bible/1461/GEN.20.ASWDC
GYENESIS 21,"Isak awoɔ
1 Na AWURADE bɛhwɛɛ Sara sɛdeɛ ɔkaeɛ no, na ɔyɛɛ Sara sɛdeɛ ɔhyɛɛ no bɔ no. 2 Na Sara nyinsɛnee, na ɔwoo ɔbabarima maa Abraham wɔ ne nkɔkoraaberɛ mu, berɛ a Onyankopɔn kaa ne ho asɛm no mu. 3 Abraham too ɔba a Sara wo maa no no din Isak.
4 Na Abraham ba Isak dii nnawɔtwe no, ɔtwaa no twetia sɛdeɛ Onyankopɔn hyɛɛ no no. 5 Na Abraham adi mfirinhyia ɔha berɛ a wɔwoo ne ba Isak maa no no.
6 Na Sara kaa sɛ: Onyankopɔn ama me sereɛ, obiara a ɔbɛteɛ no bɛsere ama me. 7Na ɔse: Hwan na anka ɔbɛka akyerɛ Abraham sɛ Sara bɛma mma nufoɔ? Nanso hwɛ, mawo ba ama no ne nkɔkoraaberɛ mu. 8Na abɔfra no nyinii, na wɔtwaa no nufoɔ. Na da a wɔtwaa Isak nufoɔ no, Abraham too pono kɛseɛ.
Wɔpamo Hagar ne Ismael
9Na Sara hunuu Misraimni Hagar ba a ɔwo maa Abraham no sɛ ɔredi fɛw. 10 Na ɔka kyerɛɛ Abraham sɛ: Pamo afenaa yi ne ne ba no, na ɛnyɛ afenaa yi ba ne me ba Isak na ɛbɛdi adeɛ. 11Na ne ba no nti, asɛm no yɛɛ Abraham ya yie. 12 Na Onyankopɔn ka kyerɛɛ Abraham sɛ: Mma abɔfra no ne w’afenaa asɛm no nnyɛ wo ya, na deɛ Sara ka kyerɛɛ woɔ nyinaa, tie, na Isak mu na wɔbɛfrɛ w’asefoɔ. 13 Na afenaa ba no nso, mɛyɛ no ɔman kɛseɛ, ɛfiri sɛ ɔyɛ w’aseni. 14Na Abraham sɔree anɔpatutu faa aduane ne nsuo kotokuo, na ɔde maa Hagar, ɔde sii ne kɔn ho, na ɔmaa no ne abɔfra no kɔe. Na ɔkɔe kɔkyinkyinii Beer-seba serɛ so.
15Na nsuo no saa wɔ kotokuo no mu no, ɔgyaa abɔfra no too dɔtɔ bi ase. 16Ɛnna ɔkɔ kɔtenaa akyiri bɛyɛ sɛ deɛ wɔto bɛmma a ɛbɛtɔ, na ɔse: Mma mennhunu abɔfra yi wuo! Na ɔtenaa ne ntentensoɔ, na ɔmaa ne nne so sui.
17Na Onyankopɔn tee abarimaa no nne, na Nyankopɔn bɔfoɔ firi soro frɛɛ Hagar bisaa no sɛ: Hagar, ɛdeɛn na ɛreyɛ woɔ? Nsuro, na Onyankopɔn ate abarimaa no nne wɔ deɛ ɔwɔ hɔ. 18Sɔre ma abarimaa no so, na fa wo nsa sɔ ne mu; na mɛyɛ no ɔman kɛseɛ. 19Na Onyankopɔn buee n’ani, na ɔhunuu subura bi, na ɔkɔ kɔsaa bi hyɛɛ nsuo kotokuo no ma, na ɔde bi maa abarimaa no nomee. 20Na Onyankopɔn dii abarimaa no akyi, na ɔnyinii, na ɔtenaa ɛserɛ so hɔ yɛɛ agyantoni. 21 Na ɔtenaa Paran serɛ so; na ne na kɔwaree yerɛ firi Misraim asase so brɛɛ no.
Abimelek ne Abraham apam
22 Na berɛ no mu no, Abimelek ne ne safohene Pikol bɛka kyerɛɛ Abraham sɛ: Onyankopɔn di w’akyi wɔ biribiara a woyɛ mu. 23 Enti afei ka Onyankopɔn ntam kyerɛ me sɛ worentwa me ne me mma ne me mmanana nkontompo, na sɛ adɔeɛ a meyɛɛ woɔ no teɛ no, wode bi bɛyɛ me ne m’asase a woabɛyɛ hɔhoɔ wɔ soɔ yi. 24Na Abraham kaa sɛ: Mɛka ntam no. 25 Na asubura bi a Abimelek nkoa nam aniɛden so gyeeɛ no nti, Abraham kaa Abimelek anim. 26Na Abimelek kaa sɛ: Mennim deɛ ɔyɛɛ saa adeɛ yi, na wo nso, woanka ankyerɛ me, nanso mentee da, gye nnɛ. 27Na Abraham de nnwan ne anantwie maa Abimelek, na wɔn baanu pamee. 28Na Abraham yii nnwanten mma abereɛ nson gyinaa fa. 29Na Abimelek bisaa Abraham sɛ: Nnwanten mma abereɛ nson a woyii wɔn gyinaa fa yi aseɛ ne sɛn? 30Na ɔkaa sɛ: Nnwanten mma abereɛ nson yi, gye wɔ me nsam, na ɛnyɛ me adanseɛ sɛ me na metuu abura yi. 31 Enti ɔfrɛɛ hɔ Beer-seba, ɛfiri sɛ ɛhɔ na wɔn baanu nyinaa kekaa ntam. 32Na wɔpamee wɔ Beer-seba; na Abimelek ne ne safohene Pikol sɔree, na wɔsane kɔɔ Filistifoɔ asase so. 33 Na Abraham duaa ɛsɛnteɛ dua wɔ Beer-seba, na ɔsɔree AWURADE a ɔyɛ daa Nyankopɔn no wɔ hɔ. 34Na Abraham yɛɛ ɔhɔhoɔ Filistifoɔ asase so nna pii.",https://www.bible.com/bible/1461/GEN.21.ASWDC
GYENESIS 22,"Onyankopɔn hyɛ Abraham sɛ ɔmfa Isak mmɔ afɔreɛ
1 Na nsɛm yi akyiri no, Onyankopɔn sɔɔ Abraham hwɛe, na ɔka kyerɛɛ no sɛ: Abraham! Na ɔse: Menie. 2 Na ɔkaa sɛ: Fa wo ba, wo ba korɔ a wodɔ no, Isak, kɔ Moria asase so, na fa no kɔbɔ ɔhyeɛ afɔdeɛ wɔ hɔ, wɔ mmepɔ no mu baako a mɛkyerɛ woɔ so.
3Na Abraham sɔree anɔpatutu, na ɔhyehyɛɛ n’afunumu, na ɔfaa n’asomfoɔ mu baanu ne ne ba Isak kaa ne ho, na ɔtwaa ɔhyeɛ afɔdeɛ nnyina, na ɔsii mu kɔɔ faako a Onyankopɔn kyerɛɛ no no. 4Na da a ɛtɔ so mmiɛnsa no, Abraham maa n’ani so, na ɔhunuu beaeɛ hɔ wɔ akyirikyiri. 5Na Abraham ka kyerɛɛ ne somfoɔ no sɛ: Mo ne afunumu yi ntena ha; na me ne abarimaa yi bɛkɔ nohoa akɔsɔre, na yɛasane aba mo nkyɛn. 6Na Abraham faa ɔhyeɛ afɔdeɛ nnyina no de soaa ne ba Isak, na ɔfaa ogya ne sekan kurae, na wɔn baanu kɔe. 7Na Isak ka kyerɛɛ n’agya Abraham sɛ: M’agya! Na ɔse: Menie, me ba. Na ɔse: Hwɛ, ogya ne nnyina nie, na adwammaa a wɔde rekɔbɔ ɔhyeɛ afɔdeɛ no wɔ he? 8Na Abraham se: Me ba, Onyankopɔn ankasa bɛkyerɛ ɔhyeɛ afɔdeɛ adwammaa no. Na wɔn baanu kɔe. 9Na wɔkɔduruu deɛ Onyankopɔn kyerɛɛ no hɔ, na Abraham sii afɔrebukyia wɔ hɔ, na ɔsiesiee nnyina no, na ɔkyekyeree ne ba Isak, na ɔde no too afɔrebukyia no so wɔ nnyina no so. 10 Afei Abraham tenee ne nsa faa sekan no sɛ ɔde rebɛkum ne ba no.
11Na AWURADE bɔfoɔ firi soro frɛɛ no sɛ: Abraham, Abraham! Na ɔse: Menie. 12 Na ɔse: Mfa wo nsa nka abarimaa no, nso nyɛ no hwee. Afei na mahunu sɛ wosuro Onyankopɔn, na woankame me wo ba korɔ no.
13Na Abraham maa n’ani so, na ɔhunuu odwennini a dɔtɔ asɔ ne mmɛn mu wɔ n’akyi. Na Abraham kɔfaa odwennini no de no sii ne ba no ananmu bɔɔ ɔhyeɛ afɔdeɛ.
14Na Abraham too bea hɔ din sɛ: Yahwe-yir’e. Enti wɔka no nnɛ ara sɛ: AWURADE bepɔ so na wɔbɛhwɛ.
15Na AWURADE bɔfoɔ firi soro frɛɛ Abraham bio sɛ: 16 Sɛ AWURADE seɛ nie: Ɛsiane sɛ woayɛ saa asɛm yi, na woankame me wo ba korɔ no nti, maka me ho ntam sɛ: 17 Hyira na mɛhyira woɔ, na dɔ na mɛma w’asefoɔ adɔre sɛ ɔsoro nsoromma ne mpoano anwea. Na w’asefoɔ bɛfa wɔn atamfoɔ nkuro ano apono adi so. 18 Na w’asefoɔ mu na wɔbɛhyira asase so amanaman nyinaa, ɛfiri sɛ woatie me nne. 19Ɛnna Abraham sane baa ne mmeranteɛ no nkyɛn, na wɔsɔre sii mu baa Beer-seba. Na Abraham tenaa Beer-seba.
Nahor asefoɔ
20 Na nsɛm yi akyiri no, wɔka kyerɛɛ Abraham sɛ: Hwɛ, Milka nso awo mma ama wo nua Nahor: 21N’abakan Us ne ne nua Bus ne Kemuel a ɔyɛ Aram agya, 22ne Kesed ne Haso ne Pildas ne Yidlaf ne Betuel. 23 Na Betuel woo Rebeka. Nnipa baawɔtwe yi na Milka wo maa Abraham nua Nahor. 24Na ne mpena baako bi a wɔfrɛ no Rehuma nso woo Teba, Gaham, Tahas ne Maaka.",https://www.bible.com/bible/1461/GEN.22.ASWDC
GYENESIS 23,"Sara wuo ne ne sie
1Na Sara nkwa nna a ɔdiiɛ nyinaa yɛ mfirinhyia ɔha aduonu nson. 2Na Sara wuu wɔ Kiriat-arba, (ɛne Hebron) a ɛwɔ Kanaan asase soɔ no. Na Abraham ba bɛsuu Sara abia; ɔsuu no.
3Na Abraham sɔre firii n’amu no anim, na ɔne Het mma kɔkasaa sɛ: 4 Meyɛ mo nkyɛn hɔhoɔ ne mamfrani, momma me amusiebea wɔ mo nkyɛn, na mensie m’amu yi ma no mfiri m’ani so. 5Na Het mma no buaa Abraham see no sɛ: 6Owura, tie yɛn! Okunini bi ne wo wɔ yɛn mu. Yɛn ada mu deɛ wopɛ no, sie w’amu no wɔ mu. Yɛn mu biara renkame wo ne da, sɛ nsie w’amu wɔ mu. 7Na Abraham sɔre gyinae, na ɔbɔɔ ne mu ase maa asase no so nkurɔfoɔ, Het mma no, 8na ɔne wɔn kasaa sɛ: Sɛ ɛyɛ mo pɛ sɛ mesie m’amu yi ma no firi m’ani so a, montie me, na monsrɛ Efron, Sohar ba, mma me, 9na ɔmfa Makpela bodan a ɛyɛ ne deɛ, na ɛwɔ n’afuo ano no mma me; ɔnnye me n’abotene na ɔmfa mma me, na mennya asieeɛ wɔ mo ha. 10Na Efron te Het mma no mu. Na Hetini Efron buaa Abraham maa Het mma no tee wɔ wɔn a wɔhyɛne ne kuro pono mu no nyinaa anim sɛ: 11Dabi, me wura, tie me: Mede afuo no mema wo, na ɔbodan a ɛwɔ mu no nso mede mema wo. Me man mma anim na mede ma woɔ yi, sie w’amu. 12Na Abraham bɔɔ ne mu ase wɔ asase no so nkurɔfoɔ no anim, 13na ɔkasa kyerɛɛ Efron maa asase no so nkurɔfoɔ no tee sɛ: Sɛ wotie me a, mede afuo no tiri dwetɛ bɛma wo; gye no me nsam, na mensie m’amu wɔ hɔ. 14Na Efron buaa Abraham see no sɛ: 15Me wura, tie, nnwetɛbena ahanan asase yɛ deɛn wɔ me ne wo ntam? W’amu ara na sie. 16Na Abraham tiee Efron, na Abraham karii dwetɛ a Efron bɔɔ din maa Het mma teeɛ no maa no, nnwetɛbena ahanan a adwadifoɔ die no. 17Na wɔde Efron afuo a ɛwɔ Makpela a ɛda Mamre ntentensoɔ no, afuo no ne ɔbodan a ɛwɔ mu no ne afuo no so nnua nyinaa, deɛ ɛwɔ n’ahyeɛ nyinaa soɔ, 18hyɛɛ Abraham nsa wɔ Het mma no anim, wɔn a wɔhyɛne ne kuro pono mu no nyinaa anim.
19Na ɛno akyiri no, Abraham siee ne yere Sara wɔ Makpela afuo mu ɔbodan mu, wɔ Mamre ntentensoɔ, (a ɛne Hebron) a ɛwɔ Kanaan asase soɔ no. 20 Na Het mma de afuo no ne ɔbodan a ɛwɔ mu no hyɛɛ Abraham nsa sɛ amusiebea.",https://www.bible.com/bible/1461/GEN.23.ASWDC
