Title,Content,URL
GYENESIS 29,"Yakob kɔduru Laban fie
1Na Yakob sii mu kɔɔ nnipa a wɔte apueeɛ fam asase so. 2Na ɔhunui asubura bi wɔ wiram, na hwɛ, nnwankuo mmiɛnsa boaboa ho wɔ hɔ, ɛfiri sɛ abura no mu nsuo na wɔsa ma nnwankuo no nom, na ɔboɔ kokuroo da abura no ano. 3Ɛhɔ na wɔboa nnwankuo nyinaa ano, na wɔmuni ɔboɔ no firi abura no ano, na wɔma nnwan no nom, na wɔmuni ɔboɔ no to abura no so bio wɔ ne daberɛ hɔ. 4Na Yakob bisaa wɔn sɛ: Me nuanom, mofiri he? Na wɔse: Yɛfiri Haran. 5Na ɔsee wɔn sɛ: Monim Nahor ba Laban anaa? Na wɔse: Yɛni no. 6Na ɔbisaa wɔn sɛ: Ne ho yɛ? Na wɔbuaa sɛ: Ne ho yɛ, na hwɛ, ne babaa Rahel ne nnwan na ɛreba yi. 7Na ɔka kyerɛɛ wɔn sɛ: Hwɛ, adeɛ nnya nsae koraa, na ɛberɛ a wɔboaboa mmoakuo ano nnya nnurui. Momma nnwan no nsuo nnom, na monkɔ mma wɔnkɔdidi. 8Na wɔse: Yɛntumi, gye sɛ wɔaboaboa nnwankuo no nyinaa ano, na wɔamuni ɔboɔ no afiri abura no ano, ansa na yɛama nnwan no anom.
9Na Yakob ne wɔn da so rekasa no, Rahel ne n’agya nnwan no bae, ɛfiri sɛ na ɔyɛ odwanhwɛfoɔ. 10Na Yakob hunuu ne na nua Laban ba Rahel ne ne na nua Laban nnwan no no, ɔtwe pinii kɔmunii ɔboɔ no firii asubura no ano, na ɔmaa ne na nua nnwan no nsuo nomee. 11Na Yakob fee Rahel ano, na ɔmaa ne nne so sui. 12Na Yakob ka kyerɛɛ Rahel sɛ ɔyɛ n’agya busuani, na ɔyɛ Rebeka ba. Na Rahel tutuu mmirika kɔka kyerɛɛ n’agya.
13Na Laban tee ne nua ba Yakob nka no, ɔtuu mmirika kɔhyiaa no, na ɔyɛɛ no atuu fee n’ano, na ɔde no baa ne fie. Na ɔbɔɔ n’amanneɛ kyerɛɛ Laban. 14Na Laban ka kyerɛɛ no sɛ: Ampa, woyɛ me dompe ne me honam. Na ɔtenaa ne nkyɛn bɛyɛ bosome.
Yakob som Laban de ware Lea ne Rahel
15Na Laban bisaa Yakob sɛ: Ɛnam sɛ woyɛ me busuani nti, wobɛsom me kwa anaa? Kyerɛ me deɛ ɛnyɛ w’akatua. 16Nso Laban wɔ mmammaa baanu, ɔpanin no din de Lea, na akumaa no din de Rahel. 17Na Lea animma yɛ nketewa, na Rahel ho yɛ fɛ, na n’anim yɛ nyam.
18Na Yakob dɔ Rahel, na ɔkaa sɛ: Wo ba kumaa Rahel nti mɛsom wo mfeɛ nson. 19Na Laban se: Ɛyɛ sɛ mede no mema woɔ sene sɛ mede no bɛma onipa foforɔ bie; tena me nkyɛn. 20Na Rahel nti Yakob som mfeɛ nson, na dɔ a ɔdɔ no nti ɛyɛɛ n’ani so sɛ nna mfuamfua bi. 21Na Yakob ka kyerɛɛ Laban sɛ: Fa me yere ma me, na me nna no adu, na mene no nna. 22Na Laban boaboaa kurom hɔfoɔ nyinaa ano, na ɔtoo pono.
23Na anadwofa no ɔde ne ba Lea brɛɛ no, na ɔne no dae. 24(Na Laban de n’abaawa Silpa maa ne ba Lea yɛɛ n’abaawa.) 25Na adeɛ kyeeɛ no, Yakob hunuu sɛ ɛyɛ Lea mmom. Na ɔbisaa Laban sɛ: Ɛdeɛn na woayɛ me yi? Ɛnyɛ Rahel nti na mesom woɔ? Na adɛn nti na woadaadaa me yi? 26Ɛnna Laban se: Yɛn ha deɛ, wɔnyɛ no saa, wɔmma akumaa nware ansa na wɔde abakan ama. 27 Di ne nkyɛn nnawɔtwe yi, na yɛde oyi nso bɛma wo, som a wobɛsom me mfeɛ nson bio ho.
28Na Yakob yɛɛ saa, na ɔdii ne nkyɛn nnawɔtwe no. Na ɔde ne ba Rahel maa no awareɛ. 29(Na Laban de n’abaawa Bilha maa ne ba Rahel yɛɛ n’abaawa.) 30 Na Yakob ne Rahel nso dae, na ɔdɔ Rahel sene Lea, na ɔsomm no mfeɛ nson bio.
Yakob mma
31Na AWURADE hunuu sɛ wɔtane Lea no, ɔbuee ne yafunu mu, na Rahel deɛ, ɔyɛɛ obonini.
32Na Lea nyinsɛnee, na ɔwoo ɔbabarima, na ɔtoo no din Ruben, na ɔse: AWURADE ahwɛ m’amaneɛ, na afei deɛ, me kunu bɛdɔ me. 33Na ɔnyinsɛnee bio, na ɔwoo ɔbabarima, na ɔkaa sɛ: AWURADE ate sɛ wɔtane me nti na ɔde oyi nso ama me. Na ɔtoo no din Simeon. 34Na ɔnyinsɛnee bio, na ɔwoo ɔbabarima, na ɔse: Afei ansa na me kunu de ne ho bɛfam me ho, ɛfiri sɛ me ne no awo mmammarima baasa. Enti ɔtoo no din Lewi. 35Na ɔnyinsɛnee bio, na ɔwoo ɔbabarima, na ɔse: Yei deɛ mɛyi AWURADE ayɛ. Enti ɔtoo no din Yuda. Na n’awoɔ mu twee.",https://www.bible.com/bible/1461/GEN.29.ASWDC
GYENESIS 30,"1Na Rahel hunuu sɛ ɔnwo mma Yakob no, ɔtwee ne nuabaa no ho kora, na ɔka kyerɛɛ Yakob sɛ: Ma me mma, na anyɛ saa a, mɛwu. 2 Na Yakob bo fuu Rahel kaa sɛ: Mesi Nyankopɔn a ɔkame wo wo yam mma no ananmu anaa? 3 Na Rahel kaa sɛ: Hwɛ, m’afenaa Bilha nie, wo ne no nna, na ɔnwo ngu me srɛ so, na me nso mennya ne ho mma. 4Na ɔde n’abaawa Bilha maa no awareɛ, na Yakob ne no dae.
5Na Bilha nyinsɛnee, na ɔwoo ɔbabarima maa Yakob. 6Na Rahel kaa sɛ: Onyankopɔn adi m’asɛm, na watie me nne nso ama me ɔba. Enti ɔtoo no din Dan. 7Na Rahel abaawa Bilha nyinsɛnee bio, na ɔwoo ɔbabarima a ɔtɔ so mmienu maa Yakob. 8Na Rahel kaa sɛ: Ako akɛseɛ na me ne me nuabaa adie, nso matumi no. Na ɔtoo no din Naftali.
9 Na Lea hunuu sɛ n’awoɔ mu atwe no, ɔde n’abaawa Silpa maa Yakob awareɛ. 10Na Lea abaawa Silpa woo ɔbabarima maa Yakob. 11Na Lea kaa sɛ: Aba yie. Na ɔtoo no din Gad. 12Na Lea abaawa Silpa woo ɔbabarima a ɔtɔ so mmienu maa Yakob. 13Na Lea kaa sɛ: M’ahotɔ nie! Na mmaa bɛfrɛ me deɛ wɔahyira no. Na ɔtoo no din Aser.
14Na ayuo twaberɛ mu no, Ruben firii adi kɔhunuu dudaim wɔ wiram, na ɔde brɛɛ ne na Lea. Na Rahel ka kyerɛɛ Lea sɛ: Ma me wo ba dudaim yi bi ɛ! 15Na ɔka kyerɛɛ no sɛ: Ɛnnɔɔso sɛ woafa me kunu? Na worebɛgye me ba dudaim nso anaa? Na Rahel se: Wo ba dudaim no nti ma ɔne wo nkɔda anadwo yi. 16Na anwummerɛ a Yakob firi wiram reba no, Lea firii adi kɔhyiaa no kaa sɛ: Bra me nkyɛn, ɛfiri sɛ ampa ara mede me ba dudaim matɔ wo. Na ɔne no daa anadwo no.
17Na Onyankopɔn tiee Lea, na ɔnyinsɛnee, na ɔwoo ɔbabarima a ɔtɔ so nnum maa Yakob. 18Na Lea kaa sɛ: Onyankopɔn atua me ka, sɛ mede m’abaawa mama me kunu awareɛ. Na ɔtoo no din Isakar. 19Na Lea nyinsɛnee bio, na ɔwoo ɔbabarima a ɔtɔ so nsia maa Yakob. 20Na Lea kaa sɛ: Onyankopɔn akyɛ me akyɛdeɛ pa, afei deɛ, me kunu ne me bɛtena yie, ɛfiri sɛ mawo mmammarima baasia mama no. Na ɔtoo no din Sebulon. 21Na ɛno akyiri no, ɔwoo ɔbabaa, na ɔtoo no din Dina.
22 Na Onyankopɔn kaee Rahel, na Onyankopɔn tiee no, na ɔbuee ne yam. 23 Na ɔnyinsɛnee, na ɔwoo ɔbabarima, na ɔse: Onyankopɔn ayi m’ahohora. 24Na ɔtoo no din Yosef sɛ: AWURADE mma me ɔba foforɔ nka ne ho.
Laban ne Yakob nnaadaa
25Na Rahel woo Yosef no, Yakob ka kyerɛɛ Laban sɛ: Gya me kwan na menkɔ me kurom ne m’asase so. 26 Fa me yerenom ne me mma a wɔn nti mesomm woɔ no ma me. Wo ara wonim me som a masom woɔ.
27 Na Laban ka kyerɛɛ no sɛ: Ma mennya w’anim animuonyam, na mahunu sɛ wo nti AWURADE ahyira me. 28Kyerɛ me w’akatua a woregye me, na mɛma. 29Na Yakob see no sɛ: Wo ara wonim sɛdeɛ masom wo afa ne sɛdeɛ wo mmoakuo ayɛ wɔ m’aseɛ. 30Mebaa wo nkyɛn no, na deɛ wowɔ no sua, na afei aseɛ atrɛ ayɛ pii, na AWURADE ahyira wo baabiara a mefa. Na afei da bɛn na menhwɛ me fie nso? 31Na ɔbisaa sɛ: Ɛdeɛn na memma woɔ? Na Yakob se: Mma me biribiara; sɛ wobɛyɛ saa adeɛ yi ama me deɛ a, mɛsane mabɛyɛne wo nnwan na mahwɛ wɔn. 32Ɛnnɛ mɛkɔ makɔfa wo nnwan nyinaa mu, na mayiyi emu nnwan a wɔn ho yɛ ntokontrama ne nworonnworan nyinaa ne nnwammire nyinaa wɔ nnwanten no mu ne mmirekyie no mu nworonnworan ne ntokontrama. Wɔn a wɔtete sɛɛ na ɛnyɛ m’akatua. 33Na daakye bi a wobɛka m’akatua ho asɛm no, me tenenee abua ama me wɔ w’anim. Mmirekyie no mu biara a ne ho nyɛ ntokontrama ne nworonnworan, ne nnwanten no mu deɛ ɔnyɛ odwammire no, ma wɔmmu no awifodeɛ wɔ me nsam. 34Na Laban se: Hwɛ, ma no nyɛ sɛdeɛ woaka yi ɛ! 35Na da no ara ɔyiyii mpapo a wɔn ho yɛ nsensannsensan ne nworonnworan, ne mmirekyibereɛ a wɔn ho yɛ ntokontrama ne nworonnworan nyinaa, obiara a fufuo wɔ ne ho, ne nnwanten no mu nnwammire nyinaa. Na ɔde wɔn hyɛɛ ne mmammarima nsa. 36Na ɔde nnansa kwan too ɔne Yakob ntam, na Yakob yɛnee Laban nnwan a ɛkaeɛ no.
37Na Yakob faa sɛsɛ dua, ɛdwono dua ne kyɛnkyɛn dua mman mono, na ɔyiyii ho nsema fitafitaa maa mmaa no ho fitaa no fifirii adi. 38Na ɔde mmaa a ɔyiyii ho no guu anomeeɛ adaaseɛ a nnwan no rebɛnom mu nsuo no mu wɔ nnwan no anim, na wɔba nsunom a, wɔanyenyem so. 39Na nnwan no nyenyem mmaa no so, na wɔwowoo nsensannsensan, ntokontrama ne nworonnworan. 40Na Yakob yiyii nnwammaa no, na ɔde nnwan no ani kyerɛɛ Laban nnwan no mu nsensannsensan ne nnwammire nyinaa. Na ɔyɛɛ ɔno ara nnwankuo nko wɔ fa baabi, na wamfa wɔn amfra Laban nnwan no mu. 41Na sɛ daa nnwan a wɔn ho yɛ den no nyenyem a, na Yakob de mmaa no akɔgu adaaseɛ no mu wɔ nnwan no anim, na wɔanyenyem mmaa no so. 42Na nnwan no yɛ nofonofo deɛ a, ɔmfa ngu mu. Na wɔn a wɔyɛ mmerɛ no yɛɛ Laban dea, na wɔn a wɔn ho yɛ den no yɛɛ Yakob dea. 43 Na ɔbarima no yɛɛ kɛseɛ pa ara, na ɔnyaa nnwan pii ne mfenaa ne nkoa ne yoma ne mfunumu.",https://www.bible.com/bible/1461/GEN.30.ASWDC
GYENESIS 31,"Yakob dwane firi Laban nkyɛn
1 Na ɔtee Laban mmammarima nsɛm a wɔkaeɛ no sɛ: Yakob afa deɛ ɛyɛ yɛn agya deɛ nyinaa; na ɛno na ɔde anya saa agyapadeɛ yi nyinaa. 2Na Yakob hunuu Laban anim, na hwɛ, ɛnte no sɛdeɛ na ɛteɛ kane no. 3 Na AWURADE ka kyerɛɛ Yakob sɛ: Sane kɔ wo nananom asase so ne w’abusua mu, na mɛdi w’akyi. 4Na Yakob soma maa wɔkɔfrɛɛ Rahel ne Lea baa wiram wɔ ne nnwan no nkyɛn, 5 na ɔka kyerɛɛ wɔn sɛ: Mehunu mo agya anim sɛ ɛnte me sɛdeɛ na ɛteɛ kane no; nanso m’agya Nyankopɔn adi m’akyi. 6Na mo ara monim sɛ m’ahoɔden nyinaa na mede masom mo agya, 7na mo agya asisi me, adane m’akatua ani mprɛdu; nanso Onyankopɔn amma no kwan amma no anyɛ me bɔne biara. 8 Sɛ ɔka sɛ: Wɔn a wɔn ho yɛ ntokontrama no nyɛ w’akatua a, na nnwan no nyinaa awowo ntokontrama. Na sɛ ɔka sɛ: Wɔn a wɔn ho yɛ nsensannsensan no nyɛ w’akatua a, na nnwan no nyinaa awowo nsensannsensan. 9Na Onyankopɔn agye mo agya mmoakuo ama me. 10Na berɛ a mmoa no refoforo wɔn ho na wɔanyinsɛn no, memaa m’ani so na mehunui wɔ daeɛ mu, na hwɛ, mpapo a na wɔforo mmirekyie no, wɔn ho yɛ nsensannsensan ne ntokontrama ne nworonnworan. 11Na Nyankopɔn bɔfoɔ ka kyerɛɛ me daeɛ mu sɛ: Yakob! Na mese: Menie. 12Na ɔse: Ma w’ani so hwɛ, adwennini no a wɔreforo nnwan no nyinaa yɛ nsensannsensan ne ntokontrama ne nworonnworan: Ɛfiri sɛ mahunu deɛ Laban ayɛ woɔ nyinaa. 13 Mene Nyankopɔn a wohyiaa no Betel faako a wosraa ɛhɔ dum na wohyɛɛ bɔ maa me no; afei sɔre firi asase yi so, na sane kɔ w’abusua asase so. 14Na Rahel ne Lea bua see no sɛ: Yɛda so wɔ kyɛfa anaasɛ agyapadeɛ bi wɔ yɛn agya fie anaa? 15 Ɔmmu yɛn ahɔhoɔ anaa? Ɛsiane sɛ watɔn yɛn, na wadi yɛn tiri sika awie, 16na ahonyadeɛ a Onyankopɔn gyee yɛn agya nsam no yɛ yɛn ne yɛn mma dea. Enti afei yɛ deɛ Onyankopɔn aka akyerɛ woɔ nyinaa.
Yakob dwane firi Laban anim
17Na Yakob sɔre faa ne mma ne ne yerenom tenatenaa yoma so, 18na ɔfaa ne mmoakuo nyinaa ne n’ahodeɛ a ɔnyaeɛ nyinaa ne mmoakuo a ɔnyaeɛ wɔ Mesopotamia no nyinaa sii mu sɛ ɔrekɔ n’agya Isak nkyɛn wɔ Kanaan asase so.
19Na Laban kɔ rekɔtwitwa ne nnwan ho nwi. Na Rahel wiaa n’agya abusua honi. 20Na Yakob wiaa ne ho dwanee, ɛfiri sɛ wankra Aramni Laban. 21Na ɔne deɛ ɔwɔ nyinaa dwanee, na ɔsɔre twaa asubɔnten no, na ɔde n’ani kyerɛɛ Gilead bepɔ.
Laban ti Yakob
22Na da a ɛtɔ so mmiɛnsa no, wɔkɔka kyerɛɛ Laban sɛ Yakob adwane. 23 Na Laban faa ne nkurɔfoɔ kaa ne ho tii no nnanson kwan, na ɔbɛtoo no Gilead bepɔ so. 24 Na Onyankopɔn baa Aramni Laban nkyɛn anadwo daeɛ mu sɛ: Hwɛ yie, na woankasa papa anaa bɔne so ankyerɛ Yakob. 25Na Laban kɔtoo Yakob. Na Yakob asi ne ntomadan wɔ bepɔ no so, na Laban ne ne nkurɔfoɔ nso sii wɔn deɛ Gilead bepɔ so.
26Na Laban bisaa Yakob sɛ: Ɛdeɛn na woayɛ yi, sɛ woawia wo ho adwane me, na woasoa me mmammaa kɔ sɛ wɔn a wɔde nkrantɛ afa wɔn nnommum yi? 27Adɛn nti na woahunta adwane, na woawia wo ho afiri me nkyɛn? Adɛn na woanka ankyerɛ me, na mamfa anigyeɛ ne nnwom, mpintin ne nsankuo mannya wo kwan? 28Adɛn nti na woamma mamfe me mmammarima ne me mmammaa ano anya wɔn kwan? Yei deɛ, woadi no nkwasea so. 29Mewɔ tumi sɛ anka me ne mo di no bɔne; nanso nnora anadwo no, mo agya ne Nyankopɔn kasa kyerɛɛ me sɛ: Hwɛ yie, na woankasa papa anaa bɔne so ankyerɛ Yakob. 30Na afei deɛ korɔ ara na wopɛ sɛ wokorɔ, ɛfiri sɛ gyina na w’ani agyina w’agya fie; na adɛn nti na woawia m’anyame? 31Na Yakob bua see Laban sɛ: Na mesuro, ɛfiri sɛ mesusuu sɛ wobɛgye wo mmammaa afiri me nsam. 32 Na deɛ wobɛhunu w’anyame wɔ ne nsa mu no rentena ase. Yɛn nkurɔfoɔ yi anim na hwehwɛ deɛ ɛyɛ wo dea wɔ me nkyɛn, na fa kɔ. Na Yakob nnim sɛ Rahel na ɔwiaeɛ. 33Na Laban kɔɔ Yakob ntomadan mu ne Lea ntomadan ne mfenaa baanu no ntomadan mu, nanso wanhunu. Na ɔfiri Lea ntomadan mu kɔɔ Rahel ntomadan mu.
34Na Rahel afa abusua honi no de ahyehyɛ yoma so adwa mu atena so. Na Laban de ne nsa kekaa ntomadan mu hɔ nyinaa, nanso wanhunu. 35Na ɔka kyerɛɛ n’agya sɛ: Mma no nnyɛ me wura abufuo sɛ mentumi mensɔre wɔ w’anim, ɛfiri sɛ mabu me nsa. Na ɔpɛe pɛe pɛe, nanso wanhunu ahoni no.
36Na Yakob bo fui, na ɔne Laban hamee, na Yakob ka kyerɛɛ Laban sɛ: Me mfomsoɔ ne sɛn, na me bɔne ne sɛn na wosa me yerɛdɛdɛdɛdɛ yi? 37Na wobɛhwehwɛɛ me nnoɔma mu nyinaa yi, wo fie mu adeɛ bɛn na woahunu wɔ mu? Saa! Fa bɛto me nkurɔfoɔ ne wo nkurɔfoɔ anim wɔ ha, na wɔmmu yɛn baanu ntam atɛn. 38Mfirinhyia aduonu ni a metenaa wo nkyɛn, wo nnwammereɛ ne wo mmirekyie ampɔn, na wo nnwan mu adwennini nso, manni bi. 39 Wɔn a mmoa kumm wɔn no mamfa mammrɛ wo, me na metuaa so ka. Deɛ wɔwiaa no awia ne deɛ wɔwiaa no anadwo, me nsa mu na wobisaeɛ. 40Sɛ ɛyɛɛ me nie: Ahuhuro dee me awia, na awɔ dee me anadwo, na m’ani soroe. 41 Saa na medii wo fie mfirinhyia aduonu. Wo mmammaa baanu ho mesom wo mfeɛ dunan, ne wo mmoakuo ho nso mfeɛ nsia, na wodanee m’akatua ani mprɛdu. 42 Sɛ m’agya Nyankopɔn, Abraham Nyankopɔn, ne Isak suro annyina m’akyiri a, anka afei wogyaa me kwan nsapan. Me brɛ ne me nsa ano adwumayɛ na Onyankopɔn hunuiɛ, na ɔkaa w’anim nnora anadwo. 43Na Laban bua see Yakob sɛ: Mma mmaa yi, me mma a, na mmammarima yi, me mma a, na nnwan yi, me nnwan a, na deɛ wohunu yi nyinaa, me dea. Na me mmammaa yi, anaasɛ wɔn mma a wɔawo wɔn yi, ɛdeɛn na mɛtumi de ayɛ wɔn nnɛ?
44Afei bra ma yɛmpam, me ne wo, na ɛnyɛ me ne wo ntam adanseɛ. 45 Na Yakob faa ɔboɔ de yɛɛ odum sii hɔ. 46Na Yakob ka kyerɛɛ ne nkurɔfoɔ sɛ: Mommoaboa aboɔ ano! Na wɔtasee aboɔ yɛɛ no kuo; na wɔdidii wɔ ekuo no so hɔ. 47Na Laban frɛɛ hɔ Yegarsahaduta, na Yakob deɛ, ɔfrɛɛ hɔ Galeed. 48 Na Laban kaa sɛ: Ekuo yi ne me ne wo ntam adanseɛ nnɛ. Enti wɔfrɛ hɔ Galeed, 49ne Mispa, ɛfiri sɛ ɔse: Sɛ yɛtete mu a, AWURADE nhwɛ me ne wo ntam. 50Sɛ woteetee me mmammaa, na woware yerenom ka me mma ho a, obi nka yɛn ho deɛ, nanso Onyankopɔn ne me ne wo ntam danseni. 51Na Laban ka kyerɛɛ Yakob sɛ: Hwɛ kuo yi, na hwɛ odum a mama so asi me ne wo ntam yi. 52Aboɔkuo yi ne adanseɛ, na odum yi nso yɛ adanseɛ, sɛ me deɛ, merensiane ekuo yi ho memma wo nkyɛn, na wo nso, worensiane ekuo yi ne odum yi ho mma me nkyɛn mmɛyɛ bɔne. 53 Abraham Nyankopɔn ne Nahor Nyankopɔn, ne wɔn agya Nyankopɔn mmu yɛn ntam atɛn. Na Yakob kaa n’agya suro ho ntam. 54Na Yakob bɔɔ afɔdeɛ wɔ bepɔ no so, na ɔfrɛɛ ne nkurɔfoɔ sɛ wɔmmɛdidi; na wɔdidii na wɔtenaa bepɔ no so anadwo no.
55Na Laban sɔree anɔpatutu, na ɔfee ne nananom ne ne mmammaa no ano hyiraa wɔn, na ɔsii mu sane kɔɔ ne kurom.",https://www.bible.com/bible/1461/GEN.31.ASWDC
GYENESIS 32,"Yakob kɔhyia Esau
1 Na Yakob sii ne kwan so sɛ ɔrekɔ; na Nyankopɔn abɔfoɔ bɛhyiaa no. 2Na Yakob hunuu wɔn no, ɔkaa sɛ: Nyankopɔn asafo nie. Na ɔtoo hɔ din: Maha-naim.
3 Na Yakob tuu abɔfoɔ dii n’anim kɔɔ ne nua Esau nkyɛn Seir asase so wɔ Edom wiram. 4Na ɔhyɛɛ wɔn sɛ: Sɛdeɛ monka nkyerɛ me wura Esau ne sɛ: W’akoa Yakob se: Mekɔtenaa Laban nkyɛn na ɛhɔ na mewɔ de abɛduru sɛsɛɛ. 5Manya anantwie, mfunumu, nnwan, mmirekyie ne nkoa ne mfenaa; na masoma sɛ wɔmmɛka nkyerɛ me wura, sɛdeɛ mɛnya w’anim adom.
6Na abɔfoɔ no sane baa Yakob nkyɛn bɛkaa sɛ: Yɛakɔ wo nua Esau nkyɛn, na ɔno nso ne mmarima ahanan reba abɛhyia wo. 7Ɛnna Yakob suroo sɛ, na ne ho yeraa no. Na ɔkyɛɛ nkurɔfoɔ a wɔwɔ ne nkyɛn ne nnwan, mmirekyie, anantwie ne yoma no mu akuo mmienu 8kaa sɛ: Sɛ Esau ba kuo baako so bɛku wɔn a, ekuo a ɛbɛka no bɛnya kwan adwane.
9 Na Yakob kaa sɛ: M’agya Abraham Nyankopɔn ne m’agya Isak Nyankopɔn, AWURADE a wosee me sɛ: Sane kɔ w’asase so ne w’abusua mu, na mɛyɛ wo yie no, 10 w’adɔeɛ ne wo nokorɛ a wode akyerɛ w’akoa yi mu biara nsɛ me, ɛfiri sɛ mede me poma na metwaa Yordan yi, na afei mayɛ akuo mmienu. 11Mesrɛ wo, yi me firi me nua Esau nsam, ɛfiri sɛ mesuro no sɛ ɔbɛba abɛku me, ne ɛnanom ne wɔn mma nyinaa. 12 Wo na wokaa sɛ: Yie na mɛyɛ woɔ, na mɛma w’asefoɔ ayɛ sɛ mpoano anwea a dodoɔ nti wɔntumi nkan.
13Na ɔtenaa hɔ anadwo no; na ɔyii deɛ ɛwɔ ne nsa mu bi sɛ ɔde rekɔkyɛ ne nua Esau, 14mmirekyibereɛ ahanu, mpapo aduonu, nnwammereɛ ahanu, adwennini aduonu, 15yoma a wɔma nufoɔ ne wɔn mma aduasa, anantwibereɛ aduanan, anantwinini du, mfunumubereɛ aduonu ne mfunumu anini du. 16Na ɔde hyɛɛ ne nkoa nsa akuakuo, na ɔka kyerɛɛ ne nkoa no sɛ: Monsene nni m’anim, na momma kuo ne kuo ntam ntwe. 17Na ɔhyɛɛ deɛ ɔdi kan no sɛ: Sɛ me nua Esau bɛhyia wo, na ɔbisa wo sɛ: Hwan nipa ne wo, na ɛhe na worekorɔ, na yeinom a ɛdi w’anim yi yɛ hwan dea? 18Ka kyerɛ no sɛ: W’akoa Yakob dea; ɛyɛ ayɛyɛdeɛ a wasoma de rebrɛ me wura Esau; na hwɛ, ɔno nso wɔ yɛn akyi. 19Na ɔhyɛɛ deɛ ɔtɔ so mmienu ne deɛ ɔtɔ so mmiɛnsa ne wɔn a wɔdi mmoakuo no akyire nyinaa nso sɛ: Sɛ mokɔhunu Esau a, monka asɛm korɔ yi ara nkyerɛ no. 20Na monka nsi so sɛ: Hwɛ, w’akoa Yakob wɔ yɛn akyi. Afei ɔkaa sɛ: Mede ayɛyɛdeɛ a ɛdi m’anim yi merekɔpata no, ansa na mahunu n’anim; ebia ɔbɛhwɛ m’anim.
21Na ayɛyɛdeɛ no sene dii n’anim; na ɔno deɛ, ɔtenaa nsraban no mu anadwo no.
Yakob ne ɔbɔfoɔ bi tentam
22Na anadwo no ɔsɔree, na ɔfaa ne yerenom baanu ne ne mmaawa baanu no ne ne mma dubaako no de wɔn kɔtwaa Yabok asutwareeɛ. 23Na ɔde wɔn twaa asubɔnten no, na ɔmaa deɛ ɔwɔ nyinaa twaee. 24 Na ɛkaa Yakob nko ara. Na ɔbarima bi ne no bɛtentamee kɔduruu adekyeeɛ. 25Na ɔbarima no hunuu sɛ ɔntumi no no, ɔkaa n’asene tokuro mu, na Yakob dwonku hwanee tentam a ɔne no tentameeɛ no mu. 26 Na ɔbarima no kaa sɛ: Ma menkɔ, na adeɛ rekye. Na Yakob buaa sɛ: Meremma wonkɔ gye sɛ wohyira me. 27Na ɔbarima no bisaa no sɛ: Wo din de sɛn? Na ɔbuaa sɛ: Yakob. 28 Na ɔkaa sɛ: Wɔremfrɛ wo din Yakob bio, na wɔbɛfrɛ no Israel, ɛfiri sɛ wo ne Onyankopɔn ne nnipa ako, na woatumi. 29 Na Yakob bisaa no sɛ: Mesrɛ wo, kyerɛ me wo din. Na ɔse: Adɛn nti na worebisa me din? Na ɔbarima no hyiraa no wɔ hɔ. 30 Na Yakob too ɛhɔ din Peni-el, ɛfiri sɛ ɔse: Me ne Onyankopɔn adi nhunuanimu, nso me kra anya nkwa.
31Na ɔtwaa mu wɔ Peniel berɛ a na owia apue no, na ɔtɔ gu so ne dwonku a ahwan no nti. 32Enti Israelfoɔ nni ntini a ɛwɔ asene mu akwaa tokuro mu no de bɛduru nnɛ, ɛfiri sɛ ɔkaa Yakob dwonkuo tokuro mu, n’asene mu ntini no so.",https://www.bible.com/bible/1461/GEN.32.ASWDC
GYENESIS 33,"Yakob hyia Esau
1 Na Yakob maa n’ani so hunui, na hwɛ, Esau reba, na mmarima ahanan ka ne ho. Na ɔkyɛɛ ne mma mu maa Lea ne Rahel ne mmaawa baanu no. 2Na ɔde mmaawa no ne wɔn mma dii anim, na Lea ne ne mma dii hɔ, na Rahel ne Yosef dii akyire. 3Na ɔno ara deɛ ɔsene dii wɔn anim, na ɔbɔɔ ne mu ase kɔɔ fam mprɛnson de kɔsii sɛ ɔduruu ne nua nkyɛn. 4Na Esau tuu mmirika bɛhyiaa no yɛɛ no atuu, na ɔde ne tiri too ne kɔn ho, na ɔfee n’ano, na wɔsui. 5 Na Esau maa n’ani so hunuu mmaa no ne wɔn mma no, ɔkaa sɛ: Hwannom ne yeinom a wɔka wo ho yi? Na Yakob buaa sɛ: Ɛyɛ mma a Onyankopɔn de adom w’akoa. 6Na mmaawa no twe pinii, wɔn ne wɔn mma, na wɔbobɔɔ wɔn mu ase. 7Na Lea nso ne ne mma twe pinii bobɔɔ wɔn mu ase, na akyire yi no Yosef ne Rahel twe pinii bobɔɔ wɔn mu ase. 8 Na ɔkaa sɛ: Na ɛdɔm a mehyiaa wɔn yi ase ne sɛn? Na ɔse: Sɛdeɛ ɛbɛyɛ na mɛnya me wura anim adom. 9Na Esau kaa sɛ: Deɛ mewɔ dɔɔso, me nua, ma w’adeɛ ntena hɔ mma wo. 10 Na Yakob kaa sɛ: Dabi da, mesrɛ wo, sɛ manya w’anim adom a, gye m’ayɛyɛdeɛ a ɛwɔ me nsam yi, na w’anim a mahunu yi te sɛdeɛ obi hunu Nyankopɔn anim, ɛfiri sɛ w’ani asɔ me. 11 Mesrɛ wo, gye nhyira a wɔde abrɛ woɔ yi, ɛfiri sɛ Onyankopɔn adom me, na mewɔ ade nyinaa. Na ɔhyɛɛ no, na ɔgyee. 12Na Esau kaa sɛ: Ma yɛnsim nkɔ, na menni w’anim. 13Na ɔka kyerɛɛ no sɛ: Me wura nim sɛ mma a wɔyɛ mmerɛ ne nnwan ne anantwie a wɔma nufoɔ ka me ho, na sɛ wɔpia wɔn dodo da koro a, nnwankuo no nyinaa bɛwuwu. 14Enti ma me wura nsene nni n’akoa anim, na me deɛ, mɛnante brɛoo, sɛdeɛ mmoa a wɔdi m’anim ne mma no bɛtumi de akɔsi sɛ mɛduru me wura nkyɛn wɔ Seir. 15Na Esau kaa sɛ: Ma mennya wo nnipa a wɔka me ho yi bi. Na ɔse: Na wɔnyɛ dɛn? Ma mennya me wura anim adom. 16Ɛnna Esau sanee da no ara sii kwan so kɔɔ Seir.
17Na Yakob sii mu kɔɔ Sukot, na ɔsii dan maa ne ho, na ɔbobɔɔ asese maa ne mmoa. Yei nti na wɔfrɛ hɔ Sukot.
18Na Yakob firii Mesopotamia no, ɔnam bɛduruu Sekem kuro a ɛwɔ Kanaan asase soɔ no mu dwoodwoo, na ɔsisii ne ntomadan wɔ kuro no anim. 19 Na ɔtɔɔ asase a ɔsii ne ntomadan wɔ soɔ no wɔ Sekem agya Hamor mma nkyɛn nnwetɛbena ɔha. 20 Na ɔsii afɔrebukyia wɔ hɔ, na ɔtoo no: El-elohe-Israel.",https://www.bible.com/bible/1461/GEN.33.ASWDC
GYENESIS 34,"Sekem to Dina mmɔnaa
1 Na Lea ne Yakob babaa Dina firii adi sɛ ɔrekɔhwɛ asase no so mmaa. 2Na asase no so otitire Hewini Hamor ba Sekem hunuu no, na ɔkyeree no too no mmɔnaa guu ne ho fi. 3Na Yakob ba Dina sɔɔ Sekem ani, na ɔdɔɔ ababaa no, na ɔkorɔkorɔɔ no.
4Na Sekem ka kyerɛɛ n’agya Hamor sɛ: Kɔgye ababaa yi awareɛ ma me. 5Na Yakob tee sɛ wagu ne babaa Dina ho fi. Nanso ɛnam sɛ na ne mmammarima no wɔ ne mmoa nkyɛn wɔ wiram no, enti ɔyɛɛ komm de kɔsii sɛ wɔbaa fie. 6Na Sekem agya Hamor firii adi kɔɔ Yakob nkyɛn sɛ ɔne no rekɔkasa. 7 Na Yakob mmammarima teeɛ no, wɔfirii wiram bae. Na ɛyɛɛ mmarima no ya, na wɔn bo fuu pa ara, sɛ Sekem adi Israel ho nkwaseasɛm sɛ ɔne Yakob babaa akɔda; adeɛ a ɛnsɛ sɛ wɔyɛ. 8Na Hamor ne wɔn kasaa sɛ: Me ba Sekem akoma fam mo babaa no ho; mesrɛ mo, momfa no mma no aware. 9Na mo ne yɛn nni ayewareɛ, na momfa mo mmammaa mma yɛn, na mo nso monware yɛn mmammaa. 10Na mo ne yɛn ntena, na asase na ɛda mo anim yi, montena so nyɛ so adwuma nnya so adeɛ. 11Na Sekem ka kyerɛɛ Dina n’agya ne ne nuanom sɛ: Momma mennya mo anim adom, na biribiara a mobɛse me no, mɛma. 12 Monnye me etire adeɛ dodoɔ ne akyɛdeɛ biara, na biribiara a mobɛse me no, mɛma; na momfa ababaa no mma me awareɛ.
13Na Yakob mmammarima no kasa de nnaadaa buaa Sekem n’agya Hamor ɛfiri sɛ wagu wɔn nuabaa Dina ho fi. 14Na wɔka kyerɛɛ wɔn sɛ: Yɛntumi saa adeɛ yi yɛ, sɛ yɛde yɛn nua bɛma ɔbarima a ɔyɛ momonoto, ɛfiri sɛ ɛno yɛ ahohora ma yɛn. 15Na yei mu nko na yɛbɛpene mo sɛ mobɛdane ayɛ sɛ yɛn, na wɔatwitwa mo mu mmarima nyinaa twetia. 16Ɛno na yɛde yɛn mmammaa bɛma mo, na yɛabɛfa mo mmammaa nso aware, na yɛne mo atena, na yɛayɛ ɔman korɔ. 17Na sɛ moantie yɛn, na moantwitwa twetia a, ɛnneɛ yɛbɛfa yɛn babaa akɔ.
18Na wɔn nsɛm no sɔɔ Hamor ne ne ba Sekem ani. 19Enti Sekem antwetwe ne ho sɛ ɔbɛyɛ saa adeɛ no, ɛfiri sɛ na Yakob babaa no sɔ n’ani, na aberanteɛ no animuonyam sene n’agya fiefoɔ nyinaa. 20Na Hamor ne ne ba Sekem kɔɔ wɔn kuro aboboano, na wɔne wɔn kurom mmarima kɔkasaa sɛ: 21Nnipa yi, wɔne yɛn te asomdwoeɛ mu, enti momma wɔntena asase yi so, na wɔnyɛ so adwuma. Na asase yi, hwɛ, ɛda wɔn anim kakraa. Momma yɛmfa wɔn mmammaa nware, na yɛmfa yɛn mmammaa nso mma wɔn. 22Na yei nko mu na nnipa no bɛpene sɛ wɔne yɛn bɛtena, na yɛayɛ ɔman korɔ; sɛ yɛn mu mmarima nyinaa bɛtwitwa twetia, sɛdeɛ wɔatwitwa no. 23Wɔn mmoa ne wɔn ahonyadeɛ ne wɔn afieboa nyinaa renyɛ yɛn dea anaa? Momma yɛmpene so ma wɔn, na wɔne yɛn ntena. 24Na wɔn a wɔnam Hamor kuro pono ano firi adie nyinaa tiee no ne ne ba Sekem, na mmarima nyinaa, wɔn a wɔnam ne kuro pono ano firi adie nyinaa twitwaa twetia.
25 Na da a ɛtɔ so mmiɛnsa a ne yea kaa wɔn no, Yakob mmammarima baanu, Simeon ne Lewi a wɔyɛ Dina nuanom, fefaa wɔn nkrantɛ kɔɔ kuro no so mpofirim kɔkunkumm mmarima nyinaa. 26Na wɔde nkrantɛ kumm Hamor ne ne ba Sekem; na wɔde Dina firii Sekem fie hɔ bae.
27Yakob mmammarima no baa atɔfoɔ no so bɛfom kuro no mu nnoɔma fae, ɛfiri sɛ wɔagu wɔn nua no ho fi. 28Wɔn nnwan, wɔn anantwie, wɔn mfunumu ne deɛ ɛwɔ kuro no mu ne deɛ ɛwɔ mfuo mu no, wɔfae. 29Na wɔn ade nyinaa ne wɔn mma nyinaa ne wɔn yerenom, wɔfaa wɔn nnommum fom deɛ ɛwɔ fie nyinaa.
30 Na Yakob ka kyerɛɛ Simeon ne Lewi sɛ: Moaha me ama me ho abɔn wɔn a wɔte asase yi soɔ, Kanaanfoɔ ne Perisifoɔ. Na me deɛ, meyɛ asafo a mesua yi, wɔbɛboaboa wɔn ano aba me so abɛku me, na wɔasɛe me ne me fie. 31Na wɔse: Ɔnyɛ yɛn nuabaa sɛ odwamamfoɔ anaa?",https://www.bible.com/bible/1461/GEN.34.ASWDC
