Title,Content,URL
GYENESIS 1,"Adebɔ mfitiaseɛ
1 Mfitiaseɛ no Onyankopɔn bɔɔ ɔsoro ne asase. 2Na asase da hɔ hunu a ɛnni bɔbea biara, na esum wɔ ebunu ani. Na Nyankopɔn honhom butu nsuo no ani.
3 Na Onyankopɔn kaa sɛ: Ɛnyɛ hann! Na ɛyɛɛ hann. 4Na Onyankopɔn hunuu hann no sɛ ɛyɛ. Na Onyankopɔn paee hann ne esum no mu. 5Na ɔfrɛɛ hann no sɛ adekyee, ne esum no adesae. Na adeɛ sae, na adeɛ kyee, da a ɛdi kan ne no.
6Na Onyankopɔn kaa sɛ: Ewiem mmra, na ɛmmɛpae nsuo no mu. 7 Na Onyankopɔn yɛɛ ahunumu ntrɛmu. Na ɔpaee nsuo a ɛwɔ ewiem no aseɛ ne deɛ ɛwɔ ewiem no soɔ no mu. Na ɛyɛɛ saa. 8Na Onyankopɔn frɛɛ ewiem no ɔsoro. Na adeɛ sae, na adeɛ kyee, da a ɛtɔ so mmienu ne no.
9 Na Onyankopɔn kaa sɛ: Nsuo a ɛwɔ ɔsoro aseɛ no mmoaboa ano wɔ faako, na wɔnhunu asase pɛsɛɛ. Na ɛyɛɛ saa. 10Na Onyankopɔn frɛɛ pɛsɛɛ no asase, na nsuo mmoano no, ɔfrɛɛ no ɛpo. Na Onyankopɔn hunuu sɛ ɛyɛ.
11Na Onyankopɔn kaa sɛ: Asase mfifiri nwira, mfudeɛ, nnuaba sɛdeɛ wɔn su teɛ wɔ asase so. Na ɛyɛɛ saa. 12Na asase fifirii nwira ne nnuaba sɛdeɛ wɔn su teɛ. Na Onyankopɔn hunuu sɛ ɛyɛ. 13Na adeɛ sae, na adeɛ kyee, da a ɛtɔ so mmiɛnsa ne no.
14 Na Onyankopɔn kaa sɛ: Nkanea mmra ewiem, na ɛmmɛpae awia ne anadwo mu, na ɛnyɛ nsɛnkyerɛnneɛ mma ɛberɛ, nna ne mfeɛ nkyekyɛmu. 15Bio, na ɛnyɛ nkanea wɔ ewiem, na ɛnhyerɛn wɔ asase so. Na ɛyɛɛ saa. 16 Na Onyankopɔn yɛɛ nkanea akɛseɛ mmienu no, sɛ kɛseɛ no nni adekyeeɛ so, na ketewa no, sɛ ɛnni anadwo so. Ɔyɛɛ nsoromma nso. 17Na Onyankopɔn de sisii ewiem sɛ ɛnhyerɛn wɔ asase so, 18na ɛnni adekyeeɛ ne adesaeɛ so, na ɛmpae hann ne esum no mu. Na Onyankopɔn hunuu sɛ ɛyɛ. 19Na adeɛ sae, na adeɛ kyee, da a ɛtɔ so nnan ne no.
20Na Onyankopɔn kaa sɛ: Nsuo no nnɔre abɔdeɛ a ɛte aseɛ pii, na ntakraboa ntu mfa asase so wɔ ewiem. 21Na Onyankopɔn bɔɔ nsuboa akɛseɛ ne nketewa ahodoɔ sɛdeɛ wɔn su teɛ; ne ntakraboa nyinaa sɛdeɛ wɔn su teɛ. Na Onyankopɔn hunuu sɛ ɛyɛ. 22Na Onyankopɔn hyiraa wɔn sɛ: Monwo, na monnɔ, na monyɛ ɛpo mu ma, na ntakraboa nnɔɔso asase so. 23Na adeɛ sae, na adeɛ kyee, da a ɛtɔ so nnum ne no.
24Na Onyankopɔn kaa sɛ: Abɔdeɛ a ɛtete aseɛ mfiri asase mu mmra, sɛdeɛ wɔn su teɛ: Ntɔteboa a ɛwɔ fie ne wiram ne mmoa a wɔwea ne asase so mmoadoma, sɛdeɛ wɔn su teɛ. Na ɛyɛɛ saa. 25Na Onyankopɔn yɛɛ asase so mmoadoma, ntɔteboa ne mmoa a wɔwea fam nyinaa sɛdeɛ wɔn su teɛ. Na Onyankopɔn hunuu sɛ ɛyɛ.
26 Na Onyankopɔn kaa sɛ: Momma yɛnyɛ onipa wɔ yɛn suban so sɛ yɛn nsɛsoɔ, na wɔnni ɛpo mu mpataa, ewiem nnomaa, ntɔteboa, ne mmoa a wɔwea asase so nyinaa so.
27 Na Onyankopɔn bɔɔ onipa wɔ ne suban so.
Aane, Nyankopɔn suban so na ɔbɔɔ no,
ɔbarima ne ɔbaa na ɔbɔɔ wɔn.
28 Na Onyankopɔn hyiraa wɔn, na ɔka kyerɛɛ wɔn sɛ: Monwo, na monnɔre, na monyɛ asase so ma, na monya so tumi; na monni ɛpo mu mpataa ne ewiem nnomaa ne mmoa a wɔwɔ asase soɔ nyinaa so.
29Na Onyankopɔn kaa sɛ: Hwɛ, mede mfudeɛ a ɛwɔ asase ani nyinaa ne nnuaba nyinaa mama mo sɛ ɛnyɛ mo aduane. 30Na asase so mmoadoma nyinaa ne ewiem nnomaa nyinaa ne mmoa a wɔwea asase soɔ nyinaa, mede nhahan mono mama wɔn sɛ wɔnni. Na ɛyɛɛ saa. 31Na Onyankopɔn hunuu deɛ ɔyɛeɛ nyinaa, na hwɛ, ɛyɛ pa ara. Na adeɛ sae, na adeɛ kyee, da a ɛtɔ so nsia ne no.",https://www.bible.com/bible/1461/GEN.1.ASWDC
GYENESIS 2,"Homeda
1Na wɔwiee ɔsoro ne asase ne deɛ ɛwɔ mu nyinaa bɔ. 2 Na da a ɛtɔ so nson no, na Onyankopɔn awie n’adwuma a ɔyɛeɛ no, na da a ɛtɔ so nson no, ɔhome firii n’adwuma a ɔyɛeɛ nyinaa ho. 3 Na Onyankopɔn hyiraa da a ɛtɔ so nson no so, na ɔtee ho, ɛfiri sɛ ɛno mu na ɔhome firii n’adwuma a ɔyɛeɛ wɔ adebɔ mu no nyinaa ho.
Eden turo no
4Yei ne sɛdeɛ AWURADE Nyankopɔn bɔɔ ɔsoro ne asase. 5Na afuo mu nnua nyinaa nnya mmaa asase so, na afuo mu nhahan nyinaa nnya mfifirii, ɛfiri sɛ na AWURADE Nyankopɔn nnya ntɔɔ nsuo nguu asase no so, na na onipa a ɔbɛdɔ asase nni hɔ. 6Na nsuo firi asase so foroe, na ɛfɔɔ asase ani nyinaa. 7 Na AWURADE Nyankopɔn de fam dɔteɛ nwonoo onipa, na ɔhuu nkwa home guu ne hwene mu, na onipa yɛɛ ɔkra teasefoɔ.
8Na AWURADE Nyankopɔn yɛɛ turo bi wɔ Eden a ɛwɔ apueeɛ fam, na ɔde onipa a ɔnwonoo no no tenaa hɔ. 9 Na AWURADE Nyankopɔn maa nnua ahodoɔ nyinaa a wɔhwɛ a, ɛyɛ fɛ, na ɛyɛ sɛ wɔdie asase no so, ne nkwa dua a ɛsi turo no mfimfini, ne papa ne bɔne ho nimdeɛ dua fifirii asase no so.
10Na asuo bi tene firi Eden bɛfɔ turo no, na ɛfiri hɔ ara na emu paapae yɛɛ nsutire nnan. 11Deɛ ɛdi kan no din de Pison, ɛno na ɛkonton twa Hawila asase a sika wɔ soɔ no nyinaa ho hyiae. 12Na asase no so sika yɛ papa. Ɛhɔ na bedola aduhwam ne apopobibireboɔ wɔ. 13Na asuo a ɛtɔ so mmienu no din de Gihon. Ɛno na ɛkonton twa Kus asase nyinaa ho hyia. 14Na asuo a ɛtɔ so mmiɛnsa no ne Tigri, ɛno na ɛsene wɔ Asiria apueeɛ. Na asuo a ɛtɔ so nnan ne Eufrate.
15Na AWURADE Nyankopɔn de onipa no kɔtenaa Eden turom sɛ ɔnnɔ na ɔnwɛn hɔ. 16Na ɔhyɛɛ onipa no sɛ: Turom ha nnua nyinaa, di bi. 17 Na mmom papa ne bɔne ho nimdeɛ dua no deɛ, nni; ɛfiri sɛ da a wobɛdi bie no, wuo na wobɛwuo. 18 Na AWURADE Nyankopɔn kaa sɛ: Ɛnyɛ sɛ onipa nko tena; mɛyɛ ne nsɛsoɔ boafoɔ mama no.
19Na AWURADE Nyankopɔn de dɔteɛ nwonoo wiram mmoadoma, ne ewiem nnomaa nyinaa, na ɔde wɔn baa onipa no nkyɛn sɛ ɔbɛhunu sɛdeɛ ɔbɛfrɛ wɔn. Na deɛ onipa de frɛɛ abɔdeɛ a ɛte aseɛ biara no, ɛno ara ne ne din. 20Na onipa totoo afiemmoa, ewiem nnomaa ne wiram mmoadoma nyinaa din. Nanso onipa deɛ wɔannya ne boafoɔ a ɔfata amma no.
21Na AWURADE Nyankopɔn maa nnahɔɔ tɔɔ onipa no so, na ɔdae. Na ɔyii ne mfe mpadeɛ mu baako, na ɔde nam tuaa ananmu. 22 Na AWURADE Nyankopɔn de mpadeɛ a ɔyi firii onipa no mu no yɛɛ ɔbaa, na ɔde no brɛɛ onipa no. 23Na onipa no kaa sɛ:
Ampa ara, me nnompe mu dompe,
ne me honam mu nam ankasa nie.
Oyi na wɔbɛfrɛ no Ɔbaa,
ɛfiri sɛ Ɔbarima mu na wɔyii no firiiɛ.
24 Saa nti na ɔbarima bɛgya ne na ne n’agya hɔ, na ɔde ne ho akɔbata ne yere ho, na wɔayɛ honam korɔ. 25Na wɔn baanu no deda adagya, ɔbarima no ne ne yere, nanso wɔn ani anwu.",https://www.bible.com/bible/1461/GEN.2.ASWDC
GYENESIS 3,"Onipa asehweɛ
1 Na ɔwɔ yɛ aniteɛ kyɛne wiram mmoadoma a AWURADE Nyankopɔn yɛɛ wɔn nyinaa. Na ɔbisaa ɔbaa no sɛ: Ampa ara sɛ Onyankopɔn aka akyerɛ mo sɛ: Monnni turom ha nnua nyinaa bi? 2 Na ɔbaa no buaa ɔwɔ no sɛ: Turom ha nnua aba no, yɛdi bi; 3 nanso dua a ɛsi turo no mfimfini no aba deɛ, Onyankopɔn aka sɛ: Monnni bi, nso mommfa mo nsa nnka, na moanwu. 4 Na ɔwɔ no ka kyerɛɛ ɔbaa no sɛ: Ɛnyɛ wuo na mobɛwuo; 5na Onyankopɔn nim sɛ da a mobɛdi bie no, mo ani bɛbue, na moayɛ sɛ Onyankopɔn ahunu papa ne bɔne.
6 Na ɔbaa no hunuu sɛ dua no yɛ sɛ wɔdie, na ɛyɛ aniwa fɛ, ɛyɛ akɔnnɔ, na ɛbɛte ani, enti ɔtee n’aba bi, na ɔdii, na ɔde bi maa ne kunu a ɔka ne ho no nso, na ɔdii. 7 Na wɔn baanu ani buebuee, na wɔhunuu sɛ wɔdeda adagya, enti wɔpempam borɔdɔma ahahan yɛɛ nkatanim fae.
8 Na wɔtee AWURADE Nyankopɔn nka sɛ ɔnam turom hɔ wɔ anwummerɛ mferɛ mu. Na Adam ne ne yere kɔhunta firii AWURADE Nyankopɔn anim wɔ turom hɔ nnua mu. 9Na AWURADE Nyankopɔn frɛɛ Adam, na ɔbisaa no sɛ: Wowɔ he? 10Na ɔse: Metee wo nka wɔ turom hɔ no, mesuroe, ɛfiri sɛ meda adagya, na mehuntae. 11Na ɔbisaa no sɛ: Hwan na ɔka kyerɛɛ wo sɛ woda adagya? Dua a mehyɛɛ wo sɛ nni bie no na woadie yi? 12Na Adam kaa sɛ: Ɔbaa no a wode no bɛkaa me ho no, ɔno na ɔmaa me dua no aba no bie, na mediiɛ. 13 Na AWURADE Nyankopɔn ka kyerɛɛ ɔbaa no sɛ: Adɛn na woyɛɛ saa? Na ɔbaa no se: Ɔwɔ no na ɔdaadaa me, maa mediiɛ.
Onipa bu atɛn
14 Na AWURADE Nyankopɔn ka kyerɛɛ ɔwɔ no sɛ:
Ɛnam sɛ woayɛ yei nti,
wɔadome wo ntɔteboa
ne wiram mmoadoma nyinaa mu.
Wo yafunu so na wobɛnanteɛ,
na woadi dɔteɛ
wo nkwa nna nyinaa.
15 Na mede ɔtan bɛto wo ne ɔbaa no ntam,
ɛne w’asefoɔ ne n’asefoɔ ntam;
ɔno na ɔbɛbɔ wo tire,
na wo nso woaka ne nantin.
16 Ɔbaa no deɛ, ɔka kyerɛɛ no sɛ:
Dɔ na mɛma wo yea ne wo nyinsɛn mu brɛ adɔɔso.
Yea mu na wobɛwo mma,
na w’ani bɛgyina wo kunu,
na ɔno na ɔbɛdi wo soɔ.
17 Na Adam deɛ, ɔka kyerɛɛ no sɛ:
Sɛ woatie wo yere nne,
na woadi dua
a mehyɛɛ wo
sɛ nnie no bie nti,
wo nti wɔadome asase.
Yea mu na wobɛdidi soɔ wo nkwa nna nyinaa.
18Na nkasɛɛ ne nnɛnkyɛnse na ɛbɛfifiri ama woɔ,
na woadi afuo mu ahahan.
19 W’anim fifire mu
na wobɛdidie
de akɔsi sɛ wobɛsane akɔ dɔteɛ mu,
ɛfiri sɛ emu na wɔyii wo firiiɛ;
na woyɛ dɔteɛ,
na dɔteɛ mu na wobɛsane akorɔ.
20Na Adam no too ne yere din Hawa, ɛfiri sɛ ɔno na ɔyɛ ateasefoɔ nyinaa na. 21Na AWURADE Nyankopɔn yɛɛ nwoma ntadeɛ maa Adam ne ne yere de hyɛɛ wɔn.
Wɔpamo Adam ne Hawa firi turo no mu
22 Na AWURADE Nyankopɔn kaa sɛ: Hwɛ, onipa no ayɛ sɛ yɛn mu baako, hunu papa ne bɔne. Na afei, deɛ ɛbɛyɛ na wantene ne nsa ante nkwa dua no nso bi anni antena ase daa nti, 23AWURADE Nyankopɔn tuu no firii Eden turom hɔ sɛ ɔnkɔdɔ asase a wɔfaa no firii mu no. 24 Na ɔpamm onipa no, na ɔde Kerubim ne ogyaframa afena a ɛdi ahim bɛsii Eden turo no anim apueeɛ fam sɛ wɔnwɛn ɔkwan a ɛde kɔ nkwa dua no ho no.",https://www.bible.com/bible/1461/GEN.3.ASWDC
GYENESIS 4,"Kain ne Habel
1Na Adam ne ne yere Hawa daeɛ, na ɔnyinsɛnee, na ɔwoo Kain. Na ɔkaa sɛ: AWURADE adaworoma manya ɔbarima. 2Na ɔwoo ne nua Habel kaa ne ho. Na Habel yɛ odwanhwɛfoɔ, ɛna Kain nso yɛ okuafoɔ. 3Na ɛbaa sɛ nna bi akyiri no, Kain de afuom nnoɔma bɛyɛɛ AWURADE ayɛ. 4 Na Habel nso de ne nnwan mu mmakan ne wɔn a wɔadɔre no bi bɛmae. Na AWURADE ani sɔɔ Habel ne n’ayɛyɛdeɛ no, 5nanso Kain ne n’ayɛyɛdeɛ no deɛ, n’ani ansɔ. Kain bo fuu pii, na ɔmunae. 6Na AWURADE bisaa Kain sɛ: Adɛn nti na wo bo afuo na woamuna yi? 7 Sɛ woyɛɛ no yie a, anka w’anim rente anaa? Na sɛ woanyɛ no yie enti, bɔne butu ɛpono ano, na w’akyiri kwan na ɛhwehwɛ, nanso di ne so.
8 Na Kain ka kyerɛɛ ne nua sɛ, ma yɛn nkɔ afuom. Na ɛbaa sɛ wɔwɔ afuom no, Kain sɔre tiaa ne nua Habel, na ɔkumm no. 9Na AWURADE bisaa Kain sɛ: Ɛhe na wo nua Habel wɔ? Na ɔse: Mennim, me nua so hwɛfoɔ ne me anaa? 10 Na AWURADE se: Ɛdeɛn na woayɛ yi? Wo nua mogya nne reteam frɛ me firi asase so.
11Na afei wɔadome wo afiri asase a abue n’ano agye wo nua mogya afiri wo nsam no so. 12Sɛ wodɔ asase a, ɛrenkɔ so mma wo ne nnɔbaeɛ bio na wobɛyɛ ɔkobɔni ne asesabɔni wɔ asase so. 13Na Kain ka kyerɛɛ AWURADE sɛ: Me bɔne so adeɛ so kyɛne sɛ mɛtumi asoa. 14 Hwɛ, woapamo me nnɛ afiri asase yi so, na mɛhunta mafiri w’anim, na mayɛ ɔkobɔni ne asesabɔni wɔ asase so, na obiara a ɔbɛhu me no, ɔbɛku me. 15Na AWURADE ka kyerɛɛ no sɛ: Ɛno nti obiara a ɔbɛkum Kain no, wɔbɛtɔ ne so werɛ ahodoɔ nson. Na AWURADE yɛɛ nsɛnkyerɛnneɛ bi maa Kain, na obiara a ɔbɛhu no no anku no. 16Na Kain firii AWURADE anim kɔe, na ɔkɔtenaa Nod asase so wɔ Eden apueeɛ.
Kain asefoɔ
17Na Kain ne ne yere dae, na ɔnyinsɛnee, na ɔwoo Henok. Na ɔkyekyeree kuro bi, na ɔde ne ba Henok din too kuro no. 18Na Henok woo Irad, na Irad woo Mehuyael. Na Mehuyael woo Metusael, na Metusael woo Lamek.
19Na Lamek waree mmaa baanu, ɔbaako din de Ada, na deɛ ɔka ho no din de Sila. 20Na Ada woo Yabal, ɔno na ɔyɛ ntomadan mu ne mmoa ho tenafoɔ agya. 21Na ne nua din de Yubal; ɔno na ɔyɛ asankubɔfoɔ ne mmɛnhyɛnfoɔ nyinaa agya. 22Na Sila nso woo Tubalkain a ɔyɛ kɔbere mfrafraeɛ ne dadeɛ adeɛ nyinaa atomfoɔ agya. Na Tubalkain nuabaa ne Naama.
23Na Lamek ka kyerɛɛ ne yerenom sɛ:
Ada ne Sila, montie me nne;
Lamek yerenom, monyɛ aso mma m’asɛm:
Mekumm ɔbarima sɛ ɔpiraa me,
mekumm aberanteɛ sɛ ɔboroo me.
24 Na sɛ wɔtɔɔ Kain so werɛ mprɛnson a,
Lamek deɛ bɛyɛ aduɔson nson.
Set ne Enos awoɔ
25Na Adam ne ne yere daeɛ bio, na ɔwoo ɔbabarima, na ɔtoo ne din Set (aseɛ ne: Nsiananmu) sɛ: Onyankopɔn de ɔba foforɔ asi me Habel a Kain kumm no no ananmu. 26Na Set nso, wɔwoo ɔba maa no, na ɔtoo ne din Enos. Ɛberɛ no mu na wɔfirii aseɛ bɔɔ AWURADE din sɔree no.",https://www.bible.com/bible/1461/GEN.4.ASWDC
GYENESIS 5,"Adam awoɔ ntoatoasoɔ
(1 Berɛsosɛm 1.1-4)
1 Adam awoɔ ntoatoasoɔ nie: Da a Onyankopɔn bɔɔ onipa no, ɔbɔɔ no ne suban so. 2Na ɔbɔɔ ɔbarima ne ɔbaa, na ɔhyiraa wɔn. Na ɔtoo wɔn din onipa.
3 Na Adam dii mfirinhyia ɔha aduasa no, ɔwoo ɔbabarima wɔ ne nsɛsoɔ ne ne suban so, na ɔtoo no din Set. 4Na Adam woo Set no akyiri no, ɔdii mfirinhyia ahanwɔtwe, na emu no ɔsane woo mmammarima ne mmammaa. 5Na Adam nna a ɔdiiɛ ansa na ɔrewuo nyinaa yɛ mfeɛ ahankron aduasa.
6Na Set dii mfirinhyia ɔha ne nnum na ɔwoo Enos. 7Na Set woo Enos no akyiri no, ɔdii mfeɛ ahanwɔtwe ne nson, na emu no ɔsane woo mmammarima ne mmammaa. 8Na Set nna a ɔdiiɛ ansa na ɔrewuo nyinaa yɛ mfeɛ ahankron ne dummienu.
9Na Enos dii mfirinhyia aduɔkron na ɔwoo Kenan. 10Na Enos woo Kenan no akyiri no, ɔdii mfeɛ ahanwɔtwe ne dunum, na emu no ɔsane woo mmammarima ne mmammaa. 11Na Enos nna ɔdiiɛ ansa na ɔrewuo nyinaa yɛ mfeɛ ahankron ne nnum.
12Na Kenan dii mfirinhyia aduɔson na ɔwoo Ma-halalel. 13Na Kenan woo Ma-halalel no akyiri no, ɔdii mfeɛ ahanwɔtwe aduanan, na emu no ɔsane woo mmammarima ne mmammaa. 14Na Kenan nna a ɔdiiɛ ansa na ɔrewuo nyinaa yɛ mfeɛ ahankron ne du.
15Na Ma-halalel dii mfirinhyia aduosia nnum na ɔwoo Yared. 16Na Ma-halalel woo Yared no akyiri no, ɔdii mfeɛ ahanwɔtwe aduasa, na emu no ɔsane woo mmammarima ne mmammaa. 17Na Ma-halalel nna a ɔdiiɛ ansa na ɔrewuo nyinaa yɛ mfeɛ ahanwɔtwe aduɔkron nnum.
18Na Yared dii mfirinhyia ɔha aduosia mmienu na ɔwoo Henok. 19Na Yared woo Henok akyiri no, ɔdii mfeɛ ahanwɔtwe, na emu no ɔsane woo mmammarima ne mmammaa. 20Na Yared nna a ɔdiiɛ ansa na ɔrewuo nyinaa yɛ mfeɛ ahankron aduosia mmienu. 21Na Henok dii mfirinhyia aduosia nnum na ɔwoo Metusela. 22 Na Henok woo Metusela no akyiri no, ɔne Onyankopɔn nantee mfirinhyia ahasa, na emu no ɔsane woo mmammarima ne mmammaa. 23Na Henok nna nyinaa yɛ mfeɛ ahasa aduosia nnum. 24 Na Henok ne Onyankopɔn nantee, na wɔanhunu no bio, ɛfiri sɛ Onyankopɔn faa no kɔe. 25Na Metusela dii mfirinhyia ɔha aduɔwɔtwe nson na ɔwoo Lamek. 26Na Metusela woo Lamek no akyiri no, ɔdii mfeɛ ahanson aduɔwɔtwe mmienu, na emu no ɔsane woo mmammarima ne mmammaa. 27Na Metusela nna a ɔdiiɛ ansa na ɔrewuo nyinaa yɛ mfeɛ ahankron aduosia nkron.
28Na Lamek dii mfirinhyia ɔha aduɔwɔtwe mmienu no ɔwoo babarima. 29 Na ɔtoo ne din Noa, na ɔkaa sɛ: Oyi na ɔbɛkyekyere yɛn werɛ wɔ yɛn nnwuma ne yɛn nsa ano brɛ mu wɔ asase a AWURADE adome no soɔ. 30Na Lamek woo Noa no akyiri no, ɔdii mfeɛ ahanum aduɔkron nnum, na emu no ɔsane woo mmammarima ne mmammaa. 31Na Lamek nna a ɔdiiɛ ansa na ɔrewuo nyinaa yɛ mfirinhyia ahanson aduɔson nson. 32Na Noa dii mfirinhyia ahanum no, ɔwoo Sem, Ham ne Yafet.",https://www.bible.com/bible/1461/GEN.5.ASWDC
GYENESIS 6,"Nnipa nnebɔne
1 Na nnipa firii aseɛ redɔɔso wɔ asase soɔ na wɔwoo mmammaa maa wɔn no, 2 Nyankopɔn mma hunuu nnipa mmammaa sɛ wɔn ho yɛ fɛ, na wɔwarewaree wɔn mu biara a wɔpɛ. 3 Na AWURADE kaa sɛ: Me honhom rentena onipa mu nkɔsi daa, ɛfiri sɛ wɔyɛ honam, enti ne nna bɛyɛ mfeɛ ɔha aduonu. 4 Nna no mu ne akyire no, na abrane akɛseɛ wɔ asase so. Na Nyankopɔn mma kɔɔ nnipa mmammaa ho na wɔwoo mma maa wɔn no, yeinom ne aberempɔn a wɔwɔ din firi tete. 5 Na AWURADE hunuu sɛ nnipa bɔne dɔɔso pii wɔ asase so, na wɔn akoma mu nsusuiɛ nyinaa yɛ bɔne nko daa nyinaa. 6 Na AWURADE nuu ne ho sɛ ɔyɛɛ onipa wɔ asase soɔ, na ɛyɛɛ no ya n’akomam. 7Na AWURADE kaa sɛ: Mɛpepa nnipa a mabɔ wɔn no afiri asase ani, ampa ara, ɛfiri onipa so kɔsi ntɔteboa ne mmoa a wɔwea ne ewiem nnomaa so, ɛfiri sɛ manu me ho sɛ meyɛɛ wɔn. 8Na Noa deɛ, ɔnyaa adom AWURADE anim.
Noa adaka no
9 Yei ne Noa ho asɛm: Na Noa yɛ onipa tenenee a ɔyɛ pɛ wɔ ne berɛ so nnipa mu. Noa ne Onyankopɔn nanteeɛ. 10Na Noa woo mmammarima baasa, Sem, Ham, ne Yafet. 11Na asase asɛe wɔ Nyankopɔn anim, na awurukasɛm ahyɛ asase so ma. 12 Na Onyankopɔn hunuu asase, na hwɛ, asɛe, ɛfiri sɛ na nnipa nyinaa asɛe wɔn akwan wɔ asase so. 13 Na Onyankopɔn ka kyerɛɛ Noa sɛ: Abɔdeɛ nyinaa awieeɛ aba m’anim, ɛfiri sɛ wɔn awurukasɛm ahyɛ asase so ma, na hwɛ, mɛsɛe wɔn ne asase.
14Fa ɔwawa yɛ adaka, na yɛ mpia wɔ adaka no mu, na fa ama ka emu ne ɛho. 15Na sɛdeɛ yɛ no nie: Ne ntwemu basafa ɔha aduonum, ne trɛ basafa aduonu nnum, ne korɔn basafa dunum. 16Yɛ adaka no ho mpomma, kɔsi sɛ aka anammɔn baako ne fa na aduru soro, na si adaka no ano pono ne nkyɛn mu, na yɛ nsamsoɔ mmiɛnsa, deɛ ɛdi aseɛ, deɛ ɛdi ntam ne deɛ ɛdi soro. 17Na hwɛ, me, mede nsuyire bɛba asase so mabɛsɛe abɔdeɛ a nkwa home wɔ wɔn mu nyinaa ɔsoro ase; asase so adeɛ nyinaa rebɛwuwu. 18Na me ne wo bɛyɛ apam ato hɔ, na woakɔ adaka no mu, wo ne wo mma, ne wo yere, ne wo mma yerenom. 19Na fa honam a ɛte aseɛ nyinaa mu mmienu mmienu, onini ne ɔbedeɛ, kɔ adaka no mu, na wɔnnya nkwa nka wo ho. 20Nnomaa sɛdeɛ wɔn su teɛ, ne ntɔteboa, sɛdeɛ wɔn su teɛ, ne mmoa a wɔwea asase soɔ nyinaa, sɛdeɛ wɔn su teɛ, wɔn nyinaa mu mmienu mmienu mmra wo nkyɛn, na wɔanya nkwa. 21Na wo deɛ, boaboa aduane nyinaa bi ano kɔ mu, na ayɛ wo ne wɔn aduane. 22Na Noa yɛɛ sɛdeɛ Onyankopɔn hyɛɛ no no nyinaa pɛpɛɛpɛ.",https://www.bible.com/bible/1461/GEN.6.ASWDC
GYENESIS 7,"Nsuyire no
1Na AWURADE ka kyerɛɛ Noa sɛ: Wo ne wo fiefoɔ nyinaa, monkɔ adaka no mu, ɛfiri sɛ wo na mahu wo sɛ ɔteneneeni m’anim, ɛberɛ yi mu. 2 Mmoa a wɔn ho teɛ nyinaa mu, fa nson nson, anini ne abedeɛ. Na mmoa a wɔn ho nteɛ mu, fa mmienu mmienu, onini ne ɔbedeɛ; 3ewiem nnomaa mu nso fa nson nson, anini ne abedeɛ, na wɔn ase nnya nkwa asase nyinaa ani. 4Ɛfiri sɛ aka nnanson na matɔ osuo agu asase so adaduanan awia ne anadwo, na mapepa adeɛ a nkwa wɔ mu a mayɛ nyinaa afiri asase ani. 5 Na Noa yɛɛ sɛdeɛ AWURADE hyɛɛ no no nyinaa. 6Ɛberɛ a nsuyire no baa asase soɔ no na Noa adi mfirinhyia ahansia. 7 Nsuo a na ɛrebɛyire no nti, Noa ne ne mma, ne ne yere, ne ne mma yerenom kɔɔ adaka no mu. 8Mmoa a wɔn ho teɛ ne mmoa a wɔn ho nteɛ ne nnomaa ne wɔn a wɔwea asase soɔ nyinaa mu 9 mmienu mmienu baa Noa nkyɛn adaka no mu, onini ne ɔbedeɛ, sɛdeɛ Onyankopɔn hyɛɛ Noa no. 10Na nnanson akyiri no, nsuyire baa asase so.
11Noa dii mfirinhyia ahansia no, bosome a ɛtɔ so mmienu no dadu nnanson soɔ, da no ara, ebunu kɛseɛ no nsuo ani nyinaa paepaee, na ɔsoro mpomma buebuee. 12Na osuo tɔɔ asase so pii adaduanan, awia ne anadwo. 13Saa da yi ara (a nsuyire yi hyɛɛ aseɛ no) mu na Noa ne ne yere, ne ne mma, Sem, Ham ne Yafet, ne ne mma yerenom baasa akɔhyɛ adaka no mu. 14Na mmoadoma nyinaa, ntɔteboa, mmoa a wɔwea asase soɔ, ntuboa nyinaa, sɛdeɛ wɔn su teɛ, 15ne wɔn na ɛkɔɔ mu. Honam a nkwa home wɔ wɔn mu nyinaa mu mmienu mmienu na wɔbaa Noa nkyɛn wɔ adaka no mu. 16 Wɔn a ɛbaeɛ no, na wɔyɛ honam nyinaa mu anini ne abedeɛ, sɛdeɛ Onyankopɔn hyɛɛ no no; na AWURADE too no mu.
17Na nsuyire no baa asase so adaduanan, na nsuo no yiriiɛ, na ɛmaa adaka no so firii asase so. 18Na nsuo no yirii dodo wɔ asase so; maa adaka no tɛɛ nsuo no ani. 19Na nsuo no boroo so ara wɔ asase so, na ɛkataa mmepɔ nyinaa so. 20Nsuo no boroo so kɔɔ soro basafa nson ne fa kataa mmepɔ so. 21Na abɔdeɛ a ɛte aseɛ nyinaa, nnomaa, ntɔteboa, wiram mmoa, mmoa a wɔwea asase soɔ, ne nnipa nyinaa; 22 wɔn a nkwa home wɔ wɔn mu, na wɔte asase pɛsɛɛ soɔ nyinaa wuwui. 23Na ɔpepaa biribiara a nkwa wom a ɛwɔ asase ani, ɛfiri nnipa so kɔsi ntɔteboa ne mmoa a wɔwea ne ewiem nnomaa so. Na wɔpepaa wɔn firii asase so, na ɛkaa Noa nko ara ne wɔn a wɔne no wɔ adaka no mu no. 24Na nsuo no yirii wɔ asase so nna ɔha aduonum.",https://www.bible.com/bible/1461/GEN.7.ASWDC
GYENESIS 8,"Nsuo no twe
1Na Onyankopɔn kaee Noa ne mmoadoma nyinaa ne ntɔteboa nyinaa a wɔne no wɔ adaka no mu nyinaa. Na Onyankopɔn maa mframa bɔ faa asase so, na nsuo no ano brɛɛ ase. 2 Na ebunu no nsuo aniwa sisii, na ɔsoro mpomma mu totoe, maa osuo a ɛfiri soro no gyaee tɔ; 3na nsuo no twe firii asase so ara. Na ɛfiri nna ɔha aduonum akyiri no na na nsuo no so rehwan.
4Na ɛda a ɛtɔ so dunson wɔ bosome nson no mu na adaka no kɔsii Ararat mmepɔ soɔ. 5Na nsuo no kɔɔ so twee ara kɔsii bosome a ɛtɔ so du no so; na saa bosome yi ara na da a ɛdi kan no na mmepɔ atifi dedaa adie.
6Na ɛno akyiri adaduanan no, Noa buee adaka no mpomma a ɔyɛeɛ no, 7na ɔsomaa anene. Na ɔfirii adi, na ɔdii akɔneaba de kɔsii sɛ nsuo no wee asase soɔ. 8Na ɔsomaa aburuburo sɛ ɔnkɔhwɛ sɛ nsuo no awe wɔ asase ani anaa. 9Nanso aburuburo no annya ne nan sibea, na ɔsane baa ne nkyɛn adaka no mu, ɛfiri sɛ na nsuo no da so wɔ asase nyinaa ani. Na ɔtenee ne nsa faa no baa ne nkyɛn wɔ adaka no mu. 10Na ɔtwɛn nnanson bio, na ɔsomaa aburuburo firii adaka no mu bio. 11Na aburuburo no baa ne nkyɛn anwummerɛ, na hwɛ, ngo dua ahahan frɔmfrɔm tua n’ano. Noa hunuu sɛ nsuo no awe asase so. 12Na ɔtwɛn nnanson bio no, ɔsomaa aburuburo no; na wansane amma ne nkyɛn bio. 13Na Noa afe a ɛtɔ so ahansia ne baako, bosome a ɛdi kan no da a ɛdi kan no na na nsuo no awe asase soɔ. Na Noa yii suhyɛ no firii adaka no so, na ɔhwɛe, na hwɛ, na asase ani awo. 14Bosome a ɛtɔ so mmienu no da a ɛtɔ so aduonu nson no na na asase so awo koraa.
15Na Onyankopɔn kasa kyerɛɛ Noa sɛ: 16Firi adaka no mu, wo ne wo yere, wo mma ne wɔn yerenom a wɔka wo ho; 17 mmoadoma a wɔka wo ho nyinaa a ɛfiri honam nyinaa mu, nnomaa ne ntɔteboa ne deɛ ɛwea asase soɔ nyinaa ne wo mfiri adi, na wɔnwo, na wɔnnɔɔso asase so. 18 Na Noa ne ne yere, ne ne mma ne wɔn yerenom firii adi; 19mmoadoma nyinaa, wɔn a wɔwea nyinaa ne nnomaa nyinaa, ne deɛ nkwa wɔ mu biara, sɛdeɛ wɔn mmoaban teɛ, firi adaka no mu firii adi.
Noa afɔrebɔ
20 Na Noa sii afɔrebukyia maa AWURADE, na ɔfaa ntɔteboa a wɔn ho teɛ nyinaa mu bi ne nnomaa a wɔn ho teɛ nyinaa mu bi de wɔn bobɔɔ ɔhyeɛ afɔdeɛ wɔ bukyia no so. 21 Na AWURADE tee afɔdeɛ no hwam no, ɔkaa no n’akoma mu sɛ: Onipa nti merennome asase bio, ɛfiri sɛ onipa akoma mu adwene yɛ bɔne firi ne mmɔfraase, na merensɛe deɛ ɛte aseɛ nyinaa bio, sɛdeɛ mayɛ yi.
22 Nna a asase wɔ hɔ yi nyinaa,
oguo ne otwa, awɔ ne ahuhuro,
asuso ne ɔpɛ, awia ne anadwo
rennyae da.",https://www.bible.com/bible/1461/GEN.8.ASWDC
