Title,Content,URL
EKSODƆS 40,"Wɔtu Tenabea no hyɛ AWURADE nsa
1 Na AWURADE ka kyerɛɛ Mose sɛ: 2Bosome a ɛdi kan no da a ɛdi kan no na si ahyiaeɛ ntomadan no tenabea no. 3Na fa adanseɛ adaka no si mu, na fa ntwamutam no kata adaka no ani. 4Na fa ɛpono no kɔ mu, na siesie deɛ wɔde sisi soɔ no; na fa kaneadua no kɔ mu, na fa ne nkanea no sisi so. 5Na fa sika aduhwamhyeɛ bukyia no kɔsi adanseɛ adaka no anim; na fa tenabea no ano nkataano no sɛne hɔ. 6Na fa ɔhyeɛ afɔrebukyia no si ahyiaeɛ ntomadan tenabea no ano. 7Na fa kuduo no si ahyiaeɛ ntomadan no ne afɔrebukyia no ntam, na fa nsuo gu mu. 8Na sisi adihɔ no hyia, na fa adihɔ no aboboano nkataano no sɛne hɔ. 9Na fa sra ngo no sra tenabea no ne emu adeɛ nyinaa, na yɛ ɛno ne ɛho nnoɔma nyinaa kronkron na ɛnyɛ akronkronneɛ. 10Na sra ɔhyeɛ afɔrebukyia no ne ɛho nnoɔma nyinaa ngo, na yɛ afɔrebukyia no kronkron, na afɔrebukyia no nyɛ akronkronneɛ mu ade kronkron. 11Na sra kuduo no ne ne ntaaseɛ no ngo, na yɛ no kronkron. 12Na fa Aaron ne ne mma no bra ahyiaeɛ ntomadan no ano, na fa nsuo dware wɔn.
13Na fa ntade kronkron no hyɛ Aaron, na sra no ngo yɛ no kronkron, na ɔnni me sɔfoɔ. 14Na fa ne mma nso bra, na hyehyɛ wɔn ntadeɛ, 15na sra wɔn ngo, sɛdeɛ wosraa wɔn agya no, na wɔnni me asɔfoɔ, na wɔn sra no nyɛ wɔn daa asɔfodie, wɔn awoɔ ntoatoasoɔ nyinaa mu. 16Na sɛdeɛ AWURADE hyɛɛ Mose no nyinaa, saa ara na ɔyɛeɛ.
17Na ɛbaa sɛ afe a ɛtɔ so mmienu no bosome a ɛdi kan no da a ɛdi kan no, wɔsii tenabea no. 18Na Mose sii tenabea no, na ɔhyehyɛɛ ne nnyinasoɔ na ɔgyinagyinaa ne ntaaboɔ no, na ɔde ne mmeamu no beabeaa mu, na ɔgyinagyinaa ne nsisimu adum. 19Na ɔyeree ntomadan no kataa tenabea no so, na ɔde ntomadan no nkatasoɔ no kataa so, sɛdeɛ AWURADE hyɛɛ Mose no. 20Na ɔfaa Adanseɛ no de hyɛɛ adaka no mu, na ɔde mpoma wurawuraa adaka no ho, na ɔde mpata adwa no sii adaka no so; 21na ɔde adaka no kɔɔ tenabea no mu, na ɔsii ntwamutam no, na ɔde kataa adanseɛ adaka no ano, sɛdeɛ AWURADE hyɛɛ Mose no. 22Na ɔde ɛpono no sii ahyiaeɛ ntomadan no mu, tenabea no nkyɛn mu a ɛkyerɛ atifi fam wɔ ntwamutam no akyi; 23na ɔsiesiee ɛso paanoo AWURADE anim sɛdeɛ AWURADE hyɛɛ Mose no. 24Na ɔde kaneadua no sii ahyiaeɛ ntomadan no mu, ɛpono no ntentensoɔ wɔ tenabea no nkyɛn mu a ɛkyerɛ anafoɔ fam; 25na ɔde nkanea no sisii so AWURADE anim, sɛdeɛ AWURADE hyɛɛ Mose no. 26Na ɔde sika afɔrebukyia no sii ahyiaeɛ ntomadan no mu, ntwamutam no anim; 27na ɔhyee so aduhwam, sɛdeɛ AWURADE hyɛɛ no no. 28Na ɔde nkataano no sɛnee tenabea no ano. 29Na ɔde ɔhyeɛ afɔrebukyia no sii ahyiaeɛ ntomadan tenabea no ano, na ɔbɔɔ so ɔhyeɛ ne aduane afɔdeɛ, sɛdeɛ AWURADE hyɛɛ Mose no. 30Na ɔde kuduo no sii ahyiaeɛ ntomadan no ne afɔrebukyia no ntam, na ɔde nsuo guu mu sɛ wɔmfa nhohoro wɔn ho. 31Na Mose ne Aaron ne ne mma no de hohoroo wɔn nsa ne wɔn nan ho; 32sɛ wɔkɔ ahyiaeɛ ntomadan no mu anaasɛ wɔrebɛbɛn afɔrebukyia no ho a, wɔhohoroo wɔn ho, sɛdeɛ AWURADE hyɛɛ Mose no. 33Na ɔsii adihɔ no de twaa tenabea no ne afɔrebukyia no ho hyiae, na ɔde adihɔ no aboboano ntwamutam no sɛnee hɔ. Na Mose wiee adwuma no.
Mununkum bɛkata Tenabea no so
(Numeri 9.15-23)
34 Ɛnna mununkum no bɛkataa ahyiaeɛ ntomadan no soɔ, na AWURADE animuonyam bɛhyɛɛ tenabea no ma. 35Na Mose antumi anhyɛne ahyiaeɛ ntomadan no mu, ɛfiri sɛ na mununkum no te so, na AWURADE animuonyam ahyɛ tenabea no ma. 36 Na Israelfoɔ akwantuo no nyinaa mu, sɛ mununkum no ma ne ho so firi tenabea no so a, na wɔkɔ wɔn anim; 37na sɛ mununkum no amma ne ho so a, ɛnneɛ wɔntu ara kɔsi da a ɛma ne ho soɔ. 38Ɛfiri sɛ wɔn akwantuo no nyinaa mu, na AWURADE mununkum no wɔ tenabea no so awia, na ogya wɔ mu anadwo, Israel fie no nyinaa anim.",https://www.bible.com/bible/1861/EXO.40.ASW
LEWITIKƆS NHYƐNMU,"NHYƐNMU
Lewitikɔs ka Nyamesom ho nhyehyɛɛ ne ɛho mmara sɛdeɛ ɛteɛ wɔ tete Israelfoɔ mu no ho asɛm. Na ɛwɔ hɔ ma asɔfoɔ a na wɔhwɛ di saa ɔsom no ho nhyehyɛɛ ne mmara yi so no. Nwoma yi mu asɛm titire fa Onyankopɔn Kronkronyɛ ne akwan a ɛsɛ sɛ ne nkurɔfoɔ fa som de bɔ wɔn bra ama ɔne wɔn ntam ayɔnkofa no atena hɔ. Nsɛm titire a nnipa nim no yie koraa ne deɛ yɛhu wɔ Ti 19.18 mu no. Ɛno ne nsɛm a Yesu frɛɛ no mmara nsɛm kɛseɛ a ɛtɔ so mmienu no. Ɛno na ɛka sɛ, “Dɔ wo yɔnko sɛ wo ho” no.
EMU NSƐM
Afɔrebɔ ahodoɔ ho mmara 1.1—7.38
Aaron ne ne mmammarima asɔfohyɛ 8.1—10.20
Mmara a ɛfa ahoteɛ ne deɛ ɛho nteɛ ho 11.1—15.33
Mpata Da 16.1-34
Asetena ne ɔsom mu kronkronyɛ ho mmara 17.1—27.34",https://www.bible.com/bible/1861/LEV.INTRO1.ASW
LEWITIKƆS 1,"Ɔhyeɛ afɔrebɔdeɛ
1Na AWURADE frɛɛ Mose, na ɔfiri ahyiaeɛ ntomadan no mu kasa kyerɛɛ no sɛ: 2Kasa kyerɛ Israelfoɔ, na ka kyerɛ wɔn sɛ: Sɛ mo mu nipa bi de ayɛyɛdeɛ rebrɛ AWURADE a, afieboa a ɔfiri anantwie ne nnwan mu na momfa nyɛ mo ayɛyɛdeɛ mmra. 3 Sɛ n’ayɛyɛdeɛ no yɛ ɔhyeɛ afɔdeɛ a ɛfiri anantwie mu a, ɔmfa onini a ɔdi mu mmra; ahyiaeɛ ntomadan no ano na ɔmfa no mmra, na wasɔ AWURADE ani. 4 Na ɔmfa ne nsa nto ɔhyeɛ afɔdeɛ no atifi, na ɛnsɔ ani mma no na ɛmpata mma no. 5Na ɔnkum nantwinini no, AWURADE anim, na Aaron mma asɔfoɔ no, mfa mogya no mmra, na wɔmfa mpete afɔrebukyia a ɛwɔ ahyiaeɛ ntomadan no so nhyia. 6Na ɔnnwa ɔhyeɛ afɔdeɛ no nwoma, na ɔntwitwa no asinasini. 7Na Ɔsɔfoɔ Aaron mma no nsiesie nnyina wɔ afɔrebukyia no so, na wɔnsɔ ano. 8Na Aaron mma asɔfoɔ no, mfa asinasini no, botire no ne sradeɛ no ngu nnyina a ɛwɔ afɔrebukyia no gya no so. 9 Na ɔnhohoro n’ayamdeɛ ne ne nnyawa ho wɔ nsuo mu; na ɔsɔfoɔ no nhye ne nyinaa afɔrebukyia no so, na ɛnyɛ ɔhyeɛ afɔdeɛ, ogya afɔdeɛ a ɛyi hwa hwanhwam ma AWURADE.
10Na sɛ n’ayɛyɛdeɛ no firi nnwan mu, nnwanten anaa mmirekyie mu, na ɔde rekɔbɔ ɔhyeɛ afɔdeɛ a, onini a ɔdi mu na ɔmfa mmra. 11 Na ɔnku no afɔrebukyia no nkyɛn mu atifi fam, AWURADE anim, na Aaron mma asɔfoɔ no, mfa ne mogya mpete afɔrebukyia no so nhyia. 12 Na ɔntwitwa mu, n’asinasini no mu, ɛne ne ti ne ne sradeɛ nyinaa na ɔsɔfoɔ no nsiesie ngu afɔrebukyia no so. 13 Na ayamdeɛ ne nnyawa no, ɔmfa nsuo nhohoro ho; na ɔsɔfoɔ no mfa ne nyinaa mmra mmɛhye no afɔrebukyia no so; ɛyɛ ɔhyeɛ afɔdeɛ, ogya afɔdeɛ a ɛyi hwa hwanhwam ma AWURADE.
14 Na sɛ n’ayɛyɛdeɛ no firi ntakraboa mu na ɔde rebɛbɔ afɔdeɛ ama AWURADE a, ɔmfa anyankuku anaa mmorɔnoma mma nyɛ n’ayɛyɛdeɛ mmra. 15Na ɔsɔfoɔ no mfa mmra afɔrebukyia no ho, na ɔnte ne ti na ɔnhye no afɔrebukyia no so, na ɔnkyi ne mogya ngu afɔrebukyia no ho. 16Na ɔnyi ne mene ase ne deɛ ɛwɔ mu nto ntwene afɔrebukyia no nkyɛn apueeɛ fam, deɛ nso guo hɔ. 17Na ɔnsuane no mu, n’atabu so, nanso ɔnnte mu, na ɔsɔfoɔ no nhye wɔ afɔrebukyia no so; ɛyɛ ɔhyeɛ afɔdeɛ, ogya afɔdeɛ a ɛyi hwa hwanhwam ma AWURADE.",https://www.bible.com/bible/1861/LEV.1.ASW
LEWITIKƆS 2,"Aduane afɔdeɛ
1Na sɛ obi de aduane afɔdeɛ ayɛyɛdeɛ rebrɛ AWURADE a, n’ayɛyɛdeɛ no nyɛ esiam, na ɔngu so ngo, na ɔmfa ohwamfufuo nto so. 2Na ɔmfa mmrɛ Aaron mma no, asɔfoɔ no, na ɔsɔfoɔ no mfa esiam ne ngo no nsa mama, ne ohwamfufuo no nyinaa, na ɔnhye wɔ afɔrebukyia no so sɛ nkaeɛ adeɛ. Ɛyɛ ogya afɔdeɛ a ɛyi hwa hwanhwam ma AWURADE. 3Na aduane afɔdeɛ no mu deɛ ɛbɛka no nyɛ Aaron ne ne mma dea, AWURADE gya mu akronkronneɛ mu ade kronkron ne no.
4Na sɛ wode aduane afɔdeɛ ayɛyɛdeɛ a wɔato no fononoo mu bi reba a, fa esiam apiti a wɔde ngo afɔre taterɛ ne apiti ɔfam a wɔagu so ngo bra. 5Na sɛ w’ayɛyɛdeɛ no yɛ aduane afɔdeɛ a wɔakye no dadeɛ so a, ma no nyɛ esiam apiti a wɔde ngo afɔre; 6bubu mu asinasini, na hwie ngo gu so, aduane afɔdeɛ ne no.
7Na sɛ w’ayɛyɛdeɛ no yɛ kukuo mu aduane afɔdeɛ a, fa esiam ne ngo yɛ. 8Na fa aduane afɔdeɛ a wɔde nnoɔma yi ayɛ no brɛ AWURADE; na wɔde brɛ ɔsɔfoɔ no a, ɔmfa mmra afɔrebukyia no ho. 9Na ɔsɔfoɔ no nyi ayɛyɛdeɛ no so nkaeɛ adeɛ no, na ɔnhye wɔ afɔrebukyia no so; ogya afɔdeɛ a ɛyi hwa hwanhwam ma AWURADE ne no. 10Na aduane afɔdeɛ no nkaeɛ nyɛ Aaron ne ne mma dea; akronkronneɛ mu ade kronkron a ɛfiri AWURADE gya afɔdeɛ mu ne no.
11 Aduane afɔdeɛ a mode bɛbrɛ AWURADE no nyinaa, mommfa mmɔreka nnyɛ; na monnhye mmɔreka biara ne ɛwoɔ biara sɛ ogya afɔdeɛ mmma AWURADE. 12 Momfa nnoɔma yi mmrɛ AWURADE sɛ aba a ɛdi kan mu afɔrebɔdeɛ, nanso wɔmmfa bi mmma afɔrebukyia no so sɛ ɛmmɛyi hwa hwanhwam. 13 Na w’aduane afɔdeɛ ayɛyɛdeɛ nyinaa, to mu nkyene, na mma wo Nyankopɔn apam nkyene mmpa w’aduane afɔdeɛ mu; fa nkyene ka w’ayɛyɛdeɛ nyinaa ho.
14Na sɛ wode aba a ɛdi kan ayɛyɛdeɛ rebrɛ AWURADE a, fa aburoo mmɛtem a wɔato no ogya mu atutu apɔn ho yɛ w’aba a ɛdi kan mu ayɛyɛdeɛ; 15na fa ngo gu so, na fa ohwamfufuo to so; aduane afɔdeɛ ne no. 16Na ɔsɔfoɔ no nhye aburoo mfuamfua a wɔapɔn ho no bi ne ngo no bi ne ohwamfufuo no nyinaa sɛ nkaeɛ adeɛ; ɛyɛ ogya afɔdeɛ a wɔbɔ ma AWURADE.",https://www.bible.com/bible/1861/LEV.2.ASW
LEWITIKƆS 3,"Asomdwoeɛ afɔdeɛ
1Na sɛ obi ayɛyɛdeɛ yɛ asomdwoeɛ afɔdeɛ, na anantwie no bi na ɔde reba a, onini oo, ɔbedeɛ oo, deɛ ɔdi mu na ɔmfa no mmra AWURADE anim. 2Na ɔmfa ne nsa nto n’ayɛyɛdeɛ no atifi, na ɔnku no, ahyiaeɛ ntomadan no ano, na Aaron mma no, asɔfoɔ no, mfa mogya no mpete afɔrebukyia no so nhyia. 3Na ɔnyi asomdwoeɛ afɔdeɛ no bi mmra mmɛyɛ AWURADE gya afɔdeɛ; sradeɛ a ɛkata ayamdeɛ no soɔ no ne ayamdeɛ no ho sradeɛ nyinaa, 4ne sawa mmienu no ne sradeɛ a ɛwɔ ho, sisia mu no, ne mmerɛboɔ so ntentan no; ɔmfiri sawa ho nyi. 5Na Aaron mma no nhye no afɔrebukyia no so, mpae ɔhyeɛ afɔdeɛ a ɛgu ogya no so, na ɛnyɛ ogya afɔdeɛ a ɛyi hwa hwanhwam ma AWURADE.
6Na sɛ n’ayɛyɛdeɛ a ɔde rebɛbɔ asomdwoeɛ afɔdeɛ ama AWURADE no yɛ nnwan no bi a, onini oo, ɔbedeɛ oo, deɛ ɔdi mu na ɔmfa mmra. 7Sɛ n’ayɛyɛdeɛ yɛ adwammaa na ɔde reba a, ɔmfa mmra AWURADE anim; 8na ɔmfa ne nsa nto n’ayɛyɛdeɛ no atifi, na ɔnku no ahyiaeɛ ntomadan no ano, na Aaron mma no mfa ne mogya mpete afɔrebukyia no so nhyia. 9Na ɔnyi asomdwoeɛ afɔdeɛ no bi mmra mmɛbɔ ogya afɔdeɛ mma AWURADE; ne sradeɛ ne ne sradeɛ duapuo a ɔntwa no padua so pa ara ne sradeɛ a ɛkata ayamdeɛ soɔ ne ayamdeɛ ho sradeɛ nyinaa, 10ne sawa mmienu no ne sradeɛ a ɛwɔ ho, sisia mu no, ne mmerɛboɔ so ntentan no; ɔmfiri sawa ho nyi. 11Na ɔsɔfoɔ no nhye no afɔrebukyia no so: Ɛyɛ aduane afɔdeɛ a wɔbɔ no gya so ma AWURADE.
12Na sɛ n’ayɛyɛdeɛ no yɛ abirekyie a, ɔmfa mmra AWURADE anim; 13na ɔmfa ne nsa nto n’atifi, na ɔnku no, ahyiaeɛ ntomadan no ano, na Aaron mma no mfa ne mogya mpete afɔrebukyia no so nhyia. 14Na ɔnyi bi mmra mmɛyɛ n’ayɛyɛdeɛ, AWURADE gya afɔdeɛ: Sradeɛ a ɛkata ayamdeɛ soɔ no ne ayamdeɛ ho sradeɛ nyinaa; 15ne sawa mmienu no, ne sradeɛ a ɛwɔ ho, sisia mu no, ne mmerɛboɔ so ntentan no; ɔmfiri sawa ho nyi. 16Na ɔsɔfoɔ no nhye no wɔ afɔrebukyia no so; ɛyɛ ogya afɔreduane a ɛyi hwa hwanhwam; sradeɛ no nyinaa yɛ AWURADE dea. 17 Ɛnyɛ daa ahyɛdeɛ mo awoɔ ntoatoasoɔ nyinaa mu ne mo tenabea nyinaa sɛ: Monnni sradeɛ anaa mogya biara.",https://www.bible.com/bible/1861/LEV.3.ASW
LEWITIKƆS 4,"Bɔne ho afɔdeɛ
1Na AWURADE kasa kyerɛɛ Mose sɛ: 2Kasa kyerɛ Israelfoɔ sɛ: Sɛ obi anhyɛda na ɔyɛ nnoɔma a AWURADE ahyɛ sɛ wɔnnyɛ no mu biara, 3sɛ nso ɔsɔfoɔ a wɔasra no ɔsɔfo panin yɛ bɔne ma ɔman no di so a, ɛnneɛ ne bɔne a ɔyɛeɛ nti ma no mfa nantwie ba onini a ɔdi mu mmrɛ AWURADE mmɛyɛ bɔne ho afɔdeɛ. 4Na ɔmfa nantwinini no mmra ahyiaeɛ ntomadan no ano, AWURADE anim, na ɔmfa ne nsa nto n’atifi, na ɔnku no, AWURADE anim. 5Na ɔsɔfoɔ a wɔasra no no mfa nantwie no mogya no bi nkɔ ahyiaeɛ ntomadan no mu, 6 na ɔsɔfoɔ no mfa ne nsateaa mmɔ mogya no mu, na ɔmpete mogya no bi mprɛnson, AWURADE anim, kronkronbea ntwamutam no anim. 7 Na ɔsɔfoɔ no mfa mogya no bi nkeka aduhwamhyeɛ bukyia a ɛwɔ AWURADE anim, ahyiaeɛ ntomadan mu no mmɛn ho, na ɔnhwie nantwie no mogya nyinaa ngu ɔhyeɛ afɔrebukyia a ɛwɔ ahyiaeɛ ntomadan ano no ase. 8Na ɔnyi bɔne ho afɔdeɛ nantwie no sradeɛ nyinaa mfiri ne ho; sradeɛ a ɛkata ayamdeɛ so ne ayamdeɛ ho sradeɛ nyinaa, 9ne sawa mmienu no ne sradeɛ a ɛwɔ so, sisia mu no ne mmerɛboɔ so ntentan no; ɔmfiri sawa ho nyi, 10sɛdeɛ wɔyi firi asomdwoeɛ afɔdeɛ nantwie ho no; na ɔsɔfoɔ no nhye no ɔhyeɛ afɔrebukyia no so. 11 Na ɔmfa nantwinini no nwoma ne ne nam nyinaa ne ne ti ne ne nnyawa ne n’ayamdeɛ ne n’agyanan no, 12 nantwinini mu no nyinaa, mfiri nkɔ nsraban no akyi, deɛ ɛhɔ teɛ, deɛ wɔhwie nso guo, na ɔmfa ogya nhye no nnyina so; deɛ wɔhwie nso guo na wɔnhye no.
Ɔman mu no
13 Na sɛ Israel asafo nyinaa fom, na asɛm no ahunta ɔman no ani so, na wɔyɛ nnoɔma a AWURADE ahyɛ sɛ wɔnnyɛ no mu bi, na wɔdi so, 14 na wɔhunu bɔne a wɔayɛ de afom no a, ɛnneɛ, asafo no mfa nantwie ba onini mmra mmɛyɛ bɔne ho afɔdeɛ, na wɔmfa no mmra ahyiaeɛ ntomadan no ano. 15Na asafo no mu mpanimfoɔ mfa wɔn nsa ngu nantwinini no atifi, na wɔnkum nantwie no, AWURADE anim. 16Na ɔsɔfoɔ a wɔasra no no mfa nantwinini no mogya no bi nhyɛne ahyiaeɛ ntomadan no mu; 17na ɔmfa ne nsateaa mmɔ mogya no mu mfa mpete mprɛnson, AWURADE anim, ntwamutam no anim, 18na ɔmfa mogya no bi nkeka afɔrebukyia a ɛsi AWURADE anim, ahyiaeɛ ntomadan no mu, no mmɛn ho, na ɔnhwie mogya no nyinaa ngu ɔhyeɛ afɔrebukyia a ɛsi ahyiaeɛ ntomadan ano no ase. 19Na ɔnyi ne sradeɛ nyinaa mfiri so, na ɔnhye no afɔrebukyia no so. 20Na sɛdeɛ ɔyɛɛ bɔne ho afɔdeɛ nantwinini no, saa ara na wɔnyɛ yei nso; na ɔsɔfoɔ no mpata mma wɔn, na wɔde bɛkyɛ wɔn. 21 Na ɔmfa nantwinini no mfiri nkɔ nsraban no akyi, na ɔnhye no sɛdeɛ wɔhyee kane nantwinini no, asafo no bɔne ho afɔdeɛ ne no.
Ɔmanfoɔ no mu atitire
22Sɛ otitire bi anhyɛ da na ɔyɛ nnoɔma a AWURADE ne Nyankopɔn ahyɛ sɛ wɔnnyɛ no nyinaa mu adeɛ baako, na ɔdi so, na sɛ wɔma no hunu ne bɔne a wayɛ no a, 23ɛnneɛ, ɔmfa n’ayɛyɛdeɛ a ɛyɛ ɔpapo a ɔdi mu mmra; 24na ɔmfa ne nsa nto ɔpapo no atifi, na ɔnku no deɛ wɔkum ɔhyeɛ afɔdeɛ no wɔ AWURADE anim: Bɔne ho afɔdeɛ ne no. 25Na ɔsɔfoɔ no mfa ne nsateaa mfa bɔne ho afɔdeɛ no mogya no bi nkeka ɔhyeɛ afɔrebukyia no mmɛn ho, na ɔnhwie ne mogya no ngu ɔhyeɛ afɔrebukyia no ase. 26Na ɔnhye ne sradeɛ nyinaa wɔ ɔhyeɛ afɔrebukyia no so sɛ asomdwoeɛ afɔdeɛ sradeɛ no; na ɔsɔfoɔ no mpata mma no, ne bɔne no ho, na wɔde bɛkyɛ no.
Ɔmanfoɔ no
27Na sɛ asase no so nkurɔfoɔ no mu biara anhyɛda na ɔyɛ nnoɔma a AWURADE ahyɛ sɛ wɔnnyɛ no mu adeɛ baako, na ɔdi so, na sɛ wɔma no hunu ne bɔne a wayɛ a, 28ɛnneɛ, ne bɔne a wayɛ no nti, ɔmfa n’ayɛyɛdeɛ, abirekyibereɛ a ɔdi mu mmra mmɛma; 29na ɔmfa ne nsa nto bɔne ho afɔdeɛ no atifi, na ɔnkum bɔne ho afɔdeɛ no deɛ wɔkum ɔhyeɛ afɔdeɛ hɔ. 30Na ɔsɔfoɔ no mfa ne nsateaa nka mogya no bi nkeka ɔhyeɛ afɔrebukyia no mmɛn ho, na ɔnhwie ne mogya nyinaa ngu ɔhyeɛ afɔrebukyia no ase. 31 Na ɔnyi ɛho sradeɛ sɛdeɛ wɔyi asomdwoeɛ afɔdeɛ deɛ no, na ɔsɔfoɔ no nhye no ɔhyeɛ afɔrebukyia no so, na ɛnyi hwa hwanhwam mma AWURADE; na ɔsɔfoɔ no mpata mma no, na wɔde bɛkyɛ no.
32Na sɛ ɔde adwammaa bɛyɛ n’ayɛyɛdeɛ ba bɛbɔ bɔne ho afɔdeɛ a, ɔmfa ɔbedeɛ a ɔdi mu mmra. 33Na ɔmfa ne nsa nto bɔne ho afɔdeɛ no atifi, na ɔnku no nyɛ bɔne ho afɔdeɛ, deɛ wɔkum ɔhyeɛ afɔdeɛ hɔ. 34Na ɔsɔfoɔ no mfa ne nsateaa nka bɔne ho afɔdeɛ no mogya no bi nkeka ɔhyeɛ afɔrebukyia no mmɛn ho, na ɔnhwie mogya no nyinaa ngu afɔrebukyia no ase. 35Na ɔnyi ne sradeɛ nyinaa, sɛdeɛ wɔyi asomdwoeɛ afɔdeɛ adwammaa ho sradeɛ no, na ɔsɔfoɔ no nhye no afɔrebukyia so, sɛdeɛ AWURADE gya afɔrebɔ teɛ no; na ɔsɔfoɔ no mpata mma no, ne bɔne a wayɛ no ho, na wɔde bɛkyɛ no.",https://www.bible.com/bible/1861/LEV.4.ASW
LEWITIKƆS 5,"Bɔne ahodoɔ ho afɔrebɔ
1 Na sɛ obi yɛ bɔne sɛ wate ntanka nne na ɔne ɛho danseni, sɛ ɔhunui oo, ɔtee oo, na wanka a, ɔbɛsoa ne mmusuo. 2 Anaasɛ sɛ obi ka afideɛ biara, sɛ aboa bi a ne ho nteɛ funu, anaa afieboa bi a ne ho nteɛ funu, anaa aboaa bi a ne ho nteɛ funu, na ɔnnim mpo a, ne ho agu fi, na ɔdi so. 3Anaasɛ sɛ ɔka onipa ho fi bi, na sɛ afideɛ a ama oniiko ho agu fi no te sɛn ara, na ɔnnim mpo a, sɛ akyire yi ɔhunu a, ɔdi so.
4Sɛ asɛnhunu firi onipa anomu anaasɛ ɔka ntam sɛ ɔbɛyɛ bɔne anaa papa bi na ɔnnim mpo a, sɛ akyire n’ani ba ne ho so a, ɔdi adeɛ yi mu biara ho so; 5na afei sɛ ɔdi adeɛ yi mu biara ho so a, ɔnka deɛ wayɛ mu bɔne no, 6na ne bɔne a wayɛ no nti, ɔmfa n’asodie ho afɔdeɛ mmrɛ AWURADE, nnwan mu ɔbedeɛ, odwanten anaa abirekyie, na ɛnyɛ bɔne ho afɔdeɛ, na ɔsɔfoɔ no mpata mma no wɔ ne bɔne no ho.
7Na sɛ ne nsa anso odwan so a, ɔmfa anyankuku mmienu anaa mmorɔnoma mma mmienu mmrɛ AWURADE mmɛyɛ bɔne a wayɛ no mu asodie ho afɔdeɛ; baako nyɛ bɔne ho afɔdeɛ, na baako nyɛ ɔhyeɛ afɔdeɛ. 8 Na ɔmfa mmrɛ ɔsɔfoɔ no, na ɔmfa deɛ ɛyɛ bɔne ho afɔdeɛ no kane, na ɔnkyinsa ne ti, ne kɔn so, nanso ɔnnte mfiri so; 9na ɔmfa bɔne ho afɔdeɛ no mogya no bi mpete afɔrebukyia no ho, na mogya no nkaeɛ no ɔmfa ngu ɔhyeɛ afɔrebukyia no ase, bɔne ho afɔdeɛ ne no. 10 Na deɛ ɔtɔ so mmienu no, ɔmfa no mmɔ ɔhyeɛ afɔdeɛ, sɛdeɛ ne yɛbea teɛ. Na ɔsɔfoɔ no mpata mma no wɔ ne bɔne a wayɛ no ho, na wɔde bɛkyɛ no. 11 Na sɛ ne nsa anso anyankuku mmienu anaa mmorɔnoma mma mmienu so a, deɛ ɔmfa nyɛ ne bɔne a ɔyɛeɛ ho ayɛyɛdeɛ ne esiam olonka abupɛn du mu baako, na ɛnyɛ bɔne ho afɔdeɛ; ɔmmfa ngo nngu so, na ɔmmfa ohwamfufuo nnto so, ɛfiri sɛ ɛyɛ bɔne ho afɔdeɛ. 12Na ɔmfa mmrɛ ɔsɔfoɔ no, na ɔsɔfoɔ no mfa mu nsa ma nyɛ nkaeɛ adeɛ, na ɔnhye no afɔrebukyia no so, sɛdeɛ AWURADE gya afɔrebɔ teɛ no: Bɔne ho afɔdeɛ ne no. 13 Na ɔsɔfoɔ no mpata mma no, ne bɔne a wayɛ nnoɔma yi biara mu no ho, na wɔde bɛkyɛ no; na nkaeɛ no nyɛ ɔsɔfoɔ no deɛ, sɛ aduane afɔdeɛ.
Asodie ho afɔdeɛ
14Na AWURADE kasa kyerɛɛ Mose sɛ: 15Sɛ obi anhyɛ da yɛ bɔne a ɛyɛ kusumdie wɔ AWURADE akronkronneɛ ho a, ɛnneɛ, n’asodie afɔdeɛ a ɔmfa mmrɛ AWURADE ne odwennini a ɔdi mu, sɛdeɛ wobɛbɔ ne boɔ, dwetɛ nnwetɛbena mu, sɛdeɛ kronkronbea dwetɛbena teɛ; na ɛnyɛ asodie ho afɔdeɛ. 16 Na deɛ wayɛ ɛho bɔne, akronkronneɛ mu no, ɔnsi ananmu, na ɔmfa mu abupɛn nnum mu baako mpae so, na ɔmfa mmrɛ ɔsɔfoɔ no, na ɔsɔfoɔ no mfa asodie ho afɔdeɛ dwennini no mpata mma no, na wɔde bɛkyɛ no. 17Na sɛ obi yɛ bɔne yɛ nnoɔma a AWURADE ahyɛ sɛ wɔnnyɛ no mu adeɛ baako a, sɛ wanhunu mpo a, ɔdi so na ɔso ne mmusuo; 18na ɔmfa odwennini a ɔdi mu mmrɛ ɔsɔfoɔ no, sɛdeɛ wobɛbɔ ne boɔ, na ɛnyɛ asodie ho afɔdeɛ; na ɔsɔfoɔ no mpata mma no, fom a wafom na wanhunu no ho, na wɔde bɛkyɛ no. 19 Asodie ho afɔdeɛ ne no. AWURADE ho so na wadie.",https://www.bible.com/bible/1861/LEV.5.ASW
LEWITIKƆS 6,"1Na AWURADE kasa kyerɛɛ Mose sɛ: 2Sɛ obi yɛ bɔne di AWURADE kusum sɛ ɔsane ne yɔnko adeɛ bi a ɔde ama no asie, anaasɛ ɔde ahyɛ ne nsa, anaasɛ ɔbɔ korɔno, anaasɛ ɔdi ne yɔnko amim, 3anaasɛ wahunu biribi a ayera na ɔsane, na ɔka ntanhunu, sɛ onipa yɛ yeinom biara mu bɔne, 4 sɛ ɛba sɛ ɔyɛ bɔne na ɔdi so saa a, ɔmfa adeɛ a ɔfaeɛ anaa adeɛ a ɔdii mu amim, anaa adeɛ a wɔde maa no asie anaa adeɛ a ɛyeraeɛ a ɔhunuiɛ, 5 anaa adeɛ biara a ɔkaa ɛho ntanhunu no nsane mmra, ɔmfa ne nyinaa mmra, na ɔmfa abupɛn nnum mu baako mpae so mma ɔdenadeɛ no, n’asodie ho afɔrebɔ da no ara; 6 na ɔmfa n’asodie ho afɔdeɛ a ɔde rebrɛ AWURADE no mmrɛ ɔsɔfoɔ no, nnwan mu odwennini a ɔdi mu, sɛdeɛ wobɛbɔ ne boɔ, na ɛnyɛ asodie ho afɔdeɛ. 7Na ɔsɔfoɔ no mpata mma no wɔ AWURADE anim, na wɔde adeɛ biara a wayɛ a ɔdi ho so no bɛkyɛ no.
Ɔhyeɛ afɔdeɛ ho mmara
8Na AWURADE kasa kyerɛɛ Mose sɛ: 9 Hyɛ Aaron ne ne mma no sɛ: Yei ne ɔhyeɛ afɔdeɛ ho mmara: Ɔhyeɛ afɔdeɛ no ntena asomurofi, afɔrebukyia no so anadwo mu nyinaa nkɔsi anɔpa, na wɔmma afɔrebukyia no so gya no nnɛre wɔ so. 10 Na ɔsɔfoɔ no nhyɛ ne nwera atadeɛ, na ɔnhyɛ ne nwera twakoto nkata ne ho, na ɔnsesa nso a ɔhyeɛ afɔdeɛ ogya no hye gyaa no afɔrebukyia no soɔ no ngu afɔrebukyia no nkyɛn. 11 Na ɔnyi ne ntadeɛ no, na ɔnhyɛ ntadeɛ foforɔ, na ɔmfa nso no mfiri nkɔ nsraban no akyi nkɔgu deɛ ɛhɔ teɛ. 12Na wɔmma afɔrebukyia so gya no nnɛre, ennnum ara da, na ɔsɔfoɔ no nsɔ nnyina wɔ so daa anɔpa, na ɔnsiesie ɔhyeɛ afɔdeɛ no wɔ so, na ɔnhye so asomdwoeɛ afɔdeɛ ho sradeɛ no. 13Ogya nnɛre afɔrebukyia no so daa, ɛnnnum da.
14 Na yei ne aduane afɔdeɛ ho mmara: Aaron mma no mfa mmra AWURADE anim wɔ afɔrebukyia no anim. 15Na ɔmfa aduane afɔdeɛ no esiam no nsa ma ne ngo no bi ne aduane afɔdeɛ no so hwamfufuo nyinaa, na ɔnhye wɔ afɔrebukyia no so, na ɛnyi hwa hwanhwam nyɛ nkaeɛ adeɛ mma AWURADE. 16Na nkaeɛ no, Aaron ne ne mma no nni no apiti, wɔnni no deɛ ɛhɔ yɛ kronkron, ahyiaeɛ ntomadan no adihɔ na wɔnnie. 17Wɔmmfa mmɔreka mmfra nnto. Wɔn kyɛfa a mede mama wɔn wɔ me gya afɔdeɛ mu ne no; ɛyɛ akronkronneɛ mu ade kronkron, sɛ bɔne ho afɔdeɛ ne asodie ho afɔdeɛ. 18Aaron mma mu mmarima nyinaa nni; ɛnyɛ AWURADE gya afɔdeɛ ahodoɔ ho daa ahyɛdeɛ, mo awoɔ ntoatoasoɔ nyinaa mu. Obiara a ɔka no nyɛ kronkron.
19Na AWURADE kasa kyerɛɛ Mose sɛ: 20 Yei ne Aaron ne ne mma ayɛyɛdeɛ a wɔmfa mmrɛ AWURADE, ɛda a wɔsra no ngo no; esiam olonka abupɛn du mu baako nyɛ daa ayɛyɛdeɛ, anɔpa deɛ fa na anwummerɛ deɛ fa. 21Wɔmfa ngo nkye no dadeɛ ayowa mu; yɛ no nkyekyeewa bra; yɛ no sɛ aduane afɔdeɛ a wɔatoto abubu mu asinasini bra, na ɛnyi hwa hwanhwam mma AWURADE. 22Na ɔsɔfoɔ a wɔbɛsra no ngo asi n’ananmu wɔ ne mma mu no na ɔnyɛ; ɛyɛ AWURADE daa ahyɛdeɛ; wɔnhye no mu. 23Na ɔsɔfoɔ no aduane afɔdeɛ nyinaa wɔnhye no mu; wɔnnni bi.
Bɔne ho afɔdeɛ ho mmara
24Na AWURADE kasa kyerɛɛ Mose sɛ: 25 Kasa kyerɛ Aaron ne ne mma no sɛ: Yei ne bɔne ho afɔdeɛ ho mmara: Faako a wɔkum ɔhyeɛ afɔdeɛ aboa no, ɛhɔ ara na wɔnkum bɔne ho afɔdeɛ deɛ no, AWURADE anim; akronkronneɛ mu ade kronkron ne no. 26Ɔsɔfoɔ a ɔbɔ bɔne ho afɔdeɛ no na ɔnnie; faako a ɛhɔ yɛ kronkron na wɔnni wɔ ahyiaeɛ ntomadan no adihɔ. 27Obiara a ɔka nam no nyɛ kronkron; na deɛ mogya no bi apete n’atadeɛ mu no nsi deɛ ɛpetee mu no wɔ deɛ ɛhɔ yɛ kronkron. 28Na ahina a wɔnoaa no wɔ mu no, wɔmmɔ, na sɛ kɔbere mfrafraeɛ sɛn mu na wɔnoaeɛ a, wɔntwi mu na wɔmfa nsuo nhohoro mu. 29Mmarima a wɔfiri asɔfoɔ abusuakuo mu nyinaa nni bi; ɛyɛ akronkronneɛ mu ade kronkron. 30Na bɔne ho afɔdeɛ a wɔde ne mogya no bi ba ahyiaeɛ ntomadan mu bɛpata wɔ kronkronbea hɔ no nyinaa, wɔnnni, wɔmfa ogya nhye.",https://www.bible.com/bible/1861/LEV.6.ASW
