Title,Content,URL
GYENESIS 46,"Yakob ne ne fiefoɔ kɔ Misraim
1 Na Israel ne deɛ ɔwɔ nyinaa sii mu, na ɔduruu Beer-seba, na ɔbɔɔ afɔdeɛ maa n’agya Isak Nyankopɔn. 2Na Onyankopɔn nam anadwo anisoadehunu mu ka kyerɛɛ Israel sɛ: Yakob, Yakob! Na ɔse: Menie. 3Na ɔse: Mene Onyankopɔn, w’agya Nyankopɔn no. Nsuro sɛ wobɛsiane akɔ Misraim, na mɛyɛ wo ɔman kɛseɛ wɔ hɔ. 4Me ne wo bɛsiane akɔ Misraim, na mede wo asane aba nso, na Yosef deɛ, ne nsa so na wo bɛwuo.
5Na Yakob sii mu firii Beer-seba; na Israel mma de wɔn agya Yakob ne wɔn mma ne wɔn yerenom tenatenaa nteaseɛnam a Farao soma maa wɔde kɔfaa no no mu. 6Na wɔfaa wɔn mmoa ne wɔn ahodeɛ a wɔanya wɔ Kanaan asase soɔ no kɔɔ Misraim, Yakob ne n’asefoɔ nyinaa, 7ne mmammarima ne ne mmammarima mma ne ne mmammaa ne ne mmammarima mmammaa ne n’asefoɔ nyinaa, na ɔne wɔn kɔɔ Misraim.
8 Na yeinom ne Israel mma a wɔkɔɔ Misraim no din, Yakob ne ne mma: Yakob abakan Ruben. 9Na Ruben mmammarima ne: Hanok, Palu, Hesron ne Karmi. 10Na Simeon mmammarima ne: Yemuel, Yamin, Ohad, Yakin, Sohar ne Kanaanni baa ba Saulo. 11Na Lewi mmammarima ne: Gerson, Kohat ne Merari. 12Na Yuda mmammarima ne: Er, Onan, Sela, Peres ne Sera; (na Er ne Onan wuu Kanaan asase so.) Na Peres mmammarima ne: Hesron ne Hamul. 13Na Isakar mmammarima ne: Tola, Puwa, Hiob ne Simron. 14Na Sebulon mmammarima ne: Sered, Elon ne Yakleel. 15(Yeinom ne Lea mmammarima a ɔwo maa Yakob wɔ Mesopotamia ne ne babaa Dina, ne mmammarima ne ne mmammaa nyinaa yɛ akra aduasa mmiɛnsa.) 16Na Gad mmammarima ne: Sifion, Hagi, Suni, Esbon, Eri, Arodi ne Areli. 17Aser mmammarima ne: Yimna, Isua, Isui, Beria ne wɔn nuabaa Sera. Na Beria mmammarima ne: Heber ne Malkiel. 18(Yeinom ne Silpa a Laban de no maa ne babaa Lea no mma a ɔwo maa Yakob, wɔyɛ akra dunsia.) 19Yakob yere Rahel mmammarima ne: Yosef ne Benyamin. 20 Na Yosef mma a On sɔfoɔ Potifera babaa Asnat wo maa no Misraim asase soɔ ne: Manase ne Efraim. 21Na Benyamin mmammarima ne: Bela, Beker, Asbel, Gera, Naaman, Ehi, Ros, Mupim, Hupim ne Ard. 22(Yeinom ne Rahel mma a wɔwo maa Yakob, akra no nyinaa yɛ dunan.) 23Na Dan babarima ne: Husim. 24Na Naftali mmammarima ne: Yahseel, Guni, Yeser ne Silem. 25(Yeinom ne Bilha a Laban de no maa ne ba Rahel no mma a ɔwo maa Yakob, akra no nyinaa yɛ baason). 26Akra a wɔne Yakob kɔɔ Misraim a wɔfiri n’asene mu, Yakob mma yerenom mfram, akra no nyinaa yɛ aduosia nsia. 27 Na Yosef mma a wɔwoo wɔn Misraim no yɛ akra baanu. Yakob fie akra a wɔbaa Misraim no nyinaa yɛ aduɔson.
Yakob ne ne fiefoɔ kɔ Misraim
28 Na ɔsomaa Yuda dii n’anim kɔɔ Yosef nkyɛn sɛ ɔmmɛdi n’anim nkyerɛ no Gosen kwan. Na wɔduruu Gosen asase so. 29Na Yosef siesiee ne nteaseɛnam kɔhyiaa n’agya Israel wɔ Gosen. Na ɔde ne ho kɔkyerɛɛ no no, ɔsɔɔ ne kɔn mu, na ɔsui ara kyɛree wɔ ne kɔn ho.
30 Na Israel ka kyerɛɛ Yosef sɛ: Afei a manya mahunu w’anim sɛ woda so te aseɛ yi, wɔmma menti nananom wɔ asamando. 31Na Yosef ka kyerɛɛ ne nuanom ne n’agya fiefoɔ sɛ: Merekɔ makɔka akyerɛ Farao sɛ: Me nuanom ne m’agya fiefoɔ a wɔwɔ Kanaan asase soɔ no aba me nkyɛn. 32Na nnipa no yɛ nnwanhwɛfoɔ, na mmoa na wɔyɛne, na wɔde wɔn nnwan ne wɔn anantwie ne deɛ wɔwɔ nyinaa aba. 33Na sɛ Farao bɛfrɛ mo, na ɔbisa mo sɛ: Mo adwuma ne sɛn a? 34 Monse no sɛ: Wo nkoa yɛ mmoahwɛfoɔ firi yɛn mmɔfraase de bɛsi nnɛ, yɛn ne yɛn nananom, na moatena Gosen asase so, ɛfiri sɛ Misraimfoɔ kyiri mmoahwɛfoɔ nyinaa.",https://www.bible.com/bible/1861/GEN.46.ASW
GYENESIS 47,"Yosef de n’agya ne ne nuanom mu bi kɔkyea Farao
1Na Yosef kɔka kyerɛɛ Farao sɛ: M’agya ne me nuanom ne wɔn nnwan ne wɔn anantwie ne deɛ wɔwɔ nyinaa firi Kanaan asase so aba, na hwɛ, wɔwɔ Gosen asase so. 2Na ɔde ne nuanom mu baanum kɔgyinaa Farao anim. 3 Na Farao bisaa ne nuanom no sɛ: Mo adwuma ne sɛn? Na wɔka kyerɛɛ no sɛ: Wo nkoa yɛ mmoahwɛfoɔ, yɛn ne yɛn nananom nso. 4Na wɔka kyerɛɛ Farao bio sɛ: Yɛaba sɛ yɛrebɛtena asase yi so, ɛfiri sɛ wo nkoa nnya adidibea mma wɔn nnwan, ɛfiri sɛ ɛkɔm no mu yɛ den wɔ Kanaan asase so. Enti afei yɛsrɛ wo, ma wo nkoa ntena Gosen asase so. 5Na Farao ka kyerɛɛ Yosef sɛ: W’agya ne wo nuanom aba wo nkyɛn. 6Misraim asase na ɛda w’anim yi, asase no mu deɛ ɛyɛ no, ma w’agya ne wo nuanom ntena hɔ. Ma wɔntena Gosen asase so. Na sɛ wonim sɛ wɔn mu bi yɛ nsiyɛfoɔ a, fa wɔn si me mmoa a mewɔ so. 7Na Yosef de n’agya Yakob kɔgyinaa Farao anim. Na Yakob hyiraa Farao. 8Na Farao bisaa Yakob sɛ: Wo nkwa mu mfirinhyia yɛ ahe? 9 Na Yakob ka kyerɛɛ Farao sɛ: Me hɔhobea asetena mfirinhyia mu nna yɛ mfeɛ ɔha aduasa; me nkwa mfirinhyia mu nna yɛ kakraa bi ne amaneɛ nko, ɛnnuru me nananom nkwa mfirinhyia mu nna wɔ wɔn hɔhobea asetena nna mu. 10Na Yakob hyiraa Farao, na ɔfirii Farao anim kɔe.
11Na Yosef maa n’agya ne ne nuanom tenaberɛ, na ɔmaa wɔn asase wɔ Misraim wɔ deɛ asase no yɛ, wɔ Rameses asase so, sɛdeɛ Farao hyɛeɛ no. 12 Na Yosef bɔɔ n’agya ne ne nuanom ne n’agya fiefoɔ nyinaa akɔnhoma, sɛdeɛ abusua biara dodoɔ teɛ.
Ɛkɔm no
13Na aduane nni asase biara so, na ɛkɔm no mu yɛɛ den yie maa Misraim asase ne Kanaan asase tɔɔ ɛkɔm no anim piti. 14Na Yosef prapraa sika a ɛwɔ Misraim asase ne Kanaan asase soɔ nyinaa wɔ aburoo a wɔbɛtɔeɛ no mu, na Yosef de sika no kɔɔ Farao fie. 15Na sika saa Misraimfoɔ ne Kanaanfoɔ ho no, Misraimfoɔ nyinaa baa Yosef nkyɛn sɛ: Ma yɛn aduane ɛ! Adɛn na sɛ sika asa nti, yɛnwuwu w’anim? 16Na Yosef se: Momfa mo mmoa mmra, na sɛ mo sika asa a, mɛma mo bi magye mo mmoa. 17Na wɔde wɔn mmoa bae, na Yosef maa wɔn aduane gyegyee apɔnkɔ, nnwan, anantwie ne mfunumu. Na ɔmaa wɔn aduane de gyee wɔn mmoa nyinaa afirinhyia no. 18Na afe no twaa mu no, afe a ɛdi soɔ no, wɔbaa ne nkyɛn bɛka kyerɛɛ no sɛ: Yɛremfa nhunta me wura sɛ yɛn sika asa na mmoa akuakuo no yɛ me wura dea, na biribiara nkae wɔ me wura anim sɛ yɛn honam ne yɛn asase nko. 19Adɛn nti na yɛn ne yɛn asase nwu w’anim? Tɔ yɛn ne yɛn asase, na ma yɛn aduane, na yɛde yɛn ho ne yɛn asase bɛsom Farao. Ma yɛn aduaba, na yɛntena ase, na yɛanwu amma asase yi anna mpan. 20Na Yosef tɔɔ Misraim asase nyinaa maa Farao. Na Misraimfoɔ nyinaa tontɔnee wɔn mfuo, ɛfiri sɛ ɛkɔm no denee wɔn, na asase no danee Farao dea. 21Na nkurɔfoɔ no deɛ, ɔdanee wɔn nkoa, ɛfiri Misraim hyeɛ so kɔsi hyeɛ so.
22Gye asɔfoɔ nsase nko na wantɔ, ɛfiri sɛ na Farao ahyɛ kyɛfa bi ama asɔfoɔ no, na wɔdi wɔn kyɛfa a Farao de ma wɔn no nti, wɔantɔn wɔn asase. 23Na Yosef ka kyerɛɛ nkurɔfoɔ no sɛ: Monhwɛ, ɛnnɛ matɔ mo ne mo asase mama Farao, na hwɛ, mo aduaba a momfa nkɔdua asase no soɔ nie. 24Na deɛ ɛbɛsoɔ no, momfa nkyekyɛmu nnum mu baako mma Farao, na emu abupɛn nnan no nyɛ mo dea, na mode bi adua mfuo mu, na mode bi ayɛ mo ne mo fiefoɔ ne mo mma aduane. 25Na wɔse: Woagye yɛn nkwa; ma yɛnnya me wura anim adom ara, na yɛbɛyɛ Farao nkoa. 26Na Yosef hyɛɛ yei ho mmara wɔ Misraim a ɛwɔ hɔ de bɛsi nnɛ, sɛ wɔmfa Misraim asase so adeɛ biara nkyekyɛmu nnum mu baako mma Farao, gye asɔfoɔ asase nko na anyɛ Farao dea.
Yakob adesrɛ a ɛtwa toɔ
27 Na Israel tenaa Misraim asase so wɔ Gosen, na wɔnyaa mu adeɛ, na wɔdɔree, na wɔn ase trɛɛ pa ara. 28Na Yakob tenaa Misraim asase so mfeɛ dunson, na Yakob nna, ne nkwa mfirinhyia, yɛ mfeɛ ɔha aduanan nson.
29 Na Israel nna duruu sɛ ɔbɛwuo no, ɔfrɛɛ ne ba Yosef ka kyerɛɛ no sɛ: Sɛ manya w’anim adom a, fa wo nsa ka m’asene mu, na yɛ me adɔeɛ di me nokorɛ, na nsie me Misraim! 30 Ɛda a mɛtoa nananom no, soa me firi Misraim kɔsie me wɔ me nananom amusieeɛ. Na ɔbuaa sɛ: Mɛyɛ sɛdeɛ woaka yi. 31Na ɔse: Ka me ntam. Na ɔkaa no ntam. Na Israel bɔɔ ne mu ase kyerɛɛ mpa no atifi.",https://www.bible.com/bible/1861/GEN.47.ASW
GYENESIS 48,"Yakob hyira Efraim ne Manase
1Na nsɛm yi akyiri no, wɔka kyerɛɛ Yosef sɛ: Hwɛ, w’agya yare. Na ɔfaa ne mmabarima baanu, Manase ne Efraim kaa ne ho.
2Na wɔkɔka kyerɛɛ Yakob sɛ: Hwɛ, wo ba Yosef reba wo nkyɛn. Na Israel miaa n’ani tenaa ne mpa so.
3 Na Yakob ka kyerɛɛ Yosef sɛ: Onyankopɔn Tweaduampɔn yii ne ho kyerɛɛ me wɔ Lus a ɛwɔ Kanaan asase soɔ, na ɔhyiraa me 4 ka kyerɛɛ me sɛ: Hwɛ, mɛma woadɔ, na mama woadɔɔso, mɛyɛ wo aman asafo, na mede asase yi bɛma w’asefoɔ a wɔbɛdi w’akyire no sɛ daa agyapadeɛ.
5 Na afei wo mma baanu a wowoo wɔn wɔ Misraim asase soɔ ansa na mereba wo nkyɛn wɔ Misraim no, wɔnyɛ me dea. Efraim ne Manase nyɛ me dea te sɛ Ruben ne Simeon. 6Na wo mma a wobɛnya wɔn wɔ wɔn akyiri no na ɛnyɛ wo dea, na wɔde wɔn nuanom din bɛfrɛ wɔn wɔ wɔn agyapadeɛ mu.
7 Na me deɛ, mefiri Padan baeɛ no, Rahel wui m’anim wɔ Kanaan asase so wɔ kwan mu, na aka kwantiaa bi na wɔaduru Efrat, na mesiee no hɔ wɔ Efrat (a ɛne Betlehem) no kwan nkyɛn. 8Na Israel hunuu Yosef mma no, ɔkaa sɛ: Hwannom nie?
9 Na Yosef ka kyerɛɛ n’agya sɛ: Ɛyɛ me mma a Onyankopɔn de ama me wɔ ha yi. Ɛnna ɔse: Fa wɔn brɛ me ɛ ma menhyira wɔn. 10Na enyini nti, na Israel ani so ayɛ no kusukusu a ɔnhunu adeɛ yie. Na ɔde wɔn pinii ne nkyɛn; na ɔfee wɔn ano yɛɛ wɔn atuu. 11 Na Israel ka kyerɛɛ Yosef sɛ: Mansusu sɛ mɛhunu w’anim, na hwɛ, Onyankopɔn ama mahunu wo mma nso. 12Na Yosef yii wɔn firii Yakob nantam, na ɔponoo ne mu de n’anim butuu fam. 13Na Yosef faa wɔn baanu nyinaa de ne nifa sɔɔ Efraim mu de no kyerɛɛ Israel benkum, de ne benkum sɔɔ Manase mu de no kyerɛɛ Israel nifa, na ɔde wɔn pinii ne nkyɛn. 14Na Israel tenee ne nifa too Efraim a ɔyɛ akumaa no atifi, ne ne benkum too Manase atifi, ɔboapa na ɔyɛɛ ne nsa saa, ɛfiri sɛ Manase ne abakan. 15 Na ɔhyiraa Yosef sɛ:
Onyankopɔn a me nananom Abraham ne Isak nantee n’anim no,
Onyankopɔn a wayɛne me me nkwa nna nyinaa de abɛsi nnɛ.
16 Ɔbɔfoɔ a ɔyii me bɔne nyinaa mu no, nhyira mmɔfra yi,
na wɔmfa me din ne me nananom Abraham ne Isak din mfrɛ wɔn,
na wɔnnɔɔso nyɛ pii wɔ asase so.
17Na Yosef hunuu sɛ n’agya de ne nsa nifa ato Efraim atifi no, anyɛ no dɛ, na ɔsɔɔ n’agya nsa sɛ ɔnyi mfiri Efraim atifi nkɔto Manase atifi. 18Na Yosef ka kyerɛɛ n’agya sɛ: M’agya, ɛnyɛ sɛ ɛteɛ ne no, na oyi ne abakan, fa wo nifa to n’atifi. 19 Na n’agya ampene, na ɔse: Menim, me ba, menim; ɔno nso bɛyɛ ɔman, na ɔno nso ayɛ kɛse, nanso ne nua kumaa no bɛso asene no, na n’asefoɔ bɛyɛ aman pii. 20 Na ɛda no ɔhyiraa wɔn sɛ:
Wo na Israel de wo bɛhyira sɛ:
Onyankopɔn nyɛ wo sɛ Efraim ne Manase.
Na ɔde Efraim dii Manase kan. 21Na Israel ka kyerɛɛ Yosef sɛ: Hwɛ, merewu, na Onyankopɔn bɛdi mo akyi, na ɔde mo asane akɔ mo nananom asase so. 22 Na me deɛ, mama wo asase kɛseɛ bi a ɛboro wo nuanom deɛ soɔ a mede me nkrantɛ ne me tadua megyee no Amorifoɔ nsam.",https://www.bible.com/bible/1861/GEN.48.ASW
GYENESIS 49,"Yakob hyira ne mma
1Na Yakob frɛɛ ne mma sɛ: Mommoaboa mo ano, na menka mo deɛ ɛbɛyɛ mo, nna a ɛdi akyire no mu.
2Yakob mma, monhyia na montie,
montie mo agya Israel!
3 Ruben, m’abakan ne wo;
m’ahoɔden ne me mmaninyɛ asefire.
Woboro so anidie mu, woboro so tumi mu.
4 Wohinhim sɛ nsuo, enti wo kandie bɛfiri wo nsa,
ɛfiri sɛ woforoo w’agya nnaeɛ.
Ɛno mu na woguu ɛho fi, — me mpa na woforoeɛ!
5Simeon ne Lewi yɛ anuanom.
Wɔn nkrantɛ yɛ aniɛden akodeɛ.
6 Me kra, nnkɔ wɔn agyina mu,
na m’animuonyam nkɔfra wɔn asafo mu.
Ɛfiri sɛ wɔn abufuo mu na wɔkum nnipa,
na wɔn ahokyerɛ mu na wɔsɛee anantwie.
7 Wɔadome wɔn abufuo, sɛ ɛso,
ne wɔn anibereɛ, sɛ emu yɛ den.
Mɛkyekyɛ wɔn mu wɔ Yakob mu,
na mabɔ wɔn ahwete Israel mu.
8 Yuda, wo na wo nuanom bɛyi wo ayɛ;
wo nsa bɛtia w’atamfo kɔn so;
w’agya mma bɛkoto w’anim.
9 Gyata ba ne Yuda;
hanam so na wode anyini, me ba.
Ɔkotoe, ɔbutuu sɛ gyata ne gyatabereɛ;
hwan na ɔbɛhwanyan no?
10 Ahempoma remfiri Yuda nsa,
na mmarahyɛ poma remfiri ne nan ntam
de kɔsi sɛ ɛsodifoɔ
a aman bɛyɛ setie ama no no bɛba.
11 Ɔsa n’afunumu ba wɔ bobe mu,
ne n’afunumu bereɛ ba wɔ bobe pa mu.
Ɔsi n’atadeɛ wɔ nsa mu,
ne ne ntoma wɔ bobe aba mogya mu.
12Bobesa bɛma n’ani ayɛ kɔɔ,
na nufosuo ama ne se ayɛ fitaa.
13 Sebulon tenabea bɛkyerɛ mpoano,
na wahwɛ deɛ ahyɛn gyinagyina,
na ɔne Sidon abɔ hyeɛ.
14Isakar yɛ afunumu hoɔdenfoɔ,
ɔbutu mmoaban ntam;
15na ɔhunu sɛ homebea no yɛ
ne asase no sɛ ɛyɛ fɛ,
na ɔbrɛ ne mmatiri ase de gye adesoa,
na ɔde ɛsom adwuma ayi toɔ.
16 Dan bɛbu ne nkurɔfoɔ atɛn
sɛ Israel mmusuakuo mu biara.
17Dan bɛyɛ ɔkwan so ɔwɔ,
tempɔn so ahuritia.
Ɔka ɔpɔnkɔ nantin,
na ne so tenafoɔ ahwe n’akyi.
18 AWURADE, wo nkwagyeɛ na mehwɛ no kwan.
19Gad, asafo bi retoa no,
na ɔno nso atoa wɔn aka wɔn nantin.
20 Aser aduane bɛyɛ sradeduane,
na ɔbɛma ahennuane a ɛyɛ akɔnnɔ.
21 Naftali yɛ ɔforoteɛ a wɔato no sraha;
ɔka nsɛm dɛdɛ.
22 Yosef yɛ dua a ɛso aba mman,
dua a ɛso aba wɔ nsuo aniwa soɔ mman;
ne mman tratra ɔfasuo.
23Mmɛmmatofoɔ hyɛɛ no yea,
wɔtotoo no, na wɔtaa no.
24Nanso na ne tadua kura no pintinn,
na ne basa mu yɛɛ den.
Ɛfiri Yakob Tumfoɔ no nsam,
ɛfiri ɔhwɛfoɔ a ɔyɛ Israel botan no mu.
25Ɛfiri w’agya Nyankopɔn, ɔmmoa wo,
na ɛfiri Tweaduampɔn hɔ, ɔnhyira wo.
Ɔmfa ɔsorosoro nhyira,
ne ebunu a ɛtrɛtrɛ aseɛ mu nhyira, ne nufoɔ
ne yafunu mu nhyira nhyira wo.
26 W’agya nhyira a
ɛyɛ kɛseɛ boro daa daa mmepɔ no nhyira
a ɛkɔduru tete nteredee nkokoɔ no ahyeɛso nohoa;
ɛmmra Yosef atifi,
deɛ wɔyii no firii ne nuanom mu no mpampam.
27 Benyamin yɛ pataku a ɔtete mmoa mu;
ɔdi hanam anɔpa,
na anwummerɛ nso ɔkyɛ asadeɛ mu.
28Yeinom nyinaa ne Israel mmusuakuo dummienu no, na yei ne deɛ wɔn agya ka kyerɛɛ wɔn de hyiraa wɔn. Sɛdeɛ wɔn nhyira teɛ mmaako mmaako na ɔhyiraa wɔn.
Yakob wuo ne ne sie
29 Na ɔhyɛɛ wɔn ka kyerɛɛ wɔn sɛ: Aka kumaa bi na maka m’ani agu so. Monkɔsie me me nananom nkyɛn, wɔ ɔbodan a ɛwɔ Hetini Efron afuo mu no mu, 30ɔbodan a ɛwɔ Makpela afuo soɔ Mamre ntentensoɔ wɔ Kanaan asase so, asase a Abraham tɔeɛ wɔ Hetini Efron nkyɛn de yɛɛ amusieeɛ no mu. 31 Ɛhɔ na wɔsiee Abraham ne ne yere Sara, ɛhɔ na wɔsiee Isak ne ne yere Rebeka, na ɛhɔ na mesiee Lea. 32Afuo no ne ɔbodan a ɛwɔ mu no, wɔtɔɔ no Het mma nsam.
33Na Yakob hyɛɛ ne mma nsamanseɛ wieeɛ no, ɔboaa ne nan ano guu mpa no so, na ɔguu n’ahome a ɛdi akyire, na ɔtii ne nananom wɔ asamando.",https://www.bible.com/bible/1861/GEN.49.ASW
GYENESIS 50,"1 Na Yosef de n’anim kɔbutuu n’agya anim, na ɔsu guu ne so, na ɔfee n’ano. 2Na Yosef hyɛɛ ne nkoa a wɔhyɛ amu aduro sɛ wɔnhyɛ n’agya mu aduro. Na wɔhyɛɛ Israel mu aduro. 3Na wɔdii ho adaduanan, nna a wɔde wie adurohyɛ no ne no. Na Misraimfoɔ suu no adaduɔson.
4Na nna a wɔde suu no no twaa mu no, Yosef ka kyerɛɛ Farao fiefoɔ sɛ: Sɛ manya adom wɔ mo anim a, monkɔyi Farao asotire sɛ: 5 M’agya maa mekaa no ntam sɛ: Hwɛ, merewu, na ɛda a mabɔ no Kanaan asase so mafa no mu, ɛhɔ na kɔsie me. Enti afei ma menkɔ menkɔsie m’agya, na mensane memmra. 6Na Farao kaa sɛ: Kɔ, na kɔsie w’agya, sɛdeɛ ɔmaa wokaa ntam no.
7Na Yosef kɔɔ sɛ ɔrekɔsie n’agya; na Farao nkoa nyinaa, ne fie mpanimfoɔ ne Misraim asase so mpanimfoɔ nyinaa 8ne Yosef fiefoɔ nyinaa ne ne nuanom ne n’agya fiefoɔ kaa ne ho kɔe, gye wɔn mma ne wɔn nnwan ne wɔn anantwie na wɔgyaa wɔn Gosen asase no soɔ. 9Na nteaseɛnam ne apɔnkɔsotefoɔ ne no kɔe; na ɛyɛ dɔm kɛseɛ. 10Na wɔduruu Atad ayuporebea a ɛwɔ Yordan agya nohoa no, wɔtwaa kwadwom kɛseɛ a emu yɛ den wɔ hɔ, na ɔgyam n’agya nnanson. 11Na ɛhɔfoɔ, Kanaanfoɔ no, hunuu esu a wɔsuu no Atad ayuporebea hɔ no, wɔkaa sɛ: Yei deɛ, Misraimfoɔ ayie a emu yɛ den nie. Enti wɔfrɛ hɔ sɛ Abel-misraim ɛwɔ Yordan agya nohoa. 12 Na ne mma yɛɛ no sɛdeɛ ɔhyɛɛ wɔn no. 13 Na ne mma soaa no kɔɔ Kanaan asase so kɔsiee no wɔ Makpela afuo so ɔbodan a ɛwɔ Mamre ntentensoɔ a Abraham tɔɔ ɛne afuo no wɔ Hetini Efron nkyɛn de yɛɛ asieeɛ no mu. 14Na Yosef siee n’agya wieeɛ no, ɔne ne nuanom ne wɔn a wɔne no kɔsiee n’agya no nyinaa sane baa Misraim.
Yosef ma ne nuanom awerɛhyɛmu
15Na Yosef nuanom hunuu sɛ wɔn agya awuo no, wɔkaa sɛ: Ebia Yosef bɛtane yɛn, na watua yɛn bɔne a yɛyɛɛ no nyinaa so ka. 16Na wɔmaa wɔkɔka kyerɛɛ Yosef sɛ: W’agya hyɛe ansa na ɔrewuo sɛ: 17Monka nkyerɛ Yosef sɛ: Mesrɛ wo, fa wo nuanom amumuyɛ ne wɔn bɔne kyɛ wɔn, ɛfiri sɛ wɔayɛ wo bɔne. Na afei yɛsrɛ wo, fa w’agya Nyankopɔn nkoa amumuyɛ no kyɛ wɔn. Na wɔkaa saa kyerɛɛ Yosef no, ɔsui. 18Na ne nuanom nso ba bɛtwa hwee n’anim kaa sɛ: Hwɛ, yɛyɛ wo nkoa. 19Na Yosef ka kyerɛɛ wɔn sɛ: Monnsuro, na megyina Nyankopɔn ananmu anaa? 20 Na mo deɛ modwenee me ho bɔne nanso Onyankopɔn deɛ, na ɔde rebɛyɛ papa. Sɛ ɔbɛyɛ deɛ ada adi nnɛ yi, na ɔbɛgye nnipa pii nkwa. 21Na afei monnsuro; na mɛhwɛ mo ne mo mma. Na ɔkyekyeree wɔn werɛ kaa wɔn akoma too wɔn yam.
Yosef wuo
22Na Yosef ne n’agya fiefoɔ tenaa Misraim, na Yosef dii mfirinhyia ɔha ne du.
23 Na Yosef hunuu Efraim mmanana. Manase ba Makir mma nso, wɔwoo wɔn guu Yosef srɛ so.
24 Na Yosef ka kyerɛɛ ne nuanom sɛ: Merebɛti nananom wɔ asamando, na Onyankopɔn bɛba abɛhwɛ mo ampa, na wabɛyi mo afiri asase yi so akɔ asase a ɔkaa ho ntam kyerɛɛ Abraham ne Isak ne Yakob no so.
25 Na Yosef maa Israel mma kaa ntam na ɔkaa sɛ: Ampa ara, Onyankopɔn bɛba abɛhwɛ mo, na monsoa me nnompe mfiri ha nkɔ. 26Na Yosef wui, berɛ a na wadi mfirinhyia ɔha ne du. Na wɔhyɛɛ ne mu aduro, na wɔde no too adaka mu wɔ Misraim.",https://www.bible.com/bible/1861/GEN.50.ASW
EKSODƆS NHYƐNMU,"NHYƐNMU
Nwoma no din “Eksodɔs” no asekyerɛ ne “Otukorɔ”. Nwoma yi ka Israelfoɔ abakɔsɛm mu adeɛ titire bi a ɛsiiɛ ho asɛm. Ɛne sɛ, Israelfoɔ tu firii Misraim asase so, nkoasom mu.
Wɔtumi kyɛ nwoma yi mu mmiɛnsa:
1. Wɔgyee Hebrifoɔ firii nkoasom mu maa wɔtuu kwan firii Misraim kɔɔ Sinai bepɔ ho;
2. Onyankopɔn apam a ɔne ne man pameeɛ wɔ Sinai Bepɔ ho no. Apam yi fa abrabɔ, amanyɛ ne Onyamesom mmara a ɛsɛ sɛ wɔdi soɔ ho.
3. Wɔsii ɛdan siesiee mu sɛ Israelfoɔ no nsom wɔ mu, na wɔhyehyɛɛ mmara maa asɔfodie ne sɛdeɛ wɔsom Onyankopɔn fa.
Ne korakora ne sɛ, nwoma no ka deɛ Onyankopɔn yɛeɛ, sɛ ɔgyee ne man a wɔde wɔn ayɛ nkoa ne mfenaa na ɔyɛɛ wɔn ɔman a wɔanya anidasoɔ.
Onipa titire a nwoma no ka ne ho asɛm ne Mose. Ɔno na Onyankopɔn yii no sɛ ɔnni ne man no anim nyi wɔn mfiri Misraim. Nwoma no fa bi a wɔnim no yie papaapa ne Mmara Nsɛm Du a ɛwɔ Ti 20 mu no.
EMU NSƐM
Wɔgyee Israelfoɔ firii Misraim nsamu 1.1—15.21
1. Wɔyɛɛ wɔn nkoa wɔ Misraim 1.1-22
2. Mose awoɔ ne ne mmɔfraase ho nsɛm 2.1—4.31
3. Mose ne Aaron kɔhyiaa Misraimhene 5.1—11.10
4. Twam afahyɛ ne firi a Israelfoɔ firii Misraim 12.1—15.21
Wɔfirii Mmɛwa Po no ho kɔɔ Sinai Bepɔ ho 15.22—18.27
Mmara no ne apam no 19.1—24.18
Ntomadan no ne ɔsom ho nhyehyɛɛ 25.1—40.38",https://www.bible.com/bible/1861/EXO.INTRO1.ASW
EKSODƆS 1,"Israelfoɔ amanehunu wɔ Misraim
1 Na yeinom ne Israel mma a wɔne Yakob baa Misraim no din. Wɔn mu biara ne ne fiefoɔ na ɛbaeɛ. 2Ruben, Simeon, Lewi, Yuda, 3Isakar, Sebulon, Benyamin, 4Dan, Naftali, Gad ne Aser. 5 Na nnipa a wɔfiri Yakob asene mu nyinaa yɛ aduɔson. Na Yosef wɔ Misraim dada.
6 Na Yosef ne ne nuanom nyinaa ne wɔn berɛ sofoɔ no nyinaa wuwui. 7 Na Israel mma no wowoe, na wɔdɔree bebree, na wɔn ase kyenee, na wɔn ho yɛɛ den papaapa; na wɔyɛɛ asase no so ma. 8Na ɔhene foforɔ bi sɔree Misraim a na ɔnnim Yosef. 9Na ɔka kyerɛɛ ne man sɛ: Hwɛ, Israelfoɔ no dɔɔso, na wɔn ho yɛ den sene yɛn. 10Momma yɛmfa nyansa kwan bi so ne wɔn nni, na wɔannɔɔso, na sɛ ɛsa bi ba a, wɔankɔka yɛn atamfoɔ ho ne yɛn ammɛko, na wɔansɔre asase yi so ankɔ. 11 Na wɔsisii wɔn so adwumayɛfoɔ so mpanimfoɔ sɛ wɔmfa nnesoadeɛ a emu yɛ duro nhyɛ wɔn so. Na wɔkyekyeree adekora nkuro Pitom ne Raamses maa Farao. 12Nanso dodoɔ a wɔhyɛɛ wɔn soɔ no, dodoɔ no ara na wɔdɔreeɛ, na wɔtrɛe. Na Misraimfoɔ suroo Israelfoɔ no. 13Na wɔde nyadie yaya dii Israelfoɔ. 14Wɔmaa wɔn asetena fonoo wɔn wɔ dɔteɛ ne ntaayaa ho adwuma a ɛyɛ den ne afuom adwumayɛ ahodoɔ ne nnwuma ahodoɔ nyinaa mu nyadie yaya a wɔde dii wɔn mu.
15Na Misraimhene ka kyerɛɛ Hebrifoɔ awogyefoɔ a wɔn mu baako din de Sifra, na ɔbaako din de Pua no sɛ: 16Sɛ mokɔgye Hebrifoɔ mmaa awoɔ, na awoeɛ hɔ mohunu sɛ ɔyɛ ɔbarima a, monku no; na sɛ ɔyɛ ɔbaa deɛ a, momma no ntena ase. 17Na awogyefoɔ no suro Onyankopɔn, enti wɔanyɛ sɛdeɛ Misraimhene ka kyerɛɛ wɔn no, na mmom wɔgyee mmabanin no nkwa. 18Na Misraimhene frɛɛ awogyefoɔ no bisaa wɔn sɛ: Adɛn nti na moyɛ saa, na momma mmarima no tena aseɛ? 19Na awogyefoɔ no buaa Farao sɛ: Hebrifoɔ mmaa nte sɛ Misraimfoɔ mmaa, ɛfiri sɛ wɔn deɛ, wɔyɛ pirimpirim; awogyefoɔ no nnya nnuruu wɔn nkyɛn no, na wɔawo dada. 20Enti Onyankopɔn ne awogyefoɔ no dii no yie. Na nkurɔfoɔ no dɔɔso ara, na wɔyɛɛ den yie. 21Na ɛsiane sɛ awogyefoɔ no suro Onyankopɔn nti, ɔmaa wɔn afie mu yɛɛ yie.
22Ɛnna Farao hyɛɛ ne man nyinaa sɛ: Ɔbabanin biara a wɔbɛwo no no, monkɔto no ntwene asubɔnten no mu, na mmammaa nyinaa deɛ, momma wɔntena ase.",https://www.bible.com/bible/1861/EXO.1.ASW
EKSODƆS 2,"Mose awoɔ
1 Na ɔbarima bi a ɔfiri Lewi fie kɔwaree Lewi babaa bi. 2 Na ɔbaa no nyinsɛnee, na ɔwoo ɔbabanin; na ɔhunuu sɛ ne ho yɛ fɛ no, ɔde no siee abosome mmiɛnsa.
3Na ɔntumi nkora no bio no, ɔfaa mmɛwa adaka bi de ama ne ɛhyɛ sraa ho, na ɔde abɔfra no too mu, na ɔde kɔsii wira mu wɔ asuo no ano. 4 Na ne nuabaa kɔgyinaa akyirikyiri sɛ ɔrehwɛ deɛ ɛbɛyɛ no.
5Na Farao babaa siane baa asuo no ano adwareɛ, na ne mmaawa repasa asuo no nsunoa. Berɛ a Farao babaa hunuu adaka no wɔ wira no mu no, ɔsomaa n’abaawa sɛ ɔnkɔfa mmra. 6Na ɔbuee soɔ no, ɔhunuu akɔkoaa no, na hwɛ, na ɔyɛ abarimaa a ɔresu. Na ɔyɛɛ no mmɔbɔ, na ɔse: Hebrifoɔ mma no bi nie. 7Ɛnna ne nuabaa no ka kyerɛɛ Farao babaa no sɛ: Menkɔ menkɔfrɛ Hebrifoɔ mmaa no mu nufomafoɔ bi memmrɛ wo, na ɔmmɛma akɔkoaa no nufoɔ mma wo anaa? 8Na Farao babaa no ka kyerɛɛ no sɛ: Kɔ! Na ababaa no kɔ kɔfrɛɛ abɔfra no na bae. 9Na Farao babaa no ka kyerɛɛ no sɛ: Fa abɔfra yi kɔ kɔma no nufoɔ ma me, na mɛtua wo ka. Na ɔbaa no faa abɔfra no kɔmaa no nufoɔ. 10Na abɔfra no nyinii, na ɔde no kɔmaa Farao babaa no, na ɔdanee ne ba. Na ɔtoo no din Mose, ɛfiri sɛ ɔse: Nsuo mu na meyii no firiiɛ.
Mose dwane kɔ Midian
11 Na Mose nyiniiɛ no, da bi ɔfirii adi kɔɔ ne nuanom nkyɛn sɛ ɔrekɔhwɛ wɔn adwumayɛ no; na ɔhunuu sɛ Misraimni bi reboro ne nuanom mu bi a ɔyɛ Hebrini. 12 Na ɔhwɛɛ ha ne ha, na ɔhunuu sɛ obiara nni hɔ no, ɔbɔɔ Misraimni no kumm no, na ɔde no siee anwea mu. 13Na adeɛ kyeeɛ no, ɔfirii adi, na hwɛ, na Hebrifoɔ baanu reko. Na ɔbisaa deɛ ɔdi fɔ no sɛ: Adɛn nti na woboro wo yɔnko? 14 Na ɔbuaa sɛ: Hwan na ɔde wo sii yɛn so otitire ne osennifoɔ? Wopɛ sɛ woku me sɛdeɛ wokum Misraimni no anaa? Na Mose suroe, na ɔse: Ampa ara, asɛm no apue!
15 Na Farao tee asɛm yi no, anka ɔrehwehwɛ Mose aku no, nanso Mose dwane firii n’anim kɔtenaa Midian asase so wɔ subura bi ho. 16 Nso na Midian sɔfoɔ wɔ mmammaa baason; na wɔba bɛtoo nsuo de hyehyɛɛ adaaseɛ no amaama sɛ wɔrema wɔn agya nnwan anom. 17 Na nnwanhwɛfoɔ bi ba bɛpamm wɔn; na Mose sɔre boaa wɔn, na ɔmaa wɔn nnwan no nomee. 18Na wɔbaa wɔn agya Reuel nkyɛn no, ɔbisaa wɔn sɛ: Ɛyɛɛ dɛn na ɛnnɛ deɛ, moaba ntɛm seyie? 19Na wɔbuaa sɛ: Misraimni bi na ɔgyee yɛn firii nnwanhwɛfoɔ no nsam, na ɔtoo nsuo mpo maa yɛn, na ɔmaa nnwan no nomee. 20Na ɔbisaa ne mmammaa no sɛ: Na ɔwɔ he? Adɛn nti na mogyaa ɔbarima no hɔ? Monkɔfrɛ no na ɔmmɛdidi.
21Na Mose penee sɛ ɔne Midian sɔfoɔ no bɛtena. Na ɔde ne babaa Sipora maa Mose awareɛ.
22 Na ɔwoo ɔbabanin, na Mose too no din Gersom, ɛfiri sɛ ɔse: Mayɛ hɔhoɔ wɔ ananafoɔ asase so.
23 Na nna dodoɔ yi akyiri no, ɛbaa sɛ Misraimhene wui. Na nkoasom no nti Israelfoɔ no sii apini, na wɔsu frɛe, na wɔn sufrɛ no kɔduruu Nyankopɔn anim. 24 Na Onyankopɔn tee wɔn apinisie no, ɔkaee n’apam a ɔne Abraham ne Isak ne Yakob pameeɛ no. 25Na Onyankopɔn hwɛɛ Israelfoɔ no, ɔhunuu wɔn tebea a wɔwɔ mu no.",https://www.bible.com/bible/1861/EXO.2.ASW
