Title,Content,URL
NUMERI 11,"Mana fono ɔman no
1 Na ɔman no yɛɛ sɛdeɛ wɔrenwiiwii wɔn amaneɛ ho, AWURADE aso mu; na AWURADE teeɛ no, ne bo hurui, na AWURADE gya bɛsɔɔ wɔn mu hyee nsraban no ano ano. 2Na ɔman no su frɛɛ Mose, na Mose paa AWURADE kyɛw, na ogya no dumii. 3Na ɔfrɛɛ hɔ Tabera, ɛfiri sɛ AWURADE gya dɛree wɔ wɔn mu.
4 Na afrafrafoɔ a wɔwɔ wɔn mu no kɔn dɔɔ adeɛ, na Israelfoɔ no nso sane suu bio sɛ: Hwan na ɔbɛma yɛn nam adie? 5Yɛakae nsunam a yɛdii no Misraim kwa ne ɛferɛ, anamuna, fan, gyeene ne aanwo no. 6Afei yɛn kra akusa, na biribiara nni hɔ sɛ mana a ɛtua yɛn aniwa mu yi nko.
7 Na mana no te sɛ wisa aba, na ɛho te sɛ bedola hyɛ ho. 8Ɔman no nenam tasetasee, na wɔyam no ayuyammoɔ so anaasɛ wɔsi no nwaduro mu na wɔnoa no ɛsɛn mu, na wɔyɛ no taterɛ, na ne dɛ te sɛ ngo taterɛ dɛ. 9Na sɛ bosuo tɔ nsraban no so anadwo a, mana no nso tɔ gu so.
10Na Mose tee sɛ ɔman no resu, wɔn mmusua mu, wɔn ntomadan ano ano; na AWURADE bo huruu no sɛ, na ɛyɛɛ Mose nso ahomete. 11Na Mose ka kyerɛɛ AWURADE sɛ: Adɛn nti na wo ne w’akoa adi no bɔne, na adɛn nti na mannya w’anim animuonyam sɛ wode ɔman yi nyinaa adesoa ato me soɔ yi? 12Me na menyinsɛnee ɔman yi nyinaa anaasɛ me na mewoo wɔn, na wose me sɛ: Turu wɔn wo koko so, sɛdeɛ ɔbayɛnfoɔ turu n’akɔkoaa, fa kɔ asase a wokaa ho ntam kyerɛɛ wɔn nananom no so? 13Ɛhe na mɛnya nam mama ɔman yi nyinaa sɛ wɔsu gu me so sɛ: Ma yɛn nam na yɛnni yi? 14Me nko ara mentumi menkura ɔman yi nyinaa ɛfiri sɛ wɔyɛ duru ma me. 15 Na sɛ saa na wo ne me bɛdi no a, ɛnneɛ sɛ m’anim aba nyam w’anim a, kum mmom na ku me, na manhunu m’amaneɛ no.
16 Ɛnna AWURADE ka kyerɛɛ Mose sɛ: Boaboa Israel mpanimfoɔ mu mmarima aduɔson ano ma me, nnipa a wonim wɔn sɛ wɔyɛ ɔman no mpanimfoɔ ne wɔn atwerɛfoɔ, na fa wɔn bra ahyiaeɛ ntomadan no ho, na wɔne wo mmɛgyina hɔ. 17Na mɛsiane na me ne wo abɛkasa, na mede honhom a ɛwɔ wo soɔ no bi magu wɔn so na wɔne wo asɔ ɔman no adesoa no mu, na wo nko woankura. 18 Na ka kyerɛ ɔman no sɛ: Monyɛ mo ho kronkron nsie ɔkyena, na mobɛdi nam, ɛfiri sɛ moakɔsu agu AWURADE aso mu sɛ: Hwan na ɔbɛma yɛn nam adie? Anka na ɛyɛ ma yɛn wɔ Misraim. Enti AWURADE bɛma mo nam adi: 19Ɛnyɛ da koro nko na mobɛdie, na ɛnyɛ nnanu, na ɛnyɛ nnanum, na ɛnyɛ dadu, na ɛnyɛ adaduonu nko, 20na mmom ɛbɛkɔ akɔsi bosome, akɔsi sɛ ɛbɛfifiri mo hwene mu na afono mo, ɛsiane sɛ moapo AWURADE a ɔwɔ mo mu no, na moasu n’anim aka sɛ: Adɛn nti na yɛfirii Misraim baeɛ yi? 21Na Mose kaa sɛ: Ɔman a mewɔ wɔn mu yi ano si mmarima anammɔnmufoɔ mpem ahansia, na wo deɛ, wose: Mɛma wɔn nam adi bosome? 22 Wɔbɛkunkum nnwan ne anantwie ama wɔn na aso wɔn? Anaasɛ wɔbɛboa ɛpo mu mpataa nyinaa ano ama wɔn na aso wɔn? 23 Na AWURADE ka kyerɛɛ Mose sɛ: Wɔatwa AWURADE nsa so? Afei wobɛhunu sɛ m’asɛm bɛba mu ama wo anaasɛ ɛremma mu.
24Na Mose firii adi kɔkaa AWURADE asɛm no kyerɛɛ ɔman no, na ɔboaa ɔman no mpanimfoɔ mu mmarima aduɔson ano, na ɔde wɔn bɛgyinaa ntomadan no ho hyiae. 25Na AWURADE sianee mununkum no mu na ɔkasa kyerɛɛ no, na ɔde ne honhom a ɛwɔ ne soɔ no bi guu mpanimfoɔ aduɔson no so; na honhom no sisii wɔn soɔ no, wɔkaa adiyisɛm berɛ tiaa bi mu, nanso akyire yi no wɔansane anyɛ bio.
26Na mmarima baanu kaa nsraban no mu, ɔbaako din de Eldad na ɔbaako no de Medad; na honhom no baa wɔn so, na wɔfra nnipa a wɔtwerɛɛ wɔn din no mu, nanso na wɔmfirii adi nkɔɔ ntomadan no ho; enti wɔkaa adiyisɛm nsraban no mu. 27Na aberanteɛ bi tutuu mmirika bɛka kyerɛɛ Mose sɛ: Eldad ne Medad reka adiyisɛm nsraban no mu. 28 Na Nun ba Yosua, Mose somfoɔ a ɔyɛ ne mmeranteɛ no mu baako no gyee so sɛ: Me wura Mose, bara wɔn! 29 Na Mose ka kyerɛɛ no sɛ: Woretwe me ho ninkunu? Ɛkaa me nko a, anka AWURADE man nyinaa adanedane adiyifoɔ, na AWURADE de ne honhom agu wɔn so. 30Na Mose ne Israel mpanimfoɔ no sane baa nsraban no mu.
31 Na mframa firi AWURADE nkyɛn bɔe, na ɛkɔpraa mmoko firi ɛpo no ho bɛguu nsraban no so, ɛbɛyɛ da koro kwan wɔ ɔfa ha ne da koro kwan wɔ ɔfa ha, nsraban no ho, wɔn sorokorɔ ne asase ani bɛyɛ sɛ basafa baako. 32Na ɔman no sɔree da mu no nyinaa ne anadwo no nyinaa ne adekyeeɛ nyinaa, na wɔkɔboaboaa mmoko no ano; deɛ ɔnyaa deɛ ɛsua koraa no mpo boaa homer du ano, na wɔhatahatae ara de twaa nsraban no ho hyia fae. 33Na ɛnam no da so wɔ wɔn se mu a wɔnnya nwesaeɛ no, AWURADE bo huru tiaa ɔman no, na AWURADE de ɔhaw kɛseɛ pa ara bobɔɔ ɔman no. 34 Na wɔfrɛɛ hɔ sɛ: Kibrot-hataawa, ɛfiri sɛ ɛhɔ na wɔsiee ɔman a adeɛ yɛɛ wɔn akɔnnɔ no. 35Na ɔman no tu firii Kibrot-hataawa kɔɔ Haserot, na wɔtenaa Haserot.",https://www.bible.com/bible/1861/NUM.11.ASW
NUMERI 12,"Miriam ne Aaron kasa tia Mose
1 Na Miriam ne Aaron kasa tiaa Mose sɛ ɔwaree Kusni baa, ɛfiri sɛ na waware Kusni baa bi. 2Na wɔkaa sɛ: Mose nko so na AWURADE nam kasa, na ɔmfa yɛn so nso nkasa a? Na AWURADE tee. 3Na ɔbarima Mose deɛ, na ɔdwo pii sene nnipa a wɔwɔ asase soɔ nyinaa. 4Ɛnna AWURADE ka kyerɛɛ Mose ne Aaron ne Miriam mpofirim sɛ: Mo baasa momfiri adi mmra ahyiaeɛ ntomadan no ho. 5 Na wɔn baasa no firii adi. Na AWURADE sianee mununkum dum mu bɛgyinaa ntomadan no ano, na ɔfrɛɛ Aaron ne Miriam; na wɔn baanu firii adi. 6Na ɔkaa sɛ: Montie me nsɛm ɛ. Sɛ AWURADE diyifoɔ bi wɔ mo mu a, adehunu mu na mema no hu me, daeɛ mu na mekasa mekyerɛ no: 7 Na ɛnte sɛ m’akoa Mose; ɔno na mede me fie nyinaa ahyɛ ne nsa. 8 Ano ne ano na me ne no de kasa ehunu mu, na ɛnyɛ mmebuo mu, na ɔhunu AWURADE suban. Na adɛn nti na moansuro sɛ mobɛkasa atia m’akoa Mose? 9Na AWURADE bo fuu wɔn, na ɔsii mu kɔe.
10 Na mununkum no firii ntomadan no soɔ, na hwɛ, Miriam ayare kwata sɛ sukyerɛmma. Na Aaron danee ne ho hwɛɛ Miriam no, hwɛ, na wayare kwata. 11Na Aaron ka kyerɛɛ Mose sɛ: Wo kyɛw nie, me wura. Mfa bɔne a yɛadi nkwaseasɛm ayɛ yi nto yɛn so. 12Mma no nnyɛ sɛ efunu a ɔfiri ne na yam baeɛ na ne honam fa asɛe dada. 13 Na Mose su frɛɛ AWURADE sɛ: O Onyankopɔn ee, mesrɛ wo, sa no yadeɛ ɛ! 14 Na AWURADE ka kyerɛɛ Mose sɛ: Na sɛ n’agya hinam n’ani so ntasuo kɛkɛ mpo a, anka n’ani renwu nnanson anaa? Wɔnto no mu nnanson nsraban no akyi, na ɛno akyiri ansa na wɔmfa no mmra mu bio. 15Na wɔtoo Miriam mu nsraban no akyi nnanson. Na ɔman no antu kɔsii sɛ wɔde Miriam baa mu bio. 16Na ɛno akyiri no, ɔman no tu firii Haserot, na wɔkɔkyeree nsraban Paran serɛ so.",https://www.bible.com/bible/1861/NUM.12.ASW
NUMERI 13,"Akwansrafoɔ no
1 Na AWURADE kasa kyerɛɛ Mose sɛ: 2Fa mmarima soma wɔn, na wɔnkɔsra Kanaan asase a mede merema Israelfoɔ no; monsoma ɔbarima baako mfiri wɔn nananom abusuakuo biara mu, na wɔn mu biara nyɛ wɔn mu mmapɔmma no bi. 3Na Mose nam AWURADE asɛm so somaa wɔn firii Paran serɛ so, wɔn nyinaa yɛ mmarima a wɔyɛ Israelfoɔ mu atitire. 4Na wɔn din nie: Ruben abusuakuo deɛ ne Sakur ba Samua; 5Simeon abusuakuo deɛ, Hori ba Safat; 6 Yuda abusuakuo deɛ, Yefune ba Kaleb; 7Isakar abusuakuo deɛ, Yosef ba Igal; 8 Efraim abusuakuo deɛ, Nun ba Hosea; 9Benyamin abusuakuo deɛ, Rafu ba Palti; 10Sebulon abusuakuo deɛ, Sodi ba Gadiel; 11Yosef abusuakuo, mekyerɛ Manase abusuakuo, Susi ba Gadi; 12Dan abusuakuo deɛ, Gemali ba Amiel; 13Aser abusuakuo deɛ, Mikael ba Setur; 14Naftali abusuakuo deɛ, Wofsi ba Nahibi; 15Gad abusuakuo deɛ, Maki ba Geuel; 16 yeinom ne mmarima a Mose soma maa wɔkɔsraa asase no din. Na Mose frɛɛ Nun ba Hosea sɛ Yosua.
17Na Mose somaa wɔn sɛ wɔnkɔsra Kanaan asase no, na ɔka kyerɛɛ wɔn sɛ: Monkɔfa Negeb ha yi na monkɔforo mmepɔ no. 18Na monkɔhwɛ asase no sɛdeɛ ɛteɛ ne aman a wɔtete soɔ no, sɛ wɔyɛ den anaasɛ wɔgo, wɔsua anaasɛ wɔdɔɔso, 19ne sɛdeɛ asase a wɔtete soɔ no teɛ, sɛ ɛyɛ asase pa anaa bɔne ne sɛdeɛ nkuro a wɔtete mu no teteɛ, sɛ nsraban mu anaa aban mu, 20ne sɛdeɛ asase no teɛ, sɛ emu yɛ fɔɔfɔɔ anaa pɛsɛɛ sɛ nnua wɔ so anaasɛ ebi nni so; na momfa akokoɔduro ntete asase no so aba bi mmra. Nso na saa berɛ no yɛ bobe aba a ɛdi kan berɛ.
21Na wɔsii mu kɔ kɔsraa asase no firi Sin serɛ so kɔsii Rehob, deɛ wɔnam kɔ Hamat no. 22Na wɔforo faa nifa fam, na wɔduruu Hebron deɛ Anak mma Ahiman, Sesai ne Talmai wɔ. (Na Hebron deɛ, wɔkyekyeree no mfeɛ nson ansa na wɔrekyekyere Soan a ɛwɔ Misraim.) 23Na wɔduruu Eskol bonhwa mu, na wɔtwaa obobe mman ne bobe esia baako wɔ soɔ wɔ hɔ; na nnipa baanu wuraa no dua, ne atoaa aba bi ne borɔdɔma. 24Ɛsiane sɛ Israelfoɔ no twaa bobe aba esia wɔ hɔ no nti, wɔfrɛ hɔ Eskol.
25Na adaduanan duruiɛ no, wɔsane firi asase no so nsra bae. 26Na wɔbaa Mose ne Aaron ne Israelfoɔ asafo no nyinaa nkyɛn Paran serɛ so wɔ Kades, na wɔbɔɔ wɔn kaseɛ kyerɛɛ wɔn ne asafo no nyinaa, na wɔde asase no so aba no kyerɛɛ wɔn. 27 Na wɔbɔɔ wɔn amanneɛ kyerɛɛ no sɛ: Yɛakɔ asase a wosomaa yɛn soɔ no so, na ɛsene nufosuo ne ɛwoɔ ampa, na ɛso aba nie. 28Nanso aman a wɔtete asase no soɔ no yɛ den, na nkuro no, wɔabɔ ho ban, ɛsoso sɛ, na yɛhunuu Anak mma nso wɔ hɔ. 29Amalek te Negeb asase so, na Hetifoɔ ne Yebusifoɔ ne Amorifoɔ tete bepɔ so, na Kanaanfoɔ tete mpoano ne Yordan ho.
30 Na Kaleb dwodwoo ɔman no maa Mose, na ɔkaa sɛ: Momma yɛnkɔ nkɔforo, na yɛnkɔfa asase no. Na tumi deɛ, yɛbɛtumi wɔn. 31Na mmarima a wɔne no kɔeɛ no kaa sɛ: Yɛrentumi nkɔforo ntia ɔman no, ɛfiri sɛ wɔyɛ den sene yɛn. 32Na wɔmaa asase a wɔkɔsraeɛ no ho atenka bɔne trɛɛ Israelfoɔ no mu sɛ: Asase a yɛfaa mu kɔsraeɛ no yɛ asase a ɛdi ɛsotefoɔ, na nkurɔfoɔ a yɛhunuu wɔn wɔ soɔ no nyinaa yɛ abrane ara nko; 33 na ɛhɔ na yɛhunuu abrane akɛseɛ no, (Anak mma a wɔfiri abrane akɛseɛ no mu no,) na yɛyɛɛ yɛn ara yɛn ani so sɛ mmɛbɛ, na saa nso na yɛyɛɛ wɔ wɔn ani soɔ.",https://www.bible.com/bible/1861/NUM.13.ASW
NUMERI 14,"Ɔman no nwiinwii
1 Ɛnna asafo mu no nyinaa memaa wɔn nne soɔ, na ɔman no suu anadwo no. 2 Na Israelfoɔ no nyinaa nwiinwii tiaa Mose ne Aaron, na asafo no nyinaa ka kyerɛɛ wɔn sɛ: Ɛkaa yɛn nko a, anka yɛwuwui wɔ Misraim asase so, anaa ɛserɛ so ha mpo. Ɛkaa yɛn nko a, anka yɛawuwu. 3 Na adɛn nti na AWURADE de yɛn reba asase yi so sɛ yɛmmɛtotɔ nkrantɛ ano, na wɔmfa yɛn yerenom ne yɛn mma nnommum? Ɛnyɛ yɛ na ɛyɛ ma yɛn sɛ yɛbɛsane akɔ Misraim bio?
4Na wɔsesee wɔn ho wɔn ho sɛ: Momma yɛnsi otitire na yɛnsane nkɔ Misraim. 5 Ɛnna Mose ne Aaron de wɔn anim butubutuu fam, Israelfoɔ asafo badwa no nyinaa anim.
6 Na Nun ba Yosua ne Yefune ba Kaleb a wɔfra asase no srafoɔ no mu no sunsuanee wɔn ntadeɛ mu, 7na wɔka kyerɛɛ Israelfoɔ asafo no nyinaa sɛ: Asase a yɛtwaa mu kɔsraeɛ no yɛ asase pa ara. 8 Sɛ yɛsɔ AWURADE ani a, ɔde yɛn bɛduru asase no so na ɔde ama yɛn, asase a nufosuo ne ɛwoɔ sene wɔ soɔ. 9AWURADE ani so atua ara nko na monnteɛ, na monnsuro asase no sofoɔ no, na wɔyɛ yɛn aduane; wɔn kataman afiri wɔn so, na yɛn deɛ, AWURADE di yɛn akyi, monnsuro wɔn. 10 Na asafo no nyinaa kaa sɛ wɔnsi Yosua ne Kaleb aboɔ.
Ɛnna AWURADE animuonyam puee ahyiaeɛ ntomadan no mu kyerɛɛ Israelfoɔ no nyinaa. 11Na AWURADE ka kyerɛɛ Mose sɛ: Ɔman yi bɛbu me animtia akɔsi da bɛn? Na ɛnkɔsi da bɛn na wɔrennye me nnie, nsɛnkyerɛnneɛ a mayɛ no wɔn mu no nyinaa akyi? 12 Mede owuyadeɛ mɛbobɔ wɔn na masɛe wɔn, na mede wo mayɛ ɔman kɛseɛ a ɛyɛ den sene wɔn.
13Na Mose ka kyerɛɛ AWURADE sɛ: Ɛno deɛ, Misraimfoɔ bɛte, ɛfiri sɛ wode wo tumi na ayi ɔman yi afiri wɔn mu; 14na wɔbɛka akyerɛ asase yi sofoɔ. Wɔate sɛ wo, AWURADE, wowɔ ɔman yi mu a woma wɔhu wo anim ne anim, AWURADE, na wo mununkum gyina wɔn so, na wo na wodi wɔn anim mununkum dum mu awia, ne ogya dum mu anadwo; 15na sɛ wokum ɔman yi sɛ onipa koro a, anka amanaman a wɔate wo nka no bɛka sɛ: 16 Ɛnam sɛ AWURADE antumi amfa ɔman yi ankɔ asase a ɔkaa wɔn ho ntam no soɔ nti, na waku wɔn ɛserɛ soɔ. 17Enti, mesrɛ wo, ma AWURADE tumi no nyɛ kɛseɛ, sɛdeɛ wokaa sɛ: 18 AWURADE yɛ abufuo mu nyaa na n’adɔeɛ so. Ɔde amumuyɛ ne mmrato kyɛ, na bem na ɔmmu deɛ ɔdi fɔ; na ɔtua nananom amumuyɛ so ka de fa mma so kɔsi awoɔ ntoatoasoɔ mmiɛnsa ne nnan so. 19Fa ɔman yi amumuyɛ kyɛ wɔn ɛ, sɛdeɛ w’adom kɛseɛ no teɛ ne sɛdeɛ wode akyɛ ɔman yi firi Misraim abɛduru ha yi no.
20Na AWURADE kaa sɛ: Mede akyɛ wɔn sɛdeɛ w’asɛm seɛ no, 21 nanso sɛ mete aseɛ na AWURADE animuonyam bɛhyɛ asase nyinaa ma yi, 22mmarima no a wɔhunuu m’animuonyam ne me nsɛnkyerɛnneɛ a meyɛɛ no Misraim ne ɛserɛ soɔ no a wɔasɔ me ahwɛ mprɛdu nie na wɔantie me nne no nyinaa, 23 ampa ara, wɔrenhunu asase a mekaa ho ntam mekyerɛɛ wɔn nananom no, na wɔn a wɔate me atua no mu biara renhunu. 24 Na m’akoa Kaleb deɛ, sɛ honhom a ɛso wɔ ne mu na wadi m’akyi awie nti, mede no bɛduru asase a ɔkɔɔ soɔ no so, na n’asefoɔ adi so. 25Na Amalekfoɔ ne Kanaanfoɔ no te bonhwa no mu, ɔkyena monnane mo ho ntu nkɔ ɛserɛ so, Mmɛwa Po kwan so.
Anwiinwiifoɔ no asotwe
26Na AWURADE kasa kyerɛɛ Mose ne Aaron sɛ: 27Mentɔ me bo ase memma asafo bɔne yi a wɔnwiinwii tia me no nkɔsi da bɛn? Israelfoɔ anwiinwii a wɔnwiinwii tia me no, mate. 28Ka kyerɛ wɔn sɛ: Me ara sɛ mete aseɛ yi, AWURADE na ɔseɛ, sɛdeɛ moakasa agu m’aso mu no, saa ara na mɛyɛ mo: 29Ɛserɛ yi so ara na mo afunu bɛdeda; mo mu nnipa a wɔkan wɔn sɛdeɛ mo nyinaa ano sie firi wɔn a wɔadi mfeɛ aduonu de rekorɔ, mo a monwiinwii tiaa me no, 30morennuru asase a memaa me nsa so mekyerɛɛ sɛ mede mo bɛtena soɔ no so, gye Yefune ba Kaleb ne Nun ba Yosua. 31Na mo mma a moka sɛ wɔbɛfa wɔn nnommum no, wɔn na mede wɔn bɛkɔ soɔ, na wɔahunu asase a moto ho pe no. 32Na mo deɛ, mo afunu bɛdeda ɛserɛ yi so, 33na mo mma ayɛ mmoahwɛfoɔ, ɛserɛ so, mfirinhyia aduanan, na wɔasoa mo adwamammɔ akɔsi sɛ mo afunu bɛwie sa ɛserɛ soɔ. 34 Nna a mode kɔsraa asase no dodoɔ a ɛsi adaduanan no mu na monsoa mo amumuyɛ no mfirinhyia aduanan, da koro da koro nyɛ afe afe, na moahunu me poɔ a mapo mo no. 35Me, AWURADE, na maka: Ampa ara, yei na mede bɛyɛ asafo bɔne a wɔayɛ dɔm atia me yi nyinaa. Ɛserɛ yi so ara na wɔbɛsa, na wɔawuwu wɔ hɔ.
36 Na mmarima a Mose soma maa wɔkɔsraa asase no a wɔsane baeɛ na wɔmaa asafo no nyinaa nwiinwii tiaa no sɛ wɔmaa asase no ho atenka bɔne tenneeɛ no, 37mmarima a wɔmaa asase no ho atenka bɔne tenneeɛ no wuwuu atɔfoɔ wuo AWURADE anim, 38 gye Nun ba Yosua ne Yefune ba Kaleb a wɔfra mmarima a wɔkɔsraa asase no mu no nko.
Wɔn a wɔantie Nyankopɔn asɛm no asotwe
39Na Mose kaa nsɛm yi nyinaa kyerɛɛ Israelfoɔ no nyinaa; na ɔman no dii abooboo pii. 40 Na wɔtuaa nhema foro kɔɔ bepɔ no atifi kaa sɛ: Yɛn nie, yɛbɛforo akɔ deɛ AWURADE kaeɛ hɔ, ɛfiri sɛ yɛayɛ bɔne. 41Na Mose kaa sɛ: Adɛn na mofom AWURADE asɛm no ho yi? Yei deɛ, ɛrenyɛ yie. 42Mommforo nnkɔ, na AWURADE nni mo mu, na moantotɔ mo atamfoɔ anim; 43na Amalekfoɔ ne Kanaanfoɔ wɔ mo anim hɔ, na mobɛtotɔ nkrantɛ ano; na ɛnam sɛ moasane afiri AWURADE akyiri nti, AWURADE nso renni mo akyi. 44Na wɔtintim wɔn anim foro kɔɔ bepɔ no atifi; na AWURADE apam adaka no ne Mose anka wɔn ho amfiri nsraban no mu. 45 Ɛnna Amalekfoɔ ne Kanaanfoɔ a wɔte bepɔ no soɔ no siane ba bɛkunkumm wɔn bobɔɔ wɔn pete kɔduruu Horma.",https://www.bible.com/bible/1861/NUM.14.ASW
NUMERI 15,"Aduane afɔdeɛ ho mmara
1Na AWURADE ka kyerɛɛ Mose sɛ: 2Ka kyerɛ Israelfoɔ no sɛ: Sɛ moduru asase a morekɔtena soɔ a me ara mede merema mo no so, 3 na morebɔ ogya afɔdeɛ a ɛfiri anantwie anaa nnwan mu ama AWURADE a, sɛ ɛyɛ ɔhyeɛ afɔdeɛ anaa okum afɔdeɛ a mode reyɛ aboadeɛ, anaa ɛyɛ ayamyi afɔdeɛ, anaa mo afahyɛ ase deɛ, sɛ morema no ayi hwa hwanhwam ama AWURADE a, 4 ɛnneɛ deɛ ɔde n’ayɛyɛdeɛ brɛ AWURADE no, ɔmfa aduane afɔdeɛ nso mmra, esiam abupɛn du mu baako a wɔde ngo susutoa abupɛn nnan mu baako afɔre 5 ne ahwiesa susutoa abupɛn nnan mu baako, na ɔmfa nka ɔhyeɛ afɔdeɛ anaa okum afɔdeɛ dwan ba baako ho. 6Na odwennini deɛ, deɛ fa bɔ aduane afɔdeɛ ne esiam abupɛn du mu mmienu a wɔde ngo afɔre susutoa abupɛn mmiɛnsa mu baako, 7na fa ahwiesa susutoa abupɛn mmiɛnsa mu baako nso bra, na ɛnyi hwa hwanhwam mma AWURADE. 8Na sɛ nantwie ba na wode rebɛbɔ ɔhyeɛ afɔdeɛ anaa okum afɔdeɛ de ayɛ w’aboadeɛ, anaasɛ wode rebɛbɔ asomdwoeɛ afɔdeɛ ama AWURADE a, 9ɛnneɛ aduane afɔdeɛ a ɔmfa nka nantwie ba no ho ne esiam abupɛn du mu mmiɛnsa a wɔde ngo susutoa fa afɔre; 10na fa ahwiesa susutoa fa nso bra, na ɛnyɛ ogya afɔdeɛ a ɛyi hwa hwanhwam ma AWURADE.
11Saa na wɔnyɛ nantwie biara anaa odwennini biara anaa nnwanten anaa mmirekyie mma mu biara. 12Sɛ afɔdeɛ a mobɛbɔ no dodoɔ no teɛ no, saa na monyɛ wɔn mu biara, sɛdeɛ wɔn dodoɔ teɛ. 13Wɔn a wɔyɛ ɔman mma nyinaa nyɛ adeɛ yi sei mfa mmɔ ogya afɔdeɛ a ɛyi hwa hwanhwam mma AWURADE. 14Na sɛ ɔhɔhoɔ bi abɛsoɛ mo mu, anaa obi wɔ mo mu mo awoɔ ntoatoasoɔ nyinaa mu na ɔpɛ sɛ ɔbɔ ogya afɔdeɛ a ɛyi hwa hwanhwam ma AWURADE a, sɛdeɛ moyɛ no no, saa ara na ɔnyɛ no. 15 Ɔman asafo no, ahyɛdeɛ baako na ɛnna hɔ mma mo ne ɔhɔhoɔ a wabɛsoɛ mo mu no; ɛnyɛ daa ahyɛdeɛ mo awoɔ ntoatoasoɔ nyinaa mu: Sɛdeɛ moteɛ no, saa nso na ɔhɔhoɔ nyɛ AWURADE anim. 16Mmara korɔ ne atemmudeɛ korɔ na ɛnna hɔ mma mo ne ɔhɔhoɔ a wabɛsoɛ mo mu nyinaa.
17Na AWURADE kasa kyerɛɛ Mose sɛ: 18Ka kyerɛ Israelfoɔ no: Sɛ moduru asase a mede mo merekɔ soɔ no so, 19 na ɛba sɛ modi asase no so aduane no bi a, momma mmasoɔ adeɛ so mma AWURADE, 20 momfa mo mmɔre a ɛdi kan bi taterɛ nyɛ mmasoɔ adeɛ; sɛdeɛ moyɛ ayuporebea mmasoɔ adeɛ no, saa ara na momma soɔ; 21momfa mo mmɔrekan no bi mma AWURADE sɛ mmasoɔ adeɛ mo awoɔ ntoatoasoɔ nyinaa mu.
22 Na sɛ mofom na moanni mmara nsɛm a AWURADE aka akyerɛ Mose yi nyinaa so, 23deɛ AWURADE nam Mose so ahyɛ mo nyinaa, firi da a AWURADE hyɛɛ mmara no de rekɔduru mo awoɔ ntoatoasoɔ so no, 24na sɛ wɔfom anifasoɔ mu a ɔman no nnim a, ɛnneɛ asafo no nyinaa mfa nantwinini baako mmɔ ɔhyeɛ afɔdeɛ a ɛyi hwa hwanhwam ma AWURADE ne n’aduane afɔdeɛ ne n’ahwiesa, sɛdeɛ ne yɛbea teɛ, ne ɔpapo baako, na ɛnyɛ bɔne ho afɔdeɛ. 25Na ɔsɔfoɔ no mpata mma Israelfoɔ asafo no nyinaa, na wɔde bɛkyɛ wɔn; ɛfiri sɛ ɛyɛ ɛfom; na wɔn deɛ, wɔn fom no nti wɔde wɔn ayɛyɛdeɛ aba de rebɛbɔ AWURADE gya afɔdeɛ ne wɔn bɔne ho afɔdeɛ, AWURADE anim; 26na wɔde bɛkyɛ Israelfoɔ asafo no nyinaa ne ɔhɔhoɔ a wabɛsoɛ mo mu no, ɛfiri sɛ ɔman no nyinaa na wɔyɛ maa wɔn ɛfom no mu.
27 Na sɛ obi anhyɛ da na ɔyɛ bɔne a, ɛnneɛ ɔmfa abirekyibereɛ a wadi afe mmra mmɛbɔ bɔne ho afɔdeɛ, 28na ɔsɔfoɔ no mpata, AWURADE anim, mma ɔkra a ɔfom anifasoɔ mu no, sɛ ɔrepata ama no; na wɔde bɛkyɛ no. 29Mmara korɔ na ɛnna hɔ mma mo mma deɛ ɔyɛ biribi anifasoɔ mu; deɛ ɔyɛ Israelfoɔ mu kuromani, ne ɔhɔhoɔ a wabɛsoɛ wɔn mu.
30 Na ɔkra a ɔde aniɛden boapa yɛ biribi, asase no soni oo, ɔhɔhoɔ oo, wasopa AWURADE, na wɔbɛtwa saa ɔnii ko no afiri ne man mu atwene, 31ɛfiri sɛ wabu AWURADE asɛm animtia na wabu ne mmara asɛm so: Twa na wɔbɛtwa saa onipa no atwene, n’amumuyɛ da ne so.
Wɔsi homedasɛefoɔ aboɔ
32Na Israelfoɔ no wɔ ɛserɛ soɔ no, wɔkɔhunuu ɔbarima bi a ɔrepɛ nnyina homeda; 33na nnipa a wɔhunuu no sɛ ɔrepɛ nnyina no de no brɛɛ Mose ne Aaron ne asafo no nyinaa; 34 na wɔbɔɔ no dua mu, ɛfiri sɛ na wɔnnya nkyerɛɛ deɛ wɔnyɛ no. 35Na AWURADE ka kyerɛɛ Mose sɛ: Kum na wɔnkum ɔbarima no, asafo no nyinaa nsi no aboɔ wɔ nsraban no akyi. 36Ɛnna asafo no nyinaa de no firii adi kɔɔ nsraban no akyi kɔsii no aboɔ maa no wuiɛ, sɛdeɛ AWURADE hyɛɛ Mose no.
Ntoma ano nnwo ho mmara
37Na AWURADE ka kyerɛɛ Mose sɛ: 38 Ka kyerɛ Israelfoɔ no sɛ: Wɔnyɛ wɔn ntoma ano nnwo wɔn awoɔ ntoatoasoɔ nyinaa mu, na wɔmfa bibire homa nsosɔ ntoma ano nnwo no mu; 39na ɛnyɛ mo nnwo a mohwɛ kae AWURADE mmara nsɛm nyinaa yɛ, na moankɔkyini anni mo akoma ne mo aniwa akyi, sɛdeɛ motaa gyae m’akyiridie kɔbɔ adwaman no. 40Deɛ ɛbɛyɛ na moakae me mmara nsɛm nyinaa ayɛ, na moayɛ kronkron ama mo Nyankopɔn. 41Mene AWURADE mo Nyankopɔn a meyii mo firii Misraim asase soɔ sɛ mɛyɛ mo Nyankopɔn no: Mene AWURADE mo Nyankopɔn.",https://www.bible.com/bible/1861/NUM.15.ASW
