Title,Content,URL
WƖAA DƖ-SUOMUŊ 15,"Wɩa bil niiŋ ʋ dɩ Abɩram pɛgɛ
1Ʋ ŋɩɩ harɩŋ nɛ Wɩa bʋl wɩaa a pɩ Abɩram arɩ duosoo tʋɔŋ. Ʋ sɩ,
“Abɩram, sɩ́ leŋe dɩ fawʋllʋŋ kɛnɩŋ.
Mɩ nɛ jaŋ chu tɔ ŋ lɛ,
ŋ time jaŋ yʋgɛ.”
2Ŋɩɩ nɛ Abɩram pɩɛsɛ, “Mɩ Tɩɩna Wɩɩjarɩbakɔ, bɛɛ nɛ ŋ jaŋ joŋo pɩmɛ, bɛɛ wɩaa mɩ bɩ bii kala kɛnɛ sɩ jaŋ dii mɩ dɩa? Nɩɩ-la sɩɩ beŋ mɩ dɩa nɛ Elieza a lɩɩ taŋ-la ba sɩɩ yɩrɛ Damasɩkʋs.” 3Abɩram bɩra bʋl, “Ŋ sɩ bɩ mɩ biiriŋ pa, ŋɩɩ-na mɩ dɩa tɩntɩnnʋ-la Elieza nɛ jaŋ dii mɩ dɩa.”
4Ŋɩɩ nɛ La TƖƖNA Wɩa bʋla pʋ, “Baal-la dee bɩ jaŋ dii ŋ dɩa, ŋ tɩtɩa bii-lʋlʋŋ nɛ jaŋ dii ŋ dɩa.” 5Ŋɩɩ nɛ La TƖƖNA kɛŋ Abɩram lɩɩ dɩ-jalɩŋ aŋ bʋl, “Beŋ wɩa-nyuŋ a na chɛnwʋlaa sɩ magɛ ŋɩɩ, ŋ bɩ jaŋ wuo dɩɩsɛba. Ŋɩɩ nɛ ŋ doho nɩaa jaŋ magɛ.”
6Abɩram laa wɩalɩŋ kala La TƖƖNA sɩ bʋla pʋ dii nɛ. Ŋɩɩ nɛ tɩɩ Wɩa joŋu arɩ ʋ ŋaa tʋɔpʋl tɩɩna nɛ. 7Ŋɩɩ nɛ La TƖƖNA bʋla pʋ, “Mɩ nɛ kɛnɩŋ lɩɩ Uu sɩ hɛ Babɩlɔŋ tinteeŋ kɔ dɩ mɩ joŋ tinteeŋ deeŋ pɩŋ nɛ. Ʋ jaŋ ŋaa ŋ kʋŋ.”
8Ŋɩɩ nɛ Abɩram pɩɛsɛ, “La TƖƖNA Wɩɩjarɩbakɔ, ɛɛ nɛ mɩ jaŋ wuo jɩŋ arɩ mɩ nɛ jaŋ tɩɩ tinteeŋ deeŋ?”
9Ŋɩɩ nɛ La TƖƖNA bʋla pɩ Abɩram, “Kɛŋ jɩsɩŋ batori napaha, jɩsɩŋ batori bʋ-nɩɩŋ, jɩsɩŋ batori pie-bele, koko-pʋla arɩ koko-fɩaŋ a kaa kɔ.”
10Ŋɩɩ nɛ Abɩram kɛŋ kɩalɩŋ Wɩa sɩ daga a kaa keri balɩa balɩa a kaa yelli yelli dɔŋɔ, ama ʋ bɩ kokosu-la kaa keri. 11Ŋɩɩ nɛ zaaraa kʋ tuu dɩ ba dii kɩalɩŋ, Abɩram kiri.
12Wɩɩ-muluŋ sɩ tuu jʋʋ, doŋ faasa kɛŋ Abɩram. Ʋ nyuŋ ŋmɛrɛ, fawʋllʋŋ kɛnʋ woruŋ. 13Ŋɩɩ nɛ La TƖƖNA bʋla pʋ, “Jɩŋ woruŋ arɩ ŋ doho nɩaa jaŋ ŋaa nʋhʋɔraa tintee-wogo lɛ, a ŋaa ba yosuŋ dɩ ba dɔgɩsɛba jɩsɩŋ zɔɔ-banɛsɛ. 14Tintee-la nɩaa ba sɩ jaŋ tɩma pa, mɩ jaŋ dɔgɩsɛba, ka ʋ harɩŋ, ŋ nɩaa jaŋ lɩlɩɩ tintee-la lɛ dɩ ba dʋa kɩaa kɩŋkɛŋ. 15Ŋ-na tɩtɩa jaŋ hɩɛsɛ woruŋ aŋ na sʋʋ arɩ yarɩfɩɛlaa dɩ ba huguŋ. 16Ama, ŋ doho nɩaa nihi-lɩɛrɛ naansɩɩŋ bʋnɛsɛ ha jaŋ mɩɩra kɔ daha, dɩ Amɔrɩ tɩŋŋaa wʋbɔŋŋɔɔ ŋaanɩŋ ha bɩ dɛrɛ.”
17Wɩɩ-muluŋ sɩɩŋ sɩ jʋa, leriŋ biri lim, ŋɩɩ nɛ nyʋɔsʋŋ arɩ nyiŋgeliŋ to nammɩɩsɩ-la pɛgɛ a lɩɩ chaanɛ. 18Tapʋlɩɩ-la tɩtɩa nɛ La TƖƖNA bil niiŋ ʋ dɩ Abɩram pɛgɛ a bʋl, “Mɩ jaŋ joŋ tinteeŋ deeŋ a pɩ ŋ doho nɩaa a chɩŋ Ijipiti fuo-la a kaa mʋ Yufireti fuo-bal-la, nɩaa deemba tinteyee: 19Keni tɩŋŋaa, Kenas tɩŋŋaa, Kadomo tɩŋŋaa, 20Hiti tɩŋŋaa, Pɛrɛs tɩŋŋaa, Refem tɩŋŋaa, 21Amɔrɩ tɩŋŋaa, Kɛnaŋ tɩŋŋaa, Gɩgasɩ tɩŋŋaa arɩ Jebus tɩŋŋaa.”",https://www.bible.com/bible/2553/GEN.15.SIS
WƖAA DƖ-SUOMUŊ 16,"Haga arɩ Ɩsɩmɛl
1Abɩram haala Saraɩ bɩ bii kala lʋla. Ama ʋ fa kɛŋ ketiiŋ nɛ, baa yɩrɛ Haga a lɩɩ Ijipiti tinteeŋ. 2Ŋɩɩ nɛ Saraɩ bʋla pɩ Abɩram, “La TƖƖNA bɩ leŋe mɩ lʋl bii, mɩɩ sʋlʋŋ, kɛŋ mɩ ketiiŋ Haga dɩ ʋ lʋl biiriŋ pɩmɛ.”
Abɩram sɛɩ wɩɩ-la Saraɩ sɩ bʋla. 3Abɩram hɛ Kɛnaŋ tinteeŋ lɛ jɩsɩŋ fii nɛ ka ʋ haala Saraɩ joŋ ʋ ketiiŋ Haga a pʋ, ʋ ŋaa ʋ haal. 4Abɩram arɩ Haga pɛ bɔsɔ ʋ kɛŋ luoruŋ.
Haga sɩ na dɩ ʋ kɛŋ luoruŋ, ʋ sɩɩŋ bɩra bɩ Saraɩ ka su. 5Saraɩ bʋla pɩ Abɩram, “Wɩɩŋ deeŋ sɩɩ ŋaa mɩ lɛ ŋ nɛ tɩɩ. Mɩ nɛ joŋ mɩ ketiiŋ pɩŋ, ʋ sɩ na dɩ ʋ kɛŋ luoruŋ, ʋ sɩɩŋ bɩra bɩ mɩɩ su. La TƖƖNA nɛ jaŋ laa wɩɩ-la bʋla pɩ la kala.”
6Ŋɩɩ nɛ Abɩram bʋla pɩ Saraɩ, “Ŋ ketiiŋ hɛ ŋ nɩsɩŋ lɛ nɛ, ŋaaʋ wɩɩ-la kala ŋ sɩɩ chɛ.” Ŋɩɩ nɛ Saraɩ dɔgɩsʋ woruŋ, ʋ lɩɩ fá.
7Wɩa tɩndaara na Haga dɩ ʋ hɛ tintee-hɩlɩŋ lɛ a kpagɛ lɩɩ-bulo. Lɩɩ-bulo-la hɛ lee-la ba sɩɩ yɩrɛ Suu wombiiŋ nɛ. 8Ŋɩɩ nɛ Wɩa tɩndaarʋ-la pɩɛsʋ, “Saraɩ ketiiŋ Haga, nɩɩ nɛ ŋ lɩɩ a mʋmʋ nɩɩ?”
Ŋɩɩ nɛ Haga bʋl, “Mɩ fáa kagɛ mɩ dɩa-naaŋ lɛ nɛ.”
9Wɩa tɩndaarʋ-la bʋla pʋ, “Mɩɩra mʋ ŋ dɩa-naaŋ teeŋ a sɛɩ pʋ. 10Mɩ jaŋ leŋ dɩ ŋ kɛŋ doho a pʋŋ woruŋ. Nʋʋ bɩ jaŋ wuo dɩɩsɛ ba kala.”
11Wɩa tɩndaarʋ-la bɩra bʋla pʋ,
“Ŋ kɛŋ luoruŋ nɛ,
ŋ jaŋ lʋl hambolibie
a hɛ ʋ yɩrɩŋ Ɩsɩmɛl,
bɛɛ wɩaa Wɩa na ŋ nenige nɛ.
12Bile jaŋ waa a nagɛ kaku-werigiŋ,
ʋ dɩ nʋʋkala bɩ jaŋ sɩŋ.
Ʋ jaŋ tɛrɛ ʋ naambiiriŋ teeŋ.”
13Ʋ sɩ bʋl ŋɩɩ dɛrɛ, Haga bʋl: “Lɛɛlɛ mɩ na Wɩa arɩ mɩ sɩɩŋ aŋ bɩ sʋba. Mɩ jaŋ hɛ ʋ yɩrɩŋ ‘Wɩa-la sɩ namɛ’.” 14Ŋɩɩ nɛ ba kɛŋ lɩɩ-bul-sɩɩ-la sɩ pɩŋ Kadɛs arɩ Bɛrɛd pɛgɛ yɩyɩrɛ Bɛɛ-Lahaɩ-Roi. Bɛrɛd bʋbʋɔŋ nɛ: ‘Wɩa-la sɩ weye a namɛ viliŋ lɛ’.
15Ŋɩɩ nɛ Haga lʋl hambolibie pɩ Abɩram. Abɩram hɛ ʋ yɩrɩŋ Ɩsɩmɛl. 16Haga sɩ lʋl Ɩsɩmɛl, bʋa-la lɛ dɩ Abɩram ŋaa jɩsɩŋ mahɩŋ banɛsɛ arɩ balɩdʋ.",https://www.bible.com/bible/2553/GEN.16.SIS
WƖAA DƖ-SUOMUŊ 17,"Ba keri nɩaa penee
1Abɩram sɩ ŋaa jɩsɩŋ mahɩŋ banɛsɛ arɩ fii arɩ nibi, La TƖƖNA kɛŋ ʋ tɩtɩa kʋ dagʋ a bʋla pʋ, “Mɩ nɛ ŋaa Wɩa doluŋ kala Tɩɩna, kɛŋ tʋɔpʋla mɩ teeŋ. 2Mɩ jaŋ leŋ dɩ nii-la mɩ sɩ bile mɩ dɩŋ pɛgɛ chɩŋ a leŋ dɩ ŋ doho nɩaa pʋŋa yʋgɛ kɩŋkɛŋ.” 3Ŋɩɩ nɛ Abɩram tele chu, Wɩa bʋla pʋ, 4“Niiŋ deeŋ nɛ mɩ bil mɩ dɩŋ pɛgɛ: Ŋ nɛ jaŋ ŋaa dʋnɩa nɩaa kala nyɩmma. 5Ba bɩra bɩ jaŋ yɩrɩŋ Abɩram, ŋ yɩrɩŋ jaŋ ŋaa Abɩraham, bɛɛ wɩaa mɩ jaŋ leŋ dɩ ŋ ŋaa tintee daŋ nyɩmma. 6Mɩ jaŋ leŋ dɩ ŋ pʋŋ. Ŋ doho nɩaa jaŋ ŋaa tintee daŋ, dɩ kuoroo lɩɩ ba tʋɔŋ. 7Mɩ jaŋ leŋ dɩ nii-la mɩ sɩ bile mɩ dɩ ŋ doho nɩaa arɩ nɩalɩŋ sɩ jaŋ to ŋ harɩŋ kɔ pɛgɛ, dɩ ʋ chɩŋ kpaŋkpaŋ a kaa mʋ wuu. Mɩ jaŋ ŋaa ŋ dɩ nɩalɩŋ sɩ jaŋ to ŋ harɩŋ kɔ Wɩa. 8Kɛnaŋ tinteeŋ deeŋ lɛ ŋ sɩ hɛ a ŋaa nʋhʋɔrʋ ŋ-la, mɩ jaŋ joŋu pɩ ŋ dɩ ŋ doho nɩaa dɩ ʋ ŋaa ma kʋŋ a kaa mʋ wuu dɩ mɩ ŋaa ba Wɩa.”
9Ŋɩɩ nɛ Wɩa bɩra bʋla pɩ Abɩraham, “Ŋ-na Abɩraham arɩ ŋ doho nɩaa, má to nii-la mɩ sɩ bile mɩ dɩ ma pɛgɛ a kaa mʋ wuu. 10Nii-la mɩ sɩ bile mɩ dɩŋ arɩ ŋ doho nɩaa pɛgɛ nɛ ŋ-la: Má keri hambolibie na-kala ma sɩ lʋla peniŋ. 11Peniŋ keriŋ nɛ jaŋ ŋaa mɩ dɩ ma pɛgɛ nii-bilii-la magɩlɩŋ. 12Má keri hambolibie sɩ ŋaa tapʋlaa chori peniŋ, dɩ ʋ ŋaa ŋ doho nʋʋ koo dɩ ʋ ŋaa yoŋ ma sɩ yɔbɔ nʋhʋɔraa teeŋ. 13Nii-la mɩ sɩ bile mɩ dɩ ma pɛgɛ jaŋ hɛ nɩmɛ a mʋmʋ wuu, dɩ ma kikeri ma doho nɩaa arɩ yosu-la ma sɩ yɔbɔ penee. 14Dɩ baal-na kala nɛ bɩ ʋ peniŋ kere, ʋ bɩ jaŋ ŋaa mɩ nʋʋ, bɛɛ wɩaa ʋ bɩ nii-la mɩ sɩ bile ka to.”
15Ŋɩɩ nɛ Wɩa bʋla pɩ Abɩraham, “Lɛɛlɛ bɩra sɩ́ ŋ haala Saraɩ yɩrʋ, yɩyɩrʋ Sara. 16Mɩ jaŋ pɛ ʋ lɛ dɩ ma lʋl hambolibie, a bɩra pɛ ʋ lɛ dɩ ʋ ŋaa tintee daŋ naaŋ, dɩ kuoroo lɩɩ ba tʋɔŋ.”
17Ŋɩɩ nɛ Abɩraham kɛŋ sɩaa chu tinteeŋ a mɔŋ aŋ bʋl ʋ tʋɔŋ lɛ, “Nʋʋ jaŋ wuo yi jɩsɩŋ zɔlɔ aŋ lʋl bie? Sara ma sɩ ŋaa jɩsɩŋ mahɩŋ banɛsɛ arɩ fii jaŋ wuo lʋl bii?” 18Ŋɩɩ nɛ Abɩraham bʋla pɩ Wɩa, “Dɩ ŋ nɛ jaŋ pɛ Ɩsɩmɛl lɛ.”
19Ŋɩɩ nɛ Wɩa bʋl, “Mɩ sɛyɛ nɛ, ama ŋ haala Sara jaŋ lʋl hambolibie, dɩ ŋ hɛ ʋ yɩrɩŋ Aɩzɩk. Mɩ jaŋ bil nii-la sɩ bɩ dɛrɛ a pɩ Aɩzɩk arɩ ʋ doho nɩaa kala. 20Ɩsɩmɛl ma wɩaa, mɩ nɩa nɛ, mɩ jaŋ pɛ ʋ lɛ a leŋ dɩ ʋ doho nɩaa pʋŋ woruŋ. Mɩ jaŋ leŋ dɩ ʋ ŋaa kuori-gentisiŋ fii arɩ balɩa nyɩmma, dɩ ʋ doho nɩaa pʋŋ woruŋ. 21Ama mɩ ha jaŋ bil niiŋ mɩ dɩ Aɩzɩk, pɛgɛ, bile Sara sɩ jaŋ lʋl harɩŋ jɩna bʋa deeŋ lɛ a leŋ dɩ ʋ chɩŋ.” 22Wɩa sɩ bʋl wɩaa pɩ Abɩraham dɛrɛ, ʋ leŋu aŋ mʋ.
23Tapʋlɩɩ-la tɩtɩa Wɩa sɩ bʋl ŋɩɩ, Abɩraham kɛŋ ʋ bie Ɩsɩmɛl arɩ baala-la kala ba sɩ lʋla ʋ dɩa lɛ, arɩ yosu-la kala ʋ sɩ yɔbɔ a keri ba penee. 24Abɩraham fa ŋaa jɩsɩŋ mahɩŋ banɛsɛ arɩ fii arɩ nibi nɛ aŋ-na keri ʋ peniŋ. 25Ʋ nanʋala Ɩsɩmɛl ma fa ŋaa jɩsɩŋ fii arɩ batori nɛ aŋ ma keri ʋ peniŋ. 26Chɛ-bala nɛ Abɩraham arɩ Ɩsɩmɛl kala keri ba penee 27a keri baala-la kala ba sɩ pɛ lʋl Abɩraham dɩa lɛ, arɩ yosu-la kala ba sɩ yɔbɔ nʋhʋɔraa teeŋ.",https://www.bible.com/bible/2553/GEN.17.SIS
WƖAA DƖ-SUOMUŊ 18,"Nʋhʋɔraa batori kɔ Abɩraham teeŋ
1Ŋɩɩ nɛ La TƖƖNA kɛŋ ʋ tɩtɩa kʋ dagɛ Abɩraham a kpagɛ Mamɩrɛ tɩɩ-bala-la, bʋa-la lɛ dɩ Abɩraham hɔŋ ʋ lɛbɩŋ boiŋ niiŋ wɩɩ-hɛɛ-siesee. 2Ʋ kɛŋ ʋ nyuŋ je a na baalaa batori dɩ ba mʋ chɩŋ sɩpaaŋ. Ʋ sɩ naba, ʋ sii ʋ lɛbɩŋ boiŋ niiŋ a mʋ chemba lɩma lɩma. Ʋ sɩ chemba, ʋ tuu kpirimi ba sɩpaaŋ, 3aŋ bʋla pɩ ba dɔŋɔ, “Mɩ kʋhɩaŋ, dɩ ma tʋɔŋ nɛ tɔrɛ mɩ nyuŋ, má sɩ́ mɩ-na ma tɩntɩnna kiele bal. 4Má leŋ dɩ mɩ kɛŋ lɩɩŋ mʋa kɔ dɩ ma sɔŋ ma naasɩŋ aŋ wiesi tɩa deeŋ bʋbʋɔŋ. 5Ma sɩ zilmi ŋɩɩ a kɔ mɩ-na ma tɩntɩnna dɩa, má leŋ dɩ mɩ ŋaa kʋdiilee pɩma dɩ ma dii aŋ mʋ.”
Ŋɩɩ nɛ ba bʋl, “Ŋ lɔlʋŋ nɛ hɛ nɩmɛ, la sɛyɛ nɛ.”
6Ŋɩɩ nɛ Abɩraham fá jʋʋ lɛbɩŋ tʋɔŋ Sara teeŋ, a bʋla pʋ, “Ŋaa munuŋ gbansɩŋ batori a ŋaa kʋdiilee lɩma.”
7Abɩraham jʋʋ na-dɩa a kɛŋ na-bie sɩ kɛŋ nammɩa a pɩ ʋ tɩntɩnna ʋ kpʋ a bɩrɩmɛ lɩma lɩma. 8Ʋ kɛŋ nayɩl-nʋʋŋ, nayɩlɩŋ arɩ nammɩa-la ba sɩ chɔ kaa kʋ lɩɩ tɩa-la bʋbʋɔŋ pɩba ba didii, ka ʋ gbɛrɛ.
9Ŋɩɩ nɛ ba pɩɛsɛ Abɩraham, “Nɩɩ nɛ ŋ haala Sara hɛ?”
Ʋ sɩ ʋ hɛ lɛbɩŋ tʋɔŋ.
10Ŋɩɩ nɛ La TƖƖNA bʋla pɩ Abɩraham, “Harɩŋ jɩna, mɩ jaŋ mɩɩra kɔ bʋa deeŋ tɩtɩa lɛ dɩ ŋ haala Sara lʋl hambolibie.”
Bʋa-la lɛ dɩ Sara chɩŋ Abɩraham harɩŋ lɛbɩŋ boiŋ niiŋ a jijegili. 11Bʋa deeŋ lɛ dɩ Abɩraham arɩ Sara hɩɛsa, Sara paala kieli biiriŋ lʋlʋŋ. 12Sara fɩɛla mɔŋ a hɛ ʋ tʋɔŋ aŋ bʋl, “Mɩ sɩ hɩɛsa ŋ-la! Mɩ bala ma hɩɛsɛ, mɩ bɩra jaŋ bɩbɩɩnɛ baalaa wɩaa?”
13Ŋɩɩ nɛ La TƖƖNA pɩɛsɛ Abɩraham, “Bɛɛ nɛ tɩɩ Sara mɔŋ ʋ tʋɔŋ lɛ, ʋ bɩɩna ʋ sɩ hɩɛsa wɩaa ʋ bɩra bɩ jaŋ wuo lʋl bie? 14Wɩɩ nɛ hɛ nɩmɛ La TƖƖNA bɩ ʋ doluŋ kɛnɛɛ? Bʋa deeŋ tɩtɩa mɩ sɩ daga lɛ, mɩ jaŋ mɩɩra kɔ dɩ Sara lʋl hambolibie.”
15La TƖƖNA sɩ pɩɛsɛ ŋɩɩ, fawʋllʋŋ kɛŋ Sara, ʋ nyɩɛ wɩaa arɩ ʋ bɩ mɔmɔ.
Ŋɩɩ nɛ La TƖƖNA bʋl, “Ŋ mɔmɔ nɛ.”
Abɩraham sʋla laa Sodom tɩŋŋaa
16Baala-la batori sɩ sie dɩ ba viiri, ba to Sodom dɩɩrɩŋ nɛ. Abɩraham kɛmba mʋ hɛ wombiiŋ lɛ. 17Ŋɩɩ nɛ La TƖƖNA bʋl, “Wɩɩ-la mɩ sɩɩ chɛ dɩ mɩ ŋaa, ʋ bɩ maga dɩ mɩ kaa faa Abɩraham. 18Abɩraham doho nɩaa jaŋ pʋŋ a yʋgɛ a kɛŋ doluŋ ma. Ba lɛ nɛ mɩ jaŋ to a pɛ dʋnɩa nɩaa kala lɛ. 19Mɩ nɛ lɩɩsʋ dɩ ʋ dagɛ ʋ biiriŋ arɩ ʋ doho nɩaa sɩ jaŋ to harɩŋ kɔ mɩ wombiiŋ dɩ ba kɛŋ wʋtɩtɩɩ, a ŋɩŋaa wɩaa ba bʋa lɛ, dɩ ŋɩɩ leŋ dɩ mɩ ŋaa wɩɩ-la mɩ sɩ bʋla pɩ Abɩraham arɩ mɩ jaŋ ŋaa pʋ.”
20Ŋɩɩ nɛ La TƖƖNA bʋl, “Mɩ nɩa arɩ Sodom arɩ Gomora nɩaa ŋaa nɩbɔmɔ nɛ a faasaa ŋaa wʋbɔŋŋɔɔ. 21Mɩ jaŋ tuu na wɩalɩŋ ba sɩ ŋaa sɩ nagɛ ŋɩɩ nɩaa bubunsi ba bɔmʋŋ lɛ, dɩ ʋ ŋaa wʋtɩtɩɩ dɩ mɩ jɩŋ.”
22Ŋɩɩ nɛ baala-la batori tʋɔŋ balɩa mɩɩra chaasɛ Sodom dɩɩrɩŋ a mʋmʋ aŋ ka Abɩraham ha chɩŋ La TƖƖNA sɩpaaŋ. 23Abɩraham sʋʋsa yi La TƖƖNA a pɩɛsʋ, “Ŋ jaŋ kpʋ tʋɔpʋl tɩŋŋaa arɩ nɩbɔŋŋɔɔ kala hɛ dɔŋɔɔ? 24Ka dɩ tʋɔpʋl tɩŋŋaa nɛ ŋaa mahɩŋ balɩa arɩ fii taŋ-la lɛ, ŋ jaŋ kpʋ ba kala koo ŋ jaŋ lemba a tɩŋ tʋɔpʋl tɩmma-la wɩaa? 25Ʋ bɩ kɩsɛ dɩ ŋ kpʋ tʋɔpʋl tɩŋŋaa arɩ nɩbɔŋŋɔɔ kala hɛ dɔŋɔ lɛɛ? Ŋɩɩ bɩ kɩsɛɛ, Nɩɩ-la sɩ jaŋ dii dʋnɩa kala sarɩya sɩ jaŋ ŋaa ŋɩɩ?”
26Ŋɩɩ nɛ La TƖƖNA bʋl, “Dɩ mɩ nɛ na nɩaa mahɩŋ balɩa arɩ fii Sodom lɛ sɩ kɛŋ tʋɔpʋla, a tɩŋ tʋɔpʋl tɩmma-la wɩaa, mɩ jaŋ joŋo chɛba.”
27Ŋɩɩ nɛ Abɩraham bɩra bʋl, “Lɛɛlɛ mɩ nyuŋ duoro nɛ dɩ mɩ wuo bʋl wɩaa La TƖƖNA teeŋ, mɩ paala bɩ kʋŋkala ŋaa ŋ sɩpaaŋ. 28Dɩ nɩaa mahɩŋ balɩa arɩ banɔŋ nɛ ŋaa tʋɔpʋl tɩŋŋaa taŋ-la lɛ, ŋ ha jaŋ kpʋ nɩalɩŋ?”
Ŋɩɩ nɛ Wɩa bʋl, “Dɩ tʋɔpʋl tɩŋŋaa mahɩŋ balɩa arɩ banɔŋ nɛ hɛ nɩmɛ, mɩ bɩ jaŋ chei taŋ-la nɩaa kala.”
29Ŋɩɩ nɛ Abɩraham bɩra pɩɛsɛ, “Ka dɩ nɩaa mahɩŋ balɩa nɛ ŋaa tʋɔpʋl tɩmma nɩmɛ, ŋ jaŋ kpʋbaa?” La TƖƖNA bʋl, “Dɩ nɩaa mahɩŋ balɩa nɛ ŋaa tʋɔpʋl tɩmma nɩmɛ, mɩ bɩ jaŋ chei taŋ-la.”
30Ŋɩɩ nɛ Abɩraham bɩra bʋl, “Mɩ Tɩɩna, sɩ́ baanɩŋ na, leŋ dɩ mɩ pɩɛsɛ, ka dɩ nɩaa mara arɩ fii nɛ hɛ nɩmɛ?” Ʋ bʋl, “Mɩ bɩ jaŋ chei taŋ-la dɩ mɩ nɛ na nɩaa mara arɩ fii sɩ kɛŋ tʋɔpʋla.”
31Abɩraham bɩra bʋl, “Lɛɛlɛ mɩ nyuŋ sɩ duoro mɩ wuo bʋl wɩaa La TƖƖNA teeŋ, mɩ bɩra jaŋ pɩɛsɛ, ka dɩ nɩaa mara nɛ hɛ nɩmɛ a ŋaa tʋɔpʋl tɩmma?”
Ŋɩɩ nɛ La TƖƖNA bʋl, “A tɩŋ nɩaa mara-la wɩaa mɩ bɩ jaŋ chei taŋ-la.”
32Ŋɩɩ nɛ Abɩraham bɩra bʋl, “Mɩ Tɩɩna Wɩa, sɩ́ baanɩŋ na, leŋ dɩ mɩ ha pɩɛsɛ wɩɩŋ deeŋ. Ka dɩ nɩaa fii nɛ hɛ nɩmɛ a ŋaa tʋɔpʋl tɩmma?”
Ŋɩɩ nɛ La TƖƖNA Wɩa bʋl, “Dɩ nɩaa fii nɛ hɛ nɩmɛ, mɩ bɩ jaŋ chei taŋ-la.”
33La TƖƖNA Wɩa arɩ Abɩraham sɩ bʋl wɩaa dɛrɛ, ʋ ta Abɩraham, ʋ mʋ dɩa.",https://www.bible.com/bible/2553/GEN.18.SIS
WƖAA DƖ-SUOMUŊ 19,"Wɩa chei Sodom arɩ Gomora tɩŋŋaa
1Wɩa tɩndaara-la balɩa mʋ Sodom dɩdaanɩŋ, dɩ Lɔt hɔŋ tabal-la boi-baalɩŋ. Ʋ sɩ naba, ʋ sii mʋ chemba a tuu kpirimi ba sɩpaaŋ a kɛŋ ʋ nyuŋ chuguli tinteeŋ, 2aŋ bʋla pɩba, “Mɩ kʋhɩasɩŋ, má kʋ jʋʋ mɩ-na ma tɩntɩnna dɩa a sɔŋ ma naasɩŋ aŋ chʋa, dɩ taŋ nɛ pʋla chʋchʋɔ-fɩɛla, ma sii viiri.”
Ŋɩɩ nɛ Wɩa tɩndaara-la bʋl, “Aɩ, la jaŋ lɩɩ chʋa lee-la taŋ nɩaa sɩɩ hilimu.”
3Lɔt vɩa aŋ pɛsɛ ba lɛ, ŋɩɩ nɛ ba to ʋ harɩŋ jʋʋ ʋ dɩa. Ʋ ŋaa kʋdiilee a wasɛ boroboro sɩ bɩ sɩbʋrʋŋ kɛnɛ a pɩba ba dii. 4Ka dɩ ba-na pɩŋ doŋ, baalaa lɩɩ Sodom sɛmɛ kala kɔ, nɩhɩasɩŋ arɩ bapʋɔsaa kala a golli Lɔt dɩa. 5Ŋɩɩ nɛ baala-la yɩrɛ Lɔt a pɩɛsʋ, “Nɩɩ nɛ nʋhʋɔra-la sɩ kɔ ŋ teeŋ tɩtaŋɩŋ deeŋ hɛ? Kɛmba kaa kʋ lɩɩ pɩla dɩ la tʋʋ ba bʋbʋɔ-niiree.”
6Ŋɩɩ nɛ Lɔt kʋ lɩɩ chemba boiŋ niiŋ aŋ kɛŋ boro-la tɔ 7aŋ bʋl, “Nandɔmba, aɩ, má sɩ́ wʋbɔmʋŋ deeŋ ŋaa. 8Mɩ kɛŋ toloo balɩa nɛ, ba ha bɩ baal jɩŋ. Mɩ jaŋ kɛmba kʋ lɩɩ pɩma, dɩ ma ŋaa ŋɩɩ kala ma sɩɩ chɛ ba lɛ. Ama má sɩ́ wɩɩkala ŋaa nʋhʋɔraa deemba lɛ, bɛɛ wɩaa ba ŋaa mɩ nʋhʋɔraa nɛ, ʋ maga mɩ pɔba.”
9Ŋɩɩ nɛ nɩalɩŋ bʋl dɩ Lɔt sii lee-la aŋ bɩra bʋl, “Ŋ ŋaa nʋhʋɔrʋ nɛ la jaŋ lɛ, sɩ́ la wɩaa laa jɩŋ. La jaŋ dɔgʋsʋŋ a kɩɩ nʋhʋɔra-la.” Ŋɩɩ nɛ ba yigi Lɔt ta aŋ mʋ dɩ ba ŋmoo ʋ boro chei.
10Ŋɩɩ nɛ Wɩa tɩndaara-la kɛŋ Lɔt lɛrɛ jʋʋ dɩa aŋ kɛŋ boiŋ niiŋ tɔ, 11aŋ ŋaa nɩalɩŋ fa sɩ chɩŋ boiŋ niiŋ, banɩhɩasɩŋ arɩ bapʋɔsɩa-la kala nyʋlɩmɛ, ba chɛ dɩa-la boiŋ niiŋ ka.
12Ŋɩɩ nɛ Wɩa tɩndaara-la balɩa pɩɛsɛ Lɔt, “Ŋ bɩra kɛŋ nʋʋ nɛ daha, naasaanaa, hambolibiisiŋ koo hantolibiisiŋ, koo ŋ sɩ tɩɩ nʋʋkala tabalɩŋ deeŋ lɛɛ? Kɛmba dɩ ma lɩɩ daha. 13Laa chɛ dɩ la chei taŋ deeŋ nɛ. Wɩa nɩa dɩ nɩaa faasa bubunsi a tɩgɛ nɩaa deemba lɛ, ŋɩɩ nɛ tɩɩ Wɩa tɩŋ la dɩ la kʋ chei taŋ deeŋ.”
14Ŋɩɩ nɛ Lɔt lɩɩ bʋla pɩ nɩalɩŋ fa sɩɩ chɛ dɩ ba jaa ʋ toloo, “Má sii a ŋaa dee dee a lɩɩ taŋ deeŋ lɛ, bɛɛ wɩaa La TƖƖNA ka chɛ ʋ chei tabalɩŋ deeŋ nɛ.” Ama ba fa bɩɩna Lɔt faa gbieli nɛ.
15Taŋ sɩ pʋlaa kɔ, Wɩa tɩndaara-la bʋla pɩ Lɔt, “Ŋaa lɩma a kɛŋ ŋ haala arɩ ŋ toloo balɩa-la sɩ hɛ daha a lɩɩ, dɩ ŋɩɩ dee, ŋ ma jaŋ sʋʋ dɩ tabalɩŋ deeŋ nɩɩ chei.”
16Lɔt kɛŋ dɩ ʋ lɛrɛ, Wɩa tɩndaara-la kɛŋ ʋ nɩsɩŋ lɛ a kɛŋ ʋ haala ma nɩsɩŋ lɛ arɩ ʋ toloo balɩa-la kala nɩsaa lɛ a kaa lɛrɛ lɩɩ tabal-la lɛ, bɛɛ wɩaa La TƖƖNA fá ba nenige nɛ. 17Ba sɩ kɛmba lɩɩ dɛrɛ, ŋɩɩ nɛ Wɩa tɩndaara-la dɔŋɔ bʋla pɩba, “Má fá a laa ma mɩɩsɩŋ! Má sɩ́ harɩŋ daasʋ, a sɩ́ lee-kala ma chɩŋ! Má fá jɩl peele-la nyuŋ, dɩ ŋɩɩ dee ma jaŋ sʋʋ.”
18Ŋɩɩ nɛ Lɔt bʋla pɩba, “Mɩ kʋhɩasɩŋ, aɩ, mɩɩ sʋlma. 19Mɩ-na ma tɩntɩnna na ŋɩɩ ma sɩ chomi nɛ. Má kɛmmɛ woruŋ a chɩchɛ dɩ ma laa mɩ mɩɩsɩŋ, ama mɩ bɩ jaŋ wuo fá jɩl peele-la nyuŋ, wɩɩŋ deeŋ jaŋ puumi dɩ mɩ sʋʋ. 20Bee-na tabie nɛ kpagɛ daha, ʋ faasa muuri nɛ. Mɩ jaŋ wuo fá mʋ tabie-laa? Má leŋ dɩ mɩ fá mʋ lee-la a laa mɩ mɩɩsɩŋ.” 21Ŋɩɩ nɛ Wɩa tɩndaara-la dɔŋɔ bʋla pʋ, “Mɩ sɛɩ wɩɩ-la ŋ sɩ bʋla nɛ, mɩ bɩ jaŋ chei tabie-la wɩaa ŋ sɩ bʋla. 22Fá lɩma mʋ nɩmɛ, mɩ bɩ jaŋ wuo ŋaa wɩɩkala see dɩ ŋ yi Zʋaa (Zʋaa bʋbʋɔŋ nɛ tabie).”
23Wɩa kʋʋ haasɛ dɩ Lɔt jʋʋ Zʋaa. 24Wɩa leŋ jiribiiŋ chol nyiniŋ, a lɩɩ wɩa-nyuŋ a kʋ tuu dii Sodom arɩ Gomora kala, 25a dii nuhuobiinee arɩ kʋŋ na-kala sɩ hɛ tabala-la balɩamɩŋ tinteeŋ lɛ. 26Lɔt haala daasɛ harɩŋ a bɩrɩmɛ yɩsɩŋ a ŋaa jebiiŋ a chɩŋ.
27Chʋchʋɔ-fɩɛla Abɩraham sii folo mʋ lee-la ʋ fa sɩ chɩŋ La TƖƖNA sɩpaaŋ. 28Ʋ sɩ beŋ Sodom arɩ Gomora tinteeŋ dɩɩrɩŋ, dɩ nyiŋgeliŋ arɩ nyʋɔsʋŋ sii jɩjɩl wɩa-nyuŋ a nagɛ ŋɩɩ hololo a dii fuonaa-la kala.
29A tɩŋ Wɩa sɩ bil nii-la pɩ Abɩraham wɩaa, nyiniŋ dii tasɩ-la kala lɛ Lɔt fa sɩ hɔnɔ aŋ lɩɩsɛ Lɔt ta.
Lɔt arɩ ʋ toloo wɩaa
30Ŋɩɩ nɛ Lɔt arɩ ʋ toloo balɩa-la lɩɩ Zʋaa lɛ a mʋ hɛ peele-la tʋɔŋ a jʋjʋʋ bʋ-bʋa a tɩŋ fawʋllʋŋ sɩ kɛmba wɩaa. 31Tapʋlɩɩ kʋbala ʋ tol-hɩaŋ bʋla pɩ ʋ ŋaana, “La nyɩmma hɩɛsa nɛ, ka baal ma kala tuo sɩ jaŋ jaala dɩ la lʋl biiriŋ. Biiriŋ lʋlʋŋ ŋaa dʋnɩa kala wɩɩ nɛ. 32Leŋ dɩ la pɩ la nyɩmma sɩnɩŋ dɩ ʋ nyʋa bugi, a kɛnla pɩŋ dɩ la to ʋ lɛ kɛŋ biiriŋ dɩ la doho sɩ́ dɛrʋ.”
33Ʋ tɩtaŋɩŋ ba pɩ ba nyɩmma sɩnɩŋ ʋ nyʋa bugi, tol-hɩaŋ jʋʋ ʋ dɩ ʋ nyɩmma pɛ bɔsɔ, ka ʋ nyɩmma bɩ jɩŋ ŋɩɩ ʋ tolo sɩ ŋaa kʋ jʋʋ a bɩra bɩ jɩŋ ŋɩɩ ʋ sɩ ŋaa lɩɩ.
34Ʋ taŋ sɩ pʋla, ŋɩɩ nɛ tol-hɩaŋ-la bʋla pɩ ʋ ŋaana arɩ ʋ dɩ ʋ nyɩmma dɩa pɛ bɔsɔ nɛ. Ʋ sɩ, “Leŋ dɩ la bɩra pʋ sɩnɩŋ jɩnɩŋ tɩtaŋɩŋ dɩ ʋ nyʋa bugi dɩ ŋ ma jʋʋ dɩ ŋ dɩ ʋ pɩŋ. Ŋɩɩ lɛ nɛ la jaŋ to ʋ lɛ a lʋl biiriŋ dɩ la doho sɩ́ dɛrʋ.” 35Ŋɩɩ nɛ ba bɩra leŋ ba nyɩmma nyʋa sɩnɩŋ bugi tɩtaŋɩŋ, tol-bie-la ma bɩra jʋʋ ʋ dɩ ʋ pɛ bɔsɔ, ka ʋ nyɩmma bɩ jɩŋ ŋɩɩ ʋ sɩ ŋaa jʋʋ arɩ ŋɩɩ ʋ sɩ ŋaa lɩɩ.
36Ŋɩɩ nɛ Lɔt tolie-la balɩa kala ŋaa ba nyɩmma lɛ a kɛŋ luoruŋ. 37Ʋ tol-hɩaŋ lʋl hambolibie a hɛ ʋ yɩrɩŋ Mʋab, ʋ nɛ jɩnɩŋ ŋaa Mʋab tɩŋŋaa naabalɩma. 38Ʋ tol-bie ma lʋl hambolibie, a ma hɛ ʋ yɩrɩŋ Bɛŋ-Ami, ʋ ma nɛ ŋaa Amɔŋ tɩŋŋaa naabalɩma jɩnɩmba ŋ-la.",https://www.bible.com/bible/2553/GEN.19.SIS
WƖAA DƖ-SUOMUŊ 20,"Abɩraham arɩ Abɩmɛlɛk
1Ŋɩɩ nɛ Abɩraham sii Mamɩrɛ tɩɩsɩ-la bʋbʋɔŋ ʋ fa sɩ hɔnɔ a mʋ Nɛgɛf tintee-hɩlɩɩ-la lɛ a hɔŋ taŋ-la ba sɩ yɩrɛ Gɛra sɩ hɛ Kadɛs arɩ Suu pɛgɛ. 2Ʋ sɩ yi Gɛra, ʋ bʋl arɩ Sara ŋaa ʋ dɩhaal nɛ. Ŋɩɩ nɛ Gɛra kuoro Abɩmɛlɛk tɩŋ ba mʋ kɛŋ Sara kʋ pʋ.
3Ama Abɩmɛlɛk pɩŋ tɩtaŋɩŋ a duoso na Wɩa, ʋ bʋla pʋ, “Ŋ jaŋ sʋʋ, bɛɛ wɩaa haal-la ŋ sɩ leŋe ba kaa kʋ pɩŋ ŋaa nʋʋ haal nɛ.”
4Ama Abɩmɛlɛk ha bɩ haal-la jɩŋ. Ŋɩɩ nɛ ʋ bʋl, “Mɩ Tɩɩna, ŋ jaŋ sɛɩ kpʋ nɩa sɩ bɩ wɩɩ lɛ jɩŋ? 5Abɩraham tɩtɩa nɛ bʋla arɩ Sara ŋaa ʋ dɩhaal nɛ. Sara ma sɛɩ arɩ ʋ ŋaa ʋ dɩbaal nɛ. Mɩ ŋaa wɩɩŋ deeŋ arɩ tʋɔpʋla nɛ, mɩ bɩ wʋbɔŋ kala bɩɩna.”
6Ŋɩɩ nɛ Wɩa bɩra bʋla pʋ duoso-la tʋɔŋ, “Mɩ jɩma ŋ bɩ wɩɩkala cheye, ŋɩɩ nɛ tɩɩ mɩ bɩ leŋe ŋ digi tolo-la dɩ ŋɩɩ ŋaa wʋbɔŋ. 7Ŋɩɩ wɩaa joŋ haal-la pɩ ʋ bala, ʋ ŋaa mɩ wʋlaabʋllʋ nɛ. Ʋ jaŋ sʋlmɛ pɩŋ dɩ ŋ sɩ́ sʋʋ. Ama dɩ ŋ nɛ vɩa, jɩŋ ma dɩ ŋ nɩaa kala jaŋ sʋʋ.”
8Ʋ taŋ sɩ pʋla chʋchʋɔ-fɩɛla Abɩmɛlɛk sii yɩrɛ ʋ nɩhɩasɩŋ kala kʋ hilimi a bʋl wɩalɩŋ kala sɩ ŋaa a pɩba. Ba sɩ nɩɩ ŋɩɩ, fawʋllʋŋ kɛmba woruŋ. 9Ŋɩɩ nɛ Abɩmɛlɛk yɩrɛ Abɩraham a pɩɛsʋ, “Bɛɛ nɛ tɩɩ ŋ ŋaa wɩɩŋ deeŋ la lɛ? Bɛɛ wɩɩ nɛ mɩ cheyiŋ ŋ lɛrɛ wʋbɔŋ-balɩŋ deeŋ kʋ hɛ mɩ dɩ mɩ nɩaa lɛ? Ŋ ŋaa wɩɩ fa sɩ bɩ maga dɩ ŋ ŋaa nɛ mɩ lɛ.” 10Ŋɩɩ nɛ Abɩmɛlɛk bɩra pɩɛsɛ Abɩraham, “Bɛɛ nɛ tɩɩ ŋ ŋaa ŋ-la?”
11Ŋɩɩ nɛ Abɩraham bʋl, “Mɩ bɩɩna ma bɩ Wɩa ka fá daha, ma jaŋ tɩŋ haal-la wɩaa a kpʋmɛ. 12Dɩ ŋ nɛ bene, ʋ sɛnɛ ŋaa mɩ dɩhaala nɛ, bɛɛ wɩaa ʋ ŋaa mɩ nyɩmma tolo nɛ ama la bɩ naaŋ pɛ. Ŋɩɩ nɛ tɩɩ ʋ ŋaa mɩ haala. 13Wɩa sɩ ŋaa mɩ lɩɩ mɩ nyɩmma dɩa lɛ, mɩ bʋla pɩ mɩ haala Sara, ‘Ŋ-la nɛ ŋ jaŋ dagɛ arɩ ŋ chomi nɛ: Dɩ la nɛ mʋ lee-kala, bʋl mɩ ŋaa ŋ dɩbaal nɛ.’ ”
14Ŋɩɩ nɛ Abɩmɛlɛk kɛsɛ piesee, nɛsɩŋ, baalaa arɩ haalaa sɩ ŋaa yosuŋ a pɩ Abɩraham a pɛ joŋ ʋ haala Sara bɩra pʋ. 15Abɩmɛlɛk bʋla pɩ Abɩraham, “Mɩ tinteeŋ nɛ ŋ-la, hɔŋ lee-la kala ŋ sɩ cho.”
16Ʋ bʋla pɩ Sara, “Mɩ joŋ warɩpʋla bʋɩ nɛ aa pɩ ŋ dɩbaala, ŋɩɩ jaŋ dagɛ ŋ nɩaa arɩ ŋ bɩ wɩɩkala ŋaa chei.”
17Ŋɩɩ nɛ Abɩraham sʋl Wɩa pɩ Abɩmɛlɛk arɩ ʋ haala arɩ ba yoŋ toloo kala ba lʋla suri ba lʋlʋl biiriŋ. 18Wɩa fa leŋe Abɩmɛlɛk dɩa haalaa kala lʋla tɔ nɛ a tɩŋ Abɩraham haala Sara wɩaa.",https://www.bible.com/bible/2553/GEN.20.SIS
