Title,Content,URL
WƖAA DƖ-SUOMUŊ 1,"Wɩaa dɩ-suomuŋ
1Dɩ-suomuŋ Wɩa ŋaa wɩa-nyuŋ arɩ tinteeŋ nɛ. 2Dʋnɩa fa bɩ kʋŋkala naga, ʋ fa pɩŋ hoi nɛ. Leriŋ kala fa bire nɛ, ka Wɩa Dɩma zɩzaarɛ lɩɩŋ nyuŋ.
3Ŋɩɩ nɛ Wɩa bʋl, “Leŋ dɩ pʋlʋmʋŋ chaanɛ,” ŋɩɩ nɛ ʋ chaanɛ. 4Wɩa na pʋlʋmʋŋ zɔmɔ, ʋ kɛŋ pʋlʋmʋŋ arɩ birimiŋ kaa pɔrɛ dɔŋɔ lɛ. 5Ŋɩɩ nɛ Wɩa kɛŋ pʋlʋmʋŋ kaa yɩyɩrɛ wɩɩhɛyɛ aŋ kɛŋ birimiŋ ma yɩyɩrɛ tɩtaŋɩŋ. Wɩa jʋʋ dɩdaanɩŋ, taŋ pʋl chʋchʋɔŋ, chɛ-bumbuŋ nɛ ŋɩɩ.
6Ŋɩɩ nɛ Wɩa bʋl, “Leŋ dɩ lɩɩŋ kpaa balɩa aŋ ka wuoluŋ pɩŋ.” 7Ŋɩɩ nɛ ʋ kpaa, aŋ ka wuoluŋ, dɔŋɔ hɛ nyuŋ, dɔŋɔ ma hɛ bʋbʋɔŋ. 8Wɩa kɛŋ wuol-la sɩ hɛ ba pɛgɛ kaa yɩyɩrɛ wɩa-nyuŋ. Wɩa jʋʋ dɩdaanɩŋ, taŋ pʋl chʋchʋɔŋ, chɛ-lɩamɩŋ nɛ ŋɩɩ.
9Ŋɩɩ nɛ Wɩa bʋl, “Leŋ dɩ lɩɩŋ kala sɩ hɛ bʋbʋɔŋ kʋ hɛ dɔŋɔ lɛ aŋ ka tintee-hɩlɩŋ,” ŋɩɩ nɛ ʋ ŋaa. 10Ŋɩɩ nɛ Wɩa kɛŋ dɩ-hɩlɩɩ-la kaa yɩyɩrɛ tinteeŋ aŋ kɛŋ lɩɩ-la sɩ hɛ bʋbʋɔŋ ma yɩyɩrɛ mʋgʋ-balɩŋ. Wɩa na dɩ ʋ zɔmɔ.
11Ŋɩɩ nɛ Wɩa bʋl, “Leŋ dɩ kʋŋkala sɩɩ nɛŋ, yaŋ arɩ tɩɩsɩŋ, nyʋ.” Ŋɩɩ sɛnɛ ŋaa. 12Ŋɩɩ nɛ yaŋ arɩ tɩɩsɩ-la nyʋ a kɛŋ doho. Ʋ na dɩ ba kala zɔmɔ. 13Wɩa jʋʋ dɩdaanɩŋ, taŋ pʋl chʋchʋɔŋ, chɛ-torimuŋ chɛɛŋ nɛ ŋɩɩ.
14Ŋɩɩ nɛ Wɩa bɩra bʋl, “Leŋ dɩ pʋlʋmʋŋ chaanɛ wɩa-nyuŋ a kɛŋ wɩɩhɛyɛ arɩ tɩtaŋɩŋ pɔrɛ dɔŋɔ lɛ, a magɩlɛ tapʋlaa, chɛnsɩŋ arɩ jɩsɩŋ dɩ-suomuŋ, 15dɩ ba chaanɛ wɩa-nyuŋ dɩ tinteeŋ kɛŋ pʋlʋmʋŋ.” Ŋɩɩ sɛnɛ ŋaa. 16Ŋɩɩ nɛ Wɩa ŋaa pʋlʋŋ balaa balɩa, ba tʋɔŋ kʋbalɩŋ pʋpɔsɛ wɩɩhɛyɛ, ka kʋbie ma pʋpɔsɛ tɩtaŋɩŋ, a ŋaa chɛnwʋlaa ma. 17Wɩa ŋaa pʋlʋŋ bala-la hɛ wɩa-nyuŋ nɛ dɩ ba chɩchaanɛ tinteeŋ, 18dɩ ba pʋpɔsɛ wɩɩhɛyɛ arɩ tɩtaŋɩŋ a kɛŋ pʋlʋmʋŋ arɩ birimiŋ pɔrɛ dɔŋɔ lɛ. Ŋɩɩ nɛ Wɩa na dɩ ba zɔmɔ. 19Wɩa jʋʋ dɩdaanɩŋ, taŋ pʋl chʋchʋɔŋ, chɛ-nɛsɩmɩŋ nɛ ŋɩɩ.
20Ŋɩɩ nɛ Wɩa bʋl, “Leŋ dɩ kɩalɩŋ sɩ jaŋ hɛ lɩɩŋ tʋɔŋ a kɛŋ mɩɩsɩŋ kɔ, dɩ wɩa-nyuŋ fillee maa zaarɛ.” 21Ŋɩɩ nɛ Wɩa ŋaa lɩɩ-jʋʋraa arɩ mʋgʋ-balɩŋ tʋɔŋ kɩaa doho doho arɩ fillee kala sɩ hɛ wɩa-nyuŋ. Wɩa na dɩ ba zɔmɔ. 22Wɩa pɛ ba lɛ aŋ bʋl, “Má pʋŋa su lɩɩŋ kala aŋ ka fillee ma pʋŋa su tinteeŋ.” 23Wɩa jʋʋ dɩdaanɩŋ, taŋ pʋl chʋchʋɔŋ, chɛ-nɔmʋŋ nɛ ŋɩɩ.
24Ŋɩɩ nɛ Wɩa bʋl, “Leŋ dɩ bagɩlaa arɩ pʋsʋŋ kala arɩ kɩalɩŋ kala sɩɩ tuuri tinteeŋ kɛŋ doho.” Ba kala hɛ nɩmɛ a kɛŋ doho. Ŋɩɩ sɛnɛ ŋaa. 25Wɩa sɩ ŋaa ba kala, ʋ tʋɔŋ tɔrɛ ba nyuŋ.
26Ŋɩɩ nɛ Wɩa bɩra bʋl, “Leŋ dɩ la ŋaa nuhuobiine dɩ ʋ nagɛla, a leŋ dɩ ʋ tɩɩ chenfile-la sɩ hɛ mʋgʋ-balɩŋ tʋɔŋ arɩ fille-la kala sɩ hɛ wɩa-nyuŋ arɩ pʋsʋ-la kala sɩ hɛ tinteeŋ arɩ tintee-tuuroo kala.”
27Ŋɩɩ nɛ Wɩa ŋaa nuhuobiinee ba nagʋ,
baal arɩ haal.
28Wɩa pɛ ba lɛ aŋ bʋla pɩba, “Má kɛŋ doho a pʋŋa su tinteeŋ, má tɩɩ kʋŋ na-kala sɩ hɛ mʋgʋ-balɩŋ arɩ fille-la kala sɩ hɛ wɩa-nyuŋ arɩ kɩalɩŋ kala sɩɩ tuuri tinteeŋ.”
29Ŋɩɩ nɛ Wɩa bʋl, “Mɩ joŋ kʋnɛnɛɛ arɩ tɩɩnɛnɛɛ kala pɩma nɛ, ba jaŋ ŋaa ma kʋdiilee. 30Mɩ joŋ pɩpaarɩŋ arɩ yaŋ a pɩ bagɩlaa, pʋsʋŋ, tinteeŋ tuuroo arɩ fillee kala sɩ hɛ wɩa-nyuŋ. Kɩalɩŋ kala sɩɩ wiesu, kɩaa deemba nɛ jaŋ ŋaa ba kʋdiilee. Ŋɩɩ sɛnɛ ŋaa.”
31Ŋɩɩ nɛ Wɩa bee na kɩalɩŋ kala ʋ sɩ ŋaa dɩ ba zɔmɔ woruŋ. Ŋɩɩ nɛ wɩa jʋʋ dɩdaanɩŋ, taŋ pʋl chʋchʋɔŋ, chɛ-dʋmʋŋ nɛ ŋɩɩ.",https://www.bible.com/bible/2553/GEN.1.SIS
WƖAA DƖ-SUOMUŊ 2,"1Ŋɩɩ nɛ ʋ ŋaa tinteeŋ arɩ wɩa-nyuŋ arɩ kɩalɩŋ kala sɩ hɛ ba lɛ dɛrɛ.
2Ŋɩɩ nɛ Wɩa dɛrɛ ʋ tɩntɩŋŋaa aŋ wiesi chɛ-pɛmɩŋ. 3Wɩa joŋ ʋ nɩsɩŋ daŋ tapʋl-pɛɩ-la lɛ a leŋ ʋ ŋaa tapʋl-zɔŋ, bɛɛ wɩaa tapʋlɩɩ-la nɛ ʋ tɩŋ ʋ tɩntɩŋŋaa dɛrɛ aŋ wiesi.
Adam arɩ Hawa
4Wɩa-nyuŋ arɩ tinteeŋ ŋaanɩŋ naasɩŋ nɛ ŋɩɩ.
La TƖƖNA Wɩa fa sɩ ŋaa wɩa-nyuŋ arɩ tinteeŋ, 5tɩɩsɩŋ, yaŋ arɩ kʋŋkala sɩɩ nyʋ tinteeŋ lɛ fa tuo, bɛɛ wɩaa La TƖƖNA Wɩa fa ha bɩ leŋe duonuŋ nɩɩ. Nʋʋ ma kala fa tuo dɩ ʋ pɛrɛ tintee-la lɛ, 6ama lɩɩŋ bulo lɩɩ tinteeŋ nɛ a su leriŋ kala. 7La TƖƖNA Wɩa lɔgɛ tɩɛrɩŋ nɛ a mɛ nuhuobiine aŋ wiese hɛ ʋ mɩɩ-boiŋ lɛ, ʋ kɛŋ mɩɩsɩŋ a wei.
8Bʋa-la lɛ La TƖƖNA Wɩa keri ŋmaŋkaaŋ nɛ a joŋ baal-la ʋ sɩ mɛ a hɛ nɩmɛ. Lee-la yɩrɩŋ nɛ Ɛdɩŋ, a hɛ wɩɩpɔsʋŋ dɩɩrɩŋ. 9Ŋɩɩ nɛ La TƖƖNA Wɩa leŋ tɩɩ-doho kala nyʋ a nɛŋ nɛnɛɛ sɩ zɔmɔ sɩɩŋ lɛ, a zɔŋ arɩ diiniŋ ma. Ŋmaŋkaa-la tʋtʋɔbaanɩŋ nɛ tɩa-la nɛnɛɛ sɩɩ pɩ mɩɩsɩŋ arɩ tɩa-la nɛnɛɛ ma sɩ jaŋ leŋ dɩ ŋ jɩŋ wʋzɔŋŋɔɔ arɩ wʋbɔŋŋɔɔ bʋa kala chɩŋ.
10Fuoŋ nɛ fa hɛ Ɛdɩŋ lɛ a pɛllɛ jʋjʋʋ ŋmaŋkaa-la tʋɔŋ, a mʋ kpaa fuonaasɩŋ banɛsɛ. 11Fuo-naasɩ-la dɔŋɔ yɩrɩŋ nɛ Pɩsɔŋ. Ʋ pɛllɛ golli Havɩla tinteeŋ kala nɛ, lee-la sɛlɩmɛ sɩ hɛ. 12(Nɩmɛ sɛlɩmɛ chaasa zɔŋ nɛ woruŋ, aŋ pɛ kɛŋ tabɩɩ-tʋlaa.) 13Fuonaa-kel-lɩa-la yɩrɩŋ nɛ Gɩhɔŋ. Ʋ nɛ golli Kus tinteeŋ kala. 14Fuonaa-kel torimuŋ nɛ Tɩgɩrɩs, ʋ nɛ pɛllɛ to Asiiria tinteeŋ wɩɩpɔsʋŋ. Fuonaa-kel nɛsɩmɩŋ nɛ ŋaa Yufireti.
15La TƖƖNA Wɩa joŋ baal-la hɛ ŋmaŋkaa-la tʋɔŋ nɛ Ɛdɩŋ tinteeŋ lɛ dɩ ʋ pɛrɛ aŋ bibeŋ ʋ nyuŋ. 16Ŋɩɩ nɛ La TƖƖNA Wɩa bʋla pɩ baal-la, “Ŋ jaŋ wuo didii tɩɩ-nɛŋ kala sɩ hɛ ŋmaŋkaa-la tʋɔŋ, 17ama ʋ bɩ maga dɩ ŋ dii tɩa-la nɛnɩŋ sɩ jaŋ leŋ dɩ ŋ jɩŋ wʋzɔmʋŋ arɩ wʋbɔmʋŋ bʋa, dɩ ŋ nɛ die, ŋ jaŋ sʋʋ.”
18La TƖƖNA Wɩa sɩ, “Ʋ bɩ zɔŋ dɩ baala dʋndʋŋa hɛ nɩmɛ. Mɩ jaŋ ŋaa nʋʋ sɩ jaŋ wuo pɩpɛ ʋ lɛ.”
19Bʋa-la lɛ dɩ La TƖƖNA Wɩa lɔgɛ tɩɛrɩŋ a mɛ bagɩlaa arɩ pʋsʋŋ arɩ fillee kala sɩ hɛ wɩa-nyuŋ. Ŋɩɩ nɛ Wɩa kɛmba kala kaa kɔ baal-la teeŋ dɩ ʋ hɛ ba yɩraa. Baal-la yɩrɩŋ nɛ Adam. Yɩrɩ na-kala Adam sɩ hɛ pɩ kʋŋkala, ʋ yɩrɩŋ nɛ ŋɩɩ arɩ jɩnɩŋ. 20Ŋɩɩ nɛ Adam hɛ yɩraa pɩ pʋsʋŋ arɩ bagɩlaa arɩ fillee kala.
Ama kɩaa deemba kʋŋkala bɩ baala lɛ wuo pɛ woruŋ. 21Ŋɩɩ nɛ La TƖƖNA Wɩa leŋ Adam pɩŋ doŋ a yuo naaŋ. Ʋ sɩ pɩŋ doŋ ŋɩɩ, Wɩa lɩɩsɛ ʋ sɛmpɛrɩ-biiŋ dɔŋɔ aŋ kɛŋ lee-la tɔ. 22Ŋɩɩ nɛ La TƖƖNA Wɩa kɛŋ sɛmpɛrɩ-bii-la ʋ sɩ lɩɩsa Adam lɛ a ŋaa haala a kaa kʋ pʋ.
23Ŋɩɩ nɛ Adam sɩ,
“Mɩ haŋgbeliŋ dɔŋɔ arɩ mɩ nammɩa sɛmɛ dɔŋɔ nɛ ŋ-la,
mɩ jaŋ yɩrʋ haala, bɛɛ wɩaa ʋ lɩɩ mɩ lɛ nɛ.”
24Ŋɩɩ nɛ tɩɩ baala yie leŋ ʋ naaŋ arɩ ʋ nyɩmma aŋ ka ʋ dɩ ʋ haala mɛrɛ dɔŋɔ lɛ a ŋaa kʋbala.
25Baal-la arɩ ʋ haal-la kala fa kɛŋ yarɩ-biree nɛ, ka hɩɩsɩŋ bɩ ba kɛnɛ.",https://www.bible.com/bible/2553/GEN.2.SIS
WƖAA DƖ-SUOMUŊ 3,"Nuhuobiine ŋaa wʋbɔŋŋɔɔ
1Dɩmɩŋ nɛ fa kɛŋ wʋjɩmɩŋ a kɩɩ pʋsʋ-la kala La TƖƖNA Wɩa sɩ ŋaa. Ʋ pɩɛsɛ haal-la, “Wɩa sɛnɛ sɩ má sɩ́ tɩa-la sɩ hɛ ŋmaŋkaaŋ deeŋ tʋɔŋ nɛnɛɛ dii nɛɛ?”
2Haal-la bʋla pʋ, “Laa dii tɩɩnɛnɛ-la kala nɛ, 3ama ŋmaŋkaa-la tʋtʋɔbaanɩŋ tɩa-la nɛnɛɛ Wɩa sɩ la sɩ́ dii nɛ, la sɩ́ digi ma, dɩ la nɛ dige, la jaŋ sʋʋ.”
4Ŋɩɩ nɛ dɩŋ-la bʋla pɩ haal-la, “Ma sɛnɛ bɩ jaŋ sʋʋ. 5Wɩa jɩma dɩ ma nɛ die, ma sɩaa jaŋ polli dɩ ma nagɛ ʋ-na Wɩa, a jɩŋ wʋzɔŋŋɔɔ arɩ wʋbɔŋŋɔɔ bʋa.”
6Ŋɩɩ nɛ haal-la beŋ a na tɩa-la nɛnɛɛ dɩ ba zɔmɔ sɩɩŋ lɛ, aŋ zɔŋ arɩ diiniŋ ma aŋ bɩra cho dɩ ʋ kɛŋ wʋjɩmɩŋ. Ʋ tɔrɔ dii, aŋ tɔrɔ pɩ ʋ bala ma ʋ dii. 7Ba dii tɩa-la nɛnɩŋ dɛrɛ, ba sɩaa polli, ba na arɩ ba kɛŋ yarɩ-biree. Ba kɛŋ kanchal-pɩpaarɩŋ pɛ dɔŋɔ a kaa tɔ ba yaraa.
8Ʋ dɩdaanɩŋ sɩ yie, ba nɩɩ La TƖƖNA Wɩa naagime ŋmaŋkaa-la tʋɔŋ. Ba mʋ faa tɩɩsɩŋ bʋbʋɔŋ. 9Ŋɩɩ nɛ La TƖƖNA Wɩa yɩrɛ baal-la a bʋl, “Nɩɩ nɛ ŋ hɛ?”
10Ŋɩɩ nɛ Adam bʋl, “Mɩ nɩɩ ŋ naagime nɛ ŋmaŋkaaŋ tʋɔŋ, fawʋllʋŋ kɛmmɛ mɩ faa, bɛɛ wɩaa mɩ kɛŋ yarɩ-biree nɛ.”
11Ŋɩɩ nɛ Wɩa pɩɛsʋ, “Ŋ ŋɩɩ nɛ jɩŋ arɩ ŋ kɛŋ yarɩ-biree nɛ? Ŋ dii tɩa-la nɛnɩŋ mɩ sɩ sɩ ŋ sɩ́ dii nɛɛ?”
12Ŋɩɩ nɛ Adam bʋl, “Haal-la ŋ sɩ joŋo pɛ mɩ lɛ, ʋ nɛ tɔrɛ tɩɩnɛŋ-la pɩmɛ mɩ dii.” 13Ŋɩɩ nɛ La TƖƖNA Wɩa pɩɛsɛ haal-la, “Bɛɛ nɛ ŋ ŋaa ŋ-la?”
Ʋ sɩ, “Dɩmɩŋ nɛ nyɩsɛmɛ mɩ dii tɩɩnɛŋ-la.”
14Ŋɩɩ nɛ La TƖƖNA Wɩa ŋmɩɛsa hɛ dɩmɩŋ lɛ a bʋl, “A tɩŋ ŋ sɩ ŋaa wɩɩŋ deeŋ,
pʋsʋŋ arɩ baga kɩaa kala tʋɔŋ,
ŋ nɛ jaŋ tuuri ŋ luoruŋ nyuŋ
a dii hagɩla ŋ mɩɩsɩŋ kala lɛ.
15Mɩ jaŋ joŋ dʋndɔnnʋŋ hɛ ŋ dɩ haal-la pɛgɛ.
Ŋ biiriŋ arɩ ʋ biiriŋ jaŋ ŋaa dʋndɔmɔ.
Adam doho nʋʋ jaŋ ŋmoo ŋ nyuŋ yɛrɛ,
ka dɩ ŋ ma ta ʋ naatilimiŋ lɛ.”
16Ŋɩɩ nɛ aŋ bɩra bʋla pɩ haal-la ma,
“Mɩ jaŋ leŋ dɩ ŋ na hɛɛŋ biiriŋ lʋlʋŋ lɛ.
Dɩ ŋ nɩɩ lʋl, ŋ hɛɛŋ jaŋ yʋga pɛ.
Ama ŋ ha jaŋ hɩhɩɛnɛ ŋ bala
ʋ jaŋ kɛŋ doluŋ ŋ nyuŋ.”
17Wɩa bɩra bʋla pɩ Adam ma, “Ŋ sɩ jegile nɩɩ ŋ haala niiŋ a dii tɩɩnɛŋ-la mɩ sɩ sɩ ŋ sɩ́ dii,
mɩ kalɩba hɛ tinteeŋ lɛ nɛ a tɩŋ ŋ wɩaa.
Ŋ mɩɩsɩŋ kala lɛ ŋ jaŋ tɩma suoli aŋ-na dii.
18Sɔsʋŋ arɩ yaŋ jaŋ nyʋ tinteeŋ,
ŋ jaŋ tɩŋ a suoli aŋ-na wuo na kʋdiilee a dii.
19Ŋ jaŋ kpɩɩnɛ suoluŋ
aŋ na kʋdiilee halɩɩ a mʋ sʋʋ.
Tɩɛrɩŋ nɛ mɩ kaa mɛŋ,
ŋ jaŋ bɩra bɩrɩmɛ tɩɛrɩŋ.”
20Adam hɛ ʋ haala yɩrɩŋ Hawa, ʋ nɛ ŋaa nʋʋkala nahɩma.
21La TƖƖNA Wɩa kɛŋ teniŋ yɛrɛ gɛnnɩŋ a pɩ Adam arɩ ʋ haala Hawa ba kaa tɔ ba hɩɩsɩŋ. 22Ŋɩɩ nɛ La TƖƖNA Wɩa bʋl, “Baala deeŋ lɛɛlɛ nagɛ la nɛ. Ʋ jɩŋ wʋzɔmʋŋ bʋa nɛ. Ʋ bɩ maga dɩ ʋ tɔrɛ tɩa-la sɩɩ pɩ mɩɩsɩŋ nɛnɩŋ dii a sɩ́ sʋʋ.” 23Ŋɩɩ nɛ La TƖƖNA Wɩa kiri Adam arɩ ʋ haala ta ŋmaŋkaa-la sɩ hɛ Ɛdɩŋ tinteeŋ lɛ, dɩ Adam lɩɩ pɩpɛrɛ tintee-la Wɩa sɩ lɔgɔ mɛʋ lɛ. 24Ʋ sɩ kiri Adam ta ʋ lɩɩ ŋɩɩ, ʋ leŋ Wɩa tɩndaara sɩ kɛŋ kɩŋkɛnsɩŋ a kori tokobiiŋ sɩɩ chol nyiniŋ a hɛ Ɛdɩŋ wɩɩpɔsʋŋ dɩɩrɩŋ a vivilli, a pɔ nʋʋkala sɩ́ tɩa-la sɩɩ pɩ mɩɩsɩŋ kpagʋ.",https://www.bible.com/bible/2553/GEN.3.SIS
WƖAA DƖ-SUOMUŊ 4,"Keeŋ arɩ Abɛl
1Adam pɩŋ ʋ haala Hawa ʋ kɛŋ luoruŋ a lʋl hambolibie, ba hɛ ʋ yɩrɩŋ Keeŋ. Ŋɩɩ nɛ Hawa bʋl, “Mɩ Tɩɩna Wɩa pɛ mɩ lɛ nɛ mɩ lʋl hambolibie.” 2Ʋ harɩŋ nɛ ʋ bɩra lʋl Keeŋ ŋaana Abɛl.
Abɛl waa aa daa piesee aŋ ka Keeŋ ma waa a ŋaa paarʋ. 3Tapʋlɩɩ kʋbala Keeŋ kɛŋ ʋ baga kʋdiilee dɔnsʋŋ kʋ ŋaa Wɩɩsʋlʋŋ pɩ La TƖƖNA. 4Abɛl ma kɛŋ ʋ piesee dɔŋɔ sɩ lʋl pie-kee bumbuŋ a kpʋ a joŋ nammɩa-la lere-la sɩ zɔmɔ a ŋaa Wɩɩsʋlʋŋ. La TƖƖNA tʋɔŋ tɔrɛ Abɛl Wɩɩsʋlɩɩ-la nyuŋ, 5ama ʋ tʋɔŋ bɩ Keeŋ arɩ ʋ kɩaa nyuŋ tɔrɔ. Ŋɩɩ nɛ Keeŋ faasa na baanɩŋ a kɛŋ sɩaa chei.
6La TƖƖNA pɩɛsɛ Keeŋ, “Bɛɛ nɛ tɩɩ ŋ na baanɩŋ a kɛŋ ŋ sɩaa chei? 7Dɩ ŋ nɛ fa ŋaa woruŋ, mɩ fa bɩŋ ka laa? Aŋ ka ŋ sɩ bɩ woruŋ ŋaa, wʋbɔmʋŋ chɩna gbɛrɩŋ nɛ a chɩchɛ dɩ ʋ kɛnɩŋ. Ʋ maga dɩ ŋ yuo diiu nɛ.”
8Ŋɩɩ nɛ Keeŋ bʋla pɩ ʋ ŋaana Abɛl, “Leŋ dɩ la mʋ gɩrɩŋ.” Ba sɩ mʋ gɩrɩŋ, Keeŋ gurigi ʋ ŋaana Abɛl a kpʋʋ.
9Ŋɩɩ nɛ La TƖƖNA pɩɛsɛ Keeŋ, “Nɩɩ nɛ ŋ ŋaana Abɛl hɛ?”
Keeŋ sɩ, “Mɩ bɩ jɩŋ. Mɩ nɛ maga dɩ mɩ pɔ mɩ ŋaanaa?”
10Ŋɩɩ nɛ La TƖƖNA pɩɛsɛ, “Bɛɛ nɛ ŋ ŋaa ŋ-la? Jegili, ŋ ŋaana chalɩŋ nɛ pɩŋ tinteeŋ a bunsoo pɩmɛ. 11A lɩɩ jɩnɩŋ mɩ ŋmɩɛsa hɛ ŋ lɛ nɛ, ŋ kiri ŋ tɩtɩa nɛ tintee-la lɛ. A tɩŋ ŋ ŋaana chalɩŋ sɩ jaasa wɩaa, ŋ chei lee-la nɛ. 12Dɩ ŋ nɛ pɛrɛ kɩaa, ba bɩra bɩ wasɛ. Ŋ jaŋ ŋaa nɩgɔllɔ baarɩ tinteeŋ deeŋ lɛ.”
13Ŋɩɩ nɛ Keeŋ bʋla pɩ La TƖƖNA Wɩa, “Ŋ dɔgɩsɛmɛ kieli nɛ. 14Jɩnɩŋ ŋ kirimi tintee-la lɛ, a kirimi ŋ sɩpaaŋ mɩ gɔllɔɔ baarɛ, dɩ nʋʋkala nɛ namɛ, ʋ jaŋ wuo kpʋmɛ.”
15Ŋɩɩ nɛ La TƖƖNA bʋl, “Ŋɩɩ dee, dɩ nʋʋ nɛ lɩɩsɛ ŋ mɩɩsɩŋ, tɩɩna nɩaa balɩpɛ jaŋ sʋʋ ŋɩɩ nyuŋ lɛ.” Ŋɩɩ nɛ Wɩa hɛ Keeŋ magɩlɩŋ, dɩ nʋʋ nɛ naʋ, dɩ ʋ sɩ́ ʋ kpʋ. 16Ŋɩɩ nɛ Keeŋ sʋʋsa lɩɩ Wɩa sɩpaaŋ a mʋ hɛ Nɔd tinteeŋ, Ɛdɩŋ wɩɩpɔsʋŋ dɩɩrɩŋ.
17Keeŋ pɩŋ ʋ haala ʋ kɛŋ luoruŋ a lʋl Ɛnɔk. Ŋɩɩ nɛ Keeŋ saa tabal a joŋ ʋ nanʋala Ɛnɔk yɩrɩŋ hɛ pɩ taŋ-la. 18Ɛnɔk ma lʋl hambolibie a hɛ ʋ yɩrɩŋ Irad, Irad ma lʋl Mɛhʋjal, Mehujal ma nɛ lʋl Mɛtʋsal, Mɛtʋsal ma lʋl Lamɛk.
19Lamɛk jaa haalaa balɩa, Ada arɩ Zila. 20Ada lʋl Jabal, ʋ doho nɩaa nɩɩ jʋʋ lɛŋŋɛɛ aa dɩɛsɛ pʋsʋŋ. 21Ʋ naambie yɩrɩŋ nɛ Jubal, ba doho nɩaa nɛ ŋaa nɩalɩŋ sɩɩ ŋmʋʋ ŋmʋlaa aŋ pɛ dudu chenniŋ. 22Zila ma lʋl hambolibie, ʋ yɩrɩŋ nɛ Tubal-Keeŋ. Ʋ sii ŋaa libiru. Ʋ dɩhaala yɩrɩŋ nɛ Naama.
23Ŋɩɩ nɛ Lamɛk bʋla pɩ ʋ haalaa Ada arɩ Zila,
“Má jegili mɩ teeŋ woruŋ.
Baal nɛ bolimimi, mɩ kpʋʋ.
Nʋʋ ma pɩrɩmɛ, mɩ kpʋʋ.
24Dɩ nʋʋ nɛ kpʋ Keeŋ, dɩ ʋ nɩaa balɩpɛ sʋʋ ŋɩɩ nyuŋ lɛ,
ŋɩɩ-na dɩ nʋʋ nɛ kpʋ mɩ-na Lamɛk,
ʋ nɩaa mahɩŋ batori arɩ fii arɩ balɩpɛ jaŋ sʋʋ.”
25Adam bɩra pɩŋ ʋ haala Hawa ʋ lʋl hambolibie a hɛ ʋ yɩrɩŋ Sɛf. Ŋɩɩ nɛ Hawa bʋl, “Wɩa bɩra joŋ baal nɛ hɛ Abɛl nyuŋ, Keeŋ sɩ kpʋ nɩɩ-la.” 26Sɛf ma sii lʋl hambolibie a hɛ ʋ yɩrɩŋ Ɛnɔs.
Bʋa-la lɛ nɛ nɩaa suomo yɩrɛ La TƖƖNA yɩrɩŋ.",https://www.bible.com/bible/2553/GEN.4.SIS
WƖAA DƖ-SUOMUŊ 5,"A chɩŋ Adam doho nɩaa lɛ a mʋ yi Nowa
1Adam doho nɩaa naasɩŋ nɛ ŋ-la.
Wɩa sɩ ŋaa nuhuobiine, ʋ ŋaaʋ ʋ nagɛ ʋ-na Wɩa tɩtɩa nɛ. 2Ʋ ŋaa baal arɩ haal nɛ a pɛ ba lɛ. Bʋa-la lɛ ʋ sɩ ŋaaba nɛ ʋ yɩrɛba “nuhuobiinee.”
3Adam sɩ hɛ nɩmɛ a yi jɩsɩŋ zɔlɔ arɩ mara arɩ fii, ʋ bɩra lʋl hambolibie, ʋ nagʋ woruŋ. Ʋ hɛ ʋ yɩrɩŋ Sɛf. 4Adam sɩ lʋl Sɛf, ŋɩɩ harɩŋ, ʋ hɛ ʋ mɩɩsɩŋ lɛ jɩsɩŋ zɔlɔ chori nɛ aŋ bɩra lʋl baalaa arɩ haalaa dɔnsʋŋ ma. 5Ʋ hɛ ʋ mɩɩsɩŋ lɛ jɩsɩŋ zɔlɔ nibi arɩ mara arɩ fii nɛ, aŋ-na sʋʋ.
6Sɛf ma hɛ ʋ mɩɩsɩŋ lɛ jɩsɩŋ zɔlɔ arɩ banɔŋ nɛ aŋ lʋl Ɛnɔs. 7Sɛf sɩ lʋl Ɛnɔs harɩŋ, ʋ hɛ nɩmɛ jɩsɩŋ zɔlɔ chori arɩ balɩpɛ nɛ, aŋ ma lʋl baalaa arɩ haalaa dɔnsʋŋ. 8Sɛf ma hɛ ʋ mɩɩsɩŋ lɛ jɩsɩŋ zɔlɔ nibi arɩ fii arɩ balɩa nɛ aŋ-na sʋʋ.
9Ɛnɔs yi jɩsɩŋ mahɩŋ banɛsɛ arɩ fii nɛ aŋ lʋl Kenaŋ. 10Ɛnɔs sɩ lʋl Kenaŋ, ʋ hɛ nɩmɛ jɩsɩŋ zɔlɔ chori arɩ fii arɩ banɔŋ nɛ aŋ ma lʋl baalaa arɩ haalaa dɔnsʋŋ. 11Ɛnɔs ŋaa jɩsɩŋ zɔlɔ nibi arɩ banɔŋ nɛ ʋ mɩɩsɩŋ lɛ, aŋ-na sʋʋ.
12Kenaŋ ŋaa jɩsɩŋ mahɩŋ batori arɩ fii nɛ aŋ lʋl Mahalalɛl. 13Kenaŋ sɩ lʋl Mahalalɛl, ʋ hɛ ʋ mɩɩsɩŋ lɛ jɩsɩŋ zɔlɔ chori arɩ mahɩŋ balɩa nɛ aŋ ma lʋl baalaa arɩ haalaa dɔnsʋŋ. 14Kenaŋ hɛ ʋ mɩɩsɩŋ lɛ jɩsɩŋ zɔlɔ nibi arɩ fii nɛ aŋ sʋʋ.
15Mahalalɛl ŋaa jɩsɩŋ mahɩŋ batori arɩ banɔŋ nɛ aŋ lʋl Jarɛd. 16Mahalalɛl sɩ lʋl Jarɛd, ʋ ŋaa jɩsɩŋ zɔlɔ chori arɩ mara arɩ fii nɛ aŋ bɩra lʋl baalaa arɩ haalaa dɔnsʋŋ. 17Mahalalɛl hɛ ʋ mɩɩsɩŋ lɛ jɩsɩŋ zɔlɔ chori arɩ mahɩŋ banɛsɛ arɩ fii arɩ banɔŋ nɛ aŋ-na sʋʋ.
18Jarɛd ŋaa jɩsɩŋ zɔlɔ arɩ mahɩŋ batori arɩ balɩa nɛ aŋ-na lʋl Ɛnɔk. 19Jarɛd sɩ lʋl Ɛnɔk, ʋ ŋaa jɩsɩŋ zɔlɔ chori nɛ aŋ ma lʋl baalaa arɩ haalaa dɔnsʋŋ. 20Jarɛd hɛ ʋ mɩɩsɩŋ lɛ jɩsɩŋ zɔlɔ nibi arɩ mahɩŋ batori arɩ balɩa nɛ aŋ-na sʋʋ.
21Ɛnɔk ma yi jɩsɩŋ mahɩŋ batori arɩ banɔŋ nɛ aŋ lʋl Mɛtʋsɛla. 22Ɛnɔk sɩ lʋl Mɛtʋsɛla, ʋ ha to Wɩa wombiiŋ a yi jɩsɩŋ zɔɔ-batori nɛ aŋ ma lʋl baalaa arɩ haalaa dɔnsʋŋ. 23Ɛnɔk hɛ ʋ mɩɩsɩŋ lɛ jɩsɩŋ zɔɔ-batori arɩ mahɩŋ batori arɩ banɔŋ nɛ. 24Ɛnɔk to Wɩa wombiiŋ ŋɩɩ nɛ halɩɩ a mʋ tuo. Wɩa nɛ joŋu viiri.
25Mɛtʋsɛla ŋaa jɩsɩŋ zɔlɔ arɩ mahɩŋ banɛsɛ arɩ balɩpɛ nɛ aŋ-na lʋl Lamɛk. 26Mɛtʋsɛla sɩ lʋl Lamɛk, ʋ yi jɩsɩŋ zɔɔ-balɩpɛ arɩ mahɩŋ banɛsɛ arɩ balɩa nɛ aŋ bɩra lʋl baalaa arɩ haalaa dɔnsʋŋ. 27Mɛtʋsɛla ŋaa jɩsɩŋ zɔlɔ nibi arɩ mahɩŋ batori arɩ nibi nɛ aŋ sʋʋ.
28Lamɛk yi jɩsɩŋ zɔlɔ arɩ mahɩŋ banɛsɛ arɩ balɩa nɛ aŋ lʋl hambolibie. 29Ʋ hɛ ʋ yɩrɩŋ Nowa aŋ bʋl, “Wɩa fa ŋmɩɛsa hɛ tinteeŋ lɛ nɛ dɩ la tɩma suoli aŋ-na dii. Bie deeŋ nɛ jaŋ leŋ dɩ la tʋɔŋ pɩŋ dɩ-bala.” 30Lamɛk sɩ lʋl Nowa, ʋ ŋaa jɩsɩŋ zɔɔ-banɔŋ arɩ mahɩŋ banɛsɛ arɩ fii arɩ banɔŋ nɛ, aŋ-na lʋl baalaa arɩ haalaa dɔnsʋŋ. 31Lamɛk ŋaa jɩsɩŋ zɔɔ-balɩpɛ arɩ mahɩŋ batori arɩ fii arɩ balɩpɛ nɛ aŋ sʋʋ.
32Nowa ŋaa jɩsɩŋ zɔɔ-banɔŋ nɛ aŋ-na lʋl Sɛm, Ham arɩ Jafɛf.",https://www.bible.com/bible/2553/GEN.5.SIS
WƖAA DƖ-SUOMUŊ 6,"Lɩɩŋ su dʋnɩa
1Baalaa sɩ kʋ pʋŋa yʋgɛ dʋnɩa lɛ, ba lʋl hantolibiisiŋ ma pɛ. 2Wɩa bii-baalaa na dɩ hantolibiisi-la zɔmɔ, ba jaa nɩalɩŋ ba sɩ cho. 3Ŋɩɩ nɛ La TƖƖNA bʋl, “Mɩ bɩ jaŋ leŋ dɩ mɩ Dɩma-la hɛ nuhuobiine lɛ deeŋ deeŋ. Ʋ yaraa wʋŋaalaa nɛ ʋ tuto. Ʋ jɩsɩŋ jaŋ ŋaa zɔlɔ arɩ mara.”
4Bʋa-la lɛ nɩwaayiilee fa hɛ dʋnɩa lɛ arɩ ŋɩɩ harɩŋ. Wɩa bii-baalaa kɛŋ nuhuobiinee toloo lʋl biiriŋ. Ba nɛ fa ŋaa nyuŋ tɩŋŋaa a kɛŋ yɩrɩŋ.
5La TƖƖNA na ŋɩɩ nuhuobiine tʋɔŋ sɩ hɛyɛ dʋnɩa tʋɔŋ, ʋ tʋɔbɩɩnaa ma kala lɔrɛ bʋa na-kala. 6Ʋ tʋɔŋ chei arɩ ʋ sɩ ŋaa nuhuobiine ʋ hɛ dʋnɩa lɛ a ŋɩŋaa wʋbɔŋŋɔɔ. Wɩɩ-la wɩɩʋ woruŋ. 7Ŋɩɩ nɛ La TƖƖNA bʋl, “Mɩ jaŋ chei kʋŋkala sɩ hɛ dʋnɩa lɛ a kɛŋ mɩɩsɩŋ, nuhuobiinee, pʋsʋŋ arɩ baga kɩaa, kɩalɩŋ sɩɩ tuuri tinteeŋ arɩ zaaraa, mɩ tʋɔŋ cheye nɛ mɩ sɩ ŋaaba.” 8Ama Wɩa tʋɔŋ tɔrɛ Nowa-na nyuŋ nɛ.
9Ŋ-la nɛ Nowa fa nagɛ: Ʋ fa ŋaa tʋɔpʋl tɩɩna nɛ Wɩa teeŋ a bɩ wɩɩkala ma cheye ʋ nɩaa tʋɔŋ. Ʋ to Wɩa wombiiŋ nɛ woruŋ. 10Nowa fa lʋl hambolibiisiŋ batori nɛ, ba yɩraa nɛ Sɛm, Ham arɩ Jafɛf.
11Wɩa na dɩ dʋnɩa suo arɩ wʋbɔŋŋɔɔ arɩ yuosuŋ. 12Ʋ na dɩ dʋnɩa cheye nɛ, bɛɛ wɩaa nʋʋkala ka ŋaa wʋbɔŋŋɔɔ nɛ. 13Ŋɩɩ nɛ Wɩa bʋla pɩ Nowa, “Mɩ jaŋ kpʋ dʋnɩa nʋʋkala, bɛɛ wɩaa dʋnɩa suo nɛ arɩ ba wʋbɔŋŋɔɔ ŋaanɩŋ. Mɩ sɛnɛ jaŋ cheiba arɩ dʋnɩa kʋŋkala. 14Ŋɩɩ wɩaa kɛŋ kanchal daaŋ kpaasɛ lɩɩŋ daboro dɩ ʋ ŋaa dɩa a kɛŋ tʋɔŋ kpaa dɩɩsɩŋ a kɛŋ keliŋ taarɛ ʋ tʋɔŋ arɩ harɩŋ kala dɩ lɩɩŋ sɩ́ jʋʋ. 15Leŋ dɩ ʋ duomuŋ ŋaa naakieliŋ zɔlɔ arɩ mahɩŋ balɩa arɩ fii, dɩ ʋ jalɩŋ ma ŋaa naakieliŋ mahɩŋ balɩa arɩ fii, dɩ ʋ leŋiŋ ma ŋaa naakieliŋ mara arɩ fii. 16Tɔ lɩɩŋ daboro-la nyuŋ aŋ hɛ viise dɩ ʋ magɛ vama bʋlɩa aŋ hɛ boro sɛmɛ lɛ a leŋ dɩ ʋ ŋaa dɩɩsɩŋ batori a sugili dɔŋɔ lɛ. 17Mɩ jaŋ leŋ dɩ lɩɩ-balɩŋ kʋ tɔ tinteeŋ kala, a kpʋ kʋŋkala sɩ kɛŋ mɩɩsɩŋ. Kʋŋ na-kala sɩ hɛ dʋnɩa lɛ jaŋ sʋʋ. 18Ama mɩ jaŋ bil niiŋ mɩ dɩŋ pɛgɛ. Kɛŋ ŋ haala, ŋ biiriŋ, arɩ ŋ bii-haalaa, dɩ ma kala jʋʋ lɩɩŋ daboro-la. 19Pɛ kɛŋ kʋŋkala sɩɩ wiesu balɩa, bele arɩ nɩɩŋ kaa jʋʋ lɩɩŋ daboro-la dɩ ba sɩ́ sʋʋ. 20Kɛŋ filli na-kala doho balɩa a kɛŋ pʋsʋŋ arɩ baga kɩaa doho-na kala balɩa arɩ tinteeŋ tuuroo ma doho kala balɩa jʋʋ lɩɩŋ daboro-la dɩ ba kɛŋ mɩɩsɩŋ. 21Kɛŋ kʋdiil na-kala doho kaa jʋʋ dɩ ba ŋaa ma kala kʋdiilee.”
22Ŋɩɩ nɛ Nowa ŋaa wɩalɩŋ kala Wɩa sɩ sɩ ʋ ŋaa.",https://www.bible.com/bible/2553/GEN.6.SIS
WƖAA DƖ-SUOMUŊ 7,"1Ŋɩɩ nɛ La TƖƖNA bʋla pɩ Nowa, “Ŋ dɩ ŋ dɩa nɩaa kala jʋʋ lɩɩŋ daboro-la, bɛɛ wɩaa ma lɛɛlɛ nɩaa kala tʋɔŋ ŋ dʋndʋŋa nɛ mɩ na dɩ ŋ ŋaa tʋɔpʋl tɩɩna. 2To kɛŋ pʋsʋ-la ma sɩ bɩ kɩsɛ belliŋ arɩ nɩɩnɩŋ balɩpɛ balɩpɛ aŋ kɛŋ pʋsʋ-la ma sɩɩ kɩsɛ balɩa-balɩa dɩ ba doho sɩ́ dɛrʋ 3aŋ bɩra kɛŋ fillee arɩ zaaraa, belliŋ arɩ nɩɩnɩŋ balɩpɛ balɩpɛ dɩ ba doho sɩ́ dɛrʋ. 4A lɩɩ jɩnɩŋ kaa mʋ tapʋlaa balɩpɛ chɛɛŋ, mɩ jaŋ leŋ dɩ duonuŋ nɩɩ tapʋlɩɩ na-kala wɩɩhɛyɛ arɩ tɩtaŋɩŋ tapʋlaa mahɩŋ balɩa a kpʋ kʋŋ na-kala mɩ sɩ ŋaa ʋ kɛŋ mɩɩsɩŋ dʋnɩa lɛ.”
5Ŋɩɩ nɛ Nowa ŋaa wɩalɩŋ kala Wɩa sɩ sɩ ʋ ŋaa.
6Nowa fa ŋaa jɩsɩŋ zɔɔ-balɩdʋ nɛ, ka Wɩa leŋ lɩɩŋ kʋ dii dʋnɩa. 7Ŋɩɩ nɛ Nowa arɩ ʋ haala arɩ ʋ hambolibiisiŋ arɩ ʋ bii-haalaa kala jʋʋ lɩɩŋ daboro-la dɩ lɩɩ-la sɩ́ ba kpʋ. 8Pʋsʋŋ arɩ bagɩlaa, kɩalɩŋ ba sɩɩ kɩsʋ arɩ kɩalɩŋ ba sɩ bɩ kɩsɛ, fillee arɩ zaaraa arɩ tinteeŋ tuuroo kala jʋʋ lɩɩŋ daboro-la. 9Ŋɩɩ nɛ kʋŋ na-kala doho, bele arɩ nɩɩŋ to Nowa harɩŋ a jʋʋ lɩɩŋ daboro-la arɩ ŋɩɩ Wɩa sɩ bʋla pɩ Nowa. 10Tapʋlaa balɩpɛ harɩŋ, lɩɩŋ kʋ su dʋnɩa.
11Nowa sɩ ŋaa jɩsɩŋ zɔɔ-balɩdʋ, chɛŋ-lɩamɩŋ tapʋl-fii arɩ balɩpɛ chɛɛŋ, wɩa-nyuŋ suri, lɩɩŋ chuchuuri aŋ pɛ bulo lɩlɩɩ tinteeŋ. 12Ŋɩɩ nɛ duonuŋ nɩɩ ŋɩɩ halɩɩ tapʋlaa mahɩŋ balɩa, wɩɩhɛyɛ arɩ tɩtaŋɩŋ kala.
13Tapʋlɩɩ-la tɩtɩa, Nowa arɩ ʋ biiriŋ Sɛm, Ham arɩ Jafɛf arɩ ʋ haala arɩ ʋ bii-haalaa batori kala jʋʋ lɩɩŋ daboro-la. 14Ba to kɛŋ bagɩlaa arɩ pʋŋ-doho na-kala arɩ tinteeŋ tuuroo arɩ fillee arɩ zaaraa kala. 15Ŋɩɩ nɛ kʋŋ na-kala doho sɩ kɛŋ mɩɩsɩŋ, ba balɩa balɩa to Nowa harɩŋ a jʋʋ lɩɩŋ daboro-la. 16Pʋsʋ-la kala sɩ to jʋʋ lɩɩŋ daboro-la ŋaa belliŋ arɩ nɩɩnɩŋ nɛ, arɩ ŋɩɩ Wɩa sɩ bʋla pɩ Nowa. Ŋɩɩ nɛ La TƖƖNA kɛŋ lɩɩŋ daboro-la boiŋ tɔ.
17Lɩɩŋ tɔ dʋnɩa halɩɩ tapʋlaa mahɩŋ balɩa, lɩɩŋ daboro-la jɩla daŋ lɩɩŋ nyuŋ. 18Lɩɩ-la pʋŋa pɛ a tɔ tinteeŋ kala. Ka lɩɩŋ daboro-la didelli lɩɩŋ nyuŋ. 19Lɩɩ-la sɩ tɔ tinteeŋ lɛ ŋɩɩ, ʋ tɔ peelee arɩ kʋŋkala sɩ hɛ tinteeŋ lɛ nɛ. 20Lɩɩ-la sɩ su tinteeŋ ŋɩɩ a tɔ peelee nyuŋ, ʋ ha kieli peele-la nyuŋ a yi naakieliŋ bʋlɩpɛ nɛ. 21Kʋŋ na-kala sɩ kɛŋ mɩɩsɩŋ a hɛ dʋnɩa lɛ sʋʋ: Bagɩlaa, pʋsʋŋ, diibiisiŋ arɩ fillee arɩ nuhuobiine kala. 22Kʋŋ na-kala sɩ hɛ tinteeŋ a kɛŋ mɩɩsɩŋ a wiwiesi kala sʋʋ. 23Lɩɩŋ kpʋ nuhuobiinee, bagɩlaa, pʋsʋŋ, arɩ tinteeŋ tuuroo arɩ fillee kala, see Nowa, ʋ dɩa nɩaa arɩ kɩalɩŋ kala fa sɩ jʋʋ lɩɩŋ daboro-la dʋndʋŋa nɛ fa ka.
24Lɩɩ-la fa tɔ tinteeŋ a yi tapʋlaa zɔlɔ arɩ mahɩŋ balɩa arɩ fii nɛ.",https://www.bible.com/bible/2553/GEN.7.SIS
