Title,Content,URL
WƖAA DƖ-SUOMUŊ 8,"1Ama Wɩa fa bɩ Nowa arɩ bagɩlaa arɩ pʋsʋ-la sɩ to Nowa harɩŋ jʋʋ lɩɩŋ daboro-la wɩaa yʋa. Ŋɩɩ nɛ ʋ leŋ peliŋ lu dʋnɩa lɛ. Lɩɩ-la suomo hʋhʋ. 2Lɩɩ-bul-sɩaa sɩ hɛ tinteeŋ lɛ kala tɔ, lɩɩ-la bɩra bɩ pʋŋaa pɛ, wɩa-nyuŋ viisiŋ kala tɔ. 3Lɩɩ-la hʋhʋ mʋa mʋa a mʋ yi tapʋlaa zɔlɔ arɩ mahɩŋ balɩa arɩ fii, dɩ ʋ tuu yʋgɛ. 4Ʋ chɛŋ-pɛmɩŋ tapʋlaa fii arɩ balɩpɛ sɩ kiele, lɩɩŋ daboro-la tuu sagɛ peel-la ba sɩɩ yɩrɛ Ararat nyuŋ. 5Lɩɩ-la tuu mʋa mʋa a mʋ yi chɛŋ-fii tʋɔŋ tapʋl-bumbuŋ dɩ peelee nyusuŋ nyɩɩsa.
6Ʋ tapʋlaa mahɩŋ balɩa chɛɛŋ nɛ Nowa kɛŋ lɩɩŋ daboro-la ʋ sɩ kpaasa tokoro suri 7aŋ lɩɩsɛ zaarɩ-kokobie ta ʋ fil a mʋ aŋ kʋkɔ ŋɩɩ halɩɩ lɩɩ-la kala hʋ dɛrɛ. 8Ŋɩɩ nɛ Nowa bɩra chɩchɛ dɩ ʋ na lɩɩ-la hʋa nɛɛ, ʋ ta kokomo dɩ ʋ lɩɩ na. 9Kokomo-la sɩ lɩa, ʋ bɩ wuo tuu tinteeŋ, bɛɛ wɩaa lɩɩŋ ha hɛ tinteeŋ kala lɛ nɛ. Ŋɩɩ nɛ kokomo-la mɩɩra kɔ lɩɩŋ daboro-la leriŋ. Nowa yɩa kɛŋ kokomo-la arɩ nɩsɩŋ a kaa jʋʋ lɩɩŋ daboro-la. 10Ŋɩɩ nɛ Nowa gbɛrɛ tapʋlaa balɩpɛ aŋ bɩra lɩɩsɛ kokomo-la ta ʋ lɩɩ. 11Kokomo-la mɩɩra chɛbɛ olif pɩpaa-laaŋ ʋ niiŋ lɛ a kɔ dɩdaanɩŋ. Ŋɩɩ nɛ Nowa jɩŋ arɩ lɩɩ-la ka mʋa nɛ. 12Ŋɩɩ nɛ Nowa bɩra gbɛrɛ tapʋlaa balɩpɛ, aŋ bɩra ta kokomo-la ʋ lɩɩ. Bʋa deeŋ-na lɛ kokomo-la bɩra bɩ mɩɩra jʋʋ ʋ teeŋ.
13Bʋa-la lɛ Nowa sɩ yi jɩsɩŋ zɔɔ-balɩdʋ arɩ kʋbala, ʋ chɛŋ-bumbuŋ tapʋl-bumbuŋ chɛɛŋ, dɩ lɩɩ-la kala hʋa. Nowa kɛŋ lɩɩŋ daboro-la viise-la suri a na arɩ tinteeŋ hɩla nɛ. 14Chɛŋ-lɩamɩŋ tapʋlaa mara arɩ balɩpɛ chɛɛŋ dɩ tinteeŋ hɩla dɛrɛ.
15Ŋɩɩ nɛ Wɩa bʋla pɩ Nowa, 16“Ŋ dɩ ŋ haala, arɩ ŋ biiriŋ arɩ ba haalaa kala, má kʋ lɩɩ daboro-la tʋɔŋ. 17Kɛŋ kʋŋkala sɩ kɛŋ mɩɩsɩŋ a hɛ ŋ teeŋ kʋ lɩɩ: Fillee, bagɩlaa, pʋsʋŋ arɩ tinteeŋ tuuroo a kʋ lɩɩ dɩ ba pʋŋa yʋgɛ.”
18Ŋɩɩ nɛ Nowa arɩ ʋ haala arɩ ʋ biiriŋ arɩ ba haalaa kʋ lɩɩ. 19Bagɩlaa, pʋsʋŋ, zaaraa, arɩ tinteeŋ tuuroo kala ma kʋ lɩɩ aa vɛŋ doho doho.
20Ŋɩɩ nɛ Nowa saa Wɩɩsʋllɩ koruŋ a pɩ La TƖƖNA a kɛsɛ kɩalɩŋ ba sɩ bɩ kɩsɛ: Pʋsʋŋ doho kala dɔnsʋŋ arɩ zaaraa doho kala dɔnsʋŋ, a kpʋ a ŋaa kʋnyɩgaa Wɩɩsʋlʋŋ a pɩ Wɩa Wɩɩsʋlʋŋ koru-la nyuŋ. 21Ŋɩɩ nɛ Wɩa nɩɩ kɩalɩŋ Nowa sɩ nyɩga sʋɔra dɩ ba sɩma. Ʋ tʋɔŋ tɔrɛ, ʋ bʋl ʋ tʋɔŋ lɛ, “Mɩ bɩra bɩ jaŋ tɩŋ nuhuobiine wɩaa a ŋmɩɛsa hɛ tinteeŋ lɛ. Nuhuobiine tʋɔbɩɩnaa kala ŋaa kʋbɔmɔ nɛ a lɩɩ ʋ hambiiriŋ kala lɛ. Mɩ bɩra bɩ jaŋ kɔ dɩ mɩ kpʋ kʋŋkala sɩ weye arɩ mɩ sɩ ŋaa ŋɩɩ bʋa-la lɛ.
22Dʋnɩa sɩ hɛ nɩmɛ a kaa mʋmʋ,
kɩaa duunuŋ arɩ kʋmʋŋ,
waarɩŋ arɩ wulumuŋ,
yibiiniŋ arɩ lɩmbaŋa,
wɩɩhɛyɛ arɩ tɩtaŋɩŋ kala jaŋ hɛ nɩmɛ a kaa mʋ wuu.”",https://www.bible.com/bible/2553/GEN.8.SIS
WƖAA DƖ-SUOMUŊ 9,"Wɩa bil niiŋ ʋ dɩ Nowa pɛgɛ
1Wɩa pɛ Nowa arɩ ʋ biiriŋ lɛ aŋ bʋl, “Má lʋl biiriŋ yʋgɛ dɩ ba kɛŋ doho a pʋŋa su tinteeŋ kala. 2Dʋnɩa kɩaa kala bagɩlaa, zaaraa, tinteeŋ tuuroo kala arɩ chenfilee sɩ hɛ mʋgʋ-balɩŋ tʋɔŋ jaŋ fɩfáma. Ma jaŋ kɛŋ ba kala doluŋ. 3Kʋŋ na-kala sɩɩ wiesu jaŋ ŋaa ma kʋdiilii arɩ mɩ sɩ joŋ pɩpaa na-kala pɩma ŋɩɩ. Mɩ lɛɛlɛ joŋ kʋŋkala pɩma nɛ.
4Ama má sɩ́ nammɩa ha sɩ kɛŋ chalɩŋ chaŋ, chalɩŋ nɛ ŋaa ʋ mɩɩsɩŋ. 5Nʋʋkala bɩ maga dɩ ʋ kpʋ ʋ dɔŋɔ. Bagɩl ma bɩ maga dɩ ʋ kpʋ nuhuobiine. Dɩ nʋʋ koo bagɩl koo pʋna nɛ kpʋ nʋʋ, ʋ maga dɩ ba kpʋʋ ma. Nʋʋkala bɩ maga dɩ ʋ kpʋ ʋ naambii, dɩ nʋʋ nɛ ŋaa ŋɩɩ, ʋ jaŋ joŋ ʋ mɩɩsɩŋ tiŋ.
6Dɩ nʋʋkala nɛ kpʋ ʋ dɔŋɔ,
ʋ maga ba kpʋʋ ma nɛ,
bɛɛ wɩaa Wɩa ŋaa nuhuobiine ʋ nagɛ ʋ-na Wɩa nɛ.
7Má lʋl biiriŋ yʋgɛ dɩ ba kɛŋ doho a pʋŋa su tinteeŋ kala.”
8Ŋɩɩ nɛ Wɩa bʋla pɩ Nowa arɩ ʋ biiriŋ, 9“Lɛɛlɛ mɩ bil niiŋ nɛ mɩ dɩŋ arɩ ŋ doho nɩaa kala pɛgɛ, 10a pɛ kɩalɩŋ kala sɩɩ wiesu lɛ: Zaaraa, bagɩlaa, pʋsʋŋ arɩ kɩalɩŋ kala sɩ to ŋ harɩŋ lɩɩ lɩɩŋ daboro-la tʋɔŋ. 11Niiŋ deeŋ nɛ mɩ bil mɩ dɩ ma pɛgɛ: Mɩ bɩra bɩ jaŋ leŋ dɩ lɩɩ-balɩŋ chei dʋnɩa kɩaa kala sɩ kɛŋ mɩɩsɩŋ a hɛ dɔŋɔ. Lɩɩ-balɩŋ bɩra bɩ jaŋ dii dʋnɩa kala.
12Wɩɩŋ deeŋ nɛ jaŋ ŋaa magɩlɩŋ a tɩŋ nii-la mɩ sɩ bile mɩ dɩŋ arɩ ŋ doho nɩaa pɛgɛ arɩ kɩalɩŋ kala sɩ kɛŋ mɩɩsɩŋ tinteeŋ lɛ a kaa mʋ wuu: 13Duoŋ-sɩa nɛ mɩ leŋ ʋ hɛ duoŋ-bɩlɩmbaanaa tʋɔŋ. Ʋ nɛ jaŋ ŋaa nii-la mɩ sɩ bile mɩ dɩ dʋnɩa nɩaa pɛgɛ magɩlɩŋ. 14Bʋa na-kala dɩ mɩ nɛ leŋe duoŋ-bɩlɩmbaanaa kʋ hɛ dɔŋɔ dɩ duoŋ-sɩa lɩɩ chɩŋ wɩa-nyuŋ, 15mɩ jaŋ liisi nii-la mɩ sɩ bile mɩ dɩŋ pɛgɛ arɩ kɩalɩŋ kala sɩ weye a ŋaa doho doho a hɛ dʋnɩa lɛ. Mɩ bɩra bɩ jaŋ leŋ dɩ lɩɩ-balɩŋ kʋ chei kɩalɩŋ mɩɩsɩŋ kala. 16Bʋa na-kala dɩ duoŋ-sɩa nɛ lɩɩ chɩŋ duoŋ-bɩlɩmbaanaa tʋɔŋ, mɩ jaŋ naʋ a liise yi nii-la sɩ bɩ dɛrɛ mɩ sɩ bile, mɩ dɩ kɩalɩŋ kala sɩ weye tinteeŋ lɛ pɛgɛ.”
17Ŋɩɩ nɛ Wɩa bɩra bʋla pɩ Nowa, “Duoŋ-sɩa deeŋ nɛ jaŋ ŋaa magɩl-la sɩ jaŋ dagɛ nii-la mɩ sɩ bile mɩ dɩ kɩalɩŋ kala sɩ weye a hɛ tinteeŋ lɛ pɛgɛ.”
Nowa hambolibiisiŋ
18Nowa hambolibiisi-la sɩ to ʋ harɩŋ kʋ lɩɩ lɩɩŋ daboro-la lɛ nɛ ŋaa Sɛm, Ham, arɩ Jafɛf (Ham nɛ lʋl Kɛnaŋ). 19Nowa hambolibiisiŋ deemba batori nɛ kʋ ŋaa dʋnɩa nɩaa kala doho.
20Nowa fa ŋaa paarʋ nɛ a bil baga a chɔnsɛ tɩɩnɛnɛɛ. 21Ŋɩɩ nɛ tapʋlɩɩ kʋbala ʋ nyʋa tɩɩnɛnɛ-la sɩnɩŋ a bugi, a kɛŋ timbogulo pɩŋ ʋ lɛbɩŋ tʋɔŋ. 22Ham sɩ ŋaa Kɛnaŋ nyɩmma na ʋ nyɩmma timbogulo a lɩɩ bʋla pɩ ʋ naambiiri-la balɩamɩŋ sɩ hɛ dɩ-jalɩŋ. 23Ŋɩɩ nɛ Sɛm arɩ Jafɛf joŋ gɛrɩŋ daŋ ba vaasɩŋ lɛ a vɛŋ tulo a joŋ sɩaa ta dɩ-wogo dɩ ba sɩ́ ba nyɩmma timbogulo na, aŋ kɛŋ gɛrɩ-la kʋ tɔ ʋ yarɩ-bire-la.
24Sɩŋ-la sɩ lɩɩ Nowa sɩaa lɛ, ka ʋ nɩɩ ŋɩɩ ʋ biiriŋ tʋɔŋ kʋbie-la sɩ ŋaa ʋ lɛ, 25ʋ sɩ,
“Mɩ ŋmɩɛsa hɛ Kɛnaŋ lɛ nɛ,
ʋ jaŋ ŋaa yosuŋ tʋɔŋ yomo ʋ naambiiriŋ tʋɔŋ.”
26Ŋɩɩ nɛ ʋ bɩra bʋl,
“Mɩɩ dɛnnɛ mɩ Tɩɩna, Wɩa-la sɩ ŋaa Sɛm Wɩa.
Kɛnaŋ jaŋ ŋaa Sɛm yomo.
27Wɩa jaŋ leŋ dɩ Jafɛf leriŋ jallɛ,
dɩ Jafɛf jʋʋ Sɛm daanyʋɔsʋŋ lɛ
aŋ ka dɩ Kɛnaŋ ŋaa Sɛm yoŋ.”
28Lɩɩ-bal-la sɩ chei dʋnɩa harɩŋ lɛ, Nowa hɛ ʋ mɩɩsɩŋ lɛ jɩsɩŋ zɔɔ-batori arɩ mahɩŋ balɩa arɩ fii nɛ. 29Nowa jɩsɩŋ kala ŋaa zɔlɔ nibi arɩ mahɩŋ balɩa arɩ fii nɛ aŋ-na sʋʋ.",https://www.bible.com/bible/2553/GEN.9.SIS
WƖAA DƖ-SUOMUŊ 10,"Nowa doho nɩaa
1Nowa hambolibiisiŋ Sɛm, Ham arɩ Jafɛf doho nɩaa nɛ ŋ-la. Lɩɩ-bal-la sɩ dii dʋnɩa harɩŋ lɛ, ba ma lʋl biiriŋ nɛ.
2Jafɛf ma hambolibiisiŋ nɛ fa ŋaa:
Goma, Magɔg, Madaɩ, Javaŋ, Tubal, Mɛsɛk arɩ Tɩras.
3Goma ma hambolibiisiŋ nɛ fa ŋaa:
Asɩkɛnas, Rɩfaf arɩ Togaama.
4Javaŋ ma hambolibiisiŋ nɛ fa ŋaa:
Ɛlɩsa, Taasɩs, Kɩtɩm arɩ Rodanim. 5Doho deeŋ nɩaa nɛ hɔŋ mʋgʋ-balɩŋ niiŋ a pɩsa hɔŋ taŋ taŋ. Tasɩ-la nɛ kʋ ŋaa tinteyee, tintee kala arɩ ʋ yikoro.
6Ham ma hambolibiisiŋ nɛ ŋ-la:
Kus, Mizirem, Puti arɩ Kɛnaŋ.
7Kus ma hambolibiisiŋ nɛ fa ŋaa:
Sɛba, Havɩla, Sabɩta, Raama arɩ Sabɩtɛka.
Raama ma hambolibiisiŋ nɛ: Sɛɛba arɩ Dɛdaŋ.
8Kus nɛ lʋl Nɩmɩrɔd, ʋ sii waa a ŋaa laalɩyuori-duo dʋnɩa lɛ. 9Ʋ fa ŋaa nambagɩl-duo nɛ La TƖƖNA doluŋ lɛ. A lɩɩ ŋɩɩ harɩŋ, dɩ nʋʋ nɛ bagɩlɛ woruŋ, ba yie kɛnʋ mɩmagɩsɛ Nɩmɩrɔd a bʋl ʋ nagɛ Nɩmɩrɔd. 10Ʋ kuoruŋ gentisiŋ nɛ fa ŋaa Babɩlɔŋ, Ɛrɛk, Akad arɩ Kalɩnɛ sɩ hɛ Babɩlɔŋ tinteeŋ lɛ. 11A lɩɩ nɩmɛ ʋ mʋ Asiiria tinteeŋ a saa Nɩnɩvɛ a pɛ Rehobɔf-Ɛɛ, Kala 12arɩ Resiŋ. Resiŋ fa hɛ Nɩnɩvɛ arɩ tabal-la ba sɩɩ yɩrɛ Kala pɛgɛ nɛ.
13Mizirem doho nɩaa nɛ ŋ-la:
Lud tɩŋŋaa, Anam tɩŋŋaa, Lɛhab tɩŋŋaa, Nafituhi tɩŋŋaa, 14Pafurusi tɩŋŋaa, Kasilu tɩŋŋaa arɩ Kafɩtɔ tɩŋŋaa. Fɩlɩsɩtɩa tɩŋŋaa lɩɩ nɩaa deemba tʋɔŋ nɛ.
15Kɛnaŋ nɛ lʋl Sɩdɔŋ, ʋ bii-hɩaŋ, Hiti tɩŋŋaa, 16Jebus tɩŋŋaa, Amɔrɩ tɩŋŋaa, Gɩgasɩ tɩŋŋaa, 17Hivi tɩŋŋaa, Akɩ tɩŋŋaa, Sini tɩŋŋaa, 18Avad tɩŋŋaa, Zɛma tɩŋŋaa, arɩ Hama tɩŋŋaa.
Harɩŋ nɛ Kɛnaŋ doho nɩaa pɩsɛ. 19Kɛnaŋ doho nɩaa tinteeŋ niiŋ nɛ: a chɩŋ Sɩdɔŋ lɛ a kaa mʋ Gɛra, a mʋ yi Gaza a to Sodom arɩ Gomora, Adɩma arɩ Zeboyim a kaa mʋ yi Lasa.
20Ham hambolibiisiŋ nɛ ŋɩɩ, ba sɩ gɔllɔ hɔŋ hɔŋ ba tasɩŋ lɛ, tasɩ-la nɛ kʋ ŋaa tinteyee, tintee kala arɩ ʋ yikoro.
21Jafɛf malɩma Sɛm ma lʋl biiriŋ nɛ. Sɛm nɛ ŋaa Ɛba hambolibiisiŋ naabalɩma.
22Sɛm hambolibiisiŋ nɛ:
Ɛlam, Asu, Afaza, Lud arɩ Aram.
23Aram ma hambolibiisiŋ nɛ:
Yus, Hul, Gɛda arɩ Mɛsɛk.
24Afaza nɛ lʋl Sɛla,
ʋ ma sii lʋl Ɛbɛ.
25Ɛbɛ ma lʋl hambolibiisiŋ balɩa nɛ,
dɔŋɔ yɩrɩŋ nɛ Pɛlɛg. Bʋa-la lɛ ba sɩ lʋl Pɛlɛg nɛ dʋnɩa nɩaa suomo pɔrɛ dɔŋɔ lɛ a hɔŋ hɔŋ leree. Ŋɩɩ nɛ tɩɩ ba hɛ yɩrɩ-la pʋ. Ʋ yɩrɩ-la bʋbʋɔŋ nɛ “pɔrɛ dɔŋɔ lɛ.” Pɛlɛg ŋaana ma yɩrɩŋ nɛ Jɔkɩtaŋ.
26Jɔkɩtaŋ ma nɛ lʋl
Alɩmɔdad, Sɛlɛf, Hazaamavɛf, Jɛra, 27Hadɔra, Uzal, Dɩkɩla 28arɩ Obal, Abɩmɛl, Sɛba, 29arɩ Ofi, Havɩla arɩ Jobab. Ba kala ŋaa Jɔkɩtaŋ biiriŋ nɛ.
30Lee-la ba fa sɩ hɛ nɛ a lɩɩ Mɛsa a mʋʋ yi Sɛfa, sɩ hɛ wɩɩpɔsʋŋ dɩɩrɩŋ lee-la peelee sɩ yʋga.
31Sɛm biiriŋ nɛ ŋ-la ba sɩ gɔllɔ hɔŋ hɔŋ ba tasɩŋ lɛ, tasɩ-la nɛ kʋ ŋaa tinteyee, tintee kala arɩ ʋ yikoro.
32Lɩɩ-bal-la sɩ bala, Nowa biiriŋ doho nɛ gɔllɔ hɔŋ hɔŋ tinteyee, a pɩsa su dʋnɩa kala.",https://www.bible.com/bible/2553/GEN.10.SIS
WƖAA DƖ-SUOMUŊ 11,"Babɛl dɩɩ-leŋiŋ
1Bumbuŋ-la dʋnɩa nɩaa kala faa bʋl yikoru-bala nɛ a kɛŋ nii-bala. 2Ba sii gɔllɔ lɩɩ wɩɩpɔsʋŋ dɩɩrɩŋ a kʋ na tintee-taala kʋbala sɩ hɛ Babɩlɔŋ tinteeŋ lɛ, a hɔŋ nɩmɛ.
3Ŋɩɩ nɛ ba bʋla pɩ dɔŋɔ, “Má leŋ dɩ la pɛɛsɛ tiebiee a nyɩgɛ dɩ ba kɛŋ doluŋ.” Ŋɩɩ nɛ ba pɛɛsɛ tiebie-la, a chɛ keliŋ ma ba sɩ jaŋ kaa saa. 4Ŋɩɩ nɛ ba bʋla pɩ dɔŋɔ, “Má leŋ dɩ la saa tabal arɩ dɩɩ-leŋiŋ sɩ jaŋ jɩla yi wɩa-nyuŋ a pɩ la tɩtɩa. Dɩ la nɛ ŋaa ŋɩɩ, la jaŋ laa yɩrɩŋ a pɩ la tɩtɩa a sɩ́ dɔŋɔ lɛ pɩsʋ, tinteeŋ lɛ.”
5Ŋɩɩ nɛ La TƖƖNA kʋ tuu dɩ ʋ na taŋ-la arɩ dɩɩ-leŋii-la nuhuobiinee sɩɩ saa. 6La TƖƖNA bʋl, “Dɩ nuhuobiine nɩɩ bʋl yikoru-bala, ba jaŋ wuo ŋaa wɩɩkala ba sɩɩ chɛ dɩ ba ŋaa. 7Leŋ dɩ La tuu kɛŋ ba yikoro vʋgʋmɛ dɩ ba bɩra sɩ́ dɔŋɔ wʋbʋlʋŋ nɩɩ.”
8Ŋɩɩ nɛ La TƖƖNA kɛŋ ba pɩsɛ lee-kala tinteeŋ lɛ, ba leŋ taŋ-la saanɩŋ. 9Ŋɩɩ nɛ tɩɩ ba fa yɩyɩrɛ taŋ-la Babɛl, bɛɛ wɩaa La TƖƖNA kɛŋ yikoro kala vʋgʋmɛ tinteeŋ lɛ nɛ. A lɩɩ nɩmɛ La TƖƖNA kɛmba pɩsɛ dʋnɩa kala lɛ.
A lɩɩ Sɛm doho a kaa mʋ Abɩram doho
10Sɛm doho nɩaa nɛ ŋ-la:
Lɩɩŋ fa sɩ dii tinteeŋ jɩsɩŋ balɩa harɩŋ, dɩ Sɛm fa ŋaa jɩsɩŋ zɔlɔ nɛ aŋ lʋl Afaza. 11Sɛm sɩ lʋl Afaza, ʋ hɛ ʋ mɩɩsɩŋ lɛ jɩsɩŋ zɔɔ-banɔŋ nɛ aŋ bɩra lʋl hambolibiisiŋ arɩ hantolibiisiŋ dɔnsʋŋ.
12Afaza sɩ ŋaa jɩsɩŋ mara arɩ fii arɩ banɔŋ, ʋ lʋl Sɛla. 13Afaza sɩ lʋl Sɛla, ʋ hɛ ʋ mɩɩsɩŋ lɛ jɩsɩŋ zɔɔ-banɛsɛ arɩ batori nɛ aŋ lʋl hambolibiisiŋ arɩ hantolibiisiŋ dɔnsʋŋ.
14Sɛla sɩ ŋaa jɩsɩŋ mara arɩ fii, ʋ lʋl Ɛbɛ. 15Sɛla sɩ lʋl Ɛbɛ, ʋ hɛ ʋ mɩɩsɩŋ lɛ jɩsɩŋ zɔɔ-banɛsɛ arɩ batori nɛ aŋ bɩra lʋl hambolibiisiŋ arɩ hantolibiisiŋ dɔnsʋŋ.
16Ɛbɛ sɩ ŋaa jɩsɩŋ mara arɩ fii arɩ banɛsɛ, ʋ lʋl Pɛlɛg. 17Ɛbɛ sɩ lʋl Pɛlɛg, ʋ hɛ ʋ mɩɩsɩŋ lɛ jɩsɩŋ zɔɔ-banɛsɛ arɩ mara arɩ fii nɛ, aŋ bɩra lʋl hambolibiisiŋ arɩ hantolibiisiŋ dɔnsʋŋ.
18Pɛlɛg sɩ ŋaa jɩsɩŋ mara arɩ fii, ʋ lʋl Rɛʋ. 19Pɛlɛg sɩ lʋl Rɛʋ, ʋ hɛ ʋ mɩɩsɩŋ lɛ jɩsɩŋ zɔɔ-balɩa arɩ nibi nɛ, aŋ bɩra lʋl hambolibiisiŋ arɩ hantolibiisiŋ dɔnsʋŋ.
20Rɛʋ sɩ ŋaa jɩsɩŋ mara arɩ fii arɩ balɩa, ʋ lʋl Sɛrʋg. 21Rɛʋ sɩ lʋl Sɛrʋg, ʋ hɛ ʋ mɩɩsɩŋ lɛ jɩsɩŋ zɔɔ-balɩa arɩ balɩpɛ nɛ, aŋ bɩra lʋl hambolibiisiŋ arɩ hantolibiisiŋ dɔnsʋŋ.
22Sɛrʋg sɩ ŋaa jɩsɩŋ mara arɩ fii, ʋ lʋl Nahɔ. 23Sɛrʋg sɩ lʋl Nahɔ, ʋ hɛ ʋ mɩɩsɩŋ lɛ jɩsɩŋ zɔɔ-balɩa nɛ, aŋ bɩra lʋl hambolibiisiŋ arɩ hantolibiisiŋ dɔnsʋŋ.
24Nahɔ sɩ ŋaa jɩsɩŋ mara arɩ nibi, ʋ lʋl Tɛra. 25Ʋ sɩ lʋl Tɛra, ʋ hɛ ʋ mɩɩsɩŋ lɛ jɩsɩŋ zɔlɔ arɩ fii arɩ nibi nɛ, aŋ lʋl hambolibiisiŋ arɩ hantolibiisiŋ dɔnsʋŋ.
26Tɛra sɩ ŋaa jɩsɩŋ mahɩŋ batori arɩ fii, ʋ lʋl Abɩram, Nahɔ arɩ Haraŋ.
27Tɛra doho nɩaa nɛ ŋ-la:
Tɛra nɛ lʋl Abɩram, Nahɔ arɩ Haraŋ. Haraŋ ma lʋl Lɔt. 28Ŋɩɩ nɛ Haraŋ sʋʋ ʋ nyɩmma Tɛra sɩɩŋ lɛ, taŋ-la ba sɩɩ yɩrɛ Uu lɛ. Ʋ hɛ Babɩlɔŋ tinteeŋ nɛ, lee-la lɛ ba sɩ lʋlʋ. 29Abɩram arɩ Nahɔ kala jaa haalaa. Abɩram haala yɩrɩŋ nɛ Saraɩ. Nahɔ ma haala yɩrɩŋ nɛ Mɩlɩka. Haraŋ toloo nɛ Mɩlɩka arɩ Ɩsɩka. 30Saraɩ fa ŋaa hapɩrɩ nɛ ʋ bɩ bii kala lʋla.
31Ŋɩɩ nɛ Tɛra kɛŋ ʋ nanʋala Abɩram arɩ ʋ nihiŋ Lɔt sɩ ŋaa Haraŋ nanʋala, arɩ ʋ bii-haala Saraɩ sɩ ŋaa Abɩram haala. Ba kala lɩɩ Uu sɩ hɛ Babɩlɔŋ tɩŋŋaa tinteeŋ a chaasɛ Kɛnaŋ tinteeŋ dɩɩrɩŋ a mʋmʋ. Ba sɩ yi taŋ-la ba sɩ yɩrɛ Haraŋ, ba hɔŋ nɩmɛ.
32Tɛra fa ŋaa jɩsɩŋ zɔɔ-balɩa arɩ banɔŋ nɛ aŋ sʋʋ Haraŋ tinteeŋ lɛ.",https://www.bible.com/bible/2553/GEN.11.SIS
WƖAA DƖ-SUOMUŊ 12,"Wɩa yɩrɛ Abɩram
1La TƖƖNA fa bʋla pɩ Abɩram: “Lɩɩ ŋ tinteeŋ lɛ, a leŋ ŋ doho nɩaa arɩ ŋ dɩa nɩaa kala aŋ mʋ tintee-la mɩ sɩ jaŋ dagɩŋ.
2Mɩ jaŋ leŋ dɩ ŋ doho nɩaa pʋŋ,
a ŋaa tintee-bal.
Mɩ jaŋ pɛ ŋ lɛ, a leŋ dɩ ŋ yɩrɩŋ yɩrɛ,
a to ŋ lɛ a pɛ nɩaa lɛ.
3Mɩ jaŋ pɛ nɩalɩŋ kala sɩ pɛ ŋ lɛ,
aŋ ŋmɩɛsa hɛ nɩalɩŋ ma sɩ ŋmɩɛsa hɛ ŋ lɛ,
aŋ to ŋ lɛ a pɛ dʋnɩa nɩaa kala lɛ.”
4Ŋɩɩ nɛ Abɩram lɩɩ Haraŋ lɛ arɩ Wɩa sɩ bʋl ŋɩɩ pʋ. Lɔt lɩɩ to ʋ harɩŋ. Bʋa-la lɛ dɩ Abɩram ŋaa jɩsɩŋ mahɩŋ batori arɩ fii arɩ banɔŋ. 5Abɩram kɛŋ ʋ haala Saraɩ arɩ ʋ ŋaana bie Lɔt, nɩalɩŋ arɩ kɩalɩŋ kala ba sɩ dʋa Haraŋ lɛ, a lɩɩ a mʋmʋ Kɛnaŋ tinteeŋ a mʋ yi nɩmɛ.
6Abɩram vɛŋ Kɛnaŋ tinteeŋ lɛ ŋɩɩ nɛ a mʋ yi tɩɩ-bal kʋbala baa yɩrɛ More a hɛ lee-la ba sɩɩ yɩrɛ Sɛkɛm. Bʋa-la lɛ dɩ Kɛnaŋ tɩŋŋaa nɛ fa hɛ tintee-la lɛ. 7Ŋɩɩ nɛ La TƖƖNA kɛŋ ʋ tɩtɩa dagɛ Abɩram, aŋ bʋla pʋ, “Mɩ jaŋ joŋ tinteeŋ deeŋ a pɩ ŋ dɩ ŋ doho nɩaa.” Ŋɩɩ nɛ Abɩram saa Wɩɩsʋllɩ koruŋ a pɩ La TƖƖNA, lee-la ʋ sɩ kɛŋ ʋ tɩtɩa dagʋ.
8Ʋ lɩɩ nɩmɛ a mʋ peel-la sɩ hɛ Bɛtɛl wɩɩpɔsʋŋ, a hɛ ʋ lɛbɩŋ Bɛtɛl wɩɩjʋʋlʋŋ dɩɩrɩŋ, ka Aɩ ma hɛ wɩɩpɔsʋŋ dɩɩrɩŋ. Nɩmɛ nɛ ʋ saa Wɩɩsʋllɩ koruŋ a pɩ La TƖƖNA a yɩrɛ ʋ yɩrɩŋ. 9Ŋɩɩ nɛ Abɩram sii nɩmɛ a mʋmʋ Nɛgɛf dɩɩrɩŋ. Nɛgɛf hɛ wɩɩpɔsʋŋ nagʋa dɩɩrɩŋ nɛ.
Abɩram arɩ Saraɩ hɛ Ijipiti tinteeŋ lɛ
10Bʋa-la lɛ losuŋ fa jʋʋ Kɛnaŋ tinteeŋ nɛ. Losuŋ sɩ faasa jʋʋ ŋɩɩ, Abɩram arɩ ʋ haala lɩɩ nɩmɛ a mʋ Ijipiti tinteeŋ dɩ ba hɔŋ nɩmɛ. 11Ʋ sɩ mʋ kpagɛ Ijipiti tinteeŋ, ŋɩɩ nɛ Abɩram bʋla pɩ ʋ haala Saraɩ, “Mɩ jɩma ŋ ŋaa hazɔŋ nɛ woruŋ. 12Dɩ Ijipiti tɩŋŋaa nɛ naŋ, ba jaŋ bʋl, ‘Na ʋ haala nɛ ŋ-la.’ Ba jaŋ kpʋmɛ aŋ leŋ dɩ ŋ dɩ ba hɔŋ. 13Bʋl ŋ ŋaa mɩ dɩhaal nɛ. Dɩ ŋ nɛ bʋl ŋɩɩ, ba jaŋ kɛmmɛ woruŋ a tɩŋ ŋ wɩaa, ba bɩ jaŋ kpʋmɛ.”
14Ba sɩ kʋ jʋʋ Ijipiti tinteeŋ, Ijipiti tɩŋŋaa na dɩ Saraɩ ŋaa hazɔŋ nɛ. 15Ijipiti kuoro nanzɔɔba sɩ na Saraɩ, ba bʋl ʋ zɔmʋŋ wɩaa a pɩ ba kuoro aŋ kɛnʋ kaa jʋʋ ʋ dɩa. 16Ijipiti kuoro kɛŋ Abɩram woruŋ a tɩŋ Saraɩ wɩaa a pʋ piesee, nɛsɩŋ, kaku-belliŋ arɩ nɩɩnɩŋ, aŋ pʋ tɩntɩnnaa (baalaa arɩ haalaa) arɩ bʋntaŋŋaba.
17Ama a tɩŋ Saraɩ wɩaa La TƖƖNA joŋ nyanyal bɔŋŋɔɔ hɛ Ijipiti kuoro arɩ ʋ dɩa nɩaa lɛ. 18Ŋɩɩ nɛ Ijipiti kuoro yɩrɛ Abɩram a pɩɛsʋ: “Bɛɛ nɛ tɩɩ ŋ ŋaa ŋ-la? Bɛɛ nɛ tɩɩ ŋ bɩ bʋla pɩmɛ arɩ ʋ ŋaa ŋ haala nɛ? 19Bɛɛ nɛ tɩɩ ŋ bʋl arɩ ʋ ŋaa ŋ dɩhaal nɛ, a leŋ mɩ kɛnʋ mʋ ŋaa mɩ haal? Laa ŋ haala kaa viiri.” 20Ŋɩɩ nɛ Ijipiti kuoro leŋ ʋ nɩaa kɛŋ Abɩram arɩ ʋ haala arɩ ba kɩaa kala a kaa lɩɩ hɛ wombiiŋ lɛ dɩ ba viiri.",https://www.bible.com/bible/2553/GEN.12.SIS
WƖAA DƖ-SUOMUŊ 13,"Abɩram arɩ Lɔt pɔrɛ dɔŋɔ lɛ
1Ŋɩɩ nɛ Abɩram arɩ ʋ haala arɩ kʋŋkala ʋ sɩ kɛnɛ lɩɩ Ijipiti tinteeŋ lɛ a mʋ Nɛgɛf tinteeŋ. Lɔt to ba harɩŋ. 2Abɩram fa kɛŋ kɩaa kɩŋkɛŋ, pʋsʋŋ, warɩpʋla arɩ sɛlɩmɛ.
3Ŋɩɩ nɛ ʋ lɩɩ Nɛgɛf a dʋʋrɛ ŋɩɩ a kʋ yi Bɛtɛl, a kiele mʋ Bɛtɛl arɩ Aɩ pɛgɛ, lee-la ʋ lɛbɩŋ fa sɩ hɛ. 4Lee-la nɛ ʋ laa sɩpaaŋ saa Wɩɩsʋllɩ koruŋ a yɩrɛ La TƖƖNA yɩrɩŋ.
5Lɔt fa sɩɩ to Abɩram harɩŋ, ʋ ma fa kɛŋ ʋ tɩtɩa piesee, nɛsɩŋ, arɩ lɛŋŋɛɛ nɛ. 6Ama Abɩram arɩ Lɔt fa bɩra bɩ dɩ-bala wuo hɔŋ, bɛɛ wɩaa ba pʋsʋŋ yʋga, ka yaŋ bɩ yʋgɛ lee-la dɩ ba pʋsʋŋ didii. 7Ŋɩɩ nɛ Abɩram kʋdaaraa arɩ Lɔt kʋdaaraa yuyuo dɔŋɔ. Bʋa-la lɛ dɩ Kɛnaŋ tɩŋŋaa arɩ Pɛrɛs tɩŋŋaa nɛ fa hɔŋ nɩmɛ.
8Ŋɩɩ nɛ Abɩram bʋla pɩ Lɔt, “Mɩɩ sʋlʋŋ, la ŋaa naambiiriŋ nɛ, sɩ́ leŋe la yuyuo dɔŋɔ, dɩ la kʋdaaraa ma sɩ́ dɔŋɔ yuyuo. 9Tinteeŋ dee bɩ ŋɩɩ pɩnaa? Leŋ la pɔrɛ dɔŋɔ lɛ, dɩ ŋ nɛ jaŋ mʋ nadiiŋ, mɩ jaŋ mʋ nagʋa. Dɩ ŋ nɛ bɩra jaŋ mʋ nagʋa, mɩ jaŋ mʋ nadiiŋ.”
10Ŋɩɩ nɛ Lɔt bee na Jɔdaŋ fuonaaŋ kala dɩ ʋ pɩna a fɩɛlɛ woruŋ. Fuonaa-la pɩŋ ŋɩɩ nɛ a mʋ yi taŋ-la ba sɩɩ yɩrɛ Zʋaa. Ʋ fa kɛŋ lɩɩŋ kɩŋkɛŋ a nagɛ Ɛdɩŋ ŋmaŋkaaŋ a bɩra nagɛ Ijipiti tinteeŋ ma. (Bʋa-la lɛ dɩ La TƖƖNA fa ha bɩ tasɩ-la ba sɩɩ yɩrɛ Sodom arɩ Gomora cheye.) 11Ŋɩɩ nɛ Lɔt bagɩsɛ joŋ Jɔdaŋ fuonaa-la kala a mʋ hɔŋ wɩɩpɔsʋŋ dɩɩrɩŋ, ʋ dɩ Abɩram pɔrɛ dɔŋɔ lɛ. 12Ŋɩɩ nɛ Abɩram hɔŋ Kɛnaŋ tinteeŋ dundolo nyuŋ, ka Lɔt ma mʋ hɔŋ tabala-la sɩ hɛ fuonaaŋ lɛ a hɛ ʋ lɛbɩŋ kpagɛ tabal-la ba sɩɩ yɩrɛ Sodom. 13Ama Sodom nɩaa fa ŋaa nɩbɔmɔ nɛ a chaasa ŋaa wʋbɔŋŋɔɔ La TƖƖNA teeŋ.
14Abɩram arɩ Lɔt sɩ kɛrɛ dɔgɔ lɛ, Wɩa bʋla pɩ Abɩram, “Lee-la ŋ sɩ chɩna, kɛŋ ŋ nyuŋ je a beŋ taŋ-sɛsɩŋ, taŋ-bʋbʋɔŋ arɩ taŋ-nyuŋ. 15Lee-la kala ŋ sɩ na, mɩ jaŋ joŋo pɩŋ, ŋ dɩ ŋ doho nɩaa a kaa mʋ wuu. 16Mɩ jaŋ leŋ dɩ ŋ doho nɩaa nagɛ hagɩlɩ-biee. Dɩ nʋʋ nɛ jaŋ wuo dɩɩsɛ hagɩlɩ-bie, ʋ jaŋ wuo dɩɩsɛ ŋ doho nɩaa. 17Sii a vɛnɛ golli tintee-la, ʋ duomuŋ arɩ ʋ jalɩŋ. Ʋ nɛ mɩɩ chɛ mɩ joŋo pɩŋ.”
18Ŋɩɩ nɛ Abɩram churi ʋ lɛŋŋɛɛ a kaa mʋ hɔŋ taŋ-la ba sɩɩ yɩrɛ Hɛbʋrɔŋ lɛ a kpagɛ Mamɩrɛ tɩɩ-bala-la. Nɩmɛ nɛ ʋ saa Wɩɩsʋllɩ koruŋ a pɩ La TƖƖNA.",https://www.bible.com/bible/2553/GEN.13.SIS
WƖAA DƖ-SUOMUŊ 14,"Abɩram laa Lɔt ta
1Kuoroo banɛsɛ nɛ fa hɛ nɩmɛ: Babɩlɔŋ kuoro Amɩrafɛl, Ɛlasa kuoro Arɔk, Ɛlam kuoro Kedolooma arɩ Goim kuoro Tɩdal. 2Ba nɛ sii a mʋ dɩ ba yuo kuoroo deemba banɔŋ: Sodom kuoro Bɛra, Gomora kuoro Bɛɛsa, Adɩma kuoro Sɩnab, Zeboyim kuoro Sɛmɛba arɩ Bɛla kuoro. Bɛla nɛ ha ŋaa Zʋaa. 3Kuoroo deemba banɔŋ kɛŋ ba laal-yuoroo kʋ hɛ dɔŋɔ lɛ Sɩdɩm fuonaaŋ lɛ. Sɩdɩm fuonaa-la nɛ ba haa yɩrɛ yɩsɩŋ mʋgʋ-balɩŋ. 4Jɩsɩŋ fii arɩ balɩa pɛgɛ Kedolooma nɛ faa bemba, jɩ-fii arɩ batorumuŋ tʋɔŋ ba bɩ sɛyɛ.
5Jɩ-fii arɩ banɛsɩmɩŋ tʋɔŋ Kedolooma arɩ ʋ nɩaa yuo dii nɩaa deemba: Refem tɩŋŋaa sɩ hɔŋ Asɩtɛrɔf Kanam lɛ. Zuzi tɩŋŋaa sɩ hɛ Ham lɛ, Emi tɩŋŋaa sɩ hɔŋ Kɩrɩatam lɛ 6arɩ Hori tɩŋŋaa sɩ hɛ tintee-la peelee sɩ yʋga lɛ baa yɩrɛ Sɛɛ a kaa mʋ yi Ɛl Paraŋ sɩ kpagɛ tintee-hɩlɩŋ. 7Ŋɩɩ nɛ ba mɩɩrɛ harɩŋ a mʋ Ɛŋ-Mɩsɩpat, Kadɛs nɛ ŋɩɩ, a yuo dii Amalɛk tɩŋŋaa tinteeŋ kala arɩ Amɔrɩ tɩŋŋaa fa sɩ hɔŋ Hazazɔŋ Tama lɛ.
8Ŋɩɩ nɛ Sodom, Gomora, Adɩma Zeboyim arɩ Bɛla kuoroo kɛŋ ba laalɩyuoroo kʋ pɛ dɔŋɔ lɛ Sɩdɩm fuonaaŋ lɛ 9dɩ ba yuo Ɛlam kuoro Kedolooma, Goim kuoro Tɩdal, Sɩna kuoro Amɩrafɛl arɩ Ɛlasa kuoro Arɔk, kuoroo banɛsɛ a yuyuo kuoroo banɔŋ. 10Ŋɩɩ nɛ dɩ Sɩdɩm fuonaa-la fa kɛŋ bʋa-tuonuŋ a kɛŋ keliŋ yʋgɛ. Ŋɩɩ nɛ Sodom arɩ Gomora kuoroo arɩ ba laalɩyuoroo fɩfa dɩ ba laa ba tɩtɩa. Ba sɩɩ fa ŋɩɩ, dɔnsʋŋ tel Sɩdɩm fuonaa-la tʋɔŋ, ka dɔnsʋŋ ma fá jʋʋ peele-la tʋɔŋ. 11Ŋɩɩ nɛ kuorusu-la banɛsɛ yuo dii Sodom arɩ Gomora nɩaa a laa ba kɩaa arɩ ba kʋdiilee kala a kaa viiri. 12Ba pɛ kɛŋ Abɩram ŋaana bie Lɔt arɩ ʋ dʋa kala ma pɛ mʋ, bɛɛ wɩaa bʋa-la lɛ dɩ ʋ ma fa hɛ Sodom lɛ.
13Ba tʋɔŋ dɔŋɔ sɩ foro fa nɛ mʋ bʋla pɩ Abɩram sɩ ŋaa Hiburu tɩɩna. Bʋa-la lɛ Abɩram fa sɩ jʋʋ lee-la kpagɛ Mamɩrɛ tɩɩ-bala-la. Mamɩrɛ fa ŋaa Amɔrɩ tɩɩna nɛ. Ʋ naambiiriŋ nɛ fa Ɛsɩkɔl arɩ Ana, ba dɩ Abɩram fa ŋaa sɩma nɛ. 14Abɩram sɩ nɩa dɩ ba yuo a kɛŋ ʋ ŋaana bie Lɔt, ŋɩɩ nɛ ʋ yɩrɛ ʋ laalɩyuoroo zɔɔ-batori arɩ fii arɩ chori ba sɩ lʋla ʋ dɩa lɛ ʋ dagɛ ba laalɩŋ-yuonuŋ a ŋaa ba lɩɩ kiri nɩalɩŋ harɩŋ a mʋ yi taŋ-la ba sɩɩ yɩrɛ Daŋ. 15Ʋ tɩtaŋɩŋ Abɩram kɛŋ ʋ laalɩyuoroo kaa kpaa ba yuo dii nɩalɩŋ a kiriba a mʋ yi Hɔba. Hɔba hɛ Damasɩkʋs wɩɩpɔsʋŋ nagʋa dɩɩrɩŋ nɛ. 16Ŋɩɩ nɛ ʋ laa kɩalɩŋ kala a laa Lɔt ʋ ŋaana bie arɩ ʋ dʋa arɩ haala-la arɩ nɩalɩŋ dɔnsʋŋ Kedolooma sɩɩ yuo kɛsɛ.
17Abɩram sɩ mʋ yuo dii kuoro Kedolooma arɩ ʋ kuoru dɔnsʋ-la aŋ mɩɩra kɔ, ŋɩɩ nɛ Sodom kuoro kʋ lɩɩ chemu Save fuonaa-la lɛ, ʋ nɛ ŋaa kuoroo fuonaaŋ.
18Ŋɩɩ nɛ Mɛlɩkɩzɛdɛk kɛŋ kʋdiilee arɩ sɩnɩŋ kʋ pɩ Abɩram. Mɛlɩkɩzɛdɛk ŋaa Salɛm kuoro nɛ aŋ bɩra ŋaa nɩɩ-la sɩ laa nɩaa nyuŋ a tɩma pɩpɩ Wɩa sɩ kɩɩ kʋŋ kala. 19Ŋɩɩ nɛ ʋ sʋl Wɩa pɩ Abɩram aŋ bʋl,
“Wɩa-la sɩ kɩɩ kʋŋkala a ŋaa
wɩa-nyuŋ arɩ tinteeŋ nɛ jaŋ pɛ Abɩram lɛ.
20Mɩɩ dɛnnɛ Wɩa sɩ kɩɩ kʋŋkala
sɩ joŋ ŋ dʋndɔŋŋɔɔ hɛ ŋ nɩsɩŋ lɛ.”
Ŋɩɩ nɛ Abɩram kɛŋ kɩalɩŋ kala ka kpaa puguloo fii a joŋ dɔŋɔ pɩ Mɛlɩkɩzɛdɛk.
21Ŋɩɩ nɛ Sodom kuoro bʋla pɩ Abɩram, “Joŋ nɩalɩŋ pɩmɛ aŋ kɛŋ kɩalɩŋ.”
22Ama Abɩram bʋla pɩ Sodom kuoro, “Mɩ je mɩ nɩsɩŋ dagɛ Wɩa sɩ kɩɩ kʋŋkala a ŋaa wɩa-nyuŋ arɩ tinteeŋ, a ŋmɩɛsɛ 23arɩ mɩ bɩ jaŋ laa kʋŋkala sɩ ŋaa ŋ kʋŋ, dɩ ʋ ŋaa ŋmɛŋ koo nɛntɛbɩŋ jolo, dɩ ŋ sɩ́ wuo bʋl ŋ nɛ ŋaa mɩ dʋa. 24Mɩ bɩ ma kʋŋkala ka chɛ see kɩalɩŋ mɩ nɩaa sɩ die arɩ kpaal-la sɩ maga dɩ nɩalɩŋ sɩ to mɩ harɩŋ mʋ, Ana, Ɛsɩkɔl arɩ Mamɩrɛ, leŋ ba laa ba kpaalɩŋ.”",https://www.bible.com/bible/2553/GEN.14.SIS
