Title,Content,URL
WƖAA DƖ-SUOMUŊ 21,"Sara lʋl Aɩzɩk
1La TƖƖNA fá Sara nenige a ŋaa wɩɩ-la ʋ fa sɩ sɩ ʋ jaŋ ŋaa pʋ. 2Ʋ kɛŋ luoruŋ a lʋl hambolibie a pɩ Abɩraham bʋa-la tɩtɩa lɛ Wɩa fa sɩ daga arɩ ʋ jaŋ lʋl, dɩ Abɩraham hɩɛsa. 3Ŋɩɩ nɛ Abɩraham hɛ bile yɩrɩŋ Aɩzɩk. 4Aɩzɩk sɩ yi tapʋlaa chori, Abɩraham keri ʋ peniŋ arɩ Wɩa fa sɩ dagʋ ŋɩɩ. 5Abɩraham fa ŋaa jɩsɩŋ zɔlɔ nɛ aŋ ka ba lʋl Aɩzɩk.
6Ŋɩɩ nɛ Sara bʋl, “Wɩa leŋe mɩ tʋɔŋ tɔrɛ nɛ mɩ mʋmɔŋ. Dɩ nʋʋkala nɛ nɩɩ wɩɩŋ deeŋ, ʋ jaŋ pɛ mɩ lɛ dɩ la mɔŋ.” 7Ʋ bɩra bʋl, “Kʋbɛɛ nɛ fa jaŋ wuo bʋla pɩ Abɩraham arɩ mɩ-na Sara jaŋ lʋl bie a kɛŋ yɩlɩŋ pʋ dɩ ʋ wasɛ? Ama ʋ hɩɛsa ŋɩɩ nɛ aŋ ka mɩ lʋl bie pʋ.”
Ba kiri Haga arɩ Ɩsɩmɛl ta
8Aɩzɩk waa, ba kɛrʋ yɩlɩŋ lɛ. Tapʋlɩɩ-la ba sɩ kɛrʋ yɩlɩŋ lɛ, Abɩraham ŋaa kʋdiilee ba gbieli gbieli-bal. 9Chɛɛ-kʋbala Sara na Haga Ijipiti tɩŋŋaa tolo-la sɩ lʋl bile pɩ Abɩraham dɩ ʋ sieri Aɩzɩk lɛ. 10Ŋɩɩ nɛ Sara bʋla pɩ Abɩraham, “Kiri yomo-la arɩ ʋ bie ta, mɩ bɩ chɛ dɩ yomo-la bie pɛ mɩ bie Aɩzɩk lɛ dii dɩa.” 11Wɩɩ-la wɩɩ Abɩraham woruŋ a tɩŋ Ɩsɩmɛl ma sɩ ŋaa ʋ bie wɩaa. 12Ŋɩɩ nɛ Wɩa bʋla pʋ, “Sɩ́ leŋe dɩ wɩɩŋ deeŋ walɩmɩŋ a tɩŋ bile arɩ ʋ naaŋ wɩaa. Jegile nɩɩ wɩɩ-la kala Sara sɩ bʋla, bɛɛ wɩaa Aɩzɩk lɛ nɛ mɩ jaŋ to pɛ ŋ doho nɩaa lɛ. 13Mɩ jaŋ leŋ dɩ ŋ yomo bie Ɩsɩmɛl ma pʋŋ a ŋaa nɩ-daŋ, bɛɛ wɩaa ʋ ma ŋaa ŋ doho nʋʋ nɛ.”
14Taŋ sɩ pʋla chʋchʋɔ-fɩɛla Abɩraham ŋaa kʋdiilee a ŋaa lɩɩŋ ma hɛ puruŋ tʋɔŋ a joŋo laalɛ Haga aŋ kiri ʋ dɩ ʋ bie ta. Ŋɩɩ nɛ ba lɩɩ jaŋ-la lɛ a mʋ bɩbaarɛ Bɛɛsɩba tintee-hɩlɩɩ-la lɛ.
15Lɩɩ-la fa sɩ dɛrɛ puru-la tʋɔŋ, ʋ joŋ bile bil tɩɩ-puguŋ bʋbʋɔŋ. 16Ŋɩɩ nɛ aŋ kiele mʋ hɔŋ a yi naakieliŋ zɔlɔ aŋ bʋl, “Mɩ bɩ jaŋ wuo bibeŋ ka dɩ bile sʋʋ.” Ʋ sɩ hɔnɔ ŋɩɩ, ʋ yiyel.
17Wɩa nɩɩ bile sɩɩ yel. Ŋɩɩ nɛ Wɩa tɩndaara lɩɩ wɩa-nyuŋ a yɩrɛ Haga a bʋl, “Bɛɛ nɛ, Haga? Sɩ́ fawʋllʋŋ fá, Wɩa nɩɩ bile sɩ pɩŋ nɩmɛ aa yel nɛ. 18Sii mʋ a kɛŋ bile dɩ ʋ sɩ́ yel, bɛɛ wɩaa, mɩ jaŋ leŋ dɩ ʋ pʋŋ a kʋ ŋaa tintee-bal.”
19Ŋɩɩ nɛ Wɩa suri Haga sɩaa ʋ na viliŋ sɩ kɛŋ lɩɩŋ. Ʋ mʋ ŋaa lɩɩŋ a su puru-la a kaa kʋ pɩ bile ʋ nyʋa.
20Wɩa pɛ bile lɛ ʋ waa a kʋ ŋaa nambagɩl a hɛ gɩrɩŋ tʋɔŋ. 21Bile sɩ hɛ Paraŋ tintee-hɩlɩɩ-la lɛ, ʋ naaŋ jaa Ijipiti tɩŋŋaa tolo pʋ.
Nii-la Abɩraham arɩ Abɩmɛlɛk sɩ bile pɩ dɔŋɔ
22Bʋa-la lɛ Abɩmɛlɛk arɩ ʋ laalɩyuori-hɩaŋ Fiko mʋ Abɩraham teeŋ a bʋla pʋ, “Wɩa chɩŋ ŋ harɩŋ nɛ, wɩɩ na-kala ŋ sɩɩ ŋaa lɛ. 23Ŋmɩɛsa pɩla Wɩa sɩpaaŋ arɩ ŋ bɩ jaŋ nyɩsɛla, a bɩra bɩ jaŋ nyɩsɛ la biiriŋ ma, koo la doho nɩaa. La ziliŋ nɛ. La sɩ ziliŋ ŋɩɩ, ŋ ma zilla arɩ la nɩaa, tintee-la ŋ sɩ́ hɔnɔ lɛɛlɛ a ŋaa nʋhʋɔrʋ lɛ.”
24Ŋɩɩ nɛ Abɩraham bʋl, “Tɔɔ, mɩ jaŋ ŋmɩɛsɛ.”
25Ŋɩɩ nɛ Abɩraham bʋla pɩ Abɩmɛlɛk, “Ŋ tɩntɩnnaa sɩ kɛŋ vil-la laa mɩ teeŋ wɩɩmɛ nɛ woruŋ.” 26Ŋɩɩ nɛ Abɩmɛlɛk bʋl, “Mɩ bɩ jɩŋ nɩɩ-la sɩ ŋaa wɩɩŋ deeŋ. Ŋ ma bɩ bʋla pɩmɛ, jɩnɩŋ nɛ mɩ nɩɩʋ ŋ-la.”
27Ŋɩɩ nɛ Abɩraham kɛŋ piesee arɩ nɛsɩŋ a kaa kɔ pɩ Abɩmɛlɛk, ba balɩa-la bil niiŋ pɩ dɔŋɔ. 28Ŋɩɩ nɛ Abɩraham lɩɩsɛ pie-keyee balɩpɛ, ʋ piesee tʋɔŋ. 29Abɩmɛlɛk pɩɛsɛ Abɩraham, “Wɩɩ-la ŋ sɩ ŋaa bʋbʋɔŋ nɛ bɛɛ?”
30Ŋɩɩ nɛ Abɩraham bʋl, “Laa pie-keyee deemba balɩpɛ mɩ nɩsɩŋ lɛ dɩ ŋɩɩ dagɛ arɩ mɩ nɛ lu viliŋ deeŋ.”
31Baa yɩrɛ lee-la Bɛɛsɩba, bɛɛ wɩaa nɩmɛ nɛ ba ŋmɩɛsa pɩ dɔŋɔ. 32Ba sɩ bil nii-la Bɛɛsɩba lɛ dɛrɛ, Abɩmɛlɛk arɩ ʋ laalɩyuori-hɩaŋ Fiko mɩɩra mʋ Fɩlɩsɩtɩa tɩŋŋaa tinteeŋ. 33Ŋɩɩ nɛ Abɩraham chɔnsɛ tɩa kʋbala baa yɩrɛ tamarɛs Bɛɛsɩba lɛ. Nɩmɛ nɛ ʋ yɩrɛ La TƖƖNA yɩrɩŋ, Wɩa-la sɩ hɛ nɩmɛ a kaa mʋ wuu. 34Abɩraham hɔŋ Fɩlɩsɩtɩa tɩŋŋaa tinteeŋ lɛ a dieni.",https://www.bible.com/bible/2553/GEN.21.SIS
WƖAA DƖ-SUOMUŊ 22,"Wɩa magɩsɛ Abɩraham
1Ʋ sɩ yi bʋa kʋbala Wɩa chɩchɛ dɩ ʋ na Abɩraham laa ʋ wɩaa dii nɛ, ŋɩɩ nɛ ʋ yɩrʋ, “Abɩraham!”
Ʋ sɛɩ a bʋl, “Namɛ nɛ ŋ-la!”
2Ŋɩɩ nɛ Wɩa bʋl, “Kɛŋ Aɩzɩk ŋ bii-bala-la ŋ sɩ cho, a mʋ lee-la ba sɩɩ yɩrɛ Moria. Kpʋʋ peel-la nyuŋ mɩ sɩ jaŋ dagɩŋ a ŋaa kʋnyɩgaa Wɩɩsʋlʋŋ pɩmɛ.”
3Ʋ taŋ sɩ pʋla chʋchʋɔ-fɩɛla, Abɩraham sii joŋ kaku-kpasa a daŋ ʋ kakumo nyuŋ a vɔɔ daasɩŋ daŋ a kɛŋ ʋ nanʋala Aɩzɩk arɩ ʋ tɩntɩnnaa balɩa a mʋmʋ lee-la Wɩa sɩ dagʋ. 4Tapʋl torimuŋ chɛɛŋ Abɩraham beŋ sɩpaaŋ a mʋ na lee-la, dɩ ʋ hɛ dɩ-bolii. 5Ŋɩɩ nɛ Abɩraham bʋla pɩ ʋ tɩntɩnna-la balɩa, “Má kɛŋ kakumo-la chɩŋ daha, ka mɩ dɩ bile kiele mʋ a chʋɔlɛ Wɩa aŋ kɔ.”
6Abɩraham puri daasɩ-la chʋŋ Aɩzɩk aŋ tɩtɩa kori sɩa arɩ nyiniŋ. Ba to dɔŋɔ mʋmʋ lee-la. 7Ba sɩɩ mʋ, ŋɩɩ nɛ Aɩzɩk yɩrɛ ʋ nyɩmma Abɩraham, “Mɩ nyɩmma.”
Ʋ sɛɩ. Ŋɩɩ nɛ Aɩzɩk pɩɛsʋ, “La sɩ kori daasɩŋ arɩ nyiniŋ, nɩɩ nɛ piesu-la la sɩɩ chɛ dɩ la kpʋ pɩ Wɩa hɛ?”
8Ŋɩɩ nɛ Abɩraham bʋl, “Mɩ bii, Wɩa tɩtɩa nɛ jaŋ pɩla piesu-la la sɩ jaŋ kpʋ a nyɩga pʋ.” Ŋɩɩ nɛ ba to dɔŋɔ a mʋmʋ lee-la.
9Ba sɩ mʋ yi lee-la Wɩa sɩ daga, ŋɩɩ nɛ Abɩraham saa Wɩɩsʋllɩ koruŋ a paa daasɩ-la daŋ ʋ nyuŋ aŋ vɔɔ ʋ bie Aɩzɩk a joŋo daŋ Wɩɩsʋlʋŋ koru-la arɩ daasɩ-la nyuŋ. 10Ŋɩɩ nɛ ʋ lɩɩsɛ sɩa dɩ ʋ kpʋ Aɩzɩk. 11Ŋɩɩ nɛ Wɩa tɩndaara yɩrɛ, “Abɩraham, Abɩraham.”
Ŋɩɩ nɛ ʋ sɛɩ, “Namɛ nɛ ŋ-la.”
12Ŋɩɩ nɛ Wɩa tɩndaarʋ-la bʋla pʋ, “Sɩ́ bile wɩɩkala ŋaa. Lɛɛlɛ mɩ jɩma ŋ fá Wɩa nɛ a laaʋ dii, bɛɛ wɩaa ŋ bɩ ʋ nii-la vɩa ʋ sɩ sɩ ŋ kɛŋ ŋ bii-bala-la kpʋ a nyɩga pʋ.”
13Abɩraham kɛŋ nyuŋ je, a beŋ dɩ ʋ na pie-bele dɩ ʋ nyilliŋ gɩrɩgɛ tiiŋ tʋɔŋ. Ŋɩɩ nɛ Abɩraham mʋ lɩɩsɛ piesu-la a kaa kʋ kpʋ a nyɩga pɩ Wɩa aŋ leŋ ʋ bile. 14Abɩraham hɛ lee-la yɩrɩŋ ‘Wɩa nɛ jaŋ chɛ pɩmɛ (Jehova Jire)’. Arɩ jɩnɩŋ kala lee-la yɩrɩŋ nɛ ha ŋɩɩ: “Peel-la nyuŋ Wɩa jaŋ chɛ pɩŋ.”
15Ŋɩɩ nɛ Wɩa tɩndaarʋ-la bɩra yɩrʋ lɩamɩŋ lɛ 16a bʋl, “Mɩ ŋmɩɛsɛ mɩ tɩtɩa a tɩŋ ŋ sɩ bɩ ŋ bii-bala-la vɩa dɩ ŋ kpʋ pɩmɛ, 17mɩ jaŋ pɛ ŋ lɛ a leŋ dɩ ŋ doho nɩaa pʋŋ a nagɛ chɛnwʋlaa, koo hagɩlɩ-bumbugulo sɩ hɛ mʋgʋ-balɩŋ niiŋ. Ŋ doho nɩaa jaŋ yuo laa ba dʋndɔŋŋɔɔ tinteeŋ. 18A tɩŋ ŋ sɩ sɛɩ mɩ niiŋ wɩaa, mɩ jaŋ to ŋ doho nɩaa lɛ a pɛ dʋnɩa nɩaa kala lɛ.”
19Ŋɩɩ nɛ Abɩraham mɩɩra kɔ ʋ tɩntɩnna-la balɩamɩŋ teeŋ. Ba to dɔŋɔ mʋ Bɛɛsɩba. Ŋɩɩ nɛ Abɩraham hɔŋ nɩmɛ.
Nahɔ hambolibiisiŋ
20Ʋ ŋɩɩ harɩŋ nɛ Abɩraham nɩɩ arɩ Mɩlɩka lʋl biiriŋ pɩ ʋ naambie Nahɔ: 21Yus ʋ bii-hɩaŋ, arɩ ʋ ŋaana Bus arɩ Kɛmʋɛl (Aram nyɩmma). 22Mɩlɩka biiri-la dɔnsʋŋ nɛ ŋ-la: Kɛsɛd, Hazo, Pilidas, Jidilaf arɩ Bɛtʋɛl. 23Bɛtʋɛl tolo nɛ Rɩbɛka. Mɩlɩka lʋl biiriŋ chori nɛ a pɩ Nahɔ, Abɩraham naambie. 24Ruuma fa ŋaa Nahɔ haala dɔŋɔ ʋ sɩ bile nɛ aŋ ha bɩ jaa ka ba lʋl biiriŋ deemba: Teba, Gaham, Tahas arɩ Maaka.",https://www.bible.com/bible/2553/GEN.22.SIS
WƖAA DƖ-SUOMUŊ 23,"Sara sʋba
1Sara hɛ ʋ mɩɩsɩŋ lɛ jɩsɩŋ zɔlɔ arɩ mara arɩ balɩpɛ nɛ 2aŋ sʋʋ Hɛbʋrɔŋ lɛ Kɛnaŋ tinteeŋ. Ŋɩɩ nɛ Abɩraham mʋ dɩ ʋ yel ʋ yoho. Hɛbʋrɔŋ nɛ ba haa yɩrɛ Kɩrɩaf-Aba.
3Ŋɩɩ nɛ Abɩraham sii sʋʋ-la bʋbʋɔŋ a mʋ Hiti tɩŋŋaa teeŋ a bʋl, 4“Mɩ ŋaa nʋhʋɔrʋ nɛ ma tʋɔŋ, mɩɩ sʋlma, má yallɛ leriŋ pɩmɛ dɩ mɩ joŋ mɩ haala hugi.”
5Hiti tɩŋŋaa ma bʋla pɩ Abɩraham, 6“Nɩhɩaŋ, jegile nɩɩ la teeŋ, ŋ ŋaa kuori-bii-duo nɛ a hɛ la tʋɔŋ. Lɩɩsɛ la bʋɔsʋ-la tʋɔŋ kʋzɔmʋŋ a hugi ŋ haala. La kʋŋkala bɩ jaŋ vɔmʋŋ leriŋ.”
7Ŋɩɩ nɛ Abɩraham tuu kpirimi Hiti tɩmma-la sɩpaaŋ 8aŋ bʋl, “Dɩ ma nɛ jaŋ sɛɩ dɩ mɩ hugi mɩ haala daha, má sʋl Zoha nanʋala Ɛfʋrɔŋ pɩmɛ, 9dɩ ʋ joŋ Makɩpɛla bʋ-bʋa-la sɩ hɛ ʋ ŋmaŋkaaŋ niiŋ, a yalla pɩmɛ ma sɩpaaŋ. Ʋ yalɩŋ sɩ maga ŋɩɩ kala, mɩ jaŋ tiŋ ka dɩ ʋ ŋaa mɩ sʋʋnʋŋ dɩ-huguŋ.”
10Dɩ Ɛfʋrɔŋ Hiti tɩɩna-la arɩ ʋ nɩaa kala hilime ba jaŋ boiŋ niiŋ. Ŋɩɩ nɛ ʋ bʋla pɩ Abɩraham ʋ nɩalɩŋ kala sɩ kʋ hilimi ʋ jaŋ boiŋ niiŋ, ba kala nɩɩ. 11“Aɩ, mɩ kʋhɩaŋ, jegile nɩɩ mɩ teeŋ, mɩ joŋ ŋmaŋkaa-la arɩ bʋa-la kala aa pɩŋ nɛ mɩ nɩaa sɩpaaŋ dɩ ŋ hugi ŋ haala.”
12Ŋɩɩ nɛ Abɩraham bɩra tuu kpirimi tintee-la tɩŋŋaa sɩpaaŋ, 13aŋ bʋla pɩ Ɛfʋrɔŋ, ʋ nɩaa kala sɩpaaŋ, “Ɛfʋrɔŋ, jegile nɩɩ mɩ teeŋ, dɩ ŋ nɛ jaŋ sɛɩ, mɩ jaŋ tiŋ ŋmaŋkaa-la chɩmɩŋ pɩŋ aŋ joŋ mɩ haala hugi nɩmɛ.”
14Ɛfʋrɔŋ bʋla pɩ Abɩraham, 15“Mɩ kʋhɩaŋ, jegile nɩɩ mɩ teeŋ. Tintee-la yalɩŋ ŋaa warɩpʋla zɔɔ-banɛsɛ nɛ, deeŋ saa ŋaa wɩɩ nɛ la dɩŋ pɛgɛ? Joŋ ŋ haala hugi.”
16Ŋɩɩ nɛ Abɩraham sɛɩ a tiŋ moribii-la niiŋ Ɛfʋrɔŋ sɩ daga ʋ nɩaa sɩpaaŋ, warɩpʋla zɔɔ-banɛsɛ, arɩ bayalaa sɩɩ yallɛ ŋɩɩ.
17Ŋmaŋkaa-la sɩ ŋaa Ɛfʋrɔŋ kʋa a hɛ Makɩpɛla lɛ arɩ bʋ-bʋa-la sɩ kpagɛ Mamɩrɛ leriŋ, arɩ tɩɩsɩ-la kala sɩ chɩŋ ŋmaŋkaa-la niiŋ nɛ ʋ joŋo pʋ. 18Hiti tɩmma-la kala fa sɩ hilimi ba jaŋ boiŋ niiŋ sɩpaaŋ ba kala jɩŋ arɩ ʋ ŋaa Abɩraham ŋmaŋkaaŋ nɛ. 19Ʋ ŋɩɩ harɩŋ nɛ Abɩraham joŋ ʋ haala Sara hugi bʋ-bʋa-la lɛ Kɛnaŋ tinteeŋ. 20Hiti tɩŋŋaa sɩ to ŋɩɩ a yallɛ ŋmaŋkaa-la arɩ bʋ-bʋa-la kala a pɩ Abɩraham ʋ ŋaa ʋ sʋʋnʋŋ dɩ-huguŋ nɛ ŋɩɩ.",https://www.bible.com/bible/2553/GEN.23.SIS
