ref,text
"Jesus walked on a little way. Then he knelt with his face to the ground and prayed, “My Father, if it is possible, don't make me suffer by drinking from this cup. But do what you want, and not what I want.”","Ninfɛ aakyɛ sitũ kɛɛkɛ nɛ, ni aapɛ akunkyi aafuusa anu kaasɔ aapɛ ɔlaa alɛ, “Teete, nse diaalɛ yi, faata dibuo opũ wɔ mmle nwu nkpo kufe mi. Kafɔɔ diele mmle okle komiɛ nii, kafɔɔ bla di dibiesaa lɛfɔ suoto.”"
Get up! Let's go. The one who will betray me is already here.” Jesus Is Arrested (Mark,"Bitaka buosifi. Binyu, otii wɔ nikodiki mi anta ni ntɔɔtɛɛtɛɛ.” Yuda Batii Banɔɔfo Lamufũ Yesu."
"Jesus took along Peter and the two brothers, James and John. He was very sad and troubled,","Ni aakpaa Petro ku Sebedeo babi banyɔ nwu nkpo aakyakaa di suoto nɛ. Ditaklɛ ni aabuo nyaami, aakyako otũtũkũ di suoto nɔɔ kamɛ nɛ."
"He came back and found his disciples sleeping. So he said to Peter, “Can't any of you stay awake with me for just one hour?","Ni aakple aawa basaateketetɛ nɔɔ batiɛ nwu nkpo nfũ nɛ, aabanya ma baatɔɔkyɔsĩi. Ninfɛ aakaalɛ Petro alɛ, “Ni bilaafuo osiɛ otoonyunkoe lebombo ninwii pɛ?"
"Stay awake and pray that you won't be tested. You want to do what is right, but you are weak.”","Bita anu lee ate kesekese biɛpɛ ɔlaa bita Yaa alɛ bilaabuo di ɔsɔ onyu kamɛ. Ninwuna komiɛ ɔbla, kafɔɔ suoto sina nnaa osie.”"
He left them and prayed the same prayer once more.,"Yesu lakple aadiɛ ma aatɛ, aasifi aalaapɛ ɔlaa aata Yaa ditiɛfa aabuɛ sɛlaa se okle aabuɛ abafe nii."
"Jesus replied, “My friend, do what you came for.” The men grabbed Jesus and arrested him.","Ninfɛ di Yesu ladiki kanya alɛ, “Siɛwo, lɛsaa le oso fɛɛwa ni ta dipɛsɛwa!” Ninfɛ di batii nwu nkpo ladie baawa Yesu nfũ, ni baamufũ nwɔ, baakle kpinkpĩ nɛ."
"Jesus was still speaking, when Judas the betrayer came up. He was one of the twelve disciples, and a large mob armed with swords and clubs was with him. They had been sent by the chief priests and the nation's leaders.",Yesu lakple aayila aatɔɔkakatɛ ko ma fiɛ di Yuda wɔ ninle ni lefosi batii banyɔ nwu nkpo onwii lɛma lawa. Batii dikudi le di olebatatɛ banɔɔfo ku kufiofa batuotɛ ku okpoo banɔɔfo ladiki ni latikanko nwɔ baatɔɔwa. Baaklee nwosoku ku mpamii.
"Judas had told them ahead of time, “Arrest the man I greet with a kiss.”","Otii wɔ niadiki Yesu aata ni latɔkɔ ma aatɛ alɛ, “Otii wɔ kamaminiko mbla ni atuu yi, nnwɔɔ ninle nwɔ biowolaa ni nɛ. Biemufũ nwɔ.”"
"Judas walked right up to Jesus and said, “Hello, teacher.” Then Judas kissed him.","Di Yuda lanya ni Yesu, ni aakyɛ ɔkyɛ nɔɔ aalaatɔkɔ nwɔ alɛ, “Saatuotɛ, atoko ɔkyɛ ole disiɛko fɔ.” Ninfɛ aaminiko nwɔ aabla nwɔ aatuu nɛ."
One of Jesus' followers pulled out a sword. He struck the servant of the high priest and cut off his ear.,"Ni baatii ba niawɛ ni di Yesu ɔkyɛ, onwii lɛma ladiki kapamii nɔɔ di kotofo kamɛ aasafɔ Oletatɛ Nɔɔfo kpɛmblatɛ kotoko aakpa nɛ."
"But Jesus told him, “Put your sword away. Anyone who lives by fighting will die by fighting.","Ninfɛ di Yesu latɔkɔ nwɔ alɛ, “Kplesa kapamii lɛfɔ fakpee ninfũ feediki ni. Batii ba niɛyɔ ni kapamii yi, kapamii kanya manka."
"The high priest then tore his robe and said, “This man claims to be God! We don't need any more witnesses! You have heard what he said.","Obe wɔ di Oletatɛ Nɔɔfo lanu ni ɔlaa wɔ mmle, ni aabɛ awu nɔɔ aabuɛ alɛ, “Bienu! Ebuɛ mbusuo ɔlaa! Diesinfĩ alɛ otii kuonwii kayila ɔlaa owo kamaa!"
"But Jesus did not answer. So the high priest said, “With the living God looking on, you must tell the truth. Are you the Messiah, the Son of God?”","Kafɔɔ Yesu lamaasa kanya, atabuɛ ɔlaa kuonwii. Ninfɛ di Oletatɛ Nɔɔfo lakple aatɔkɔ nwɔ alɛ, “Lɛka Yaa wɔ ninkpe ni nkpa lekpete fɔ nlɛ tɔkɔwo, nse afɔ ninle Kristo nwu nkpo, Yaa wɔ ninkpe ni nkpa Obi.”"
"When Peter had gone out to the gate, another servant girl saw him and said to some people there, “This man was with Jesus from Nazareth.”","Ninfɛ aadie aalaayila di kaflɔnkɔ nwu nkpo kayokontũ nɛ. Ninfɛ di kpɛmblatɛ ɔsankobi bamba lanya Petro, ni aatɔkɔ basuɔtɔ ba niayila ni ninfa alɛ, “Osuɔtɔ wɔ mmle kafɔɔ latikanko Yesu Nasaret Otii nwu nkpo.”"
"After Jesus had been arrested, he was led off to the house of Caiaphas the high priest. The nation's leaders and the teachers of the Law of Moses were meeting there.","Ninfɛ di batii ba niamufũ ni Yesu lakpaa nwɔ baasifiko Oletatɛ Nɔɔfo Kaiafa leyo nɛ, nfũ di kufiofa batuotɛ ku okpoo banɔɔfo lasi nii."
But Peter followed along at a distance and came to the courtyard of the high priest's palace. He went in and sat down with the guards to see what was going to happen.,Petro latikanko nwɔ sɛɛmaa fanfa aalaabuo Yaa Oletatɛ Nɔɔfo nwu leyo kaflɔnkɔ di bawo kalɛɛkɔ. Aakyɛ aalaasiɛ di asaa banyuntɛ ɔlɔɔkɔ aatoonyu mmle okle di ɔsaabla nwu nkpo mate kunfe nii.
The chief priests and the whole council wanted to put Jesus to death. So they tried to find some people who would tell lies about him in court.,Olebatatɛ banɔɔfo ku bakantɛ nwu nkpo niawɛ ni ninfa bamuu lamiɛ alɛ boobudi kanya mantika di Yesu suoto mmle okle baafuo nwɔ ni olo.
"But they could not find any, even though many did come and tell lies. At last, two men came forward","Kafɔɔ batawɛ ɔlaa kuonwii di suoto nɔɔ, nu batii kpinwu ladie baabudi nwɔ kanya. Lɛyɛntɛle, batii banyɔ banwii ladie,"
"and said, “This man claimed he could tear down God's temple and build it again in three days.”","bababuɛ alɛ, “Otii wɔ mmle labuɛ alɛ, ‘Kamabiɛ Yaa Olekatakɔ ka mmle, ninni kamaa, mayɔ ayi atiɛ nse ni letofo.’ ”"
"“That is what you say!” Jesus answered. “But I tell all of you, ‘Soon you will see the Son of Man sitting at the right side of God All-Powerful and coming on the clouds of heaven.’ ”","Ninfɛ di Yesu ladiki kanya alɛ, “Ɛɛ! Nwu fatoobuɛ fɛ mmle kute ni nɛ. Kafɔɔ kɔtɔkɔ ye nlɛ, diɛyɔ di nua diesifi nii, bibanya Otii Obi nwu nkpo nsi di Yaa wɔ ninlenke ni oletanɛɛkyɛ. Bibanyɔɔ kafɔɔ eekye osi ɔɔwa di alokonkyɛ kamɛ!”"
Then they spit in his face and hit him with their fists. Others slapped him,"Ninfɛ baatufa sita baakpete nwɔ di anu, ni baapɛ nwɔ nɛ. Bawo kafɔɔ lapɛ nwɔ nnɛɛ di atokosi."
"and said, “You think you are the Messiah! So tell us who hit you!” Peter Says He Doesn't Know Jesus (Mark","Ni baakaalɛ nwɔ alɛ, “Afɔ ninle Kristo nwu nɛ? Tɔkɔ wo, otii wɔ niɛpɛ fɔ ni!” Petro Lasĩ Yesu Aalaa Aabuɛ Alɛ Aaye Nwɔ."
"Again Peter denied it, and this time he swore, “I don't even know that man!”","Ninfɛ di Petro lakple aasĩ aaka di asaa aabuɛ alɛ, “Ninye osuɔtɔ nwu nkpo kama!”"
"While Peter was sitting out in the courtyard, a servant girl came up to him and said, “You were with Jesus from Galilee.”","Kafɔɔ Petro lasiɛ kaayi di leyo nwu kaflɔnkɔ fiɛ di Olebatatɛ ɔnɔɔfo kpɛmblatɛ ɔsankobi onwii lawa abatɔkɔ nwɔ alɛ, “Afɔɔ fatikanko Yesu wɔ niekye ni Galilea kasɔ!”"
"But in front of everyone Peter said, “That isn't so! I don't know what you are talking about!”","Kafɔɔ Petro lasĩ di batii nwu nkpo bamuu anu aabuɛ alɛ, “Ninye ɔlaa kuonwii nkyeko ɔlaa wɔ foobuɛ ni suoto.”"
"A little while later some people standing there walked over to Peter and said, “We know you are one of them. We can tell it because you talk like someone from Galilee.”","Ditaklɛ saa, ni di basuɔtɔ ba niayila ni ninfa lawa Petro nfũ babatɔkɔ nwɔ alɛ, “Nwaako, afɔɔ, onwii lɛma fale. Diekye mmle okle fɔɔkakatɛ nii, ditoodiki dietuo klekle.”"
"Peter began to curse and swear, “I don't know that man!” Right then a rooster crowed,","Ninfɛ di Petro labuɛ alɛ, “Lɛka nlɛ nwaako kobuɛ! Yaa ananfi mi kootoko nse ɔlaa kɔlaa! Ninye osuɔtɔ wɔ mmle.” Nfanwu, ni di kɔɔkɔ labo nɛ."
"and Peter remembered that Jesus had said, “Before a rooster crows, you will say three times you don't know me.” Then Peter went out and cried bitterly.","Ninfɛ di Petro lanyuma alɛ Yesu latɔkɔ nwɔ alɛ, “Fiɛ di kɔɔkɔ mabo nii, fabasĩ mi sitiɛ fambuɛ falɛ, faaye mi.” Nkpo oso aadie aasifi kayi aalaawi kaku osie kanya."
Pilate knew the leaders had brought Jesus to him because they were jealous.,Aakaalɛ ma ɔlaa nwu nkpo diekye aatofo alɛ onunsɛɛ kanya oso di Yuda banɔɔfotii lakpaa Yesu baawako nwɔ.
"On the way they met a man named Simon who was from Cyrene, and they forced him to carry Jesus' cross.","Di obe wɔ batoodie boosifi nii, ni baakyakako osuɔtɔ onwii baatɔɔlɛɛ ni Simon nɛ. Aakye Kirene kasɔ. Ninfɛ di bakpɛtɛ nwu nkpo layila nwɔ di suoto alɛ afũ Yesu kowoso nwu nkpo atuka nɛ."
"and said, “I have sinned by betraying a man who has never done anything wrong.” “So what? That's your problem,” they replied.","Ni aatɔkɔ ma alɛ, “Lɛbla okpile di obe wɔ lediki otii wɔ ninambla ni okpile lɛta nlɛ balo nii.” Ni baatɔkɔ nwɔ alɛ, “Nnwu nkpo diɛkaako wo. Ɔlaa lɛfɔ kule!”"
Then they had a meeting and decided to buy a field that belonged to someone who made clay pots. They wanted to use it as a graveyard for foreigners.,"Di obe wɔ baakpee ni asi baawo, baatuna alɛ babayɔ koto nwu nkpo man-ya dibukii blatɛ kasɔ, nfa kafɔɔ babatookookaa bafɔɔ nɛ."
This is why people still call that place “Field of Blood.”,"Nle mmle oso, bia miɛ bɔɔlɛɛ kasɔ nwu nkpo alɛ Ntɔ Kasɔ nɛ."
"So the words of the prophet Jeremiah came true, “They took the thirty silver coins, the price of a person among the people of Israel.","Nioso ɔlaa wɔ di Yaa Ɔlaabuɛtɛtɛ Yeremia labuɛ aatɛ ni lawa kaanya nwaako. Aabuɛ alɛ, “Baayɔ koto fututu afosi atiɛ ko di Israel batii latuna alɛ baata ni diisi nɔɔ,"
"They paid it for a potter's field, as the Lord had commanded me.” Pilate Questions Jesus (Mark",baaya dibukii blatɛ kasɔ fɛ mmle di Saate latɔkɔ mi nii.” Pilato Lakaalɛ Yesu Sɛlaa.
"Jesus was brought before Pilate the governor, who asked him, “Are you the king of the Jews?” “Those are your words!” Jesus answered.","Baakpaa Yesu baalaase di Roma batii abaa ɔnɔɔfo Pilato anu. Ni aakaalɛ nwɔ alɛ, “Afɔ ninle Yuda batii Ɔka nwu nɛ?” Ninfɛ di Yesu ladiki kanya alɛ, “Nnwu fatoobuɛ nɛ.”"
"And when the chief priests and leaders brought their charges against him, he did not say a thing.","Kafɔɔ obe wɔ di olebatatɛ banɔɔfo ku okpoo banɔɔfo nwu nkpo layila baatoobudi nwɔ ni kanya yi, Yesu ditakpee ma kanya."
"But Jesus did not say anything, and the governor was greatly amazed. The Death Sentence (Mark",Kafɔɔ Yesu lasĩ atabɛ kanya adiki ɔlaa kuonwii kanya. Nioso diabla abaa nɔɔfo nwu nkpo ɔkpɛ. Pilato Lalo Yesu Kukpi Lɛpɔɔ.
Pilate set Barabbas free. Then he ordered his soldiers to beat Jesus with a whip and nail him to a cross. Soldiers Make Fun of Jesus (Mark,"Ninfɛ di Pilato ladiɛ Baraba aata ma nɛ. Kafɔɔ obe wɔ aata baapɛ Yesu ku mpile baaloo nii, ni aayɔ nwɔ aakpee ma ninnɛɛ alɛ balaapɛ nwɔ bakaasa di kowosa suoto nɛ. Roma Batii Bakpɛtɛ Nwu Nkpo, Lakpee Yesu Sinunsɔ."
People who passed by said terrible things about Jesus. They shook their heads and,"Batii ba niatoofe ni ninfa bamuu latũkunsa asi, baatufa Yesu baabuɛ alɛ,"
But the chief priests and the leaders convinced the crowds to ask for Barabbas to be set free and for Jesus to be killed.,"Kafɔɔ olebatatɛ banɔɔfo ku okpoo banɔɔfo nwu nkpo lakpee batii dikudi nwu nkpo ɔtɔ alɛ, baakaalɛ Pilato alɛ adiɛ Baraba ata ma, aalo Yesu."
"Pilate saw that there was nothing he could do and that the people were starting to riot. So he took some water and washed his hands in front of them and said, “I won't have anything to do with killing this man. You are the ones doing it!”","Di obe wɔ di Pilato lanya alɛ ɔlɔbasinfuo ni lele kuniwii ɔbla, kafɔɔ kudu nfɛ nimadie ni yi, ni aayɔ ntu, aafoto nnɛɛ nɔɔ di batii nwu nkpo dikudi anu, aabuɛ alɛ, “Nnɛɛ nii diesi di osuɔtɔ wɔ mmle kukpi kamɛ lo! Oleye kule lo!”"
"Everyone answered, “We and our own families will take the blame for his death!”","Ninfɛ di batii dikudi nwu nkpo bamuu labuɛ alɛ, “Kukpi nɔɔ lɛkpaani ditika di awo ku babiloo disi!”"
"They made a crown out of thorn branches and placed it on his head, and they put a stick in his right hand. The soldiers knelt down and pretended to worship him. They made fun of him and shouted, “Hey, you king of the Jews!”","Ni baabla sɛkansi lɛkakoto baatũkũsɔɔ nɛ. Ninfɛ baayɔ ɔkyɛnwoso onwii baakleesɔɔ di koletanɛɛ nɔɔ nɛ. Ninfɛ baapɛ akunkyi kaatũ nɔɔ baama nwɔ baatɔɔtaa siwidi alɛ, “Yii yiiduu! Yuda batii Ɔka, asiɛ nkpa aklɛ!”"
"He trusted God, so let God save him, if he wants to. He even said he was God's Son.”","Eetika Yaa disi, ɔɔlɛɛ suoto kafɔɔ alɛ Yaa Obi ale. Nse nwaako Yaa mbɔmbɔ nwɔ yi, ni aabafũ nwɔ buonyu!”"
"When the soldiers had finished making fun of Jesus, they took off the robe. They put his own clothes back on him and led him off to be nailed to a cross.","Di obe wɔ baaloo nwɔ ni ɔma, baadiki nwɔ awu sɛɛle nwu di suoto baakplesa awu nɔɔ amu baakpee nwɔ. Ninfɛ baakpaa nwɔ baasifiko alɛ bɔɔlaapɛ nwɔ sibuɛ mankaasa koowoso suoto nɛ. Baapɛ Yesu Sibuɛ Baakaasa Koowoso Suoto."
"There they gave Jesus some wine mixed with a drug to ease the pain. But when Jesus tasted what it was, he refused to drink it.","Ninfɛ baayɔ nta be bɛɛkpɔtɔɔsa ni ku kɔfa lonle baata Yesu alɛ anyi nɛ. Kafɔɔ obe wɔ aatu aanyu nii, aasĩ mi onyi."
The soldiers nailed Jesus to a cross and gambled to see who would get his clothes.,"Ninfɛ di bakpɛtɛ nwu nkpo lapɛ nwɔ sibuɛ baakaasa koowoso suoto nɛ. Nni kamaa, baayɔ awu nɔɔ baasɛ bawo di obe wɔ baawii ni atrebi baatofo n-ya di obiala lɛma kayɔ nii."
Then they sat down to guard him.,"Nni kamaa, ni baasiɛ ninfa baatoonyu nwɔ nɛ."
"Above his head they put a sign that told why he was nailed there. It read, “This is Jesus, the King of the Jews.”","Ni baayɔ kataabookyɛɛ baapɛ baakaasa di lɛkantosi nɔɔ, ni baakpana lɛsaa le oso beelo nwɔ nii alɛ, “Nnya Yesu Yuda Batii Ɔka Nwu Ninle Nwɔ Nɛ.”"
"shouted, “So you're the one who claimed you could tear down the temple and build it again in three days! If you are God's Son, save yourself and come down from the cross!”","“Afɔ niabuɛ falɛ fababiɛ Yaa Olekatakɔ ka mmle, fanse ni letofo di ayi atiɛ kamɛ nɛ! Nse Yaa Obi fale nwaako, faasoo koowoso nwu fawa, faafũ suoto lɛfɔ nkpa buonyu!”"
"Others said, “Wait! Let's see if Elijah will come and save him.”","Kafɔɔ batii bamba labuɛ alɛ, “Bita buyila buonyu, nse Elia kamawa amadiki nwɔ di kowoso suoto.”"
At noon the sky turned dark and stayed that way until three o'clock.,"Kakũ lefosi elomu ɛnyɔ lebe, kayi kamuu lawɔfɔ, dialaase di kɔtɔɔfɔ elomu etiɛ kamɛ."
"Then about that time Jesus shouted, “Eli, Eli, lema sabachthani?” which means, “My God, my God, why have you deserted me?”","Di kɔtɔɔfɔ elomu etiɛ kamɛ okle, Yesu lafaa osie kanya aabuɛ alɛ, “Eli, Eli, lama sabaktani?” Lɛsɔdiki ninle alɛ, “Yaa nii, Yaa nii, be oso feediɛ mi nnɛɛ nkpo?”"
"One of them at once ran and grabbed a sponge. He soaked it in wine, then put it on a stick and held it up to Jesus.","Nfanwu onwii kaamɛ lɛma latoso aalaayɔ oleteku aanyɔ di nta nyankale kamɛ, aayɔ aatũ di owoso suoto, aamiɛ alɛ ɔɔyɔ ankyɔɔ nwɔ annyi."
"At once the curtain in the temple was torn in two from top to bottom. The earth shook, and rocks split apart.","Nfanwu, dibula le ninsaka ni di Yaa Olekatakɔ nwu nkpo kamɛ niabɛ di akyuu anyɔ diakye di osi dialaase kaasɔ. Kasɔ kafɔɔ latukũ, afuɔ labibiɛ."
"Graves opened, and many of God's people were raised to life.","Sɛkya kafɔɔ labɛ siatikiti, Yaa batii klekle ba nintookpi bɛɛbafe ni bawo lataka baakye bakpi kamɛ."
"They left their graves, and after Jesus had risen to life, they went into the holy city, where they were seen by many people.","Baadie di sɛkya lɛma kamɛ obe wɔ di Yesu lakple aataka aakye ni bakpi kamɛ yi, baasifi Yerusalem okpoo klekle nwu nkpo kamɛ baalaadiki suoto baatuo batii kpinwu."
"The officer and the soldiers guarding Jesus felt the earthquake and saw everything else that happened. They were frightened and said, “This man really was God's Son!”","Di obe wɔ di bakpɛtɛ ɔnɔɔfo ku bakpɛtɛ nwu nkpo niayila baatonyu ni Yesu lanya mmle okle kaasɔ latukũ ni ku aasaa ya amuu niabla ni yi, lɛyɛkɛ lapɛ ma osie kanya! Ninfɛ baabuɛ alɛ, “Nwaako, Yaa Obi ninle otii wɔ mmle!”"
"Many women had come with Jesus from Galilee to be of help to him, and they were there, looking on at a distance.","Basanko ba kpinwu kafɔɔ niatikanko Yesu baatɔɔkyakaako nwɔ ni, baakye ni Galilea lawɛ ninfa. Baayila kaakyonkɔ baatoonyu asaa ya niatɔɔwa nii."
That evening a rich disciple named Joseph from the town of Arimathea,"Obe wɔ kɔɔtɔɔfɔ lawo nii, osuɔtɔ onwii niale ni saawɛntɛ baatɔɔlɛɛ ni Yosef lawa, aakye Arimatea. Yesu saateketetɛ aale."
"went and asked for Jesus' body. Pilate gave orders for it to be given to Joseph,",Aakyɛ Pilato nfũ alɛ ayɔ Yesu kpi atɔɔ. Ninfɛ di Pilato lata osuku alɛ balaayɔ kpi nwu nkpo batɔɔ nɛ.
who took the body and wrapped it in a clean linen cloth.,"Ninfɛ di Yosef lasifi aalaayɔ kpi nwu nkpo, ni aayɔ dibula fututu aamiminisa nwɔ di suoto nɛ."
Then Joseph put the body in his own tomb that had been cut into solid rock and had never been used. He rolled a big stone against the entrance to the tomb and went away.,Ninfɛ aayɔ nwɔ aalaakokaa di ofuɔntuu ɔkya fɔle wɔ aakutu aata ni suoto kamɛ nɛ. Ninfɛ aamunusa difuɔ dibinte ninwii aatĩi ofuɔntuu nwu kanya nɛ. Ni aasifi nɛ.
All this time Mary Magdalene and the other Mary were sitting across from the tomb.,Ninfɛ di Maria Magdalene ku Maria nyɔɔfa lasiɛ ninfa baakyɔɔ ɔkya nwu nkpo anu nɛ. Basaanyuntɛ Layila Baatoonyu Yesu Ɔkya Nwu Nkpo.
"On the next day, which was a Sabbath, the chief priests and the Pharisees went together to Pilate.","Kaleesɛ niale ni Lɛnyɛɛtɛyi yi, olebatatɛ banɔɔfo ku Farisi batii lalɛɛ bawo di Pilato nfũ."
"They said, “Sir, we remember what this liar said while he was still alive. He claimed in three days he would come back from death.","Ni baatɔkɔ nwɔ alɛ, “Ɔnɔɔfo, buonyuma bulɛ obe wɔ di laatɛ nwu nkpo lasiɛ ni nkpa yi, aabuɛ alɛ, ‘Nse lekpi yi, makple ntaka nkye bakpi kamɛ di ayi atiɛ kamɛ.’"
"So please order the tomb to be carefully guarded for three days. If you don't, his disciples may come and steal his body. They will tell the people he has been raised to life, and this last lie will be worse than the first one.”","Nkpo oso ta falɛ basaanyuntɛ lɛlaayila beenyu ɔkya nwu nkpo osie kanya diɛlaase di ayi atiɛ kamɛ. Nse faata babla nle mmle yi, basaateketetɛ nɔɔ makyɛ manayu nwɔ mansifiko, manatɔkɔ batii alɛ, ‘Atɔɔtaka eekye bakpi kamɛ.’ Nse diɛwa ninkpo yi, sɛlaa kuafunu se babakple malaa ni malenkee lɛkasale.”"
"Pilate said to them, “All right, take some of your soldiers and guard the tomb as well as you know how.”","Ninfɛ di Pilato latɔkɔ ma alɛ, “Bita bakpɛtɛ bakyɛ balaayila banyu ɔkya nwu nkpo fɛ mmle dikaatɛ ni.”"
So they sealed it tight and placed soldiers there to guard it.,Ninfɛ baakyɛ baalaatĩi ɔkya nwu nkpo kanya osie kanya baatɛ nwu nsũ nɛ. Ninfɛ baadiki bakpɛtɛ baase baatoonyu ɔkya nwu nkpo nɛ.
"Jesus' eleven disciples went to a mountain in Galilee, where Jesus had told them to meet him.","Ninfɛ di basaateketetɛ nɔɔ lefosi onwii nwu nkpo, lakata baasifi Galilea di kobokote ko suoto di Yesu latɔkɔ ma alɛ basifi ni nɛ."
So the chief priests met with the leaders and decided to bribe the soldiers with a lot of money.,"Ninfɛ di olebatatɛ banɔɔfo nwu nkpo ku okpoo banɔɔfo, lalɛɛ bawo baabla disibu nɛ. Ni baata basaanyuntɛ nwu nkpo koto dikudi kplɛ ninwii nɛ,"
"and teach them to do everything I have told you. I will be with you always, even until the end of the world.",Bietuo ma bilɛ bakyɔɔ asaa ya amuu letuo ye ni atoko. Nwaako kamasiɛko ye obe lele ninaadu bia kayi ka mmle kalookɔ.”
"Then Jesus said, “Don't be afraid! Tell my followers to go to Galilee. They will see me there.” Report of the Guard","Ninfɛ di Yesu latɔkɔ ma alɛ, “Bitanyɛkɛ. Bitɔɔkyɛ biɛlaatɔkɔ babiloo bilɛ, batɔɔkyɛ Galilea, babanyɛɛ ninfa.” Basaanyuntɛ Nwu Nkpo Lakyɛ Baalaabuɛ Lɛsaa Le Baanya Nii."
"Suddenly a strong earthquake struck, and the Lord's angel came down from heaven. He rolled away the stone and sat on it.","Nfanwu, kasɔ latũkũ osie kanya. Ni di Yaa tɔkyɛntɛ onwii lasoo aakye osi aawa, abamunusa difuɔ nwu nkpo di ɔkya kanya, ni aasiɛ ni di suoto nɛ."
"The angel looked as bright as lightning, and his clothes were white as snow.","Suoto nɔɔ odiki otuo late fɛ ɔplalaa nimunaa, awu nɔɔ kafɔɔ lapu fɛle oleteku."
"The guards shook from fear and fell down, as though they were dead.","Lɛyɛkɛ lamufũ basaanyuntɛ nwu nkpo osie kanya, baakyako otũtũkũ baaklee baabla fɛ bakpi."
"The angel said to the women, “Don't be afraid! I know you are looking for Jesus, who was nailed to a cross.","Ninfɛ di Yaa tɔkyɛntɛ nwu nkpo latɔkɔ basanko nwu alɛ, “Bitanyɛkɛ. N-ye nlɛ Yesu wɔ baapɛ sibuɛ baakaasa ni koowoso suoto biowolaa."
"Now hurry! Tell his disciples he has been raised to life and is on his way to Galilee. Go there, and you will see him. This is what I came to tell you.”","Kanunua bipɛsɛwa biɛtɔɔkyɛ bilaatɔkɔ basaateketetɛ nɔɔ bilɛ, ‘Aatɔɔtaka eekye bakpi kamɛ. Atoole ye katũ oofe Galilea. Nfa bibanyɔɔ nɛ.’ Binyuma ɔlaa wɔ lɛtɔkɔ ye ni!”"
"Suddenly Jesus met them and greeted them. They went near him, held on to his feet, and worshiped him.","Nfanwu, Yesu lakyakako ma di osuku. Ni aatɔkɔ ma alɛ, “Atoko ɔkyɛ ole disiɛko ye.” Ninfɛ baakpukuti baatɛɛtɛ nwɔ, baamufũ nwɔ nkpaa, baasumu nwɔ nɛ."
"While the women were on their way, some soldiers who had been guarding the tomb went into the city. They told the chief priests everything that had happened.","Di obe wɔ di basanko nwu nkpo ntɔɔkyɛ boosifi nii, basaanyuntɛ nwu nkpo bawo niatoonyu ni ɔkya nwu nkpo, baasifi okpoo kamɛ baalaatɔkɔ olebatatɛ banɔɔfo asaa ya amuu niawa ni ninfa."
"They said to the soldiers, “Tell everyone that Jesus' disciples came during the night and stole his body while you were asleep.","ni baatɔkɔ ma alɛ, “Bibuɛ bilɛ obe wɔ bite biɔkyɔsĩi ni ku kakyɛ, ni baasaateketetɛ nɔɔ labayu nwɔ baasifiko nɛ."
The soldiers took the money and did what they were told. The people of Judea still tell each other this story. What Jesus' Followers Must Do (Mark,Basaanyuntɛ nwu nkpo lafũ koto nwu nkpo baabla fɛ mmle okle baakpee ma nii. Nioso ɔlaa lɛma nwu nkpo labiɛ kuabuo di Yuda batii kamɛ diɛbase bia miɛ. Yesu Ladiki Suoto Aatuo Basaateketetɛ Nɔɔ.
Jesus came to them and said: I have been given all authority in heaven and on earth!,"Ninfɛ di Yesu lakpukuti aatɛɛtɛɛ ma ni aatɔkɔ ma alɛ, “Yaa lɛyɔ osi ku kasɔ osie omuu eekpee mi di nnɛɛ kamɛ."
"Go to the people of all nations and make them my disciples. Baptize them in the name of the Father, the Son, and the Holy Spirit,","Nkpo oso bitɔɔkyɛ kayi ka mmle nnle mmuu kamɛ, biɛlaabla batii basaateketetɛ nii. Biekpeesa ma Yaa ntu di Ote, Obi, ku Ninwuna Klekle leyooto kamɛ."
"They saw him and worshiped him, but some of them doubted.","Di obe wɔ baanyɔɔ nii, baase akunkyi kaasɔ baasumu nwɔ. Kafɔɔ batii bawo kaamɛ lɛma ditafũ baanu alɛ nnwɔɔ diale."
Right then the two brothers dropped their nets and went with him.,"Nfanwu ni baadiɛ asawu lɛma, baatikanko nwɔ nɛ."
"Jesus walked on and soon saw James and John, the sons of Zebedee. They were in a boat, mending their nets.","Aakyɛ ni sitũ kɛɛkɛ, ni aanya babilɛma banyɔ banwii ninle ni Sebedeo babi Yakobo ku Yohane, baasiɛ di oklo kamɛ baatoololaa asawu lɛma."
News about Jesus quickly spread all over Galilee. Jesus Heals Many People (Matthew,Ta nkpo oso Yesu leyooto lakyaka Galilea kasɔ kamuu. Yesu Lakya Batii Sifiɛ.
"It began just as God had said in the book written by Isaiah the prophet, “I am sending my messenger to get the way ready for you.","Binyu! Diawa fɛ mmle di Yaa Ɔlaa Buɛtɛtɛ Yesaia lakpana aatɛ ni kofokofoko alɛ, “Makyesee tɔkyɛntɛ nii anle fɔ katũ, aanaalolaa osuku antɛ fɔ."
John wore clothes made of camel's hair. He had a leather strap around his waist and ate grasshoppers and wild honey.,"Di obe wɔ mmle kamɛ Yohane lakpee kapupɔnkɔ sinwini awu, ni aayɔ bɔkɛɛ kukũ okũ aatika ofiamɛ nɛ. Alesaa nɔɔ niale akpakyekyee ku bablɔ."
"John also told the people, “Someone more powerful is going to come. And I am not good enough even to stoop down and untie his sandals.","Ɔlaa wɔ aatoobuɛ ninle alɛ, “Otii wɔ nimawa ni sɛɛmaa nii nlenke mi. Ale Otii wɔ ninansiɛko alɛ bia kadiki nwɔ ni ntokota fɛ kpɛmblatɛ."
Jesus and his disciples went to the town of Capernaum. Then on the next Sabbath he went into the synagogue and started teaching.,"Ni baasifi Kapernaum okpoo nɛ. Obe wɔ di Yuda batii Lɛnyɛɛtɛyi nwu lawo nii, Yesu lasifi kasiisakɔ lɛma, ni aalaakya ko batii asaa otuo nɛ."
"Everyone was amazed at his teaching. He taught with authority, and not like the teachers of the Law of Moses.","Asaa nɔɔ otuo labla ma ɔkpɛ, diekye aatuo ma asaa fɛ otii wɔ ninkpe ni otumi, ninanle ni fɛ mmle di kufiofa batuotɛ ntuo nii."
