Title,Content,URL
GYENESIS 1,"Adebɔ Mfiase
1Mfiase no Onyankopɔn bɔɔ ɔsoro ne asase. 2 Na asase da hɔ hunu a enni bɔbea biara na Onyankopɔn honhom butuw nsu no ani.
3 Na Onyankopɔn kae sɛ: Ɛnyɛ hann! Na ɛyɛɛ hann. 4Na Onyankopɔn huu hann no sɛ eye. Na Onyankopɔn paee hann ne sum no mu. 5 Na ɔfrɛɛ hann no sɛ: Adekyee, na esum no de, ɔfrɛɛ no adesae. Na ade sae, na ade kyee, da a edi kan nen.
6 Na Onyankopɔn kae sɛ: Ntrɛwmu mmra nsu no ntam, na ɛmmɛpae nsu no mu. 7Na Onyankopɔn yɛɛ ahun mu ntrɛwmu, na ɔpaee nsu a ɛwɔ ntrɛwmu no ase ne nsu a ɛwɔ ntrɛwmu no so no mu. Na ɛyɛɛ sa. 8 Na Onyankopɔn frɛɛ ntrɛw mu no ɔsoro. Na ade sae, na ade kyee, da a ɛto so abien nen.
9 Na Onyankopɔn kae sɛ: Nsu a ɛwɔ ɔsoro ase no mmoaboa ano wɔ faako, na wonhu asase kesee. Na ɛyɛɛ sa. 10Na Onyankopɔn frɛɛ kesee no asase, na nsu mmoaano no, ɔfrɛɛ no ɛpo. Na Onyankopɔn hui sɛ eye.
11Na Onyankopɔn kae sɛ asase mfifi nwura frɔmfrɔm, nhaban a ɛsow aba, nnua a ɛsow nnuaba sɛnea ne su te a n'aba wɔ mu, wɔ asase so. Na ɛyɛɛ sa. 12Na asase fifii wura, nhaban a ɛsow aba sɛnea ne su te, ne nnua a ɛsow nnuaba a n'aba wɔ mu sɛnea ne su te. Na Onyankopɔn hui sɛ eye. 13Na ade sae, na ade kyee, da a ɛto so abiɛsa nen.
14 Na Onyankopɔn kae sɛ: Akanea mmra ɔsoro ntrɛwmu no mu, na ɛmmɛpae awia ne anadwo mu, na ɛnyɛ nsɛnkyerɛnne ne bere nkyekyem ne nna ne mfe; 15na ɛnyɛ akanea wɔ ɔsoro ntrɛwmu no mu, na ɛnharan asase so. Na ɛyɛɛ sa. 16 Na Onyankopɔn yɛɛ akanea akɛse abien no, ɔkanea kɛse no, sɛ enni awia so, ne ɔkanea ketewa no, sɛ enni anadwo so, ne nsoromma nso. 17Na Onyankopɔn de sisii ɔsoro ntrɛwmu no mu sɛ ɛnharan asase so, 18na enni awia ne anadwo so, na ɛmpae hann ne esum no mu. Na Onyankopɔn hui sɛ eye. 19Na ade sae, na ade kyee, da a ɛto so anan nen.
20Na Onyankopɔn kae sɛ: Nsu no nnɔ abɔde a ɛte ase manyamanya, na ntakraboa ntu mfa asase so ɔsoro ntrɛwmu no ani. 21Na Onyankopɔn bɔɔ nsuboa akɛse ne abɔde a ɛte ase a ɛkeka ne ho a ɛyɛ nsu mu manyamanya nyinaa, sɛnea wɔn su te, ɛne nnomaa a wɔwɔ ntaban nyinaa, sɛnea wɔn su te. Na Onyankopɔn hui sɛ eye. 22Na Onyankopɔn hyiraa wɔn sɛ: Monwo, na monnɔ, na monyɛ ɛpo mu nsu mu ma, na ntakraboa nnɔɔso asase so. 23Na ade sae, na ade kyee, da a ɛto so anum nen.
24Na Onyankopɔn kae sɛ: Asase mma abɔde a ɛtete ase mfi mmra, sɛnea wɔn su te; ntɔteboa ne mmoa a wɔwea ne asase so mmoadoma, sɛnea wɔn su te. Na ɛyɛɛ sa. 25Na Onyankopɔn yɛɛ asase so mmoadoma sɛnea wɔn su te, ne ntɔteboa sɛnea wɔn su te, ne mmoa a wɔwea fam nyinaa sɛnea wɔn su te. Na Onyankopɔn hui sɛ eye.
26 Na Onyankopɔn kae sɛ: Momma yɛnyɛ onipa wɔ yɛn suban so sɛ yɛn sɛso, na wonni ɛpo mu mpataa ne wim nnomaa ne ntɔteboa ne mmoa a wɔwea asase so nyinaa so.
27 Na Onyankopɔn bɔɔ onipa wɔ ne suban so,
Yiw Onyankopɔn suban so na ɔbɔɔ no,
ɔbarima ne ɔbea na ɔbɔɔ wɔn.
28 Na Onyankopɔn hyiraa wɔn, na Onyankopɔn ka kyerɛɛ wɔn sɛ: Monwo, na monnɔre, na monyɛ asase so ma, na monni so tumi, na munni ɛpo mu mpataa ne wim nnomaa ne mmoa a wɔkeka wɔn ho wɔ asase so nyinaa so.
29Na Onyankopɔn kae sɛ: Hwɛ, mede nhaban a ɛsow aba nyinaa a ɛwɔ asase nyinaa ani, ɛne nnua nyinaa a adua a n'aba wɔ mu wɔ so mama mo sɛ ɛnyɛ mo aduan. 30Na asase so mmoadoma nyinaa ne wim nnomaa nyinaa ne mmoa a wɔwea asase so nyinaa a ɔkra a ɛte ase wɔ wɔn mu no, mede nhaban momono mama wɔn sɛ wonni. Na ɛyɛɛ sa. 31Na Onyankopɔn huu nea ɔyɛe nyinaa, na hwɛ, eye papa. Na ade sae, na ade kyee, da a ɛto so asia nen.",https://www.bible.com/bible/3439/GEN.1.ATWDB
GYENESIS 2,"Homeda
1Na wowiee ɔsoro ne asase ne nea ɛwɔ mu nyinaa. 2 Na da a ɛto so ason no, Onyankopɔn wiee n'adwuma a ɔyɛe no, na da a ɛto so ason no, ɔhome fii n'adwuma a ɔyɛe nyinaa ho. 3 Na Onyankopɔn hyiraa da a ɛto so ason no, na ɔtew ho, efisɛ ɛno mu na Onyankopɔn home fii n'adwuma a ɔbɔe na ɔyɛe nyinaa ho.
Adebɔ su: Eden turo
4Eyi ne sɛnea Awurade Nyankopɔn bɔɔ ɔsoro ne asase. 5Na afuw mu nnua nyinaa nnya mmaa asase so, na afuw mu nhaban nyinaa nnya mfifii, efisɛ AWURADE Nyankopɔn nnya ntɔɔ osu nguu asase so ɛ, na onipa a ɔbɛdɔw asase nni hɔ. 6Na nsu fi asase so foroe, na ɛfɔw asase ani nyinaa. 7 Na AWURADE Nyankopɔn de fam dɔte nwenee onipa, na ohuw nkwa home guu ne hwene mu, na onipa yɛɛ ɔkra teasefo.
8Na AWURADE Nyankopɔn yɛɛ turo bi wɔ Eden a ɛwɔ apuei fam, na ɔde onipa a ɔnwenee no, tenaa hɔ. 9 Na AWURADE Nyankopɔn maa nnua ahorow nyinaa a wɔhwɛ a, ɛyɛ fɛ, na eye sɛ wodi asase no so, ne nkwa dua a esi turo no mfinimfini, ne papa ne bɔne hu dua fifii asase so.
10Na asu bi fi Eden bɛfɔw turo no, na efi hɔ ara na emu paepae yɛɛ nsuti anan. 11Nea edi kan no din de Pison, ɛno na ɛkɔntɔn twa Hawila asase a sika wɔ so no nyinaa ho hyia; 12na asase no so sika ye; ɛhɔ na bedola ne apopobibiribo wɔ. 13Na asu a ɛto so abien no din de Gihon, ɛno na ɛkɔntɔn twa Kus asase nyinaa ho hyia. 14Na asu a ɛto so abiɛsa ne Tigri, ɛno na ɛsen wɔ Asaria apuei. Na asu a ɛto so anan ne Eufrate.
15Na AWURADE Nyankopɔn de onipa no kɔtenaa Eden turom sɛ ɔnnɔw na ɔnwɛn hɔ. 16Na ɔhyɛɛ onipa no sɛ: Turom ha nnua nyinaa, di bi. 17 Na papa ne bɔne hu dua no de, nni, efisɛ da a wubedi bi no, owu na wubewu. 18 Na AWURADE Nyankopɔn kae sɛ: Enye sɛ onipa nko tena, mɛyɛ ne sɛso boafo mama no.
19Na AWURADE Nyankopɔn de dɔte nwenee wuram mmoadoma nyinaa ne wim nnomaa nyinaa, na ɔde wɔn baa onipa no nkyɛn sɛ obehu sɛnea ɔbɛfrɛ wɔn. Na nea onipa de frɛɛ abɔde a ɛte ase biara no, ɛno ara ne ne din. 20Na onipa totoo afieboa nyinaa ne wim nnomaa ne wuram mmoadoma nyinaa din. Nanso onipa de, wɔannya ne sɛso boafo amma no.
21Na AWURADE Nyankopɔn maa nnahɔɔ tɔɔ onipa no so, na ɔdae, na oyii ne mfe pare mu biako, na ɔde nam tuaa anan mu. 22 Na AWURADE Nyankopɔn de mfe pare a oyi fii onipa no mu no yɛɛ ɔbea, na ɔde no brɛɛ onipa no. 23Na onipa no kae sɛ:
Ampa ara me nnompe mu dompe
ne me honam mu nam ankasa ni.
Oyi na wɔbɛfrɛ no ɔbea,
efisɛ ɔbarima mu na woyii no fii.
24 Ne saa nti na ɔbarima begyaw ne na ne n'agya, na ɔde ne ho akɔbata ne yere ho, na wɔayɛ ɔhonam koro. 25Na wɔn baanu no deda adagyaw, ɔbarima no ne ne yere, na wɔn ani nwu.",https://www.bible.com/bible/3439/GEN.2.ATWDB
GYENESIS 3,"Onipa Asehwe
1 Na ɔwɔ yɛ anifere kyɛn wuram mmoadoma a AWURADE Nyankopɔn yɛɛ wɔn nyinaa. Na obisaa ɔbea no sɛ: Ampa sɛ Nyankopɔn aka sɛ Munnni turom ha nnua nyinaa bi? 2 Na ɔbea no ka kyerɛɛ ɔwɔ no sɛ: Turom ha nnua aba no, yedi bi, 3 nanso dua a esi turo no mfinimfini no aba de, Onyankopɔn aka sɛ: Munnni bi, nso mommfa mo nsa nnka, na moanwu. 4 Na ɔwɔ no ka kyerɛɛ ɔbea no sɛ: Ɛnyɛ owu na mubewu: 5na Onyankopɔn nim sɛ da a mubedi bi no, mo ani bebue, na moayɛ sɛ Onyankopɔn, ahu papa ne bɔne.
6 Na ɔbea no hui sɛ dua no ye sɛ wodi, na ɛyɛ aniwa fɛ, na dua no dɔ kɔn na ɛbɛtew ani no, ɔtew n'aba no bi, na odii, na ɔde bi maa ne kunu a ɔka ne ho no nso, na odii. 7 Na wɔn baanu ani buebuei, na wohui sɛ wɔdeda adagyaw, na wɔpompam borɔdɔma ahaban yɛɛ nkataanim fae.
8 Na wɔtee AWURADE Nyankopɔn nka sɛ ɔnam turom hɔ wɔ anwummere mfare mu. Na Adam no ne ne yere kohintaw fii AWURADE Nyankopɔn anim wɔ turom hɔ nnua mu. 9Na AWURADE Nyankopɔn frɛɛ Adam, na ɔka kyerɛɛ no sɛ: Wowɔ he? 10Na ose: Metee wo nka wɔ turom hɔ no, misuroe, efisɛ meda adagyaw, na mihintawee. 11Na ɔkae sɛ: Hena na ɔka kyerɛɛ wo sɛ woda adagyaw? Dua a mehyɛɛ wo sɛ nni bi no na woadi yi? 12Na Adam se: Ɔbea no a wode no bɛkaa me ho no, ɔno na ɔmaa me dua no aba bi na midii. 13 Na AWURADE Nyankopɔn ka kyerɛɛ ɔbea no sɛ: Ɛdɛn nti na woyɛɛ saa? Na ɔbea no se: Ɔwɔ no na ɔdaadaa me na midii.
14 Na AWURADE Nyankopɔn ka kyerɛɛ ɔwɔ no sɛ:
Sɛ woayɛ eyi nti,
wɔadome wo ntɔteboa
ne wuram mmoadoma nyinaa mu.
Wo yafunu so na wobɛnantew,
na woadi dɔte
wo nkwa nna nyinaa.
15 Na mede ɔtan mɛto wo ne ɔbea no ntam,
ɛne w'asefo ne n'asefo ntam;
ɔno na ɔbɛbɔ wo ti,
na wo nso woaka ne nantin.
16 Ɔbea no de, ɔka kyerɛɛ no sɛ:
Ɔdɔ na mɛma wo yaw ne wo nyinsɛn mu brɛ adɔɔso.
Ɛyaw mu na wobɛwo mma,
na w'ani begyina wo kunu,
na ɔno na obedi wo so.
17 Na Adam de, ɔka kyerɛɛ no sɛ:
Sɛ woatie wo yere nne,
na woadi dua a mehyɛɛ wo sɛ nni no bi nti,
wo nti wɔadome asase.
Ɛyaw mu na wubedidi so,
wo nkwa nna nyinaa,
18na nsɔe ne nnɛnkyɛnse na ebefifi ama wo,
na woadi afuw so ahaban.
19 W'anim fifiri mu
na wubedidi
de akosi sɛ wobɛsan akɔ dɔte mu,
efisɛ emu na woyii wo fii,
na woyɛ dɔte,
na dɔte mu na wobɛsan akɔ.
20Na Adam too ne yere din Hawa, efisɛ ɔno na wayɛ ateasefo nyinaa na. 21Na AWURADE Nyankopɔn yɛɛ nhoma ntade maa Adam ne ne yere de hyɛɛ wɔn.
22 Na AWURADE Nyankopɔn kae sɛ: Hwɛ, onipa no ayɛ sɛ yɛn mu biako ahu papa ne bɔne. Na afei, nea ɛbɛyɛ na wanteɛ ne nsa antew nkwa dua no nso bi anni antena ase daa nti, 23AWURADE Nyankopɔn tuu no fii Eden turom hɔ sɛ ɔnkɔdɔw asase a wɔfaa no fii mu no. 24 Na ɔpam onipa no, na ɔde Kerubim ne gyaframa afoa a edi ahim besii Eden turo no anim apuei fam sɛ wɔnwɛn ɔkwan a ɛkɔ nkwa dua no ho no.",https://www.bible.com/bible/3439/GEN.3.ATWDB
GYENESIS 4,"Kain ne Habel
1Na Adam ne ne yere Hawa hyiae, na onyinsɛnee, na ɔwoo Kain, na ɔkae se: AWURADE adaworoma, manya ɔbarima. 2Na ɔwoo ne nua Habel kaa ne ho. Na Habel yɛɛ oguanhwɛfo, na Kain de, ɔyɛɛ okuafo. 3Na ɛbae sɛ nna bi akyi no, Kain de afum nneɛma bɛyɛɛ AWURADE ayɛ. 4 Na Habel nso de ne nguan mu mmakan ne wɔn a wɔadɔ no bi bɛmae. Na AWURADE ani sɔɔ Habel ne n'ayɛyɛde no, 5nanso Kain ne n'ayɛyɛde de, n'ani ansɔ. Na Kain bo fuwii pii, na omunae. 6Na AWURADE bisaa Kain sɛ ɛdɛn nti na wo bo afuw, na ɛdɛn nti na woamuna yi? 7Sɛ woyɛ papa a, anka w'anim rentew anaa? Na sɛ woanyɛ papa nti, bɔne butuw ɔpon ano, na w'akyi kwan na ɛrehwehwɛ, nanso di no so.
8 Na Kain ka kyerɛɛ ne nua Habel sɛ ɔmma wɔnkɔ afum, na ɛbae sɛ wɔwɔ afum no, Kain sɔre hyɛɛ ne nua Habel, na okum no. 9Na AWURADE bisaa Kain sɛ: Ɛhe na wo nua Habel wɔ? Na Kain buae sɛ: Minnim, me nua so hwɛfo ne me anaa? 10 Na AWURADE se: Ɛdɛn na woayɛ yi? Wo nua mogya nne teɛm frɛ me fi asase so. 11Na afei wɔadome wo afi asase a abue n'ano agye wo nua mogya afi wo nsam no so. 12Sɛ wodɔw asase a, ɛrenkɔ so mma wo ne nnɔbae bio, wobɛbɔ asesa na waye ɔkobɔfo wɔ asase so. 13Na Kain ka kyerɛɛ AWURADE sɛ: Me bɔne so ade so kyɛn sɛ metumi masoa. 14 Hwɛ, woapam me nnɛ afi asase so, na mehintaw mafi w'anim, na mayɛ ɔsesafo ne ɔkobɔfo wɔ asase so, na obiara a obehu me no, obekum me. 15Na AWURADE ka kyerɛɛ no sɛ: Ɛno nti obiara a obekum Kain no, wobedi ne were ahorow asɔn. Na AWURADE yɛɛ sɛnkyerɛnne bi maa Kain, na obiara a obehu no no ankum no. 16Na Kain fii AWURADE anim kɔe, na ɔkɔtenaa Nod asase so wɔ Eden apuei.
Kain Asefo
17Na Kain ne ne yere Hawa dae, na onyinsɛnee, na ɔwoo Enok. Na ɔkyekyeree kurow bi, na ɔde ne ba Enok din too kurow no. 18Na wɔwoo Irad maa Enok, na Irad woo Mehuyael, na Mehuyael woo Metusael, na Metusael woo Lamek.
Lamek ne ne yerenom
19Na Lamek faa mmea baanu waree, obiako din de Ada, na nea ɔka ho no din de Sila. 20Na Ada woo Yabal, ɔno na ɔyɛ ntamadan mu ne mmoa ho tenafo agya. 21Na ne nua din de Yubal, ɔno na ɔyɛ asankubɔfo ne mmɛnhyɛnfo nyinaa agya. 22Na Sila nso woo Tubal-kain a ɔyɛ kɔbere mfrafrae ne dade ade nyinaa atomfo agya. Na Tubal-kain ne nuabea ne Naama. 23Na Lamek ka kyerɛɛ ne yerenom sɛ:
Ada ne Sila, muntie me nne;
Lamek yerenom, monyɛ aso mma m'asɛm:
Mikum aberante bi sɛ opiraa me,
na mikum aberante sɛ ɔboroo me.
24 Na sɛ wodi Kain so were mpɛn ason a,
Lamek de bɛyɛ aduɔsɔn asɔn.
Set ne Enos awo
25Na Adam ne ne yere dae bio, na ɔwoo babarima, na ɔtoo no din Set a ase ne: Nsiananmu, sɛ Onyankopɔn de ɔba foforo asi me Habel a Kain kum no no anan mu.
26Na Set nso, wɔwoo ba maa no, na ɔtoo no din Enos. Ɛbere no mu na wofii ase bɔɔ AWURADE din sɔree no.",https://www.bible.com/bible/3439/GEN.4.ATWDB
GYENESIS 5,"Adam awo ntoatoaso
(1 Berɛsosɛm 1.1-4)
1 Adam awo ntoatoaso nhoma ni: Da a Onyankopɔn bɔɔ onipa no, ne suban so na ɔyɛɛ no; 2 ɔbarima ne ɔbea na ɔbɔɔ wɔn, na ohyiraa wɔn, na ɔtoo wɔn din onipa.
3 Na Adam dii mfirihyia ɔha aduasa na ɔwoo babarima wɔ ne sɛso so sɛ ne suban so, na ɔtoo no din Set. 4Na Adam woo Set no akyi no odii mfirihyia ahanwɔtwe, na ɔwoo mmammarima ne mmabea. 5Na Adam nna a odii nyinaa si mfe ahankron aduasa, na owui.
6Na Set dii mfirihyia ɔha ne anum na ɔwoo Enos. 7Na Set woo Enos no akyi no, odii mfe ahanwɔtwe ne asɔn, na ɔwoo mmammarima ne mmabea. 8Na Set nna nyinaa si mfe ahankron ne dumien, na owui.
9Na Enos dii mfirihyia aduakron na ɔwoo Kenan. 10Na Enos woo Kenan no akyi no, odii mfe ahanwɔtwe ne dunum, na ɔwoo mmammarima ne mmabea. 11Na Enos nna nyinaa si mfe ahankron ne anum, na owui.
12Na Kenan dii mfirihyia aduɔsɔn na ɔwoo Mahalaleel. 13Na Kenan woo Mahalaleel no akyi no, odii mfe ahanwɔtwe aduanan, na ɔwoo mmammarima ne mmabea. 14Na Kenan nna nyinaa si mfe ahankron ne du, na owui.
15Na Mahalaleel dii mfirihyia aduosia anum na ɔwoo Yared. 16Na Mahalaleel woo Yared akyi no, odii mfe ahanwɔtwe aduasa, na ɔwoo mmammarima ne mmabea. 17Na Mahalaleel nna nyinaa si mfe ahanwɔtwe aduakron anum, na owui.
18Na Yared dii mfirihyia ɔha aduosia abien na ɔwoo Enok. 19Na Yared woo Enok akyi no, odii mfe ahanwɔtwe, na ɔwoo mmammarima ne mmabea. 20Na Yared nna nyinaa si mfe ahankron aduosia abien, na owui.
21Na Enok dii mfirihyia aduosia anum na ɔwoo Metusela. 22 Na Enok woo Metusela no akyi no, ɔne Nyankopɔn nantewee mfirihyia ahasa, na ɔsan woo mmammarima ne mmabea. 23Na Enok nna nyinaa si mfe ahasa aduosia anum. 24 Na Enok ne Nyankopɔn nantewee; na wanhu no efisɛ Onyankopɔn faa no kɔe. 25Na Metusela dii mfirihyia ɔha aduɔwɔtwe ason na ɔwoo Lamek. 26Na Metusela woo Lamek no akyi no, odii mfe ahansɔn aduɔwɔtwe abien, na ɔwoo mmammarima ne mmabea. 27Na Metusela nna nyinaa si mfe ahankron aduosia akron, na owui.
28Na Lamek dii mfirihyia ɔha aduɔwɔtwe abien na ɔwoo ɔbabarima, 29 na ɔtoo no din Noa, na ɔkae sɛ: Oyi na ɔbɛkyekye yɛn werɛ wɔ yɛn nnwuma ne yɛn nsa ano brɛ mu wɔ asase a AWURADE adome no so. 30Na Lamek woo Noa no akyi no, odii mfe ahanum aduɔkron anum, na ɔsan woo mmammarima ne mmabea. 31Na Lamek nna nyinaa si mfirihyia ahansɔn aduɔsɔn asɔn, na owui. 32Na Noa dii mfirihyia ahannum, na Noa woo Sem, Ham ne Yafet.",https://www.bible.com/bible/3439/GEN.5.ATWDB
GYENESIS 6,"Nnipa nnebɔne
1 Na nnipa fii ase redɔɔso wɔ asase so na wɔwoo mmabea maa wɔn no, 2 Onyankopɔn mma huu nnipa mmabea sɛ wɔn ho yɛ fɛ, na wɔwarewaree wɔn mu biara a wɔpɛ. 3 Na AWURADE kae sɛ: Me honhom rentena onipa mu nkosi daa, efisɛ wɔyɛ ɔhonam, enti wɔn nna nyɛ mfe ɔha aduonu. 4 Nna no mu na abran akɛse wɔ asase so, na akyiri yi nso a Onyankopɔn mma kɔɔ nnipa mmabea ho na wɔwoo mma maa wɔn no, eyinom ne abirempɔn a wɔwɔ din fi tete. 5 Na AWURADE hui sɛ nnipa bɔne dɔɔso pii wɔ asase so, na wɔn komam adwene nyinaa yɛ bɔne nko daa nyinaa. 6 Na AWURADE nuu ne ho sɛ, ɔyɛɛ onipa wɔ asase so, na ɛyɛɛ no yaw ne komam. 7Na AWURADE kae sɛ: Mɛpopa nnipa a mabɔ wɔn no mafi asase ani, efi onipa so kosi ntɔteboa ne mmoa a wɔwea ne wim nnomaa so, efisɛ manu me ho sɛ meyɛɛ wɔn. 8Na Noa de, onyaa ɔdom wɔ AWURADE anim.
Noa adaka no
9 Eyi ne Noa ho asɛm: Noa yɛ onipa trenee a ɔyɛ pɛ, wɔ ne bere so nnipa mu. Noa ne Onyankopɔn na ɛnantewee. 10Na Noa woo mmabanin baasa, Sem, Ham ne Yafet. 11Na asase asɛe wɔ Onyankopɔn anim, na awurukasɛm ahyɛ asase so ma. 12 Na Onyankopɔn huu asase, na hwɛ, asɛe, efisɛ nnipa nyinaa asɛe wɔn akwan wɔ asase so. 13 Na Onyankopɔn ka kyerɛɛ Noa sɛ: Abɔde nyinaa awiei aba wɔ m'anim, efisɛ wɔn awurukasɛm ahyɛ asase so ma, na hwɛ, mɛsɛe wɔn ne asase.
14Fa ɔwawa yɛ adaka, na yɛ mpia wɔ adaka no mu, na fa ama tare emu ne ɛho. 15Na sɛnea yɛ no ni: Ne ntwemu basafa ɔha aduonum, ne trɛw basafa aduonum anum, ne korɔn basafa dunum. 16Yɛ adaka no ho mfɛnsere, enkosi sɛ aka basafa biako na adu soro, na si adaka no ano pon ne nkyɛn mu, na yɛ nsɛmso abiɛsa, nea edi ase, nea edi ntam ne nea edi soro. 17Na hwɛ, mede nsuyiri mɛba asase so mabɛsɛe abɔde a nkwa home wɔ mu nyinaa ɔsoro ase; asase so ade nyinaa rebewuwu. 18Na me ne wo bɛpam ato hɔ, na woakɔ adaka no mu, wo, ne wo mma, ne wo yere, ne wo mma yerenom. 19Na fa ade a ɛte ase nyinaa, ɔhonam nyinaa mu abien abien, onini ne ɔbere, kɔ adaka no mu, na wonnya nkwa nka wo ho. 20Nnomaa, sɛnea wɔn su te, ne ntɔteboa, sɛnea wɔn su te, ne mmoa a wɔwea asase so nyinaa, sɛnea wɔn su te, wɔn nyinaa mu abien abien mmra wo nkyɛn, na wɔanya nkwa. 21Na wo de, boaboa aduan a wodi nyinaa bi ano kɔ mu, na ayɛ wo ne wɔn aduan. 22Na Noa yɛɛ sa; sɛnea Onyankopɔn hyɛɛ no no nyinaa pɛpɛɛpɛ, saa ara na ɔyɛe.",https://www.bible.com/bible/3439/GEN.6.ATWDB
GYENESIS 7,"Nsuyiri no
1Na AWURADE ka kyerɛɛ Noa sɛ: Wo ne wo fi nyinaa, monkɔ adaka no mu, efisɛ wo na mahu wo ɔtreneeni m'anim bere yi mu. 2 Mmoa a wɔn ho tew nyinaa mu, fa ason asɔn, anini ne abere. Na mmoa a wɔn ho ntew mu, fa abien abien, onini ne ɔbere; 3wim nnomaa mu nso, ason asɔn, anini ne abere, na wɔn ase nnya nkwa asase nyinaa ani. 4Efisɛ aka ɛha nnansɔn na matɔ osu magu asase so adaduanan awia ne anadwo, na mapopa ade a nkwa wom nyinaa afi asase ani. 5 Na Noa yɛe sɛnea AWURADE hyɛɛ no no nyinaa. 6Na nsuyiri no baa asase so na Noa adi mfirihyia ahansia. 7 Na nsu a ɛrebeyiri no nti, Noa ne ne mma ne ne yere ne ne mma yerenom kɔɔ adaka no mu. 8Mmoa a wɔn ho tew ne mmoa a wɔn ho ntew ne nnomaa ne wɔn a wɔwea asase so nyinaa mu 9 abien abien ne Noa kɔɔ adaka no mu, onini ne ɔbere, sɛnea Onyankopɔn hyɛɛ Noa no. 10Na nnansɔn akyi no, nsuyiri baa asase so.
11Noa nkwa mu afe a ɛto so ahansia mu, ɔsram a ɛto so abien so, ɔsram no dadu nnansɔn so, da no ara ebun kɛse no nsu aniwa nyinaa paepaee, na ɔsoro mfɛnsere buebuei. 12Na osu tɔɔ asase so pii adaduanan awia ne anadwo. 13Saa da yi ara (nsuyiri yi hyɛɛ ase no) mu na Noa ne ne mma, Sem, Ham ne Yafet, ne Noa yere ne ne mma yerenom baasa kɔɔ adaka no mu, 14wɔn, ne mmoadoma nyinaa, sɛnea wɔn su te, ne ntɔteboa nyinaa, sɛnea wɔn su te, ne mmoa a wɔwea asase so nyinaa, sɛnea wɔn su te, ne ntuboa nyinaa, sɛnea wɔn su te, nnomaa ne ntakraboa nyinaa, 15wɔne Noa kɔɔ adaka no mu, ɔhonam a nkwa home wɔ wɔn mu nyinaa mu abien abien. 16 Na wɔn a ɛbae no, ɔhonam nyinaa mu anini ne abere na ɛbae, sɛnea Onyankopɔn hyɛɛ no no, na AWURADE too no mu.
17Na nsuyiri no baa asase so adaduanan, na nsu no tɔe, na ɛsoaa adaka no, na ɛmaa so fii asase so. 18Na nsu no boroo so na eyirii dodo wɔ asase so; na adaka no tɛn nsu no ani. 19Na nsu no boroo so ara wɔ asase so, na ɛkataa mmepɔw atenten a ɛwɔ ɔsoro ase nyinaa so. 20Nsu no boroo so kɔɔ soro basafa ason ne fa kataa mmepɔw so. 21Na abɔde a ɛkeka ne ho asase so nyinaa wuwui, nnomaa, ntɔteboa, wuram mmoa, mmoa a wɔwea asase so nyinaa, ne nnipa nyinaa, 22 wɔn a nkwa home wɔ wɔn mu, na wɔte asase kesee so nyinaa wuwui. 23Na ɔpopaa biribiara a nkwa wom a ɛwɔ asase ani, efi nnipa so kosi ntɔteboa ne mmoa a wɔwea ne wim nnomaa so, na wɔpopaa wɔn fii asase so, na ɛkaa Noa nko ne wɔn a wɔne no wɔ adaka no mu no. 24Na nsu no boroo so wɔ asase so nna ɔha aduonum.",https://www.bible.com/bible/3439/GEN.7.ATWDB
GYENESIS 8,"Nsuyiri no twetwe
1Na Onyankopɔn kaee Noa ne mmoadoma nyinaa ne ntɔteboa a wɔne no wɔ adaka no mu no nyinaa, na Onyankopɔn maa mframa bɔ faa asase so, na nsu no ano brɛɛ ase. 2 Na ebun no nsu aniwa sisiwii, na ɔsoro mfɛnsere mu totoe, na osu a efi soro no gyaee tɔ. 3Na nsu no twe fii asase so ara; na nna ɔha aduonum akyi no na nsu no so rehuan.
4Na ɔsram a ɛto so asɔn, ɔsram no da a ɛto so dunsɔn na adaka no kɔtaa Ararat mmepɔw so. 5Na nsu no kɔɔ so twee ara kosii ɔsram a ɛto so du no so. Na ɔsram a ɛto so du no da a edi kan no na mmepɔw atifi dedaa adi.
6Na ɛno akyi adaduanan no, Noa buee adaka no mfɛnsere a ɔyɛe no, 7na ɔsomaa kwaakwaadabi; na ofii adi, na odii akɔneaba de kosii sɛ nsu no yowee asase so. 8Na ɔsomaa aborɔnoma fii ne nkyɛn sɛ ɔnkɔhwɛ sɛ nsu no ayow wɔ asase ani anaa. 9Nanso aborɔnoma no annya ne nan sibea, na ɔsan baa ne nkyɛn adaka no mu, efisɛ nsu no da so wɔ asase nyinaa ani ara. Na ɔteɛɛ ne nsa faa no baa ne nkyɛn wɔ adaka no mu. 10Na ɔtwɛn nnansɔn bio, na ɔsomaa aborɔnoma fii adaka no mu bio. 11Na aborɔnoma no baa ne nkyɛn anwummere, na hwɛ, ngodua ahaban frɔmfrɔm tua n'ano; na Noa hui sɛ nsu no ayow asase so. 12Na ɔtwɛn nnansɔn bio, na ɔsomaa aborɔnoma no; na wansan amma ne nkyɛn bio. 13Na afe a ɛto so ahansia ne biako, ɔsram a edi kan no da a edi kan no na nsu no ayow asase so; na Noa yii suhyɛ no fii adaka no so, na ɔhwɛe, na hwɛ, asase ani awo. 14Ɔsram a ɛto so abien no da a ɛto so aduonu ason no na asase so awo koraa.
15Na Onyankopɔn kasa kyerɛɛ Noa sɛ: 16Fi adaka no mu, wo ne wo yere ne wo mma ne wo mma yerenom a wɔka wo ho; 17 mmoadoma a wɔka wo ho nyinaa a efi ɔhonam nyinaa mu, nnomaa ne ntɔteboa ne nea ɛwea asase so nyinaa ne wo mfi adi, na wɔnyɛ asase so manyamanya, na wɔnwo, na wɔnnɔɔso asase so. 18 Na Noa ne ne mma ne ne yere ne ne mma yerenom fii adi; 19mmoadoma nyinaa, wɔn a wɔwea nyinaa ne nnomaa nyinaa, nea ɛkeka ne ho asase so nyinaa, sɛnea wɔn mmoaban te, fi adaka no mu fii adi.
20 Na Noa sii afɔremuka maa AWURADE, na ɔfaa ntɔteboa a wɔn ho tew nyinaa mu bi ne nnomaa a wɔn ho tew nyinaa mu bi de wɔn bobɔɔ ɔhyew afɔre wɔ muka no so.
Onyankopɔn bɔhyɛ
21 Na AWURADE tee afɔre no huam, na ɔkae ne komam sɛ: Onipa nti meremmɔ asase dua bio, efisɛ onipa komam adwene yɛ bɔne fi ne mmofraase, na merensɛe nea ɛte ase nyinaa bio, sɛnea mayɛ yi.
22 Nna nyinaa a asase wɔ hɔ yi,
ogu ne otwa, awɔw ne ahohuru,
asusow ne ɔpɛ, awia ne anadwo
rennyae da.",https://www.bible.com/bible/3439/GEN.8.ATWDB
GYENESIS 9,"Onyankopɔn ne Noa yɛ Apam
1 Na Onyankopɔn hyiraa Noa ne ne mma, na ɔka kyerɛɛ wɔn sɛ Monwo na monnɔɔso, na monhyɛ asase so ma. 2Na mo ho hu ne mo ho suro mmra asase so mmoadoma nyinaa ne wim nnomaa nyinaa, nea ɛwea fam nyinaa ne ɛpo mu mpataa nyinaa so; mo nsa na wɔde wɔn ahyɛ. 3 Nea ɛkeka ne ho a ɛwɔ nkwa nyinaa, ɛnyɛ mo aduan; mede ne nyinaa mama mo, sɛnea mede nhabanmono memaa mo no.
4 Nam a ne mogya wɔ ne mu nko na munnni. 5 Na onipa biara a ɔka onipa mogya gu no, ne nsam na mebisa; na aboa mpo ka onipa mogya gu a mebisa afi ne nsam.
6 Nea ohwie onipa mogya gu no,
onipa so na wɔnam behwie ne mogya agu,
efisɛ Onyankopɔn suban so
na ɔyɛɛ onipa.
7 Na mo de, monwo na monnɔ, na monyɛ asase so manyamanya, na monnɔɔso wɔ so.
8Na Onyankopɔn ka kyerɛɛ Noa ne ne mma a wɔka ne ho no sɛ: 9 Na me nso, hwɛ, merema m'apam atim hɔ ama mo ne mo asefo a ebedi mo akyi, 10 ne akra a ɛtete ase a ɛka mo ho nyinaa, nnomaa, ntɔteboa ne asase so mmoadoma a wɔne mo wɔ hɔ nyinaa, wɔn a efi adaka no mu nyinaa, asase so mmoadoma nyinaa. 11 Na mama me ne mo apam yi agyina hɔ, sɛ meremfa nsuyiri mensɛe abɔde nyinaa bio, na nsuyiri remma mmɛsɛe asase bio. 12Na Onyankopɔn kae sɛ: Apam a merema ada me ne mo ne akra ateasefo a ɛka mo ho nyinaa ntam akɔ nnasanten awo ntoatoaso so no ho sɛnkyerɛnne ni: 13Me nyankontɔn na mede masi omununkum mu, na ayɛ me ne asase ntam apam no ho sɛnkyerɛnne. 14Na sɛ mede omununkum meba asase so a, wobehu nyankontɔn no wɔ omununkum no mu, 15na makae m'apam a ɛwɔ me ne mo ne abɔde nyinaa mu ateasefo ntam no, na nsu annan nsuyiri ansɛe ɔhonam nyinaa bio. 16Na nyankontɔn no bɛba omununkum mu, na mahwɛ, na mede makae daa apam a ɛwɔ Onyankopɔn ne abɔde a ɛwɔ asase so nyinaa ntam no. 17Na Onyankopɔn ka kyerɛɛ Noa sɛ: Eyi ne apam a mama agyina me ne ɔhonam a ɛwɔ asase so nyinaa ntam no ho sɛnkyerɛnne.
Noa asefo pete asase so
18 Na Noa mma a wofii adaka no mu fii adi no ne Sem ne Ham ne Yafet; na Ham ne Kanaan n'agya. 19Eyinom ne Noa mma baasa no. Wɔn mu na nnipa fi petee asase nyinaa so.
20Na Noa fii ase yɛɛ kua, na ɔyɛɛ bobeturo. 21Na ɔnom nsa no bi, na ɔbowee, na ɔda ne ntamadan mu a ne ho da hɔ. 22 Na Kanaan n'agya Ham kohuu n'agya adagyaw mu, na ɔkɔka kyerɛɛ ne nuanom baanu no wɔ adiwo. 23Na Sem ne Yafet faa ntama, na wɔn baanu de guu wɔn mmati so nam nkyirinkyiri de kɔkataa wɔn agya adagyaw so, na wɔdan wɔn ani kyerɛɛ akyiri, na wɔanhu wɔn agya adagyaw mu. 24Na Noa ani so tetew fii n'asabow mu na ɔtee nea ne ba kumaa no ayɛ no no, 25ɔkae sɛ:
Wɔadome Kanaan,
ɔbɛyɛ nkoa mu akoa ama ne nuanom.
26 Na ɔkae sɛ
Nhyira ne Sem Nyankopɔn, Awurade,
na Kanaan nyɛ wɔn akoa.
27 Onyankopɔn mma Yafet ase ntrɛw,
na ɔntena Sem ntamadan mu,
na Kanaan nyɛ wɔn akoa.
28Na nsuyiri no akyi no, Noa tenaa ase mfirihyia ahasa aduonum. 29Na Noa nna a odii nyinaa si mfe ahankron aduonum, na owui.",https://www.bible.com/bible/3439/GEN.9.ATWDB
