Title,Content,URL
GYENESIS 50,"Yakob wu
1 Na Yosef de n'anim kobutuw n'agya anim, na osu guu no so, na ofew n'ano. 2Na Yosef hyɛɛ ne nkoa a wɔhyɛ amu aduru no sɛ wɔnhyɛ n'agya amu no aduru. Na wɔyɛɛ saa. 3Na wɔde adaduanan dii ho dwuma, nna a wɔde wie aduruhyɛ no nen. Na Misraimfo suu no adaduɔsɔn.
4Na nna a wɔde suu no no twaam no, Yosef ka kyerɛɛ Farao fifo sɛ: Sɛ manya ɔdom wɔ mo anim a, munkoyi Farao asitiw sɛ: 5 M'agya ma mekaa no ntam sɛ: Hwɛ, merewu, na ɔda a mabɔ wɔ Kanaan asase so mafa no mu, ɛhɔ na kosie me. Enti ma menkɔ minkosie m'agya, na mensan memmra. 6Na Farao kae se: Kɔ na kosie w'agya, sɛnea ɔma wokaa ntam no.
7Na Yosef kɔe sɛ, okosie n'agya; na Farao nkoa nyinaa, ne fi mpanyimfo ne Misraim asase so mpanyimfo nyinaa 8ne Yosef fifo nyinaa ne ne nuanom ne n'agya fifo kaa ne ho kɔe, gye wɔn mma ne wɔn nguan ne wɔn anantwi na wogyaw wɔn Gosen asase so. 9Na nteaseɛnam ne apɔnkɔsotefo ne no kɔe; na ɛyɛ dɔm kɛse. 10Na woduu Atad awiporowbea a ɛwɔ Yordan agya no hɔ no, wotwaa kwadwom kɛse a emu yɛ den wɔ hɔ, na ogyam n'agya nnansɔn. 11Na ɛhɔfo, Kanaanfo no, huu osu a wosuu no Atad awiporowbea hɔ no, wɔkae sɛ: Eyi de, Misraimfo ayi a emu yɛ den ni. Enti wɔfrɛɛ hɔ sɛ: Abelmisraim ase ne: Misraimfo ayiyɛ, ɛwɔ Yordan agya noho. 12 Na ne mma yɛɛ no sɛnea ɔhyɛɛ wɔn no. 13 Na ne mma soaa no kɔɔ Kanaan asase so kosiee no wɔ: Makpela afuw so ɔbodan a ɛwɔ Mamre ntentenso a Abraham tɔɔ no wɔ Hetini Efron nkyɛn de yɛɛ asiei no mu. 14Yosef siee n'agya wiei no, ɔne ne nuanom ne wɔn a wɔne no kɔe kosiee n'agya no nyinaa san baa Misraim.
Yosef de ne nuanom mfomso kyɛ
15Na Yosef ne nuanom hui sɛ wɔn agya awu no, wɔkae sɛ: Ebia Yosef bɛtan yɛn, na watua yɛn bɔne a yɛyɛɛ no nyinaa so ka. 16Na wɔma wɔkɔka kyerɛɛ Yosef sɛ: W'agya hyɛe ansa na ɔrewu sɛ: 17Monka nkyerɛ Yosef sɛ: Mesrɛ wo, fa wo nuanom amumɔyɛ ne wɔn bɔne kyɛ wɔn, efisɛ wɔayɛ wo bɔne. Na afei yɛsrɛ wo, fa w'agya Nyankopɔn nkoa amumɔyɛ no kyɛ wɔn. Na wɔkaa saa kyerɛɛ no no, Yosef sui. 18Na ne nuanom nso bae betwa hwee n'anim kae sɛ: Hwɛ, yɛyɛ wo nkoa. 19Na Yosef ka kyerɛɛ wɔn sɛ: Munnsuro, na migyina Onyankopɔn ananmu anaa? 20 Na mo de, mudwen me ho bɔne, nanso Onyankopɔn de, na ɔde rebɛyɛ papa, sɛ ɔbɛyɛ nea ada adi nnɛ yi, sɛ obegye nnipa pii nkwa. 21Na afei munnsuro. Na mɛhwɛ mo ne mo mma. Na ɔkyekyee wɔn werɛ twaa wɔn bo tɔɔ wɔn yam.
22Na Yosef ne n'agya fifo tenaa Misraim, na Yosef dii mfirihyia ɔha ne du.
23 Na Yosef huu Efraim mmanana. Manase ba Makir mma nso, wɔwoo wɔn guu Yosef srɛ so.
Yosef wu
24 Na Yosef ka kyerɛɛ ne nuanom sɛ: Merebetiw nananom wɔ asamando, na Onyankopɔn bɛba abɛhwɛ mo ampa, na wabeyi mo afi asase yi so akɔ asase a ɔkaa ho ntam kyerɛɛ Abraham ne Isak ne Yakob no so.
25 Na Yosef maa Israel mma kaa ntam, na ɔkae sɛ: Ampa ara Onyankopɔn bɛba abɛhwɛ mo, na monsoa me nnompe mfi ha nkɔ.
26Na Yosef wui, na wadi mfirihyia ɔha ne du. Na wɔhyɛɛ n'amu no aduru na wɔde no too adaka mu wɔ Misraim.",https://www.bible.com/bible/3439/GEN.50.ATWDB
EKSODƆS NHYƐNMU,"NHYƐNMU
Din Eksodɔs no asekyerɛ ne: Otukɔ na ɛkyerɛ Israelfo abakɔsɛm mu ade titiriw bi a esii, ɛne otu a Israelfo tu fii Misriam, beae a wokɔyɛɛ nkoa no. Nhoma no wɔ nkyekyɛmu ahorow abiɛsa:
1. Israelfo ahofadi fi nkoasom mu, ne wɔn akwantu kosi bepɔw Sinai ho.
2. Onyankopɔn ne wɔn apam wɔ Sinai a emu na wonyaa, mmara nsɛm a ɛboa abrabɔ pa, ɔman mu tena ne wɔn Nyamesom.
3. Nea ɛboro ne nyinaa so ne sɛ, nhoma no kyerɛkyerɛ nea Onyankopɔn ayɛ, sɛnea osi yii ne nkurɔfo fii nkoasom mu, na ɔde wɔn yɛɛ ɔman a wɔwɔ daakye. Onipa titiriw a odi nhoma yi mu akoten ne Mose. Ɔyɛ onipa a Onyankopɔn faa no so yii Israelfo fii Misraim. Nhoma no fa titiriw a wonim no yiye papaapa ne Mmaransɛm du no. (20.1-17)
EMU NSƐM
Israelfo nya ahofadi fi Misraim 1.1—15.21
Wɔn Nkoasom wɔ Misraim 1.1-22
Mose awo ne n'abrabɔ mfiase 2.1—4.31
Mose ne Aaron ne Misraimhene de si anim 5.1—11.10
Twam afahyɛ ne ofi a wofii Misraim 12.1—15.21
Efi mmɛw po no ho kosi Sinai Bepɔw ho 15.22—18.27
Mmara no ne Apam no 19.1—24.18
Apam ntamadan no, ne ɔsom ho akwankyerɛ 25.1—40.38",https://www.bible.com/bible/3439/EXO.INTRO1.ATWDB
EKSODƆS 1,"Israelfo amanehunu wɔ Misraim
1 Na eyinom ne Israel mma a wɔne Yakob baa Misraim no din. Wɔn mu biara ne ne fifo na ɛbae. 2Ruben, Simeon, Lewi ne Yuda, 3Isakar, Sebulon ne Benyamin, 4Dan ne Naftali, Gad ne Aser. 5 Na akra a wofi Yakob asen mu nyinaa si akra aduɔsɔn; na Yosef wɔ Misraim dedaw.
6 Na Yosef ne ne nuanom nyinaa ne wɔn bere sofo no nyinaa wuwui. 7 Na Israel mma no wowoe, na wɔdɔe pii pa ara, na wɔn ase fɛee, na wɔn ho yɛɛ den papaapa; na wɔyɛɛ asase no so ma. 8Na ɔhene foforo bi a onnim Yosef bedii Misraim so. 9Na ɔka kyerɛɛ ne man sɛ: Hwɛ, Israelfo no dɔɔso, na wɔn ho yɛ den sen yɛn. 10Momma yɛmpɛ nyansa kwan bi mfa wɔn mfa so, na wɔannɔɔso, na sɛ ɔsa bi ba a, wɔankɔdɔm yɛn atamfo ne yɛn ammɛko, na wɔansɔre asase yi so ankɔ. 11 Na wosisii wɔn so adwumayɛfo so mpanyimfo sɛ wɔmfa nnwuma a ɛyɛ den nhyɛ wɔn so. Na wɔkyekyeree adekora nkurow Pitom ne Rameses maa Farao. 12Nanso dodow a wɔhyɛɛ wɔn so no, dodow ara na wɔdɔe, na wɔtrɛwee. Na Misraimfo suroo Israelfo no. 13Na wɔde anyadi yawyaw dii Israelfo, 14na wɔmaa wɔn asetena fonoo wɔn wɔ dɔte ne ntayaa ho adwuma den ne afum adwumayɛ ahorow nyinaa, ne nnwuma horow nyinaa mu nyadi yawyaw a wɔde dii wɔn mu.
15Na Misraim hene ka kyerɛɛ Hebrifo awogyefo a wɔn mu biako din de Sifra, na obiako din de Pua no sɛ: 16Sɛ mokogye Hebrifo mmea awo, na muhu agua no so sɛ ɔyɛ ɔbarima a, munkum no; na sɛ ɔyɛ ɔbea de a, momma ɔntena ase. 17Na awogyefo no suro Onyankopɔn, enti wɔanyɛ sɛnea Misraim hene ka kyerɛɛ wɔn no, na mmom wogyee mmammarima no nkwa. 18Na Misraim hene frɛɛ awogyefo no ka kyerɛɛ wɔn sɛ: Ɛdɛn nti na moyɛ saa, na moma mmarima no tena ase? 19Na awogyefo no ka kyerɛɛ Farao sɛ: Hebrifo mmea nte sɛ Misraimfo mmea, na wɔn de, wɔyɛ pirimpirim; awogyefo no nnya nnuu wɔn nkyɛn no, na wɔawo dedaw. 20Enti Onyankopɔn ne awogyefo no dii no yiye. Na nkurɔfo no dɔɔso ara, na wɔyɛɛ den yiye. 21Na esiane sɛ awogyefo no suro Onyankopɔn nti, ɔmaa wɔn afi mu yɛɛ yiye.
22Ɛnna Farao hyɛɛ ne man nyinaa sɛ: Ɔbabanin biara a wɔbɛwo no no, monkɔtow no nkyene asubɔnten Nil mu, na mmabea nyinaa de, momma wɔntena hɔ.",https://www.bible.com/bible/3439/EXO.1.ATWDB
EKSODƆS 2,"Mose awo
1 Na ɔbarima bi a ofi Lewi fi kɔwaree Lewi babea bi. 2 Na ɔbea no nyinsɛnee, na ɔwoo babarima; na ohui sɛ ne ho yɛ fɛ no, ɔde no siei asram abiɛsa.
3Na ontumi nkora no so bio no, ɔfaa mmɛw adaka bi de ama ne mannɔ sraa ho, na ɔde abofra no too mu, na ɔde kɔtoo wura mu wɔ asubɔnten no ano. 4 Na ne nuabea kogyinaa akyirikyiri sɛ ɔrehwɛ nea ɛbɛyɛ no.
5Na Farao babea sian baa asu no ano aguare, na ne mmaawa repase asu no kɔn so; na ohuu adaka no wɔ wura no mu no, ɔsomaa n'abaawa sɛ ɔnkɔfa mmra. 6Na obuee so no, ohuu akokoaa no, na hwɛ, ɛyɛ abarimaa a ɔresu. Na ɔyɛɛ no mmɔbɔ, na ose: Hebrifo mma no bi ni. 7Ɛnna ne nuabea no ka kyerɛɛ Farao babea no sɛ: So menkɔ menkɔfrɛ Hebrifo mmea no mu nufumafo bi memmrɛ wo, na ɔmmɛma akokoaa no nufu mma wo anaa? 8Na Farao babea no ka kyerɛɛ no sɛ: Kɔ ɛ! Na ababaa no kɔe kɔfrɛɛ abofra no na ankasa bae. 9Na Farao babea no ka kyerɛɛ no sɛ: Fa abofra yi kɔ kɔma no nufu ma me, na metua wo ka. Na ɔbea no faa abofra no kɔmaa no nufu. 10Na abofra no nyinii, na ɔde no kɔmaa Farao babea no, na ɔdan ne ba. Na ɔtoo no din Mose, efisɛ ose: Nsu mu na miyii no fii.
Mose guan kɔ Midian
11 Na Mose nyinii no, da bi ofii adi kɔɔ ne nuanom nkyɛn sɛ ɔrekɔhwɛ wɔn adwumayɛ no; na ohui sɛ Misraimni bi reboro ne nuanom mu bi a ɔyɛ Hebrini. 12 Na ɔhwɛɛ ha ne ha, na ohui sɛ obi nni hɔ no, ɔbɔɔ Misraimni no ade kum no, na ɔde no siee nwea mu. 13Na ade kyee no, ofii adi, na hwɛ, Hebrifo baanu reko. Na ɔka kyerɛɛ nea odi fɔ no sɛ: Ɛdɛn nti na woboro wo yɔnko? 14 Na ose: Hena na ɔde wo sii yɛn so otitiriw ne sennifo? Wopɛ sɛ wukum me sɛnea wukum Misraimni no anaa? Na Mose suroe, na ose: Asɛm no anya afi!
15 Na Farao tee asɛm yi no, anka ɔhwehwɛ Mose akum no, nanso Mose guan fii Farao anim kɔtenaa Midian asase so. Na ɔkɔtenaa asubura bi so. 16 Nso Midian sɔfo wɔ mmabea baasɔn; na wɔbae bɛtow nsu de hyehyɛɛ adaase no amaama sɛ wɔrema wɔn agya nguan anom. 17 Na nguanhwɛfo bi bae bɛpam wɔn; na Mose sɔre boaa wɔn, na ɔmaa wɔn nguan no nomee. 18Na wɔbaa wɔn agya Reuel nkyɛn no, ɔkae sɛ: Ɛyɛɛ dɛn na nnɛ de, moaba ntɛm sɛɛ? 19Na wose: Misraimni bi na oyii yɛn fii nguanhwɛfo no nsam, na ɔtow nsu po maa yɛn, na ɔmaa nguan no nomee. 20Na ɔka kyerɛɛ ne mmabea no sɛ: Na ɔwɔ he? Ɛdɛn nti na mugyaw ɔbarima no? Monkɔfrɛ no na ommedidi.
21Na Mose penee sɛ ɔne ɔbarima no bɛtena. Na ɔde ne babea Sipora maa Mose aware.
22 Na ɔwoo babanin, na Mose too no din Gersom, ase ne: Baabi hɔho, efisɛ ose: Mayɛ ɔhɔho wɔ ananafo asase so.
23 Na nna dodow yi mu no ɛbae sɛ Misraim hene wui. Na ɔsom no nti Israelfo no sii apini, na wosu frɛe, na wɔn som no mu sufrɛ no koduu Onyankopɔn anim. 24 Na Onyankopɔn tee wɔn apinisi no, na Onyankopɔn kaee n'apam a ɔne Abraham ne Isak ne Yakob pamee no. 25Na Onyankopɔn hwɛɛ Israelfo no, na Onyankopɔn huu wɔn tebea a wɔwɔ mu no.",https://www.bible.com/bible/3439/EXO.2.ATWDB
EKSODƆS 3,"Onyankopɔn frɛ Mose
1Bere bi a Mose rehwɛ n'ase Yetro, Midian sɔfo no, nguan, na ɔkaa wɔn de wɔn kɔɔ sare no akyi noho, na oduu Onyankopɔn bepɔw Horeb ho.
2 Na AWURADE bɔfo beyii ne ho adi kyerɛɛ no wɔ nkyɛkyerɛ bi mfinimfini gyaframa mu, na ɔhwɛe, na hwɛ, nkyɛkyerɛ no redɛw, nanso nkyɛkyerɛ no nhyew. 3Na Mose se: Eyi de, mɛman makɔhwɛ ahwɛde kɛse yi, dekode a enti nkyɛkyerɛ no nhyew. 4Na AWURADE hui sɛ waman rehwɛ no, Onyankopɔn fi nkyɛkyerɛ no mu frɛe sɛ: Mose, Mose! Na ose: Mini! 5 Ɛnna AWURADE kae sɛ: Ntwiw mmɛn ha! Yi wo nan ase mpaboa, na nea wugyinae hɔ yɛ asase kronkron. 6 Na ɔkae bio sɛ: Mene w'agya Nyankopɔn no, Abraham Nyankopɔn, Isak Nyankopɔn ne Yakob Nyankopɔn no. Ɛnna Mose kataa n'ani, efisɛ osuro sɛ ɔbɛhwɛ Onyankopɔn. 7 Na AWURADE se: Ohu na mahu me man a ɛwɔ Misraim no amanehunu, na wɔn su a wɔn so ahwɛfo nti wosu frɛ no mate. 8Na masian sɛ merebeyi wɔn Misraimfo nsam, na matutu wɔn afi asase no so akɔ asase pa a ɛtrɛw so, asase a nufusu ne wo sen wɔ so: Kanaanfo, Hetifo, Amorifo, Perisifo, Hewifo, Yebusifo tenabea hɔ.
9Na afei, hwɛ, Israelfo no sufrɛ adu m'anim, na mahu ɔhaw a Misraimfo de haw wɔn no. 10Na afei bra na mensoma wo Farao nkyɛn, na koyi me man Israelfo no fi Misraim. 11 Na Mose ka kyerɛɛ Onyankopɔn sɛ: Hena ne me a merekɔ Farao nkyɛn makoyi Israelfo afi Misraim? 12Na AWURADE ka kyerɛɛ no sɛ: Medi w'akyi; na eyi bɛyɛ wo sɛnkyerɛnne sɛ me na mesomaa wo: wunya yi ɔman no fi Misraim ba a, mobɛsom Nyankopɔn wɔ bepɔw yi so.
13Na Mose ka kyerɛɛ Onyankopɔn sɛ: Na sɛ midu Israelfo nkyɛn, na meka mekyerɛ wɔn sɛ: Mo agyanom Nyankopɔn na asoma me mo nkyɛn, na wɔka kyerɛ me sɛ: Ne din de dɛn a, dɛn na minse wɔn? 14 Na Onyankopɔn ka kyerɛɛ Mose sɛ: ME ARA NE NEA MENE. Na ose: Sɛnea ka kyerɛ Israelfo no ni: ME ARA na asoma me mo nkyɛn yi.
15 Na Onyankopɔn ka kyerɛɛ Mose bio sɛ: Ka kyerɛ Israel mma sɛ: AWURADE, mo agyanom Nyankopɔn, Abraham Nyankopɔn, Isak Nyankopɔn ne Yakob Nyankopɔn na wasoma me mo nkyɛn yi, eyi ne me din de kosi daa, na eyi na wɔmfa nkae me awo ntoatoaso nyinaa mu. 16Kɔ na kɔboa Israel mpanyimfo ano, na ka kyerɛ wɔn sɛ: AWURADE, mo nananom Nyankopɔn, Abraham, Isak ne Yakob Nyankopɔn no ayi ne ho akyerɛ me sɛ: Ɔhwɛ na mabɛhwɛ mo ne nea wɔreyɛ mo wɔ Misraim no. 17Na mise: Meyi mo afi Misraim amanehunu no mu akɔ Kanaanfo, Hetifo, Amorifo, Perisifo, Hewifo ne Yebusifo asase so, asase a nufusu ne wo sen wɔ so no. 18 Na wobetie wo nne, na wo ne Israel mpanyimfo nkɔ Misraim hene nkyɛn nkɔka nkyerɛ no sɛ: AWURADE, Hebrifo Nyankopɔn, abehyia yɛn, enti yɛsrɛ wo, ma yɛnkɔ sare so nnansa kwan nkɔbɔ AWURADE, yɛn Nyankopɔn, afɔre. 19Na me de, minim sɛ wɔde nsa a ɛyɛ den hyɛ Misraim hene mpo a, ɔremma mo kwan nkɔ. 20Enti mɛteɛ me nsa de m'anwonwade a mɛyɛ wɔ hɔ no nyinaa mabobɔ Misraim, na ɛno akyi na ɔbɛma moakɔ. 21 Na mɛma ɔman yi anim ayɛ nyam wɔ Misraimfo anim, na ɛbɛba sɛ mobɛkɔ no, morenkɔ no nsapan. 22Na mmea mmisabisa wɔn afipamfo ne wɔn afitenafo nkyɛn dwetɛ nnwinne ne sika nnwinne ne ntama, na momfa nhyehyɛ mo mmammarima ne mo mmabea, na Misraimfo nneɛma no nyɛ mo asade.",https://www.bible.com/bible/3439/EXO.3.ATWDB
EKSODƆS 4,"Onyankopɔn ma Mose tumi sonowonko
1Na Mose buaa AWURADE sɛ: Na sɛ wɔannye me anni, na wɔantie me nne, na wɔka sɛ: AWURADE nyii ne ho adi nkyerɛɛ wo ɛ! 2Na AWURADE ka kyerɛɛ no sɛ: Dɛn na ekura wo nsam yi? 3 Na ose: Poma. Na ose: Tow kyene fam! Na ɔtow kyenee fam, na ɛdan ɔwɔ. Na Mose guan fii ho. 4Na AWURADE ka kyerɛɛ Mose sɛ: Teɛ wo nsa na so ne dua mu. Na ɔteɛɛ ne nsa kyeree no, na ɛdan poma wɔ ne nsam. 5Nea ɛbɛyɛ na wɔagye adi sɛ Awurade, wɔn agyanom Nyankopɔn, Abraham Nyankopɔn, Isak Nyankopɔn ne Yakob Nyankopɔn no, ayi ne ho akyerɛ wo nen.
6Na AWURADE ka kyerɛɛ no bio sɛ: Fa wo nsa hyɛ wo kokom! Na ɔde ne nsa hyɛɛ ne kokom, na oyii, na hwɛ, ɛho agu kwata fitaa sɛ sukyerɛma. 7Na ose: Fa wo nsa san hyɛ wo kokom! Na ɔsan de ne nsa hyɛɛ ne kokom, na oyi fii ne kokom, na hwɛ, adan sɛ ne honam ara. 8Na sɛ wɔannye wo anni, na wɔammu sɛnkyerɛnne a edi kan no a, wobegye sɛnkyerɛnne a ɛto so abien no adi. 9 Na sɛ wɔannye nsɛnkyerɛnne abien yi nso anni na wɔantie wo nne a, ɛnne kɔsaw asubɔnten no mu nsu kohwie gu asase kesee so, na nsu a wosawee, asu no mu no bɛdan mogya wɔ asase kesee no so.
10 Na Mose ka kyerɛɛ AWURADE sɛ: Mesrɛ wo, AWURADE! Me de, ɛde besi nnɛ anaa efi bere a wo ne w'akoa kasae yi, m'ano ntew; me kasa yɛ nyaa na me tɛkrɛma nso yɛ duru. 11 Na AWURADE ka kyerɛɛ no sɛ: Hena na ɔyɛɛ onipa ano? Anaasɛ hena na ɔyɛ mum anaa ɔsotifo, anaa ɔdehufo anaa onifuraefo? Ɛnyɛ me AWURADE ara? 12 Na afei kɔ, na me ara medi w'ano akyi na makyerɛ wo nea ka. 13Na Mose kae sɛ: Mesrɛ wo, AWURADE! Soma onipa foforo biara a wopɛ.
14Ɛnna AWURADE bo fuw Mose, na ose: So minnim sɛ wo nua Aaron, Lewini no, nim kasa? Na hwɛ, wafi adi rebehyia wo, na sɛ ohu wo a, ne koma bɛtɔ ne yam. 15Na kasa kyerɛ no, na fa nsɛm no hyɛ n'anom; na me de, medi w'ano ne n'ano akyi, na makyerɛ mo nea monyɛ. 16 Na ɔnkasa w'ano nkyerɛ ɔman no, na ɔbɛdan w'ano na woadan no Onyankopɔn. 17Na poma yi a wode bɛyɛ nsɛnkyerɛnne no, fa kura wo nsam.
Mose san kɔ Misraim
18 Na Mose kɔe, na ɔsan kɔɔ n'ase Yetro nkyɛn, na ɔkɔka kyerɛɛ no sɛ: Ma mensan menkɔ me nuanom a wɔwɔ Misraim no nkyɛn menkɔhwɛ sɛ wɔda so tete ase anaa. Na Yetro ka kyerɛɛ Mose sɛ: Fa asomdwoe kɔ. 19 Na AWURADE ka kyerɛɛ Mose wɔ Midian sɛ: San kɔ Misraim, efisɛ nnipa a wɔhwehwɛ wo akum wo no nyinaa awuwu. 20 Na Mose faa ne yere ne ne mma de wɔn tenatenaa mfurum so, na ɔsan baa Misraim asase so. Na Mose faa Onyankopɔn poma no kurae.
21 Na AWURADE ka kyerɛɛ Mose sɛ: Sɛ wosan kɔ Misraim a, hwɛ na yɛ anwonwade a mede mahyɛ wo nsa no nyinaa Farao anim; na me de, mepirim ne koma, na ɔremma ɔman no nkɔ. 22 Na ka kyerɛ Farao sɛ: Sɛnea AWURADE se ni: M'abakan ne Israel. 23 Na mise wo sɛ: Ma me ba nkɔ nkɔsom me. Na sɛ woampene amma wankɔ a, hwɛ, me de, mekum w'abakan.
24 Na AWURADE bɛtoaa no ɔkwan so, asoɛe a wɔdaa hɔ no, pɛe sɛ okum no. 25 Ɛnna Sipora faa twɛrebo de twaa ne ba no twetia, na ɔtow kyenee ne nan ase kae sɛ: Woyɛ mogya ayeforokunu ma me! 26Ɛnna ogyaa no. Ɛnna twetiatwa no nti ɔkae sɛ: Mogya ayeforokunu ne wo.
27Na AWURADE ka kyerɛɛ Aaron sɛ: Kɔ sare so kohyia Mose. Na ɔkɔe kɔtoo no wɔ Onyankopɔn bepɔw no ho, na ofew n'ano. 28Na Mose kaa AWURADE nsɛm a ɔde asoma no no nyinaa ne nsɛnkyerɛnne a ɔde ahyɛ ne nsa no nyinaa kyerɛɛ Aaron. 29Na Mose ne Aaron kɔ kɔboaboaa Israelfo mpanyimfo nyinaa ano. 30Na Aaron kaa nsɛm a AWURADE ka kyerɛɛ Mose no nyinaa kyerɛɛ wɔn, na ɔyɛɛ nsɛnkyerɛnne no wɔ ɔman no anim.
31 Na ɔman no gye dii. Na wɔtee sɛ AWURADE abɛhwɛ Israelfo na wahu wɔn amanehunu no, wɔbobɔɔ wɔn mu ase sɔree.",https://www.bible.com/bible/3439/EXO.4.ATWDB
EKSODƆS 5,"Mose ne Aaron kɔ Farao anim
1 Na ɛyɛe no, Mose ne Aaron kɔɔ Farao nkyɛn kɔka kyerɛɛ no sɛ: Sɛ AWURADE, Israel Nyankopɔn, se ni: Ma me man nkɔ na wɔnkɔhyɛ fa mma me wɔ sare so. 2 Na Farao se: Hena ne AWURADE a metie ne nne na mama Israel akɔ? Minnim AWURADE no, na Israel nso, meremma wɔnkɔ. 3Na wose: Hebrifo Nyankopɔn abehyia yɛn; enti ma yɛnkɔ sare so nnansa kwan, na yɛnkɔbɔ Awurade, yɛn Nyankopɔn, afɔre, na wamfa owuyare anaa nkrante ammetoa yɛn. 4Na Misraimhene ka kyerɛɛ wɔn sɛ: Ɛdɛn nti na mo, Mose ne Aaron, muyi ɔman no fi wɔn nnwuma so? Monkɔ mo adwuma so. 5 Na Farao se: Monhwɛ, afei nnipa no adɔɔso wɔ asase no so, na morepɔn wɔn afi wɔn adwumayɛ mu yi!
6Na da no ara Farao hyɛɛ ɔman no adwumayɛ so ahwɛfo ne wɔn aboafo sɛ: 7Mommma ɔman no sare a wɔde yɛ ntayaa no bio sɛ kan no; wɔn ankasa nkɔpɛ sare no. 8Na ntayaa dodow a wɔyɛ daa no, munnye wɔn, munnyi so bi, efisɛ wɔyɛ anihawfo, enti na wosu sɛ: Ma yɛnkɔ nkɔbɔ yɛn Nyankopɔn afɔre no. 9Momma wɔn adwuma a emu yɛ duru, na wɔnyɛ, na wɔantie nsɛnhunu. 10Na ɔman no adwumayɛ so ahwɛfo ne wɔn aboafo no bae bɛka kyerɛɛ ɔman no sɛ: Sɛ Farao se ni: Meremma mo sare bio. 11Mo ara monkɔ nkɔpɛ sare wɔ nea mubenya; na mo adwuma no nso, wɔrentew so hwee. 12Ɛnna ɔman no bɔ petee Misraim asase nyinaa so kɔboaboaa awi ntwakae ano de yɛɛ sare mesemese no. 13Na adwumayɛ so ahwɛfo no piapiaa wɔn kae sɛ: Munwie mo da koro adwuma wɔ ne bere mu, sɛ bere a sare wɔ hɔ no. 14Na wɔhwee Israelfo ahwɛfo a Farao adwumayɛ so ahwɛfo no de asisi wɔn so no kae sɛ: Ɛdɛn nti na moanwie ntayaa a wɔahyɛ mo no nnɛ ne nnɛra nyinaa, sɛ kan no?
15Ɛnna Israelfo ahwɛfo no bae besu kyerɛɛ Farao sɛ: Ɛdɛn nti na wo ne wo nkoa di no saa? 16 Wɔmmaa wo nkoa sare bi ɛ, nso wose yɛnyɛ ntayaa; na hwɛ, wɔhwe wo nkoa, nso ɛyɛ wo ara wo nkurɔfo no mfomso. 17Na ose: Anihawfo, anihawfo na moyɛ. Enti na moka sɛ: Ma yɛnkɔ nkɔbɔ AWURADE afɔre. 18Enti monkɔ nkɔyɛ adwuma, na sare de, wɔremma mo, nso ntayaa no dodow de, mobɛma ara. 19Na wɔkae sɛ: Munnyi mo da koro adwuma mu ntayaa no so ara da, no, Israelfo adwumayɛ so ahwɛfo no hui sɛ amane na ato wɔn.
20Na wofi Farao nkyɛn reba no, wɔbɛtoo Mose ne Aaron a wogyina hɔ rebehyia wɔn, 21 na wɔka kyerɛɛ wɔn sɛ: AWURADE nhwɛ mo mmu atɛn sɛ moama yɛn ho abɔn wɔ Farao ne ne nkoa anim, na mode nkrante ahyɛ wɔn nsa sɛ wɔmfa nkum yɛn.
Mose kasa kyerɛ AWURADE
22Na Mose san baa AWURADE nkyɛn bɛkae sɛ: AWURADE, adɛn na woayɛ ɔman yi bɔne sɛɛ? Adɛn na wosomaa me yi? 23Na efi bere a mebaa Farao nkyɛn na mede wo din me ne no kasae no, wayɛ ɔman yi bɔne, na wo nso wunnyee wo man ɛ!",https://www.bible.com/bible/3439/EXO.5.ATWDB
EKSODƆS 6,"1 Na AWURADE ka kyerɛɛ Mose sɛ: Afei ansa na worebehu nea mɛyɛ Farao, efisɛ wɔde nsa a ɛyɛ den bɛma wama wɔakɔ, na wɔde nsa a ɛyɛ den bɛma wapam wɔn afi n'asase so mpo.
2Na Onyankopɔn ne Mose kasae na ɔka kyerɛɛ no sɛ: Mene AWURADE, 3 na miyii me ho mekyerɛɛ Abraham, Isak ne Yakob sɛ Onyankopɔn Tweaduampɔn, na me din YHWH (AWURADE) no de, mamma wɔamfa anhu me. 4 Nanso mama m'apam a me ne wɔn pamee no agyina, sɛ mede Kanaan asase a ɛyɛ wɔn ahɔhobea asase a wɔyɛɛ so ahɔho no mɛma wɔn. 5Nanso mate Israelfo a Misraimfo di wɔn nya no apinisi, na makae m'apam no. 6Ɛno nti ka kyerɛ Israelfo sɛ: Mene AWURADE, na megye mo afi Misraim nkoasom no ase, na mayi mo mafi wɔn anyadi no mu, na mede basa a ateɛ ne atemmu akɛse magye mo. 7Na mɛfa mo mayɛ me man, na mayɛ mo Onyankopɔn, na moahu sɛ mene AWURADE mo Nyankopɔn a ogyee mo fii Misraim nkoasom ase no. 8 Na mede mo mɛkɔ asase a mekaa ntam sɛ mede mɛma Abraham, Isak ne Yakob no so, na mede mɛma mo sɛ agyapade. Mene Awurade. 9Na Mose kaa saa kyerɛɛ Israelfo no; nanso ahometew ne nkoasom dennen no nti wɔantie Mose. 10Na Awurade ka kyerɛɛ Mose sɛ: 11Kɔ na kɔka kyerɛ Misraim hene Farao sɛ ɔmma Israelfo mfi n'asase so nkɔ. 12 Na Mose ka kyerɛɛ Awurade sɛ: Hwɛ, Israelfo no ntie me, na ɛbɛyɛ dɛn na Farao betie me a meyɛ ano mu momonoto yi. 13Na AWURADE ne Mose ne Aaron kasae, na ɔhyɛɛ wɔn sɛ wɔnkɔ Israelfo ne Misraim hene Farao nkyɛn nkoyi Israelfo no mfi Misraim asase so.
14 Eyinom ne wɔn agyanom afi mu atitiriw: Israel abakan Ruben mma ne: Hanok ne Palu, Hesron ne Karmi; eyinom ne Ruben mmusua.
15Na Simeon mma ne: Yemuel ne Yamin ne Ohad ne Yakin ne Sohar ne Saul a ɔyɛ Kanaanni bea bi ba; eyinom ne Simeon mmusua.
16 Na eyinom ne Lewi mma din wɔn awo ntoatoaso mu: Gerson ne Kahat ne Merari. Na Lewi mfe a odii si mfe ɔha aduasa asɔn. 17Gerson mma ne: Libni ne Simei wɔ wɔn mmusua horow mu: 18Na Kohat mma ne: Amram ne Ishar ne Hebron ne Usiel. Na Kahat mfe a odii si mfe ɔha aduasa abiɛsa. 19Na Merari mma ne Mahli ne Musi. Eyinom ne Lewi mmusua, sɛnea wɔn awo ntoatoaso te. 20 Na Amram faa n'agya ne nua Yokebed waree, na ɔwoo Aaron ne Mose maa no. Na Amram mfe a odii si mfe ɔha aduasa asɔn. 21 Na Ishar mma ne: Kora ne Nefeg ne Sikri. 22 Na Usiel mma ne: Misael ne Elsafan ne Sitri. 23 Na Aaron faa Aminadab babea Eliseba a ɔyɛ Nahson ne nua waree, na ɔwoo Nadab, Abihu, Eleasar ne Itamar maa no. 24Na Kora mma ne: Asir, Elkana ne Abiasaf; eyinom ne Kora mma mmusua. 25 Na Aaron ba Eleasar faa Putiel mma mu bi waree, na ɔwoo Pinehas maa no. Eyinom ne Lewifo agyanom atitiriw sɛ wɔn mmusua te. 26Eyinom ne Aaron ne Mose a Awurade ka kyerɛɛ wɔn sɛ: Munyi Israelfo mfi Misraim asase so sɛ wɔn dɔm te no. 27Wɔne wɔn a wɔne Misraim hene Farao kasae sɛ wobeyi Israelfo afi Misraim akɔ no, Mose ne Aaron no ni.
28Na da a AWURADE ne Mose kasae Misraim asase so no, 29AWURADE ka kyerɛɛ Mose sɛ: Mene Awurade, ka nea mɛka makyerɛ wo nyinaa kyerɛ Misraim hene Farao. 30 Na Mose ka kyerɛɛ AWURADE sɛ: Hwɛ, ano mu momonoto ne me, na ɛbɛyɛ dɛn na Farao betie me?",https://www.bible.com/bible/3439/EXO.6.ATWDB
EKSODƆS 7,"1 Na AWURADE ka kyerɛɛ Mose sɛ: Hwɛ, madan wo Onyankopɔn mama Farao, na wo nua Aaron bɛyɛ wo diyifo. 2Wo de, wobɛka nea mɛhyɛ wo nyinaa, na wo nua Aaron bɛka akyerɛ Farao sɛ ɔmma Israelfo mfi n'asase so nkɔ. 3 Na me de, mepirim Farao koma, na mama me nsɛnkyerɛnne ne m'anwonwade adɔɔso Misraim asase so. 4Nanso Farao rentie mo; na mede me nsa mɛto Misraim so, na mayi m'asafo, me man Israelfo no, mafi Misraim asase so wɔ atemmu akɛse mu. 5 Na sɛ meteɛ me nsa wɔ Misraim so na miyi Israelfo mifi wɔn mu a, na Misraimfo behu sɛ mene AWURADE. 6Na Mose ne Aaron yɛe sɛnea AWURADE hyɛɛ wɔn no ara.
7Bere a wɔne Farao kɔkasae no, na Mose adi mfirihyia aduɔwɔtwe, na Aaron nso adi mfirihyia aduɔwɔtwe abiɛsa.
Aaron poma no
8Na AWURADE ka kyerɛɛ Mose ne Aaron sɛ: 9 Sɛ Farao ka kyerɛ mo sɛ monyɛ anwonwade bi a, ɛno de ka kyerɛ Aaron sɛ: Fa wo poma to fam wɔ Farao anim, na ɛbɛdan ɔtweaseɛ. 10Na Mose ne Aaron kɔɔ Farao nkyɛn kɔyɛe sɛnea AWURADE hyɛɛ wɔn no; na Aaron de ne poma no too fam wɔ Farao ne ne nkoa anim, na ɛdan ɔtweaseɛ.
11 Na Farao nso frɛfrɛɛ anyansafo ne ntafowayifo bae. Na wɔn Misraim akɔmfo no nso de wɔn asumansɛm yɛɛ saa ara. 12Na wɔn nyinaa de wɔn mpoma totoo fam, na ɛdannan atweaseɛ, nanso Aaron poma no memmenee wɔn mpoma no. 13 Na Farao koma pirimii ara, na wantie wɔn, sɛnea AWURADE kae no.
Ɔhaw ahorow ba Misraim
14Na AWURADE ka kyerɛɛ Mose sɛ: Farao koma yɛ den, ɔmpene sɛ ɔman no bɛkɔ. 15Kɔ Farao nkyɛn anɔpa; hwɛ, ɔrefi adi akɔ asu no ano; na kogyina asu no ano hyia no, na fa wo poma a ɛdan ɔwɔ no kura. 16 Ka kyerɛ no sɛ: AWURADE, Hebrifo Nyankopɔn na wasoma me wo nkyɛn sɛ: Ma me man nkɔ nkɔsom me sare so, na hwɛ, wuntiei de abedu sesɛɛ. 17 Sɛ AWURADE se ni: Eyi na wode behu sɛ mene AWURADE: Hwɛ, mede poma a mikurae yi merebɔ asu yi mu nsu mu, na ɛbɛdan mogya. 18Na mpataa a ɛwɔ asu no mu bewuwu, na nsu no bɛbɔn na Misraimfo bekyi sɛ wɔbɛnom asu no mu nsu.
19 Na AWURADE ka kyerɛɛ Mose sɛ: Ka kyerɛ Aaron sɛ: Fa wo poma, na teɛ wo nsa wɔ Misraim nsu so, wɔn nsubɔnten so, wɔn asuasu so ne wɔn atare so ne wɔn nsu a ɛtaataa hɔ nyinaa so, na ɛnnan mogya; na mogya aba Misraim asase nyinaa so, nnua ade ne abo ade mu. 20Na Mose ne Aaron yɛe sɛnea AWURADE hyɛɛ wɔn no; na ɔmaa poma no so, na ɔde bɔɔ nsu a ɛwɔ asu no mu no mu wɔ Farao ne ne nkoa anim; na nsu a ɛwɔ asu no mu nyinaa dan mogya. 21Na mpataa a ɛwɔ asu no mu wuwui, na asu no bɔnee, na Misraimfo antumi annom asu no mu nsu, na mogya kataa Misraim asase nyinaa so. 22 Na Misraim akɔmfo de wɔn asumansɛm yɛɛ saa ara. Na Farao koma pirimii ara, na wantie wɔn, sɛnea AWURADE kae no. 23Na Farao dan ne ho kɔɔ ne fi, na eyi nso wannwen ho. 24Na Misraimfo nyinaa tutuu asu no ho mmura sɛ wɔrepɛ nsu anom, efisɛ wontumi nnom asu no mu nsu. 25Na nnansɔn a AWURADE dan nsu no betwaa mu.",https://www.bible.com/bible/3439/EXO.7.ATWDB
