Title,Content,URL
GYENESIS 31,"Yakob guan fi Laban fi
1 Na ɔtee Laban mmammarima nsɛm a wɔkae sɛ: Yakob afa nea ɛyɛ yɛn agya de nyinaa; eno na ɔde anya saa anuonyam yi nyinaa. 2Na Yakob huu Laban anim, na hwɛ, ɛnte sɛnea ɛte kan no. 3 Na AWURADE ka kyerɛɛ Yakob sɛ: San kɔ w'agyanom asase so ne w'abusua mu, na medi w'akyi. 4Na Yakob soma kɔfrɛɛ Rahel ne Lea baa wuram wɔ ne nguan no nkyɛn, 5 na ɔka kyerɛɛ wɔn sɛ: Mihu mo agya anim sɛ ɛnte sɛnea ɛte kan no; nanso m'agya Nyankopɔn adi m'akyi. 6Na mo ara munim sɛ m'ahoɔden nyinaa na mede asom mo agya, 7na mo agya asisi me adan m'akatua ani mpɛn du; nanso Onyankopɔn amma no kwan amma wanyɛ me bɔne bi. 8 Sɛ ɔka sɛ: Wɔn a wɔn ho yɛ ntokontrama no nyɛ w'akatua a, na nguan no nyinaa awowo ntokontrama. Na sɛ ɔka sɛ: Wɔn a wɔn ho yɛ nsensannsensan no nyɛ w'akatua a, na nguan no nyinaa awowo nsensannsensan. 9Na Onyankopɔn agye mo agya mmoakuw ama me. 10Na bere a nguan no reforoforo wɔn ho na wɔayem no, memaa m'ani so na mihui wɔ ɔdae mu, na hwɛ, mpapo a na wɔreforo mmirekyi no ho yɛ nsensannsensan ne ntokontrama ne nworannworan. 11Na Onyankopɔn bɔfo ka kyerɛɛ me ɔdae mu sɛ: Yakob! Na mise: Mini. 12Na ɔkae sɛ: Ma w'ani so hwɛ, adwennini a wɔreforo nguan no nyinaa yɛ nsensannsensan ne ntokontrama ne nworannworan, na mahu nea Laban ayɛ wo nyinaa. 13 Mene Nyankopɔn a wuhyiaa no Betel a wosraa ɛhɔ dum na wohyɛɛ bɔ wɔ hɔ maa me no; afei sɔre fi asase yi so, na san kɔ w'abusua asase so. 14Na Rahel ne Lea bua see no sɛ: So yɛda so wɔ kyɛfa anaasɛ agyapade bi wɔ yɛn agya fi anaa? 15 So ommu yɛn ahɔho anaa? Esiane sɛ watɔn yɛn, na wadi yɛn ti sika awie, 16na ahonyade a Onyankopɔn gyei yɛn agya nsam no yɛ yɛn ne yɛn mma dea. Enti afei yɛ nea Onyankopɔn aka akyerɛ wo nyinaa.
Yakob guan fi Laban anim
17Na Yakob sɔre faa ne mma ne ne yerenom tenatenaa yoma so, 18na ɔfaa ne mmoakuw nyinaa ne n'ahode a onyae nyinaa, ne mmoakuw a onyae wɔ Mesopotamia no, siim sɛ ɔrekɔ n'agya Isak nkyɛn wɔ Kanaan asase so.
19Na Laban kɔe sɛ, ɔrekotwitwa ne nguan ho nwi. Na Rahel wiaa n'agya abusua honi. 20Na Yakob wiaa ne ho guan efisɛ wankra Aramni Laban 21Na ɔne nea ɔwɔ nyinaa guanee, na ɔsɔre twaa asubɔnten no, na ɔde n'ani kyerɛɛ Gilead bepɔw.
22Na da a ɛto so abiɛsa no, wɔkɔka kyerɛɛ Laban sɛ: Yakob aguan. 23 Na ɔfaa ne nkurɔfo kaa ne ho tiw no nnansɔn kwan, na ɔbɛtoo no Gilead bepɔw so. 24 Na Onyankopɔn baa Aramni Laban nkyɛn anadwo dae mu sɛ: Hwɛ yiye na woankasa papa anaa bɔne so ankyerɛ Yakob. 25Na Laban kɔtoo Yakob. Na Yakob asi ne ntamadan wɔ bepɔw no so, na Laban ne ne nkurɔfo nso sii wɔn de Gilead bepɔw so.
26Na Laban ka kyerɛɛ Yakob sɛ, ɛdɛn na woayɛ yi, sɛ woadaadaa me, na woasoa me mmabea kɔ sɛ, wɔn a wɔde nkrante afa wɔn nnommum yi? 27Adɛn nti na woahintaw aguan, na woawia wo ho afi me nkyɛn, na woanka ankyerɛ me, na mamfa anigye ne nnwom, mpintin ne asanku mannya wo kwan? 28Adɛn na woamma mamfew me mmammarima ne me mmabea ano? Eyi de, woadi no nkwasea so. 29Mewɔ tumi sɛ anka me ne mo di no bɔne; nanso nnɛra anadwo no, mo agya me Nyankopɔn kasa kyerɛɛ me sɛ: Hwɛ yiye, na woankasa papa anaa bɔne so ankyerɛ Yakob. 30Na afei de, mahu sɛ pɛ ara na wopɛ sɛ wokɔ, efisɛ gyina na w'ani agyina w'agya fi; na ɛdɛn nti na woawia m'anyame? 31Na Yakob bua see Laban sɛ: Misuroe, efisɛ misusuwii sɛ wubegye wo mmabea afi me nsam. 32 Na nea wubehu w'anyame wɔ ne nsam no rentena ase. Yɛn nkurɔfo yi anim na hwehwɛ nea ɛyɛ wo de wɔ me nkyɛn, na fa kɔ. Na Yakob nnim sɛ, Rahel na owiae. 33Na Laban kɔɔ Yakob ntamadan mu ne Lea ntamadan ne mfenaa baanu no ntamadan mu, nanso wanhu. Na ofi Lea ntamadan mu kɔɔ Rahel ntamadan mu.
34Na Rahel afa abusua honi no de ahyehyɛ yoma so agua mu atena so. Na Laban de ne nsa kekaa ntamadan mu hɔ nyinaa, nanso wanhu. 35Na ɔka kyerɛɛ n'agya sɛ: Mma ɛnnyɛ me wura abufuw sɛ mintumi mensɔre wɔ w'anim, efisɛ mabu me nsa. Na ɔpɛe, pɛe, pɛe, nanso wanhu ahoni no.
36Na Yakob bo fuwii, na ɔne Laban hamee, na Yakob ka kyerɛɛ Laban sɛ: Me mfomso ne dɛn, na me bɔne ne dɛn sɛ wutiw me ɔhyew so sɛɛ yi? 37Sɛ worebɛhwehwɛɛ me nneɛma nyinaa mu yi, wo fi mu ade bɛn na woahu wɔ mu? Saa, fa bɛto me nkurɔfo ne wo nkurɔfo anim wɔ ha, na wommu yɛn baanu ntam atɛn. 38Mfirihyia aduonu ni a metenaa wo nkyɛn, wo nguammere ne wo mmirekyi ampɔn, na wo nguan mu adwennini nso, manni bi. 39 Wɔn a mmoa kum wɔn no mamfa mammrɛ wo, me na mituaa so ka. Nea wowiaa no awia ne nea wowiaa no anadwo, me nsam na wubisae. 40Sɛɛ na ɛyɛɛ me ni: Ahohuru dee me awia, na awɔw dee me anadwo, na m'ani saree dwe. 41 Saa na midii wo fi mfirihyia aduonu. Wo mmabea baanu ho mesom wo mfe dunan, ne wo mmoakuw ho nso mfe asia, na wodan m'akatua ani mpɛn du. 42 Sɛ m'agya Nyankopɔn, Abraham Nyankopɔn ne Isak suro annyina m'akyi a, anka afei wugyaa me kwan nsapan. M'amane ne me nsa ano adwumayɛ na Onyankopɔn hui, na ɔkaa w'anim nnɛra anadwo. 43Na Laban bua see Yakob sɛ: Mmabea yi, me mma a, na mmammarima yi, me mma a, na nguan yi, me nguan a, na nea wuhu yi nyinaa, me dea. Na me mmabea yi, anaasɛ wɔn mma a wɔawo wɔn yi, menyɛ wɔn dɛn nnɛ?
44Afei bra ma yɛmpam, me ne wo, na ɛnyɛ me ne wo ntam adanse. 45 Na Yakob faa ɔbo de yɛɛ odum sii hɔ. 46Na Yakob ka kyerɛɛ ne nkurɔfo sɛ: Mommoaboa abo ano! Na wɔtasee abo yɛɛ no kuw; na wodidii wɔ kuw no so hɔ. 47Na Laban frɛɛ hɔ Yegar-sahaduta, ase ne: Adansekuw, na Yakob de, ɔfrɛɛ hɔ Galeed. 48 Na Laban kae sɛ: Kuw yi ne me ne wo ntam adanse nnɛ. Enti wɔfrɛ hɔ Galeed, ase ne: Adansekuw, 49ne Mispa, ase ne: Ahwɛe, efisɛ ose: Yɛtetew mu a, AWURADE nhwɛ me ne wo ntam. 50Sɛ woteetee me mmabea, na woware yerenom ka me mma ho a, hwɛ obi nka yɛn ho de nanso, Onyankopɔn ne me ne wo ntam dansefo. 51Na Laban ka kyerɛɛ Yakob sɛ: Hwɛ kuw yi, na hwɛ odum a mama so masi me ne wo ntam nso yi. 52Ekuw yi ne adanse, na odum yi ne adanse, sɛ me de, merentwa ekuw yi ho memma wo nkyɛn, na wo nso, worentwa ekuw yi ne odum yi ho mma me nkyɛn mmɛyɛ bɔne. 53 Abraham Nyankopɔn ne Nahor Nyankopɔn, wɔn agya Nyankopɔn mmu yɛn ntam atɛn. Na Yakob kaa n'agya Isak suro ho ntam. 54Na Yakob bɔɔ afɔre wɔ bepɔw no so, na ɔfrɛɛ ne nkurɔfo sɛ, wommedidi; na wodidii, na wɔtenaa bepɔw no so anadwo no.
55Na Laban sɔree anɔpatutu, na ofew ne nenanom ne ne mmabea no ano hyiraa wɔn, na osiim, san kɔɔ ne kurom.",https://www.bible.com/bible/3439/GEN.31.ATWDB
GYENESIS 32,"Yakob hyia Esau
1 Na Yakob sii ne kwan so. Na Onyankopɔn abɔfo behyiaa no. 2Na Yakob huu wɔn no, ɔkae sɛ: Onyankopɔn asafo ni. Na ɔtoo hɔ din: Mahanaim.
3 Na Yakob tutuu abɔfo dii n'anim kɔɔ ne nua Esau nkyɛn Seir asase so wɔ Edom wuram. 4Na ɔhyɛɛ wɔn sɛ: Sɛnea monka nkyerɛ me wura Esau ne sɛ: W'akoa Yakob se: Mekɔtenaa Laban nkyɛn na ɛhɔ na mewɔ de abedu sesɛɛ, 5na manya anantwi ne mfurum, nguan ne nkoa ne mfenaa; na masoma sɛ wɔmmɛka nkyerɛ me wura, na manya w'anim dom.
6Na abɔfo no san baa Yakob nkyɛn bɛkae sɛ: Yɛakɔ wo nua Esau nkyɛn, na ɔno nso ne mmarima ahanan reba abehyia wo. 7Ɛnna Yakob suroe sɛ, na ne ho hiaa no; na ɔkyɛɛ nkurɔfo a wɔwɔ ne nkyɛn, ne nguan, anantwi ne yoma no mu akuw abien kae sɛ: 8Sɛ Esau ba kuw biako so bekum wɔn a, ekuw a ɛbɛka no benya ɔkwan aguan.
9 Na Yakob kae sɛ: M'agya Abraham Nyankopɔn ne m'agya Isak Nyankopɔn, AWURADE a wusee me sɛ: San kɔ w'asase so ne w'abusua mu na mɛyɛ wo yiye no, 10 w'adɔe ne wo nokware a wode akyerɛ w'akoa yi mu biara nsɛ me, efisɛ mede me poma na mitwaa Yordan yi, na afei mayɛ akuw abien. 11Mesrɛ wo, yi me fi me nua, Esau nsam, efisɛ misuro no sɛ ɔbɛba abekum me ne ɛnanom ne wɔn mma nyinaa. 12 Wo na wokae sɛ: Yiye na mɛyɛ wo, na mɛma w'asefo ayɛ sɛ mpoano anwea a dodow nti wontumi nkan.
13Na ɔtenaa hɔ anadwo no; na oyii nea ɛwɔ ne nsam bi sɛ ɔde rekɔkyɛ ne nua Esau; 14mmirekyibere ahanu ne mpapo aduonu, nguammere ahanu ne adwennini aduonu, 15yoma a wɔma nufu ne wɔn mma aduasa, anantwibere aduanan ne anantwinini du, mfurummere aduonu ne mfurum anini du. 16Na ɔde hyɛɛ ne nkoa nsa akuwakuw, na ɔka kyerɛɛ ne nkoa no sɛ: Monsen nni me kan, na momma kuw ne kuw ntam mpan. 17Na ɔhyɛɛ nea odi kan no sɛ: Sɛ me nua Esau behyia wo, na obisa wo sɛ: Hena nipa ne wo, na ɛhe na worekɔ, na eyinom a edi w'anim yi yɛ hena dea? 18Ka kyerɛ no sɛ: W'akoa Yakob dea; ɛyɛ ayɛyɛde a wasoma de rebrɛ me wura Esau; na hwɛ, ɔno nso wɔ yɛn akyi. 19Na ɔhyɛɛ nea ɔto so abien ne nea ɔto so abiɛsa ne wɔn a wodi mmoakuw no akyi nyinaa nso sɛ: Sɛ mukohu Esau a, monka asɛm yi nkyerɛ no. 20Na monka nsi so sɛ: Hwɛ, w'akoa Yakob wɔ yɛn akyi. Na ose: Mede ayɛyɛde a edi m'anim yi merekɔpata no, ansa na mahu n'anim; ebia ɔbɛhwɛ m'anim. 21Na ayɛyɛde no sen dii n'anim; na ɔno de, ɔtenaa nsra no mu anadwo no.
22Na anadwo no ɔsɔree, na ɔfaa ne yerenom baanu, ne ne mmaawa baanu no, ne ne mma dubiako no de wɔn kotwaa Yabok asutwaree. 23Na ɔde wɔn twaa asubɔnten no, na ɔmaa nea ɔwɔ nyinaa twae.
Yakob ne ɔbɔfo bi tentam
24 Na ɛkaa Yakob nko ara. Na ɔbarima bi ne no bɛtentamee koduu adekyee. 25Na ɔbarima no hui sɛ ontumi no no, ɔkaa n'asen so tokuru mu, na Yakob dwonku huanee tentam a ɔne no tentamee no mu. 26 Na ɔbarima no kae sɛ: Ma menkɔ, na ade rekye. Na Yakob se: Meremma wonkɔ gye sɛ wuhyira me. 27Na obisaa no sɛ: Wo din de dɛn? Na ose: Yakob. 28 Na ɔkae sɛ: Wɔremfrɛ wo din Yakob bio, na wɔbɛfrɛ wo Israel, ase ne: Onyankopɔn kofoni, efisɛ wo ne Nyankopɔn ne nnipa ako, na woatumi. 29 Na Yakob bisaa no sɛ: Mesrɛ wo, kyerɛ me wo din. Na ose ɛdɛn nti na wubisa me din? Na ohyiraa no wɔ hɔ. 30 Na Yakob too hɔ din Peniel, ase ne: efisɛ ose: Me ne Nyankopɔn adi nhuanim nso me kra anya nkwa.
31Otwaa mu wɔ Peniel, bere a na owia apue no, na ɔtɔ gu so ne dwonku a ahuan no nti. 32Enti Israelfo nni ntini a ɛwɔ asen mu akwaa tokuru mu no de besi nnɛ, efisɛ ɔkaa Yakob dwonku tokuru mu, n'asen mu ntini no so.",https://www.bible.com/bible/3439/GEN.32.ATWDB
GYENESIS 33,"Yakob ne Esau nkabom
1 Na Yakob maa n'ani so hui, na hwɛ, Esau reba, na mmarima ahanan ka ne ho. Na ɔkyɛɛ ne mma mu maa Lea ne Rahel ne mmaawa baanu no. 2Na ɔde mmaawa no ne wɔn mma dii anim, na Lea ne ne mma dii hɔ, na Rahel ne Yosef dii akyiri. 3Na ɔno ankasa de, ɔsen dii wɔn anim, na ɔbɔɔ ne mu ase kɔɔ fam mpɛn ason de kosii sɛ oduu ne nua no nkyɛn. 4Na Esau tuu mmirika behyiaa no yɛɛ no atuu, na ɔde ne ti too ne kɔn ho, na ofew n'ano, na wosui. 5 Na ɔmaa n'ani so huu mmea no ne wɔn mma no, ɔkae sɛ: Henanom ne eyinom a wɔka wo ho yi? Na ose: ɛyɛ mma a Onyankopɔn de adom w'akoa. 6Na mmaawa no twiw bɛnee, wɔn ne wɔn mma, na wɔbobɔɔ wɔn mu ase. 7Na Lea nso ne ne mma twiw bɛnee bobɔɔ wɔn mu ase, na akyiri no Yosef ne Rahel twiw bɛnee bobɔɔ wɔn mu ase. 8 Na ɔkae sɛ: Na ɛdɔm a mihyiaa wɔn yi ase ne dɛn? Na ose: Sɛ ɛbɛyɛ na menya me wura anim dom. 9Na Esau kae sɛ: Nea mewɔ dɔɔso, me nua, ma wo de ntena hɔ mma wo. 10 Na Yakob kaa se: Dabida, mesrɛ wo, sɛ manya w'anim dom a, gye m'ayɛyɛde a ɛwɔ me nsam yi, na w'anim a mahu yi te sɛ obi hu Nyankopɔn anim, efisɛ w'ani asɔ me. 11 Mesrɛ wo, gye nhyira a wɔde abrɛ wo yi, efisɛ Onyankopɔn adom me, na mewɔ ade nyinaa. Na ɔhyɛɛ no, na ogyei. 12Na ɔkae sɛ: Ma yensim nkɔ, na minni w'anim. 13Na ɔka kyerɛɛ no sɛ: Me wura nim sɛ mma a wɔyɛ mmerɛw ne nguan ne anantwi a wɔma nufu ka me ho, na sɛ wopia wɔn dodo da koro a, nguankuw no nyinaa bewuwu. 14Enti ma me wura ntwam nni n'akoa kan, na me de, mɛnantew brɛoo, sɛnea mmoa a wodi m'anim ne mma no betumi, de akosi sɛ medu me wura nkyɛn wɔ Seir. 15Na Esau kae sɛ: Ma minnyaw wo nnipa a wɔka me ho yi bi. Na ose: Na wɔnyɛ dɛn? Ma minnya me wura anim dom. 16Ɛnna Esau san da no ara sii kwan so kɔɔ Seir.
17Na Yakob siim kɔɔ Sukot, na osii dan wɔ hɔ, na ɔbobɔɔ asese maa ne mmoa; enti wɔfrɛ hɔ Sukot, ase ne: Asese.
18Na Yakob fii Mesopotamia no, ɔnam beduu Sekem kurow a ɛwɔ Kanaan asase so no mu dwoodwoo, na osisii ne ntamadan wɔ kurow no anim. 19 Na ɔtɔɔ asase a osii ne ntamadan wɔ so no wɔ Sekem n'agya Hamor mma nkyɛn, nnwetɛbona ɔha. 20 Na osii afɔremuka wɔ hɔ, na ɔtoo no: El-Elohe-Israel, ase ne: Onyankopɔn, Israel Nyankopɔn.",https://www.bible.com/bible/3439/GEN.33.ATWDB
GYENESIS 34,"Sekem to Dina mmonaa
1 Na Lea babea Dina a ɔwoo no maa Yakob no fii adi sɛ ɔrekɔhwɛ asase no so mmea. 2Na asase no so otitiriw Hewini Hamor ba Sekem huu no no, ɔkyeree no, too no mmonaa guu ne ho fi. 3Na Sekem koma fam Yakob ba Dina ho, na ɔdɔɔ ababaa no, na otwaa ne bo too ne yam.
4Na Sekem ka kyerɛɛ n'agya Hamor sɛ: Kogye ababaa yi aware ma me. 5Na Yakob tee sɛ wahyɛ ne babea Dina ne no ada no; nso na ne mmammarima wɔ ne mmoa nkyɛn wɔ wuram, enti Yakob yɛɛ komm de kosii sɛ wɔbaa fie. 6Na Sekem n'agya Hamor fii adi kɔɔ Yakob nkyɛn sɛ ɔne no rekɔkasa. 7 Na Yakob mmammarima tee no, wofii wuram bae. Na ɛyɛɛ mmarima no yaw, na wɔn bo fuwii pa ara, sɛ Sekem adi Israel ho nkwaseasɛm sɛ ɔne Yakob babea akɔda, ade a ɛnsɛ sɛ wɔyɛ. 8Na Hamor ne wɔn kasae sɛ: Me ba Sekem akoma fam mo babea no ho, mesrɛ mo, momfa no mma no aware. 9Na mo ne yɛn nni ayeware, na momfa mo mmabea mma yɛn, na mo nso monware yɛn mmabea. 10Na mo ne yɛn ntena, na asase na ɛda mo anim yi, montena so nyɛ so adwuma nnya so ade. 11Na Sekem ka kyerɛɛ, Dina n'agya ne ne nuanom sɛ: Momma minnya mo anim dom, na biribiara a mubese me no, mɛma. 12 Munnye me tiade dodow ne akyɛde biara, na biribiara a mubese me no, mɛma, na momfa ababaa no mma me aware.
13Na Yakob mmammarima no kasae de nnaadaa buaa Sekem ne n'agya Hamor, efisɛ wagu wɔn nuabea Dina ho fi, 14na wɔka kyerɛɛ wɔn sɛ: Yɛrentumi saa ade yi yɛ, sɛ yɛde yɛn nua bɛma ɔbarima a ɔyɛ momonoto, efisɛ ɛno yɛ ahohora ma yɛn. 15Na eyi mu nko na yɛbɛpene mo, sɛ mobɛdan ayɛ sɛ yɛn, na wɔatwa mo mu mmarima nyinaa twetia. 16Ɛno na yɛde yɛn mmabea bɛma mo, na yɛabɛfa mo mmabea nso aware, na yɛne mo atena, na yɛayɛ ɔman koro. 17Na sɛ moantie yɛn, na moantwa twetia a, ɛnne yɛbɛfa yɛn babea akɔ.
18Na wɔn nsɛm no sɔɔ Hamor ne Hamor ba Sekem ani, 19sɛ ɔbɛyɛ saa ade no, efisɛ Yakob babea no sɔ n'ani, na ɔwɔ anuonyam sen n'agya fifo nyinaa. 20Na Hamor ne ne ba Sekem kɔɔ wɔn kurow abobow ano, na wɔne wɔn kurom mmarima kɔkasae sɛ: 21Nnipa yi, wɔne yɛn te asomdwoe mu, enti momma wɔntena asase yi so, na wɔnyɛ so adwuma. Na asase yi, hwɛ, ɛda wɔn anim haharaa. Momma yɛmfa wɔn mmabea nware, na yɛmfa yɛn mmabea nso mma wɔn. 22Na eyi nko mu na nnipa no bɛpene sɛ wɔne yɛn bɛtena, na yɛayɛ ɔman koro: sɛ yɛn mu mmarima nyinaa betwa twetia, sɛnea wɔatwa no. 23So wɔn mmoa ne wɔn ahonyade ne wɔn afieboa nyinaa renyɛ yɛn dea anaa? Momma yɛmpene wɔn ara, na wɔne yɛn ntena. 24Na wɔn a wɔnam Hamor kurow pon ano fi adi nyinaa tiee no, ne ne ba Sekem, na mmarima nyinaa, wɔn a wɔnam ne kurow pon ano fi adi nyinaa twitwaa twetia.
25 Na da a ɛto so abiɛsa a ne yaw kaa wɔn no, Yakob mmammarima baanu, Simeon ne Lewi a wɔyɛ Dina nuanom, fofaa wɔn nkrante kɔɔ kurow no so mpofirim kokum mmarima nyinaa. 26Na wɔde nkrante kum Hamor ne ne ba Sekem; na wɔde Dina fii Sekem fi hɔ bae.
27Yakob mmammarima no baa atɔfo no so bɛfow kurow no mu nneɛma, efisɛ wɔagu wɔn nua ho fi. 28Wɔn nguan, anantwi ne wɔn mfurum ne nea ɛwɔ kurow no mu ne nea ɛwɔ mfuw mu no, wɔfae, 29ne wɔn ahode nyinaa, wɔn mma nyinaa ne wɔn yerenom, wɔfaa wɔn nnommum, fow nea ɛwɔ fie nyinaa.
30 Na Yakob ka kyerɛɛ, Simeon ne Lewi sɛ: Moahaw me ama me ho abɔn wɔn a wɔte asase yi so, Kanaanfo ne Perisifo. Na me de, meyɛ asafo a misua yi, wɔbɛboaboa wɔn ho ano aba me so abekum me, na wɔasɛe me ne me fi. 31Na wose: So ɔnyɛ yɛn nuabea sɛ oguamanfo anaa?",https://www.bible.com/bible/3439/GEN.34.ATWDB
GYENESIS 35,"Onyankopɔn hyira Yakob wɔ Betel
1 Na Onyankopɔn ka kyerɛɛ, Yakob sɛ: Sɔre kɔ Betel kɔtena hɔ, na si afɔremuka wɔ hɔ ma Onyankopɔn a oyii ne ho kyerɛɛ wo ɛda a woreguan afi wo nua Esau anim no.
2 Ɛnna Yakob ka kyerɛɛ ne fifo ne wɔn a wɔka ne ho nyinaa sɛ: Montotow anyame ananafo a ɛwɔ mo mu ngu, na munnwira mo ho, na monsakra mo ntade. 3 Na momma yɛnsɔre nkɔ Betel, na minkosi afɔremuka wɔ hɔ memma Onyankopɔn a m'ahohia da otiee me, na odii m'akyi wɔ ɔkwan a mekɔe no mu no. 4 Ɛnna wɔde wɔn anyame ananafo a ɛwɔ wɔn nsam nyinaa ne wɔn aso mu nkaa maa Yakob, na Yakob de koraa dupɔn bi a ɛwɔ Sekem ho no ase. 5Na wosiim sɛ wɔrekɔ no; Onyankopɔn ho hu baa nkurow a atwa wɔn ho ahyia no so, na wɔantiw Yakob mma no.
6Na Yakob ne nkurɔfo a wɔka ne ho nyinaa duu Lus a ɛwɔ Kanaan asase so a ɛne Betel. 7 Na osii hɔ afɔremuka, na ɔfrɛɛ hɔ: El-betel, ase ne: Betel Nyankopɔn, efisɛ da a ɔreguan afi ne nua anim no, ɛhɔ na Onyankopɔn yii ne ho kyerɛɛ no.
8 Na Rebeka gyigyefo Debora wui, na wosiee no Betel anafo fam wɔ odum bi ase, na ɔtoo no din Alonbakut.
9Na Onyankopɔn yii ne ho kyerɛɛ Yakob bio, ne ba a ofii Mesopotamia bae no mu, na ohyiraa no. 10 Na Onyankopɔn ka kyerɛɛ no sɛ: Wo din de Yakob, nanso wɔremfrɛ wo Yakob bio, na mmom Israel ne wo din; na ɔtoo ne din Israel. 11 Na Onyankopɔn ka kyerɛɛ no sɛ: Mene Onyankopɔn Tweaduampɔn: dɔ na yɛ bebree; ɔman ne aman asafo befi wo mu aba, na ahene fi w'asen mu bɛba. 12Na asase a mede mama Abraham ne Isak no, wo na mede mɛma wo; na w'asefo a wobedi w'akyi no na mede asase no mɛma wɔn. 13 Na Onyankopɔn fii ne nkyɛn wɔ nea ɔne no kasae hɔ kɔɔ ɔsoro. 14 Na Yakob de odum sii nea ɔne no kasae hɔ, ɔbodum, na ohwiei ɔnom afɔre guu so, na ɔde ngo guu so. 15Na Yakob frɛɛ nea ɔne Nyankopɔn kasae hɔ Betel.
16Na wotutu fii Betel kɔe. Na aka ɔkwan tiaa bi na wɔadu Efrat no, awo kaa Rahel, na awo no den no. 17Na n'awo no mu yɛɛ den no, awogyefo no ka kyerɛɛ no sɛ: Nsuro, na eyi nso wobɛwo babarima. 18Na ne kra refi ne mu na ɔreyɛ awu no, ɔtoo no din Benoni, ase ne: M'amanehunu ba, na n'agya de, ɔfrɛɛ no Benyamin ase ne: Ahotɔ ba. 19 Na Rahel wui, na wosiee no Efrat a ɛne Betlehem no kwan nkyɛn 20Na Yakob sii ne da so dum, ɛne Rahel da so dum de besi nnɛ. 21 Na Israel tutu kosii ne ntamadan wɔ Eder abantenten akyi no ho.
22 Na Israel te asase no so no, Ruben ne n'agya abaawayere Bilha kɔdae, na Israel tee.
Yakob mma
(1 Berɛsosɛm 2.1-2)
23Nso Yakob mmammarima si dumien; Lea mma ne Ruben Yakob abakan ne Simeon, Lewi, Yuda, Isakar ne Sebulon. 24Rahel mma ne Yosef ne Benyamin. 25Na Rahel abaawa Bilha mma ne Dan ne Naftali. 26Na Lea abaawa Silpa mma ne Gad ne Aser. Eyinom ne Yakob mmammarima a wɔwoo wɔn maa no wɔ Mesopotamia.
Isak wu
27Na Yakob baa n'agya Isak nkyɛn wɔ Mamre, wɔ Kiriat-arba a ɛne Hebron, nea Abraham ne Isak tenae sɛ ahɔho no.
28Na Isak nna nyinaa si mfirihyia ɔha aduɔwɔtwe. 29 Na Isak gyaa mu, na owui, na otiw ne nananom kɔɔ asamando, na wabɔ akora, na nna amee no. Na ne mma Esau ne Yakob siee no.",https://www.bible.com/bible/3439/GEN.35.ATWDB
GYENESIS 36,"Esau asefo
(1 Berɛsosɛm 1.34-37)
1 Na eyinom ne Esau a wɔfrɛ no Edom no awo ntoatoaso: 2 Esau waree Kanaanfo mmea: Hetini Elon babea Ada ne Hewini Sibeon ba Ana babea Ohlibama, 3 ne Ismael babea Basmat, Nebaiot ne nuabea. 4Na Ada woo Elifas maa Esau, na Basmat woo Reuel. 5Na Oholibama woo Yeus ne Yalam ne Kora. Eyinom ne Esau mma a wɔwoo wɔn maa no wɔ Kanaan asase so.
6Na Esau faa ne yerenom ne ne mmammarima ne ne mmabea ne ne fifo nyinaa ne ne mmoa ne n'anantwi nyinaa ne n'ahonyade a onyae wɔ Kanaan asase so nyinaa, na ofii ne nua Yakob ho kɔɔ asase bi so. 7Efisɛ wɔn ahonyade dɔɔso sen nea wɔde tena faako, na asase a wɔyɛ so ahɔho no, wɔn mmoa dodow nti na wɔnsen so. 8Na Esau a ɔno ara ne Edom no kɔtenaa Seir bepɔw so.
9Na eyinom ne Edomfo agya Esau, a ɔte Seir bepɔw so no awo ntoatoaso: 10Esau mmammarima din ni: Esau yere Ada ba Elifas, Esau yere Basmat ba Reuel. 11Na Elifas mma ne Taman, Omar, Sefo, Gatam ne Kenas. 12Na Timna yɛ Esau ba Elifas yefam, no ɔwoo Amalek maa Elifas; eyinom ne Esau yere Ada mma. 13Na eyinom ne Reuel mma: Nahat ne Sera, Sama ne Misa; eyinom ne Esau yere Basmat mma. 14Na eyinom ne Esau yere Oholibama, Sibeon ba Ana babea no, mma: ɔwoo Yeus ne Yalam ne Kora maa Esau.
15Eyinom ne Esau mma mu atitiriw: Esau abakan Elifas mma: Atitiriw Teman, Omar, Sefo, Kenas, 16Kora, Gatam ne Amalek. Eyinom ne Elifas atitiriw wɔ Edom asase so; eyinom ne Ada mma. 17Na eyinom ne Esau ba Reuel mma: Atitiriw Nahat, Sera, Sama, ne Misa. Eyinom ne Reuel atitiriw wɔ Edom asase so; eyinom ne Esau yere Basmat mma. 18Na eyinom ne Esau yere Oholibama mma: Atitiriw Yeus, Yalam ne Kora. Eyinom ne Esau yere Oholibama, Ana ba, atitiriw no. 19Eyinom ne Esau mma, na eyinom ne wɔn atitiriw no; ɔne Edom.
Seir Asefo
(1 Berɛsosɛm 1.38-42)
20 Eyinom ne Horini Seir mma asase no sofo: Lotan, Sobal, Sibeon, Ana, 21Dison, Eser ne Disan. Eyinom ne Horifo a wɔyɛ Seir mma a wɔte Edom asase so no atitiriw. 22Na Lotan mma ne Hori ne Heman, na Lotan ne nuabea ne Timna. 23Na eyinom ne Sobal mma: Alwan, Manahat, Ebal, Sefo ne Onam.
24Na eyinom ne Sibeon mma: Aya ne Ana. Oyi ne Ana a na ɔhwɛ n'agya Sibeon mfurum no, a ohuu nsuɔhyew aniwa wɔ sare so no. 25Na eyinom ne Ana mma: Dison ne Oholibama, Ana babea. 26Na eyinom ne Dison mma: Hemdan Esban, Itran ne Keran. 27Eyinom ne Eser mma: Bilhan, Saawan ne Akan. 28Eyinom ne Disan mma: Us ne Aran. 29Eyinom ne Horifo atitiriw: Atitiriw Lotan, Sobal, Sibeon, Ana, 30Dison, Eser, ne Disan. Eyinom ne Horifo atitiriw a wɔyɛɛ wɔn atitiriw wɔ Seir asase so.
Edom Ahene
(1 Berɛsosɛm 1.43-54)
31Eyinom ne ahene a wodii Edom asase so ansa na obi dii Israel mma so hene. 32Na Bela, Beor ba, dii Edom hene, na ne kurow din de Dinhaba. 33Na Bela wui, na Sera ba Yobab a ofi Bosra bedii n'ade. 34Na Yobab wui, na Husam a ofi Teman asase so bedii n'ade. 35Na Husam wui, na Bedad ba Hadad a okum Midian wɔ Moab petee mu no bedii n'ade, na ne kurow din de Awit. 36Na Hadad wui, na Samla a ofi Masreka bedii n'ade. 37Na Samla wui, na Saul a ofi Rehobot a ɛda asu no ho no bedii n'ade. 38Na Saul wui, na Akbor ba Baal-hanan bedii n'ade. 39Na Akbor ba Baal-hanan wui, na Hadar bedii n'ade. Na ne kurow din de Pau, na ne yere din de Mehetabel, Mesahab babea Matred babea.
40Na eyinom ne Esau atitiriw no din, sɛnea wɔn mmusuakuw, wɔn tenabea ne wɔn din te: Atitiriw Timna, Ahoa, Yetet, 41Oholibama, Ela, Pinon, 42Kenas, Teman, Mibsar, 43Magdiel, ne Iram. Eyinom ne Edom a ɔne Esau, Edomfo agya no atitiriw, sɛnea wɔn tenabea te wɔ asase a wonyae no so.",https://www.bible.com/bible/3439/GEN.36.ATWDB
