Title,Content,URL
GYENESIS 19,"Sodom ne Gomora sɛe
1 Na abɔfo baanu no duu Sodom anwummere; na Lot te Sodom kurow pon ano. Na Lot huu wɔn no, ɔsɔre kohyiaa wɔn, na ɔbɔɔ ne mu ase kae sɛ: 2Me wuranom, mesrɛ mo, momman mmra mo akoa fi mmɛsoɛ anadwo yi, na monhohoro mo anan ase, na anɔpatutu moasɔre akɔ mo kwan. Na wose: Dabi, na yɛbɛda abɔnten so. 3Na ɔsrɛɛ wɔn dennennen. Na wɔman ne nkyɛn baa ne fi, na ɔtow wɔn pon, na ɔtoo apiti ma wodii.
4Na wonnya nkɔdae no, kurom hɔfo, Sodomfo, betwaa ɔdan no ho hyiae, efi mmofra so kosi mpanyimfo so, ɔman mu no nyinaa. 5 Na wɔfrɛɛ Lot ka kyerɛɛ no sɛ; Mmarima a wɔbaa wo nkyɛn anadwo yi no wɔ he? Yi wɔn brɛ yɛn, na yene wɔn nna. 6Na Lot fi kɔɔ wɔn nkyɛn ɔpon ano, na ɔtoo ɔpon no mu wɔ n'akyi. 7Na ɔkae sɛ: Anuanom, mesrɛ mo, monnyɛ bɔne sa! 8Hwɛ, mewɔ mmabea baanu a wonhuu ɔbarima ɛ, momma memfa wɔn mimfi memmrɛ mo, na monyɛ wɔn sɛnea eye mo ani so, na mmarima yi nko de, monnyɛ wɔn hwee, na ɛno nti na wɔbaa me suhyɛ nwini ase yi. 9 Na wɔkae sɛ: Twe wo ho fi hɔ! Na wose: Saa onipa yi bae bɛyɛɛ ɔhɔho, ɛnna afei ɔpɛ sɛ ɔyɛ ɔtemmufo yi! Afei yɛbɛyɛ wo bɔne akyɛn wɔn. Na wɔhyɛɛ Lot so dennen twiw bae sɛ wobebubu pon no. 10Na mmarima no teɛɛ wɔn nsa twee Lot baa wɔn nkyɛn wɔ ɔdan no mu, ma wɔtoo pon no mu. 11 Na nnipa a wogyina ɔpon ano no de, wofurafuraa wɔn ani fi nketewa so kosi akɛse so, na wɔhwehwɛɛ ɔpon ano kwan brɛe.
12Na mmarima no ka kyerɛɛ Lot sɛ: Wowɔ obi wɔ ha ka wo ho? Asew anaa mmammarima anaa mmabea anaa biribiara a wowɔ wɔ kurow yi mu, yi wɔn fi ha, 13 na yɛrebɛsɛe ha, efisɛ wɔn nnebɔne adu AWURADE anim, na AWURADE asoma yɛn sɛ yɛmmɛsɛe ha. 14 Na Lot fii adi ne ne nsenom a wɔrebɛware ne mmabea no kɔ kasae sɛ: Monsɔre mfi ha, na AWURADE rebɛsɛe kurow yi. Nanso ɔyɛɛ ne nsenom no ani so sɛ obi a ɔredi fɛw.
15Na ade reyɛ akye no, abɔfo no piapiaa Lot sɛ: Sɔre, fa wo yere ne wo mmabea baanu a wɔwɔ ha no kɔ, anyɛ saa a, wɔbɛsɛe wo, ɔman yi amumɔyɛ mu. 16 Na ɔtwentwɛn ne nan ase no, mmarima no susoo ɔno ne ne yere ne ne mmabea baanu no nsa, na AWURADE huu no mmɔbɔ na wɔde no fii adi gyaw no kurow no akyi. 17 Na wɔde wɔn fii adi no, ɔkae sɛ: Guan gye wo kra nkwa, nhwɛ w'akyi, nso nnyina dantaban yi mu baabiara; bepɔw so na guan kɔ, anyɛ saa a, wɔbɛsɛe wo.
18Na Lot ka kyerɛɛ wɔn sɛ: O, owura, mma ɛnnyɛ sa. 19Hwɛ, w'akoa anya w'anim dom, na woama w'adɔe a woayɛ me yi aso sɛ woregye me nkwa, nanso merentumi nguan nkɔ bepɔw so, na mmusu no ammɛto me, na manwu. 20Hwɛ, kurow yi na ɛbɛn sɛ woguan kɔ hɔ, nanso ɛhɔ sua; ma minguan menkɔ hɔ ɛ, so ensua anaa? Na me kra anya nkwa. 21Na ɔka kyerɛɛ no sɛ: Hwɛ, matie wo wɔ saa asɛm yi ho nso, na meremmutuw kurow a woka ho asɛm yi. 22Yɛ ntɛm guan kɔ hɔ, efisɛ merentumi menyɛ hwee gye sɛ woakodu hɔ ansa. Enti na wɔfrɛ kurow no din sɛ: Soar, ase ne: Ade ketewaa. 23Na Lot duu Soar no, na owia apue asase so.
24 Na AWURADE tɔɔ sufre ne gya fi ɔsoro guu Sodom ne Gomora so. 25Na obutuw nkurow no ne dantaban no nyinaa ne wɔn a wɔtete nkurow no mu nyinaa ne nea afifi asase no so.
26 Na ne yere no de, ɔhwɛɛ n'akyi, na ɔdan nkyene siw.
27Na Abraham tuaa ahema kɔɔ nea ogyinaa AWURADE anim hɔ no. 28Na ɔdan n'ani kyerɛɛ Sodom ne Gomora ne dantaban no asase nyinaa, na ɔhwɛe, na hwɛ, asase no so wusiw foroe sɛ, fononoo mu wusiw. 29Na Onyankopɔn sɛee dantaban no nkurow no no, Onyankopɔn kaee Abraham, na ogyee Lot fii butuw a obutuw nkurow a Lot te mu no mu.
Moab ne Amonfo mfiase
30Na Lot fii Soar kɔtenaa bepɔw no so, ɔne ne mmabea baanu no, efisɛ osuroo Soar tena, na ɔne ne mmabea baanu no kɔtenaa ɔbodan bi mu.
31Na abakan no ka kyerɛɛ akumaa no sɛ: Yɛn agya anyin, na ɔbarima biara nni asase yi so a ɔbɛba yɛn ho, sɛnea asase sofo nyinaa amanne te. 32 Bra, na yɛmma yɛn agya nsa nnom, na yɛne no nkɔda, na yɛanya yɛn agya ho mma. 33Na wɔmaa wɔn agya nsa nomee anadwo no, na abakan no kɔɔ mu ne n'agya kɔdae; na wanhu ne nna ne ne sɔre mu. 34Na ade kyee no, abakan no ka kyerɛɛ akumaa no sɛ: Hwɛ, me ne m'agya akɔda anadwo yi, ma yɛmma no nsa nnom nnɛ anadwo yi nso, na kɔ mu, na wo ne no nkɔda, na yɛanya yɛn agya ho mma. 35Na wɔmaa wɔn agya nsa nomee anadwo no nso bio, na akumaa no sɔre ne no kɔdae; na wanhu ne nna ne ne sɔre mu. 36Na Lot mmabea baanu no nyinsɛn wɔn agya ho. 37 Na abakan no woo babarima, na ɔtoo no din Moab; ɔne Moabfo agya de besi nnɛ. 38 Na akumaa no nso woo babarima, na ɔtoo no din Benami; ɔne Amonfo agya de besi nnɛ.",https://www.bible.com/bible/3439/GEN.19.ATWDB
GYENESIS 20,"Abraham ne Abimelek
1 Na Abraham tutu fii hɔ kɔɔ nɛgeb, na ɔkɔtenaa Kades ne Sur ntam, na ɔkɔyɛɛ ɔhɔho wɔ Gerar.
2 Na Abraham kae ne yere Sara ho sɛ ɔyɛ me nuabea. Na Gerar hene Abimelek soma ma wɔbɛfaa Sara.
3Na Onyankopɔn baa Abimelek nkyɛn anadwo dae mu, na ɔka kyerɛɛ no sɛ: Hwɛ, ɔbea a woakɔfa no no nti woawu awie, efisɛ ɔyɛ ɔbarima bi yere. 4Nso Abimelek nnya mfaa ne ho nkaa no ɛ. Na ɔkae sɛ: AWURADE, so wubekum ɔman trenee nso? 5So ɛnyɛ ɔno na ɔka kyerɛɛ me sɛ: Me nua ne no? Na ɔbea no nso kae sɛ: Me nua ne no. Me komam fann ne me tirim fitaa na mede meyɛɛ eyi. 6Na Onyankopɔn ka kyerɛɛ no ɔdae mu sɛ: Me nso minim sɛ, wo komam fann na wode yɛɛ eyi, na me nso misoo wo mu, na woanyɛ me bɔne, ɛno nti na mamma woamfa wo ho anka no. 7 Na afei dan ɔbarima no yere kɔma no, efisɛ ɔyɛ odiyifo, na wapa kyɛw ama wo, na woanya nkwa; na sɛ woannan no ankɔma no a, ɛnne, hu sɛ owu na wubewu, wo ne nea wowɔ nyinaa. 8Na Abimelek sɔree anɔpatutu frɛɛ ne nkoa nyinaa, na ɔkaa nsɛm yi nyinaa kyerɛɛ wɔn, na nnipa no suroe pii.
9Na Abimelek frɛɛ Abraham ka kyerɛɛ no sɛ: Dɛn na woayɛ yɛn yi, na bɔne bɛn na mayɛ wo, na wode bɔne kɛse yi aba me ne m'ahenni so? Ade a wɔnyɛ na woayɛ me yi. 10Na Abimelek ka kyerɛɛ Abraham sɛ: Dɛn na wuhui na wudii saa asɛm yi? 11Na Abraham kae sɛ: Efisɛ misusuwii sɛ, ampa Onyankopɔn ho suro nni ha yi, na me yere nti wobekum me. 12Nanso ɛwom ampa sɛ ɔyɛ me nua; m'agya ba ne no, na ɛnyɛ me na ba a; na wayɛ me yere. 13Na Onyankopɔn ma mifii m'agya fi mibekyinii no, misee no sɛ: W'adɔe a wobɛyɛ me ne sɛ, baabiara a yebedu no, ka me ho sɛ ɔyɛ me nua.
14Ɛnna Abimelek faa nguan ne anantwi, ne nkoa ne mfenaa de maa Abraham, na ɔdan ne yere Sara maa no. 15Na Abimelek kae sɛ: Hwɛ, m'asase na ɛda w'anim yi, baabiara a eye wɔ w'ani so no, tena. 16Na Sara de, ɔka kyerɛɛ no sɛ: Hwɛ, mama wo nua nnwetɛbona apem, hwɛ, ɛno na wɔn a wɔka wo ho nyinaa de behu wo tirim, na wo ho afi nnipa nyinaa anim.
17Na Abraham bɔɔ Onyankopɔn mpae, na Onyankopɔn saa Abimelek ne ne yere ne ne mfenaa yare ma wɔwowoe. 18Esiane Abraham yere Sara ho asɛm no nti, na AWURADE ato Abimelek fifo mmea nyinaa yafunu mu.",https://www.bible.com/bible/3439/GEN.20.ATWDB
GYENESIS 21,"Isak awo
1 Na AWURADE bɛhwɛɛ Sara sɛnea ɔkae no, na Awurade yɛɛ Sara sɛnea ɔhyɛɛ no bɔ no. 2 Na Sara nyinsɛnee, na ɔwoo babarima maa Abraham ne nkwakorabere mu, bere a Onyankopɔn kaa no ho asɛm no mu. 3 Na Abraham too ɔba a Sara wo maa no no din Isak.
4 Na Abraham ba Isak dii nnawɔtwe no, otwaa no twetia, sɛnea Onyankopɔn hyɛɛ no no. 5 Na Abraham adi mfirihyia ɔha na wɔwoo ne ba Isak maa no.
6 Na Sara kae sɛ: Onyankopɔn ama me ɔserew, obiara a ɔbɛte no bɛserew ama me. 7Na ose: Hena na anka ɔbɛka akyerɛ Abraham sɛ: Sara bɛma mma nufu? Nanso hwɛ, mawo ba ama no, ne nkwakorabere mu. 8Na abofra no nyinii, na wotwaa no nufu. Na da a wotwaa Isak nufu no, Abraham tow pon kɛse.
Wɔpam Hagar ne Ismael
9Na Sara huu Misraimni Hagar ba a ɔwo maa Abraham no sɛ ɔredi fɛw. 10 Na ɔka kyerɛɛ Abraham sɛ: Pam afenaa yi ne ne ba no, na ɛnyɛ afenaa yi ba ne me ba Isak na ebedi ade. 11Na ne ba no nti asɛm no yɛɛ: Abraham yaw yiye. 12 Na Onyankopɔn ka kyerɛɛ Abraham sɛ: Mma abofra no ne w'afenaa asɛm no nnyɛ wo yaw, na nea Sara ka kyerɛ wo nyinaa, tie, na Isak mu na wɔbɛfrɛ w'asefo. 13 Na afenaa ba no nso, mɛyɛ no ɔman kɛse, efisɛ ɔyɛ w'aseni. 14Na Abraham sɔree anɔpatutu faa aduan ne nsu kotoku, na ɔde maa Hagar, ɔde sii ne kɔn ho, na ogyaa ɔne abofra no kwan. Na ɔkɔe, kokyinkyinii Beer-seba sare so.
15Na nsu no sae wɔ kotoku no mu no, ogyaw abofra no wɔ ɔdɔtɔ bi ase, 16na ɔkɔ kɔtenaa akyiri bɛyɛ sɛnea wɔtow bɛmma a ɛbɛtɔ, na ose: Mma minnhu abofra yi wu! Na ɔtenaa ne ntentenso, na ɔmaa ne nne so sui.
17Na Onyankopɔn tee abarimaa no nne, na Onyankopɔn bɔfo fi soro frɛɛ Hagar ka kyerɛɛ no sɛ: Hagar, dɛn na ɛyɛ wo? Nsuro, na Onyankopɔn ate abarimaa no nne wɔ nea ɔwɔ hɔ. 18Sɔre, ma abarimaa no so, na fa wo nsa so no mu; na mɛyɛ no ɔman kɛse. 19Na Onyankopɔn buee n'ani, na ohuu asubura bi, na ɔkɔe kɔsaw bi hyɛɛ nsu kotoku no ma, na ɔde bi maa abarimaa no nomee. 20Na Onyankopɔn dii abarimaa no akyi, na onyinii, na ɔtenaa sare so hɔ yɛɛ ɔbɛmmatofo. 21 Na ɔtenaa Paran sare so; na ne na kɔwaree yere fi Misraim asase so brɛɛ no.
Abimelek ne Abraham apam
22 Na bere no mu no, Abimelek ne ne safohene: Pikol bɛka kyerɛɛ Abraham sɛ: Onyankopɔn di w'akyi wɔ biribiara a woyɛ mu. 23 Enti afei ka Onyankopɔn ntam kyerɛ me sɛ, worentwa me ne me mma ne me mmanana nkontompo, na, sɛ adɔe a meyɛɛ wo no te no, wode bɛyɛ me ne m'asase a woabɛyɛ ɔhɔho wɔ so yi. 24Na Abraham kae sɛ: Mɛka ntam no. 25 Na asubura bi a Abimelek nkoa nam anuɔden so gyei no nti Abraham kaa Abimelek anim. 26Na Abimelek kae sɛ: Minnim nea odii saa asɛm yi, na wo nso, woanka ankyerɛ me, nanso mentee da, sɛ nnɛ. 27Na Abraham de nguan ne anantwi maa Abimelek, na wɔn baanu pamee. 28Na Abraham yii nguanten mma abere ason gyinaa ɔfa. 29Na Abimelek ka kyerɛɛ Abraham sɛ: Nguanten mma abere ason a wuyii wɔn gyinaa ɔfa yi ase ne dɛn? 30Na ɔkae sɛ: Nguanten mma abere ason yi, gye wɔ me nsa mu, na ɛnyɛ me adanse, sɛ me na mituu abura yi. 31 Enti ɔfrɛɛ hɔ Beer-seba a ase ne: Ntanka abura, efisɛ ɛhɔ na wɔn baanu nyinaa kekaa ntam. 32Na wɔpamee wɔ Beer-seba, na Abimelek ne ne safohene titiriw Pikol sɔree, na wɔsan kɔɔ Filistifo asase so. 33 Na Abraham tɛw asantɛw dua wɔ Beer-seba, na ɔsɔree AWURADE a ɔyɛ daa Nyankopɔn din wɔ hɔ. 34Na Abraham yɛɛ ɔhɔho Filistifo asase so nna pii.",https://www.bible.com/bible/3439/GEN.21.ATWDB
GYENESIS 22,"Wɔsɔ Abraham hwɛ
1 Na nsɛm yi akyi no, Onyankopɔn sɔɔ Abraham hwɛe, na ɔka kyerɛɛ no sɛ: Abraham! Na ose: Mini. 2 Na ɔkae sɛ: Fa wo ba, wo ba koro a wodɔ no, Isak, kɔ Moria asase so, na fa no kɔbɔ ɔhyew afɔre wɔ hɔ, wɔ mmepɔw no mu biako a mɛkyerɛ wo so. 3Na Abraham sɔree anɔpatutu, na ɔhyehyɛɛ n'afurum, na ɔfaa ne mmofra mu baanu ne ne ba Isak kaa ne ho, na otwaa ɔhyew afɔre nnyina, na osiim kɔɔ nea Onyankopɔn kyerɛɛ no no. 4Na da a ɛto so abiɛsa no, Abraham maa n'ani so, na ohuu beae hɔ wɔ akyirikyiri. 5Na Abraham ka kyerɛɛ ne mmofra no sɛ: Mo ne afurum yi ntena ha, na me ne abarimaa yi bɛkɔ noho akɔsɔre, na yɛasan aba mo nkyɛn. 6Na Abraham faa ɔhyew afɔre nnyina no de soaa ne ba Isak, na ɔfaa ogya ne sekan kurae, na wɔn baanu kɔe. 7Na Isak ka kyerɛɛ n'agya Abraham sɛ: M'agya! Na ose: Mini, me ba. Na ose: Hwɛ, ogya ne nnyina ni, na oguammaa a wɔde rekɔbɔ ɔhyew afɔre no wɔ he? 8Na Abraham se: Me ba, Onyankopɔn ankasa bɛkyerɛ ɔhyew afɔre aguammaa no. Na wɔn baanu kɔe. 9Na wokoduu nea Onyankopɔn kyerɛɛ no hɔ, na Abraham sii afɔremuka wɔ hɔ, na osiesiee nnyina no, na ɔkyekyeree ne ba Isak, na ɔde no too afɔremuka no so wɔ nnyina no so. 10Na Abraham teɛɛ ne nsa faa ɔsekan no sɛ ɔde rebekum ne ba no.
11Na AWURADE bɔfo fi soro frɛɛ Abraham bio sɛ: Abraham, Abraham! Na ose: Mini. 12 Na ose: Mfa wo nsa nka abarimaa no, nso nyɛ no hwee, na afei mahu sɛ wusuro Onyankopɔn, na woankame me wo ba koro no.
13Na Abraham maa n'ani so, na ohui, na hwɛ, odwennini a ɔdɔtɔ aso ne mmɛn mu wɔ n'akyi; na Abraham kɔfaa odwennini no de no sii ne ba no ananmu bɔɔ ɔhyew afɔre.
14Na Abraham too beae hɔ din sɛ Yahwe-Yire. Enti wɔka nnɛ ara sɛ AWURADE bepɔw so na wɔbehwɛ.
15Na AWURADE bɔfo fi soro frɛɛ: Abraham bio sɛ, 16 Sɛ AWURADE se ni: Esiane sɛ woadi saa asɛm yi, na woankame me wo ba koro no nti, maka me ho ntam sɛ: 17 Nhyira na mehyira wo, na ɔdɔ na mɛma w'asefo adɔ sɛ ɔsoro nsoromma ne mpoano nwea, na w'asefo bɛfa wɔn atamfo nkurow ano apon adi so; 18 na w'asefo mu na wobehyira asase so amanaman nyinaa, efisɛ woatie me nne. 19Ɛnna Abraham san baa ne mmerante no nkyɛn, na wɔsɔre siim baa Beer-seba. Na Abraham tenaa Beer-seba.
20 Na nsɛm yi akyi no, wɔka kyerɛɛ Abraham sɛ: Hwɛ, Milka nso awo mma ama wo nua Nahor: 21n'abakan Us, ne ne nua Bus, ne Kemuel a ɔyɛ Aram agya, 22ne Kesed ne Haso ne Pildas ne Yidlaf ne Betuel. 23 Na Betuel woo Rebeka. Nnipa baawɔtwe yi na Milka wo maa Abraham ne nua Nahor. 24Na ne yere biako bi a wɔfrɛ no Rehuma nso woo Teba ne Gaham ne Tahas ne Maaka.",https://www.bible.com/bible/3439/GEN.22.ATWDB
GYENESIS 23,"Sara wu ne ne sie
1Na Sara dii mfirihyia ɔha aduonu asɔn; Sara nkwa nna mu mfe ni. 2Na Sara wui wɔ Kiriat-arba, ɛne Hebron a ɛwɔ Kanaan asase so no. Na Abraham bae begyam Sara, na osuu no. 3Na Abraham sɔre fii n'amu no anim, na ɔne Het mma kɔkasae sɛ: 4 Meyɛ mo nkyɛn hɔho ne mamfrani. Momma me amusie wɔ mo nkyɛn ha, na minsie m'amu a ɔda m'anim yi na emfi m'ani so.
5Na Het mma no buaa Abraham see no sɛ: 6Owura, tie yɛn! Woyɛ okunini bi wɔ yɛn mu. Yɛn amusie no mu nea wopɛ biara no, sie w'amu no wɔ hɔ. Yɛn mu biara renkame wo ne da, sɛ nsie w'amu wɔ mu. 7Na Abraham sɔre gyinae, na ɔbɔɔ ne mu ase maa asase no so nkurɔfo, Het mma no, 8na ɔne wɔn kasae sɛ: Sɛ ɛyɛ mo pɛ sɛ misie m'amu yi ma no fi m'ani so a, muntie me, na monsrɛ Sohar ba Efron, mma me, 9na ɔmfa Makpela ɔbodan a ɛyɛ ne de, na ɛwɔ n'afuw ano no mma me; na onnye me n'aboten na ɔmfa mma me, na minnya asiei wɔ mo ha. 10Na Efron te Het mma no mu. Na Hetini Efron buaa Abraham maa Het mma tee wɔ wɔn a wɔhyɛn ne kurow pon mu no nyinaa anim sɛ: 11Dabi, me wura, tie me: Mede afuw no mema wo, na ɔbodan a ɛwɔ mu no nso mede mema wo. Me man mma anim na mede mema wo yi, sie w'amu. 12Na Abraham bɔɔ ne mu ase wɔ asase no so nkurɔfo no anim, 13na ɔkasa kyerɛɛ Efron maa asase no so nkurɔfo no tee sɛ: Sɛ wutie me a, mede afuw no ti dwetɛ mɛma wo; gye wɔ me nsam, na minsie m'amu wɔ hɔ. 14Na Efron buaa Abraham see no sɛ: 15Me wura, tie, nnwetɛbona ahanan asase yɛ dɛn wɔ me ne wo ntam? W'amu ara na sie. 16Na Abraham tiee Efron, na Abraham karii dwetɛ a Efron bɔɔ din maa Het mma tee no maa no, nnwetɛbona ahanan a aguadifo di no. 17Na wɔde Efron afuw a ɛwɔ Makpela a ɛda Mamre ntentenso no, afuw ne ɔbodan a ɛwɔ mu ne afuw no so nnua nyinaa, nea ɛwɔ n'ahye nyinaa so, 18hyɛɛ Abraham nsa wɔ Het mma anim, wɔn a wɔhyɛn ne kurow pon mu no nyinaa anim.
19Na ɛno akyi no, Abraham siee ne yere Sara wɔ Makpela afuw no mu, wɔ ɔbodan mu, wɔ Mamre ntentenso, ɛne Hebron a ɛwɔ Kanaan asase so. 20 Na Het mma de afuw no ne ɔbodan a ɛwɔ mu no hyɛɛ Abraham nsa sɛ amusie.",https://www.bible.com/bible/3439/GEN.23.ATWDB
GYENESIS 24,"Wɔhwehwɛ ɔyere ma Isak
1 Na Abraham abɔ akwakoraa, na wadi nna pii, na AWURADE ahyira no ade nyinaa mu. 2 Na Abraham ka kyerɛɛ ne somfo ne fie panyin a ɔhwɛ nea ɔwɔ nyinaa so sɛ: Fa wo nsa ka m'asen mu, 3 na mɛma woaka AWURADE, ɔsoro ne asase Nyankopɔn, ntam sɛ: Worenware Kanaanfo a mete wɔn mu yi mmabea mu bi mma me ba. 4Na kɔ me kurow ne m'abusua mu kɔware yere ma me ba Isak. 5Na ɔsomfo no ka kyerɛɛ no sɛ: Ebia ɔbea no rempɛ sɛ obedi m'akyi aba asase yi so: ɛnne memfa wo ba no mensan menkɔ asase a wufi so bae no so anaa? 6Na Abraham ka kyerɛɛ no sɛ: Hwɛ yiye, na woamfa me ba ansan ankɔ hɔ bio. 7 AWURADE, ɔsoro Nyankopɔn a ɔfaa me fii m'agya fi ne asase a wɔwoo me wɔ so no so, na ɔne me kasae, na ɔkaa ntam kyerɛɛ me sɛ: W'asefo na mede asase yi mɛma wɔn no, ɔbɛsoma ne bɔfo adi w'anim, na woakɔware yere afi hɔ abrɛ me ba. 8Na sɛ ɔbea no mpɛ sɛ odi w'akyi a, ɛnne wo ho afi me ntam yi mu, nanso mfa me ba nsan nkɔ hɔ bio. 9Na ɔsomfo no de ne nsa kaa ne wura Abraham asen mu, na ɔkaa no ntam wɔ asɛm no ho.
10 Na ɔsomfo no faa ne wura yoma mu du, na ɔkɔe, na okura ne wura nnepa ahorow nyinaa bi, na ɔsɔre siim kɔɔ Mesopotamia, Nahor kurow mu. 11Na ɔmaa ne yoma no butuw kurow no kurotia wɔ asubura bi ho anwummere a mmea bɛsaw nsu.
12Na ɔbɔɔ mpae sɛ: AWURADE, me wura Abraham Nyankopɔn, mesrɛ wo, ma ensi me yiye nnɛ, na yɛ me wura Abraham adɔe. 13Hwɛ, migyina asubura yi so ha yi, na kurom hɔfo mmabea rebefi abɛsaw nsu yi, 14ma ɛmmra sɛ ababaa a mese no sɛ: Soɛ wo kuruwa ma mennom nsu no bi, na ɔbɛka sɛ: Nom, na mɛma wo yoma no anom bi no, ma ɔno ara nyɛ nea woayi no ama w'akoa Isak, na ɛno mu na mehu sɛ woayɛ me wura adɔe.
15 Na onnya nwiee kasa no, hwɛ, Rebeka a wɔwoo no maa Betuel a ɔyɛ Abraham ne nua Nahor yere Milka ba bae, na ne kuruwa si ne mmati so. 16Na ababaa no ho yɛ fɛ sɛ, ɔyɛ ɔbaabun a ɔbarima bi nhuu no da, na ɔkɔɔ asubura no mu kɔhyɛɛ ne kuruwa ma, na ɔbae. 17Na ɔsomfo no tuu mmirika kohyiaa no sɛ: Mesrɛ wo, ma memmɔ wo kuruwa yi mu nsu kakra hwirow. 18Na ose: Me wura, nom bi! Na ɔyɛɛ ntɛm soɛɛ ne kuruwa no sii ne nsam ma ɔnomee. 19Na ɔma ɔnom wiei no, ɔkae sɛ: Mɛkɔ makɔsaw bi mabrɛ wo yoma no nso akosi sɛ wobewie nom. 20Na ɔyɛɛ ntɛm kohwiee ne kuruwa mu nsu no guu anomee hɔ, na otutuu mmirika kɔɔ abura no mu bio kɔsaw nsu, na ɔsaw maa ne yoma no nyinaa. 21Na ɔbarima no hwɛɛ no ara, na ɔyɛɛ komm sɛ obehu sɛ AWURADE ama ne kwankɔ no ayɛ dwoodwoo anaasɛ ɛnte sa. 22 Na yoma no wiee nsu no nom no, ɔbarima no yii sika hwene mu kaa a ano si dwetɛbona fa ne nsa so nkapo abien a ano si sikabona du de hyɛɛ no, 23na ɔkae sɛ: Hena ba ne wo? Mesrɛ wo, kyerɛ me! So yebenya dabere wɔ w'agya fi anaa? 24Na ɔka kyerɛɛ no sɛ: Betuel, Milka ba a ɔwoo no maa Nahor no ba ne me. 25Na ɔka kyerɛɛ no sɛ: Yɛwɔ sare ne mmoa aduan pii ne nea mobɛda.
26Na ɔbarima no bɔɔ ne mu ase sɔree AWURADE, 27na ɔkae sɛ: Nhyira nka AWURADE, me wura Abraham Nyankopɔn a wamma n'adɔe ne ne nokware ammɔ me wura. Na me nso, AWURADE akyerɛ me me wura ne nuanom fi kwan. 28Na ababaa no tuu mmirika kɔkaa saa nsɛm yi kyerɛɛ ne na fifo.
29Na Rebeka wɔ onuabarima bi a ne din de Laban. Na Laban de mmirika fii adi kɔɔ ɔbarima no nkyɛn wɔ asubura no ho. 30Na ohuu hwene mu kaa ne ne nua nsa so nkapo no, na ɔtee ne nua Rebeka nsɛm no sɛ: Sɛnea ɔbarima no kasa kyerɛɛ me ni, no, ɔbaa ɔbarima no nkyɛn, na hwɛ, ogyina yoma no nkyɛn, asubura no ho. 31Na ose: Wo a AWURADE ahyira wo, bra, ɛdɛn nti na wugyina kurotia? Na masiesie ɔdan mu ne baabi nso mama yoma no. 32Na ɔbarima no kɔɔ ofie, na oyii yoma no so nneɛma, na ɔmaa yoma no sare ne aduan, na ɔmaa ɔno ne nnipa a wɔka ne ho no nsu sɛ wɔnhohoro wɔn anan ase. 33Na wɔde aduan besii n'anim sɛ onni; na ose: Merennidi gye sɛ mabɔ m'amanneɛ ansa. Na ose: Bɔ na yentie ɛ!
34Na ose: Abraham somfo ne me. 35Na AWURADE ahyira me wura pii, na wayɛ ɔkɛse, na wama no nguan ne anantwi, ne dwetɛ ne sika, ne nkoa ne mfenaa, ne yoma ne mfurum. 36Na me wura yere Sara awo ɔba wɔ ne mmerewabere mu ama me wura, na ɔde nea ɔwɔ nyinaa ama no. 37Na me wura ama maka ntam se: Nware Kanaanfo a mete wɔn asase so yi mmabea mu bi mma me ba, 38na mmom kɔ m'agya fi ne m'abusua mu kɔware yere brɛ me ba. 39Na misee me wura sɛ: Na sɛ ɔbea no anni m'akyi ɛ? 40 Na ɔka kyerɛɛ me sɛ: AWURADE a menam n'anim no bɛsoma ne bɔfo aka wo ho, na wama wo kwan so ayɛ dwoodwoo, na woakɔware yere wɔ m'abusua mu ne m'agya fi abrɛ me ba. 41Ɛno ansa na sɛ wokɔ m'abusua mu a, wo ho befi me ntam no mu, na sɛ wɔamma wo bi a, ɛnne na wo ho afi me ntam no mu. 42Na mebaa asubura no ho nnɛ kae sɛ: AWURADE, me wura Abraham Nyankopɔn, sɛ wo ara worema me kwan a mitu yi ayɛ dwoodwoo a, 43hwɛ, migyina asubura yi ho, na ma ɛmmra mu sɛ ababaa a obefi abɛsaw nsu, na mese no sɛ: Mesrɛ wo, ma me wo kuruwa yi mu nsu kakra mennom, 44na ɔbɛka akyerɛ me sɛ: Nom, na menkɔsaw bi memmrɛ wo yoma no nso no, ma ɔno ara nyɛ ɔbea a AWURADE ayi no ama me wura ba. 45Na minnya minwiee me koma mu kasa no, hwɛ, Rebeka fii adi bae a kuruwa si ne mmati so, na ɔkɔɔ abura no mu kɔsaw nsu. Na misee no sɛ Mesrɛ wo, ma me bi mennom. 46Na ɔyɛɛ ntɛm soɛɛ ne kuruwa no kae sɛ: Nom, na mɛma wo yoma no nso bi anom. Na menomee, na ɔmaa yoma no nso bi nomee. 47 Na mibisaa no sɛ: Hena ba ne wo? Na ose: Betuel, Nahor ba a Milka wo maa no no ba ne me. Na mede hwene mu kaa no mesɛn ne hwenem, na mede nkapo no mehyehyɛɛ ne nsa, 48na mebɔɔ me mu ase mesɔree AWURADE, na mihyiraa AWURADE, me wura Abraham Nyankopɔn a ɔkyerɛɛ me nokware kwan sɛ menkɔware me wura ne nua ba memma ne ba no. 49Na afei sɛ mo ara moreyɛ me wura adɔe adi no nokware a, monka nkyerɛ me; na sɛ ɛnte saa a, monka nkyerɛ me, na mennan memfa nifa anaa benkum.
50Ɛnna Laban ne Betuel buae sɛ: AWURADE na asɛm yi fi no, yɛrentumi nka no papa anaa bɔne nkyerɛ wo. 51Hwɛ, Rebeka na ogyina w'anim yi, fa no kɔ ma ɔnkɔyɛ wo wura ba yere, sɛnea AWURADE aka no. 52Na Abraham somfo no tee wɔn nsɛm no, ɔkotow fam sɔree AWURADE. 53Na ɔsomfo no yii dwetɛ nnwinne ne sika nnwinne ne ntade de maa Rebeka; na ɔde nneɛma a ɛsom bo maa ne nuammarima ne ne na. 54Na ɔne nnipa a wɔka ne ho no didii, na wɔnomee, na wɔdaa hɔ. Na wɔsɔree anɔpa no, ɔkae sɛ: Munnya me kwan, na menkɔ me wura nkyɛn. 55Na ne nua ne ne na kae sɛ: Ma ababaa no ntena yɛn nkyɛn da tiaa bi sɛ dadu ansa na woakɔ. 56Na ɔka kyerɛɛ wɔn sɛ: Munnsianka me, efisɛ AWURADE ama m'akwantu no asi me yiye. Munnya me kwan mma menkɔ me wura nkyɛn. 57Na wose: Ma yɛmfrɛ ababaa no mmisa n'ankasa.
58Na wɔfrɛɛ Rebeka ka kyerɛɛ no sɛ: Wo ne ɔbarima yi bɛkɔ anaa? Na ose: Mɛkɔ. 59Na wogyaa wɔn nua Rebeka ne ne gyigyefo ne Abraham somfo no ne ne nnipa no kwan. 60 Na wohyiraa Rebeka see no sɛ: Yɛn nuabea, dan ɔpedu ahorow mpem, na w'asefo mfa wɔn atamfo apon nni. 61Na Rebeka ne ne mmaawa sɔree, na wɔtenatenaa yoma no so dii ɔbarima no akyi, na ɔsomfo no de Rebeka sii kwan so.
62 Na Isak fi Lahairoi abura ho bae, efisɛ ɔte negeb asase so. 63Na Isak fii adi kɔɔ wuram anwummere kɔdwennwenee ne nsɛm ho. Na ɔmaa n'ani so hwɛɛ, na hwɛ, yoma reba. 64Na Rebeka maa n'ani so, na ohuu Isak no, ofii yoma no so sii fam, 65na ɔka kyerɛɛ ɔsomfo no sɛ: Ɔbarima bɛn na ɔnam wura mu rebehyia yɛn yi? Na ɔsomfo no se, ɛyɛ me wura. Na ɔfaa ne nkataanim de kataa n'anim. 66Na ɔsomfo no kaa nea ɔyɛe no nyinaa kyerɛɛ Isak. 67 Na Isak de no kɔɔ ne na Sara ntamadan mu, na ɔwaree Rebeka, na ɔyɛɛ ne yere, na ɔdɔ no, na Isak werɛkyekyee ne na wu akyi.",https://www.bible.com/bible/3439/GEN.24.ATWDB
