Title,Content,URL
GYENESIS 35,"Onyankopɔn hyira Yakob wɔ Betel
1 Na Onyankopɔn ka kyerɛɛ Yakob sɛ: Sɔre kɔ Betel kɔtena hɔ, na si afɔrebukyia wɔ hɔ ma Onyankopɔn a ɔyii ne ho kyerɛɛ wo ɛda a woredwane afiri wo nua Esau anim no.
2 Ɛnna Yakob ka kyerɛɛ ne fiefoɔ ne wɔn a wɔka ne ho nyinaa sɛ: Montoto anyame ananafoɔ a ɛwɔ mo mu no ngu, na monnwira mo ho, na monsakyera mo ntadeɛ. 3 Na momma yɛnsɔre nkɔ Betel, na menkɔsi afɔrebukyia wɔ hɔ memma Onyankopɔn a m’ahohiahia da ɔtiee me na ɔdii m’akyi wɔ kwan a mekɔeɛ no mu no. 4 Ɛnna wɔde wɔn anyame ananafoɔ a ɛwɔ wɔn nsam nyinaa ne wɔn aso mu nkaa maa Yakob, na ɔde siee dupɔn bi a ɛwɔ Sekem ho no ase. 5Na wɔsii mu sɛ wɔrekorɔ no, Nyankopɔn ho hu baa nkuro a atwa wɔn ho ahyia no so, na wɔanti Yakob mma no.
6Na Yakob ne nkurɔfoɔ a wɔka ne ho nyinaa duruu Lus a ɛwɔ Kanaan asase soɔ (a ɛne Betel). 7 Na ɔsii hɔ afɔrebukyia, na ɔfrɛɛ hɔ: El-betel, ɛfiri sɛ da a ɔredwane afiri ne nua anim no, ɛhɔ na Onyankopɔn yii ne ho kyerɛɛ no.
8 Na Rebeka abaawa panin Debora wui, na wɔsiee no Betel aseɛ fam wɔ odum bi ase, na ɔtoo dua no din Alon-bakut.
9Na Onyankopɔn yii ne ho kyerɛɛ Yakob bio, ne ba a ɔfirii Mesopotamia baeɛ no mu, na ɔhyiraa no. 10 Na Onyankopɔn ka kyerɛɛ no sɛ: Wo din de Yakob, nanso wɔremfrɛ wo Yakob bio, na mmom Israel ne wo din; na ɔtoo no din Israel. 11 Na Onyankopɔn ka kyerɛɛ no sɛ: Mene Onyankopɔn Tweaduampɔn, dɔre na yɛ bebree; ɔman ne aman asafo bɛfiri wo mu aba, na ahemfo firi w’asene mu bɛba. 12Na asase a mede mama Abraham ne Isak no, wo na mede bɛma woɔ; na w’asefoɔ a wɔbɛdi w’akyire no na mede asase no bɛma wɔn. 13 Na Onyankopɔn firii ne nkyɛn wɔ deɛ ɔne no kasaeɛ hɔ kɔɔ ɔsoro. 14 Na Yakob de odum sii deɛ ɔne no kasaeɛ hɔ, ɔboɔ dum, na ɔhwiee ɔnom afɔdeɛ guu so, na ɔde ngo guu so. 15Na Yakob frɛɛ deɛ ɔne Onyankopɔn kasaeɛ hɔ Betel.
Rahel wuo
16Na wɔtutu firi Betel kɔe. Na aka kwan tiaa bi na wɔaduru Efrat no, awoɔ kaa Rahel, na awoɔ no denee no. 17Na n’awoɔ mu yɛɛ den no, awogyefoɔ no ka kyerɛɛ no sɛ: Nsuro, na yei nso wobɛwo ɔbabarima. 18Na ne kra refiri ne mu na ɔreyɛ awuo no, ɔtoo no din Ben-oni, na n’agya deɛ, ɔfrɛɛ no Benyamin. 19 Na Rahel wui, na wɔsiee no ɛkwan a ɛde Efrat (a ɛne Betlehem) no nkyɛn. 20Na Yakob sii ne da so dum, ɛne Rahel da so dum de bɛsi nnɛ. 21 Na Israel tutu kɔsii ne ntomadan wɔ Eder abantenten akyiri nohoa.
22 Na ɛbaa sɛ Israel te asase no soɔ no, Ruben ne n’agya abaawayerɛ Bilha kɔdae, na Israel tee.
Yakob mmammarima
(1 Berɛsosɛm 2.1-2)
23Nso Yakob mmammarima yɛ dummienu: Lea mma ne Ruben (Yakob abakan), Simeon, Lewi, Yuda, Isakar ne Sebulon. 24Rahel mma ne Yosef ne Benyamin. 25Na Rahel abaawa Bilha mma ne Dan ne Naftali. 26Na Lea abaawa Silpa mma ne Gad ne Aser. Yeinom ne Yakob mmammarima a wɔwoo wɔn wɔ Mesopotamia.
Isak wuo
27Na Yakob baa n’agya Isak nkyɛn wɔ Mamre, wɔ Kiriat-arba (a ɛne Hebron), deɛ Abraham ne Isak tenaeɛ sɛ ahɔhoɔ no.
28Na Isak nna nyinaa yɛ mfirinhyia ɔha aduɔwɔtwe. 29 Na Isak gyaa ne honhom mu, na ɔwui, na ɔtii ne nananom wɔ asamando, berɛ a na wabɔ akora, na nna amee no. Na ne mma Esau ne Yakob siee no.",https://www.bible.com/bible/1861/GEN.35.ASW
GYENESIS 36,"Esau asefoɔ
(1 Berɛsosɛm 1.34-37)
1 Na yeinom ne Esau (a wɔfrɛ no Edom) awoɔ ntoatoasoɔ: 2 Esau waree Kanaanfoɔ mmaa: Hetini Elon babaa Ada, ne Hewini Sibeon ba Ana babaa Oholibama, 3 ne Ismael babaa Basmat, Nebaiot nuabaa. 4Na Ada woo Elifas maa Esau, na Basmat woo Reuel. 5Na Oholibama woo Yeus ne Yalam ne Kora. Yeinom ne Esau mma a wɔwoo wɔn wɔ Kanaan asase soɔ.
6Na Esau faa ne yerenom ne ne mmammarima ne ne mmammaa ne ne fiefoɔ nyinaa ne ne mmoa ne n’anantwie nyinaa ne n’ahonyadeɛ a ɔnyaeɛ wɔ Kanaan asase soɔ nyinaa, na ɔfirii ne nua Yakob ho kɔɔ asase bi so, 7ɛfiri sɛ wɔn ahonyadeɛ dɔɔso sene deɛ wɔde tena faako, na asase a wɔyɛ so ahɔhoɔ no, wɔn mmoa dodoɔ nti na wɔnsene so. 8Esau, a ɔno ara ne Edom no kɔtenaa Seir bepɔ so.
9Na yeinom ne Edomfoɔ agya Esau a ɔte Seir bepɔ soɔ no awoɔ ntoatoasoɔ: 10Esau mmammarima din nie: Esau yere Ada ba Elifas, ne Esau yere Basmat ba Reuel. 11Na Elifas mma ne Teman, Omar, Sefo, Gatam ne Kenas. 12(Na Timna yɛ Esau ba Elifas mpena, na ɔwoo Amalek maa Elifas.) Yeinom ne Esau yere Ada mma. 13Na yeinom ne Reuel mma: Nahat, Sera, Sama ne Misa; yeinom ne Esau yere Basmat mma. 14Na yeinom ne Esau yere Oholibama, Sibeon ba Ana babaa no mma: Ɔwoo Yeus, Yalam ne Kora maa Esau.
15Yeinom ne Esau mma mu atitire: Esau abakan Elifas mma: Otitire Teman, otitire Omar, otitire Sefo, otitire Kenas, 16otitire Kora, otitire Gatam, ne otitire Amalek. Yeinom ne Elifas atitire wɔ Edom asase so; yeinom ne Ada mma. 17Na yeinom ne Esau ba Reuel mma: Otitire Nahat, otitire Sera, otitire Sama, ne otitire Misa. Yeinom ne Reuel atitire wɔ Edom asase so; yeinom ne Esau yere Basmat mma. 18Na yeinom ne Esau yere Oholibama mma: Otitire Yeus, otitire Yalam, otitire Kora. Yeinom ne Esau yere Oholibama, Ana ba, atitire no. 19Yeinom ne Esau mma, na yeinom ne wɔn atitire no; (ɔne Edom.)
Seir Asefoɔ
(1 Berɛsosɛm 1.38-42)
20 Yeinom ne Horini Seir mma asase no sofoɔ: Lotan, Sobal, Sibeon, Ana, 21Dison, Eser ne Disan. Yeinom ne Horifoɔ a wɔyɛ Seir mma a na wɔte Edom asase soɔ no atitire. 22Na Lotan mma ne Hori ne Hemam, na Lotan nuabaa ne Timna. 23Na yeinom ne Sobal mma: Alwan, Manahat, Ebal, Sefo ne Onam.
24Na yeinom ne Sibeon mma: Aya ne Ana. Oyi ne Ana a na ɔhwɛ n’agya Sibeon mfunumu no, a ɔhunuu nsuohyeɛ aniwa wɔ ɛserɛ soɔ no. 25Na yeinom ne Ana mma: Dison ne Oholibama, a ɔyɛ Ana babaa. 26Na yeinom ne Dison mma: Hemdan, Esban, Itran ne Keran. 27Yeinom ne Eser mma: Bilhan, Saawan ne Akan. 28Yeinom ne Disan mma: Us ne Aran. 29Yeinom ne Horifoɔ atitire: Otitire Lotan, otitire Sobal, otitire Sibeon, otitire Ana, 30otitire Dison, otitire Eser, otitire Disan. Yeinom ne Horifoɔ atitire sɛdeɛ wɔn mmusua teɛ wɔ Seir asase soɔ.
Edom Ahemfo
(1 Berɛsosɛm 1.43-54)
31Yeinom ne ahemfo a wɔdii Edom asase soɔ ansa na obi redi Israel mma so hene. 32Na Bela, Beor ba, dii Edomhene, na ne kuro din de Dinhaba. 33Na Bela wui, na Sera ba Yobab a ɔfiri Bosra bɛdii n’adeɛ. 34Na Yobab wui, na Husam a ɔfiri Teman asase soɔ no bɛdii n’adeɛ. 35Na Husam wui, na Bedad ba Hadad a ɔkumm Midian wɔ Moab petee mu no bɛdii n’adeɛ, na ne kuro din de Hawit. 36Na Hadad wui, na Samla a ɔfiri Masreka bɛdii n’adeɛ. 37Na Samla wui, na Saulo a ɔfiri Rehobot a ɛda asuo no ho no bɛdii n’adeɛ. 38Na Saulo wui, na Akbor ba Baal-hanan bɛdii n’adeɛ. 39Na Akbor ba Baal-hanan wui, na Hadar bɛdii n’adeɛ. Na ne kuro din de Pau, na ne yere din de Mehetabel, Mesahab babaa Matred babaa.
40Na yeinom ne Esau atitire no din, sɛdeɛ wɔn mmusuakuo, wɔn tenabea ne wɔn din teɛ: Otitire Timna, otitire Alwa, otitire Yetet, 41otitire Oholibama, otitire Ela, otitire Pinon, 42otitire Kenas, otitire Teman, otitire Mibsar, 43otitire Magdiel, otitire Iram. Yeinom ne Edom (a ɔne Esau, Edomfoɔ agya) no atitire, sɛdeɛ wɔn tenabea teɛ wɔ asase a wɔnyaeɛ no soɔ.",https://www.bible.com/bible/1861/GEN.36.ASW
GYENESIS 37,"Yosef ne ne nuanom
1Na Yakob tenaa asase a n’agya yɛɛ so hɔhoɔ a ɛne Kanaan asase no so. 2Na yei ne Yakob abusua ho abakɔsɛm: Yosef dii mfirinhyia dunson no, ɔne ne nuanom kɔhwɛɛ nnwan; na aberantewaa no ne n’agya yerenom Bilha ne Silpa mma na ɛwɔ hɔ. Na Yosef bɛka wɔn ho asɛmmɔne kyerɛ n’agya. 3Na ɛsiane sɛ Yosef yɛ ne nkɔkoraaberɛ mu ba nti, na Israel dɔ no sene ne mma nyinaa; enti ɔpam batakari fɛfɛ bi maa no. 4Na ne nuanom hunuu sɛ wɔn agya dɔ no sene wɔn nyinaa no, wɔtanee no, na wɔmfa abodwoɔ ne no nkasa.
5Na Yosef soo daeɛ, na berɛ a ɔka kyerɛɛ ne nuanom no, wɔtanee no senee akane no. 6Na ɔka kyerɛɛ wɔn sɛ: Montie daeɛ a maso yi: 7Na hwɛ, na yɛrekyekyere ayuo afiafi wɔ afuom. Na m’afi no sɔre gyinaa kyirebenn, na hwɛ, mo afiafi no twaa m’afi ho hyiae, na ɛrekoto m’afi no. 8Na ne nuanom ka kyerɛɛ no sɛ: Kyerɛ sɛ worebɛdi yɛn so hene anaasɛ worebɛdi yɛn so tumi? Na ne daeɛ ne ne nsɛm no nti wɔkɔɔ so tanee no bebree. 9Na ɔsoo daeɛ foforɔ bio, na ɔka kyerɛɛ ne nuanom sɛ: Hwɛ, maso daeɛ bio, na hwɛ, owia ne ɔsrane ne nsoromma dubaako akoto me. 10Na ɔka kyerɛɛ n’agya ne ne nuanom no, n’agya kaa n’anim sɛ: Daeɛ bɛn na woaso yi? Kyerɛ sɛ, me ne wo na ne wo nuanom bɛba abɛkoto fam wɔ w’anim? 11Na ne nuanom ani beree no; na n’agya deɛ, ɔde nsɛm no siee.
Wɔtɔn Yosef ma wɔde no kɔ Misraim
12 Na ne nuanom de wɔn agya nnwan kɔɔ adidie wɔ Sekem. 13Na Israel ka kyerɛɛ Yosef sɛ: Sɛ wonim sɛ wo nuanom rewɛn mmoa wɔ Sekem. Bra na mensoma wo wɔn nkyɛn. Na ɔse: Menie. 14 Na ɔka kyerɛɛ no sɛ: Kɔ na kɔhwɛ sɛ wo nuanom ne nnwan no ho yɛ anaa; na sane bɛka kyerɛ me. Na ɔsomaa no firii Hebron bonhwa mu, na ɔkɔduruu Sekem. 15Na ɔbarima bi hunuu no, na hwɛ, na ɔrewɔ wira no mu ntwɛtwɛdɛ. Na ɔbarima no bisaa no sɛ: Worehwehwɛ deɛn? 16Na ɔka kyerɛɛ no sɛ: Me nuanom na merehwehwɛ wɔn; mesrɛ wo, kyerɛ me faako a wɔrehwɛ wɔn mmoa no. 17Na ɔbarima no se: Wɔatu ha; na metee sɛ wɔreka sɛ: Momma yɛnkɔ Dotan. Na Yosef tii ne nuanom, na ɔkɔhunuu wɔn wɔ Dotan.
18Na ne nuanom hunuu no akyirikyiri na ɔnnya nnuruu wɔn nkyɛn no, wɔpamm ne tiri so sɛ wɔbɛku no. 19Na wɔsesee wɔn ho wɔn ho sɛ: Hwɛ, ɔdaeɛsofoɔ no na ɔreba no. 20Afei mommra mma yɛnku no mfa no nto mmura yi bi mu, na yɛnka sɛ: Aboa bɔne bi na awe no, na yɛahwɛ deɛ ne daeɛ no bɛyɛ.
21 Na Ruben teeɛ no, ɔgyee no firii wɔn nsam kaa sɛ: Mommma yɛnnku no. 22Na ɔkaa sɛ: Monnhwie mogya nngu, na momfa no nto ɛserɛ so ha abura yi mu; na mommfa mo nsa nnka no. Ɔreyɛ na anka wayi no afiri wɔn nsam de no asane akɔma n’agya. 23 Na Yosef duruu ne nuanom nkyɛn no, wɔworɔɔ n’atadeɛ ne batakari fɛfɛ a ɔhyɛ no, 24 na wɔde no kɔtoo abura no mu. Nso na abura no da mpan a nsuo nni mu. 25Na wɔtenaa ase didii. Na wɔmaa wɔn ani so hwɛe, wɔhunuu Ismaelfoɔ akwantufoɔkuo bi a wɔfiri Gilead rekɔ Misraim ne wɔn yoma a wɔsoso hyehwam ne akyenkyennuro ne kurobo sɛ wɔreba.
26Na Yuda ka kyerɛɛ ne nuanom sɛ: Sɛ yɛkum yɛn nua na yɛsi ne mogya so a, mfasoɔ bɛn na ɛwɔ mu? 27Mommra mma yɛntɔn no mma Ismaelfoɔ. Mommma yɛmmfa yɛn nsa nnka no, ɛfiri sɛ ɔyɛ yɛn nua ne yɛn mogya. Na ne nuanom no tiee no. 28 Na Midianfoɔ adwadifoɔ bi rebɛsene. Na wɔtwetwee Yosef yii no firii abura no mu, na wɔtɔn no maa Ismaelfoɔ no gyee nnwetɛbena aduonu. Na wɔde Yosef kɔɔ Misraim. 29 Na Ruben sane baa abura no so, na hwɛ, na Yosef nni abura no mu. Na ɔsunsuanee ne ntadeɛ mu, 30na ɔsane baa ne nuanom nkyɛn bɛkaa sɛ: Abɔfra no nni hɔ, na afei ɛdeɛn na menyɛ?
31Na wɔfaa Yosef atadeɛ no, na wɔkumm ɔpapo bi, na wɔde atadeɛ no bɔɔ mogya no mu. 32Na wɔsoma maa wɔde batakari fɛfɛ no brɛɛ wɔn agya bɛkaa sɛ: Yei na yɛahunu, hwɛ sɛ wo ba no atadeɛ ni anaa? 33 Na ɔhwɛeɛ no, ɔkaa sɛ: Ɛyɛ me ba no atadeɛ a! Aboa bɔne bi na awe no, ampa ara wɔatete Yosef mu. 34 Ɛnna Yakob sunsuanee ne ntadeɛ mu, na ɔde ayitoma bɔɔ n’asene, na ɔsuu ne ba no kyɛree. 35Na ne mmammarima nyinaa ne ne mmammaa nyinaa bae sɛ wɔbɛkyekyere ne werɛ, nanso wamma wɔankyekyere ne werɛ. Na ɔkaa sɛ: Mede awerɛhoɔ yi ara bɛkɔ me ba nkyɛn wɔ Asamando. Na n’agya suu no.
36Na Midianfoɔ no kɔtɔnee no wɔ Misraim maa Potifar a ɔyɛ Farao piani ne n’ankɔbeafoɔ so panin no.",https://www.bible.com/bible/1861/GEN.37.ASW
GYENESIS 38,"Yuda ne Tamar
1Na ɛbaa sɛ berɛ no ara mu Yuda firii ne nuanom nkyɛn kɔe, na ɔkɔtenaa Adulamni bi a wɔfrɛ no Hira nkyɛn. 2Na Yuda hunuu Kanaanni bi a wɔfrɛ no Sua babaa bi wɔ hɔ, ɔwaree no na ɔne no dae. 3Na ɔnyinsɛnee, na ɔwoo ɔbabarima, na ɔtoo no din Er. 4Na ɔnyinsɛnee bio woo ɔbabarima, na ɔtoo no din Onan. 5Na ɔnyinsɛnee bio woo ɔbabarima, na ɔtoo no din Sela. Na ɔwoo no no, na ɔwɔ Kesib.
6Na Yuda waree yerɛ bi a wɔfrɛ no Tamar maa n’abakan Er. 7Na Yuda abakan Er dii amumuyɛsɛm AWURADE anim, na AWURADE kumm no.
8 Na Yuda ka kyerɛɛ Onan sɛ: Kɔ wo nua yere no ho, na fa ne kunafoɔ, na wo mma ma wo nua no. 9Na Onan nim sɛ mma no renyɛ ne dea, na ɛbaa sɛ, sɛ ɔkɔ ne nua yere no ho a, ɔma ne ho gu fam sɛe, na wanwo mma amma ne nua. 10Na deɛ ɔyɛeɛ no yɛɛ bɔne wɔ AWURADE anim, enti ɔkumm ɔno nso.
11Na afei Yuda ka kyerɛɛ n’ase Tamar sɛ: Kɔtena kuna mu wɔ w’agya fie kɔsi sɛ me ba Sela bɛnyini. Ɛfiri sɛ ɔse, anyɛ saa a, ɔno nso bɛwu sɛ ne nuanom. Na Tamar kɔ kɔtenaa n’agya fie.
12Na ɛkyɛree kyɛreeɛ no, Sua babaa, Yuda yere no, wui. Na Yuda werɛ kyekyereeɛ no, ɔne n’adamfo Hira Adulamni no kɔɔ ne nnwan ho twitwafoɔ nkyɛn wɔ Timnat. 13Na wɔkɔka kyerɛɛ Tamar sɛ: Hwɛ, w’ase rekɔ Timnat akɔtwitwa ne nnwan ho. 14Na ɔyii ne kuna ntadeɛ firii ne ho, na ɔde nkatanimu kataa n’anim, na ɔsakyeraa ne ho kɔtenaa Enaim kurotia wɔ Timnat kwan ho, ɛfiri sɛ wahunu sɛ Sela anyini, na wɔamfa no amma no awareɛ. 15Na Yuda hunuu no no, ɛsiane sɛ wakata n’anim nti, ɔbuu no sɛ odwamamfoɔ. 16 Na ɔmane kɔɔ ne nkyɛn ɔkwan no ho kaa sɛ: Ma mene wo nkɔda ɛ, nso na ɔnnim sɛ n’ase a. Na ɔse: Ɛdeɛn na wobɛma me na wone me ada? 17Na ɔse: Mɛma wɔde abirekyie ba afiri mmoa mu abrɛ wo. Na ɔse: Ɛnneɛ ma me awowadeɛ kɔsi sɛ wode bɛba. 18Na ɔkaa sɛ: Ɛdeɛn na memfa mensi wo awowa? Na ɔse: Wo nsɔanokaa ne wo homa ne wo nsam poma. Na ɔde maa no, na ɔkɔɔ ne ho, na ɔne no nyinsɛnee. 19Na ɔsɔree, na ɔkɔe, na ɔyii ne nkatanimu firii ne ho, na ɔhyɛɛ ne kuna ntadeɛ no. 20Na Yuda de abirekyie ba no maa n’adamfo Adulamni no sɛ ɔmfa nkɔgye n’awowadeɛ no wɔ ɔbaa no nsam mmrɛ no, nanso wanhu no. 21Na ɔbisaa kurom hɔfoɔ sɛ: Odwamamfoɔ a ɔte Enaim kwan ho no wɔ he? Na wɔse: Odwamamfoɔ biara nni ha. 22Na ɔsane baa Yuda nkyɛn bɛkaa sɛ: Manhu no, nanso kurom hɔfoɔ se: Odwamamfoɔ biara nni hɔ. 23Na Yuda se: Ma no mfa, na yɛn ani anwu. Hwɛ, mama wode abirekyie ba yi akɔma no, na woanhu no. 24Na ɛbɛyɛ abosome mmiɛnsa akyiri no, wɔbɛka kyerɛɛ Yuda sɛ: W’ase Tamar abɔ adwaman ama no anyinsɛn. Na Yuda kaa sɛ: Monkɔfa no mmra na wɔnhye no. 25Na wɔkɔfaa Tamar baeɛ no, ɔsoma maa wɔkɔka kyerɛɛ n’ase no sɛ: Ɔbarima a ne nnoɔma nie no, ne me na anyinsɛn. Na ɔse: Hwehwɛ mu na hwɛ, deɛ nsɔanokaa, homa ne poma yi yɛ ne dea? 26Na Yuda ani hunuiɛ no, ɔkaa sɛ: Ɔtene sene me, ɛfiri sɛ mamfa no mamma me ba Sela. Nanso ɔne no anna bio.
27Na ɛduruu n’awoɔ soɔ no, hwɛ, na nta na ɛwɔ ne yam. 28Na ɔrewoɔ no, ɔbaako yii ne nsa, na awogyefoɔ no sɔɔ mu de asaawa kɔkɔɔ kyekyeree ne nsa no kaa sɛ: Oyi na ɔfirii adi kane. 29 Na ɔtwee ne nsa kɔɔ mu no, hwɛ, ne nua no firii adi, na ɔkaa sɛ: Hwɛ sɛdeɛ woatete mu? Wo so na ntemu no wɔ. Enti wɔtoo no din Peres. 30Na akyire yi no, ne nua a asaawa kɔkɔɔ bɔ ne nsa soɔ no bae, na ɔtoo no din Sera.",https://www.bible.com/bible/1861/GEN.38.ASW
GYENESIS 39,"Yosef ne Potifar yere
1 Na wɔde Yosef kɔɔ Misraim. Na Farao piani Potifar a ɔyɛ ankɔbeafoɔ so panin na ɔyɛ Misraimni no tɔɔ no Ismaelfoɔ a wɔde no kɔɔ hɔ no nsam. 2Na AWURADE dii Yosef akyi, na ɔyɛɛ ɔbarima a ne ho wɔ siadeɛ, na ɔtenaa ne wura Misraimni no fie. 3Na ne wura hunuu sɛ AWURADE di n’akyi na AWURADE ma deɛ ɔyɛ nyinaa yɛ yie n’abasa soɔ no, 4Yosef nyaa n’anim adom, na ɔsom no; na ɔde no sii ne fie so, na ɔde deɛ ɔwɔ nyinaa hyɛɛ ne nsa. 5 Na ɛfiri berɛ a ɔde no sii ne fie ne deɛ ɔwɔ nyinaa soɔ no, Yosef nti AWURADE hyiraa Misraimni no fie, na AWURADE nhyira baa deɛ ɔwɔ nyinaa so, efie ne afuom. 6Na ɔde deɛ ɔwɔ nyinaa hyɛɛ Yosef nsa, na ɔwɔ hɔ nti, ɔnhwɛ biribiara gye aduane a ɔno ara die. Nso na Yosef ho ne n’anim yɛ fɛ.
7 Na ɛbaa sɛ akyire yi no, Yosef wura yere tuu n’ani sii ne so, na ɔkaa sɛ: Wo ne me mmɛda. 8Nanso wampene, na ɔka kyerɛɛ ne wura yere no sɛ: Hwɛ, sɛ me wura anya me nti ɔnhwɛ deɛ ɛwɔ ne fie, na ɔde deɛ ɔwɔ nyinaa ahyɛ me nsa. 9 Obiara nyɛ kɛseɛ nsene me efie ha, na ɔnkame me biribiara gye wo, ɛnam sɛ ne yere ne woɔ ntira. Na adɛn na menyɛ amumuyɛ kɛseɛ yi, na menyɛ bɔne mentia Onyankopɔn? 10Na ɔka kyerɛ Yosef saa daa daa, nanso Yosef antie sɛ ɔne no bɛda na ama ne nsa aka no. 11Na da koro bi a ɔkɔɔ ɛdan no mu sɛ ɔrekɔyɛ n’adwuma, na efie hɔfoɔ no mu biara nni hɔ no, 12ne wura yere no sɔɔ n’atadeɛ mu kaa sɛ: Wo ne me mmɛda! Na Yosef gyaa n’atadeɛ no wɔ ne nsam dwane firii adi.
13Na ɔbaa no hunuu sɛ wagya n’atadeɛ wɔ ne nsam adwane afiri adie no, 14ɔfrɛfrɛɛ ne fiefoɔ ka kyerɛɛ wɔn sɛ: Monhwɛ, wakɔfa Hebrini yi aba rebɛdi yɛn ho fɛw; waba me nkyɛn sɛ ɔne me rebɛda, na mede nne kɛseɛ meteaa mu; 15na ɔtee sɛ memaa me nne soɔ meteaa mu no, ɔgyaa n’atadeɛ wɔ me nsam, na ɔdwane firii adi. 16Na ɔde n’atadeɛ no guu ne nkyɛn kɔsii sɛ ne wura baa fie. 17Na ɔkaa saa nsɛm yi ara kyerɛɛ no sɛ: Akoa Hebrini a wokɔfaa no brɛɛ yɛn no baa me nkyɛn sɛ ɔrebɛdi me ho fɛw; 18na memaa me nne so meteaa mu no, ɔgyaa n’atadeɛ wɔ me nsam, na ɔdwane firii adie.
19Na ne wura tee ne yere nsɛm a ɔka kyerɛɛ no sɛ: Saa adeɛ yi na w’akoa no ayɛ me no, ne bo fui. 20Na Yosef wura no faa no de no kɔtoo afiase, deɛ ɔhene nneduafoɔ guo, na ɔdaa afiase hɔ.
Onyankopɔn di Yosef akyi
21Na AWURADE dii Yosef akyi, na ɔdom no, na ɔmaa n’anim baa nyam wɔ afiasehwɛni no anim. 22Na afiasehwɛni no de nneduafoɔ a wɔwɔ afiase hɔ nyinaa hyɛɛ Yosef nsa, na biribiara a na wɔyɛ no wɔ hɔ no, ɔno na na ɔhwɛ soɔ. 23Afiasehwɛni no anha ne ho anhwɛ biribiara a ɛwɔ Yosef nsam, ɛfiri sɛ AWURADE dii n’akyi, na deɛ ɔyɛeɛ nyinaa, AWURADE maa no yɛɛ yie.",https://www.bible.com/bible/1861/GEN.39.ASW
GYENESIS 40,"Yosef kyerɛ nneduafoɔ daeɛ ase
1Na ɛbaa sɛ akyire yi Misraimhene nsahyɛni ne ne paanootoni fom wɔn wura, Misraimhene no. 2Na Farao bo fuu n’apiafoɔ baanu no, nsahyɛfoɔ panin ne paanootofoɔ panin no. 3 Na ɔde wɔn kɔguu afiase wɔ ankɔbeafoɔ panin no fie, faako a Yosef da hɔ. 4Na ankɔbeafoɔ panin no maa Yosef hwɛɛ wɔn so som wɔn; na wɔkyɛree afiase hɔ kakra.
5Na Misraimhene nsahyɛni ne ne paanootoni a na wɔgu afiase hɔ no baanu nyinaa sosoo daeɛ anadwo korɔ, ɛsono oyi daeɛ ne n’asekyerɛ, na ɛsono oyi nso daeɛ. 6Na Yosef kɔɔ wɔn nkyɛn anɔpa kɔhwɛɛ wɔn, na hwɛ, na wɔayeyɛ mosomosoo. 7Na ɔbisaa Farao apiafoɔ a wɔne no gu afiase wɔ ne wura fie no sɛ: Adɛn nti na nnɛ mo anim ayɛ bosabosaa sɛɛ? 8 Na wɔka kyerɛɛ no sɛ: Yɛasoso daeɛ, nso obiara nni hɔ a ɔbɛkyerɛ aseɛ. Na Yosef ka kyerɛɛ wɔn sɛ: Nkyerɛaseɛ mfiri Onyankopɔn hɔ anaa? Monka nkyerɛ me ɛ! 9Ɛnna nsahyɛfoɔ panin no kaa ne daeɛ no kyerɛɛ Yosef sɛ: Me daeɛ mu no, na hwɛ, bobe bi si m’anim, 10na bobe no apae nkorabata mmiɛnsa, na ayɛ sɛdeɛ ɛrefefɛ, na anyini agu nhyerɛne, na abɔ esia ayɛ aba a abereɛ. 11Na Farao kuruwa kura me, na metetee bobe aba no mekyi guu Farao kuruwa no mu, na mede kuruwa no hyɛɛ Farao nsa. 12Na Yosef ka kyerɛɛ no sɛ: Ne nkyerɛaseɛ nie: Nkorabata mmiɛnsa no yɛ nnansa. 13Na aka nnansa na Farao ayi wo afiri ha de wo asane akɔdi wo dibea bio, na wode Farao kuruwa ahyɛ ne nsa sɛ kane a na woyɛ ne nsahyɛni no. 14Nanso sɛ ɛyɛ a, kae me, na sɛ ɛsi wo yie a, yɛ me adɔeɛ, na bɔ me din kyerɛ Farao, na bɛyi me ɛdan yi mu, 15 ɛfiri sɛ wia na wɔwiaa me Hebrifoɔ asase soɔ, na ɛha nso menyɛɛ hwee a anka ɛsɛ sɛ wɔde me bɛto amena yi mu. 16Na paanootofoɔ panin no hunuu sɛ nkyerɛaseɛ no yɛ no, ɔka kyerɛɛ Yosef sɛ: Me nso, me daeɛ mu no, na hwɛ, paanoo nkɛntɛn mmiɛnsa a ɛsisi soɔ wɔ m’atifi. 17Na kɛntɛn a ɛdi soro no mu na Farao anomu atɔduane nyinaa bi wɔ; na nnomaa redidi wɔ kɛntɛn no mu wɔ m’atifi. 18Na Yosef buaa sɛ: Ne nkyerɛaseɛ nie: Nkyerɛnkyɛ mmiɛnsa no yɛ nnansa; 19na aka nnansa na Farao ayi wo afiri ha, na wakɔsɛne wo dua so ma nnomaa adi wo nam afiri wo ho.
20Na da a ɛtɔ so mmiɛnsa a ɛyɛ Farao awoda no, ɔtoo ne nkoa nyinaa pono, na ɔyii nsahyɛfoɔ panin ne paanootofoɔ mu panin no de wɔn baa ne nkoa anim; 21na ɔsane de nsahyɛfoɔ mu panin no sii ne nsahyɛ so bio a ɔde kuruwa hyɛ Farao nsa. 22Na paanootofoɔ panin no deɛ, ɔsɛnee no, sɛdeɛ Yosef kyerɛɛ wɔn aseɛ no.
23 Nanso nsahyɛfoɔ panin no ankae Yosef, na ne werɛ firii no.",https://www.bible.com/bible/1861/GEN.40.ASW
