Title,Content,URL
PIILIMKA 1,"1A nyini piilimka po ate Wen a nye wenzukku ale tɛŋka la. 2Tɛŋka a jam ka magsa ale chim tɛŋ koruk. Legi nna kpitɔ ale jam a lik nya liuŋtaŋa ate Wen Chiika a yaa bo nyiamu zuk a ja.
3Ate Wen yaa weeni ayen, <<Ku be nyaksi a nya,>> ate ku yaa a nya. 4Wen a nya ayen, ku la a nya la a nala, ate wa gaari nyaka legini po. 5Wen yaa wi ku le nyaksi a nya la ayen kantueŋ ale a wi legini ayen yok. Ate saluik ale junɔi yaa deri boro. Piilimka danni jam le la.
6Wen yaa ŋman weeni ayen, <<Basi ate peelim a bo nyaataŋa suŋsuŋ a gaari ti tɔgatɔga.>> 7Wen yaa nye peelimmu a poori wenzuk nyiamu ale tɛŋzuk nyiamu. Ate ku nye va wa le weeni diila. 8Wen yaa wi ŋmazukku ayen wen. Ate saluik ale junɔi a ŋman boro. Da dila jam saari ka daa ŋaye.
9Wen yaa ŋman weeni ayen, <<Basi ate nya buui ale bo tɛŋka la a chuiri ga duek jigi yeŋ ate tɛŋ kosik a nya.>> Ate ku nye dila. 10Wen yaa wi tɛŋ kosikka ayen tɛŋ alege a wi nya tii ale chuiri dua jigi yeŋ ka la ayen nyakpiem. Wen yaa nya ate ku nala te wa.
11Wen yaa weeni ayen, <<Basi ate ŋanta tɔgatɔga ale tiisa a nyini tɛŋka zuk ate ba a yɔni yɔna a ta bie a va ba buuni ale ka diila.>> Ate ku nye dila. 12Ate ŋanta tɔgatɔga ale tiisa a nyini tɛŋka zuk a yɔni yɔna a ta bie a va ba buuni ale ka diila. Wen yaa nya ate ku nala te wa. 13Ate saluik ale junɔi a ŋman boro. Da dila jam saari ka daa ŋata.
14Wen yaa ŋman weeni ayen, <<Basi ate ŋan nyaksinta a bo wenzukku a gaari yok ale kantueŋ. Ŋan bala mɛ ale ba gaari wenkarik ale yoei ale daa ale bena. 15Bala mɛ ale ba bo wenzukku a nyaksi ate tɛŋka zuk a nya.>> Ate ku nye dila. 16Wen a nye ka ŋan nyaksin kpienta baye wenbinni ale chiika. Wenbinni ale soa kantueŋka ate chiika a soa yokku. Wa nye chiŋmarisaŋa mɛ. 17Wen a nye ba kama a basi wenzukku ayen tɛŋka zuk a nya, 18wenbinni a nya kantueŋ abe chiika mɛ a nya yokku. Wenbinni le chiika ale poori legini. Wen yaa nya ayen ku nala a te wa. 19Ate saluik ale junɔi a ŋman boro. Da dila a saari ka daa ŋanaansi.
20Wen yaa ŋman weeni ayen, <<Basi ate nyiamu a ta ŋanvuta abe nuinsa a yiri wenzukku.>> 21Dila Wen yaa nye nyiam po ŋan kpienta ale ŋan fiisa ate ba bo nyiamu po a cheŋ, ba jam ka ŋanta tɔgatɔga a bo nyiamu po. Wa nye nuinsa mɛ tɔgatɔga. Wen yaa nya ate ku nala a te wa. 22Wen yaa niak ŋantaŋa ale weeni ayen ba biak abe ba wɔgri a sueri nyiamu po meena abe nuinsaŋa a wɔgri a sueri tɛŋka. 23Ate saluik ale junɔi a ŋman boro. Da dila a saari ka daa ŋanu.
24Wen ŋman weeni ayen, <<Basi ate ŋanvuta tɔgatɔga a bo tɛŋka zuk, yeri duŋsa, ŋan baai meena ale vuuri a cheŋ ale gɔi duŋsa ba meena ba tɔga ba tɔga.>> Ate ku nye dila. 25Wen a nye gɔi duŋsa buuni ale yeri duŋsa buuni ale ŋan baai ale vuuri a cheŋ la buuni. Ate Wen nya ate ku nala te wa nna yegayega. 26Wen yaa ŋman weeni ayen, <<Ni te ti nye nuru ase tidek la ate wa a neensi ti ate wa a nya nyakpiemu jumaŋa ale nuinsaŋa, ale bo wenzukku la ale duŋsaŋa ale bo tɛŋka zuk ale ŋan baai meena ale vuuri a cheŋ la zuk.>>
27Dila Wen yaa nye nuru ase wadek la, wadek ale ka diila ate wa nye wa, nidoa ale nipok ate wa nye.
28Wen a niak ba ale weeni ba ayen, <<Ni biak a sueri tɛŋka a nya ka zuk. Ayen ba a nya jumaŋa ale bo nyakpiemu po la, ale nuinsaŋa ale bo wenzukku la, ale ŋanvutaŋa meena ale a cheŋ tɛŋka zuk la.>>
29Wen yaa weeni ayen, <<M pai ŋan bie meena ale nyini tɛŋka a biak ŋmaa bɛ la ale tiisa meena ale a yɔni yɔna a te ni ayen ba chim ŋandiinta te ni. 30M pai duŋsaŋa ale nuinsa ale ŋan baai meena ale bo tɛŋka zuk a cheŋ ate ba ta nyuvuri la te ni. M pai va sobta meena a te ba ayen ba chim ba ŋandiinta.>> Ate ku nye dila.
31Wen yaa nya wa ale nye dii meena la ate ku nala te wa. Ate saluik ale junɔi a ŋman boro. Da dila a saari ka daa ŋayuebi.",https://www.bible.com/bible/2176/GEN.1.BWU
PIILIMKA 2,"1Dila la Wen yaa nye jaab meena tɔgatɔga ale bo wenzukku ale tɛŋka la a nueri.
2Daa ŋayopɔiwa danni ale Wen nueri tuim ŋaai meena ate wa tom la kama, dila daa ŋayopɔiwa danni wa yaa vuusi. 3Wen yaa niak dai dila danni a basi ate di chim tuilum dai, dii nyiŋla da dila wa vuusi kama, wa an ŋman tom tuini.
4Dii meena ale magsi chaab ale wenzukku ale tɛŋka nyeka la ale la. Naawen dii ale ka Wen la ale nye tɛŋka ale wenzukku la 5tiisa ale wuuta an diem jam nyini ya, diila Naawen dii ale ka Wen la an basi ate ŋmoruk a ni ya, nuru mɛ abe karo a tom. 6Alege nyiam ale nyini tɛŋ jueli a yɔk tɛŋka ŋmazuk meena. 7Naawen dii ale ka Wen la yaa nye tantaŋa a mɛ nuru a yaa vuusi basi wa nyueŋa po ate wa chim nuru vuk.
8Yɔgyɔgla de Naawen dii ale ka Wen la yaa nye talim kpiem Eden po kori geŋka a yaa basi ate nuruwa ate wa nye la a bo du. 9Naawen dii ale ka Wen la a yaa basi ate tiisa tɔgatɔga a nyini. Sii ale nala nina po ale magsi dɛka. Talimu suŋsuŋ nyuvuri tiib ale jam za du. Nalim sebika ale biem sebika tiib ale maa za du.
10Beli ale jam bo Eden a chali a zaŋti talimu. Di jam poori ka beli naŋsa sinaansi. 11Dii ale dɛ niŋ la yuei ale Pison, di chali va ka Yavila tɛŋka po a taam. Ligmɔniŋ ale jam bo du la. 12Tɛŋ kala ligmɔniŋka jam nala kama. Tiisa ale jam boro ate si vaataŋa nyummu masa. Si chaab mɛ simmu nyummu a masa. Tintain ŋmiŋmirita ale jam maa boro. 13Beli dii ale jam nye ŋayewa la yuei ale Giyon, di chali va ka Kus tɛŋka po a taam. 14Beli dii ale jam nye ŋatawa la yuei ale Tigris, di jam chali va ka Assur kori geŋka a taam. Beli dii ale nye ŋanaansiwa la yuei jam le Yufiretis.
15Naawen dii ale ka Wen la yaa pai nuruwa a basi Eden Talimu po ayen wa a tom abe wa a nya bu zuk. 16Naawen dii ale ka Wen la yaa weeni nuruwa ayen fi ta suik a dɛ tiib buui yɔna kama, 17alege kan dɛ nalim ale biem sebika tiimu yɔnaŋa, diila fi dan dɛ fi sum a kpi kama.
18Naawen dii ale ka Wen la yaa ŋman weeni ayen, <<Ku an nala ayen nidoawa a boro wadek wa nyiini. M le nye ka maarɔ magsi a te wa.>>
19Yɔgyɔgla de Naawen dii ale ka Wen la a yaa pai tanta a nye duŋsaŋa ale wenzuk nuinsaŋa a nyini ka tɛŋka. Wa yaa ta ba jam nuruwa jigi ayen wa nya wa le wa te ba yue diila. Wa dan te jaab yuei, jaab bula yuei ale la dera. 20Dila nuruwa yaa te duŋ wuunsa yue ale te nuinsa meena mɛ yue ale duŋsa meena yue. Alege maarɔ a jam karo a magsi nuruwa.
21Dila Naawen dii ale ka Wen la yaa nye ate nidoawa a lo goom po nna yegayega. Wa ale a goa la, ate Wen yaa yeeri wa nyipik kobini dinyi alege lik kauk kula. 22Naawen dii ale ka Wen la yaa pai nidoawa nyipik kobini ate wa yeeri la a nye nipok a pai te nidoawa. 23Nidoawa yaa weeni ayen, <<Yɔgyɔgla de ka m dek kobi ale nna. Ka m dek nyiŋ lam ale nna, ba le wi wa ayen ka nipok, diila wa nyini ka mi jigi.>> 24Dila nyiŋla, ku a fɛ kama ate nidoa basi wa ko ale wa ma, abe wa gum chaab ale wa powa, ate bayewa a chim nyiŋ yeŋ. 25Nidoawa ale nipowa a jam ta ka chaboala alege kan chali chivie.",https://www.bible.com/bible/2176/GEN.2.BWU
PIILIMKA 3,"1Duŋsaŋa meena ate Naawen dii ale ka Wen la jam nye la po, waamu ale jam seba a gaam si meena. Bu yaa weeni nipowa ayen, <<Wen sum weeni kama ayen, <Ni kan dɛ tiisaŋa ale bo talimu po la yɔnaŋa?> >>
2Nipowa yaa weeni waamu ayen, <<Ti baga a dɛ tiisaŋa yɔnaŋa kama, 3alege Wen weeni kama ayen ti kan dɛ buui ale za talimu suŋsuŋ la yaase ti tiri bu. Ti dan nye dila, ti le kpi.>>
4Waamu yaa weeni nipowa ayen, <<Ni kan kpi. 5Wen sebi kama ayen ni dan dɛ ni ninaŋa ale lagri ate ni a nye ase Wen la, a yaa seba nalim ale biem.>>
6Nipowa yaa nya ayen yɔnni a nala nina po a magsi dɛka. Ku be ŋman magsi mɛ ayen wa ta yam. Wa yaa gbesi yɔnni dɛ alege te wa chorɔwa le bo ale wa la ate wa mɛ dɛ. 7Ba nɔi bayewa nina deri lagri ate ba deri miŋ ayen ba ta ka chaboala. Ate ba ya yaali kiŋkaŋ vaata a baali tom chaab a lik badek.
8Dai dila danni dek junɔi ate ku yɔk nna chorototo la, nidoawa ale wa powa yaa wom Naawen dii ale ka Wen la a cheŋ talimu po, ba yaa suk tiisaŋa po.
9Naawen dii ale ka Wen la yaa wi nidoawa ayen, <<Fi bo ka bɛ?>>
10Nidoawa yaa tulisi ayen, <<Mi wom ka fi le a tabi la yaa chali yɔgsum, a yaa suk, diila mi ta ka chaboala.>>
11Naawen yaa bek ayen, <<Ka wana ale weeni fu ayen fi ta chaboala? Fi dɛ tiib buui ate mi a weeni ayen fi kan dɛ bu yɔnni la kama?>>
12Nidoawa yaa tulisi ayen, <<Nipowa ate fi pai te mu la, ale pai tiimu yɔnni a te mi ate mi dɛ.>>
13Naawen dii ale ka Wen la yaa bek nipowa ayen, <<Ka boa ale la ate fi nye?>>
Nipowa yaa tulisi ayen, <<Waamu ale paasi mi ate mi dɛ yɔnni.>>
14Dila Naawen dii ale ka Wen la yaa weeni waamu, <<Fi ale nye nnala la nyiŋ, m yeeri fu kama yeri duŋsa ale gɔi duŋsa po a ka a te fu. Fi ale kasim a vuuri ka fi lɔgni zuk a cheŋ abe fi a dɛ tanta fi boka meena po. 15Abe m basi ate dachaani a bo fi ale nipowa suŋsuŋ abe di bo fi buuni ale nipowa buuni suŋsuŋ. Fi ale dom wa nankpanni ate wa mɛ tabi fi zukku a ŋɔriŋ.>>
16Alege weeni nipowa ayen, <<Fi dan boro a biak biik fi nyiŋdommaŋa ale zuak nna yegayega. Fi le kasim a biak bisa ale ka nyiŋdomma. Fi le kasim a yaali fi chorɔwa abe wa a nya fi zuk.>>
17Alege a weeni nidoawa ayen, <<Fi le wom fi powa nɔi a siak dɛ tiimu ate m weeni ayen fi kan dɛ bu yɔnni la, fi nyiŋ m ka basi tɛŋka zuk. Fi le kasim a cheri ka wulum abe fi nya ŋandiinta a dɛ fi boka meena po. 18M le basi ate tɛŋka a ta wuuk ale munsa ate fi nam a nya ŋanta a dɛ. 19Wulum ale fi za fi cheri a nya ŋandiinta a dɛ ate fi pilim ŋman siŋ tɛŋ, fi le tɔlim nyini ka tanta po la. Fi ka tanta, fi be le ŋman cheŋ ka tantaŋa po.>>
20Nidoawa yuei jam ale Adam ate wa yaa te wa powa yuei ayen Iiv, dii nyiŋla wa za wa chim ka saalɔ meena ma.
21Naawen dii ale ka Wen la a yaa pai duŋsa gbaŋsa a nye gatta a te Adam ale Iiv ate ba lik badek.
22Naawen dii ale ka Wen la yaa weeni ayen, <<Nuruwa yaa nye se ka tama la, a yaa seba nalim ale biem. Wa kan ŋman laari nisa a gbesi nyuvuri tiimu yɔnni a dɛ ate wa kan kpi.>> 23Dila Naawen dii ale ka Wen la yaa yiak wa Eden Talimu po ayen wa nyini ga a kpa tɛŋ kaai ate Wen nye tantaŋa a nye wa la. 24Wa le yiak wa nueri la, wa yaa basi ate ŋanvuta a za Eden Talimu kori geŋ ale gebi kpieŋ a yuk ayen suik kan boro a taam nyuvuri tiimu jigini.",https://www.bible.com/bible/2176/GEN.3.BWU
PIILIMKA 4,"1Adam yaa goa ale wa powa Iiv ate wa yik lɔgi a biak Keen. Iiv yaa weeni ayen Naawen maarika nyiŋ wa biak ka nidoa. 2Ku ŋaaŋnyiŋ wa yaa biak Keen yoawa Abel. Abel a jam a wuuk ka piisa alege Keen a kpa. 3Ku yaa jam paari diipo ate Keen yaa ta wa kpanni ŋanta gela jam ayen wa te Naawen. 4Abel mɛ ko wa pai ŋaai ate wa piisaŋa a liŋ biak la a yaa ta kab tii ale ta kpaam la jam ayen wa te Naawen. Naawen yaa tuesi Abel tiirimu 5alege zɛri Keen tiirimu. Dila nyiŋ Keen sui yaa puuri ale kaasi nina.
6Naawen yaa bek Keen ayen, <<Ka boa ale soa ate fi sui a puuri? Ka boa le soa ate fi kaasi nina? 7Fi dan nye dii ale magsi la, m ti a siak kama, alege fi dan kan nye dii ale magsi la, be seba ale biem ale a yaali ayen bu jo fu. Bu a yaali ayen bu nya ka pagrim fi zuk, alege ku a fɛ ate fi nya pagrim biem zuk.>>
8Keen yaa weeni wa yoawa Abel ayen, te ti nyini a cheŋ peelim. Ba ale cheŋ la Keen yaa nak wa yoawa Abel a ko.
9Naawen a yaa bek Keen ayen, <<Fi yoawa Abel bo ka bɛ?>> Keen yaa tulisi ayen, <<Mi a zɛ. Ka mi ale chim yoawa nyaarɔ?>>
10Naawen yaa weeni ayen, <<M nya fi ale ko fi yoawa la kama. Wa ziimu ale siŋ tɛŋka la a weeni mu kama ayen m namsi fu. 11Yɔgyɔgla de mi ka te tɛŋka kama. Tɛŋka abe tuesi fi yoawa ziimu kama. 12Fi dan kpa fi kan nya jaaboa. Fi le kasim a nyiem tɛŋka meena, fi kan nya jigi a vuusi.>>
13Keen yaa weeni Naawen ayen, <<M ninammu a zuak ka yega a gaam m le baga tu. 14Jinla fi yiak mu a basi kama, fi be kan bo ale mu. M le kasim a nyiem ka tɛŋka meena a ka jigiya a vuusi. Waai a dan nya mu wa a ko mu kama.>>
15Alege Naawen yaa weeni wa ayen, <<Daa di, waai a dan ko fu wa le nya ku tutuna naŋtuok nɔi buyopɔi.>> Naawen yaa dueni daana wa nyiŋ ate waai a dan nya wa abe wa kan ko wa. 16Keen yaa basi Naawen ale cheŋ ga bo Nod tɛŋka. Nod a bo ka Eden kori geŋ.
17Keen yaa goa ale wa powa ate wa yik lɔgi a biak Ɛnok. Dila po Keen jam a sɛ ka tɛŋ kpieŋ ate wa yaa pai wa nidoabinni yuenni a te tɛŋka a wi ayen Ɛnok. 18Ɛnok yaa jam biak Irad, ate Irad a biak Meyujael, ate Meyujael a biak Metusael, ate Metusael a biak Lamek.
19Lamek jam faari ka nipooba baye. Wanyi yuei jam le Ada, m wala yuei jam le Zilla. 20Ada jam biak ka Jabal. Jabal jam ka baai ale jam a wuuk duŋsa ale a goa viita po la ko. 21Wa yua yuei jam le Jubal. Jubal jam ka baai ale a yaali kpanta nakka ale paampuuŋta peeka la ko.
22Zilla mɛ a jam biak ka nidoabili a te wa yuei ayen, Tubal Keen. Tubal Keen a jam ka choabiik. Wa jam ta ka toa, wa yuei ale Naama.
23Lamek yaa jam weeni wa pooma Ada ale Zilla ayen ni wom dii ate m ta la. Nuru ale jam te mi tuem ate mi a ko wa. Wa jam diem ka bi paaluk ate mi ko wa, wa le te mi tuemu la. 24Keen a dan a nya tutuna naŋtuok nɔi buyopɔi, dan ka di Lamek le nya ka naŋtuok nɔi pisiyopɔi ale buyopɔi.
25Adam yaa ŋman goa ale wa powa ate wa biak nidoabili ate ba te wa yuei ayen Sɛti. Ba jam weeni kama ayen Wen ŋman te ba ka biik ate wa tagri Abel ate Keen ko la zuk. 26Sɛti mɛ a biak nidoabili a te wa yuei ayen Enos. Dila powa ate nuruba yaa jam piilim a puusi Naawen yuei.",https://www.bible.com/bible/2176/GEN.4.BWU
PIILIMKA 5,"1Adam buuni ale ŋmarisi dii a doa la le nna. Wen jam nye nurubiik kama ase wadek la. 2Wa jam nye ka nidoa le nipok a yaa niak ba. Wa le nye ba la, wa jam a wi ba ayen ka nuruba.
3Adam le goa paari bena kook ale pisita la wa biak ka nidoabili ase wadek la, a te wa yuei ayen Sɛti. 4Adam ale biak Sɛti la wa goa paari ka bena kobsanaaniŋ ale ŋman biak nidoabilisa ale lieba. 5Adam jam paari ka bena kobsaneok ale pisita alege kpi.
6Sɛti goa ka bena kook ale ŋanu ale biak Enos. 7Wa le biak Enos la, wa goa paari ka bena kobsanaaniŋ ale ŋayopɔi a biak nidoabilisa ale lieba. 8Sɛti benaŋa meena jam ka kobsaneok ale pi ale ŋaye alege kpi.
9Enos jam ka bena pineok ale biak Kenan. 10Wa le biak Kenan la, wa goa ka bena kobsanaaniŋ ale pi ale ŋanu alege biak nidoabilisa ale lieba. 11Enos benaŋa meena jam ka kobsaneok ale ŋanu alege kpi.
12Kenan jam ka bena pisiyopɔi alege biak Mayalale. 13Kenan ale biak Mayalale la wa ŋman goa paari ka bena kobsanaaniŋ ale pisinaansi a biak nidoabilisa ale lieba. 14Kenan benaŋa meena jam ka bena kobsaneok ale pi alege kpi.
15Mayalale jam ka bena pisiyuebi ale ŋanu alege biak Jared. 16Wa le biak Jared la wa ŋman goa paari ka bena kobsanaaniŋ ale pisita a biak nidoabilisa ale lieba. 17Mayalale benaŋa meena jam ka bena kobsanaaniŋ ale pineok ale ŋanu alege kpi.
18Jared jam ka bena kook ale pisiyuebi ale ŋaye alege biak Ɛnok. 19Wa le biak Ɛnok la, wa goa paari ka bena kobsanaaniŋ a biak nidoabilisa ale lieba. 20Jared benaŋa meena jam ka bena kobsaneok ale pisiyuebi ale ŋaye alege kpi.
21Ɛnok jam ka bena pisiyuebi ale ŋanu alege biak Metusela. 22Wa le biak Metusela la, wa paari ka bena kobsita a biak nidoabilisa ale lieba. Wa jam va Wen kama nalimnyiini. 23Ɛnok benaŋa meena jam ka bena kobsita ale pisiyuebi ale ŋanu. 24Ɛnok ale jam a va Wen nalimnyiini la, Wen deri pai wa ta cheŋ te ba an ŋman nya wa.
25Metusela jam ka bena kook ale pinaanuŋ ale ŋayopɔi alege biak Lamek. 26Wa ale biak Lamek la, wa goa paari ka bena kobsiyopɔi ale pinaanuŋ ale ŋaye a biak nidoabilisa ale lieba. 27Metusela benaŋa meena jam ka kobsaneok ale pisiyuebi ale neok alege kpi.
28Lamek jam ka bena kook ale pinaanuŋ le ŋaye alege biak nidoabili. 29Wa jam te wa yuei ayen ka Nowa. Wa jam weeni kama ayen Naawen ale ka te tɛŋka ate ti a tom ale ti nisima a nam diila, biika de ale yɔk ti sue. 30Wa ale biak Nowa la, wa goa paari ka bena kobsinu ale pineok ale ŋanu a biak nidoabilisa ale lieba. 31Lamek benaŋa meena jam ka kobsiyopɔi ale pisiyopɔi le ŋayopɔi alege kpi.
32Nowa jam ka bena kobsinu alege biak Sɛm, ale Yɛm, ale Jafet.",https://www.bible.com/bible/2176/GEN.5.BWU
PIILIMKA 6,"1Nuru bisaŋa a yaa le jam a piisi tɛŋka zuk alege a biak lieba la, 2Wen nidoabilisaŋa a yaa nya ba ale nala diila ba yaa lueri a faari baai ate ba a yaali la. 3Naawen yaa weeni ayen mi Chiik kan bo ale nurubiik taam wuu, diila wa ka waai ale a kpi. Wa daaŋa tɛŋzuk de ka bena kook le pisiye.
4Nefilim demma ale jam bo tɛŋka zuk da ŋala po. Ate ku ŋaaŋnyiŋ Wen nidoabilisaŋa yaa ga goa ale nuruba lieba ate ba biak bisa. Ba jam ka ganduata, baai ale ta yuei.
5Naawen yaa nya ayen nurubiik biem yaa zuak ka nna yegayega. Wa popolaŋa ale wa suinummu biem kasim sueri ba ka daaŋa meena. 6Ku kasim daani Naawen ate wa sui a dom wa le nye nurubiik a basi tɛŋka zuk la. 7Dila Naawen yaa weeni ayen, wa le ko nurubiik meena ate wa nye la, nuruba ale duŋsa, ŋan baai ale a cheŋ ba lɔga zuk, ale wenzuk nuinsa, diila m sui kaasi ka yegayega m le nye ba la.
8Alege Nowa nyeka jam nala Naawen nina po. 9Nowa ale jam ka diila ale nna. Nowa jam ka nuru maŋ, da ŋala po nuru an baga a dak wa kaasuŋŋoa, wa jam a cheŋ ale Wen kama. 10Nowa jam ta ka nidoabilisa bata. Ba yue jam ale Sɛm ale Yɛm ale Jafet.
11Nurubiik meena a yaa jam a tom ka biem, ate nyeka tuem zuak Wen nina po. 12Wen yaa nya tɛŋka kaasi nna yegayega diila nuruma nyeka an bola nala. 13Wen yaa weeni Nowa ayen, <<Mi za m kaasi nurubiik meena kama, diila ba nyiŋ ale soa ate nyeka tuem a sueri tɛŋka po. M le sum kaasi tɛŋka le ba meena. 14Be nye ŋaaruŋ ale daata a magsi nidek. Abe fi nye diina ku po a pai kotaali a lik paaŋa ŋaaŋ ale popo meena. 15Fi le fi nye ku diila ale nna. Ku woglimmu magsi anamagib kobsaneok, labsimu magsi anamagib kook ale pisinu, abe ku woŋŋa jueli ase anamagib pineok la. 16Abe fi pili ku ate pilika jueli ase anamagib buye. Nye tuok a basi kaukku kunyi. Nye ate ŋaaruŋku ta tɛŋ ale suŋsuŋ ale ŋmazuk.
17<<M le basi ate nyiam jam lik tɛŋka meena a ko javuk meena ale bo tɛŋka zuk la. Jaabuuri meena ale ta nyuvuri la. Jaab meena tɛŋka zuk ale kpi. 18Alege mi ale fi ale nye nɔiyeŋ ate fi ale fi nidoabilisa ale fi powa ale fi nidoabilisaŋa pooma a jo ŋaaruŋku po.
19<<Se fi ta ŋanvuta buuri meena baye baye ja duok ale ja sari a jo ŋaaruŋku po ate ba vua ale fu. 20Nuinsa buuri siye siye, ale duŋsa buuri siye siye, ale ŋan baai ale duiri tɛŋ a cheŋ baye baye, ale jam fi jigi ate fi ta ba ate ba vua. 21Pa ŋandiin tii buuri ale magsi dɛka a ta jo magsi fi ale ba.>>
22Nowa yaa nye dii meena ti Wen weeni wa la.",https://www.bible.com/bible/2176/GEN.6.BWU
PIILIMKA 7,"1Naawen yaa weeni Nowa ayen, <<Jo ŋaaruŋku po, fi ale fi dɔkdemma meena dii nyiŋla m nya kama ayen fi ale wayɔrisima nyɔnɔ nuruma de po. 2Lueri duŋ sii buuri ale magsi Wen tiirim teka la siyopɔi, jaduok ale jasari ale sii ale kan magsi Naawen tiirim teka la siye, jaduok ale jasari, 3ale nuinsa buuni siyopɔi, jaduok ale jasari ate si buuni a vua a bo tɛŋka meena. 4A zaani jinla a ta cheŋ daa ŋayopɔi dai m le basi ate ŋmoruk a jam ni paari da pisinaansi ale yogta pisinaansi ate javuk meena ate m nye la a kpi.>>
5Ate Nowa nye dii meena ti Naawen weeni ayen wa nye la. 6Nowa jam ka bena kobsiyuebi diipo ate ŋmorukku a ni la. 7Nowa ale wa powa ale wa nidoabilisaŋa ale ba pooma yaa jo ŋaaruŋku ayen nyiamu kan paari ba. 8Duŋ naliŋsa ale sii ale daŋ ale nuinsa ale ŋan baai ale duiri tɛŋ a cheŋ la 9ŋanduata ale ŋansaa yaa jam Nowa jigi a jo ŋaaruŋku po ase Wen ale weeni Nowa diila. 10Daa ŋayopɔiwa ale taam la nyiamu yaa jam.
11Ben dii ate Nowa nya bena kobsiyuebi la, chiik kaai ale saari siyewa la, da pi ale ŋayopɔiwa danni tɛŋka ya lagri ate nyiamu a nyini ate wenzukku mɛ lagri. 12Ate ŋmoruk a ni da pisinaansi ale yogta pisinaansi. 13Da dila danni dek Nowa ale wa nidoabilisaŋa Sɛm, ale Yɛm ale Jafet ale wa powa le wa nidoabilisa batawa pooma yaa jo ŋaaruŋku po. 14Ba jam jo ku po ale ka gɔi duŋsa buuni, ale yeri duŋsa buuni ale ŋan baai ale vuuri a cheŋ ba lɔga zuk la buuni ale nuinsa buuri tɔgatɔga, jaab meena ale ta kiŋkaŋŋa. 15Ŋanta buuri meena ale ta nyuvuri la baye baye yaa jam Nowa jigi a jo ŋaaruŋku po. 16Duŋ sii ale jam a jo la ka jaduok ale jasari a va ale Wen ale weeni Nowa diila. Naawen yaa lik wa basi du.
17Daa pisinaansi meena nyiamu jam a siŋ tɛŋka kama, bu le kasim a gum du la, bu yaa ta ŋaaruŋku a jueli wen. 18Nyiamu kasim a jueli nna yegayega tɛŋka meena ate ŋaaruŋku yaa bo nyiamu zuk a dɛ. 19Bu jam jueli ka nna yegayega ate guuk kpientaŋa meena ale bo tɛŋka zuk la a lik. 20Bu jam jueli kama a lik guutaŋa meena. A zaani guutaŋa zuk a jueli ku limisa ase ka naŋtuok magsika pisiye la. 21Javuk meena ale bo tɛŋka zuk yaa kpi. Nuinsa ale gɔi duŋsa ale yeri duŋsa ale ŋan yirinta ale nurubiik meena a jam kpi kama. 22Jaab meena le bo tɛŋzuk a ta nyueri a vuusi a kpi kama. 23Javuk meena ale jam bo tɛŋka zuk la ŋman ka. Nurubisa ale duŋsa ale ŋan baai meena ale bo tɛŋzuk a cheŋ ale wenzuk nuinsa ŋman jam ka tɛŋka zuwa. Ka Nowa nyiini ale baai ale bo ŋaaruŋku po ale wa la. 24Nyiamu jam lik tɛŋka ka daa kook ale pisinu.",https://www.bible.com/bible/2176/GEN.7.BWU
PIILIMKA 8,"1Alege Wen yaa teeri Nowa wari ale gɔi duŋsaŋa ale yeri duŋsaŋa ale bo ŋaaruŋku po ale wa la wari. Wa yaa basi ate viok yaa fuk ate nyiamu yaa siŋ. 2Yɔgyɔgla de Wen yaa lik wenzukku ate ŋmorukku basi nika. Tɛŋka mɛ nyiamu basi nyini ka. 3Nyiamu a yaa siŋ nna maga maga. Da dii ale nye daa kook ale pisinuwa la, nyiamu yaa ŋman siŋ gum du. 4Chiisa siyopɔiwa po da pi ale ŋayopɔiwa danni ŋaaruŋku yaa siŋ zaani Ararat guutaŋa zuk. 5Nyiamu yaa kasim a siŋ a ta ga paari chiisa piwa po piilimka danni ate guutaŋa yaa a nya.
6Daa pisinaansi ale taam la Nowa yaa lak ŋaaruŋku ate wa nye la tuokparuku 7a yaa tom tagaaruk ate ku nyini a gilim de ale de ate nyiamu ga kpeeri tɛŋka zuk. 8Ate wa ŋman tom nangbaŋ ayen ka nyini nya ase nyiamu a siŋ alege tɛŋka ya. 9Alege nangbaŋka an nya jigi a kali ya dii nyiŋla nyiamu diem jam lik tɛŋka kama. Ka yaa ŋmani cheŋ Nowa jigi ŋaaruŋku po. Wa yaa laari wa nisaŋa a yik ti ka jo wadek jigi ŋaaruŋku po.
10Wa yaa limisi paari daa ŋayopɔi a ŋman tom nangbaŋka ate ka nyini ŋaaruŋku po. 11Nangbaŋka ale pilim ŋman wa jigi junɔinni la, wa yaa nya ka ta tiib viok yɔgsuk ka nɔnni po. Ate Nowa yaa seba ayen nyiamu siŋ kama. 12Wa ŋman limisi paari daa ŋayopɔi a tom ka ate ka nyini, alege ka an ŋman ga wa jigi ya.
13Ben dii ate Nowa nya bena kobsiyuebi ale dinyi la, chiik kaai ale a piilim beni la, piilimka danni nyiamu yaa kpeeri meena. Nowa yaa zagri jabuui ale lik ŋaaruŋku la a nya nyiamu ale kpeeri alege tɛŋka la. 14Benni po chiik kaai ale a nye siye la, daa pisiye ale ŋayopɔiwa danni tɛŋka yaa ko cheksegi.
15Wen yaa weeni Nowa ayen, 16<<Nyini ŋaaruŋku po nyini ale fi powa ale fi nidoabilisaŋa ale fi nidoabilisaŋa pooma. 17Ta javuk meena ale bo ŋaaruŋku po ale fu la nyini. Nuinsa, duŋsa, ale ŋan baai meena ale a cheŋ tɛŋzuk ate ba biak abe ba wɔgri a piisi a sueri tɛŋka meena.>> 18Nowa ale wa powa, ale wa nidoabilisaŋa, ale wa nidoabilisaŋa pooma yaa nyini. 19Duŋsaŋa meena ale ŋan baai meena ale a vuuri tɛŋ la, ale nuinsa, ŋan baai meena, ale a cheŋ tɛŋka zuk la, yaa nyini ŋaaruŋku po ba beŋ ba beŋ.
20Ate Nowa yaa sɛ kuŋkuŋ a pai duŋ sii ale magsi Naawen teka ale nuin sii ale magsi Naawen teka la a ko a ju te wa. 21Naawen yaa wom nyummu le masa la a yaa weeni wa suinum po ayen, <<Wa kan ŋman ka te tɛŋka diipo diipo nurubiik nyiŋŋa, dila wa suinummu po poom ka biem nyiini, nyini wa biik po. M kan ŋman kaasi ŋanvuta meena ase m ni nye dii nna. 22Ase tɛŋka ale kasim boro nna, borik daa ale cheka daa ŋoota ale wulum, yoei ale wenkarik yok ale kantueŋ a kan maa kpegli.>>",https://www.bible.com/bible/2176/GEN.8.BWU
