Title,Content,URL
PIILIMKA 18,"1Naawen yaa pai wadek a sak Abrayam a moata Mamre ti kpieŋsaŋa. Wenbinni ale jam moata wenzuk suŋsuŋ la ale wa jam kali wa viuku nɔi. 2Abrayam yaa zak zuk a nya ale nuruba bata a za moata. Wa le nya ba la, wa yaa yiti nwuli wa viuku nɔi a ga tu ba yaa koori tɛŋ a puusi ba.
3Abrayam yaa weeni ayen, <<M nyɔnɔ ni dan nya ku magsi ayen ni jam m yenni, ni kan gaam ni yɔmawa taamu. 4Ni basi ate ba ta nyiam jam ate ni sugri ni naŋsaŋa abe ni vuusi tiimu de tɛŋ. 5Ni basi ate m yaa jaab ate ni dɛ ate ni nya pagrim a cheŋ ni chelimu, yɔgyɔgla de ate ni jam ni yɔmawa jigi la.>> Ba yaa yen, <<Di ka naliŋnaliŋŋa, be nye dii ate fi weeni la.>>
6Abrayam yaa nye nwuli a jo viuku po Saara jigi a weeni wa ayen nye nwuli a yaali taasi kpien ale zom a nye boroborok.
7Abrayam yaa chali a ga wa niiŋa jigi a lueri naa paalib a te wa yɔmawa, ate wa nye nwuli a ko bu a dik. 8Wa yaa ta naabiisim goam ale naabiisim nyiam ale naamu ate ba dik la a jam zaani ba niŋ. Ba le a dɛ la Abrayam za ka ba tɛŋ tiimu kiri.
9Ba bek ayen, <<Fi powa Saara bo ka bɛ?>> Abrayam yaa tulisi ayen, <<Wa bo ka viuku po.>>
10Wa yaa weeni ayen, bali nna po de m le ŋman jam fi jigi. Dila po fi powa Saara ale biak nidoabili. Yɔgyɔgla de Saara bo ka viuku po a wom. Viuku jam bo ka wa ŋaaŋ. 11Abrayam ale Saara a poom jam kpaŋ kama a ta bena a piisi. Saara abe jam gaam biam kama taam. 12Saara ale poli ku wari la, wa yaa la wa poi po, ayen mi yaa le jiak dii ale ge ate m dɔk nidoawa mɛ a kpaŋ la, m le nya masimu de a dɛ?
13Naawen yaa bek Abrayam ayen, <<Ka boa ale soa ate Saara la a weeni ayen, <<M le sum biak biiga, mi le kpaŋ dii nna?> 14Wari a boro a tua a te Naawen yaa? M le pilim jam diipo ate m dak la bali benni. Saara ale ta nidoabili.>>
15Saara jaa chali ka yɔgsum wa yaa velim ayen, <<Mi an la ya.>> Alege Naawen ayen, <<Fi sum la kama.>>
16Nuruma ale yiti ayen ba basi dula la, ba yaa nya Sodom geŋsa. Abrayam yaa a cheŋ ale ba ayen wa basi ba suik. 17Naawen yaa weeni ayen, <<M le suk dii ate mi a yaali ayen m nye la ale Abrayam? 18Abrayam le chim ka tɛŋ kpieŋ ale tɛŋ pagrik, ate tɛŋsa meena tɛŋka zuk a va wa nyiŋ a nya niaka. 19Diila mi lueri wa kama ayen wa a sak abe wa a dak wa bisaŋa ale wa ŋaaŋbisaŋa ale bo wa ŋaaŋ la ate ba ta Naawen suiku. Abe ba a nye dii ale magsi ale chim wensie la. Ate Naawen ale puulim ayen wa nye dii a te Abrayam la wa nye.>>
20Naawen yaa weeni ayen, <<Kum sii ale a kum Sodom ale Gomora biemu nyiŋla a zuak kama. Ba biemu a zuak kama. 21Mi ale siŋ a nya ase ba le nye diila a bie ase ka kumsaŋa ale paari mu diila ya. Be dan kan daa di m le seba.>>
22Nuruma yaa cheem cheŋ a duŋ Sodom nyiŋ, alege Abrayam wari za Naawen niŋ.
23Abrayam yaa cheŋ paari wa ayen, <<Fi le kaasi nyeka tuem nyama ale nuru maŋsaŋa kama? 24Alege nuru maŋsa pisinu a nin bo tɛŋka po? Fi le kaasi ka ale kan pai ka a basi nuru maŋsa pisinuwa ale boro la nyiŋŋa? 25Fi kan siak a nye wa dila choa. A ko nuru maŋsaŋa ale nyeka tuem nyama a gum chaaba. A nye nuru maŋsaŋa ale nyeka tuem nyama wa yeŋŋa. Fi kan siak a nye di. Waai ale a bo tɛŋka meena buusa la a kan nye magsi?>>
26Naawen yaa weeni ayen, <<M dan nya nuru maŋsa pisinu Sodom tɛŋka po, m le pai ka meena basi ba nyiŋ.>>
27Abrayam yaa ŋman biisi ayen, <<Yɔgyɔgla de m ta suinum pagrik kama a biisi ale Nyɔnɔwa alege m be poom daa jaaboa alege ka tanta ale buntuem, 28alege nuru maŋsaŋa a nin ka pisinaansi ale banu? Fi le kaasi tɛŋka meena nuruba banu nyiŋŋa?>> Wa yaa weeni ayen, <<M dan nya nuruba pisinaansi ale banu m kan kaasi ka.>> 29Abrayam yaa ŋman biisi ayen, <<Alege nuruba pisinaansi a nin boro?>> Wa yaa tulisi ayen, <<Nuruba pisinaansi nyiŋ, m kan kaasi ka.>>
30Abrayam yaa weeni ayen, <<Nyɔnɔwa kan te wa sui a puuri ale mu, alege basi ate m biisi. Alege nuruba pisita a nin boro? Wa yaa tulisi ayen, <<Nuruba pisita nyiŋ, m kan nye dila.>>
31Abrayam yaa weeni ayen, <<Yɔgyɔgla de ate m ta suinum pagrik a biisi ale Nyɔnɔwa la, alege nuruba pisiye nyiini a nin boro?>> Wa yaa tulisi ayen, <<Nuruba pisiye nyiŋ m kan kaasi ka.>>
32Abrayam yaa ŋman weeni ayen, <<Nyɔnɔwa a kan te wa sui a puuri, alege basi ate m biisi bunyi a kpeglim. Alege nuruba pi dekki a nin boro?>> Wa yaa tulisi ayen, <<Nuruba pi nyiŋ m kan kaasi ka.>>
33Naawen ale biisi ale Abrayam nueri la, wa yaa basi dula alege ate Abrayam ŋman kuli.",https://www.bible.com/bible/2176/GEN.18.BWU
