Title,Content,URL
PIILIMKA 9,"1Dila Wen yaa niak Nowa ale wa nidoabilisaŋa, ale weeni ayen, <<Ni biak a piisi a sueri tɛŋka. 2Fi yɔgsum popola ale jam ka duŋsa ale wenzuk nuinsa zuk, ale ŋan baai meena ale vuuri a cheŋ la zuk, ale jumaŋa ale bo nyiam po la. M pai ba nyo fi nisa po. 3Jaab meena ale boro a cheŋ la, m pai te fu ayen ba chim ŋandiinta. Ase m le pai jaab meena ale ta vaata a te fu la, m yaa pai jaab meena a te fu. 4Alege m kan yaali ayen waai ŋɔbi jaab ate ziim wari wa po. 5Waai abe dan ko fu ate ziim nyini m le bek bu wari. M le bek nyini duŋ meena jigi. Nuru meena mɛ m le bek nyini wa jigi wa nin ko wa choa. 6Waai ale a ko nurubiik la, ba le ko wa mɛ, diila Naawen nye nurubiik ase ka wadek la. 7Alege nama, ni be biak a piisi tɛŋka zuk.>>
8Wen yaa weeni Nowa ale wa nidoabilisaŋa le bo ale wa la ayen, 9<<Yɔgyɔgla de m nyeka nɔiyeŋ ale fi ale fi ŋaaŋsa 10ale javuk meena ale jam bo ale fu la, nuinsa, yeri duŋsa ale gɔi duŋsa, ŋan baai meena ale nyini ŋaaruŋku po a nyini ale fu la, javuk meena ale bo tɛŋzuk la. 11M nye nɔiyeŋ le fu. M kan ŋman kaasi nyuvuri ale nyiamoa. Nyiam kan ŋman kaasi tɛŋka diipo diipo.>>
12Wen yaa ŋman weeni, <<Jaabuui ale a sak ayen nɔiyeŋ a bo mi ale fi suŋsuŋ ale javuk meena ale bo ale fu la ale baai ate ba za ba biak ba ate ba yiti la. 13M pai ka nagoritom a basi chiŋmaaŋa po ate bu a sak nɔiyeŋ kaai ale bo mi ale tɛŋka suŋsuŋ la. 14M dan basi ate chiŋmaaŋa lik ate nagoritommu a nyini chiŋmaaŋa po nyini, 15M le teeri nɔiyeŋka ale bo mi ale fi ale ŋanvuta meena tɔgatɔga la suŋsuŋ. Nyiam kan ŋman lik tɛŋka a ko ŋanvuta meena. 16Diipo meena nagoritommu dan nyini chiŋmaaŋa po nyini, m le nya bu a teeri nɔiyeŋ kaai ale kan ta nuerika a bo Wen ale ŋanvuta tɔgatɔga tɛŋka zuk la.>> 17Dila Wen yaa weeni Nowa ayen, <<Jabuui ale a sak nɔiyeŋka ate mi nye mi ale fi ale ŋanvuta meena tɛŋka zuk la ale nna.>>
18Nowa nidoabilisaŋa ale jam nyini ŋaaruŋku po a nyini la ale, Sɛm ale Yɛm ale Jafet. Yɛm jam ka Keenan ko. 19Nowa nidoabilisa batawa jam le la. Bala abe le biak ate nuruma waaŋ tɛŋka meena.
20Nowa waai le ka kpaarɔ la yaa vuk tiisa kaduk po. 21Wa le gbesi yɔnaŋa a nye daam nyu la wa yaa buk doa chaboala wa viuku po. 22Keenan kowa Yɛm yaa nya wa kowa chaboalaŋa a yaa weeni wa suataŋa bayewa ale bo peelim la. 23Alege Sɛm ale Jafet yaa pai garuk a vi ba ŋmankpala zuk a cheŋ tuntula a ga lik ba kowa chaboalaŋa. Ba jam tulim ba ninaŋa a basi ka nakpiak ayen ba kan nya ba kowa chaboalaŋa.
24Nowa daamu ale yiinti ate wa yiti a wom wa bibaaŋka ale nye wa diila, 25Wa yaa weeni ayen, <<Kikaasa va Keenan! Wa le chim ka yɔma te wa suataŋa.>>
26Wa ŋman weeni ayen, <<Niauŋ a bo Naawen jigi, Sɛm Wenni. Keenan ale chim ka Sɛm yɔma. 27Wen abe lagri Jafet tɛŋ banni, Jafet za wa bo ka Sɛm viitaŋa po, abe Keenan chim wa yɔma.>>
28Nyiamu le kpeeri la ŋaaŋnyiŋ Nowa goa ka bena kobsita ale pisinu. 29Nowa benaŋa meena jam ka kobsaneok ale pisinu alege ate wa kpi.",https://www.bible.com/bible/2176/GEN.9.BWU
PIILIMKA 10,"1Sɛm ale Yɛm ale Jafet buuni wie ale nna. Ba jam ka Nowa nidoabilisa. Ba mɛ jam biak ka nidoabilisa nyiamu ale jam tagli tɛŋka la ŋaaŋnyiŋ.
2Jafet nidoabilisaŋa jam le Gomer ale Megɔg ale Madai ale Javan ale Tubal ale Mesek ale Tiras. 3Gomer nidoabilisaŋa a jam le Askenaz ale Aripat ale Togarma. 4Javan nidoabilisaŋa jam ka Elisa ale Tarsis ale Kittim ale Dodanim. 5Baai ale jam kali gilim nyakpiemu la a jam nyini ka Jafet yezukku buuni. Ba yaa jam piisi a chim tɛŋ kpieŋsa a ta biisa tɔgatɔga.
6Yɛm nidoabilisaŋa jam ka Kus ale Mizraim ale Put ale Keenan. 7Kus nidoabilisaŋa jam ka Sɛba ale Yavila ale Sabta ale Araamaya ale Sabteka. Araamaya nidoabilisaŋa jam le Siiba ale Dedan.
8Kus jam ka Nimrod ko. Nimrod ale jam piilim yiti a chim pagrɔ a nak kpaliŋsa tɛŋka zuk. 9Wa jam ka yaalɔ dek Naawen niŋ. Dila ale soa ate ba weeni ayen, <<Nna sɛ Nimrod waai ale jam ka yaalɔ dek Naawen niŋ la.>> 10Wa buuni ale jam liŋ kali kab tii la ale Babilon ale Erek ale Akkad ale Kalne ale bo Sinar la. 11A nyini tɛŋ kala wa ŋman cheŋ ka Assiria. Dula ale wa sɛ Niineve ale Areyobot Ir ale Kalaha 12ale Aresen ale bo Niineve ale Kalaha suŋsuŋ po la. Tɛŋ kpieŋka jam le la.
13Mizraim jam ka Lud demma ale Anam demma ale Lehab demma ale Naftu demma ale 14Patrus demma ale Kaftor demma ale Kaslu demma ko. Filistia demma a nyini ka Kaslu demma po. 15Keenan nidoabili kpagni jam le Saidon. Wa abe jam ka Yit demma ale 16Jebus demma ale Amori demma ale Girgas demma ale 17Yivi demma ale Arki demma ale Sin demma ale 18Arvad demma ale Zemar demma ale Yamat demma ko. Ku ŋaaŋnyiŋ Keenan demma diinaŋa a yaa waaŋ chaab, 19ate Keenan tɛŋka a yaa paari Saidon a ta tuak Gerar. A ŋman ga paari Gaza a ta tuak Sodom ale Gomora ale Adma ale Zeboiim a ga paari Lasa.
20Yɛm nidoabilisaŋa ale nna a magsi chaab ale ba yezuima ale ba biisa ale ba tɛŋ bana ale ba tɛŋ kpieŋsa.
21Sɛm mɛ a jam biak ka nidoabilisa. Sɛm moa jam le Jafet. Sɛm ale jam chim Eber nidoabilisaŋa meena ko kpieŋ. 22Sɛm nidoabilisaŋa jam le Iilam ale Assur ale Afakasad ale Lud ale Araam. 23Araam nidoabilisaŋa jam le nna mɛ: Uz ale Yul ale Geter ale Masɛ. 24Afakasad a jam ka Sɛla ko ate Sɛla a chim Eber ko. 25Eber jam biak ka nidoabilisa baye. Wa jam te wanyi wa yuei ayen ka Peleg, diila wa daaŋa po tɛŋka jam poori kama. Wa suoku yuei jam le Joktan. 26Joktan ale jam biak Almodad ale Selef ale Yazarmavet ale Jera 27ale Yadoram ale Uzal ale Dikla 28ale Obal ale Abimael ale Siiba 29ale Ofir ale Yavila ale Jobab. Bade meena jam ka Joktan nidoabilisa. 30Kauk kuui ate ba jam boro la, ba jam teeri kama a nyini Mesa a cheŋ Sefar kori geŋ ate guuta boro la. 31Sɛm nidoabilisaŋa ale nna a magsi ale ba yezuima ale ba biisa ale ba tɛŋ bana ale ba tɛŋ kpieŋsa.
32Nowa ŋaaŋbisaŋa ale nna. Nyiamu ale jam lik tɛŋka la ŋaaŋnyiŋ ba yaa jam chim ka tɛŋ kpieŋsa a waaŋ tɛŋka meena zuk.",https://www.bible.com/bible/2176/GEN.10.BWU
PIILIMKA 11,"1Yɔgyɔgla de tɛŋka meena a jam ta ka bi yeŋ ale a biisi bi yeŋ. 2Ase nuruma ale jam torisi a cheŋ kori geŋ la, ba yaa nya jigi nna jassi Sinar a yaa kali dula.
3Ba yaa weeni chaab ayen, <<Ni jam ate ti nak peela a ju ŋa nalimnyiini.>> Ba jam pai ka peela daa tana ale kotaali a chim tanta. 4Ba yaa weeni chaab ayen, <<Ni jam, ate ti sɛ tɛŋ a te tidek ate ka ta kiari a jueli wenŋmazuk. Ate ti nye yuei a te tidek ate ti kan waaŋ tɛŋka meena zuwa.>>
5Alege Naawen a yaa siŋ nya tɛŋ nummu ale kiani ate saalɔ bisaŋa a sɛ la. 6Naawen a yaa weeni ayen, <<Ba dan chim nuru yeŋsa a biisi bi yeŋ a yaa piilim a nye nna, wari ka ate ba dan zɔk ayen ba nye di tua te ba. 7Ni jam, ate ti siŋ tɛŋ a butim ba biika ate ba kaa miŋ chaaba.
8Dila nyiŋ Naawen a yaa basi ate ba waaŋ chaab tɛŋka meena zuk ate ba basi tɛŋka sɛka. 9Dila ale soa ate ba jam a wi ka ayen Babel la. Ku kiri ale Naawen a butim tɛŋka meena biika. A nyini dula jigini Naawen a basi ate ba waaŋ tɛŋka meena zuk.
10Sɛm wie ale nna. Nyiamu ale jam lik tɛŋka la ku bena ŋaye ŋaaŋnyiŋ Sɛm yaa jam ka bena kook. Wa jam biak Afakasad. 11Wa le biak Afakasad la ŋaaŋnyiŋ wa nya ka bena kobsinu. Wa ŋman jam biak ka nidoabilisa ale lieba.
12Afakasad nya ka bena pisita ale ŋanu ale biak Sɛla. 13Wa le biak Sɛla la ŋaaŋnyiŋ, wa nya ka bena kobsinaansi ale ŋata. Wa jam biak ka nidoabilisa ba chaab ale lieba.
14Sɛla ale nya bena pisita la wa yaa biak Eber. 15Wa le biak Eber la wa goa ka bena kobsinaansi ale ŋata. Wa jam biak ka nidoabilisa ba chaab ale lieba.
16Eber ale nya bena pisita ale ŋanaansi la wa yaa biak Peleg. 17Wa le biak Peleg la wa goa ka bena kobsinaansi ale pisita. Wa jam biak ka nidoabilisa ba chaab ale lieba.
18Peleg ale nya bena pisita la wa yaa biak Areu. 19Peleg ale biak Areu la wa goa ka bena kobsiye ale neok. Wa jam biak ka nidoabilisa ba chaab ale lieba.
20Areu ale nya bena pisita ale ŋaye la wa yaa biak Serug. 21Wa le biak Serug la wa goa ka bena kobsiye ale ŋayopɔi. Wa jam biak nidoabilisa ba chaab kama ale lieba.
22Serug ale nya bena pisita la, wa yaa biak Nayo. 23Wa le biak Nayo la wa goa ka bena kobsiye. Wa jam biak nidoabilisa ba chaab kama ale lieba.
24Nayo ale nya bena pisiye ale neok la wa yaa biak Tɛra. 25Wa le biak Tɛra la wa goa ka bena kook ale pi ale neok. Wa jam biak nidoabilisa ba chaab kama ale lieba.
26Tɛra ale nya bena pisiyopɔi la wa yaa biak Abram ale Nayo ale Yaran.
27Tɛra wie ale nna. Tɛra jam ka Abram ale Nayo ale Yaran ko. Ate Yaran a jam chim Lɔti ko. 28Ba kowa Tɛra a jam diem boro kama alege ate Yaran a kpi Ur ale bo Kaldiya po la ate ba biak wa. 29Abram ale Nayo meena jam faari nipooba kama. Abram powa yuei jam le Sarai. Nayo powa mɛ yuei jam le Milka. Wa jam ka Yaran lie. Yaran jam ka Milka ale Iska ko. 30Sarai abe jam ka kirik. Wa jam ka bisa.
31Tɛra yaa pai wa nidoabinni Abram ale wa ŋaaŋka Lɔti, Yaran nidoabinni ale wa sampowa Sarai, Abram powa. Ba meena yaa basi Ur ale bo Kaldiya po la ayen ba cheŋ Keenan. Alege ba le jam paari Yaran la, ba yaa kali dula.
32Tɛra a goa ka bena kobsiye ale ŋanu alege kpi Yaran tɛŋka.",https://www.bible.com/bible/2176/GEN.11.BWU
PIILIMKA 12,"1Naawen a jam weeni Abram ayen, <<Basi fi tɛŋka, ale fi nuruma, ale fi kowa dɔkdemma abe fi cheŋ tɛŋ kaai ate mi ale dak a sak fu la.
2<<M le basi ate fi chim tɛŋ kpieŋ abe m niak fu, m le basi ate fi yuenni a yiti ate fi chim niauŋ. 3M le niak baai ale a niak fu la, abe waai ale ka a te fu la m le ka a te wa. Tɛŋzuk nuruma meena ale nya niauŋ fi nyiŋ.
4Dila nyiŋ Abram yaa basi dula ase Naawen ale weeni diila. Lɔti jam maa va wa kama a cheŋ. Abram jam ka bena pisiyopɔi ale ŋanu alege basi Yaran tɛŋka. 5Abram yaa pai wa powa Sarai ale wa suoku nidoabinni Lɔti, ale ŋan baai ate ba jam tigsi ta la ale nuru baai meena ate wa nya Yaran la, a yaa basi Yaran ayen ba cheŋ Keenan. Ba yaa jam ga paari du.
6Abram jam cheŋ kama a ga paari More ti kpiemu ale bo Sikiim la. Dila po Keenan demma a jam bo tɛŋka po kama. 7Naawen yaa pai wadek a sak Abram, a yaa weeni wa ayen, <<M le pai tɛŋka de a te fi ŋaaŋbisaŋa.>> Wa yaa sɛ kuŋkuŋ dula a te Naawen dii ale pai wadek a sak wa la.
8Wa yaa nyini dula a va guutaŋa jigini Betel kori geŋsa a ga ti wa viuku, ate Betel a bo yeniŋ geŋsa alege Ai a bo kori geŋsa. Dula jigini wa yaa sɛ kuŋkuŋ a te Naawen, a yaa wi Naawen yuenni. 9Abram ŋman basi dula ale cheŋ va Negev geŋsa.
10Yɔgyɔgla de kɔm ale jam bo tɛŋka po, ate Abram a cheŋ Ejipiti ayen wa bo dula maga diila kɔmmu a jam pagra kama. 11Ba le jam moata Ejipiti tɛŋka la, wa yaa weeni wa powa Sarai ayen, <<Mi seba fi ale ka nipok naliŋ diila kama. 12Ejipiti demma a dan nya fu, ba le weeni ayen, <Nya wa pok ale nna.> Ba le ko mu alege basi ate fi boro. 13Ba dan bek weeni ayen fi ka mi toa ate ba nye mu magsi fi nyiŋ. Dila mɛ ba kan ko mu fi nyiŋ.>>
14Abram ale ga paari Ejipiti la, Ejipiti demma a yaa nya ayen nipowa a ŋmasi nala ka yega. 15Faaro nisɔmma a yaa nya nipowa a paali wa wie a sak Faaro, ate ba ta wa jo naawa yenni po. 16Wa jam nye Abram a magsi kama nipowa nyiŋ ate Abram paari piisa ale niiga ale bon duata ale bon niima, yɔm nidoaba ale nipooba ale laalaakomiba.
17Alege Naawen yaa basi ate nyiŋtui kpiema a yik Faaro ale wa yenni demma Abram powa Sarai nyiŋ. 18Faaro yaa wi Abram ayen, <<Ka boan le la ate fi nye mu?>> Wa ŋman weeni ayen, <<Ka boa ale soa ate fi an weeni mi ayen wa ka fi powa? 19Ka boa ale soa ate fi weeni ayen, wa ka m toa, ate mi yaa pai wa chim m powa? Yɔgyɔgla de fi powa ale nna. Ta wa cheŋ.>> 20Faaro yaa weeni wa nuruma ate ba te ti Abram a cheŋ ale wa powa ale wa ŋantaŋa meena ate wa ta la.",https://www.bible.com/bible/2176/GEN.12.BWU
PIILIMKA 13,"1Abram yaa basi Ejipiti alege cheŋ Negev ale wa powa ale jaabuuri meena ate wa jam ta la. Lɔti mɛ jam va wa kama a cheŋ. 2Abram jam jigsi kama ale duŋsa ale kpana ale ligmɔniŋ.
3Wa jam zaani Negev kama a cheŋ de ale de a yaa ga paari Betel kauk kuui ale bo Betel ale Ai suŋsuŋ la. Dula ale wa jam liŋ ti wa viuku la. 4Dula mɛ ale wa liŋ a sɛ kuŋkuŋku la. Dula jigini Abram yaa wi Naawen yuenni.
5Lɔti ale jam va Abram nyiem a cheŋ la a jam ta piisa ale niiga ale viita kama. 6Alege tɛŋka an jam soa dii ate ba meena a bo du ale chaaba. Ba ŋantaŋa jam zuak ka nna yegayega ate ba an baga a bo ale chaaba. 7Kpaliŋ ale jam bo baai ale a nya Abram duŋsaŋa zuk la ale baai ale a nya Lɔti duŋsaŋa zuk la suŋsuŋ. Keenan demma ale Perizzi demma mɛ jam maa bo ka tɛŋ kala dila po.
8Abram yaa jam weeni Lɔti ayen, <<Kan te ti kpaliŋ a bo mi ale fi suŋsuŋŋa yaase baai ale a nya mi duŋsaŋa zuk la ale fi duŋsaŋa zuk la suŋsuŋŋa, diila ti ka suata. 9Tɛŋka an doa daa mi ale fi meena niŋŋa? Basi ate ti gaari chaab. Fi dan cheŋ gala, mi ale cheŋ juga, fi be dan cheŋ juga, mi ale cheŋ gala.>>
10Lɔti yaa zak zuk nya Jodan ale dua dii jassi ale yɔk a nye ase Naawen tiisa jigi la. Ku jam a nye ase ka Ejipiti tɛŋka la a tuak Zoar. Ku le jam ka dii alege ate Naawen a kaasi Sodom ale Gomora tɛŋsaŋa la. 11Lɔti yaa lueri Jodan meena ale dua jassi la a te wadek a va kori geŋ. Nuruba bayewa yaa jam poori chaab. 12Abram jam bo ka Keenan tɛŋka alege Lɔti jam bo tɛŋ sii ale jam dua nna jassi la a ti wa viitaŋa a moata Sodom. 13Yɔgyɔgla de Sodom nuruma nyeka jam tua kama ale a nye biem nna yegayega a kaasi Naawen.
14Abram ale Lɔti ale poori chaab la ŋaaŋnyiŋ, Naawen yaa weeni wa ayen, <<Kauk kuui ate fi za la zak zuk a nya wiiluk geŋ ale yeseok geŋ ale kori geŋ ale yeniŋ geŋ. 15Tɛŋka meena ate fi a nya la m le pai te fi ale fi ŋaaŋbisaŋa taam wuu. 16M le basi ate fi ŋaaŋbisaŋa a piisi ase tintain busuŋ la, ate waai a dan baga a chiini tintain busuŋku, wa le baga a chiini fi ŋaaŋbisaŋa. 17Cheŋ, cheŋ tɛŋka woglim ale ka labsimu meena, diila m pai a te fu kama.>>
18Dila nyiŋ Abram yaa torisi wa viitaŋa a cheŋ moata Mamre ale bo Yebron la tiib kpieŋsaŋa jigini. Dula jigini, wa yaa sɛ kuŋkuŋ a te Naawen.",https://www.bible.com/bible/2176/GEN.13.BWU
PIILIMKA 14,"1Dila po Sinar naawa Amrapel ale Ellasar naawa Ariok ale Iilam naawa Chedorlaomer ale Goyim naawa Tidal, 2yaa cheŋ ba nye kpaliŋ ale Sodom naawa Bera ale Gomora naawa Birsa ale Adma naawa Sinab ale Zeboiim naawa Sɛmeber ale Bela naawa. Zoar jam le la. 3Nalimaŋa de ate ba siti la, jam tigsi ka chaab Siddim Viaka po, Yesa Nyakpiemu le la. 4Bena pi ale ŋaye nalimaŋa de jam siak te Chedorlaomer kama, alege bena pi ale ŋatawa po ba zɛri wa nɔi.
5Bena pi ale ŋanaansiwa po, Chedorlaomer ale nalimaŋa yaa nye nɔiyeŋ a cheŋ ga nak dɛ Arefa demma ale bo Asterot Karnaim la ale Zuzi demma ale bo Yɛm la ale Emi demma ale bo Saveya Kiriataim la 6ale Yori demma ale bo Seir ate ka ta guuta la, a ta ga paari El Paran ale moata gɔnni la. 7Ba yaa ŋman viriŋ ŋaaŋ a cheŋ En Mispat yaase Kades, a nak dɛ Amalek demma tɛŋsaŋa meena ale Amori demma ale jam bo Yazazon Tamara la.
8Ate Sodom naawa ale Gomora naawa ale Adma naawa ale Zeboiim naawa ale Bela yaase Zoar naawa a yaa gɔk santiri a ga tom chaab bari zaani a magsi kpaliŋ Siddim Viaka po. 9Ayen ba siti Iilam naawa Chedorlaomer ale Goyim naawa Tidal ale Sinar naawa Amrapel ale Ellasar naawa Ariok. Nalima ŋanaansi ale ta chaab ale nalima ŋanu. 10Siddim Viaka jam ta ka gola ate ŋa sueri ale kotaali. Sodom ale Gomora nalimaŋa ale jam a chali la, nuruma gela yaa lo ŋa po alege nuru mbala chali jueli guutaŋa zuima. 11Nalima ŋanaansiwa yaa vari Sodom ale Gomora kɔlimaŋa meena ale ba ŋandiintaŋa meena a ta cheŋ. 12Ba jam ta Abram suoku nidoabinni Lɔti ale wa ŋantaŋa a cheŋ kama. Wa le tɔlim jam bo Sodom la.
13Ba wanyi ale jam chali bɛ yaa jam weeni dii le nye la a sak Yiburu denɔwa Abram. Abram le jam bo juijui la a moata ka Mamre, Amori denɔwa tiib kpieŋsaŋa. Mamre jam ka Eskol ale Aner suok. Bala meena jam nye ka nɔiyeŋ ale Abram. 14Abram le wom ayen wa suoku nidoabinni ba yik ta cheŋ la, wa yaa wi nuruma kobsita ale pi ale naanika ate ba biak ba wa yenni po a sak ba la a nyini ta ba a ga paari Dan. 15Yɔkku Abram yaa poori wa nuruma a siti ba a vi a nak ba dɛ. Wa vi ba ga paari ka Yoba, Damasikus wiiluk geŋsa. 16Wa tuesi wa suoku nidoabinni Lɔti ale wa ŋantaŋa meena ale nipooma ale nuru yontaŋa.
17Abram ale nak Chedorlaomer ale nalimaŋa ale nye nɔiyeŋka ale wa a dɛ la, Sodom naawa a yaa nyini ayen wa tu wa Saveya Viaka po. Viaka jam ka Naawa Viak le la.
18Salem naawa Melekizedek yaa ta boroborok ale daam a nyini. Wa jam ka Wen Dii Ale Bo Wenŋmazuk La kaabteerɔ. 19Ate wa yaa niak Abram ayen, <<Wen Dii Ale Bo Wenŋmazuk La a niak Abram, wa ka waai ale nye wenzuk ale tɛŋ. 20Abe niauŋ a bo Wen Dii Ale Bo Wenŋmazuk La jigi, wa ka waai ale pai fi dachaasaŋa a nyo fi nisima po.>> Abram yaa pai wa ŋantaŋa piika po bunyi a te wa.
21Sodom naawa yaa weeni Abram ayen, <<Te mu nuruma abe fi tanla kɔlimaŋa fidek.>>
22Alege Abram a weeni Sodom naawa ayen, mi zak ka nisa a sak Naawen, Wen Dii Ale Bo Wenŋmazuk La, a nye wenzuk ale tɛŋ la alege a pɛ, 23ayen mi kan tuesi jabuui ale ka fi jaab la, daa garuk miik yaase nuensiri gbain mɛ, ate fi kan baga a weeni ayen fi ale basi ate Abram jigsi. 24M kan siak a tuesi jaab fi jigiya alege ka mi nuruma ale dɛ ŋan baai la ale nuru baai ale va mu cheŋ la charuku. Bala ale Aner ale Eskol ale Mamre. Bala tuesi ba charuku.>>",https://www.bible.com/bible/2176/GEN.14.BWU
PIILIMKA 15,"1Kude ŋaaŋnyiŋ Naawen wanni yaa jam Abram jigi ase gɔdaasima la ayen, <<Abram, kan chali yɔgsummoa. Mi ka waai ale a lik fu, a chim fi tutun kpiema. >>
2Alege Abram yaa weeni ayen, <<M Nyɔnɔwa waai ale ka Naawen la, fi le te mu ka boa mi ale kan ta biik nna? Waai ale wa pai m nitalimu la ale Ɛlieza ale nyini Damasikus la.>> 3Abram weeni ayen, <<Fi an te mu bisa. Dila nyiŋ m yenni po yɔmma wanyi ale wa pai m nitalimu.>>
4Ate Naawen wanni yaa jam Abram jigi ayen, <<Nuruwa de a kan pai fi nitalimu alege ka nidoabi dii ale wa chim fidek ziim la ale wa pai fi nitalimu.>> 5Naawen yaa ta wa nyini peelim a weeni ayen, <<Zak zuk a nya wenŋmazuk a chiini chiŋmarisaŋa, fi dan baga a chiini si.>> Wa yaa weeni wa ayen, <<Fi ŋaaŋbisaŋa le piisi ka dila.>>
6Abram yaa ta siaka ale Naawen, ate wa a wi wa ayen wayɔrisima nyɔnɔ.
7Wa ŋman weeni wa mɛ ayen, <<Mi ka Naawen, mi ale ta fu nyini Ur, Kaldiya demma tɛŋka a nyini ayen m te fu tɛŋka de ate fi soa.>>
8Alege Abram a weeni ayen, <<M Nyɔnɔwa waai ale ka Naawen la, mi ale nye ka sɛ a seba ayen m le tuesi tɛŋka de a soa?>>
9Naawen yaa weeni Abram ayen, <<Ta bena ŋata naasari ale bena ŋata buuk ale bena ŋata padiak a jam. Maa ta nangbaŋ takuriŋ ale nangbaŋ kawuruk a jam.>>
10Abram yaa ta ŋantaŋa de meena a jam wa jigi, a gebi ŋa gela buye a yaa pai dueni a tuk chaab. Alege nangbaŋsaŋa wa an gebi ya. 11Nuin sii ale a dɛ lanta la a yaa jam lantaŋa zuk, alege Abram a yiak ti si yiti cheŋ.
12Wenni ale a siŋ la goom yaa chiak Abram nna vilim, ate legi nna kpitɔ yaa jam Abram zuk. 13Naawen yaa weeni Abram ayen, <<Sebi chak ayen fi ŋaaŋbisaŋa ale chim ka nicham tɛŋ kaai ale kan daa ba tɛŋ la po. Ba le tom ba yɔntidi abe ba kan nye ba a magsi ate ku paari bena kobsinaansi. 14Alege m le namsi tɛŋ kaai ate ba tom a te ba ase yɔm la, ate ku ŋaaŋnyiŋ ba yaa nyini tɛŋka po a nyini ale ŋanta yegayega. 15Alege fidek, ale kpaŋ a kpi ate ba gu fu ate fi cheŋ fi koma jigi ale suiyɔgni. 16Fi ŋaaŋbiik sii ale a saari bunaansiwa la ale ŋman jam de la, diila Amori demma biemu an diem zuak ya.>>
17Wenbinni ale siŋ la ate tɛŋka a sob la, samɔniŋ ale nyuisa ale bolim ŋiak a yaa jam va lam gelaŋa suŋsuŋ a taam. 18Dai dila danni Naawen yaa nye nɔiyeŋ ale Abram ayen, <<M le pai tɛŋka de a te fi ŋaaŋbisaŋa a zaani Ejipiti benni a ga paari beli kpienni Yufiretis. 19M le pai Ken demma ale Kenizzi demma ale Kadmon demma 20ale Yit demma ale Perizzi demma ale Arefa demma, 21ale Amori demma ale Keenan demma ale Girgas demma ale Jebus demma tɛŋsaŋa a te ba.>>",https://www.bible.com/bible/2176/GEN.15.BWU
PIILIMKA 16,"1Yɔgyɔgla de Abram powa Sarai an jam biak bisa a te wa. Alege wa jam ta ka dɔklie ate wa nyini Ejipiti. Wa yuei jam le Aga. 2Wa yaa weeni wa chorɔwa Abram ayen, <<Naawen a kasi mu kama ale bisa biam. Be goa ale m dɔkliewa ate m nya dɔkdem a nyini wa jigi.>> Abram yaa siak wa powa Sarai ale weeni diila. 3Abram le bo Keenan tɛŋka bena pi la ŋaaŋnyiŋ, wa powa Sarai yaa pai wa dɔkliewa Ejipiti denɔwa Aga a te wa chorɔwa ayen wa chim wa pok. 4Wa yaa goa le Aga ate wa yik lɔgi. Wa le miŋ ayen wa yik lɔgi la, wa kan ŋman nye wa mawa Sarai a magsi. 5Sarai yaa weeni Abram ayen, <<Fi ale soa kaasuŋ kuui ate mi a namu nna. M pai m dɔkliewa a nyo fi nisima po, ate yɔgyɔgla de wa yaa le nya le wa ta lɔgi la wa kan nye mi a magsi. Naawen a bo mi ale fi buusa.
6Abram yaa weeni ayen, <<Fi dɔkliewa a bo fi nisima po. Dii ate fi a poli ayen ku nala magsi fi nye wa la, be nye.>> Sarai yaa jam kan nye Aga a magsi, ate wa chali ale ge wa.
7Naawen maarɔ yaa nya Aga ale wa kali moata bulik gɔnni po. Ka ka bulik kaai ale jam bo suik kuui ale a cheŋ Sur la nakpiak. 8Ate maarɔwa yaa bek wa ayen, <<Aga, Sarai dɔkliewa fi nyini ka bɛ a jam, fi be a cheŋ ka bɛ?>> Wa yaa tulisi ayen, <<M chali ale a ge ka m mawa Sarai.>>
9Naawen maarɔwa yaa weeni ayen, <<Ŋman cheŋ fi mawa jigi a siak te wa.>> 10Maarɔwa ŋman weeni a gum du ayen, <<M le basi ate fi ŋaaŋbisaŋa a piisi a gaam taam ale chiinika.>>
11Naawen maarɔwa ŋman weeni mɛ ayen, <<Yɔgyɔgla de fi ta ka lɔgi fi be le biak nidoabili a te wa yuei ayen Ismael, diila Naawen a wom fi le a tɔk fi niniŋŋa la kama. 12Fi biika a za wa a nye ase ka boniŋ kaai ale waara, wa le zak nisa ta chaab le waai meena, abe waai meena zak nisa ta chaab le wa, ate wa ta dachaani ale wa suataŋa meena.>>
13Ate wa yaa pai yuenni de a te Naawen dii ale biisi le wa la ayen, <<Fi ka Wen dii ale a nya mu.>> Wa weeni kama ayen, <<Yɔgyɔgla de mi nya Waai ale a nya mi la.>> 14Dila ale soa ate ba a wi vinni ayen, Beer Layai Aroi. Di diem bo ka Kades ale Bered suŋsuŋ po.
15Aga yaa biak nidoabili a te Abram, ate Abram te wa yuei ayen Ismael. 16Abram jam ka bena pinaanuŋ ale ŋayuebi ale ge ate Aga a biak Ismael la.",https://www.bible.com/bible/2176/GEN.16.BWU
PIILIMKA 17,"1Abram ale jam nya bena pineok ale neok la, Naawen yaa pai wadek a sak wa a weeni ayen, <<Mi ka Wen Dii Ale A Niak La, a cheŋ ale mu abe fi kan ta nye kaasuŋŋoa. 2M le basi ate fi ŋaaŋbisaŋa a piisi ate nɔiyeŋ kaai ate mi ale fi nye la a chim wensie.>>
3Abram yaa koori a pai diri a kpi tɛŋ, ate Wen weeni wa ayen, 4<<Dan ka mi tɔga, mi ale fi nɔiyeŋka ale nna. Fi le chim tɛŋsa yega ko. 5Ba kan ŋmaa wi fu ayen Abram. Fi yuenni yaa le chim ka Abrayam. Diila m basi kama ate fi chim tɛŋsa yega ko. 6M le basi ate biam jam fi jigi. Tɛŋsa ale nyini fi jigi ate nalima mɛ a nyini fi jigi. 7M le basi ate m nɔiyeŋka a chim nɔiyeŋ kaai ale kaa kpeglim mi ale fi ale fi ŋaaŋbisaŋa suŋsuŋ la. Ka le kasim boro kama ale fi ŋaaŋ sii ale cheen la. M le chim fi Wen ale fi ŋaaŋsaŋa Wen. 8Keenan tɛŋka meena ate fi boro yɔgyɔgla de a chim nichaanɔ nna, m le basi ate ka chim fi ale fi ŋaaŋbisaŋa tɛŋ kasim a cheŋ. M le chim ba Wen.>>
9Wen yaa weeni Abrayam ayen, <<Ku a fɛ kama ayen fi ale fi ŋaaŋsaŋa a ta m nɔiyeŋka a magsi baai meena ale bo ŋaaŋ a cheen la. 10Mi nɔiyeŋka ale fi ale fi ŋaaŋbisaŋa ale bo ŋaaŋ la ale nna. Nɔiyeŋ kaai ale magsi ni ta la. Nidoa meena ale bo ni po la a gebi wa yoari. 11Ni gebi ni yoaŋa ate ku a sak nɔiyeŋka ale bo mi ale fi suŋsuŋ la. 12Fi buuni po meena ale bo ŋaaŋ cheena la, nidoa meena a dan nya daa naaniŋ ba gebi wa yɔnni, ale baai ate ba biak fi dɔkku po yaase ba da nichaanɔ ale ligra. Baai ale poom kan daa fidek bisa la. 13Ba da ba ale ligra yaase ba biak ba fi dɔkku po, ku a fɛ kama ayen ba gebi ba yoaŋa. Mi nɔiyeŋka ale bo ni nyiŋ lammu nyiŋla ka nɔiyeŋ kaai ale kan ta kpeglimka. 14Nidoa waai ale kan gebi wa yoari, ate nyiŋ gbaŋka an gebi la a kan maara bo wa nuruma po, diila wa kaasi nɔiyeŋka kama.>>
15Wen ŋman weeni Abrayam ayen, <<Fi powa Sarai, kan ŋman wi wa ayen Sarai, wa yuei yaa le Saara. 16M le niak wa, abe m basi ate wa biak nidoabili a te fu. M le niak wa ate wa chim tɛŋsa ma, wa le biak nuruba nalima.>>
17Abrayam yaa koori a pai diri a kpi tɛŋ, a yaa la ale weeni wadek ayen, <<Bena kook nuru ale baga a biak nidoabili a te wa dega? Saara ale ta bena pineok la ale biak biiga?>> 18Ate Abrayam yaa weeni Wen ayen, <<Be basi ate Ismael a nya fi niaka.>>
19Wen yaa weeni Abrayam ayen, m siak ya, alege fi powa Saara ale biak nidoabili ate fi te wa yuei ayen Aizik. M le basi ate mi ale wa nɔiyeŋka a zaani ate ka chim nɔiyeŋ kaai ale kaa kpeglim a te wa ŋaaŋbisaŋa ale bo wa ŋaaŋ cheen la. 20Alege Ismael jigi, m wom fu kama. M le sum niak wa. M le basi ate wa ta kiri abe m basi ate wa ŋaaŋbisaŋa piisi. Wa le chim kpaga pi ale ŋaye ko abe m basi ate wa chim tɛŋ kpieŋ. 21Alege m nɔiyeŋka m le basi ate ka zaani ale Aizik, waai ate Saara a za wa biak a te fu bali benni nna po de la.>> 22Wen ale biisi ale Abrayam nueri la, wa yaa jueli wen ale ge wa.
23Dai dila danni dek Abrayam yaa yik Ismael ale baai ate ba biak wa dɔkku po a le baai ate wa da ale ligra la, nidoa meena wa dɔkku po a gebi ba yoaŋa ase Wen ale weeni diila. 24Abrayam jam ka bena pineok ale neok ale gebi wa yoanni. 25Wa nidoabinni Ismael jam ka bena pi ale ŋata. 26Abrayam ale wa nidoabinni Ismael a jam gebi ba yoaŋa ka da dila dek. 27Nidoa meena Abrayam dɔkku po, ale baai meena ate ba biak wa dɔkku po la ale baai ate wa da nichaanɔ ba jigi la jam gebi kama ale wa.",https://www.bible.com/bible/2176/GEN.17.BWU
