Title,Content,URL
MOSE I 18,"Yehowa, ɖe eɖokui fia Abraham.
1Eye Yehowa ɖe eɖokui fiae le Mamre ƒe ati gãwo gbɔ, le esime wòbɔbɔ nɔ eƒe agbadɔ nu le ŋdɔ me. 2Esi wòfɔ mo te la, kasia ekpɔ ŋutsu etɔ̃ le tsitre le eŋgɔ ɖa; eye esi wòkpɔ wo ko la, eƒu du tso eƒe agbadɔ nu yi ɖakpe wo, eye wobɔbɔ tsyɔ mo anyi. 3Tete wògblɔ bena; Aƒetɔ, ne eve nunye la, ekema megato wò dɔla ŋu yi o. 4Woaku tsi via ɖe ve, ne miaklɔ miaƒe afɔwo ŋuti; emegbe la miagbɔ ɖe eme vie, 5eye matsɔ abolo via ɖe vɛ, ne míado ŋusẽ mia ɖokui hafi adzo; elabena esia ta mieva to miaƒe dɔla gbɔ ɖo. Eye woxɔ dzi bena: Wɔ, abe alesi negblɔ ene! 6Tete Abraham ƒu ɖu yi ɖe Sara gbɔ le agbadɔ me, eye wògblɔ nɛ bena: Wɔ kaba, ku wɔ memee asiʋlo etɔ̃a ɖe, nablui, eye natsɔe atɔ tatalii. 7Eye Abraham ƒu ɖu yi ɖe nyiwo dome, eye wòlé nyivi nyuia ɖe tsɔ na eƒe dɔla wòɖawu enumake, eye wòmee wòbi nyuie. 8Eye wòtsɔ notsi kpekẽtɔ kple notsi tsrolotɔ hekpe ɖe nyilã memee la ŋu va ɖo wo kɔme; ke eya ŋutɔ tsitre ɖe wo gbɔ le atia te, esime wole nua ɖum.
Yehowa gado Isak ŋugbe na Abraham.
9Eye wògblɔ nɛ bena: Afika srɔ̃wò Sara le? Eɖo ŋu bena: Ele agbadɔ me. 10Eye wògblɔ nɛ bena: Le ƒe, si gbɔna ƒe woalewoɣi la, magatrɔ ava gbɔwò, eye ŋutsuvi anɔ srɔ̃wò Sara si. Ke Sara le agbadɔ nu le emegbe le esem. 11Eye Abraham kple Sara wotsi xɔ ƒe geɖe ŋutɔ, ale bena Sara megaléa gbe gɔ̃ hã o. 12Tete Sara ko nu ɖe dɔ me gblɔ bena: Esi metsi lé ayi ale la, ɖe nu agavivi nunyea? Eye ye aƒetɔ hã ku amegã ɖeɖi! 13Tete Yehowa gblɔ na Abraham bena: Nukaŋuti Sara le nu kom le susum bena: Nye amesi ku nyagã la, magate ŋu adzi via? 14Ɖe nane sesẽ na Yehowa? Le ƒe, si gbɔna ƒe woleawoɣi la, magato ava gbɔwò, eye ŋutsuvi anɔ Sara si. 15Tete Sara sẽ nu gblɔ bena: Nyemeko nu o; elabena ele vɔvɔ̃m. Ke egblɔ ne bena: O, èko nu tso!
Sodom gbegblẽ gbɔgblɔɖi.
16Esia megbe la ŋutsuawo dze mɔ tso afima, eye wokpɔ Sodom le abu me ɖa; ke Abraham yi kpli wo, be yeaɖo wo ɖa. 17Eye Yehowa gblɔ bena: Ɖe maɣla nusi wɔ ge mala la, ɖe Abraham, 18esi wònye Abraham ava nye dukɔ gã sẽŋua ɖe, eye woayra anyigba dzi dukɔwo katã le eme laa? 19Elabena metiae, bena wòade se na emegbeviwo kple eƒe me katã bena, woalé ŋku ɖe Yehowa ƒe mɔ ŋuti, eye woawɔ nu dzɔdzɔe kple nu nyui, bena ne nusi ŋugbe Yehowa do la, nava me na Abraham. 20Tete Yehowa gblɔ bena: Dodo ɖe Sodom kple Gomora ta sɔ gbɔ akpa, eye woƒe dzidadawo tso me akpa. 21Eyata maɖi ayi, ne makpɔ bena, nya, siwo katã sem mele le wo ŋuti la, le eme loo, alo mele eme o, ne manya.
Abraham ɖo kuku ɖe Sodom ta.
22Esia megbe la ŋutsuawo trɔ yi Sodom; ke Abraham gatɔ ɖe Yehowa gbɔ ko. 23Eye Abraham te ɖe eŋu gblɔ bena: Ɖe atsrɔ̃ ame dzɔdzɔewo kple ame vɔ̃ɖiwo siaa mahã? 24Ɖewohi ame dzɔdzɔe blaatɔ̃ anɔ dua me; ɖe àtsrɔ̃e, eye màtsɔe ake teƒe la le ame dzɔdzɔe blaatɔ̃, siwo le eme la ta o mahã? 25Esia nede megbe xaa tso gbɔwò be, nagawu ame dzɔdzɔe kple ame vɔ̃ɖi siaa zi ɖeka, eye ame dzɔdzɔe nanɔ abe ame vɔ̃ɖi ene o! Esia nede megbe xaa tso gbɔwò! Ɖe xexeame ƒe ʋɔnudrɔ̃la madrɔ̃ ʋɔnu dzɔdzɔe oa? 26Yehowa ɖo ŋu nɛ bena: Ne makpɔ ame dzɔdzɔe blaatɔ̃ le Sodom-dua me la, ekema màtsɔe ake teƒe blibo la le woawo la. 27Abraham xɔ dzi gblɔ bena: Kpɔ ɖa, nye amesi nye anyi kple afi ko la, meɖo dzi be, maƒo nu kpli wò, Aƒetɔ! 28Ɖewohi ame atɔ ato le ame dzɔdzɔe blaatɔ̃ me; le ame atɔ ta la, ɖe atsrɔ̃ ɖu blibo la katã mahã? Eɖo ŋu be: O, ne makpɔ ame blane vɔ atɔ̃ le eme la, nyematsɔe o. 29Eye wògayi dzi ƒo nu kplii gblɔ bena: Ɖewohĩ woakpɔ ame blane le eme. Eɖo ŋu be: Le ame blane ta nyemawòe o. 30Eye wògblɔ bena: Aƒetɔ, megabi dzi be, megale nu ƒo ge o loo! Ɖewohi woakpɔ ame blaetɔ̃ le eme. Eɖo ŋu nɛ bena: Ne makpɔ ame blaetɔ̃ le eme la, nyemawɔe o. 31Eye wògblɔ nɛ bena: Kpɔ ɖa, medo dzi be, maƒo nu kpli wò Aƒetɔ. Ɖewohi woakpɔ ame blave le eme. Eɖo ŋu nɛ be: Le ame blave ta nyematsrɔ̃ wo o. 32Eye wògblɔ be: Aƒetɔ, megabi dzi o loo, ne magaƒo nu zi ɖeka pɛ ko. Ɖewohĩ woakpɔ ame ewo le eme. Eɖo ŋu nɛ be: Le ame ewo ta nyematsrɔ̃ wo o. 33Ke esi Yehowa wu nuƒoƒo kple Abraham nu la, edzo; eye Abraham hã trɔ yi aƒe.",https://www.bible.com/bible/2259/GEN.18.EWERV
MOSE I 19,"Sodomtɔwo ƒe nu tovo wɔwɔ.
1Mawudɔla eveawo va ɖo Sodom le fiẽ me, eye Lot bɔbɔ nɔ Sodom gbɔ nu. Ke esi Lot kpɔ wo la, etsi tre yi ɖakpe wo, eye wobɔbɔ tsyɔ mo anyi. 2Eye wògblɔ bena: Oo, nye aƒetɔwo, mitrɔ va dze miaƒe dɔla gbɔ, ne míatsi adɔ, eye miaklɔ miaƒe afɔwo ŋu; etsɔ ŋdi kanya hafi miagadze miaƒe mɔ dzi. Ke woɖo ŋu ne bena: O, míatsi dugbɔdzi le ablɔ me adɔ boŋ. 3Eye esi wòƒoe ɖe wo nu ʋuu la, wòtrɔ va dze eƒe me. Eye wòto tatali heɖo kplɔ̃ na wo, eye woɖu nu. 4Ke esi womekpɔ mia anyi haɖe o la, Sodom ŋutsuwo, ɖekakpuiwo kple ame tsitsiwo, keke dua ƒe mlɔenutɔwo ke hã va, eye woɖe to ɖe aƒe la. 5Tete wodo ɣli yɔ Lot gblɔ bena: Afika ŋutsu, siwo va gbɔwò egbe fiẽ la le? Kplɔ wo do go va mía gbɔe, ne míanya wo. 6Eye Lot do go yi wo gbɔ le agbo la godo, eye wòtu ʋɔ ɖewo nu. 7Eye wògblɔ bena: Nɔvinyewo, migawɔ nu baɖa o! 8Míkpɔ ɖa, vinyenyɔnu eve li, amesiwo medo ŋutsu gbɔ kpɔ o, makplɔ wo vɛ na mi, ne miawɔ nusi mielɔ̃ la, ɖe wo ŋu faa; ɖeko migawɔ nu baɖa ɖe ŋutsu siawo ŋu o, elabena esiata wova dze gbɔnye ɖo. 9Eye wodo ɣli ɖe eta gblɔ bena: Te ɖa afia! Wò amedzro ɖeka hã sia, si va dze mía gbã la, nanɔ ɖokuiwò wum amegãe alea? Azɔ la miawo vo ɖe wòa ŋuwò wu woawo gɔ̃. Eye wonyẽ zi ɖe Lot dzi gbidigbidi, be yewoagbã ʋɔa. 10Ke ŋutsuawo do abɔ ɖa he Lot va wo ɖokui gbee le aƒea me, eye wotu ʋɔa. 11Eye wotsɔ ŋkuagbã ƒo ŋutsu, siwo le xexe le ʋɔtrua nu, ɖeviwo kple ame tsitsiwo siaa, ale bena ɖeɖi koe te wo ŋu dzodzro le ʋɔtrua nu didi me.
Lot ɖeɖe.
12Eye ŋutsuawo gblɔ na Lot bena: Amea ɖewo gale asiwò le afisia? Kplɔ towòwo kple viwònyɔnuwo kple tɔwo to, siwo katã le dua me la, do go tso teƒe sia. 13Miele teƒe sia tsrɔ̃ ge, elabena dodo ɖe wo ta ɖi ɖe Yehowa ƒe to me; eyata Yehowa ɖo mí ɖa, bena míatsrɔ̃e. 14Tete Lot do go yi ɖagblɔe na toa, siwo le vianyɔnuwo ɖe ge la bena: Mitso, ne míado le ɖu la me, elabena Yehowa le etsrɔ̃ ge! Ke toawo bui nukonyae.
15Esi dzite tso la, mawudɔlawo ƒo du ɖe Lot te gblɔ bena: Tso nakplɔ srɔ̃wò kple viwònyɔnu eve, siwo le gbɔwò la, ne màgatsrɔ̃ le ɖu la ƒe vodada ta o! 16Ke esi wòle tɔtrɔm la, ŋutsuawo lé eya kple srɔ̃a kpakple vianyɔnu eveawo ƒe alɔnu hekplɔ wo do goe, eye woɖe asi le wo ŋu ɖe du la godo; elabena Yehowa ve woawo nu. 17Eye esi wokplɔ wo do goe vo la, wogblɔ bena: Ekpo ɖe asiwò azɔ, eyata ɖe ɖokuiwò! Megakpɔ megbe o, eye megatɔ ɖe afia ɖeke hã o; ke boŋ si yi ɖe to la dzi, bena màgatsrɔ̃ o! 18Ke Lot gblɔ bena: O, Aƒetɔ, meganɔ nenema o! 19Kpɔ ɖa, ève wò ɖɔla nu xoxo, eye wò amenuveve, si nètsɔ ve nunye be, megale agbe la, esɔ gbã. Gake ɖewo nyemate ŋu asi ade toa dzi, hafi gbegblẽ la nava tum, eye maku o mahi. 20Kpɔ ɖa, dua ɖe nye kem tsɔ ɖe mía gbɔ, ne masi ayi ɖe afima. Du suea ɖe ko wònye; eyata na mɔm, nemasi ayi ɖe eme, bena matsi agbe! Alo menye du suea ɖe ko wònye oa? 21Eye wògblɔ nɛ bena: Le nya sia me hã meɖo to wò, eye nyemagblẽ du, si nẽwɔnɛ la o. 22Ɖe abla yi afima kaba; elabena nyemate ŋu awɔ naneke o, vaseɖe esime naɖo afima. Eyata woyɔa ɖu la be Zoar. 23Eye ɣe dze, hafi Lot de Zoar.
Sodom tsɔtsrɔ̃.
24Eye Yehowa na aŋɔ kple dzo dza tso dziƒo tso Yehowa gbɔ ɖe Sodom kple Gomora dzi. 25Eye wotsrɔ̃ du siawo kple nuto ma me katã; dua me nɔlawo tsrɔ̃, eye nusiwo miena ɖe anyigba dzi hã gblẽ. 26Ke srɔ̃a nye kɔ kpɔ megbe, eye wòzu dzekɔ. 27Eye Abraham fɔ ŋdi kanya yi ɖe teƒe, si wòtsi tre ɖe Yehowa ƒe ŋku me le tsã la. 28Eye esi wòkpɔ Sodom kple Gomora kple afima nutowo katã me le abu me ɖa la, kpo ɖa, dzudzɔ gãa ɖe le dzi dem tso anyigba la dzi abe aŋɔɖaƒe ene. 29Esi Mawu tsrɔ̃ nuto ma me duawo la, eɖo ŋku Abraham dzi, eye wòɖe Lot hekplɔe tso ɖu, siwo me Lot nɔ la ƒe gbegblẽ me.
Lot vinyɔnuwo wɔ nuvɔ̃.
30Eye Lot kple vianyɔnu eveawo dzo le Zoar yi ɖanɔ to la dzi, elabena ele Zoar nɔnɔ vɔ̃m, eye woa kple vianyɔnu eveawo va no agadoa ɖe me. 31Eye tsitsitɔ gblɔ na ɖevitɔ bena: Mía fofo tsi, eye ŋutsua ɖeke megale anyigba dzi aɖe mí le amegbetɔwo ƒe kɔ la nu o. 32Va míana wein mia fofo wòano, eye míadɔ egbɔ, ne wòado fu mi míadzi vi. 33Tete wona wein wo fofo le zã ma me wono, eye tsitsitɔ yi ɖamlɔ fofoa gbɔ; ke eya menya naneke le eƒe egbɔ mɔmlɔ kple fɔfɔdzo ŋuti o. 34Esi ŋu ke la, tsitsitɔ la gblɔ na ɖevitɔ bena: Eto ƒe zã la memlɔ fofonye gbɔ. Míagana wòano wein egbe ƒe zã hã; ekema wò hã nayi aɖamlɔ egbɔ, bena mía fofo nado fu mí míadzi vi. 35Eye le zã sia me hã wona wein wo fofo wono, eye ɖevitɔ hã yi ɖamlɔ egbɔ; ke eya menya naneke le eƒe egbɔ mɔmlɔ kple fɔfɔdzo ŋuti o. 36Ale wɔ Lot ɖo fu vianyɔnu eveawo. 37Eye tsitsiwo dzi ŋutsuvi, eye wòtsɔ ŋkɔ nɛ bena Moab; eya nye egbegbe Moabitɔwo tɔgbui. 38Eye ɖevitɔ hã dzi ŋutsuvi, eye wòtsɔ ŋkɔ ne be Ben-Ami, eya nye Amonitɔwo tɔgbui.",https://www.bible.com/bible/2259/GEN.19.EWERV
MOSE I 20,"Abimelex na wokplɔ Sara vɛ nɛ.
1Eye Abraham ʋu le afima yi ɖe dziehenyigba dzi heva nɔ Kades kple Sur dome, eye wònɔ Gerar vie? 2Eye Abraham gblɔ le srɔ̃a Sara ŋuti bena, ye nɔvinyɔnue; eyata Abimelex, Gerar-fia, na wokplɔ Sara vɛ na ye. 3Ke le zã me la Mawu va Abimelex gbɔ le ɖrɔ̃eƒe gblɔ nɛ bena: Kpɔ ɖa, àku kokoko le nyɔnu, si nèxɔ la ta, elabena ame srɔ̃e. 4Ke Abimelex meɖe asi eŋu haɖe o, eye wògblɔ nɛ bena: Aƒetɔ, ame maɖifɔwo hãe nawua? 5Alo menye eya ŋutɔ gblɔ nam bena, ye nɔvinyɔnue, eye nyɔnua hã gblɔ nam bena, ye nɔviŋutsue oa? Nye dzime kɔ, eye nye asi dza le ekpɔkplɔme. 6Tete Mawu gblɔ nɛ le drɔ̃eƒe bena: Nye hã menyae bena, wò dzime kɔ le ewɔwɔ me; eyata metso wò xɔ ɖo, be nagade asi eŋu ahawɔ nuvɔ̃ ɖe ŋunye o. 7Azɔ gagbugbɔ nyɔnu la na srɔ̃a, elabena nyagblɔɖila wònye, eye wòaɖe kuku ɖe tawo, be natsi agbe. Ke ne meɖe asi le eŋu o la, ekema nyae bena, mia kple aƒewòmetɔwo katã miaku. 8Esi Abimelex fɔ ŋdi la, eya eƒe dɔlawo katã vɛ heto nya siawo katã na wo, eye ŋutsuawo vɔ ŋutɔ. 9Tete Abimelex yɔ Abraham, eye wògblɔ nɛ bena: Nuka nye esi nèwɔ ɖe mía ŋu? Nuvɔ̃ ka gɔ̃ mewɔ de ŋuwò bena, nèhe dzɔgbevɔ̃e gã sia va nye ŋutɔ kple nye fiaɖuƒe la dzi mahã? Nusi womewɔna o la, eya nye esia nèwɔ ɖe ŋutinye. 10Eye Abimelex gagblɔ na Abraham bena: Nukae nèɖo ɖe ŋunye, hafi wɔ nu sia? 11Abraham gblɔ bena: Mebu be, afisiatɔwo manya vɔ̃a Mawu o, eye woawum le srɔ̃nye ta mahi. 12Evɔ, nyateƒe, nɔvinyenyɔnue; elabena fofonye vie, gake menye danye vie o, eye meɖee. 13Esi Mawu gblɔ nam bena, maʋu le fofonye ƒe me ayi dzronyigba dzi la, eya me kee megblɔ nɛ bena: Ve nunye, eye afisiafi, si míava la, nagblɔ bena, ye nɔvi ŋutsu menye.
Abimelex na wogakplɔ Sara vɛ na Abraham kple nunanawo.
14Tete Abimelex tso alẽwo, nyiwo, kluviwo kple kosiviwo na Abraham, eye wògagbugbɔ srɔ̃a Sara hã nɛ. 15Eye Abimelex gblɔ bena: Nye anyigba enye si, no afisiafi, si nyo ŋuwò. 16Eye wògblɔ na Sara bena: Kpɔ ɖa, metso afia na wò, eye metsɔ klosalo akpe ɖeka na nɔviwò heɖe ŋukpe le mo na wò le gbɔwò viwo katã ŋku me. 17Eye Abraham ɖe kuku na Mawu ɖe Abimelex kple srɔ̃a kple atsusiawo katã ta, eye wòyɔ dɔ wo, bena woate ŋu adzi vi. 18Elabena Yehowa xe nyɔnu, siwo katã le Abimelex ƒe me la ƒe vidzidɔ le Sara, Abraham srɔ̃ la ta.",https://www.bible.com/bible/2259/GEN.20.EWERV
MOSE I 21,"Isak dzidzi.
1Ke Yehowa ɖo ŋku ŋugbe, si wòɖo na Sara la dzi, eye Yehowa wɔ na Sara, abe alesi wògblɔ ene. 2Ale Sara fɔ fu, eye wòdzi ŋutsuvi na Abraham le eƒe amegãkuku me le ɣeyiɣi, si Mawu gblɔ ɖi xoxo la dzi. 3Eye Abraham yɔ ŋutsuvi, si Sara dzi nɛ la ƒe ŋkɔ bena Isak. 4Esi via Isak xɔ ŋkeke enyi la, Abraham tso aʋa ne, abe alesi Yehowa de se nɛ ene. 5Ke Abraham xɔ ƒe alafa ɖeka, esime wodzi via Isak nɛ. 6Eye Sara gblɔ bena: Mawu do nukokoe nam, eye amesiame, si asee la, ako nu le ŋutinye. 7Eye wògblɔ bena: Ameka susu le Abraham ŋuti bena, Sara ana no viwò mahã? Elabena medzi ŋutsuvi nɛ le eƒe amegãkuku me. 8Eye ɖevi la tsi, eye wòɖi no, eye gbesigbe Isak ɖi no la, Abraham ɖo kplɔ̃ gãa ɖe.
Ismael kple dada nyanyã.
9Ke esi Sara kpo bena, Egipte-nyɔnua Hagar ƒe vi, si wòdzi na Abraham, lɔ̃a gaflumuwɔwɔ la, 10egblɔ na Abraham bena: Nyã kosi sia kple via ɖa; elabena kosi sia ƒe vi mate ŋu anyi dome kple vinye Isak o. 11Ke nya la medze Abraham ŋu o le viaŋutsu la ta. 12Eye Mawu gblɔ na Abraham bena: Megana nya sia nave wò le ŋutsuvi la kple wò kosi la ta o; ke boŋ ɖo to Sara le nusianu, si wodi tso gbɔwò la me, elabena Isak me wò dzidzime-viwo adzo tso. 13Ke mana dukɔ nadzo tso kosi la ƒe vi hã me, elabena viwoe. 14Eye Abraham fɔ ŋdi kanya tso abolo, eye woku tsi ɖe lãgbalẽgolo me taŋ, eye wotsɔ ɖevi la kple nu mawo ɖo abɔta na Hagar hedo mɔ wo. Ke esi wole yiyim la, wova tra mɔ le Beer-Seba gbe dzi. 15Esi lãgbalẽgolo me tsi la vɔ la, etsɔ ɖevi la yi ɖamlɔ ati dodoea ɖe te, 16eye wòyi ɖabɔbɔ na ɖevi la kasa le adzɔge boo, wo dome didi abe aŋutrɔ ƒe duɖiɖi me ene; elabena egblɔ bena: Nyemate ŋu akpa ɖevi la ƒe kuƒe o. Eyata wòyi ɖabɔbɔ no adzɔge boo ɖo; tete ɖevi la de asi avifafa me sesĩe. 17Ke Mawu se ɖevia ƒe avifafa, eye mawudɔla yɔ Hagar tso dziƒo gblɔ nɛ bena: Hagar, nuka le wɔwòm? Megavɔ̃ o, elabena Mawu se ɖevi la ƒe gbe tso afisi wòle. 18Tsi tre, yi ɖakɔ ɖevi la, eye nalée ɖe asi, elabena mana woazu dukɔ gãa ɖe. 19Tete Mawu ʋu eƒe ŋkuwo, eye wòkpɔ tsivudoa ɖe. Enumake woyi ɖaku tsi ɖe lãgbalẽgolo la me taŋ, eye wòna ɖevia wono. 20Eye Mawu nɔ kple ɖevi la, eye wòtsi, eye wònɔ gbe dzi hezu aŋutrɔdala. 21Eye wònɔ Paran-gbe dzi, eye dada ɖe srɔ̃ nɛ tso Egipte-nyigba dzi.
Abraham bia nu kple Abimelex.
22Le ɣemaɣi me la Abimelex kple eƒe aʋafia Pixol wogblɔ na Abraham bena: Mawu li kpli wò le nusianu, si nèwɔna la me. 23Azɔ ka atam le Mawu ƒe ŋku me le afisia be, nagable nye ŋutɔ, vinyewo kple nye dzidzimeviwo o! Abe alesi meve nu wòe ene la, nenema ke wò hã nawɔ nam kple anyigba, si dzi nènye amedzro le la! 24Eye Abraham gblɔ bena: Melɔ̃, maka atam la. 25Tete Abraham ƒo nu kple Abimelex le tsivudo, si eƒe dɔlawo xɔ sesẽe la ŋuti. 26Abimelex xɔ edzi ne bena: Nyemenya amesi wɔ nu sia o, eye wò hã mègblɔ nyaa ɖeke le eŋuti nam kpɔ o, egbe ko hafi nye hã mese nyaa ɖe le eŋu. 27Tete Abraham tsɔ alẽwo kple nyiwo na Abimelex, eye wo kple eve wòbia nu. 28Ke Abraham ɖe alẽvi adre ɖo vovo. 29Eye Abimelex bia Abraham be: Alẽvi adre, siwo neɖo vovo la gome ɖe? 30Eɖo ŋu nɛ bena: Alẽvi adre siawo naxa le asinye, ne wòanye ɖase nam bena, nyee ɖe vudo sia. 31Eyata woyɔ teƒe ma bena: Beer-Seba, elabena afima wo ame eve la woka atam na wo nɔewo le. 32Eye esi wòbia nu le Beer-Seba la, Abimelex kple eƒe aʋafia Pixol wodze mɔ gatrɔ yi ɖe Filistitowo ƒe anyigba dzi. 33Eye Abraham do atiwo ɖe Beer-Seba, eye wòyɔ Yehowa Mawu, si le agbe tegbee la ƒe ŋkɔ dzi le afima. 34Ke Abraham nye amedzro le Filistitowo ƒe anyigba dzi eteƒe didi.",https://www.bible.com/bible/2259/GEN.21.EWERV
MOSE I 22,"Mawu ɖo Abraham kpɔ.
1Le nya siawo megbe la Mawu do Abraham kpɔ, eye wògblɔ nɛ bena: Abraham! Eɖo ŋu nɛ bena: Nye enye si! 2Eye wògblɔ nɛ bena: Kplɔ Isak, wò tenuvi, si gbɔ mèlɔ̃a nu lena o la, yi ɖe Moria-nyigba dzi, eye natsɔe amè nui le afima le vɔsamlekpui dzi le toa ɖe, si mafia wò la dzi! 3Tete Abraham tɔ ŋdi kanya, bia akpa na eƒe tedzi, eye wòkplɔ dɔla eve kple via Isak ɖe asi, eye esi wòdze nake ɖe numemea ŋu la, edze mɔ yi teƒe, si Mawu gblɔ nɛ la. 4Le ŋkeke etɔ̃agbe la Abraham wu mo dzi kpɔ teƒe la le adzɔge ɖa ʋĩ. 5Tete Abraham gblɔ na dɔlawo bena: Mitsi afisia kple tedzi la; ke mía kple vinye la míayi afime aɖado gbe ɖa, emegbe míagatrɔ ava mia gbɔ. 6Eye Abraham tsɔ numènake la ɖo la na via Isak, ke eya ŋutɔ ɖe dzo, eye wòɖo hɛ asi; ale wo kpakple eve woyi. 7Tete Isak gblɔ na fofoa Abraham bena: Fofonye! Eɖo ŋu ne bena: Nye enye si, vinye! Eye wògblɔ nɛ bena: Kpɔ ɖa, dzo kple nake enye si, ke afika alẽ le miatsɔ ame nui? 8Abraham xɔ edzi bena: Vinye, Mawu ŋutɔ aɖi alẽ miatsɔ amè nui. Eye wo kpakple eve wogayi ŋgɔ. 9Esi woɖo teƒe, si Mawu gblɔ nɛ la, Abraham ɖi vɔsamlekpui, eye wòtɔ nakeawo ɖo edzi; emegbe la ebla via Isak, eye wòkɔe mlɔ nake, siwo le vɔsamlekpuia dzi la dzi. 10Eye Abraham do asi ɖa tsɔ hɛ, be yeawu via. 11Tete Yehowa ƒe dɔla yɔe tso dziƒo gblɔ bena: Abraham, Abraham! Eye wòtɔ bena: Nye enye si! 12Eye wògblɔ bena: Megaka asi ɖevi la ŋu o, eye megawɔ nanekee o! Menyae azɔ bena, èvɔ̃a Mawu, elabena mete wò tenuvi lam o. 13Tete Abraham fɔ kɔ dzi, eye kpɔ ɖa, agboa ɖe nye ekem, si ƒe dzowo ku aveka le emegbe, eye Abraham yi ɖalé agbo la hetsɔ mè nui ɖe via teƒe. 14Eye Abraham yɔ teƒe ma bena: Afisi Yehowa ɖe eɖokui fia le. Eyata wogblɔna vaseɖe egbegbe bena: Le to dzi, afisi Yehowa ɖea eɖokui fiana le.
Mawu ɖo kpe ŋugbedodo la dzi.
15Eye Yehowa ƒe dɔla gayɔ Abraham zi evelia tso dziƒo 16hegblɔ bena: Mefa ɖokuinye, elabena esi nèwɔ nu sia, eye mete wò tenuvi ɖeka lam o la, 17eyata mayra wò geɖe ŋutɔ, eye viwòwo asɔ gbɔ fũ abe dziƒoɣletiviwo kple ƒutake ene, eye wò dzidzimeviwo atsɔ woƒe futɔwo ƒe duwo anyi domee. 18To wò dzidzimeviwo me woayra anyigba dzi dukɔwo katã le, elabena èɖo to nye gbe. 19Emegbe Abraham gatrɔ va eƒe dɔlawo gbɔ, eye wodze mɔ yi Beer-Seba, eye Abraham nɔ Beer-Seba.
Nahor ƒe dzidzimeviwo.
20Le nya siawo megbe la Abraham se bena, Milka hã dzi ŋutsuviwo na nɔvia Naxor. 21Woƒe ŋkɔwo nye: Uz, eƒe ŋgɔgbevi, kple nɔvia Bus, Kemuel, amesi me Aramtɔwo dzɔ tso, 22Kesed, Haso, Pildas, Yidlaf kple Betuel. 23Eye Betuel dzi Rebeka. Ame enyi siawo Milka dzi na Naxor, Abraham nɔvi. 24Eye srɔ̃ evelia ŋkɔ nye Rehuma, eya hã dzi Tebax, Gaham, Tahas kple Maxa nɛ.",https://www.bible.com/bible/2259/GEN.22.EWERV
MOSE I 23,"Sara ƒe ku kple eɖiɖi.
1Sara xɔ ƒe alafa ɖeka kple blave vɔ adre; esia nye Sara ƒe agbe me ƒewo. 2Eye Sara ku le Kiryat-Arba, eya nye Xebron le Kanaan-nyigba dzi. Eye Abraham va, be wòafa konyi, eye wòafa avi na Sara. 3Eye Abraham tso le ame kuku la gbɔ, eye wòƒo nu kple Xitiviwo bena: 4Amedzro menye le mia dome, mina ameɖiƒem, bena matsɔ nye ame kuku la aɖi ɖe afima! 5Eye Xitiviwo ɖo ŋu na Abraham bena: 6Amegã, se mía gbe! Mawu ƒe ame ɖoɖoa nenye le mia dome; ɖi wò ame kuku la ɖe míaƒe ame veviwo ɖiƒe. Mía dometɔa ɖeke magbe bena, megaɖi wò ame kukua ɖe eƒe ameɖiƒe o. 7Tete Abraham tsi tre, eye wobɔbɔ na anyigbadzitɔ, siwo nye Xitiviwo, 8eye wòƒo nu kpli wo bena: Ne mielɔ̃ bena, maɖi nye ame kukua la, ekema miɖo tom, eye miɖe kuku na Efron Zoxar-vi nam 9be, wòatsɔ eƒe kpeto Maxpela, si le eƒe agble ƒe nuwuƒe la nam, eye maxe fe ɖe eta blibo, ne wòanye nye ameɖiƒe koŋ le mia dome. 10Ke Efron le Xitiviawo dome Eye Efron Xititɔ la ɖo ŋu na Abraham le Xitiviwo kple amesiwo katã va dua me la ƒe ŋku me bena: 11Nye amegã, ɖo tom! Metsɔ agble lã kple kpeto, si le eme la, ke wò. Le nye dumetɔwo katã ŋku me metsɔe ke wò, ɖi wò ame kuku la ko! 12Tete Abraham bɔbɔ na duametɔwo, 13eye wòɖo ŋu na Efron bena: Mi duameviwo misee! Maxe fe ɖe agble la ta; meɖe kuku na wò, xɔ ga le asinye, be mate ŋu aɖi nye ame kukua ɖe afima! 14Efron ɖo ŋu na Abraham bena: 15Amegã, se nye gbe! Anyigba, si ke xɔ klosalo sekel alafa ene la, nuka wònye le mía kpli wò domee? Ɖi wò ame kukua ko. 16Abraham ɖo to Efron, eye Abraham xlẽ ho, si Efron yɔ le Xitiviawo ŋku me la ne, klosalo sekel alafa ene, ga nyui, si asitsalawo xɔna. 17Ale Efron ƒe agble, si le Maxpela le Mamre kasa, agble la kple kpeto, si le eme, kple ati, siwo katã le agblea me godoo la, 18zu Abraham tɔ le Xitiviawo kple amesiwo katã va dua me la ŋku me. 19Esia megbe la Abraham ɖi srɔ̃a Sara ɖe kpeto, si le Maxpela-gblea me la me le Mamre kasa; esia enye Hebron le Kanaan-nyigba dzi. 20Ale Xitiviwo ɖe asi le agble la kple kpeto, si le eme la ŋuti na Abraham, be wòanye ameɖiƒe nɛ koŋ.",https://www.bible.com/bible/2259/GEN.23.EWERV
