Title,Content,URL
MOSE I 34,"Dina kple Sixem.
1Gbe ɖeka Dina, Lea ƒe vinyɔnu, tsi wòdzi na Yakob la, do go yi dua me nyɔnuviwo kpɔ ge ɖa. 2Tete anyigba ma dzi fia, Xamor Xiwitɔ, ƒe ŋutsuvi Sixem kpɔe, eye wolee de asi eŋu, hegblẽe sesẽe. 3Eye eƒe dzi ku de Yakob ƒe vinyɔnu Dina ŋu, eye wolã ɖetugbivi la, eye wòde asi eŋu beble me. 4Emegbe la Sixem gblɔ na fofoa Xamor bena: Ɖe ɖetugbi sia nam! 5Eye Yakob se be, wogblẽ vianyɔnu Dina, ke viaŋutsuwo le gbedzi le eƒe alẽhawo gbɔ, eye Yakob zi kpi, vaseɖe esime wogbɔ. 6Eye Xamor, Sixem fofo, yi Yakob gbɔ, be wòaƒo nu kplii. 7Esi Yakob viŋutsuwo gbɔ tso lãnyiƒe, eye wosee la, ŋutsuawo bi dzi, eye wodo dɔmedzoe ŋutɔ; elabena ewɔ ŋukpenanu ɖe Israel ŋuti, be wòde asi Yakob ƒe vinyɔnu ŋuti, nusi medze kura o. 8Eye Xamor ƒo nu kpli wo gblɔ bena: Vinye Sixem ƒe dzi ku de mia nɔvinyɔnu la ŋuti; mede kuku, mitsɔe nɛ, ne wòaɖe. 9Eye mina miaɖe srɔ̃ ɖekae, mitsɔ miaƒe nyɔnuviwo na mí, eye miawo hã miatsɔ míaƒe nyɔnuviwo na mi. 10Minɔ mía gbɔ, kpɔ ɖa, anyigba la enye si, minɔ edzi, eye miatsa le edzi, eye míatsi edzi dika. 11Tete Sixem gblɔ na fofoa kple nɔviawo bena: Ne miave nunye la, ekema nusianu, si miabiam la, mana. 12Tabianu kple akpedanu, alesi nu miabiam la, mana, abe alesi miedi ene; mitsɔ ɖetugbivi la nam made ko. 13Eye Yakob viŋutsuwo do ŋu na Sixem kple fofoa Xamor le aye me, elabena egblẽ wo nɔvinyɔnu Dina. 14Eye wogblɔ na wo bena: Míate ŋu awɔ nya sia dzi be, miatsɔ mía nɔvinyɔnu na bolobolotɔ o, elabena esia enye ŋukpe na mí. 15Negbe ne mianɔ abe miawo ene, eye mia dome ŋutsu sia ŋutsu natso aʋa la, eya ko hafi míalɔ̃. 16Ekema miatsɔ mía nyɔnuviwo na mi, eye miawo hã miaɖe mia nyɔnuviwo; mianɔ mia gbɔ, eye míazu dukɔ ɖeka. 17Ke ne mieɖo to mi, eye mietso aʋa o la, ekema miaxɔ mía nɔvinyɔnu la adzoe. 18Nya siawo dze to na Xamor kple via Sixem. 19Eye ɖekakpui la, amesi fofoa ƒemetɔwo buna ŋutɔ la, meɖe: ɖe megbe le ewɔwɔ me o, elabena Yakob vinyɔnu la ƒe nu nyo eŋu ŋuta. 20Eye Xamor kple via Sixem wova du la ƒe agbo nu, eye woƒo nu kple dua me ŋutsuwo bena: 21Ŋutsu siawo nye ame fafawo le mia dome; eyata mina, woatso aƒe ɖe miaƒe anyigba dzi, eye woatsa le edzi. Kpɔ ɖa, anyigba la keke na wo le goawo katã me. Miaɖe woƒe nyonuviwo faa, eye miawo hã miatsɔ mía nyɔnuviwo na wo. 22Ne mía dome ŋutsu sia ŋutsu atso aʋa, abe alesi woawo hã tso aʋae ene la, eya ko ŋutsuawo alɔ̃ anɔ mía gbɔ, bena míazu dukɔ ɖeka. 23Woƒe lãhawo, kesinɔnuwo kple woƒe dɔwɔlãwo katã la menye mia tɔ, woanye oa? Eyata mina míawɔ woƒe nya la dzi, ekema woanɔ mia gbɔ. 24Tete amesiwo katã va ƒo ƒu ɖe dua ƒe agbo nu la, ɖo to Xamor kple via Sixem, eye dua me ŋutsuwo katã tso aʋa.
Ʋu kɔkɔɖeanyi le Sixem.
25Le ŋkeke etɔ̃agbe, esi abi la le wo vem, eye woɖe ŋu ɖi la, Yakob ƒe viŋutsu eve, Simeon kple Lewi, siwo nye Dina nɔviwò lã, wotsɔ woƒe yiwo dze du la dzi hewu ŋutsuwo katã. 26Wowu Xamor kple via Sixem hã kple yi, eye wokplɔ Dina tso Sixem ƒe me hedzoe. 27Ke Yakob vi mamleawo va ɖe nu le ame kukuawo ŋu, eye woha du la, elabena wogblẽ wo nɔvinyɔnu. 28Eye wokplɔ woƒe alẽwo, nyiwo kple tedziwo, eve wotso nusiwo wokpɔ le dua me kple agble me la, hedzoe 29Woha woƒe kesinɔnuwo katã, eye woɖe aboyo ɖeviwo kple nyɔnuwo siaa, eye woha woƒe xɔme nuwo hã. 30Tete Yakob gblɔ na Simeon kple Lewi bena: Miehe dzɔgbevɔ̃e va dzinye, eye anyi gbadzinɔla, siwo nye Kanaanitɔwo kple Perizitɔwo la, woalem ɖe fu me: kpɔ ɖa, ame ʋeea ɖewo koe míenye, eye ne woaƒo ƒu ɖe mia ŋu la, ekema woaɖu mía dzi, eye woatsrɔ̃m kple tɔnyetɔwo katã. 31Woɖo ŋu ne bena: Ɖe eya kpɔ mɔ abu mia nɔvi gboloe mahã?",https://www.bible.com/bible/2259/GEN.34.EWERV
MOSE I 35,"Yakob le Betel.
1Eye Mawu gblɔ na Yakob bena: Tso, naʋu ayi Betel, eye nanɔ afima, eye naɖi vɔsamlekpui ɖe afima na Mawu, si ɖe eɖokui fia wò, esime nesi le nɔviwò Esau nu! 2Tete Yakob gblɔ na eƒemetɔwo kple amesiwo katã le egbɔ la, bena: Miɖe dzromawu, siwo le mia dome la da, miklɔ mia ɖokui ŋuti, eye miɖɔ li miaƒe awuwo, 3eye míaʋu ayi Betel, bena maɖi vɔsamlekpui ɖe afima na Mawu, si ɖo tom, esi mele xaxa me, eye wònɔ anyi kplim le nye mɔzɔzɔ me la! 4Tete wotsɔ dzromawu, siwo katã le wo si, kple woƒe togɛwo na Yakob, eye Yakob ɖi wo ɖe ati gã, si le Sixem gbɔ la te. 5Emegbe la wodze mɔ, ke Mawu na vɔvɔ̃ va dze du, siwo ƒo xlã wo la dzi: eyata wometi Yakob viwo yome o. 6Eye Yakob kple amesiwo katã le eŋu la, wova Lus, esia nye Betel, le Kanaan-nyigba dzi. 7Eye wòɖi vɔsamlekpui ɖe afima, eye wòyɔ teƒe la be „Betel ƒe Mawu“, elabena afima Mawu ɖe eɖokui fiae le, esime wòsi le nɔvia nu. 8Ke Debora, amesi na no Rebeka le ɖevime la ku, eye woɖii ɖe Betel ƒe anyigbe ɖe logoti gãa ɖe te, eyata wona ŋkɔ afima bena „Konyifalogo“.
Mawu na ŋkɔ yeye Yakob, eye wòyrae.
9Eye Mawu gaɖe eɖokui fia Yakob, esime wògbɔ tso Mesopotamia, eye wòyrae. 10Eye Mawu gblɔ nɛ bena: Ŋkɔwò enye Yakob; tso esia dzi la womagayɔ wò bena Yakob o, ke boŋ wò ŋkɔ anye Israel. Eyata woyɔnɛ bena Israel. 11Eye Mawu gblɔ nɛ bena: Nye enye Mawu ŋusẽkatãtɔ, àdzi, eye nasɔ gbɔ; anye dukɔ kple dukɔhawo ƒe fofo, eye fiawo adzɔ atso mewò. 12Eye anyigba, si metsɔ na Abraham kple Isak la, màtsɔe ana wò, eye matsɔ anyigba la ana megbewòviwo. 13Eye Mawu dzo le egbɔ heyi dzi tso afisi wòƒo nu kplii le la. 14Tete Yakob tu dzesikpe, si enye ŋkuɖodzikpea ɖe, ɖe afisi wòƒo nu kplii le la, eye wòkɔ aha ɖe edzi, emegbe la ekɔ ami hã ɖe edzi. 15Eye Yakob na ŋkɔ teƒe, si Mawu ƒo nu kplii le la, bena Betel.
Raxel ƒe ku.
16Emegbe la wodze mɔ tso Betel. Esi wote lu Efrat la, Raxel de asi kulele me: ke vidzidzi la nye dɔ nɛ. 17Eye esi vidzidzia nye dɔ nɛ la, vixela la gblɔ nɛ bena: Megavɔ̃ o, elabena esia hã nye ŋutsuvi! 18Esi wòle kudɔ ƒom, eye wòkpɔ bena, yele kuku ge la, ena ŋkɔe bena: Benoni; ke fofoa yɔe be Benyamin. 19Emegbe la Raxel ku, eye woɖu ɖe Efrat, si enye Betlexem, mɔ to. 20Eye Yakob tu dzesikpe ɖe eƒe yɔdo dzi, esia nye ŋkuɖodzikpe le Raxel ƒe yɔdo dzi vaseɖe egbegbe. 21Emegbe la Israel gadze mɔ, eye wòtu eƒe agbadɔ ɖe Migdal-Edel godo.
Yakob viŋutsuwo.
22Ke esi Israel le nuto sia me la, Ruben de asi fofoa ƒe kosi Bilha ŋu, eye Israel see.
23Eye viŋutsu wuieve le Yakob si. Lea viŋutsuwo nye Ruben, Yakob ƒe ŋgɔgbevi, eyome Simeon, Lewi, Yuda, Isaxar kple Zebulon. 24Raxel viŋutsu wo nye Yosef kple Benyamin. 25Raxel ƒe kosi Bilha ƒe viŋutsuwo nye Dan kple Naftali. 26Eye Lea ƒe kosi Silpa ƒe viŋutsuwo nye Gad kple Aser. Esiawo nye Yakob ƒe viŋutsu, siwo wodzi nɛ le Mesopotamia. 27Eye Yakob va fofoa Isak gbɔ le Mamre le Kiryat-Arba, esia nye Xebron, afisi Abraham kple Isak wonye amedzrowo le. 28Eye Isak ƒe agbe me ŋkekewo nye ƒe alafa ɖeka kple blanyi. 29Eye Isak ku amegã ɖeɖi, eye agbenɔnɔ tii, hafi woku, eye wòyi ɖe tɔgbuiawo gbɔ Eye via Esau kple Yakob woɖu.",https://www.bible.com/bible/2259/GEN.35.EWERV
MOSE I 36,"Esau ƒe dzidzimegbalẽ.
1Esia enye Esau, si enye Edom, ƒe dzidzimeviwo ŋutinya. 2Esau ɖe Kanaan-nyɔnuwo, woawo nye Ada, Xititɔ Elon ƒe vinyɔnu, Oholibama, Ana ƒe vinyɔnu, amesi enye Xititɔ Zibeon ƒe tɔgbuiyɔvi; 3kple Basmat, Ismael ƒe vinyɔnu, si enye Nebayot ƒe nɔvinyɔnu. 4Ada dzi Elifaz na Esau, eye Basmat dzi Reguel. 5Eye Oholibama dzi Yehus, Yaelem kple Korax. Esiawo nye viŋutsu, siwo wodzi na Esau le Kanaan-nyigba dzi. 6Eye Esau kplu srɔ̃awo, viaŋutsuwo kple vianyɔnuwo kple eƒe kluvi, siwo katã le eƒe me, kple eƒe lãhawo kple eƒe dɔwɔlãwo katã kpe ɖe eƒe kesinɔnu, siwo katã wòkpɔ le Kanaan-nyigba dzi la ŋuti, eye woʋu le nɔvia Yakob gbɔ heyi ɖe Seir-nyigba dzi. 7Elabena woƒe kesinɔnuwo so gbɔ akpa, ale bena womate ŋu anɔ wo nɔewo gbɔ o; eye anyigba, si dzi wonye amedzro le la, mede wo nu o, le woƒe lãhawo ta. 8Eye Esau nɔ Seir-to la dzi. Esau enye Edom.
9Esia enye Esau, Edomtɔ, siwo le Seir-to dzi la, fofo ƒe dzidzimeviwo ŋutinya. 10Esiawo nye Esau viŋutsuwo ƒe ŋkɔwo Esau srɔ̃ Ada viŋutsu enye Elifaz, eye Esau srɔ̃ Basmat viŋutsu enye Reguel. 11Elifaz viŋutsuwo nye Teman, Omar, Zefo, Gaetam kple Kenas. 12Eye Esau viŋutsu Elifas srɔ̃ evelia ŋkɔ enye Timna, eya dzi Amalek na Elifaz. Esiawo nye Esau srɔ̃ Ada ƒe viŋutsuwo. 13Reguel viŋutsuwo nye: Naxat, Serax, Sama kple Misa. Woawo nye Esau srɔ̃ Basmat ƒe viŋutsuwo 14Esiawo nye Esau srɔ̃ Oholibama, Ana ƒe vinyɔnu, si enye Zibeon ƒe tɔgbuiyɔvi ƒe viŋutsuwo, eya dzi Yehus, Yaelam kple Korax na Esau.
15Ame siawo nye amegãwo le Esau viwo dome. Esau ƒe ŋgɔgbevi Elifaz viwo nye, amegã Teman, amegã Omar, amegã Zefo, amegã Kenas, 16amegã Korax, amegã Gaetan kple amegã Amalek. Amegã siawo dzɔ tso Elifaz me le Edom-nyigba dzi. Woawo nye Ada viwo. 17Esiawo nye Esau vi Reguel ƒe viŋutsuwo: Amegã Naxat, amegã Serax, amegã Sama kple amegã Misa. Woawo nye amegã, siwo dzɔ tso Reguel me le Edom-nyigba dzi, eye wonye Esau srɔ̃ Basmat ƒe viwo. 18Esiawo nye Esau srɔ̃ Oholibama ƒe viwo. Amegã Yehus, amegã Yaelam kple amegã Korax. Amegã siawo dzo tso Esau srɔ̃ Oholibama, si enye Ana ƒe vinyɔnu la me. 19Esiawo nye Esau ƒe viŋutsuwo, eye woawo nye woƒe amegãwo Eya nye Edom.
20Esiawo nye Xoritɔ Seir, amesi nɔ anyigba la dzi tsã la, ƒe viŋutsuwo Lotan, Sobal, Zibeon, Ana, 21Dison, Ezer kple Disan. Woawo nye amegãwo le Xoritɔ Seir, amesi nɔ Edom-nyigba dzi la, ƒe viwo dome. 22Lotan ƒe viŋutsuwo nye: Xori kple Hemam; eye Lotan nɔvinyɔnu enye Timna. 23Esiawo nye Sobal ƒe viŋutsuwo: Alwan, Manaxat, Ebal, Sefo kple Onam. 24Esiawo nye Zibeon ƒe viŋutsuwo: Aya kple Ana; eya nye Ana ma, si tɔ tsi dzodzoe vudo le gbedzi, esime wòle fofoa Zibeon ƒe tedziwo kplɔm la. 25Esiawo nye Ana ƒe viwo: Dison kple Ana ƒe vinyɔnu Oholibama. 26Esiawo nye Dison ƒe viŋutsuwo: Xemdan, Esban, Yitran kple Keran. 27Ezer viŋutsuwo nye Bilhan, Sawan kple Akan. 28Disan viŋutsuwo nye: Uz kple Aran. 29Esiawo nye Xoritɔwo ƒe amegãwo: Amegã Lotan, amegã Sobal, amegã Zibeon, amegã Ana, 30amegã Dison, amegã Ezer kple amegã Disan. Esiawo nye Xoritɔwo ƒe amegãwo le Seir-nyigba la dzi le woƒe duawo nu.
31Esiawo nye fia, siwo ɖu Edom-nyigba dzi, hafi fia va ɖo Israel-viwo si. 32Beor vi Bela ɖu fia le Edom, eye eƒe fiadu enye Dinhaba. 33Esi Bela ku la, Serax vi Yobab tso Bozra ɖu fia ɖe eteƒe. 34Eye esi Yobab ku la, Xusam tso Temanitɔwo ƒe anyigba dzi ɖu fia ɖe eteƒe. 35Esi Xusam ku la, Bedad vi Hadad ɖu fia ɖe eteƒe; eya nye amesi ɖu Midiantɔwo dzi le Moab ƒe gbadzaƒe, eye eƒe fiadu enye Awit. 36Eye esi Hadad ku la, Samla tso Masreka ɖu fia ɖe eteƒe. 37Esi Samla ku la, Saul tso Rexobot, si le tɔsisia nu, ɖu fia ɖe eteƒe. 38Eye esi Saul ku la, Axbor vi Baal-Xanan ɖu fia ɖe eteƒe. 39Esi Baal-Xanan, Axbor vi ku la, Hadar ɖu fia ɖe eteƒe; eƒe fiadu enye Pagu, eye srɔ̃a ŋkɔ enye Mehetabeel. Matred ƒe vinyɔnu kple Mesahab ƒe tɔgbuiyɔvi.
40Esiawo nye amegã, siwo dzɔ tso Esau me la, ƒe ŋkɔwo le woƒe ƒomewo, nɔƒewo kple ŋkɔwo nu. Amegã Timna, amegã Alwa, amegã Yetet, 41amegã Oholibama, amegã Ela, amegã Pinon, 42amegã Kenas, amegã Teman, amegã Mibzar, 43amegã Magdiel kple amegã Iram. Esiawo nye Edom-megãwo le woƒe nɔƒewo kple woawo ŋutɔwo ƒe anyigbawonu. Eya nye Esau, amesi nye Edomtɔwo ƒe fofo.",https://www.bible.com/bible/2259/GEN.36.EWERV
MOSE I 37,"Yosef fe drɔ̃ewo.
1Ke Yakob nɔ anyigba, si dzi fofoa nye amedzro le la dzi, si enye Kanaan-nyigba la. 2Esia nye Yakob ƒe dzidzimeviwo ŋutinya. Esi Yosef nye ɖekakpuivi xɔ ƒe wuiadre la, enɔa alẽwo kplɔm kple tɔviawo, siwo nye fofoa srɔ̃ Bilha kple Silpa viŋutsuwo, eye ne wowɔ nu vloea ɖe wose la, Yosef va gblɔnɛ na fotoa. 3Eye Israel lɔ̃ Yosef wu viaŋutsu bubuawo katã, elabena edzii le eƒe amegãkuku me, eye wòtɔ awu ʋlaya nɛ. 4Ke esi nɔviawo kpɔ bena, wo fofo lɔ̃nɛ wu wo katã la, wolée ɖe fu me, eye womegaƒoa nu nɛ nyuie o. 5Gbe ɖeka Yosef ku drɔ̃e, eye wòlĩi na nɔviawo; tso ekema dzi la wogale fui ɖe dzi. 6Egblɔ na wo bena: Miɖo to, ne miase drɔ̃e, si meku! 7Miele mɔli biam le agble me, tete nye mɔli babla tsi tre, eye wòdzɔ kã; kasiaa mia tɔwo va ƒo xlãe, eye wode la agu nɛ. 8Tete nɔviawo gblɔ nɛ bena: Ɖe nèle didim be, naɖu fia ɖe mía nu, eye naɖu mía dzia? Tso ekema dzi wogalé fui ɖe dzi wu le eƒe drɔ̃ekuku kple eƒe nyawo ta. 9Gbe ɖeka egaku drɔ̃e bubu, eye woli eya hã na nɔviawo bena: Megaku drɔ̃e be, ɣe, ɣleti kple ɣletivi wuiɖekɛ wode ta agu nam. 10Eye esi wòlii na fofoa kple nɔviawo la, fofoa ka mo nɛ, eye wògblɔ nɛ bena: Drɔ̃e ka enye si nèku? Alo ɖe mia kple dawo kple nɔviwòwo míava dze klo ade ta agu na wò mahã? 11Tso esia dzi la nɔviawo ʋã ŋui; ke fofoa dzra nya la ɖo.
Woƒle Yosef yi ɖe Egipte.
12Gbe ɖeka esi nɔviawo yi wo fofo ƒe alẽwo kplɔ ge le Sixem la, 13Israel gblɔ na Yosef bena: Nɔviwòwo le alẽwo kplɔm le Sixem, va madɔ wò ɖe wo gbɔ. Eɖo ŋu bena: Nye enye si! 14Eye wògblɔ ne bena: Yi ɖakpɔ bena, nɔviwòwo kple lãhawo li sesĩe mahã? Emegbe la nava gblɔe nam. Ale wòdɔe tso Xebron-bali me, eye wòva Sixem. 15Ke esi wòtra mɔ le gbedzi la, ŋutsua ɖe kpɔe, eye wòbiae bena: Nuka dim nèle? 16Eɖo ŋu bena: Nɔvinyewo dim mele: mede kuku, gblɔ afisi wole woƒe lãhawo nyim le la nam. 17Ŋutsu la gblɔ bena: Mese wogblɔ bena: Mina míaʋu le afisia ayi Dotan! Tete Yosef li nɔviawo, eye wòva tu wo le Dotan. 18Ke esi wokpɔe le adzɔge, eye mekpɔ ɖo wo gbɔ haɖe o la, wode adaŋu le eŋu be, yewoawui le aye me. 19Eye wogblɔ na wo nɔewo bena: Mikpɔ drɔ̃ekula enye kem gbɔna ɖa! 20Mina miawui, eye miatsɔe aƒu gbe ɖe ɖoa ɖe me, eye míagblɔ bena, lã wodaa ɖe vuvui, ekema miakpɔ nusi eƒe drɔ̃e la ava zu. 21Esi Ruben see la, exɔ nya ɖe enu gblɔ bena: Gbeɖe, migana miawui o! 22Tete Ruben gblɔ na wo bena: Migakɔ ʋua ɖeke ɖi o: ke boŋ mitsɔe de do kema, si le gbedzi la me, eye migade asi eŋu o! Elabena ele didim be, yeaxɔe le wo si, eye yeaɖoe ɖe fofoa. 23Esi Yosef va nɔviawo gbɔ la, woɖe eƒe awu le eŋu, eƒe awu ʋlaya, si wòɖo. 24Eye wolée tsɔe ƒu gbe ɖe do la me; ke doa le ƒuƒlu, eye tsia ɖeke mele eme o. 25Emegbe wobɔbɔ na anyi, be yewoaɖu nu, kasiaa wokpɔ Ismael-sihawo tso Gilead gbɔna heyina ɖe Egipte, eye woƒe kposɔwo tsɔ aŋe, lifi kple kotoklobo. 26Tete Yuda golɔ na nɔviawo bena: Viɖe ka wònye na mi, ne míefi mía nɔvi wu? 27Mina míatsɔe adzra na Ismaeltɔwo, ke mígade asi eŋu o, elabena mía nɔvi kpamkpam wònye. Eye nɔviawo lɔ̃ ɖe edzi. 28Ke Midian-sitsalawo va to wo ŋuti yi, eye woɖe Yosef le do la me hetsɔ dzra na Ismaeltɔwo klosalo blave, eye wokplɔ Yosef yi Egipte. 29Esi Ruben gatrɔ va doa to la, megakpɔ Yosef le do la me o Tete wòdze eƒe awu, 30eye esi wògatrɔ va nɔviawo gbɔ la, egblɔ bena: Ɖevia megali o; azɔ afika nye la mayi?
Yakob fa konyi le Yosef ŋuti.
31Emegbe la wowu gbɔ̃tsua ɖe, eye wotso Yosef ƒe awu la nyrɔ ɖe ʋua me. 32Eye wotso awu ʋlaya la ɖo ɖe wo fofo gblɔ bena: Nusia míefɔ, le ŋku ɖe ŋu nyuie, be viwò ƒe awue loo, alo menye eyae o! 33Esi wòɖe ŋku ɖee nyuie la, edo ɣli bena: Vinye ƒe awu enye esia; lã wodaa ɖe vuvui, oo, evuvu Yosef vavã! 34Tete Yakob dze eƒe awu, sa papahũ ɖe ali, eye wofa konyi na via ŋkeke geɖewo. 35Eye viaŋutsuwo kple vianyɔnuwo katã la akɔ nɛ ʋuu do kpoe, ke egblɔ bena: Matsɔ konyifafa ayi vinye gbɔe le tsieƒe boŋ. Ale fofoa fa nɛ ŋutɔ. 36Ke Midiantɔwo ɖadzrae ɖe Egipte na Potifar, Farao ƒe aƒedzikpɔla kple eŋuti mewo ƒe amegã.",https://www.bible.com/bible/2259/GEN.37.EWERV
MOSE I 38,"Yuda wɔ nuvɔ̃.
1Le ɣemaɣi me la Yuda ʋu le nɔviawo gbɔ heyi ɖe Xira. Adulamtɔ la gbɔ. 2Afima Yuda kpo Kanaantɔ Sua ƒe vinyɔnu le, eye woɖee, eye wòdo kplii. 3Eye wòfa fu hedzi ŋutsuvi, eye wòna ŋkɔe bena Ger. 4Eyome la efɔ fu gadzi ŋutsuvi, eye wòna ŋkɔe be Onan. 5Emegbe la egadzi ŋutsuvi, eye wòna ŋkɔe bena Sela. Enɔ Kesib hafi dzii. 6Eye Yuda ɖe srɔ̃ na eƒe ŋgɔgbevi Ger, eŋku nye Tamar. 7Ke Yuda ƒe ŋgɔgbevi Ger enye ame vɔ̃ɖi le Yehowa ƒe ŋku me, eyata Yehowa wui. 8Tete Yuda gblɔ na Onan bena: Ɖe nɔviwò srɔ̃ ahoe, bena nado ƒome ɖi na nɔviwò. 9Ke esi Onan nya bena, ɖeviawo manye ye tɔ o la, ɖaa ne edɔ nɔvia srɔ̃ gbɔ la, enana tsi la duduna ɖe anyigba, bena yemagado ƒome ɖi na nɔvia o. 10Nuwɔwɔ sia vɔ̃ɖi le Yehowa ƒe ŋku me, eyata wowu eya hã. 11Eye Yuda gblɔ na lɔ̃xoa Tamar bena: Yi fofowò ƒe me, eye nanye ahosi, vaseɖe esime vinye Sela natsi. Elabena ele vɔvɔ̃m bena, eya hã ava ku abe nɔviawo ke ene. Tete Tamar yi ɖanɔ fofoa ƒe me. 12Le ŋkeke geɖewo megbe la Sua vinyɔnu, si nye Yuda srɔ̃ la ku. Eye esi Yuda fa nɛ vɔ la, eya kple xɔlɔ̃a Xira, Adulamtɔ la woyi ɖe Timnat, be woakpɔ amesiwo le fu sẽm na eƒe alẽwo la ɖa. 13Ke esi wogblɔ na Tamar bena, toa gbɔna va Timnat fu sẽ ge na eƒe alẽwo la, 14eɖe eƒe ahovɔwo ɖi, tsɔ motsyɔnu tsyɔ ŋku me, eye wòtsyɔ avɔ blukɔɔ heva bɔbɔ nɔ Enaim-gbo, si le Titmnat-mɔ dzi la nu; elabena ekpɔ be, Sela tsi, gake wometsɔ ye nɛ, be wòaɖe o. 15Ke esi Yuda kpɔe la, ebu be, gboloa ɖee; elabena etsyɔ nu ŋku me. 16Tete wòdze yi ɖe egbɔ gblɔ bena: Na mamlɔ gbɔwò! Elabena menyae bena, lɔ̃xoa wònye o. Eɖo ŋu nɛ bena: Nuka nanam hafi amlɔ gbɔnye? 17Egblɔ bena: Malé gbɔ̃tsu ɖeka le lãhawo me aɖo ɖe wò. Eɖo ŋu bena: Ekema tsɔ nane ɖo awɔba nam, vaseɖe esime naɖoe ɖem. 18Eye wòbiae bena: Nuka matsɔ aɖo awɔba na wò mahã? Eɖo ŋu be: Wò ŋkɔsigɛ, si nètsɔna ɖoa ŋkɔ nu dzi, kple eŋuti ka kpakple wò atikplɔ, si le asiwò la! Tete wotsɔ wo nɛ, eye wòmia egbɔ, eye wòfɔ lu nɛ. 19Tete wòdzo yi, eye wòɖe motsyɔnu la ɖi gatsɔ eƒe ahovɔwo ta. 20Emegbe la Yuda tsɔ gbɔ̃tsu la ɖe xɔlɔ̃a Adulamtɔ la si, be wòaxɔ awɔbaɖonu la le nyɔnu la si; gake mekpɔe o. 21Eye wòbia dua me ŋutsuwo bena: Afika gbolo, si nɔ Enaim-mɔ dzi la le? Woɖo eŋu ne bena: Gboloa ɖeke menɔ afisia kpɔ o. 22Tete wòtrɔ yi Yuda gbɔ gblɔ bena: Nyemekpɔe o, eye dua me ŋutsuwo hã gblɔ bena, gboloa ɖeke menɔ afisia kpɔ o. 23Yuda gblɔ bena: Nenɔ esi ko! Ne menya ɖu fewu le mía ŋuti o ko. Meɖo gbɔ̃tsu la ɖee, ke mèkpɔe o. 24Anɔ ɣleti etɔ̃ megbe la wogblɔ na Yuda bena: Lɔ̃xowò Tamar wɔ ahasi, eye wòfɔ fu ɖe eme. Tete Yuda gblɔ bena: Mikplɔe ɖo goe, ne míatɔ dzoe! 25Ke esi wokplɔe do goe la, edɔ ame ɖo ɖe toa gbɔ gblɔ bena: Ŋutsu, si ƒe nu enye esiawo la, eyae ɖo fum. Eye wògblɔ bena: Lé ŋku ɖe eŋu nyuie be, ameka tɔ enye ŋkɔsigɛ la kple eŋuti ka kpakple alikplɔ la mahã? 26Esi Yuda ɖe ŋku ɖee nyuie la, egblɔ bena: Etɔ dzɔ wu tanye, elabena nyematsɔe na vinye Sela wòɖe o. Tso ema dzi la megade asi eŋu kpɔ o.
27Ke esi eƒe vidziɣi ɖo la, wokpɔ be, venɔviwo le eƒe dɔ me. 28Esime wòle vi dzim la, ɖeka do asi ɖa. Tete vixela tsɔ ka dzia ɖe sa ɖe asi ŋu nɛ gblɔ bena: Esiae tre dodo. 29Ke esi wògahe asi ɖe eme la, nɔvia do, eye vixela gblɔ bena: Nukaŋuti nèdze le nɔviwò ŋu ale? Eyata wòna ŋkɔe bena: Perez. 30Emegbe la nɔvia, si ƒe asi ŋu ka dzi le la, hã do; eyata wona ŋkɔe bena Serax.",https://www.bible.com/bible/2259/GEN.38.EWERV
MOSE I 39,"Yosef subɔ Potifar.
1Eye esi wokplɔ Yosef va Egipte la, Egiptetɔ Potifar, Farao ƒe aƒedzikpɔla kple eŋuti mewo ƒe amegã la ƒlee le Ismaeltɔ, siwo kplɔe yi afima la si. 2Ke Yehowa nɔ kple Yosef, eye nusianu dze edzi nɛ nyuie, eye wònɔ eƒe aƒetɔ, Egiptetɔ la, ƒe me 3Esi eƒe aƒetɔ kpɔ bena, Yehowa li kplii, eye Yehowa na nusianu, si wòwɔna, dzea edzi nɛ la, 4eve Yosef nu, eye wòtsɔe wɔ eƒe subɔlae, eye wòtsɔe ɖo eƒe me nu wo dzikpɔlae hetsɔ eƒe nuwo katã ɖe esi. 5Tso esime wòtsɔe ɖo eƒe aƒe me nuwo dzikpɔlae, eye wotsɔ eƒe nuwo katã de esi la, Yehowa yra Egiptetɔ la ƒe aƒe le Yosef ta, eye Yehowa ƒe yayra le nusiwo katã le esi le aƒe me kple agble me la dzi. 6Eye wotsɔ eƒe nuwo katã de Yosef si, eye megatsɔ ɖeke le nyaa ɖeke me o, negbe eƒe nuɖuɖu ko. Eye Yosef nyo, eye wòdze ɖeka ŋutɔ.
Yosef nɔ anyi dzadzɛ.
7Le nusiawo megbe la eƒe aƒetɔ srɔ̃ nɔa ahiãmoe ɖom ɖe Yosef ŋu, eye wògblɔ bena: Va mlɔ gbɔnye. 8Ke egbe, eye wògblɔ na eƒe aƒetɔ srɔ̃ bena: Kpɔ ɖa, nye aƒetɔ megatsɔ ɖeke le aƒea ƒe nya me o, eye wòtsɔ eƒe nuwo katã ɖe asi nam. 9Amea ɖeke meɖe nunye le aƒe sia me o, eye womeɖe naneke le eme nam o, negbe wò ko, elabena srɔ̃a nènye. Aleke gɔ̃ mawɔ vɔ̃ gã sia, eye mada vo ɖe Mawu ŋuti mahã? 10Eye wonɔa nya sia gblɔm na Yosef ŋkeke sia ŋkeke, ke melɔ̃ be, yeamlɔ egbɔ, eye yeade asi eŋu o. 11Gbe ɖeka esi wòva aƒea me, be wòawɔ eƒe dɔwo, eye aƒeametɔa ɖeke meli o la, 12ele eƒe avɔ, eye wògblɔ bena: Va mlɔ anyi kplim! Ke egblẽ eƒe avɔ la ɖe esi me, eye wòsi do go le aƒea me. 13Esi wòkpɔ be, egblẽ eƒe avɔ ɖe ye si hesi do go la, 14eya aƒeametɔwo vɛ, eye wògblɔ na wo bena: Mikpɔ ɖa, ekplɔ Hebritɔ sia vɛ na mi, amesi ɖi be, yeado ŋukpe mí. Eva gbɔnye, be yeamlɔ anyi kplim, ke medo ɣli sesĩe! 15Esi wòkpɔ be, medo ɣli sesĩe la, egblẽ eƒe avɔ ɖe gbɔnye, eye wòsi do go le aƒea me. 16Eye wotsɔ eƒe avɔ ta da ɖe eɖokui gbɔ, vaseɖe esime eƒe aƒetɔ gbɔ. 17Eye wògblɔ nya mawo ke na eya hã bena: Kpɔ ɖa, Hebri-kluvi, si nekplɔ vɛ na mi la, va gbɔnye, be yeado ŋukpem. 18Ke esi medo ɣli sesĩe la, egblẽ eƒe avɔ ɖe gbɔnye, eye wòsi do go le aƒea me.
Wode Yosef gaxɔ me.
19Esi eƒe aƒetɔ se nya, siwo srɔ̃a gblɔ nɛ bena: ale kple ale wò kluvi wɔ ɖe ŋunye la, dɔme vee ŋutɔ. 20Eye Yosef ƒe aƒetɔ lée de gaxɔ, si me fia ƒe gatɔwo nɔna la me, eye wònɔ afima le gaxɔa me. 21Ke Yehowa nɔ kple Yosef, eye wòna gaxɔdzikpɔla ƒe dzime kɔ ɖe eŋu, eye wòve enu. 22Eye gaxɔdzikpɔla tsɔ gatɔ, siwo katã le gaxɔa me la, de Yosef si, eye nusianu, si wowɔna le afima la, eyae ɖonɛ na wo. 23Eye gaxɔdzikpɔla metsɔ ɖeke le nusi wòwɔna la me o, elabena Yehowa li kplii, eye nusianu, si wòwɔ na la Yehowa na wòdzea edzi nɛ.",https://www.bible.com/bible/2259/GEN.39.EWERV
MOSE I 40,"Yosef ɖe drɔ̃e gɔme na gatɔ eve.
1Le nya siawo megbe la Egipte-fia ƒe ahakula kple aboloƒola woda vo ɖe woƒe aƒetɔ, Egipte-fia ŋuti. 2Eye Farao do dɔmedzoe ɖe eŋuti me eveawo, ahakulawo ƒe amegã kple aboloƒola wo ƒe amegã ŋuti. 3Eye wotsɔ wo de gaxɔ, si le fia ŋuti mewo ƒe amegã ƒe xɔ, si me wode Yosef hãe la me. 4Fia ŋuti mewo ƒe amegã la tsɔ wo de Yosef si, bena wòakpɔ wo dzi, eye wonɔ gaxɔ me ɣeyiɣi didia ɖe. 5Gbe ɖeka ƒe zã Egipte-fia ƒe ahakula kple aboloƒola, siwo le gaxɔ me la, woku drɔ̃e wo tɔ wo tɔwoe, eye drɔ̃eawo gɔme le vovovo. 6Esi Yosef va wo gbɔ le ŋdi la, ekpɔ wo bena, woli kpoo. 7Tete wòbia Farao ŋuti me, siwo le gaxɔ me kplii le eƒe aƒetɔ ƒe xɔ me la, bena: Nuka wɔ mieɖo adã egbea ale? 8Woɖo eŋu nɛ bena: Míeku drɔ̃e, gake amesi aɖe egɔme, meli o. Tete Yosef gblɔ na wo bena: Alo drɔ̃e gɔmeɖeɖe la menye Mawu fɔe oa? Gake milii nam ko!
Ahakula la ƒe drɔ̃ekuku.
9Tete ahakulawo ƒe amegã lĩ eƒe drɔ̃e la na Yosef, eye wògblɔ nɛ bena: Meku drɔ̃e kpɔ weinkaa ɖe le ŋkunye me. 10Alɔ etɔ̃ le weinka sia ŋu, eye esi wode asi dzedze me la, seƒoƒo ɖo wo dzi, eye woƒe tsetsewo de asi ɖiɖi me. 11Ke Farao ƒe kplu la le asinye; tete megbe weinkpoawo, eye mefiã wo ɖe Farao ƒe kplu la me, emegbe metsɔ kplu la de asi na Farao. 12Yosef ɖo ŋu nɛ bena: Drɔ̃e la gɔme enye si: Alɔ etɔ̃awo nye ŋkeke etɔ̃. 13Le ŋkeke etɔ̃agbe la Farao ado wò ɖe dzi, eye wòagatsɔ wò aɖo wò dɔ nu. Eye nagatsɔ kplu ade Farao si, abe alesi nèwɔna tsã, esi nenye eƒe ahakula ene. 14Ke ɖo ŋku dzinye, ne eva nyo na wò! Meɖe kuku, ve nunye, eye naɖo ŋku dzinye na Farao, bena wòaɖem le xɔ sia me. 15Elabena yakatsyɔe wofim le Hebritɔwo ƒe anyigba dzi, eye afi sia hã nyemewɔ naneke, hafi wolém de ga o.
Aboloƒola ƒe drɔ̃ekuku.
16Esi aboloƒolawo ƒe amegã kpɔ bena, drɔ̃e la gɔme nyo la, egblɔ na Yosef bena: Nye hã meku drɔ̃e, eye metsɔ abolo kusi etɔ̃ ɖe ta. 17Ke kusi etametɔ me la abolo vivi vovovowo li na Farao, eye xeviwo va le wo ɖum de kusia me le tanye. 18Yosef ɖo ŋu nɛ bena: Drɔ̃e la gɔme enye si: Kusi etɔ̃awo nye ŋkeke etɔ̃. 19Le ŋkeke etɔ̃agbe la Farao atso ta le nuwo, eye woahe wò ɖe ati ŋu, eye xeviwo ava ɖu wò ŋutilã.
Alesi drɔ̃ewo va ve me.
20Le ŋkeke etɔ̃agbe la Farao ɖu eƒe dzigbe, eye wòɖo kplɔ̃ na eƒe dɔlawo katã, eye wòɖe ahakulawo ƒe amegã kple aboloƒolawo ƒe amegã le gaxɔa me le eƒe dɔlawo katã ƒe ŋku me. 21Egatsɔ ahakulawo ƒe amegã la ɖo eƒe ahakudɔ nu, bena wòagatsɔ kplu anɔ asi ɖem na Farao. 22Ke ena wohe aboloƒolawo ƒe amegã ya ɖe ati ŋu, abe alesi Yosef ɖe egɔme na wo ene. 23Ahakulawo ƒe amegã megaɖo ŋku Yosef dzi o, ke boŋ eŋlɔe be.",https://www.bible.com/bible/2259/GEN.40.EWERV
