Title,Content,URL
MOSE I 29,"Yakob subɔ le Laban gbɔ.
1Tete Yakob dze mɔ, eye wòyi ɖe ɣetoɖoƒetɔwo ƒe anyigba dzi 2Eye wòkpɔ vudoa de le gbea dzi, eye alẽha etɔ̃ wotsyɔ akɔ anyi ɖe afima; elabena vudo sia me wokua tsi lena na alẽhawo wonona, eye kpe gãa ɖe le vudo la nu. 3Eye ne alẽhawo katã va ƒo ƒu ɖe afima la, ekema womlia kpe la le vudoa nu, eye wonaa tsi alẽawo; emegbe wogamlia kpe la tua vudoa nu ɖe eteƒe. 4Yakob bia wo bena: Nɔvinyewo, afika mietso? Woɖo ŋu bena. Míetso Xaran! 5Egblɔ na wo bena: Mienyã Naxor vi Laban mahã? Woɖo ŋu bena: Ẽ, mienyae! 6Egabia wo bena: Eli sesĩe mahã? Woɖo ŋu bena: Eli sesĩe! Kpɔ ɖa, via Raxel hã kplɔ alẽwo gbɔnae. 7Eye wògblɔ bena: Kpɔ ɖa, ɣe gale dzi, eye womaƒo alẽwo nu ƒu haɖe o. Mina tsi alẽawo woano, emegbe miana woagaɖu gbe. 8Wogblɔ bena: Míale ŋui o, vaseɖe esime woaƒo alẽhawo katã nu ƒu; ekema míamli kpe la ɖa le vudoa nu, hafi miana tsi alẽawo woano. 9Esi wògale nu ƒom kpli wo la, tete Raxel kplɔ fofoa ƒe alẽwo vɛ, elabena alẽkplɔla wònye. 10Ke esi Yakob kpo Raxel, edada nɔvi Laban ƒe vinyɔnu kple edada nɔvi Laban ƒe alẽwo la, Yakob te va, eye wómli kpe la ɖa le vudoa nu, eye wòna tsi edada nɔvi Laban ƒe alẽwo wono. 11Emegbe la Yakob ɖuɖɔ nu na Raxel, eye wòɖe asi avifafa me. 12Eye Yakob gblɔ na Raxel bena, fofoa nɔvi yenye, eye Rebeka vi yenye; tete wòƒu ɖu yi ɖagblɔe na fofoa. 13Esi Laban se nya siawo le nɔvianyɔnu ƒe vi Yakob ŋuti la, eƒu ɖu yi ɖakpee, eye wòkpla asi kɔ nɛ heɖuɖɔ nu nɛ, eye wòkplɔe va eƒe me. Eye wòxlẽ nya, siwo katã va dzɔ la, na Laban. 14Tete Laban gblɔ nɛ bena: Nyateƒee, nɔvinye kpamkpam nènye! Ke esi wònɔ egbɔ ɣleti ɖeka la, 15Laban gblɔ na Yakob bena: Nɔvinye nènye! Ɖe nawɔ ɖɔ nam dzodzroa? Gblɔe nam, nuka lanye wò fetu? 16Nyɔnuvi eve le Laban si, xoxoetɔ ŋkɔ nye Lea, eye ɖevitɔ ŋkɔ nye Raxel. 17Lea ƒe ŋkuwo dzi wɔ dɔ; ke Raxel ya nyo, eye wòdze tugbe. 18Eye Yakob lɔ̃a Raxel, eyata wògblɔ bena: Masubɔ wò ƒe adre le Raxel, wò nyɔnuvi ɖevitɔ la ta. 19Laban gblɔ bena: Enyo be, màtsɔe na wò, wu esi màtsɔe na ŋutsu bubu; nɔ gbɔnye! 20Ale Yakob subɔ ƒe adre ɖe Raxel ta, eye wòle nɛ abe ŋkekea ɖewo ko ene, le alesi gbegbe wòlɔ̃ne la ta.
Yakob ɖe srɔ̃.
21Emegbe la Yakob gblɔ na Laban bena: Tsɔ srɔ̃nye nam azɔ, elabena nye ŋkekewo ɖe, bena maɖee! 22Tete Laban kpe dua me ŋutsuwo katã, eye wòɖo kplɔ̃ na wo. 23Ke esi zã ɖo la, ekplɔ vianyɔnu Lea yi nɛ, eye wòdɔ kplii. 24Eye Laban tsɔ eƒe kosi Silpa na via Lea, bena woasubɔe. 25Ke esi ŋu ke la, ekpɔ be, Lea ye. Eye wògblɔ na Laban bena: Nuka enye si nèwɔ ɖe ŋunye? Alo menye Raxel ta mesubɔ wò ɖo oa? Nukaŋuti nèblema? 26Laban ɖo ŋu ne bena: Menye míaƒe kɔ be, woatre ɖevitɔ ɖeɖe na xoxoetɔ o. 27Ne ewu kwasiɖa sia nu la, ekema matsɔ eya hã na wò ɖe ɖɔ, si nagawɔ nam le ƒe adre bubu me la nu. 28Yakob wɔ nenema, eye wowu kwasiɖa la nu; emegbe wotsɔ via Raxel hã nɛ wòɖe. 29Eye Laban tsɔ eƒe kosi Bilha na via Raxel, bena woasubɔe. 30Azɔ edɔ kple Raxel hã, eye wolɔa Raxel wua Lea. Eye wòsubɔe ƒe adre bubu la.
31Ke esi Yehowa kpɔ bena, womelɔ̃a Lea ƒe nya o la, enu eƒe vidzidɔ, eye wòxe Raxel tɔ. 32Eye Lea fɔ fu dzi ŋutsuvi, eye wòna ŋkɔe bena Ruben; elabena egblɔ be: Yehowa kpɔ nye nublanui, azɔ srɔ̃nye alɔ̃m. 33Eyome la egafɔ fu, eye wòdzi ŋutsuvi. Eye wògblɔ bena: Yehowa se bena, womelɔ̃a nye nya o; eyata wotso esia hã nam. Eye wòna ŋkɔe bena Simeon. 34Emegbe wògafɔ fu dzi ŋutsuvi, eye wògblɔ bena: Azɔ ko srɔ̃nye aku ɖe ŋunye, elabena medzi ŋutsuvi etɔ nɛ. Eyata wòna ŋkɔe be Lewi. 35Eye wògafɔ fu dzi ŋutsuvi, eye wògblɔ bena: Azɔ la makafu Yehowa! Eyata wòna ŋkɔe bena Yuda. Emegbe la edzudzɔ vidzidzi.",https://www.bible.com/bible/2259/GEN.29.EWERV
MOSE I 30,"Mawu yra Yakob to vidzidzi me.
1Ke esi Raxel kpɔ bena, yemedzi via ɖeke na Yakob o la, Raxel ʋã ŋu nɔvianyɔnu la, eye wògblɔ na Yakob bena: Na madzi vi; ne menye nenem o la, maku! 2Tete Yakob do dɔmedzoe ɖe Raxel ŋuti gblɔ bena: Alo Mawu ye menye, amesi xe wò vidzidɔa? 3Eye wògblɔ bena: Nye kosi Bilha enye si, ɖɔ kplii, bena wòadzi vi ɖe nye akɔ, eye maxɔ mamayɔvi tso egbɔ! 4Eye wòtsɔ eƒe kosi Bilha ne wòde, eye Yakob dɔ kplii. 5Eye Bilha fɔ fu dzi ŋutsuvi na Yakob. 6Tete Raxel gblɔ bena: Mawu tso afia nam, ese nye gbe, eye wòna ŋutsuvim. Eyata wòna ŋkɔe be Dan. 7Eyome la Raxel ƒe kosi Bilha gafɔ fu, eye wòdzi ŋutsuvi evelia na Yakob. 8Eye Raxel gblɔ bena: Meʋli heƒo koko na Mawu le nɔvinye ta, meɖu dzi Eyata wòna ŋkɔe bena Naftali. 9Ke esi Lea kpɔ bena, yemegale vi dzim o la, etsɔ eƒe kosi Silpa na Yakob wòɖe. 10Eye Silpa, Lea ƒe kosi la, dzi ŋutsuvi na Yakob. 11Tete Lea gblɔ bena: Nye Mawu ɖi! Eye wòna ŋkɔe be Gad. 12Eyome Silpa, Lea ƒe kosi la, gadzi ŋutsuvi evelia na Yakob. 13Tete Lea gblɔ bena: Mekpɔ dzɔgbe nyui! Azɔ vinyɔnuwo akafum bena, dzɔgbenyuitɔ menye. Eyata wòna ŋkɔe be Aser. 14Le luŋeɣi la Ruben yi agble me, eye wòkpɔ agbitsa tsɔ vɛ na dada Lea. Tete Raxel gblɔ na Lea bena: Meɖe kuku, na viwò ƒe agbitsa la ɖem! 15Eɖo ŋu nɛ bena: Alo mesɔ gbɔ be, nèxɔ srɔ̃nye le asinye oa? Azɔ nèle didim be, nagaxɔ vinye ƒe agbitsa hãa? Tete Raxel gblɔ bena: Ekema nedɔ gbɔwò egbe zã ɖe viwò ƒe agbitsa la nu! 16Esi Yakob gbɔ tso gbe me le fiẽ la, Lea yi ɖakpee gblɔ bena: Gbɔnyee nava, elabena mexe fe ɖe tawo kple vinye ƒe agbitsa! Eye wòdɔ egbɔ le zã ma me. 17Eye Mawu ɖo to Lea, eye wòfɔ fu dzi ŋutsuvi atɔ̃lia na Yakob. 18Eye Lea gblɔ bena: Mawu xe fe nam, elabena metsɔ nye kosi na srɔ̃nye wòɖe. Eyata wòna ŋkɔe be Isaxar. 19Eyome Lea gafɔ fu, eye wòdzi ŋutsuvi adelia na Yakob. 20Tete Lea gblɔ bena Mawu na nu nyuia ɖem, azɔ srɔ̃nye abum, elabena medzi ŋutsuvi ade nɛ. Eyata wòna ŋkɔe be Zebulon. 21Emegbe la edzi nyɔnuvi, eye wòna ŋkɔe be Dina. 22Tete Mawu ɖo ŋku Raxel dzi, eye Mawu ɖo toe, eye wòʋu eƒe vidzidɔ. 23Eye wòfɔ fu dzi ŋutsuvi, tete wògblɔ bena: Mawu ɖe nye ŋukpe ɖa! 24Eyata wòna ŋkɔe be Yosef; elabena egblɔ be: Yehowa agatsɔ ŋutsuvi bubu akpee nam.
Yakob ƒe kesinɔnuwo.
25Ke esi Raxel dzi Yosef megbe la, Yakob gblɔ na Laban bena: Do mɔm, ne mayi mía de. 26Tsɔ srɔ̃nye kple vinye, siwo ta mesubɔ wò ɖo la nam, ne madzo; elabena wò ŋutɔ ènya alesi mesubɔ wòe! 27Tete Laban gblɔ nɛ bena: Ve nunye dzro! Elabena medze sii bena, Yehowa yram le tawo. 28Eye wògayi edzi bena: Gblɔ fetu, si dim nèle la nam, ne mana wò! 29Eɖo ŋu nɛ bena: Wò ŋutɔ ènya alesi mesubɔ wòe, kple alesi wò lãha va zu le gbɔnye. 30Nusi le asiwò hafi meva la, ele sue ko; ke azɔ la edzi ɖe dzi ŋutɔ, eye afisiafi, si meto la, Yehowa yraa wò; ke ɣekaɣi gɔ̃e nye hã mawɔ dɔ na ɖokuinye? 31Tete wògblɔ bena: Nuka mana wò? Yakob ɖo ŋu bena: Nyemaxɔ agaga femee hã le asiwò o, negbe ne alɔ nusi magblɔ na wò la dzi ko; na maganyi wò alẽwo, eye makpɔ wo dzi. 32Egbe la matsa le wò lãha la katã me, eye maɖe lã, siwo le ŋɔtaŋɔta, kple esiwo tso kpɔ la, ɖe vovo: Alẽvi, siwo le yibɔ, kple gbɔ̃, siwo tso kpɔ, kple esiwo le ŋɔtaŋɔta la, nanye nye fetu! 33Gbesigbe nava kpɔ nye fetua ɖa la, ekema nye anukwareɖiɖi adze ƒã; ne àkpɔ gbɔ̃, si mele ŋɔtaŋɔta o, kple esi metso kpɔ o, kpakple alẽvi, si mele yibɔ o la, ekema ɖe mefii. 34Laban ɖo ŋu bena: Nenɔ nenema, abe alesi negblɔ ene. 35Gbemagbe ke wòɖe gbɔ̃tsu, siwo me fli to, kple esiwo tso kpɔ, kple gbɔ̃nɔ, siwo katã le ŋɔtaŋɔta, kple esiwo tso kpɔ — lã sia lã, si me ɣi to — kpakple alẽvi, siwo le yibɔ la, ɖe vovo, eye wòde wo asi na viawo. 36Eye wòɖo be, ye kple Yakob dome mɔ nadidi ŋkeke etɔ, eye Yakob nyi Laban ƒe lã mamleawo. 37Tete Yakob tsɔ logo, xe kple nyati mumuwo, eye woŋlɔ wo ŋu ale: eɖe tsroa ɖe le wo ŋu, eye wòkpɔtɔ ɖe ɖe wo ŋu. 38Emegbe la etsɔ ati, siwo woŋlɔ la, da ɖe lãwo ƒe tsinonu me, eye ne lãwo le asi yɔm le tsinɔƒea la, etsɔa wo dana ɖe woƒe ŋku me. 39Eye ne lãwo lé ŋku ɖe atiawo ŋu hafi fɔ fu la, ekema wodzia vi, siwo me fũ to, kple esiwo le ŋɔtaŋɔta, kple esiwo tso kpɔ. 40Eye Yakob ɖe lãviawo ɖo Laban ƒe lã, siwo le ŋɔtaŋɔta, kple esiwo tso kpɔ la kasa. Ale wòɖo lãha tɔxe na eɖokui, eye mena wotɔtɔ kple Laban towo o. 41Eye ne lã sesẽtɔwo le asi yɔm la, Yakob tsoa ati ŋɔŋlɔawo dana ɖe lãwo ƒe ŋku me le tsinonu la mè, bena woafɔ fu ɖe ati ŋɔŋlɔawo ŋu. 42Ke nenye lã beliwoe la, metsɔnɛ ɖoa woƒe ŋku me o; eyata lã beliawo zua Laban tɔ, ke sesẽawo zua Yakob tɔ. 43Eye ŋutsu la ƒe kesinɔnuwo le dzidzim ɖe dzi ŋutɔ, eye wòkpɔ alẽwo kple gbɔwò, kosiviwo kple kluviwo, kposɔwo kple tedzi geɖewo?",https://www.bible.com/bible/2259/GEN.30.EWERV
MOSE I 31,"Yakob si kple etɔwo.
1Ke esi Laban viŋutsuwo gblɔ bena: Yakob da dzo mía fofo ƒe nuwo katã, eye nusiwo nye mía fofo tɔ la, woawoe wòxɔ wɔ eƒe kesinɔnu siawo katãe. 2Eye Yakob kpɔ be, Laban megakɔa ŋku me ɖee abe tsã ene o. 3Eye Yehowa gblɔ na Yakob bena: Trɔ yi fofowò ƒe anyigba dzi kple ƒowòmeawo gbɔ, eye manɔ anyi kpli wò! 4Tete Yakob dɔ woyi ɖayɔ Raxel kple Lea va eƒe lãha gbɔ le gbe me. 5Eye wògblɔ na wo bena: Mekpɔ be, mia fofo megakɔa ŋku me ɖem abe tsã ene o; gake fofonye ƒe Mawu la li kplim. 6Mia ŋutɔwo mienyae bena, nye ŋusẽ katã metsɔ subɔ mia fofo lae. 7Gake mia fofo blem, eye wòɖɔ li nye fetu zi ewo; ke Mawu meɖe mɔ nɛ be, wòawɔ vɔ ɖe ŋunye o. 8Ne egblɔ bena: lã ŋɔtaŋɔtawo nanye wò fetu la, ekema lãha blibo la katã dzia vi ŋɔtaŋɔtawo sɔŋ, eye ne egagblɔ bena: lã, siwo me fli to, nanye wò fetu la, ekema lãha blibo la dzia vi, siwo me fli to la. 9Ale Mawu xɔ lãha blibo le mia fofo si hetsɔ nam. 10Eye esi lãwo le asi yɔm la, meku drɔ̃e kpɔ bena, lãtsu, siwo me fli to, esiwo le ŋɔtaŋɔta, kple esiwo tso kpɔ sɔŋ, le lãnɔwo liam. 11Eye mawudɔla gblɔ nam le drɔ̃e me bena: Yakob! Meɖo ŋu bena: Nye enye si! 12Eye wogblɔ bena: Kpɔ ɖa, lãtsu, siwo me fli to, esiwo le ŋɔtaŋɔta, kple esiwo tso kpɔ la, le lãnɔawo liam. Elabena mekpɔ nusi Laban wɔ ɖe ŋuwò la. 13Nye enye Mawu, si ɖe eɖokui fia wò le Betel, afisi nèkɔ ami ɖe kpe dzi, eye nèɖe adzɔgbe nam le. Tso, naʋu le anyigba sia dzi àgatrɔ yi ɖe mia denyigba dzi! 14Tete Raxel kple Lea woɖo ŋu nɛ bena: Ɖe gome kple domenyinyia ɖe gali na mi le mía fofo ƒe mea? 15Ɖe mele mia bum amedzrowoe oa? Elabena etsɔ mí dzra, eye wòle ga, si wòxɔ ɖe mía ta la ɖum vaseɖe mi. 16Elabena kesinɔnu, siwo katã Mawu xɔ le mía fofo si la, wonye mía ŋutɔwo kple mia viwo tɔ; eyata wɔ nusianu, si Mawu gblɔ ha wò la ko! 17Tete Yakob tsɔ viawo kple srɔ̃awo ɖo kposɔwo dzi. 18Emegbe la ekplɔ eƒe lãwo katã, eye wotsɔ eƒe kesinɔnuwo katã, nusianu, si wòkpɔ le Mesopotamia la, eye wòdzo yina ɖe fofoa Isak gbɔ le Kanaan-nyigba dzi. 19Ke esi Laban yi fu sẽ ge na lãwo la, Raxel fi fofoa ƒe aklama kpakpɛwo. 20Eye Yakob ble Laban Aramtɔ la, elabena megblɔe nɛ hafi dzo o. 21Ale wòsi yi kple nusiwo katã le esi la, eye wotso tɔsisi la heɖo ta Gilead-towo gbɔ.
Yakob wɔ ɖeka kple Laban.
22Le ŋkeke etɔ̃ megbe la wova gblɔ na Laban bena, Yakob si. 23Tete wotsɔ nɔvia wo kpe ɖe eɖokui ŋu ti eyome ŋkeke adre sɔŋ, eye wòva tui le Gilead-towo dzi. 24Eye Mawu va Laban, Aramtɔ la gbɔ le zã me drɔ̃eƒe, eye wògblɔ nɛ bena: Kpɔ ɖokuiwò dzi, be nagaƒo nu yɔa ɖeke kple Yakob o. 25Eye Laban va tu Yakob; eye Yakob tu eƒe agbadɔ ɖe to la dzi, ke Laban kple nɔviawo tu wo tɔ ɖe Gilead-to la dzi. 26Tete Laban gblɔ na Yakob bena: Nuka nye esi nèwɔ, eye nèblem hekplɔ vinyenyɔnuwo dzoe abe aboyomewo ene? 27Nukaŋuti nèsi le adza me, eye nèblem, eye mèklãm, be maɖo wò ɖa kple aseyetsotso, hadzidzi, ʋuƒoƒo kple saŋkuƒoƒo o, 28eye mèna meɖuɖɔ nu na nye tɔgbuiyɔviwo kple vinyenyɔnuwo o mahã? Ewɔ bometsinu! 29Ŋusẽ le asinye be, mawɔ vɔ̃ mi hafi, gake le etsɔ ƒe zã, si va yi me la, mia fofo ƒe Mawu la gblɔ nam bena: Kpɔ ɖokuiwò dzi, be nagaƒonu vɔ̃a ɖeke kple Yakob o. 30Ke esi nèdzo, elabena aƒe le dzrowòm vevie la, nukaŋuti nefi nye mawuwo? 31Tete Yakob ɖo ŋu na Laban bena: Mele vɔvɔ̃m, elabena mesusu be, ɖewohĩ axa viwònyɔnuawo le asinye. 32Amesi ke gbɔ nakpɔ wò mawuawo le la, magano agbe o! Le mía nɔviawo katã ƒe ŋku me ka nye nuwo me, eye natsɔe! Ke Yakob menyae bena. Raxel ye fii o. 33Tete Laban ka Yakob kple Lea kpakple kosi eveawo ƒe agbadɔwo me, mekpɔe o; emegbe la; edze le Lea ƒe agbadɔ me heyi ɖe Raxel ƒe agbadɔ me. 34Ke Raxel fi aklama kpakpɛawo, eye wòtsɔ wo ɣla ɖe kposɔ ƒe akpa le hebɔbɔ no edzi. Eye Laban ka agbadɔ la katã me, ke mekpɔ naneke o. 35Eye wògblɔ na fofoa bena: Nye aƒetɔ, megabi dzi be, nyemate ŋu atsi tre o, elabena mekpɔ dzinu! Eye wódii gadu, ke mekpɔ aklama kpakpɛawo o. 36Azɔ Yakob bi dzi hedo dɔmedzoe ɖe Laban ŋuti. Eye Yakob bia Laban bena. Vo ka meda, eye vɔ ka mewo be, nele hosuhosu dom nam ale? 37Eka nye nuwo katã me, aƒewo me nu ka nakpɔ mahã? Tsɔe va da ɖe mia kple nɔviwòawo katã ŋku me, bena woatso atia na mia dometɔ, si to dzo! 38Ƒe blave enye si menɔ gbɔwò, fu mege le wò alẽnɔ kple wò gbɔ̃nɔa ɖeke ŋu kpo o, eye nyemele agboa ɖeke tso wò alẽha la me ɖu kpo o. 39Esiwo nu lé la, nyemetsɔa wo vanɛ na wò o, ke boŋ meɖoa eteƒe na wò, elabena èbianɛ tso asinye, eɖanye wofii le ŋɖɔ alo zã o. 40Le ŋkeke me ŋdɔ ɖuam, eye le zã me vuvɔ wɔam, eye nyemedɔa alɔ̃ hã o. 41Ƒe blave sɔŋ mena aƒewò me. Mesubɔ wò ƒe wuiene ɖe viwònyɔnuvi eveawo ta, eye ƒe ade ɖe alẽwo la; gake eɖo li nye fetu zi ewo. 42Ɖe menye tɔgbuinyewo ƒe Mawu, Abraham ƒe Mawu, si Isak hã vɔ̃na lae, nɔ anyi kplim o la, anye ne ado mɔm asi ƒuƒlui: gake Mawu kpo nye fukpekpe kple nye agbagbadzedze la, eyata wòtso afia nam etso ƒe zã, si va yi. 43Tete Laban ɖo ŋu na Yakob bena: Nyɔnuawo tɔnyewoe, ɖevia wo hã tɔnyewoe, lãwo tɔnyewoe, eye nusianu, si kpam nele la, tɔnyee! Ke nuka mawɔ ɖe vinyenyɔnuwo kple vi, siwo wodzi la ŋu? 44Na míabla nu kple mía nɔewo, eye esia anye ɖase le mia kpli wò dome. 45Tete Yakob tso kpea ɖe tu anyi, be wòanye dzesikpe. 46Eye Yakob gblɔ na nɔviawo bena: Mifa kpewo vɛ! Eye wofɔ kpewo li koe; emegbe la woɖu nu le afima le ka la dzi. 47Eye Laban na ŋkɔe be Yegar-Saxaduta; ke Yakob na ŋkɔe bena Galed. 48Eye Laban gblɔ bena: Kpekɔ sia enye ɖase le mia kple wò dome egbe. Eyata wona ŋkɔe bena Galed kple Mizpa, 49elabena egblɔ be Yehowa anɔ mia kple wò ŋuti dzom, ne miegale adzɔge tso mia nɔewo gbɔ hã la. 50Ne ate vinyenyɔnuwo ɖe anyi, alo naɖe srɔ̃ bubu akpe ɖe vinyenyɔnuawo ŋu la — amea ɖeke mele mia gbɔ o, Mawu koe nye ɖaseɖila le mia kpli wo dome. 51Eye Laban gblɔ na Yakob bena: Kpekɔ sia kple dzesikpe, si mia kpli wò mietu. — 52Kpekɔ sia kple dzesikpe la anye ɖase Nyemekpɔ mo ato kpekɔ sia kple dzesikpe sia ŋu ava gbɔwo o, eye wò hã mekpe mo aɖo tame vɔ̃ ato kpekɔ sia kple dzesikpe sia ŋu ava gbɔnye o! 53Abraham ƒe Mawu, Naxor ƒe Mawu kple wo tɔgbuiwo ƒe Mawu la anye ʋɔnudrɔ̃la le mía kpli wò dome. Eye Yakob tsɔ amesi fofoa Isak vɔ̃na la, ka atam. 54Emegbe la Yakob wu vɔsalãwo le to la dzi, eye wokpe nɔviawo be, woava ɖu nu. Eye woɖu nu, eye wotsi to la dzi dɔ.",https://www.bible.com/bible/2259/GEN.31.EWERV
MOSE I 32,"Yakob kpe mawudɔlawo.
1Eye esi Laban fo ŋdi kanya la, eɖuɖɔ nu na tɔgbuiayɔviwo kple vianyɔnuwo, eye wòyra wo. Emegbe la Laban dze mɔ gatrɔ yi enɔƒe. 2Ke Yakob hã dze eƒe ma dzi, eye mawudɔlawo va do goe. 3Eye esi Yakob kpɔ wo la, egblɔ be Mawu ƒe asaɖa enye esia! Eyata wòyɔ teƒe ma be Maxanaim.
Yakob vi Esau.
4Eye Yakob dɔ dɔlawo ɖo ɖe eŋgɔ ɖe nɔvia Esau gbɔ le Seir-nyigba dzi le Edom gbedzi. 5Eye wògblɔ na wo bena: Ale miagblɔ na nye aƒetɔ Esau enye si: Wò dɔla Yakob be, míagblɔ na wò bena: Menɔ Laban gbɔ, eye metsi anyi ʋuu vaseɖe fifi. 6Eye mekpɔ aƒenyiwo, tedziwo kple alẽwo, kluviwo kple kosiviwo, eye meɖo dɔlawo ɖo ɖe nye aƒetɔ gbɔ, be wòave nunye. 7Eye dɔlawo gatrɔ va Yakob gbɔ, eye wogblɔ bena: Miede noviwò Esau gbɔ, eye eya hã gbɔna kpe wò ge kple ame alafa ene. 8Tete Yakob de asi vɔvɔ̃ me ŋutɔ, eye dzika tso eƒo, eye wòmã amesiwo le eŋu, alẽwo, aƒenyiwo kple kposɔwo ɖe akpa eve me. 9Elabena egblɔ bena: Ne Esau ava dze akpa ɖeka dzi, eye woade zi wo me la, ekema akpa ɖeka nasi adzo.
Yakob ƒe gbedodoɖa.
10Eye Yakob gblɔ bena. Wò, fofonye Abraham ƒe Mawu kple fofonye Isak ƒe Mawu, Yehowa, wò amesi gblɔ nam bena: Trɔ yi ɖe wò anyigba dzi kple ƒowòmeawo gbɔ, eye mawɔ nyuie na wò la, 11nye medze wò nublanui, si nèkpɔ nam, kple wò anukware, si nẽɖi na wò dɔla la dometɔa ɖeke o; elabena nye ati sia metsɔ tso Yordan sia, ke azɔ la metrɔ zu asafokɔ eve. 12Meɖe kuku, ɖem tso nɔvinye si me, tso Esau si me; elabena mele evɔ̃m be, ava dze dzinye, eye wòaɖe zi dadawo kple viwo dome. 13Wò ŋutɔ gblɔ be: Mawɔ nyuie na wò vava, eye mana wò dzidzimeviwo nasɔ gbɔ abe ƒutake, si womate ŋu axlẽ le agbɔsɔsɔ ta o la ene.
Yakob fa akɔ na Esau.
14Eye wòtsi afima dɔ. Eye wòtsɔ nusiwo le esi la ƒe akpa ɖeka ɖo ɖe nɔvia Esau: 15Gbɔ̃nɔ alafa eve kple gbɔ̃tsu blave, alẽnɔ alafa eve kple agbo blave, 16kposɔ vinɔ blaetɔ̃ kple wo viwo, nyinɔ blane kple nyitsu ewo, tedzinɔ blave kple tedzivi ewo. 17Eye wotsɔ wo de dɔlawo si hamehame, eye wògblɔ na dɔlawo bena: Midze ŋgɔnye, eye mina lãhawo dome naɖe. 18Eye wogblɔna ŋgɔgbetɔ bena: Ne nɔvinye ava do go wò, eye woabia wò bena: Ameka vi nènye, afika nèyina, eye nusiwo le ŋgɔwò la, ameka tɔe mahã la, 19ekema naɖo ŋu bena. Wò dɔla Yakob ɖo nu siawo ɖe nye aƒetɔ Esau: eye eya ŋutɔ le mia megbe gbɔna. 20Nenema wògblɔ na ame evelia, etɔ̃lia kple mamle, siwo katã le lãhawo kplɔm la, eye wògblɔ bena: Alea tututu miagblɔ na Esau, ne mieɖo goe! 21Eye miagblɔ bena: Wò dɔla Yakob hã le mía megbe gbɔna. Elabena egblɔ be, yeatsɔ nunana, siwo dze ŋgɔ nɛ la, akpatae gbã, hafi ye ŋutɔ yeado ɖe eƒe ŋku me, ɖewo ave ye nu axɔ ye matu. 22Ale nunanawo dze ŋgɔ, ke eya ŋutɔ tsi asaɖa me dɔ le zã ma me.
23Emegbe la efɔ le zã ma me, eye eya kple esrɔ̃ eveawo kple kosi eveawo kpe ɖe ɖevi wuiɖekɛawo ŋu, wotso Yabok tɔsisi la. 24Eye esi wòna woɖe tsi wo kple nusiwo katã le esi, yi ɖe tɔa godo la, 25Yakob ɖeɖe tsi megbe. Tete ŋutsua ɖe va te kame kplii ʋuu, vaseɖe esime agu dze. 26Ke esi wòkpɔ be, yemate ŋui o la, etɔ asi eƒe aligo, eye Yakob ƒe aligokpeƒe ɖɔ li, le esime wole ka mea tem la. 27Eye ŋutsu la gblɔ bena: Ɖe asi le ŋunye, elabena agu le dzedzem! Ke eɖo ŋu bena: Nyemele asi ɖe ge le ŋuwò o, negbe ɖeko nayram hafi. 28Ebiae bena: Ŋkɔwò ɖe? Eɖo ŋu bena: Yakob. 29Eye wògblɔ bena: Womagayɔ wò be Yakob akpɔ o, ke boŋ Israel, elabena ete kame kple Mawu kpakple ame, eye nete ŋui. 30Tete Yakob biae bena: Meɖe kuku, yɔ wò ŋkɔ nam! Eɖo ŋu bena: Nukaŋuti gɔ̃ nèle nye ŋkɔ ta biam? Eye wòyrae lé afima. 31Eye Yakob na ŋkɔ teƒe la be Pniel, elabena egblɔ be: Mekpɔ Mawu ŋku me kple ŋku me: gake metsi agbe. 32Ke esi wòɖe Pniel ɖe megbe la, ɣe dze, eye wòle tɔtɔm ɖe aku dzi. 33Eyata Israel-viwo meɖua ka sesẽ, si la aligokpeƒe la o vaseɖe egbegbe, elabena wòtɔ asi ka, si le Yakob ƒe aligokpeƒe la dzi.",https://www.bible.com/bible/2259/GEN.32.EWERV
MOSE I 33,"Yakob lé avu eɖokui kple Esau dome.
1Eye esi Yakob kpɔ bena: Esau kple eŋume alafa eneawo gbɔna la, emã ɖeviawo na Lea, Raxel kple kosi eveawo. 2Eye wòtsɔ kosi eveawo kple wo viwo ɖo ŋgɔ, eyome Lea kple viawo, emegbe Raxel kple Yosef. 3Ke eya ŋuta dze wo ŋgɔ, eye wotsyɔ mo anyi zi adre, vaseɖe esime wòle tu nɔvia. 4Tete Esau ƒu du va kpee, kpla asi kɔ nɛ, eye wòɖuɖɔ nu nɛ, eye wòde asi avifafa me. 5Eye esi wòfɔ kɔ dzi kpɔ nyɔnuawo kple ɖeviawo la, ebia bena: Amekawo nye esiawo le ŋuwò mahã? Eɖo ŋu bena: Woawoe nye vi, siwo Mawu na wò dɔla! 6Tete kosiawo kple wo viwo va dze klo, 7eyome Lea kple viawo va dze klo, emegbe Yosef kple Raxel wova dze klo. 8Eye wòbiɛ bena: Ha blibo ka enye si va kpem le mɔ dzi? Eɖo ŋu be: Bena nye aƒetɔ nave nunye! 9Esau gblɔ bena: Nu geɖe le asinye, nɔvinye, wò nuwo nenɔ asiwò ko. 10Yakob ɖo ŋu nɛ bena: Gbeɖe! Ne ave nunye la, ekema xɔ nye nunana la! Elabena mekpɔ wò ŋku me abe Mawu ƒe ŋku mee mekpɔ ene, eye nève nunye. 11Xa nye nusi wotsɔ vɛ na wò la dzro, elabena Yehowa yram, mekpɔ nu geɖe! Eye wótèe ɖe ŋu, vaseɖe esime wòxɔe. 12Eye wògblɔ bena: Na miadze mɔ, ke nye la madze ŋgɔwò. 13Eɖo ŋu ne bena: Nye aƒetɔ, wò ŋutɔ ènyae bena, ɖevi dzawo kple alẽ kple nyi vinɔwo le ŋunye ne woaƒo du ɖe wo nu ŋkeke ɖeka ko la, ekema lãha blibo la atsrɔ̃. 14Meɖe kuku, nye aƒetɔ nedze eƒe dɔla ŋgɔ, eye nye la madze yowòme blewublewu, abe alesi lãha la kple ɖevi dzawo ate ŋui ene, vaseɖe esime matu nye aƒetɔ le Seir. 15Tete Esau gblɔ bena: Ekema magblẽ amesiwo le ŋunye la ɖewo ɖe gbɔwò! Eɖo ŋu bena: Nukaŋuti, esi nye aƒetɔ ve nunye xoxo ɖe! 16Eye Esau lé eƒe mɔ gbemagbe ke gatrɔ va Seir.
Yakob tso aƒe ɖe Sixem gbɔ.
17Eye Yakob dze mɔ va Sukot, eye wòtu xɔ ɖe afima, ke ewɔ agbadɔ na eƒe lãhawo; eyata woyɔ afima bena Sukot. 18Esi Yakob ʋu tso Mesopotamia la, eɖo Sixem, du, si le Kanaan-nyigba dzi la me dedie, eye wònɔ dua xa. 19Eye wòƒle anyigba, si dzi wòtu eƒe agbadɔ ɖo la, le Sixem fofo Hemor ƒe viwo si, kesita alafa ɖeka. 20Eye wòɖi vɔsamlekpui ete afima, eye wòna ŋkɔe bena: „Mawu, si enye Israel ƒe Mawu“.",https://www.bible.com/bible/2259/GEN.33.EWERV
