Title,Content,URL
MOSE I 1,"Xexemewɔwɔ
1Le gɔmedzedzea me Mawu wɔ dziƒo kple anyigba. 2Ke anyigba le nyama, nɔnɔme meli nɛ o, ele ƒuƒlu, eye viviti do ɖe tsi gbana la ŋku me, eye Mawu ƒe Gbɔgbɔ le agba sam le tsia dzi.
3Eye Mawu gblɔ be: Kekeli nedo! Eye kekeli do. 4Eye Mawu kpɔ kekelia bena enyo. Eye Mawu ma kekeli la kple viviti la dome. 5Mawu yɔ kekeli la be ŋkeke; ke viviti la eyɔe be zã. Ale zã do, eye ŋu ke, eya nye ŋkeke gbãtɔ.
6Eye Mawu gblɔ be: Alili nenɔ tsia titina, be wòanye dometsonu anɔ tsi kple tsi dome! 7Eye Mawu wo alili la, eye wòmã tsi, si le alilia te, kple tsi, si le alilia ta me la dome. Eye wòva me nenema. 8Eye Mawu yɔ alilia be dziƒo. Ale zã do, eye ŋu ke, eya nye ŋkeke evelia. 9Eye Mawu gblɔ be: Tsi, si le dziƒoa te la, neƒo ƒu ɖe teƒe ɖeka, bena ƒuƒuiƒe nadze! Eye wòva me nenema. 10Mawu yɔ ƒuƒuiƒe la be anyigba, ke tsi ƒoƒua la eyɔe be atsiaƒu. Eye Mawu kpo bena enyo. 11Eye Mawu gblɔ be: Anyigba nemie gbe fẽwo, nu miemie, siwo tsea ku, kple ati tseku, siwo tsena wo tɔ wo tɔwoe, esiwo me ku le, le anyigba la dzi. Eye wòva me nenema. 12Anyigba mie gbe fẽwo, nu miemie, siwo tsea ku wo tɔ wo tɔwoe, kple ati, siwo tsena, siwo me ku le, wo tɔ wo tɔwoe. Eye Mawu kpo bena enyo. 13Ale zã do, eye ŋu ke, eya nye ŋkeke etɔ̃lia.
14Eye Mawu gblɔ be: Nu keklẽwo nado ɖe dziƒolilia ŋu, bena woade vovo ŋkeke kple zã dome, eye woanɔ anyi anye dzesiwo, afia azãgbewo, ŋkekewo kple ƒewo, 15eye woanye nu keklẽwo anɔ dziƒolilia ŋu, bene woaklẽ ɖe anyigba dzi! Eye wòva me nenem. 16Tete Mawu wɔ nu keklẽ gã eveawo. Ewɔ gãtɔ, bena woaɖu ŋkeke dzi, kple suetɔ, bena woaɖu zã dzi, hekpe ɖe ɣletiviwo ŋu. 17Eye Mawu tsɔ wo ɖo dziƒolilia ŋu, bena woaklẽ ɖe anyigba dzi, 18woaɖu ŋkeke kple zã dzi, eye woamã kekeli kple viviti dome. Eye Mawu kpɔ bena enyo. 19Ale zã do, eye ŋu ke, eya nye ŋkeke enelia.
20Tete Mawu gblɔ bena: Nu gbagbewo neƒu tsi le tsia me, eye xe dzodzoewo nedzo le ya me le dziƒolilia ƒe ŋku me. 21Eye Mawu wo ƒumelã klitsuwo kple nu gbagbe, siwo katã tana, eye woʋãna le tsia me, hamehame, kple xe, siwo katã dzona. Eye Mawu kpo bena enyo. 22Eye Mawu yra wo gblɔ bena: Midzi, ne miasɔ gbɔ, eye miayɔ atsiaƒutsia me, eye xe dzodzoeawo nasɔ gbã le anyigba dzi! 23Ale zã do, eye ŋu ke, eya nye ŋkeke atɔ̃lia.
24Eye Mawu gblɔ bena: Nu gbagbewo nedo tso anyigba me hamehame, aƒemelãwo kple nu tatawo kple gbemelãwo hamehame! 25Ale Mawu wɔ gbemelãwo hamehame, aƒemelãwo hamehame kple lã, siwo katã tana le anyigba dzi hamehame. Eye Mawu kpɔ bena enyo.
Mawu wɔ ame le eya ŋutɔ ƒe nɔnɔme nu.
26Eye Mawu gblɔ be: Mine míawɔ ame ɖe míaƒe nɔnɔme, woaɖi mí, eye wòaɖu ƒumelãwo, dziƒoxe dzodzoewo, aƒemelãwo kple gbemelãwo katã kpakple lã, siwo katã tana le anyigba dzi la dzi! 27Eye Mawu wɔ ame ɖe ye ŋutɔ ƒe nɔnɔme, Mawu ƒe nɔnɔme nue wòwɔe ɖo; ŋutsu kple nyɔnu wòwɔ. 28Eye Mawu yra wo, eye Mawu gblɔ na wo bena: Midzi, ne miasɔ gbɔ, eye miayɔ anyigba la dzi, eye mianye agbo ɖe edzi, miaɖu ƒumelãwo kple dziƒoxe dzodzoewo kple lã, siwo katã zɔna le anyigba dzi la dzi! 29Eye Mawu gblɔ be: Kpɔ ɖa, metsɔ nu miemie tseku, siwo katã le anyigba blibo la dzi, kple ati, siwo katã tsena, siwo me ku le la, na mi, bena woanye nuɖuɖu na mi; 30ke gbewo kple amagbewo katã nanye nuɖuɖu na anyigba dzi lãwo katã kple dziƒoxe dzodzoewo katã kple nusiwo katã tana, siwo me agbe le, le anyigba dzi. Eye wòva me nenema. 31Eye Mawu kpo nusiwo katã wòwɔ la, eye kpɔ ɖa, wonye ŋutɔ. Ale zã do, eye ŋu ke, eya nye ŋkeke adelia.",https://www.bible.com/bible/2259/GEN.1.EWERV
MOSE I 2,"Sabat
1Ale wowu dziƒo kple anyigba kple wo me nu gbogboawo katã nu enye si. 2Eye Mawu wu eƒe ɖo, si wòwɔ la nu le ŋkeke adreagbe, eye wòdzudzɔ le ŋkeke adreagbe tso eƒe do, siwo katã wòwɔ la me. 3Eye Mawu yra ŋkeke adrelia, eye wòkɔ eŋuti, elabena eya dzi wòdzudzɔ eɖokui le tso eƒe dɔwɔwɔ, siwo katã Mawu wɔ, eye wòna wodo la me.
Amegbetɔ le Paradiso.
4Esia nye dziƒo kple anyigba ƒe dzɔdzɔmenyawo le wo wɔwɔ me le ɣeyiɣi, si me Yehowa Mawu wo anyigba kple dziƒo. 5Ke gbemetia ɖeke mele anyigba dzi haɖe o, eye nu miemiea ɖeke medo ɖe gbe me haɖe o; elabena Yehowa Mawu mena tsi dza ɖe anyigba dzi haɖe o, eye ame meli ade anyigba la o. 6Eye afu do tso anyigba dzi, eye wònyɔ ɖe anyigba la katã ƒe ŋku me. 7Azã Yehowa Mawu tsɔ anyi mè ame, eye wògbɔ agbegbɔgbɔ ɖe eƒe ŋɔti me; ale ame la zu luʋɔ gbagbe. 8Tete Yehowa Mawu tso abɔ ɖe Eden le ɣedzeƒe, eye wotsɔ ame, si wòmè la, ɖo afima. 9Eye Yehowa Mawu na ati vovovo, siwo nya kpɔna, siwo ƒe tsetse nyo na ɖuɖu la, mie tso anyigba me; eye agbeti la kpakple sidzedze nyui kple vɔ̃ ƒe ati la le abɔ la titina. 10Eye tɔsisia ɖe do tso Eden, be woade tsi abɔ la; eye tso afima wòdze ɖe alɔ ene me. 11Gbãtɔ ŋkɔ nye Pison; eƒo xlã Xawila-nyigba blibo la katã; afima sika le; 12eye anyigba sia ƒe sika nyo ŋutɔ; afima bedolax- kple soham-kpe hã le. 13Tɔsisi evelia ŋkɔ nye Gixon; eƒo xlã Kus-nyigba blibo la katã. 14Tɔsisi etɔ̃lia ŋkɔ nye Xidekel; esi to Asur ƒe ɣedzeƒe gome. Eye tɔsisi enelia nye Frat. 15Eye Yehowa Mawu tsɔ ame la ɖo Eɖen-bɔ me, be woaŋlɔ eme, eye wòakpɔ edzi.
Mawu fe sedede.
16Eye Yehowa Mawu de se na ame gblɔ bena: Ɖu abɔmetiawo katã ƒe tsetse faa; 17ke ati, si na wodzea si nyui kple vɔ la, megaɖu eya ƒe tsetsea ɖeke o; gbesigbe naɖu eƒe ɖe, ku ke naku. 18Eye Yehowa Mawu gblɔ bena: Menyo bena ame la natsi akogo o; mawɔ kpeɖeŋutɔ, si asɔ ɖe eŋu la nɛ. 19Tete Yehowa Mawu tsɔ anyi mè gbemelãwo katã kple dziƒoxe dzodzoewo katã, eye wòkplɔ wo va amea gbɔe, be yeakpɔ alesi wòayɔ woe; eye alesi ame la yɔ nu gbagbeawoe la, nenema anye woƒe ŋkɔ. 20Eye ame la tsɔ ŋkɔ na aƒemelãwo katã kple dziƒoxe dzodzoewo kpakple gbemelãwo katã; ke amea ya mekpɔ kpeɖeŋutɔ, si asɔ nɛ o.
Nyɔnuwɔwɔ.
21Eye Yehowa Mawu na ame dɔ alɔ̃ yi me ʋĩ, eye wòɖe eƒe agbaƒutiwo dometɔ ɖeka, eye wotsɔ lã ɖo eteƒe. 22Tete Yehowa Mawu tsɔ agbaƒuti, si wòɖe le amea me la, wɔ nyɔnui, eye wòkplɔe va ame la gbɔe. 23Eye ame la gblɔ be: Azɔ ko! Esia enye ƒu tso nye ƒu me kple lã tso nye lã me; woayɔ ame sia bena nyɔnu, elabena ŋutsu mee woɖee tsoe. 24Eya ŋuti ŋutsu agblẽ fofoa kple dadaa ɖi ahaku ɖe srɔ̃a ŋuti, eye woanye ŋutilã ɖeka. 25Eye wo kpakple eve la wole ƒeƒle, ame la kple srɔ̃a, eye ŋu mekpea wo o.",https://www.bible.com/bible/2259/GEN.2.EWERV
MOSE I 3,"Nuvɔ̃ me dzedze.
1Ke da dze aye wu gbemelã, siwo katã Yehowa Mawu wɔ la, eye wògblɔ na nyɔnu la bena: Vavãe Mawu gblɔ bena, migaɖu abɔmetiawo katã ƒe tsetsea ɖeke o mahã? 2Nyɔnua ɖo ŋu na da la be: Míeɖua abɔmetiawo ƒe tsetse faa; 3ke Mawu gblɔ le ati, si le abɔa titina la ƒe tsetse ŋuti bena: Migaɖu eƒe ɖeke o, eye migaka asi eŋu hã o, be miagaku o! 4Eye da la gblɔ na nyɔnua bena: Miele kuku ge akpɔ o; 5ke boŋ Mawu nyae bena, gbesigbe ke miaɖu eƒe ɖe la, miaƒe ŋkuwo laʋu, eye mianɔ abe Mawu ene, anya nyui kple vɔ̃. 6Esi nyɔnu la kpɔ bena, ati la nyo na ɖuɖu, ebiã ŋu na ame, eye wòdzroa ame, eye wònana wodzea nunya la, egbe eƒe tsetsea ɖe heɖu, eye wòna srɔ̃a, si le egbɔ hã woɖu. 7Tete wo kpakple eve ƒe ŋkuwo ʋu, eye wodze sii bena, yewole amama, eye wòtɔ amagbawo hesa ɖe ali.
8Eye esi wose Yehowa Mawu ŋkɔ le anyinufaɣi le abɔa me la, amea kple srɔ̃a woɣla wo ɖokui ɖe Yehowa Mawu ɖe abɔmetia ɖe te. 9Tete Yehowa Mawu yɔ amea gblɔ nɛ bena: Afika nèle? 10Eɖo ŋu nɛ bena: Mese ŋkɔwò le abɔa me, eye meva; elabena mele amama, eye meɣla ɖokuinye. 11Egblɔ be: Ameka toe na wò be, amamae nèle? Alo ɖe nèɖu ati, si ŋuti meɖe se na wò be, megaɖu eƒe ɖeke o la ƒe ɖe mahã? 12Ame la ɖo ŋu bena: Nyɔnu, si nètsɔ nam la, eyae na atia ɖem meɖu. 13Eye Yehowa Mawu gblɔ na nyɔnua bena: Nukaŋuti nèwɔ alea? Nyɔnu la ɖo ŋu ne be: Da lae blem, eye meɖui.
Fiƒode kple ŋugbedodo gbãtɔ.
14Eye Yehowa Mawu gblɔ na da la bena: Esi nèwɔ alea la, eyata woaƒo fi ade wò le aƒemelãwo kple gbemelãwo katã dome: Wò ƒodo dzi nazɔ, eye ʋuʋudedie naɖu le wò agbe me ŋkekewo katã me! 15Made adikã mia kple nyɔnu la dome, wò dzidzime kple nyɔnu la ƒe dzidzime dome, eya la agbã ta na wò, eye wò la àɖu afɔkpodzi nɛ. 16Eye wògblɔ na nyɔnua bena: Mana nakpe fu geɖe le fufɔfɔ me, alé ku hafi àdzi vi, ke wò tame anɔ srɔ̃wò ŋu, eye eya anye gã ɖe dziwò. 17Eye wògblɔ na Adam bena: Esi nèse srɔ̃wo ƒe gbe, eye nèɖu ati, si ŋuti mede se na wò be, megaɖu eƒe ɖekeɖeke o la ƒe ɖe la, eyata woaƒo fi ade anyigba le tawò, àkpe fu hafi akpɔ nu àɖu tso me le wò agbe me ŋkekewo katã me. 18Ŋu kple aŋɔka amie na wò, eye naɖu anyigba dzi amagbewo! 19Fifia ate wò, hafi nakpɔ abolo aɖu, vaseɖe esime nagatrɔ azu anyi, elabena eya mee woɖe wò tsoe. Anyi nènye, eye anyi ke nagatrɔ azu!
20Eye ame la tsɔ ŋkɔ na srɔ̃a bena Xawa, elabena eya ava nye ame gbagbewo katã dada. 21Eye Yehowa Mawu tsɔ lãgbalẽwu do na Adam kple srɔ̃a. 22Eye Yehowa Mawu gblɔ be: Kpɔ ɖa, ame zu sigbe mía dometɔ ɖeka ene, eye wònya nyui kple vɔ. Ke be wòagaɖo asi ɖa agbe agbetia hã ƒe ɖe aɖu, eye wòanɔ agbe ɖoɖoɖo o la, 23Yehowa Mawu ɖe ame ɖa tso Eden-bɔ la me, bene woaŋlɔ anyigba, si me woɖee tsoe. 24Tete wònyã ame la, eye wòna Kerubiwo tsɔ yi, si trɔa eɖokui, eye wòklẽna abe dzo ƒe aɖe ene la, ɖanɔ Eden-bɔ la ƒe ɣedzeƒe gome, bena woadzɔ agbeti la mɔ nu.",https://www.bible.com/bible/2259/GEN.3.EWERV
MOSE I 4,"Adam viŋutsuwo.
1Eye Adam ɖo kple srɔ̃a Xawa, eye wòfɔ fu dzi Kain, eye wògblɔ bena: Yehowa ɖi nam be, medzi ŋutsu. 2Emegbe la edzi enɔvia Habel, eye Habel va zu lãnyila, ke Kain ya zu agbledela. 3Esia megbe la eteƒe medidi o, Kain tsɔ agblemenua ɖewo wɔ vɔsae na Yehowa. 4Habel hã tsɔ eƒe lãwo ƒe ŋgɔgbevi, siwo dami la ƒe ɖewo vɛ. Eye Habel kple eƒe nunana dze Yehowa ŋu; 5ke Kain kple eƒe nunana ya medze eŋu o. Eye Kain bi dzi ŋutɔ, eye wòɖo adã. 6Tete Yehowa gblɔ na Kain bena: Nukaŋuti nèle dzi bim, eye nukaŋuti nèle adã ɖom? 7Alo menye ale wòle oa? Ne èwɔ nyui la, wò ŋku me akɔ, ke ne mèwɔ nyui o la, ekema nuvɔ̃ de xa ɖe ʋɔtru nu, eye wòɖo tamea ɖe ɖe ŋuwò; ke wò la ɖu edzi!
Kain wu nɔvia.
8Esia megbe la Kain gadɔ nu kple nɔvia Habel. Ke eva ve me bena, esime wole gbe me la, Kain tso ɖe nɔvia Habel ŋuti, eye wòwui. 9Tete Yehowa gblɔ na Kain bena: Afika noviwò Habel le? Eye wòɖo ŋu nɛ be: Nyemenyae o! Alo nɔvinye dzikpɔla menyea? 10Eye wògblɔ nɛ bena: Nuka enye esi nèwɔ? Kpɔ ɖa, nɔviwò ƒe ʋu, si nèkɔ ɖe anyi la ƒe gbe le ɖiɖim tso anyigba dzi mese! 11Azã la woaƒo fi ade wò, adzo le anyigba, si ke eƒe nu xɔ nɔviwò ƒe ʋu le asiwò no la dzi. 12Ne eŋlɔ anyigba la, megale nu ʋẽ ge na wò o; tsatsala kple godzela nanye le anyigba dzi! 13Eye Kain gblɔ na Yehowa bena: Nye vodada la kpe wu nye tsɔtsɔ. 14Wòe nyãm egbe tso agbledenyigba la dzi; madzo le wò ŋkuta anye tsatsala kple godzela le anyigba dzi, eye ava me bena, amesiame, si akpɔm la, awum. 15Eye Yehowa gblɔ nɛ bena: Eyata amesiame, si awu Kain la, woabia hlɔ̃e zi gbɔ zi adre. Eye Yehowa de dzesi Kain, bena amesiame, si ado goe la, nagawui o. 16Eye Kain dzo le Yehowa ƒe ŋku me, eye wòva nɔ Nod-nyigba dzi le Eden ƒe ɣedzeƒe gome.
Kain ƒe dzidzimeviwo
17Eye Kain da kple srɔ̃a, eye wòfɔ fu dzi Henox. Eye wòtso du, tso via ƒe ŋkɔ na du la bena Henox. 18Eye wodzi Irad na Henox, eye Irad dzi Mehuyael, eye Mehuyael dzi Metusael, eye Metusael dzi Lamex. 19Ke Lamex ɖe srɔ̃ eve; ɖeka ŋkɔ enye Ada, eye evelia ŋkɔ enye Zila. 20Eye Ada dzi Yabal, amesi nye agbadɔ me nɔlawo kple lãnyilawo fofo. 21Enɔvia ŋkɔ nye Yubal, amesi nye saŋkuƒolawo kple dzekulawo fofo. 22Eye Zila hã dzi Tubalkain, amesi nye akɔbli- kple gaŋudowolawo fofo; eye Tubalkain nɔvinyɔnu ŋkɔ nye Naama. 23Eye Lamex gblɔ na srɔ̃wo bena: Ada kple Zila, miɖo to nye gbe; mi Lamex srɔ̃wo, mise ye nyawo! Vavã, mewu ŋutsu ɖe nye abi teƒe kple ɖekakpui ɖe nye dodro teƒe. 24Elabena wòbia hlɔ̃ Kain zi adre, ke Lamex la zi blaadre vɔ adre.
Set kple Enos.
25Eye Adam gadɔ kple srɔ̃a, eye wòdzi ŋutsuvi, eye wòna ŋkɔe bena Set; elabena egblɔ be: Mawu ɖo dzidzime bubu Habel, amesi Kain wu la teƒe nam. 26Eye wodzi ŋutsuvi na Set hã, eye wòna ŋkɔe bena Enos. Le ɣemaɣi me la wode asi Yehowa ŋkɔ yɔyɔ me.",https://www.bible.com/bible/2259/GEN.4.EWERV
MOSE I 5,"Fofo gãwo ƒe dzidzimegbalã tso Adam dzi vaseɖe Noa dzi.
1Esia nye Adam ƒe dzidzimeviwo ŋutinyagbalẽ. Esi Mawu wɔ Adam la, ewɔe ɖe eya ŋutɔ ƒe nɔnɔme. 2Ewɔ wo wonye ŋutsu kple nyɔnu, eye wòyra wo: eye wòna ŋkɔ wo bena „ame“ le gbesigbe wòwɔ wo. 3Eye esi Adam xɔ ƒe alafa ɖeka kple blaetɔ̃ la, edzi ŋutsuvia ɖe, si ɖii, eye wòyɔe bena Set. 4Esi Adam dzi Set megbe la, eganɔ agbe ƒe alafa enyi, eye wòdzi ŋutsuwo kple nyɔnuwo. 5Eye Adam ƒe agbe me ŋkekewo katã nye ƒe alafa asieke kple blaetɔ̃, eye woku. 6Eye esi Set xɔ ƒe alafa ɖeka kple atɔ̃ la, edzi Enos. 7Esi Set dzi Enos megbe la, eganɔ agbe ƒe alafa enyi kple adre, eye wòdzi ŋutsuwo kple nyɔnuwo. 8Eye Set ƒe agbe me ŋkekewo katã nye ƒe alafa asieke kple wuieve, eye wòku. 9Eye esi Enos xɔ ƒe blaasieke la, edzi Kenan. 10Esi Enos dzi Kenan megbe la, eganɔ agbe ƒe alafa enyi kple wuiatɔ̃, eye wòdzi ŋutsuwo kple nyɔnuwo. 11Eye Enos ƒe agbe me ŋkekewo katã nye ƒe alafa asieke kple atɔ̃, eye woku. 12Eye esi Kenan xɔ ƒe blaadre la, edzi Mahalalel. 13Esi Kenan dzi Mahalalel megbe la, eganɔ agbe ƒe alafa enyi kple blane, eye wòdzi ŋutsuwo kple nyɔnuwo. 14Eye Kenan ƒe agbe me ŋkekewo katã nye ƒe alafa asieke kple ewo, eye woku. 15Eye esi Mahalalel xɔ ƒe blaade vɔ atɔ̃ la, edzi Yered. 16Esi Mahalalel dzi Yered megbe la, eganɔ agbe ƒe alafa enyi kple blaetɔ̃, eye wòdzi ŋutsuwo kple nyɔnuwo. 17Eye Mahalalel ƒe agbe me ŋkekewo katã nye ƒe alafa enyi kple blaasieke vɔ atɔ̃, eye woku. 18Eye esi Yered xɔ ƒe alafa ɖeka kple blaade vɔ eve la, edzi Henox. 19Esi Yered dzi Henox megbe la, eganɔ agbe ƒe alafa enyi, eye wòdzi ŋutsuwo kple nyɔnuwo. 20Eye Yered ƒe agbe me ŋkekewo katã nye ƒe alafa asieke kple blaade vɔ eve, eye woku. 21Eye esi Henox xa ƒe blaade vo atɔ̃ la, edzi Metusala. 22Esi wòdzi Metusala megbe la, Henox zɔ kple Mawu ƒe alafa etɔ̃, eye wòdzi ŋutsuwo kple nyɔnuwo. 23Eye Henox ƒe agbe me ŋkekewo katã nye ƒe alafa etɔ̃ kple blaade vɔ atɔ̃. 24Esi Henox zɔ kple Mawu ta la, ebu vĩ, elabena Mawu kplɔe dzoe. 25Eye esi Metusala xɔ ƒe alafa ɖeka kple blanyi vɔ adre la, edzi Lamex. 26Esi Metusala dzi Lamex megbe la, eganɔ agbe ƒe alafa adre kple blanyi vɔ eve, eye wòdzi ŋutsuwo kple nyɔnuwo. 27Eye Metusala ƒe agbe me ŋkekewo katã nye ƒe alafa asieke kple blaade vɔ asieke, eye wòku. 28Eye esi Lamex xɔ ƒe alafa ɖeka kple blanyi vɔ eve la, edzi ŋutsuvia ɖe. 29Eye wòna ŋkɔe bena Noa, elabena egblɔ be: Ame sia ana gbɔdzɔe mí tso míaƒe dɔwɔwɔ kple fuɖeɖewo me le anyigba, si Yehowa ƒo fi de la dzi. 30Esi Lamex dzi Noa megbe la, eganɔ agbe ƒe alafa atɔ̃ kple blaasieke vɔ atɔ̃, eye wòdzi ŋutsuwo kple nyɔnuwo. 31Eye Lamex ƒe agbe me ŋkekewo katã nye ƒe alafa adre kple blaadre vɔ adre, eye wòku. 32Esi Noa xɔ ƒe alafa atɔ̃ la, edzi Sem, Xam kple Yafet.",https://www.bible.com/bible/2259/GEN.5.EWERV
MOSE I 6,"Amegbetɔwo ƒe nu tovo wɔwɔ.
1Ke esi amewo de asi agbɔsɔsɔ me le anyigba dzi, eye wodzi nyɔnuwo la, 2mawuviwo kpɔ bena, amegbetɔviwo ƒe nyɔnuwo dze tugbe ŋutɔ, eye woɖe wo dometɔ, siwo katã dze wo ŋu. 3Eye Yehowa gblɔ bena: Nye gbɔgbɔ maganɔ amewo me boo o, elabena ŋutilã wonye le woƒe vodada me, eye woƒe agbe me ŋkekewo nanye ƒe alafa ɖeka kple blave! 4Le ŋkeke mawo me la ame dzɔtsuwo le anyigba dzi; eye esi Mawu viŋutsuwo ɖe amegbetɔwo ƒe vinyɔnuwo, eye wodzi vi na wo megbe la hã wogale; woawo nye ame kako ŋkɔxɔla, siwo nɔ agbe le blema. 5Eye esi Yehowa kpɔ bena, amegbetɔwo ƒe vɔɖivɔ̃ɖi va sɔ gbɔ le anyigba dzi, eye woƒe tamesusuwo kple dzimedidiwo nye vɔ̃ ko ɖaa la, 6eve Yehowa bena, wòwɔ ame ɖe anyigba dzi, eye woɖu dzi nɛ. 7Eye Yehowa gblɔ bena: Matsrɔ̃ ame, siwo mewɔ la ɖa le anyigba blibo la katã dzi, tso amewo kple lãwo dzi vaseɖe nu tatawo kple dziƒoxe dzodzoewo dzi, elabena evem bena, mewɔ wo. 8Ke Yehowa ve Noa nu.
Noa.
9Esia enye Noa ƒe dzidzimeviwo ŋutinya Noa enye ame dzɔdzɔe kple ame maɖifɔ le eŋɔlimetɔwo dome, eye Noa zɔ kple Mawu. 10Eye Noa dzi ŋutsuvi etɔ̃: Sem, Xam kple Yafet. 11Eye xexeame gblẽ le Mawu ƒe ŋku me, eye nu vlo wɔwɔ xɔ anyigba la dzi. 12Eye Mawu kpɔ bena, xexeame gblẽ keŋ; elabena amegbetɔwo katã ƒe zɔzɔme gblẽ le anyigba dzi.
Gbeƒãɖeɖe tsiɖɔɖɔ Aɖakanututu.
13Tete Mawu gblɔ na Noa bena: Ŋutilãwo katã ƒe nuwuwu ɖo azɔ, elabena woƒe nu vlo wɔwɔ xɔ anyigba la dzi; kpɔ ɖa, matsrɔ̃ wo kple anyigba siaa. 14Tsɔ dzatiwo kpa aɖakaʋu na ɖokuiwò, eye natso eme keŋ, atsɔ aŋɔ atre eme kple ekɔgo. 15Eye ale nawɔe enye si; Aɖakaʋu la ƒe didime nanye abɔklugui alafa etɔ̃, eƒe kekeme nanye abɔklugui blaatɔ̃, eye eƒe kɔkɔme nanye abɔklugui blaetɔ̃. 16Eye naɖe fesre, siwo akɔ abɔklugui ɖeka la, ɖe aɖakaʋu la ƒe gliwo dzi aƒo xlãe godoo va kpe; eye naɖe ʋɔtru aɖakaʋu la ƒe axa dzi, eye nawɔ dzisasrã etɔ̃, etetɔ, titinatɔ kple elametɔ. 17Elabena nye la mana tsi naɖe anyigba la, bena ŋutilã, siwo katã le dziƒoa te, esiwo me agbegbɔgbɔ le la, natsrɔ̃, eye anyigba dzi nuwo katã naku. 18Ke mabia nu kpli wò bena, nayi ɖe aɖakaʋu la me, wò ŋutɔ, viwòŋutsuwo kple srɔ̃wò hekpe ɖe viwòŋutsuawo srɔ̃wo ŋu. 19Ɖe nu gbagbewo katã kple ŋutilãwo katã eveveve yi ɖe aɖakaʋu la me, ne woanɔ agbe kpli wò; woanye atsu kple asi 20Dziƒoxe dzodzoewo le woƒe ƒomeviwo nu, aƒemelãwo le woƒe ƒomeviwo nu kple nu, siwo katã tana le anyigba la dzi, le woƒe ƒomeviwo nu, wo dome eveveve woava gbɔwò, bena woanɔ agbe. 21Ke wò la tsɔ nuɖuɖu ƒomevi vovovo, siwo katã woɖuna la, dzra ɖo ɖe gbɔwò, bena woanye nuɖuɖu na mia kpli wo siaa. 22Eye Noa wɔe; alesi Mawu de se nɛ la, nenema pɛ wòwɔ.",https://www.bible.com/bible/2259/GEN.6.EWERV
MOSE I 7,"Noa yi aɖakaʋu la me.
1Tete Yehowa gblɔ na Noa be na: Yi ɖe aɖakaʋu la me, wò ŋutɔ kple aƒewò me katã, elabena mekpɔ bena, ame dzɔdzɔe nènye le dzidzime sia dome. 2Ɖe lã matsrimatsriwo katã atsu kple asi adreadre, kple lã tsitsriwo atsu kple asi eveveve. 3Nenema ke naɖe dziƒoxe dzodzoewo hã atsu kple asi adreadre, bena woƒe ƒome natsi agbe le anyigba dzi. 4Elabena esusɔ ŋkeke adre mana tsi nadza ɖe anyigba dzi ŋkeke blane kple zã hã blane, eye matsrɔ̃ nusianu, si mewɔ ɖe anyigba dzi. 5Eye Noa wɔe, abe alesi Mawu de se nɛ ene. 6Noa xɔ ƒe alafa ade, esime tsiɖɔɖɔ ɖe anyigba. 7Eye Noa kple viaŋutsuwo kple srɔ̃a hekpe ɖe viaŋutsuawo srɔ̃wo ŋuti, woyi ɖe aɖakaʋu la me, hafi tsi va ɖe anyigba. 8Lã matsrimatsriwo kple lã tsitsriwo kple xe dzodzoewo hekpe ɖe nusiwo katã tana le anyigba dzi la ŋuti 9woyi ɖe Noa gbɔ atsu kple asi eveveve le aɖakaʋu la me, abe alesi Mawu de se na Noa ene. 10Eye wòva me le ŋkeke adreagbe bena, tsi dza ɖe anyigba la dzi.
Tsiɖɔɖɔ dze gɔme.
11Esi Noa xɔ ƒe alafa ade, le ɣleti evelia ƒe ŋkeke wuiadrelia dzi tututu la, anyigbatu me tsiwo katã ŋɔ, eye dziƒo nu ʋu. 12Eye tsi dzi ɖe anyigba dzi ŋkeke blane kple zã blane sɔŋ. 13Le ŋkeke ma dzi tututu Noa kple viaŋutsuwo: Sem, Xam kple Yafet kple Noa srɔ̃ hekpe ɖe viaŋutsuawo srɔ̃ etɔ̃awo ŋuti, woyi ɖe aɖakaʋu la me; 14woawo kple gbemelãwo katã le woƒe ƒomeviwo nu kple aƒemelãwo katã le woƒe ƒomeviwo nu kple nu tata, siwo katã tana le anyigba dzi, le woƒe ƒomeviwo nu hekpe ɖe xewo kple nusiwo katã dzona la ŋuti le woƒe ƒomeviwo nu. 15Eye lãwo tsyo ƒomevi, siwo me agbegbɔgbɔ le la, woyi de Noa gbɔ eveveve le aɖakaʋu la me. 16Eye lã, siwo yi ɖe egbɔ la, wonye atsu kple asi; lã vovovowo yi ɖe egbɔ, abe alesi Mawu ɖe se nɛ ene. Eye Yehowa do ʋɔ ɖe enu. 17Eye tsia le anyigba la ɖem ŋkeke blane sɔŋ, eye tsia le agbɔ sɔm hekɔ aɖakaʋu la ɖe dzi, ale bena, aɖakaʋu la le tsia ŋgɔ. 18Eye tsia le ɖɔɖɔm ɖe dzi hesɔ gbɔ ɖe anyigba la dzi, eye aɖakaʋu la le tsatsam le tsia ŋgɔ. 19Eye tsia do agbogbo de anyigba dzi ŋutɔŋutɔ hede to kɔkɔ, siwo katã le dziƒoa te la. 20Eye tsia dɔ gbɔ to kɔkɔwo ta me abɔklugui wuiatɔ̃; ale wɔ, eye towo katã bu de tsia me. 21Eye nu gbagbe, siwo ʋãa wo ɖokui le anyigba dzi; xe dzodzoewo, aƒemelãwo, gbemelãwo kple nusiwo katã tana le anyigba dzi, hekpe ɖe amewo ŋu, wo katã wotsi tɔ la me. 22Nusianu, si agbegbɔgbɔ le eme, si gbɔna toa ŋɔti me, eye wonɔa agbe le anyigba ƒuƒui dzi la ku. 23Nusianu, si nɔ anyigba dzi, tso amewo dzi vaseɖe aƒemelãwo kple nu tatawo kpakple dziƒoxe dzodzoewo dzi, wotsrɔ̃ wo ɖa le anyigba dzi; negbe Noa kple nusiwo le egbɔ le aɖakaʋua me koe tsi agbe. 24Eye tsia le ɖɔɖɔm ɖe anyigba dzi ŋkeke alafa ɖeka kple blaatɔ̃ sɔŋ.",https://www.bible.com/bible/2259/GEN.7.EWERV
MOSE I 8,"Tsiɖɔɖɔ wu nu.
1Eye Mawu ɖo ŋku Noa kple gbemelã kple aƒemelã, siwo katã le egbɔ le aɖakaʋua me la dzi, eye Mawu na ya ƒo ɖe anyigba dzi, ale bena tsia de asi miemie me. 2Eye anyigbatu me tsiwo nu tso, eye dziƒo nu tu; ale wɔ tsi la ke. 3Eye tsia le miemiem le anyigba la dzi ʋeʋeʋe. Edze miemie gɔme le ŋkeke alafa ɖeka kple blaatɔ̃ megbe. 4Le ɣleti adrelia ƒe ŋkeke wuiadrelia dzi aɖakaʋu la va xa ɖe Ararat-towo dometɔ ɖeka ta me. 5Eye tsia le miemiem ʋeʋeʋe vaseɖe ɣleti ewolia dzi; le ɣleti ewolia ƒe ŋkeke gbãtɔ dzi towo ƒe tagbɔ dze. 6Le ŋkeke blane megbe la Noa ʋu aɖakaʋua ƒe fesre, si wòwɔ la. 7Eye wòʋu nu le akpaviãa ɖe nu ɖo ɖa, eye wòle dzodzom tso afi yi afi, vaseɖe esime tsia mie le anyigba dzi vo. 8Tete wòʋu nu le ahɔnea ɖe nu ɖo ɖa, ne yeakpɔ bena, tsia mie vo le anyigba blibo la katã dzi hã? 9Ke esi ahɔne la mekpɔ afisi wòadze ɖo o la, egatrɔ va egbɔ le aɖakaʋu la me, elabena tsi le anyigba blibo la katã dzi, eye wòdo asi ɖa lée de aɖakaʋu la me. 10Emegbe wòlala ŋkeke adre, eye wòʋu nu le ahɔnea nu le aɖakaʋu la me. 11Eye ahɔne la va egbɔ le fiẽ me, eye kpɔ ɖa, amitiɖɔmee le enu. Azɔ Noa dze sii bena, tsia mie le anyigba dzi. 12Eye wògalala ŋkeke adre bubu, eye wògaʋu nu le ahɔnea nu, ke megado va egbɔ o. 13Le ƒe alafa ade kple ɖeka me le ɣleti gbãtɔ ƒe ŋkeke gbãtɔ dzi tsia mie le anyigba dzi. Eye Noa fo aɖakaʋu la tame ɖa, eye wotsa ŋku, eye kpɔ ɖa, anyigba dzi ƒu. 14Le ɣleti evelia ƒe ŋkeke blave vɔ adrelia dzi anyigba dzi ƒu keŋkeŋ.
Noa me nu na Mawu.
15Eye Mawu ƒo nu kple Noa gblɔ bena: 16Do go le aɖakaʋu la me, wò ŋutɔ kple srɔ̃wo kple viwòŋutsuwo hekpe ɖe viwòŋutsuawo srɔ̃wo ŋuti! 17Lã vovovo, siwo katã le gbɔwò; xe dzodzoewo kple aƒemelãwo kpakple nu tata, siwo katã tana le anyigba dzi la, nado go kpakpli wò, ne woaʋã wo ɖokui le anyigba dzi, eye wòadzi asɔ gbɔ le anyigba dzi! 18Tete Noa do go, eye viaŋutsuwo kple srɔ̃a kpakple viaŋutsuawo srɔ̃wo hã kpe ɖe eŋuti. 19Lãwo katã, nu tata wo katã kple xe dzodzoewo katã kpakple nusi wo katã zɔna le anyigba dzi la, wodo go le aɖakaʋu la me hamehame.
20Tete Noa ɖi vɔsamlekpui, eye wòtsɔ lã matsrimatsriwo kple xe matsrimatsriwo ƒe ɖewo na Yehowa hemè wo le vɔsamlekpui la dzi.
Yehowa ƒe ŋugbedodo.
21Ke esi Yehowa se ʋeʋẽ lililia la, egblɔ le eƒe dzi me bena: Nyemagaƒo fi ade anyigba akpɔ le amegbetɔ ta o. Elabena ame ƒe dzimesusu enye vɔ̃ tso ɖevime ke, eye nyemagatsrɔ̃ nu gbagbewo katã, abe alesi mewo ene o. 22Tso esia dzi, ŋkeke alesi anyigba li la, nuƒaƒã kple nuŋeŋe, viwo kple fifia, dzomeŋɔli kple pepi, ŋkeke kple zã nu matsi o.",https://www.bible.com/bible/2259/GEN.8.EWERV
